[I 2020-10-01 03:31:25,152] Trial 310 finished with value: 0.041278951705877254 and parameters: {'changepoint_prior_scale': 0.0011300978526041438, 'seasonality_prior_scale': 0.14784976246890777, 'holidays_prior_scale': 0.09296686263146697, 'seasonality_mode': 'additive', 'changepoint_range': 0.5526142535665007}. Best is trial 96 with value: 0.038883738900888705.
Initial log joint probability = -28.8311
    Iter      log prob        ||dx||      ||grad||       alpha      alpha0  # evals  Notes 
      99       18912.4    1.4945e-05       3028.41           1           1      122   
    Iter      log prob        ||dx||      ||grad||       alpha      alpha0  # evals  Notes 
     144       18912.7   8.93154e-09       2695.28     0.07846           1      180   
Optimization terminated normally: 
  Convergence detected: absolute parameter change was below tolerance
INFO:fbprophet:Making 5 forecasts with cutoffs between 2013-10-07 00:00:00 and 2015-10-18 00:00:00
INFO:fbprophet:Applying in parallel with <concurrent.futures.process.ProcessPoolExecutor object at 0x7fc84dbfdf50>
Initial log joint probability = -8.95172
    Iter      log prob        ||dx||      ||grad||       alpha      alpha0  # evals  Notes 
Initial log joint probability = -12.7302
    Iter      log prob        ||dx||      ||grad||       alpha      alpha0  # evals  Notes 
Initial log joint probability = -15.1549
    Iter      log prob        ||dx||      ||grad||       alpha      alpha0  # evals  Notes 
Initial log joint probability = -18.717
    Iter      log prob        ||dx||      ||grad||       alpha      alpha0  # evals  Notes 
Initial log joint probability = -23.5879
    Iter      log prob        ||dx||      ||grad||       alpha      alpha0  # evals  Notes 
      42       4677.05    0.00038135       2875.13   1.204e-07       0.001       98  LS failed, Hessian reset 
      99       4679.04     2.305e-06       2966.82      0.3311           1      161   
    Iter      log prob        ||dx||      ||grad||       alpha      alpha0  # evals  Notes 
      99       7029.84   3.74746e-08       3037.29      0.5545      0.5545      120   
    Iter      log prob        ||dx||      ||grad||       alpha      alpha0  # evals  Notes 
     103       4679.04   1.13416e-06       2990.59   3.816e-10       0.001      207  LS failed, Hessian reset 
     124       4679.05   5.12875e-09       2970.97      0.2026           1      237   
Optimization terminated normally: 
  Convergence detected: absolute parameter change was below tolerance
     111       7029.84   2.33115e-07       2979.59   7.853e-11       0.001      173  LS failed, Hessian reset 
      51       11813.3   8.43285e-09       3075.47      0.2315      0.2315       74   
Optimization terminated normally: 
  Convergence detected: absolute parameter change was below tolerance
     120       7029.84   8.50674e-09        2672.2       0.278      0.6451      184   
Optimization terminated normally: 
  Convergence detected: absolute parameter change was below tolerance
      99       9582.51   4.04216e-06       2738.05      0.3336      0.3336      124   
    Iter      log prob        ||dx||      ||grad||       alpha      alpha0  # evals  Notes 
     124       9582.52   4.35663e-09       2921.25      0.2114      0.2114      155   
Optimization terminated normally: 
  Convergence detected: absolute parameter change was below tolerance
      97       14233.1   8.72121e-09          3055      0.4279      0.4279      130   
Optimization terminated normally: 
  Convergence detected: absolute parameter change was below tolerance
[I 2020-10-01 03:31:39,394] Trial 311 finished with value: 0.04121128774060872 and parameters: {'changepoint_prior_scale': 0.001684240744934553, 'seasonality_prior_scale': 0.17127031303676138, 'holidays_prior_scale': 0.05672331139946757, 'seasonality_mode': 'additive', 'changepoint_range': 0.5243089488557757}. Best is trial 96 with value: 0.038883738900888705.
Initial log joint probability = -28.8311
    Iter      log prob        ||dx||      ||grad||       alpha      alpha0  # evals  Notes 
      99       18919.7   0.000847201       146.547           1           1      114   
    Iter      log prob        ||dx||      ||grad||       alpha      alpha0  # evals  Notes 
     165       18920.2   4.18443e-05       117.656   3.454e-07       0.001      237  LS failed, Hessian reset 
     199       18920.3   0.000232781       97.3009           1           1      277   
    Iter      log prob        ||dx||      ||grad||       alpha      alpha0  # evals  Notes 
     271       18920.5   0.000248552       87.2636   3.214e-06       0.001      398  LS failed, Hessian reset 
     299       18920.6   4.23187e-05       43.0581      0.3009           1      430   
    Iter      log prob        ||dx||      ||grad||       alpha      alpha0  # evals  Notes 
     399       18920.7   0.000200329       45.9986           1           1      558   
    Iter      log prob        ||dx||      ||grad||       alpha      alpha0  # evals  Notes 
     499       18920.8    6.0806e-05        42.346           1           1      678   
    Iter      log prob        ||dx||      ||grad||       alpha      alpha0  # evals  Notes 
     504       18920.8   7.02772e-05       86.6381   1.392e-06       0.001      724  LS failed, Hessian reset 
     519       18920.8    1.5531e-06       33.7454      0.5869           1      747   
Optimization terminated normally: 
  Convergence detected: relative gradient magnitude is below tolerance
INFO:fbprophet:Making 5 forecasts with cutoffs between 2013-10-07 00:00:00 and 2015-10-18 00:00:00
INFO:fbprophet:Applying in parallel with <concurrent.futures.process.ProcessPoolExecutor object at 0x7fc84dc1e550>
Initial log joint probability = -8.95172
    Iter      log prob        ||dx||      ||grad||       alpha      alpha0  # evals  Notes 
Initial log joint probability = -12.7302
    Iter      log prob        ||dx||      ||grad||       alpha      alpha0  # evals  Notes 
Initial log joint probability = -15.1549
    Iter      log prob        ||dx||      ||grad||       alpha      alpha0  # evals  Notes 
      99       4679.51    3.5108e-06       51.4533      0.7393      0.7393      118   
    Iter      log prob        ||dx||      ||grad||       alpha      alpha0  # evals  Notes 
     127       4679.51   1.97855e-07       51.1744      0.4882      0.4882      153   
Optimization terminated normally: 
  Convergence detected: relative gradient magnitude is below tolerance
Initial log joint probability = -18.717
    Iter      log prob        ||dx||      ||grad||       alpha      alpha0  # evals  Notes 
Initial log joint probability = -23.5879
    Iter      log prob        ||dx||      ||grad||       alpha      alpha0  # evals  Notes 
      99       7038.82    0.00122189       66.1984           1           1      119   
    Iter      log prob        ||dx||      ||grad||       alpha      alpha0  # evals  Notes 
      99       9586.21   0.000201558       65.0357           1           1      123   
    Iter      log prob        ||dx||      ||grad||       alpha      alpha0  # evals  Notes 
     156       7039.11   6.99891e-05       76.7462    4.61e-07       0.001      227  LS failed, Hessian reset 
     199       7039.16   8.68157e-06       33.6773   2.902e-07       0.001      330  LS failed, Hessian reset 
    Iter      log prob        ||dx||      ||grad||       alpha      alpha0  # evals  Notes 
      99       11818.3   0.000148519       82.0905     0.08962           1      122   
    Iter      log prob        ||dx||      ||grad||       alpha      alpha0  # evals  Notes 
     210       7039.16   8.47808e-08        33.323     0.07174           1      347   
Optimization terminated normally: 
  Convergence detected: relative gradient magnitude is below tolerance
     179       9586.81   5.88508e-05       94.8816    3.69e-07       0.001      254  LS failed, Hessian reset 
      99         14240   0.000382612       106.418       0.743       0.743      119   
    Iter      log prob        ||dx||      ||grad||       alpha      alpha0  # evals  Notes 
     199       9586.84   1.51995e-05       36.1005      0.1916           1      280   
    Iter      log prob        ||dx||      ||grad||       alpha      alpha0  # evals  Notes 
     214       9586.84   9.76809e-07       36.1739      0.3077       0.885      298   
Optimization terminated normally: 
  Convergence detected: relative gradient magnitude is below tolerance
     199       11819.2   0.000338542       40.3051       0.462           1      238   
    Iter      log prob        ||dx||      ||grad||       alpha      alpha0  # evals  Notes 
     199       14240.8   0.000306012       101.768           1           1      234   
    Iter      log prob        ||dx||      ||grad||       alpha      alpha0  # evals  Notes 
     228       11819.2   6.82106e-05       52.8125   1.857e-06       0.001      318  LS failed, Hessian reset 
     256       11819.2   2.39709e-07       40.8447      0.1149      0.1149      354   
Optimization terminated normally: 
  Convergence detected: relative gradient magnitude is below tolerance
     227       14240.9   3.31734e-05       82.1548   2.897e-07       0.001      311  LS failed, Hessian reset 
     276       14240.9   7.42805e-07       34.5453     0.08544           1      386   
Optimization terminated normally: 
  Convergence detected: relative change in objective function was below tolerance
[I 2020-10-01 03:31:57,149] Trial 312 finished with value: 0.04692145597362986 and parameters: {'changepoint_prior_scale': 0.09054002114147508, 'seasonality_prior_scale': 0.2457833874998142, 'holidays_prior_scale': 0.6609010141610984, 'seasonality_mode': 'additive', 'changepoint_range': 0.5709515508034071}. Best is trial 96 with value: 0.038883738900888705.
Initial log joint probability = -28.8311
    Iter      log prob        ||dx||      ||grad||       alpha      alpha0  # evals  Notes 
      99       18912.9   2.74951e-07       3088.33      0.8559      0.8559      131   
    Iter      log prob        ||dx||      ||grad||       alpha      alpha0  # evals  Notes 
     134       18912.9   3.15289e-08       3440.16      0.2511           1      171   
Optimization terminated normally: 
  Convergence detected: relative gradient magnitude is below tolerance
INFO:fbprophet:Making 5 forecasts with cutoffs between 2013-10-07 00:00:00 and 2015-10-18 00:00:00
INFO:fbprophet:Applying in parallel with <concurrent.futures.process.ProcessPoolExecutor object at 0x7fc84dc252d0>
Initial log joint probability = -8.95172
    Iter      log prob        ||dx||      ||grad||       alpha      alpha0  # evals  Notes 
Initial log joint probability = -12.7302
    Iter      log prob        ||dx||      ||grad||       alpha      alpha0  # evals  Notes 
Initial log joint probability = -15.1549
    Iter      log prob        ||dx||      ||grad||       alpha      alpha0  # evals  Notes 
Initial log joint probability = -18.717
    Iter      log prob        ||dx||      ||grad||       alpha      alpha0  # evals  Notes 
      59       4679.19   8.17957e-09       3373.11      0.5048      0.5048       80   
Optimization terminated normally: 
  Convergence detected: absolute parameter change was below tolerance
Initial log joint probability = -23.5879
    Iter      log prob        ||dx||      ||grad||       alpha      alpha0  # evals  Notes 
      99       7029.12   2.55437e-07       3281.23       1.268      0.2866      128   
    Iter      log prob        ||dx||      ||grad||       alpha      alpha0  # evals  Notes 
      57       9582.55   7.89383e-09        3110.5      0.2509      0.2509       80   
Optimization terminated normally: 
  Convergence detected: absolute parameter change was below tolerance
     109       7029.12   9.09621e-09          2989      0.3915      0.3915      139   
Optimization terminated normally: 
  Convergence detected: absolute parameter change was below tolerance
      59       11813.2   7.33906e-09       3644.98       0.703       0.703       88   
Optimization terminated normally: 
  Convergence detected: absolute parameter change was below tolerance
      99       14233.4   1.12861e-05       3746.15           1           1      123   
    Iter      log prob        ||dx||      ||grad||       alpha      alpha0  # evals  Notes 
     139       14233.5   2.59386e-09       3681.66      0.1433      0.1433      172   
Optimization terminated normally: 
  Convergence detected: absolute parameter change was below tolerance
[I 2020-10-01 03:32:11,644] Trial 313 finished with value: 0.0410266513625255 and parameters: {'changepoint_prior_scale': 0.0014073250990114968, 'seasonality_prior_scale': 0.33414826864397307, 'holidays_prior_scale': 3.1492166491560116, 'seasonality_mode': 'additive', 'changepoint_range': 0.5391505684254764}. Best is trial 96 with value: 0.038883738900888705.
Initial log joint probability = -28.8311
    Iter      log prob        ||dx||      ||grad||       alpha      alpha0  # evals  Notes 
      61       18914.3   1.27244e-07       265.184      0.4745      0.4745       96   
Optimization terminated normally: 
  Convergence detected: relative gradient magnitude is below tolerance
INFO:fbprophet:Making 5 forecasts with cutoffs between 2013-10-07 00:00:00 and 2015-10-18 00:00:00
INFO:fbprophet:Applying in parallel with <concurrent.futures.process.ProcessPoolExecutor object at 0x7fc84dc2f650>
Initial log joint probability = -8.95172
    Iter      log prob        ||dx||      ||grad||       alpha      alpha0  # evals  Notes 
Initial log joint probability = -12.7302
    Iter      log prob        ||dx||      ||grad||       alpha      alpha0  # evals  Notes 
Initial log joint probability = -15.1549
    Iter      log prob        ||dx||      ||grad||       alpha      alpha0  # evals  Notes 
Initial log joint probability = -18.717
    Iter      log prob        ||dx||      ||grad||       alpha      alpha0  # evals  Notes 
      56       4679.43   9.40817e-08       486.981           1           1       83   
Optimization terminated normally: 
  Convergence detected: relative gradient magnitude is below tolerance
Initial log joint probability = -23.5879
    Iter      log prob        ||dx||      ||grad||       alpha      alpha0  # evals  Notes 
      39       9582.71   2.26487e-05       362.751   5.526e-08       0.001       90  LS failed, Hessian reset 
      86       7032.38   3.35395e-06       263.637   9.086e-09       0.001      155  LS failed, Hessian reset 
      99       7032.38   2.71871e-07       333.477           1           1      173   
    Iter      log prob        ||dx||      ||grad||       alpha      alpha0  # evals  Notes 
     105       7032.38   5.44975e-08       334.066      0.4759           1      181   
Optimization terminated normally: 
  Convergence detected: relative gradient magnitude is below tolerance
      50       9582.71   3.03537e-07        266.83    1.09e-09       0.001      151  LS failed, Hessian reset 
      52       9582.71    1.1148e-07       240.326      0.2847           1      154   
Optimization terminated normally: 
  Convergence detected: relative gradient magnitude is below tolerance
      78       11813.2   1.01506e-07       382.197      0.3636           1      107   
Optimization terminated normally: 
  Convergence detected: relative gradient magnitude is below tolerance
      62       14234.6   1.90592e-05        409.13    5.35e-08       0.001      117  LS failed, Hessian reset 
      97       14234.7   3.50475e-08       385.484      0.2482      0.6721      159   
Optimization terminated normally: 
  Convergence detected: relative gradient magnitude is below tolerance
[I 2020-10-01 03:32:27,499] Trial 314 finished with value: 0.04184767268325261 and parameters: {'changepoint_prior_scale': 0.010252718025201184, 'seasonality_prior_scale': 0.11451434320914164, 'holidays_prior_scale': 0.1280028945440936, 'seasonality_mode': 'additive', 'changepoint_range': 0.530041248009263}. Best is trial 96 with value: 0.038883738900888705.
Initial log joint probability = -28.8311
    Iter      log prob        ||dx||      ||grad||       alpha      alpha0  # evals  Notes 
      99         18912   8.26048e-05       4197.69           1           1      128   
    Iter      log prob        ||dx||      ||grad||       alpha      alpha0  # evals  Notes 
     131       18912.1    5.4522e-06       4915.37   1.125e-09       0.001      209  LS failed, Hessian reset 
     157       18912.1   7.24291e-09       5020.93     0.05719           1      246   
Optimization terminated normally: 
  Convergence detected: absolute parameter change was below tolerance
INFO:fbprophet:Making 5 forecasts with cutoffs between 2013-10-07 00:00:00 and 2015-10-18 00:00:00
INFO:fbprophet:Applying in parallel with <concurrent.futures.process.ProcessPoolExecutor object at 0x7fc84dbf9410>
Initial log joint probability = -8.95172
    Iter      log prob        ||dx||      ||grad||       alpha      alpha0  # evals  Notes 
Initial log joint probability = -12.7302
    Iter      log prob        ||dx||      ||grad||       alpha      alpha0  # evals  Notes 
Initial log joint probability = -15.1549
    Iter      log prob        ||dx||      ||grad||       alpha      alpha0  # evals  Notes 
Initial log joint probability = -18.717
    Iter      log prob        ||dx||      ||grad||       alpha      alpha0  # evals  Notes 
Initial log joint probability = -23.5879
    Iter      log prob        ||dx||      ||grad||       alpha      alpha0  # evals  Notes 
      55       4673.98   0.000561772       4487.74   1.081e-07       0.001      126  LS failed, Hessian reset 
      99       4676.96   5.98944e-06       4608.39           1           1      180   
    Iter      log prob        ||dx||      ||grad||       alpha      alpha0  # evals  Notes 
      99       7027.73   1.19636e-06       5159.91           1           1      121   
    Iter      log prob        ||dx||      ||grad||       alpha      alpha0  # evals  Notes 
     108       7027.97    2.6133e-05        5032.7   5.729e-09       0.001      174  LS failed, Hessian reset 
     164       4678.09   5.55429e-06       4945.24   1.122e-09       0.001      311  LS failed, Hessian reset 
      50         11813   4.93415e-09       5037.62      0.1173      0.4358       76   
Optimization terminated normally: 
  Convergence detected: absolute parameter change was below tolerance
      76        9582.2   3.67878e-09       4354.95      0.3354      0.3354      111   
Optimization terminated normally: 
  Convergence detected: absolute parameter change was below tolerance
     194       4678.12   9.77602e-09       4963.71      0.5257      0.5257      350   
Optimization terminated normally: 
  Convergence detected: absolute parameter change was below tolerance
     155       7028.06   7.24494e-09       4587.72      0.5173      0.5173      231   
Optimization terminated normally: 
  Convergence detected: absolute parameter change was below tolerance
      99         14233   2.28661e-07       4853.81      0.1964      0.7898      128   
    Iter      log prob        ||dx||      ||grad||       alpha      alpha0  # evals  Notes 
     119       14233.1   1.15109e-05       5011.45   2.381e-09       0.001      189  LS failed, Hessian reset 
     157       14233.2    7.0255e-09       4976.84      0.6288      0.6288      235   
Optimization terminated normally: 
  Convergence detected: absolute parameter change was below tolerance
