[I 2020-10-01 02:31:00,213] Trial 72 finished with value: 0.041989832772078586 and parameters: {'changepoint_prior_scale': 0.0015224072690401766, 'seasonality_prior_scale': 0.13693244165600166, 'holidays_prior_scale': 0.115422652343608, 'seasonality_mode': 'additive', 'changepoint_range': 0.5960293357909539}. Best is trial 67 with value: 0.04069570224533105.
Initial log joint probability = -28.8311
    Iter      log prob        ||dx||      ||grad||       alpha      alpha0  # evals  Notes 
      99       18912.8   1.32065e-05        4594.8           1           1      128   
    Iter      log prob        ||dx||      ||grad||       alpha      alpha0  # evals  Notes 
     127       18912.8   9.44867e-09        4292.8      0.3595      0.3595      165   
Optimization terminated normally: 
  Convergence detected: absolute parameter change was below tolerance
INFO:fbprophet:Making 5 forecasts with cutoffs between 2013-10-07 00:00:00 and 2015-10-18 00:00:00
INFO:fbprophet:Applying in parallel with <concurrent.futures.process.ProcessPoolExecutor object at 0x7fc88e66cd10>
Initial log joint probability = -8.95172
    Iter      log prob        ||dx||      ||grad||       alpha      alpha0  # evals  Notes 
Initial log joint probability = -12.7302
    Iter      log prob        ||dx||      ||grad||       alpha      alpha0  # evals  Notes 
Initial log joint probability = -15.1549
    Iter      log prob        ||dx||      ||grad||       alpha      alpha0  # evals  Notes 
Initial log joint probability = -18.717
    Iter      log prob        ||dx||      ||grad||       alpha      alpha0  # evals  Notes 
      57       4679.03   4.46815e-09       4390.07      0.2303      0.2303       80   
Optimization terminated normally: 
  Convergence detected: absolute parameter change was below tolerance
Initial log joint probability = -23.5879
    Iter      log prob        ||dx||      ||grad||       alpha      alpha0  # evals  Notes 
      52       9582.15   3.61383e-09       4248.79      0.0973      0.0973       70   
Optimization terminated normally: 
  Convergence detected: absolute parameter change was below tolerance
      99       7027.44   1.69788e-06       3988.95           1           1      132   
    Iter      log prob        ||dx||      ||grad||       alpha      alpha0  # evals  Notes 
     125       7027.48   2.94769e-06       4456.77   7.009e-10       0.001      206  LS failed, Hessian reset 
      55         11813   8.74878e-09       4438.38      0.5499      0.5499       82   
Optimization terminated normally: 
  Convergence detected: absolute parameter change was below tolerance
     161        7027.5   5.60964e-09       3911.32      0.3952      0.3952      247   
Optimization terminated normally: 
  Convergence detected: absolute parameter change was below tolerance
      99       14233.1   1.58105e-07       4062.69           1           1      130   
    Iter      log prob        ||dx||      ||grad||       alpha      alpha0  # evals  Notes 
     105       14233.1   2.40823e-09       4416.67     0.08386     0.08386      138   
Optimization terminated normally: 
  Convergence detected: absolute parameter change was below tolerance
[I 2020-10-01 02:31:14,615] Trial 73 finished with value: 0.041120950893231624 and parameters: {'changepoint_prior_scale': 0.0011510331792432633, 'seasonality_prior_scale': 1.0161523065609874, 'holidays_prior_scale': 0.2555684733907369, 'seasonality_mode': 'additive', 'changepoint_range': 0.6291096967433258}. Best is trial 67 with value: 0.04069570224533105.
Initial log joint probability = -28.8311
    Iter      log prob        ||dx||      ||grad||       alpha      alpha0  # evals  Notes 
      99       18912.8   1.53456e-08       2610.62      0.5096      0.5096      128   
    Iter      log prob        ||dx||      ||grad||       alpha      alpha0  # evals  Notes 
     101       18912.8    1.3309e-08       2338.04      0.3348      0.3348      131   
Optimization terminated normally: 
  Convergence detected: relative gradient magnitude is below tolerance
INFO:fbprophet:Making 5 forecasts with cutoffs between 2013-10-07 00:00:00 and 2015-10-18 00:00:00
INFO:fbprophet:Applying in parallel with <concurrent.futures.process.ProcessPoolExecutor object at 0x7fc88e69a5d0>
Initial log joint probability = -8.95172
    Iter      log prob        ||dx||      ||grad||       alpha      alpha0  # evals  Notes 
Initial log joint probability = -12.7302
    Iter      log prob        ||dx||      ||grad||       alpha      alpha0  # evals  Notes 
Initial log joint probability = -15.1549
    Iter      log prob        ||dx||      ||grad||       alpha      alpha0  # evals  Notes 
Initial log joint probability = -18.717
    Iter      log prob        ||dx||      ||grad||       alpha      alpha0  # evals  Notes 
Initial log joint probability = -23.5879
      69       4679.04   5.59872e-09       2734.08      0.3066      0.3066       92   
Optimization terminated normally: 
  Convergence detected: absolute parameter change was below tolerance
    Iter      log prob        ||dx||      ||grad||       alpha      alpha0  # evals  Notes 
      99        7029.8   4.24424e-05       2994.61           1           1      120   
    Iter      log prob        ||dx||      ||grad||       alpha      alpha0  # evals  Notes 
      56       9582.28   4.64663e-09        2905.1      0.2102      0.2102       84   
Optimization terminated normally: 
  Convergence detected: absolute parameter change was below tolerance
     199       7031.44   3.77687e-06       2835.92     0.05051           1      249   
    Iter      log prob        ||dx||      ||grad||       alpha      alpha0  # evals  Notes 
      63         11813   1.82236e-06       2531.79   7.025e-10       0.001      130  LS failed, Hessian reset 
     243       7031.58   2.40673e-09        2797.8      0.1511      0.1511      301   
Optimization terminated normally: 
  Convergence detected: absolute parameter change was below tolerance
      83         11813   8.99954e-09       2621.64      0.5047      0.5047      154   
Optimization terminated normally: 
  Convergence detected: absolute parameter change was below tolerance
      83       14233.1   3.50605e-05       2684.68   1.274e-08       0.001      142  LS failed, Hessian reset 
      99       14233.2   1.06242e-06       2326.47      0.2656           1      162   
    Iter      log prob        ||dx||      ||grad||       alpha      alpha0  # evals  Notes 
     118       14233.2   2.36021e-08       2151.41       0.747       0.747      189   
Optimization terminated normally: 
  Convergence detected: relative gradient magnitude is below tolerance
[I 2020-10-01 02:31:30,368] Trial 74 finished with value: 0.041646396021394215 and parameters: {'changepoint_prior_scale': 0.001843474253930264, 'seasonality_prior_scale': 0.05709039175704945, 'holidays_prior_scale': 3.516034450023517, 'seasonality_mode': 'additive', 'changepoint_range': 0.5663787286204016}. Best is trial 67 with value: 0.04069570224533105.
Initial log joint probability = -28.8311
    Iter      log prob        ||dx||      ||grad||       alpha      alpha0  # evals  Notes 
      48       18915.6   7.50671e-05        238.68   3.874e-07       0.001      116  LS failed, Hessian reset 
      72       18915.6   2.79153e-05       122.533   1.932e-07       0.001      183  LS failed, Hessian reset 
      85       18915.6   3.78595e-07       128.126      0.1809           1      206   
Optimization terminated normally: 
  Convergence detected: relative gradient magnitude is below tolerance
INFO:fbprophet:Making 5 forecasts with cutoffs between 2013-10-07 00:00:00 and 2015-10-18 00:00:00
INFO:fbprophet:Applying in parallel with <concurrent.futures.process.ProcessPoolExecutor object at 0x7fc88e65e050>
Initial log joint probability = -8.95172
    Iter      log prob        ||dx||      ||grad||       alpha      alpha0  # evals  Notes 
Initial log joint probability = -12.7302
    Iter      log prob        ||dx||      ||grad||       alpha      alpha0  # evals  Notes 
Initial log joint probability = -15.1549
    Iter      log prob        ||dx||      ||grad||       alpha      alpha0  # evals  Notes 
Initial log joint probability = -18.717
    Iter      log prob        ||dx||      ||grad||       alpha      alpha0  # evals  Notes 
Initial log joint probability = -23.5879
    Iter      log prob        ||dx||      ||grad||       alpha      alpha0  # evals  Notes 
      71       4679.42   1.00834e-05        207.93   3.911e-08       0.001      138  LS failed, Hessian reset 
      90       4679.42   1.28101e-07       226.915           1           1      162   
Optimization terminated normally: 
  Convergence detected: relative gradient magnitude is below tolerance
      99       7035.65   1.72978e-05       134.686      0.7077      0.7077      133   
    Iter      log prob        ||dx||      ||grad||       alpha      alpha0  # evals  Notes 
      99       9583.86   0.000155047       158.627      0.6744      0.6744      129   
    Iter      log prob        ||dx||      ||grad||       alpha      alpha0  # evals  Notes 
     149       7035.67    3.7363e-08        138.46      0.1205      0.1205      225   
Optimization terminated normally: 
  Convergence detected: relative gradient magnitude is below tolerance
     109       9583.94   0.000115528       221.514   8.522e-07       0.001      182  LS failed, Hessian reset 
      99         11814   1.04033e-05       131.997           1           1      139   
    Iter      log prob        ||dx||      ||grad||       alpha      alpha0  # evals  Notes 
      67       14236.1   5.70679e-05       178.581   4.383e-07       0.001      136  LS failed, Hessian reset 
     107         11814   5.17099e-06       145.813   3.498e-08       0.001      189  LS failed, Hessian reset 
     120         11814   2.22136e-07        135.85      0.5199      0.5199      206   
Optimization terminated normally: 
  Convergence detected: relative gradient magnitude is below tolerance
      83       14236.1    4.7453e-07       125.166       1.251      0.3128      159   
Optimization terminated normally: 
  Convergence detected: relative gradient magnitude is below tolerance
     165       9583.96   4.26742e-05        209.44   2.123e-07       0.001      294  LS failed, Hessian reset 
     194       9583.97   1.26418e-07         154.5      0.2717           1      331   
Optimization terminated normally: 
  Convergence detected: relative gradient magnitude is below tolerance
[I 2020-10-01 02:31:46,978] Trial 75 finished with value: 0.041536225293602624 and parameters: {'changepoint_prior_scale': 0.021809067775319844, 'seasonality_prior_scale': 0.16030261543464386, 'holidays_prior_scale': 0.1684439060148685, 'seasonality_mode': 'additive', 'changepoint_range': 0.5330634992524285}. Best is trial 67 with value: 0.04069570224533105.
Initial log joint probability = -28.8311
    Iter      log prob        ||dx||      ||grad||       alpha      alpha0  # evals  Notes 
      99       18912.5   7.90473e-05       4974.77           1           1      116   
    Iter      log prob        ||dx||      ||grad||       alpha      alpha0  # evals  Notes 
     138       18912.6   1.01826e-08       5054.02      0.3569      0.8118      162   
Optimization terminated normally: 
  Convergence detected: relative gradient magnitude is below tolerance
INFO:fbprophet:Making 5 forecasts with cutoffs between 2013-10-07 00:00:00 and 2015-10-18 00:00:00
INFO:fbprophet:Applying in parallel with <concurrent.futures.process.ProcessPoolExecutor object at 0x7fc88e6b7d90>
Initial log joint probability = -8.95172
    Iter      log prob        ||dx||      ||grad||       alpha      alpha0  # evals  Notes 
Initial log joint probability = -12.7302
    Iter      log prob        ||dx||      ||grad||       alpha      alpha0  # evals  Notes 
Initial log joint probability = -15.1549
    Iter      log prob        ||dx||      ||grad||       alpha      alpha0  # evals  Notes 
Initial log joint probability = -18.717
    Iter      log prob        ||dx||      ||grad||       alpha      alpha0  # evals  Notes 
      51       4678.93   3.34011e-09       4969.62     0.09962     0.09962       74   
Optimization terminated normally: 
  Convergence detected: absolute parameter change was below tolerance
Initial log joint probability = -23.5879
    Iter      log prob        ||dx||      ||grad||       alpha      alpha0  # evals  Notes 
      93       7027.87   8.75346e-09       4624.23      0.2727      0.2727      123   
Optimization terminated normally: 
  Convergence detected: absolute parameter change was below tolerance
      62       9582.13   5.18755e-09       4755.47      0.5989      0.5989       86   
Optimization terminated normally: 
  Convergence detected: absolute parameter change was below tolerance
      58       11812.9    1.0784e-05          4737   2.271e-09       0.001      122  LS failed, Hessian reset 
      99         11813   4.40511e-08       4741.53      0.7297      0.7297      173   
    Iter      log prob        ||dx||      ||grad||       alpha      alpha0  # evals  Notes 
      98       14232.7   8.34688e-09       4921.25      0.3129      0.3129      132   
Optimization terminated normally: 
  Convergence detected: absolute parameter change was below tolerance
     103         11813   8.67558e-09        4559.9      0.4888      0.4888      179   
Optimization terminated normally: 
  Convergence detected: absolute parameter change was below tolerance
[I 2020-10-01 02:32:02,662] Trial 76 finished with value: 0.041123552267644345 and parameters: {'changepoint_prior_scale': 0.0010016818029628667, 'seasonality_prior_scale': 0.0773190648810593, 'holidays_prior_scale': 2.0201957201347547, 'seasonality_mode': 'additive', 'changepoint_range': 0.5476800784331255}. Best is trial 67 with value: 0.04069570224533105.
Initial log joint probability = -28.8311
    Iter      log prob        ||dx||      ||grad||       alpha      alpha0  # evals  Notes 
      99       18912.6   1.52692e-07       3055.65      0.2733           1      122   
    Iter      log prob        ||dx||      ||grad||       alpha      alpha0  # evals  Notes 
     110       18912.6   4.10251e-08       2720.86        0.77        0.77      135   
Optimization terminated normally: 
  Convergence detected: relative gradient magnitude is below tolerance
INFO:fbprophet:Making 5 forecasts with cutoffs between 2013-10-07 00:00:00 and 2015-10-18 00:00:00
INFO:fbprophet:Applying in parallel with <concurrent.futures.process.ProcessPoolExecutor object at 0x7fc88e651410>
Initial log joint probability = -8.95172
    Iter      log prob        ||dx||      ||grad||       alpha      alpha0  # evals  Notes 
Initial log joint probability = -12.7302
    Iter      log prob        ||dx||      ||grad||       alpha      alpha0  # evals  Notes 
Initial log joint probability = -15.1549
    Iter      log prob        ||dx||      ||grad||       alpha      alpha0  # evals  Notes 
Initial log joint probability = -18.717
    Iter      log prob        ||dx||      ||grad||       alpha      alpha0  # evals  Notes 
Initial log joint probability = -23.5879
    Iter      log prob        ||dx||      ||grad||       alpha      alpha0  # evals  Notes 
      69       4678.88   7.55958e-09       3311.98      0.1346      0.1346       96   
Optimization terminated normally: 
  Convergence detected: absolute parameter change was below tolerance
      59       9582.44   8.19071e-09       3558.94      0.4971      0.4971       78   
Optimization terminated normally: 
  Convergence detected: absolute parameter change was below tolerance
      84       7029.13   1.71722e-05       3074.29   4.734e-09       0.001      151  LS failed, Hessian reset 
      99       7029.32   1.84227e-06       3123.35      0.3587      0.3587      173   
    Iter      log prob        ||dx||      ||grad||       alpha      alpha0  # evals  Notes 
     128       7029.34   7.10787e-09       3336.65      0.4196      0.4196      210   
Optimization terminated normally: 
  Convergence detected: absolute parameter change was below tolerance
      37       11811.8    0.00017886       3644.73   4.979e-08       0.001       96  LS failed, Hessian reset 
      98       14233.4   6.22925e-09       3332.79      0.3362      0.3362      135   
Optimization terminated normally: 
  Convergence detected: absolute parameter change was below tolerance
      89       11812.8   2.22222e-07       3515.87   6.076e-11       0.001      200  LS failed, Hessian reset 
      99       11812.8   1.63995e-08       3593.76      0.1721           1      213   
    Iter      log prob        ||dx||      ||grad||       alpha      alpha0  # evals  Notes 
     100       11812.8   8.81077e-09       3534.35      0.2954           1      215   
Optimization terminated normally: 
  Convergence detected: absolute parameter change was below tolerance
[I 2020-10-01 02:32:19,328] Trial 77 finished with value: 0.040992022088448994 and parameters: {'changepoint_prior_scale': 0.001419183831399273, 'seasonality_prior_scale': 0.09209345658255866, 'holidays_prior_scale': 4.971172738723928, 'seasonality_mode': 'additive', 'changepoint_range': 0.5908632507468907}. Best is trial 67 with value: 0.04069570224533105.
Initial log joint probability = -28.8311
    Iter      log prob        ||dx||      ||grad||       alpha      alpha0  # evals  Notes 
      99       18912.7   3.07525e-07       1987.41      0.3619      0.3619      123   
    Iter      log prob        ||dx||      ||grad||       alpha      alpha0  # evals  Notes 
     108       18912.7   3.57129e-06       1789.26   1.957e-09       0.001      170  LS failed, Hessian reset 
     125       18912.7   5.55294e-08       1324.81      0.3595           1      192   
Optimization terminated normally: 
  Convergence detected: relative gradient magnitude is below tolerance
INFO:fbprophet:Making 5 forecasts with cutoffs between 2013-10-07 00:00:00 and 2015-10-18 00:00:00
INFO:fbprophet:Applying in parallel with <concurrent.futures.process.ProcessPoolExecutor object at 0x7fc88e6b7850>
Initial log joint probability = -8.95172
    Iter      log prob        ||dx||      ||grad||       alpha      alpha0  # evals  Notes 
Initial log joint probability = -12.7302
    Iter      log prob        ||dx||      ||grad||       alpha      alpha0  # evals  Notes 
Initial log joint probability = -15.1549
    Iter      log prob        ||dx||      ||grad||       alpha      alpha0  # evals  Notes 
Initial log joint probability = -18.717
    Iter      log prob        ||dx||      ||grad||       alpha      alpha0  # evals  Notes 
Initial log joint probability = -23.5879
    Iter      log prob        ||dx||      ||grad||       alpha      alpha0  # evals  Notes 
      99        4679.2   1.57602e-08       2126.96      0.3114           1      139   
    Iter      log prob        ||dx||      ||grad||       alpha      alpha0  # evals  Notes 
     100        4679.2   4.17943e-09       2162.62      0.3353      0.3353      140   
Optimization terminated normally: 
  Convergence detected: absolute parameter change was below tolerance
      99       7030.54   2.38099e-05       1828.18      0.9228      0.9228      128   
    Iter      log prob        ||dx||      ||grad||       alpha      alpha0  # evals  Notes 
      51       9582.51   3.35256e-06       2189.46   1.677e-09       0.001      108  LS failed, Hessian reset 
      59       11813.2    9.7727e-09        1921.6       0.387           1       89   
Optimization terminated normally: 
  Convergence detected: absolute parameter change was below tolerance
     188       7031.59   9.88778e-09       2165.09      0.2892      0.8518      234   
Optimization terminated normally: 
  Convergence detected: absolute parameter change was below tolerance
      97       9582.52   4.68716e-07       2149.55   2.428e-10       0.001      210  LS failed, Hessian reset 
      99       9582.52   1.72956e-07        1820.6      0.3479           1      213   
    Iter      log prob        ||dx||      ||grad||       alpha      alpha0  # evals  Notes 
     104       9582.52   8.36905e-09       2159.12      0.2226      0.2226      219   
Optimization terminated normally: 
  Convergence detected: absolute parameter change was below tolerance
      99       14232.4   1.81723e-05          1910      0.3623      0.3623      132   
    Iter      log prob        ||dx||      ||grad||       alpha      alpha0  # evals  Notes 
     165       14233.1   6.32236e-06       2170.67   3.113e-09       0.001      284  LS failed, Hessian reset 
     199       14233.1   3.79062e-07       1963.37      0.2487           1      329   
    Iter      log prob        ||dx||      ||grad||       alpha      alpha0  # evals  Notes 
     211       14233.1   9.66337e-09       1979.48      0.3405      0.3405      342   
Optimization terminated normally: 
  Convergence detected: absolute parameter change was below tolerance
