[I 2020-10-01 03:21:14,346] Trial 270 finished with value: 0.04078162690994955 and parameters: {'changepoint_prior_scale': 0.0014118467745014766, 'seasonality_prior_scale': 0.4308089738165673, 'holidays_prior_scale': 2.145352632347172, 'seasonality_mode': 'additive', 'changepoint_range': 0.5386925716500348}. Best is trial 96 with value: 0.038883738900888705.
Initial log joint probability = -28.8311
    Iter      log prob        ||dx||      ||grad||       alpha      alpha0  # evals  Notes 
      99       18912.9    2.0865e-05       3572.28      0.2617           1      125   
    Iter      log prob        ||dx||      ||grad||       alpha      alpha0  # evals  Notes 
     137         18913   1.60753e-08        2654.5      0.4929      0.4929      173   
Optimization terminated normally: 
  Convergence detected: relative gradient magnitude is below tolerance
INFO:fbprophet:Making 5 forecasts with cutoffs between 2013-10-07 00:00:00 and 2015-10-18 00:00:00
INFO:fbprophet:Applying in parallel with <concurrent.futures.process.ProcessPoolExecutor object at 0x7fc84dc20b50>
Initial log joint probability = -8.95172
    Iter      log prob        ||dx||      ||grad||       alpha      alpha0  # evals  Notes 
Initial log joint probability = -12.7302
    Iter      log prob        ||dx||      ||grad||       alpha      alpha0  # evals  Notes 
Initial log joint probability = -15.1549
    Iter      log prob        ||dx||      ||grad||       alpha      alpha0  # evals  Notes 
Initial log joint probability = -18.717
    Iter      log prob        ||dx||      ||grad||       alpha      alpha0  # evals  Notes 
      60       4677.69   4.05295e-09       2869.58      0.3013      0.3013       85   
Optimization terminated normally: 
  Convergence detected: absolute parameter change was below tolerance
Initial log joint probability = -23.5879
    Iter      log prob        ||dx||      ||grad||       alpha      alpha0  # evals  Notes 
      84       7029.17   4.46525e-05       2942.19   1.435e-08       0.001      141  LS failed, Hessian reset 
      99       7029.28   1.72476e-07        2732.7      0.1898      0.1898      159   
    Iter      log prob        ||dx||      ||grad||       alpha      alpha0  # evals  Notes 
      71       11813.3   5.31822e-09       2866.98      0.2261      0.2261       96   
Optimization terminated normally: 
  Convergence detected: absolute parameter change was below tolerance
     138       7029.44   6.16951e-05       2994.31   2.159e-08       0.001      255  LS failed, Hessian reset 
      91       9582.57   3.93254e-06       2896.01   1.268e-09       0.001      189  LS failed, Hessian reset 
      99       9582.58   1.81673e-06       2976.91      0.2292           1      198   
    Iter      log prob        ||dx||      ||grad||       alpha      alpha0  # evals  Notes 
     199       7029.85   7.38715e-07       2742.17      0.2298      0.7179      335   
    Iter      log prob        ||dx||      ||grad||       alpha      alpha0  # evals  Notes 
     123       9582.58   8.22175e-09       2318.76       0.397       0.397      229   
Optimization terminated normally: 
  Convergence detected: absolute parameter change was below tolerance
      99       14233.3   5.31591e-08       2826.95      0.6236      0.6236      132   
    Iter      log prob        ||dx||      ||grad||       alpha      alpha0  # evals  Notes 
     110       14233.3   5.83658e-09       2870.84       0.199           1      148   
Optimization terminated normally: 
  Convergence detected: absolute parameter change was below tolerance
     299       7032.04    2.3298e-07       2680.38      0.3193           1      460   
    Iter      log prob        ||dx||      ||grad||       alpha      alpha0  # evals  Notes 
     322       7032.04    2.4957e-07       3068.19   8.341e-11       0.001      529  LS failed, Hessian reset 
     328       7032.04    8.7563e-09       2947.27      0.3155      0.3155      537   
Optimization terminated normally: 
  Convergence detected: absolute parameter change was below tolerance
[I 2020-10-01 03:21:30,501] Trial 271 finished with value: 0.04262726295149592 and parameters: {'changepoint_prior_scale': 0.001693946255052312, 'seasonality_prior_scale': 0.5667019537304966, 'holidays_prior_scale': 2.138607911239265, 'seasonality_mode': 'additive', 'changepoint_range': 0.5338424576269989}. Best is trial 96 with value: 0.038883738900888705.
Initial log joint probability = -28.8311
    Iter      log prob        ||dx||      ||grad||       alpha      alpha0  # evals  Notes 
      99       18912.3   0.000140004       4355.65           1           1      133   
    Iter      log prob        ||dx||      ||grad||       alpha      alpha0  # evals  Notes 
     164       18912.8   5.08461e-09       3813.48       0.306       0.306      204   
Optimization terminated normally: 
  Convergence detected: absolute parameter change was below tolerance
INFO:fbprophet:Making 5 forecasts with cutoffs between 2013-10-07 00:00:00 and 2015-10-18 00:00:00
INFO:fbprophet:Applying in parallel with <concurrent.futures.process.ProcessPoolExecutor object at 0x7fc84dc0afd0>
Initial log joint probability = -8.95172
    Iter      log prob        ||dx||      ||grad||       alpha      alpha0  # evals  Notes 
Initial log joint probability = -12.7302
    Iter      log prob        ||dx||      ||grad||       alpha      alpha0  # evals  Notes 
Initial log joint probability = -15.1549
    Iter      log prob        ||dx||      ||grad||       alpha      alpha0  # evals  Notes 
Initial log joint probability = -18.717
    Iter      log prob        ||dx||      ||grad||       alpha      alpha0  # evals  Notes 
Initial log joint probability = -23.5879
    Iter      log prob        ||dx||      ||grad||       alpha      alpha0  # evals  Notes 
      83        4677.9   6.72379e-09       4188.95      0.4348      0.4348      106   
Optimization terminated normally: 
  Convergence detected: absolute parameter change was below tolerance
      99       7029.14   6.83506e-07       3823.26      0.2047           1      127   
    Iter      log prob        ||dx||      ||grad||       alpha      alpha0  # evals  Notes 
     114       7029.15   1.42756e-06       3947.42   3.114e-10       0.001      182  LS failed, Hessian reset 
     140       7029.15   7.80272e-09       3790.17      0.6461      0.6461      215   
Optimization terminated normally: 
  Convergence detected: absolute parameter change was below tolerance
      66       9581.79   1.01252e-05       4114.98   2.313e-09       0.001      142  LS failed, Hessian reset 
      96       9581.81   6.64095e-09       3934.52      0.5132      0.5132      177   
Optimization terminated normally: 
  Convergence detected: absolute parameter change was below tolerance
      71         11813   4.36678e-06       4257.03   1.051e-09       0.001      154  LS failed, Hessian reset 
      99         14232   2.03369e-07       4163.59      0.5914      0.5914      132   
    Iter      log prob        ||dx||      ||grad||       alpha      alpha0  # evals  Notes 
      90         11813   6.82233e-09       4222.59       0.246       0.246      179   
Optimization terminated normally: 
  Convergence detected: absolute parameter change was below tolerance
     146       14232.2   4.47347e-09       4135.54       0.178       0.178      189   
Optimization terminated normally: 
  Convergence detected: absolute parameter change was below tolerance
[I 2020-10-01 03:21:46,904] Trial 272 finished with value: 0.0423193179139381 and parameters: {'changepoint_prior_scale': 0.0011921978232177976, 'seasonality_prior_scale': 0.4058309417196818, 'holidays_prior_scale': 2.5492175272678863, 'seasonality_mode': 'multiplicative', 'changepoint_range': 0.5421320142097427}. Best is trial 96 with value: 0.038883738900888705.
Initial log joint probability = -28.8311
    Iter      log prob        ||dx||      ||grad||       alpha      alpha0  # evals  Notes 
      99       18912.8    1.2913e-07       3725.27      0.2382      0.2382      124   
    Iter      log prob        ||dx||      ||grad||       alpha      alpha0  # evals  Notes 
     114       18912.8   8.19603e-07       3672.97   2.118e-10       0.001      177  LS failed, Hessian reset 
     129       18912.8   1.51272e-08       3520.26      0.2143      0.9185      196   
Optimization terminated normally: 
  Convergence detected: relative gradient magnitude is below tolerance
INFO:fbprophet:Making 5 forecasts with cutoffs between 2013-10-07 00:00:00 and 2015-10-18 00:00:00
INFO:fbprophet:Applying in parallel with <concurrent.futures.process.ProcessPoolExecutor object at 0x7fc84dc4d0d0>
Initial log joint probability = -8.95172
    Iter      log prob        ||dx||      ||grad||       alpha      alpha0  # evals  Notes 
Initial log joint probability = -12.7302
    Iter      log prob        ||dx||      ||grad||       alpha      alpha0  # evals  Notes 
Initial log joint probability = -15.1549
    Iter      log prob        ||dx||      ||grad||       alpha      alpha0  # evals  Notes 
Initial log joint probability = -18.717
    Iter      log prob        ||dx||      ||grad||       alpha      alpha0  # evals  Notes 
Initial log joint probability = -23.5879
    Iter      log prob        ||dx||      ||grad||       alpha      alpha0  # evals  Notes 
      81       4678.97   7.16423e-09       3652.89      0.1829      0.1829      107   
Optimization terminated normally: 
  Convergence detected: absolute parameter change was below tolerance
      99       7029.01   5.42614e-06       3346.04           1           1      120   
    Iter      log prob        ||dx||      ||grad||       alpha      alpha0  # evals  Notes 
      63       9582.35   2.66368e-05        3949.2   7.028e-09       0.001      118  LS failed, Hessian reset 
     163       7031.53   9.24598e-09        3710.1      0.3306      0.3306      198   
Optimization terminated normally: 
  Convergence detected: absolute parameter change was below tolerance
      32       11811.9   0.000186623       4024.76   5.898e-08       0.001       99  LS failed, Hessian reset 
      99        9582.4   3.46344e-08       3053.39           1           1      168   
    Iter      log prob        ||dx||      ||grad||       alpha      alpha0  # evals  Notes 
     101        9582.4   1.95891e-08       3417.24      0.3936           1      171   
Optimization terminated normally: 
  Convergence detected: relative gradient magnitude is below tolerance
      83       11813.2   8.26412e-09        3609.6      0.6556      0.6556      159   
Optimization terminated normally: 
  Convergence detected: absolute parameter change was below tolerance
      99         14233   2.15467e-06       3855.19           1           1      127   
    Iter      log prob        ||dx||      ||grad||       alpha      alpha0  # evals  Notes 
     126         14233     8.046e-09       3145.62      0.0718           1      164   
Optimization terminated normally: 
  Convergence detected: absolute parameter change was below tolerance
[I 2020-10-01 03:22:02,936] Trial 273 finished with value: 0.04168004090485501 and parameters: {'changepoint_prior_scale': 0.001372696778448262, 'seasonality_prior_scale': 0.4046045397532007, 'holidays_prior_scale': 2.343247210884121, 'seasonality_mode': 'additive', 'changepoint_range': 0.5267463681032895}. Best is trial 96 with value: 0.038883738900888705.
Initial log joint probability = -28.8311
    Iter      log prob        ||dx||      ||grad||       alpha      alpha0  # evals  Notes 
      99       18912.7   1.67168e-06       2838.11      0.1488           1      127   
    Iter      log prob        ||dx||      ||grad||       alpha      alpha0  # evals  Notes 
     110       18912.7   2.76076e-09       2909.97     0.03638     0.03638      142   
Optimization terminated normally: 
  Convergence detected: absolute parameter change was below tolerance
INFO:fbprophet:Making 5 forecasts with cutoffs between 2013-10-07 00:00:00 and 2015-10-18 00:00:00
INFO:fbprophet:Applying in parallel with <concurrent.futures.process.ProcessPoolExecutor object at 0x7fc84dc04c90>
Initial log joint probability = -8.95172
    Iter      log prob        ||dx||      ||grad||       alpha      alpha0  # evals  Notes 
Initial log joint probability = -12.7302
    Iter      log prob        ||dx||      ||grad||       alpha      alpha0  # evals  Notes 
Initial log joint probability = -15.1549
    Iter      log prob        ||dx||      ||grad||       alpha      alpha0  # evals  Notes 
Initial log joint probability = -18.717
    Iter      log prob        ||dx||      ||grad||       alpha      alpha0  # evals  Notes 
Initial log joint probability = -23.5879
    Iter      log prob        ||dx||      ||grad||       alpha      alpha0  # evals  Notes 
      82       4679.21   5.80766e-09       3319.35      0.3232           1      114   
Optimization terminated normally: 
  Convergence detected: absolute parameter change was below tolerance
      99       7029.22   7.40293e-08       3372.59           1           1      122   
    Iter      log prob        ||dx||      ||grad||       alpha      alpha0  # evals  Notes 
      87       9582.59   7.33585e-09       3188.53      0.5746      0.5746      117   
Optimization terminated normally: 
  Convergence detected: absolute parameter change was below tolerance
      61       11813.2   6.45378e-09       3304.29      0.3369           1       85   
Optimization terminated normally: 
  Convergence detected: absolute parameter change was below tolerance
     131       7029.24   1.57118e-06       3003.05   4.359e-10       0.001      202  LS failed, Hessian reset 
     157       7029.24   6.84947e-09       2527.14        0.41        0.41      235   
Optimization terminated normally: 
  Convergence detected: absolute parameter change was below tolerance
      99       14233.2   7.89663e-07        3114.1           1           1      128   
    Iter      log prob        ||dx||      ||grad||       alpha      alpha0  # evals  Notes 
     119       14233.2    5.6118e-09       3234.68      0.4177      0.4177      155   
Optimization terminated normally: 
  Convergence detected: absolute parameter change was below tolerance
[I 2020-10-01 03:22:18,585] Trial 274 finished with value: 0.041053849603382195 and parameters: {'changepoint_prior_scale': 0.0015069727915785025, 'seasonality_prior_scale': 0.473012317925556, 'holidays_prior_scale': 1.7964337000639368, 'seasonality_mode': 'additive', 'changepoint_range': 0.5125751857479706}. Best is trial 96 with value: 0.038883738900888705.
Initial log joint probability = -28.8311
    Iter      log prob        ||dx||      ||grad||       alpha      alpha0  # evals  Notes 
      99       18912.6    0.00022174       4129.81      0.6418      0.6418      122   
    Iter      log prob        ||dx||      ||grad||       alpha      alpha0  # evals  Notes 
     145       18912.9   2.48816e-08        4388.9           1           1      180   
Optimization terminated normally: 
  Convergence detected: relative gradient magnitude is below tolerance
INFO:fbprophet:Making 5 forecasts with cutoffs between 2013-10-07 00:00:00 and 2015-10-18 00:00:00
INFO:fbprophet:Applying in parallel with <concurrent.futures.process.ProcessPoolExecutor object at 0x7fc84dc4d050>
Initial log joint probability = -8.95172
    Iter      log prob        ||dx||      ||grad||       alpha      alpha0  # evals  Notes 
Initial log joint probability = -12.7302
    Iter      log prob        ||dx||      ||grad||       alpha      alpha0  # evals  Notes 
Initial log joint probability = -15.1549
    Iter      log prob        ||dx||      ||grad||       alpha      alpha0  # evals  Notes 
Initial log joint probability = -18.717
    Iter      log prob        ||dx||      ||grad||       alpha      alpha0  # evals  Notes 
Initial log joint probability = -23.5879
    Iter      log prob        ||dx||      ||grad||       alpha      alpha0  # evals  Notes 
      94       4676.55   0.000333193       4375.69   7.476e-08       0.001      178  LS failed, Hessian reset 
      99       4677.38   9.11487e-05       4374.32           1           1      185   
    Iter      log prob        ||dx||      ||grad||       alpha      alpha0  # evals  Notes 
      95       7028.18   9.13677e-09       4283.48      0.1835      0.1835      125   
Optimization terminated normally: 
  Convergence detected: absolute parameter change was below tolerance
      57       9581.89   7.60497e-09        4281.5      0.1626      0.1626       83   
Optimization terminated normally: 
  Convergence detected: absolute parameter change was below tolerance
     133          4679   9.90066e-06       4230.99   2.191e-09       0.001      278  LS failed, Hessian reset 
      55         11813   5.08656e-09       4509.92      0.1829      0.1829       81   
Optimization terminated normally: 
  Convergence detected: absolute parameter change was below tolerance
     167       4679.05    4.3919e-09       4482.58      0.3475      0.3475      325   
Optimization terminated normally: 
  Convergence detected: absolute parameter change was below tolerance
      99       14233.5   1.06976e-07       4291.95      0.5847      0.5847      134   
    Iter      log prob        ||dx||      ||grad||       alpha      alpha0  # evals  Notes 
     111       14233.5   9.43883e-09       4126.11      0.4304      0.4304      148   
Optimization terminated normally: 
  Convergence detected: absolute parameter change was below tolerance
[I 2020-10-01 03:22:34,700] Trial 275 finished with value: 0.041503001621568766 and parameters: {'changepoint_prior_scale': 0.0011242896844359588, 'seasonality_prior_scale': 0.49093951400206176, 'holidays_prior_scale': 0.11890935458523735, 'seasonality_mode': 'additive', 'changepoint_range': 0.5507491797546551}. Best is trial 96 with value: 0.038883738900888705.
Initial log joint probability = -28.8311
    Iter      log prob        ||dx||      ||grad||       alpha      alpha0  # evals  Notes 
      99       18912.5   1.03369e-06       3888.12      0.4076           1      124   
    Iter      log prob        ||dx||      ||grad||       alpha      alpha0  # evals  Notes 
     164       18912.7    1.0232e-08       3761.45      0.2491      0.2491      201   
Optimization terminated normally: 
  Convergence detected: relative gradient magnitude is below tolerance
INFO:fbprophet:Making 5 forecasts with cutoffs between 2013-10-07 00:00:00 and 2015-10-18 00:00:00
INFO:fbprophet:Applying in parallel with <concurrent.futures.process.ProcessPoolExecutor object at 0x7fc84dc28310>
Initial log joint probability = -8.95172
    Iter      log prob        ||dx||      ||grad||       alpha      alpha0  # evals  Notes 
Initial log joint probability = -12.7302
    Iter      log prob        ||dx||      ||grad||       alpha      alpha0  # evals  Notes 
Initial log joint probability = -15.1549
    Iter      log prob        ||dx||      ||grad||       alpha      alpha0  # evals  Notes 
      82       4678.98   9.79146e-09       3705.91      0.3835      0.3835      121   
Optimization terminated normally: 
  Convergence detected: absolute parameter change was below tolerance
Initial log joint probability = -18.717
    Iter      log prob        ||dx||      ||grad||       alpha      alpha0  # evals  Notes 
Initial log joint probability = -23.5879
    Iter      log prob        ||dx||      ||grad||       alpha      alpha0  # evals  Notes 
      99       7028.64   2.58376e-07       4031.38      0.1962      0.1962      131   
    Iter      log prob        ||dx||      ||grad||       alpha      alpha0  # evals  Notes 
      83       9582.38   6.52712e-09       3859.78     0.07182           1      115   
Optimization terminated normally: 
  Convergence detected: absolute parameter change was below tolerance
     136       7028.65   2.81792e-09       3349.97      0.1748      0.1748      177   
Optimization terminated normally: 
  Convergence detected: absolute parameter change was below tolerance
      31       11811.8   0.000249334       3466.28   6.507e-08       0.001       92  LS failed, Hessian reset 
      73       11813.3   9.77087e-09       3922.86      0.1236      0.1236      148   
Optimization terminated normally: 
  Convergence detected: absolute parameter change was below tolerance
      92       14232.5   6.38781e-09       3662.66      0.2138      0.2138      125   
Optimization terminated normally: 
  Convergence detected: absolute parameter change was below tolerance
