[I 2020-10-01 02:16:39,104] Trial 16 finished with value: 0.05148697596506934 and parameters: {'changepoint_prior_scale': 0.4002121623449621, 'seasonality_prior_scale': 0.042713997206869206, 'holidays_prior_scale': 3.8839380859657475, 'seasonality_mode': 'additive', 'changepoint_range': 0.5955918983105954}. Best is trial 3 with value: 0.04098090703811677.
Initial log joint probability = -28.8311
    Iter      log prob        ||dx||      ||grad||       alpha      alpha0  # evals  Notes 
      64       18914.7   1.81283e-05       249.135   7.221e-08       0.001      126  LS failed, Hessian reset 
      79       18914.7   9.21777e-09       223.602    0.001785           1      148   
Optimization terminated normally: 
  Convergence detected: absolute parameter change was below tolerance
INFO:fbprophet:Making 5 forecasts with cutoffs between 2013-10-07 00:00:00 and 2015-10-18 00:00:00
INFO:fbprophet:Applying in parallel with <concurrent.futures.process.ProcessPoolExecutor object at 0x7fc88e6514d0>
Initial log joint probability = -8.95172
    Iter      log prob        ||dx||      ||grad||       alpha      alpha0  # evals  Notes 
Initial log joint probability = -12.7302
    Iter      log prob        ||dx||      ||grad||       alpha      alpha0  # evals  Notes 
Initial log joint probability = -15.1549
    Iter      log prob        ||dx||      ||grad||       alpha      alpha0  # evals  Notes 
Initial log joint probability = -18.717
    Iter      log prob        ||dx||      ||grad||       alpha      alpha0  # evals  Notes 
      60       4679.42   1.98036e-08       389.588      0.2951           1       81   
Optimization terminated normally: 
  Convergence detected: relative gradient magnitude is below tolerance
Initial log joint probability = -23.5879
    Iter      log prob        ||dx||      ||grad||       alpha      alpha0  # evals  Notes 
      99       7033.55    0.00031508       236.737      0.9907      0.9907      131   
    Iter      log prob        ||dx||      ||grad||       alpha      alpha0  # evals  Notes 
      38        9582.8   5.87889e-05       254.671   2.272e-07       0.001       86  LS failed, Hessian reset 
     139       7033.59   5.41891e-08       234.794       0.156       0.156      186   
Optimization terminated normally: 
  Convergence detected: relative gradient magnitude is below tolerance
      71       11813.3   1.53798e-07       225.305     0.09175           1      108   
Optimization terminated normally: 
  Convergence detected: relative gradient magnitude is below tolerance
      99       9582.88   0.000619552       327.566           1           1      167   
    Iter      log prob        ||dx||      ||grad||       alpha      alpha0  # evals  Notes 
      94       14235.3   4.87691e-08       340.425      0.1031      0.4585      131   
Optimization terminated normally: 
  Convergence detected: relative gradient magnitude is below tolerance
     165       9582.92    7.6746e-06       226.892      0.2616           1      263   
Optimization terminated normally: 
  Convergence detected: relative gradient magnitude is below tolerance
[I 2020-10-01 02:16:54,985] Trial 17 finished with value: 0.041377142071079384 and parameters: {'changepoint_prior_scale': 0.012850246728366163, 'seasonality_prior_scale': 0.10708204231640277, 'holidays_prior_scale': 0.029591344973155388, 'seasonality_mode': 'additive', 'changepoint_range': 0.6223855613756241}. Best is trial 3 with value: 0.04098090703811677.
Initial log joint probability = -28.8311
    Iter      log prob        ||dx||      ||grad||       alpha      alpha0  # evals  Notes 
      99       18912.8   2.80942e-05       2176.71      0.8925      0.8925      127   
    Iter      log prob        ||dx||      ||grad||       alpha      alpha0  # evals  Notes 
     168         18913    6.6673e-08       1580.39           1           1      218   
Optimization terminated normally: 
  Convergence detected: relative gradient magnitude is below tolerance
INFO:fbprophet:Making 5 forecasts with cutoffs between 2013-10-07 00:00:00 and 2015-10-18 00:00:00
INFO:fbprophet:Applying in parallel with <concurrent.futures.process.ProcessPoolExecutor object at 0x7fc88f39b9d0>
Initial log joint probability = -8.95172
    Iter      log prob        ||dx||      ||grad||       alpha      alpha0  # evals  Notes 
Initial log joint probability = -12.7302
    Iter      log prob        ||dx||      ||grad||       alpha      alpha0  # evals  Notes 
Initial log joint probability = -15.1549
    Iter      log prob        ||dx||      ||grad||       alpha      alpha0  # evals  Notes 
Initial log joint probability = -18.717
    Iter      log prob        ||dx||      ||grad||       alpha      alpha0  # evals  Notes 
Initial log joint probability = -23.5879
    Iter      log prob        ||dx||      ||grad||       alpha      alpha0  # evals  Notes 
      99       4679.39   4.37829e-08       1915.08           1           1      125   
    Iter      log prob        ||dx||      ||grad||       alpha      alpha0  # evals  Notes 
     106       4679.39   2.87855e-06       1893.82   1.423e-09       0.001      173  LS failed, Hessian reset 
     131        4679.4   6.61985e-09       1929.02      0.2183      0.2183      207   
Optimization terminated normally: 
  Convergence detected: absolute parameter change was below tolerance
      99       7032.18    7.6263e-06       1715.29      0.8505      0.8505      122   
    Iter      log prob        ||dx||      ||grad||       alpha      alpha0  # evals  Notes 
     139       7032.19   1.82894e-08       1676.85      0.2122           1      172   
Optimization terminated normally: 
  Convergence detected: relative gradient magnitude is below tolerance
      53       9582.57   1.80525e-06       1876.92   9.093e-10       0.001      117  LS failed, Hessian reset 
      89       11812.4   1.34915e-08       1905.32      0.6609      0.6609      117   
Optimization terminated normally: 
  Convergence detected: relative gradient magnitude is below tolerance
      76       9582.59   3.20178e-06       2006.28   1.721e-09       0.001      186  LS failed, Hessian reset 
      99        9582.6   3.68803e-07       1797.93       2.991      0.2991      217   
    Iter      log prob        ||dx||      ||grad||       alpha      alpha0  # evals  Notes 
     105        9582.6   9.61909e-09          1935      0.6005      0.6005      225   
Optimization terminated normally: 
  Convergence detected: absolute parameter change was below tolerance
      99       14233.5   0.000186632       1723.15      0.1691           1      137   
    Iter      log prob        ||dx||      ||grad||       alpha      alpha0  # evals  Notes 
     100       14233.5   2.91574e-05       1740.76   1.692e-08       0.001      181  LS failed, Hessian reset 
     129       14233.5   2.73724e-08       1561.85      0.3981           1      217   
Optimization terminated normally: 
  Convergence detected: relative gradient magnitude is below tolerance
[I 2020-10-01 02:17:11,038] Trial 18 finished with value: 0.04199951079323021 and parameters: {'changepoint_prior_scale': 0.002592274438053302, 'seasonality_prior_scale': 0.37795571493498237, 'holidays_prior_scale': 0.7681510724208527, 'seasonality_mode': 'additive', 'changepoint_range': 0.5397721355024402}. Best is trial 3 with value: 0.04098090703811677.
Initial log joint probability = -28.8311
    Iter      log prob        ||dx||      ||grad||       alpha      alpha0  # evals  Notes 
      99       18910.9   4.66387e-07       4772.37       0.541       0.541      132   
    Iter      log prob        ||dx||      ||grad||       alpha      alpha0  # evals  Notes 
     162       18911.3   1.06159e-08        3825.8      0.3004      0.3004      208   
Optimization terminated normally: 
  Convergence detected: relative gradient magnitude is below tolerance
INFO:fbprophet:Making 5 forecasts with cutoffs between 2013-10-07 00:00:00 and 2015-10-18 00:00:00
INFO:fbprophet:Applying in parallel with <concurrent.futures.process.ProcessPoolExecutor object at 0x7fc88f39b9d0>
Initial log joint probability = -8.95172
    Iter      log prob        ||dx||      ||grad||       alpha      alpha0  # evals  Notes 
Initial log joint probability = -12.7302
    Iter      log prob        ||dx||      ||grad||       alpha      alpha0  # evals  Notes 
Initial log joint probability = -15.1549
    Iter      log prob        ||dx||      ||grad||       alpha      alpha0  # evals  Notes 
Initial log joint probability = -18.717
    Iter      log prob        ||dx||      ||grad||       alpha      alpha0  # evals  Notes 
Initial log joint probability = -23.5879
    Iter      log prob        ||dx||      ||grad||       alpha      alpha0  # evals  Notes 
      68       4678.06   1.97188e-06       4653.26   4.033e-10       0.001      126  LS failed, Hessian reset 
      97       4678.08   7.68735e-09       4608.46       0.354       0.354      167   
Optimization terminated normally: 
  Convergence detected: absolute parameter change was below tolerance
      67       7027.04   5.36478e-05       4981.54   1.215e-08       0.001      121  LS failed, Hessian reset 
      99       7027.21   8.55797e-08       4504.89      0.4536      0.4536      162   
    Iter      log prob        ||dx||      ||grad||       alpha      alpha0  # evals  Notes 
      72       9581.53   5.50548e-09       4425.63      0.3739      0.3739      102   
Optimization terminated normally: 
  Convergence detected: absolute parameter change was below tolerance
     117       7027.22   9.48707e-07       5380.37   2.179e-10       0.001      226  LS failed, Hessian reset 
     137       7027.23   2.64547e-09       4623.57      0.3541      0.3541      248   
Optimization terminated normally: 
  Convergence detected: absolute parameter change was below tolerance
      99       14232.5   5.71333e-08       5008.19      0.9498       0.251      130   
    Iter      log prob        ||dx||      ||grad||       alpha      alpha0  # evals  Notes 
     101       14232.5   1.09203e-08       4544.89      0.3585           1      133   
Optimization terminated normally: 
  Convergence detected: relative gradient magnitude is below tolerance
      63       11812.2   1.01261e-05       4788.26   2.023e-09       0.001      141  LS failed, Hessian reset 
      93       11812.2   3.69502e-09       4654.18      0.2639      0.2639      186   
Optimization terminated normally: 
  Convergence detected: absolute parameter change was below tolerance
[I 2020-10-01 02:17:26,334] Trial 19 finished with value: 0.041030527871171195 and parameters: {'changepoint_prior_scale': 0.0010153809060846719, 'seasonality_prior_scale': 0.032996482732963996, 'holidays_prior_scale': 0.1583101596028344, 'seasonality_mode': 'additive', 'changepoint_range': 0.6942397959251458}. Best is trial 3 with value: 0.04098090703811677.
Initial log joint probability = -28.8311
    Iter      log prob        ||dx||      ||grad||       alpha      alpha0  # evals  Notes 
      59       18911.8   1.03867e-05        918.45   1.023e-08       0.001      122  LS failed, Hessian reset 
      79       18911.8    4.0779e-08       798.849      0.2906      0.8564      151   
Optimization terminated normally: 
  Convergence detected: relative gradient magnitude is below tolerance
INFO:fbprophet:Making 5 forecasts with cutoffs between 2013-10-07 00:00:00 and 2015-10-18 00:00:00
INFO:fbprophet:Applying in parallel with <concurrent.futures.process.ProcessPoolExecutor object at 0x7fc88e6d4d90>
Initial log joint probability = -8.95172
    Iter      log prob        ||dx||      ||grad||       alpha      alpha0  # evals  Notes 
Initial log joint probability = -12.7302
    Iter      log prob        ||dx||      ||grad||       alpha      alpha0  # evals  Notes 
Initial log joint probability = -15.1549
    Iter      log prob        ||dx||      ||grad||       alpha      alpha0  # evals  Notes 
Initial log joint probability = -18.717
    Iter      log prob        ||dx||      ||grad||       alpha      alpha0  # evals  Notes 
      59       4678.65   3.72069e-09       1132.28       0.146       0.146       80   
Optimization terminated normally: 
  Convergence detected: absolute parameter change was below tolerance
Initial log joint probability = -23.5879
    Iter      log prob        ||dx||      ||grad||       alpha      alpha0  # evals  Notes 
      99       7031.13   6.93654e-07       863.494           1           1      123   
    Iter      log prob        ||dx||      ||grad||       alpha      alpha0  # evals  Notes 
     112       7031.13   3.64985e-08       910.655           1           1      139   
Optimization terminated normally: 
  Convergence detected: relative gradient magnitude is below tolerance
      99       9581.57   2.09871e-08       1016.37      0.2289      0.2289      131   
    Iter      log prob        ||dx||      ||grad||       alpha      alpha0  # evals  Notes 
     121       9581.57   3.65867e-08       715.038      0.2736      0.2736      157   
Optimization terminated normally: 
  Convergence detected: relative gradient magnitude is below tolerance
      99       11812.3   3.93923e-07       925.679      0.3915           1      130   
    Iter      log prob        ||dx||      ||grad||       alpha      alpha0  # evals  Notes 
     121       11812.3   2.19136e-08       1035.02      0.3414           1      159   
Optimization terminated normally: 
  Convergence detected: relative gradient magnitude is below tolerance
      99       14232.2   0.000389978       1124.58           1           1      126   
    Iter      log prob        ||dx||      ||grad||       alpha      alpha0  # evals  Notes 
     104       14232.4   5.82331e-05       975.269   7.941e-08       0.001      173  LS failed, Hessian reset 
     151       14232.5   2.91647e-08       771.549      0.3731      0.3731      237   
Optimization terminated normally: 
  Convergence detected: relative gradient magnitude is below tolerance
[I 2020-10-01 02:17:42,105] Trial 20 finished with value: 0.04204929928096188 and parameters: {'changepoint_prior_scale': 0.0044246384568830425, 'seasonality_prior_scale': 0.027873516349337768, 'holidays_prior_scale': 0.16447781205217207, 'seasonality_mode': 'additive', 'changepoint_range': 0.7066053436241703}. Best is trial 3 with value: 0.04098090703811677.
Initial log joint probability = -28.8311
    Iter      log prob        ||dx||      ||grad||       alpha      alpha0  # evals  Notes 
      99       18911.3   1.00738e-05       4591.27      0.4841      0.8116      135   
    Iter      log prob        ||dx||      ||grad||       alpha      alpha0  # evals  Notes 
     182       18912.8   8.70567e-09       4591.85      0.3103      0.3103      235   
Optimization terminated normally: 
  Convergence detected: absolute parameter change was below tolerance
INFO:fbprophet:Making 5 forecasts with cutoffs between 2013-10-07 00:00:00 and 2015-10-18 00:00:00
INFO:fbprophet:Applying in parallel with <concurrent.futures.process.ProcessPoolExecutor object at 0x7fc88e693590>
Initial log joint probability = -8.95172
    Iter      log prob        ||dx||      ||grad||       alpha      alpha0  # evals  Notes 
Initial log joint probability = -12.7302
    Iter      log prob        ||dx||      ||grad||       alpha      alpha0  # evals  Notes 
Initial log joint probability = -15.1549
    Iter      log prob        ||dx||      ||grad||       alpha      alpha0  # evals  Notes 
Initial log joint probability = -18.717
    Iter      log prob        ||dx||      ||grad||       alpha      alpha0  # evals  Notes 
Initial log joint probability = -23.5879
    Iter      log prob        ||dx||      ||grad||       alpha      alpha0  # evals  Notes 
      76       4679.14   4.70826e-09       4412.78      0.4235      0.4235       99   
Optimization terminated normally: 
  Convergence detected: absolute parameter change was below tolerance
      89       7027.54   3.35883e-05       4616.96   7.582e-09       0.001      160  LS failed, Hessian reset 
      99       7027.93   1.88467e-06       4411.22     0.05249     0.05249      172   
    Iter      log prob        ||dx||      ||grad||       alpha      alpha0  # evals  Notes 
      57          9582   4.15643e-06       4450.39   8.292e-10       0.001      115  LS failed, Hessian reset 
     168       7028.12   1.83091e-09       4814.44      0.1649      0.1649      258   
Optimization terminated normally: 
  Convergence detected: absolute parameter change was below tolerance
      99       9582.05    2.1841e-08       4504.29      0.5918      0.5918      166   
    Iter      log prob        ||dx||      ||grad||       alpha      alpha0  # evals  Notes 
     104       9582.05   5.73699e-09       4442.65      0.5669      0.5669      171   
Optimization terminated normally: 
  Convergence detected: absolute parameter change was below tolerance
      69         11813    2.0096e-05       4698.79   4.342e-09       0.001      153  LS failed, Hessian reset 
      99       14233.3   9.02982e-06       4349.51      0.2997      0.7813      122   
    Iter      log prob        ||dx||      ||grad||       alpha      alpha0  # evals  Notes 
      99       11813.1   2.28129e-07       4808.38      0.8439      0.8439      189   
    Iter      log prob        ||dx||      ||grad||       alpha      alpha0  # evals  Notes 
     122       11813.1   9.84264e-09       4892.82      0.7885      0.7885      221   
Optimization terminated normally: 
  Convergence detected: absolute parameter change was below tolerance
     138       14233.3   8.10424e-09        4082.8      0.2289      0.2289      174   
Optimization terminated normally: 
  Convergence detected: absolute parameter change was below tolerance
[I 2020-10-01 02:17:58,176] Trial 21 finished with value: 0.04138915255047722 and parameters: {'changepoint_prior_scale': 0.001045106921484451, 'seasonality_prior_scale': 0.15216168222776047, 'holidays_prior_scale': 0.06125168628735475, 'seasonality_mode': 'additive', 'changepoint_range': 0.6845250829060182}. Best is trial 3 with value: 0.04098090703811677.
Initial log joint probability = -28.8311
    Iter      log prob        ||dx||      ||grad||       alpha      alpha0  # evals  Notes 
      99       18912.1   1.54267e-07          2830      0.8801      0.8801      120   
    Iter      log prob        ||dx||      ||grad||       alpha      alpha0  # evals  Notes 
     166       18912.2   4.41495e-07       3056.74   1.538e-10       0.001      233  LS failed, Hessian reset 
     178       18912.2   3.66303e-08       2147.83           1           1      247   
Optimization terminated normally: 
  Convergence detected: relative gradient magnitude is below tolerance
INFO:fbprophet:Making 5 forecasts with cutoffs between 2013-10-07 00:00:00 and 2015-10-18 00:00:00
INFO:fbprophet:Applying in parallel with <concurrent.futures.process.ProcessPoolExecutor object at 0x7fc88fbdbed0>
Initial log joint probability = -8.95172
    Iter      log prob        ||dx||      ||grad||       alpha      alpha0  # evals  Notes 
Initial log joint probability = -12.7302
    Iter      log prob        ||dx||      ||grad||       alpha      alpha0  # evals  Notes 
Initial log joint probability = -15.1549
    Iter      log prob        ||dx||      ||grad||       alpha      alpha0  # evals  Notes 
Initial log joint probability = -18.717
    Iter      log prob        ||dx||      ||grad||       alpha      alpha0  # evals  Notes 
      38       4677.76   0.000114475       2879.56   3.946e-08       0.001       89  LS failed, Hessian reset 
Initial log joint probability = -23.5879
    Iter      log prob        ||dx||      ||grad||       alpha      alpha0  # evals  Notes 
      76        4678.1    9.5307e-09       2860.63      0.2678      0.2678      139   
Optimization terminated normally: 
  Convergence detected: absolute parameter change was below tolerance
      74       7028.89   6.68968e-05       3035.18   2.267e-08       0.001      132  LS failed, Hessian reset 
      99       7029.04   1.52096e-06       2752.11      0.4019      0.9367      164   
    Iter      log prob        ||dx||      ||grad||       alpha      alpha0  # evals  Notes 
     114       7029.05   1.35406e-06       2646.12   4.864e-10       0.001      215  LS failed, Hessian reset 
      76       9581.69    6.2844e-06       3008.82   2.115e-09       0.001      148  LS failed, Hessian reset 
     137       7029.06   5.04006e-09       2719.49      0.1645      0.1645      242   
Optimization terminated normally: 
  Convergence detected: absolute parameter change was below tolerance
      52       11811.6    0.00016161       2452.76   5.217e-08       0.001      124  LS failed, Hessian reset 
      99        9581.7   1.00537e-06       2886.83           1           1      175   
    Iter      log prob        ||dx||      ||grad||       alpha      alpha0  # evals  Notes 
     114        9581.7   5.51321e-09       2437.95      0.1612      0.1612      193   
Optimization terminated normally: 
  Convergence detected: absolute parameter change was below tolerance
      99       14232.7   8.82055e-08       2517.91       0.156      0.7013      134   
    Iter      log prob        ||dx||      ||grad||       alpha      alpha0  # evals  Notes 
      99       11812.5   8.04366e-08       2869.85      0.2568           1      180   
    Iter      log prob        ||dx||      ||grad||       alpha      alpha0  # evals  Notes 
     106       14232.7    8.2849e-09       2351.24      0.4772      0.4772      143   
Optimization terminated normally: 
  Convergence detected: absolute parameter change was below tolerance
     111       11812.5   3.10564e-07       2837.25   1.083e-10       0.001      236  LS failed, Hessian reset 
     124       11812.5   8.07822e-09       2915.55      0.2661      0.2661      251   
Optimization terminated normally: 
  Convergence detected: absolute parameter change was below tolerance
