[I 2020-10-01 03:46:10,213] Trial 367 finished with value: 0.04221213095553306 and parameters: {'changepoint_prior_scale': 0.001772320286789422, 'seasonality_prior_scale': 0.5787670538787125, 'holidays_prior_scale': 0.22137995397669816, 'seasonality_mode': 'additive', 'changepoint_range': 0.5416646295445707}. Best is trial 96 with value: 0.038883738900888705.
Initial log joint probability = -28.8311
    Iter      log prob        ||dx||      ||grad||       alpha      alpha0  # evals  Notes 
      99       18912.4   5.97625e-05       4597.07       0.413       0.413      120   
    Iter      log prob        ||dx||      ||grad||       alpha      alpha0  # evals  Notes 
     143       18912.6   6.89721e-09       4695.71       0.341       0.341      181   
Optimization terminated normally: 
  Convergence detected: absolute parameter change was below tolerance
INFO:fbprophet:Making 5 forecasts with cutoffs between 2013-10-07 00:00:00 and 2015-10-18 00:00:00
INFO:fbprophet:Applying in parallel with <concurrent.futures.process.ProcessPoolExecutor object at 0x7fc84dc1e410>
Initial log joint probability = -8.95172
    Iter      log prob        ||dx||      ||grad||       alpha      alpha0  # evals  Notes 
Initial log joint probability = -12.7302
    Iter      log prob        ||dx||      ||grad||       alpha      alpha0  # evals  Notes 
Initial log joint probability = -15.1549
    Iter      log prob        ||dx||      ||grad||       alpha      alpha0  # evals  Notes 
Initial log joint probability = -18.717
    Iter      log prob        ||dx||      ||grad||       alpha      alpha0  # evals  Notes 
Initial log joint probability = -23.5879
    Iter      log prob        ||dx||      ||grad||       alpha      alpha0  # evals  Notes 
      54       4679.21   3.78602e-05       4446.97   8.454e-09       0.001      110  LS failed, Hessian reset 
      82       4679.29   7.34862e-09       4481.27      0.4859      0.4859      144   
Optimization terminated normally: 
  Convergence detected: absolute parameter change was below tolerance
      73       7027.19   6.84617e-09       4390.44      0.3766      0.3766       92   
Optimization terminated normally: 
  Convergence detected: absolute parameter change was below tolerance
      54       9582.37   1.83757e-05        4981.6   4.001e-09       0.001      113  LS failed, Hessian reset 
      88       9582.47   6.51101e-09       4047.01      0.2652      0.8352      155   
Optimization terminated normally: 
  Convergence detected: absolute parameter change was below tolerance
      98         11813   9.09726e-09       4286.95       0.375           1      137   
Optimization terminated normally: 
  Convergence detected: absolute parameter change was below tolerance
      99       14233.6   5.65215e-07       4387.37      0.9453      0.9453      131   
    Iter      log prob        ||dx||      ||grad||       alpha      alpha0  # evals  Notes 
     113       14233.6   9.94541e-09       4183.17      0.3724      0.3724      147   
Optimization terminated normally: 
  Convergence detected: absolute parameter change was below tolerance
[I 2020-10-01 03:46:25,934] Trial 368 finished with value: 0.041344932429673055 and parameters: {'changepoint_prior_scale': 0.0011227910057046984, 'seasonality_prior_scale': 0.7233358649737615, 'holidays_prior_scale': 2.461238107455142, 'seasonality_mode': 'additive', 'changepoint_range': 0.5268982579127804}. Best is trial 96 with value: 0.038883738900888705.
Initial log joint probability = -28.8311
    Iter      log prob        ||dx||      ||grad||       alpha      alpha0  # evals  Notes 
      99       18912.5   2.64386e-06       2900.63           1           1      129   
    Iter      log prob        ||dx||      ||grad||       alpha      alpha0  # evals  Notes 
     122       18912.5   3.30299e-08       3239.73           1           1      159   
Optimization terminated normally: 
  Convergence detected: relative gradient magnitude is below tolerance
INFO:fbprophet:Making 5 forecasts with cutoffs between 2013-10-07 00:00:00 and 2015-10-18 00:00:00
INFO:fbprophet:Applying in parallel with <concurrent.futures.process.ProcessPoolExecutor object at 0x7fc84dc207d0>
Initial log joint probability = -8.95172
    Iter      log prob        ||dx||      ||grad||       alpha      alpha0  # evals  Notes 
Initial log joint probability = -12.7302
    Iter      log prob        ||dx||      ||grad||       alpha      alpha0  # evals  Notes 
Initial log joint probability = -15.1549
    Iter      log prob        ||dx||      ||grad||       alpha      alpha0  # evals  Notes 
Initial log joint probability = -18.717
    Iter      log prob        ||dx||      ||grad||       alpha      alpha0  # evals  Notes 
      70       4679.01   9.82448e-09       3486.05      0.5205      0.5205       88   
Optimization terminated normally: 
  Convergence detected: absolute parameter change was below tolerance
Initial log joint probability = -23.5879
    Iter      log prob        ||dx||      ||grad||       alpha      alpha0  # evals  Notes 
      99       7029.51   1.02912e-05       3662.52       3.745      0.3745      127   
    Iter      log prob        ||dx||      ||grad||       alpha      alpha0  # evals  Notes 
      51       9582.52   5.72713e-06       3435.36   1.854e-09       0.001      108  LS failed, Hessian reset 
      31       11811.3   0.000336101       3504.59   1.063e-07       0.001       79  LS failed, Hessian reset 
      82       9582.53   7.55239e-09       3164.15      0.5581      0.5581      151   
Optimization terminated normally: 
  Convergence detected: absolute parameter change was below tolerance
     199       7031.71   1.51457e-05       3316.41      0.4777      0.4777      249   
    Iter      log prob        ||dx||      ||grad||       alpha      alpha0  # evals  Notes 
      81       11813.2   9.14845e-09       3477.49           1           1      136   
Optimization terminated normally: 
  Convergence detected: absolute parameter change was below tolerance
      99       14233.3   4.58227e-05       3212.21           1           1      126   
    Iter      log prob        ||dx||      ||grad||       alpha      alpha0  # evals  Notes 
     279       7031.97   2.77062e-07       3637.09   8.361e-11       0.001      378  LS failed, Hessian reset 
     296       7031.97   5.64463e-09       3336.38      0.4284      0.4284      396   
Optimization terminated normally: 
  Convergence detected: absolute parameter change was below tolerance
     138       14233.4   2.14051e-06       3555.11   5.475e-10       0.001      217  LS failed, Hessian reset 
     160       14233.4   8.51455e-09       3432.05     0.08612        0.36      245   
Optimization terminated normally: 
  Convergence detected: absolute parameter change was below tolerance
[I 2020-10-01 03:46:40,428] Trial 369 finished with value: 0.0416670608445768 and parameters: {'changepoint_prior_scale': 0.0014236924399287595, 'seasonality_prior_scale': 0.46287747897608766, 'holidays_prior_scale': 0.18499461108182416, 'seasonality_mode': 'additive', 'changepoint_range': 0.5485382542656899}. Best is trial 96 with value: 0.038883738900888705.
Initial log joint probability = -28.8311
    Iter      log prob        ||dx||      ||grad||       alpha      alpha0  # evals  Notes 
      99       18912.9   4.15143e-06       3663.62      0.3371      0.3371      128   
    Iter      log prob        ||dx||      ||grad||       alpha      alpha0  # evals  Notes 
     126       18912.9   8.83643e-09       3924.26       0.141       0.141      161   
Optimization terminated normally: 
  Convergence detected: absolute parameter change was below tolerance
INFO:fbprophet:Making 5 forecasts with cutoffs between 2013-10-07 00:00:00 and 2015-10-18 00:00:00
INFO:fbprophet:Applying in parallel with <concurrent.futures.process.ProcessPoolExecutor object at 0x7fc84dc72a50>
Initial log joint probability = -8.95172
    Iter      log prob        ||dx||      ||grad||       alpha      alpha0  # evals  Notes 
Initial log joint probability = -12.7302
    Iter      log prob        ||dx||      ||grad||       alpha      alpha0  # evals  Notes 
Initial log joint probability = -15.1549
    Iter      log prob        ||dx||      ||grad||       alpha      alpha0  # evals  Notes 
Initial log joint probability = -18.717
    Iter      log prob        ||dx||      ||grad||       alpha      alpha0  # evals  Notes 
Initial log joint probability = -23.5879
    Iter      log prob        ||dx||      ||grad||       alpha      alpha0  # evals  Notes 
      72       4678.53   3.19502e-09       4089.65      0.2108       0.491      100   
Optimization terminated normally: 
  Convergence detected: absolute parameter change was below tolerance
      69       7028.56   3.13197e-05       3999.83   7.697e-09       0.001      122  LS failed, Hessian reset 
      55       9582.24   9.89413e-09       4278.07      0.7095      0.7095       79   
Optimization terminated normally: 
  Convergence detected: absolute parameter change was below tolerance
      99       7028.67   8.73702e-07       4559.85      0.6221      0.6221      160   
    Iter      log prob        ||dx||      ||grad||       alpha      alpha0  # evals  Notes 
     113       7028.67   9.28726e-09       3725.57      0.3055           1      179   
Optimization terminated normally: 
  Convergence detected: absolute parameter change was below tolerance
      24       11811.2   0.000646577        4017.9   1.481e-07       0.001       80  LS failed, Hessian reset 
      99       14231.3   4.17745e-06       3896.51      0.5042      0.5042      124   
    Iter      log prob        ||dx||      ||grad||       alpha      alpha0  # evals  Notes 
      99         11813   1.10503e-07        4103.3      0.6249      0.6249      165   
    Iter      log prob        ||dx||      ||grad||       alpha      alpha0  # evals  Notes 
     113         11813   5.21924e-09       4114.29      0.1472      0.1472      180   
Optimization terminated normally: 
  Convergence detected: absolute parameter change was below tolerance
     149       14231.6   4.68845e-09       3779.52      0.3281      0.3281      184   
Optimization terminated normally: 
  Convergence detected: absolute parameter change was below tolerance
[I 2020-10-01 03:46:55,942] Trial 370 finished with value: 0.04119920327324784 and parameters: {'changepoint_prior_scale': 0.0012252803510917818, 'seasonality_prior_scale': 0.4374998045559175, 'holidays_prior_scale': 0.27771490955247385, 'seasonality_mode': 'additive', 'changepoint_range': 0.5173640136862818}. Best is trial 96 with value: 0.038883738900888705.
Initial log joint probability = -28.8311
    Iter      log prob        ||dx||      ||grad||       alpha      alpha0  # evals  Notes 
      99       18912.5    0.00022042       4441.03       0.431       0.431      120   
    Iter      log prob        ||dx||      ||grad||       alpha      alpha0  # evals  Notes 
     170       18912.9   9.37846e-09       4568.06      0.5676      0.5676      207   
Optimization terminated normally: 
  Convergence detected: absolute parameter change was below tolerance
INFO:fbprophet:Making 5 forecasts with cutoffs between 2013-10-07 00:00:00 and 2015-10-18 00:00:00
INFO:fbprophet:Applying in parallel with <concurrent.futures.process.ProcessPoolExecutor object at 0x7fc84dbfdf10>
Initial log joint probability = -8.95172
    Iter      log prob        ||dx||      ||grad||       alpha      alpha0  # evals  Notes 
Initial log joint probability = -12.7302
    Iter      log prob        ||dx||      ||grad||       alpha      alpha0  # evals  Notes 
Initial log joint probability = -15.1549
    Iter      log prob        ||dx||      ||grad||       alpha      alpha0  # evals  Notes 
Initial log joint probability = -18.717
    Iter      log prob        ||dx||      ||grad||       alpha      alpha0  # evals  Notes 
      63       4678.84   7.56422e-09       4856.06      0.7069      0.7069       88   
Optimization terminated normally: 
  Convergence detected: absolute parameter change was below tolerance
Initial log joint probability = -23.5879
    Iter      log prob        ||dx||      ||grad||       alpha      alpha0  # evals  Notes 
      52       9582.22   6.77628e-09       4980.36      0.1934      0.1934       73   
Optimization terminated normally: 
  Convergence detected: absolute parameter change was below tolerance
      99       7028.56   1.74328e-06       5019.25      0.6304      0.2288      127   
    Iter      log prob        ||dx||      ||grad||       alpha      alpha0  # evals  Notes 
     127       7028.56    9.4289e-09       5078.94      0.7066      0.7066      163   
Optimization terminated normally: 
  Convergence detected: absolute parameter change was below tolerance
      58       11812.9   8.05765e-09          4836      0.1429      0.1429       86   
Optimization terminated normally: 
  Convergence detected: absolute parameter change was below tolerance
      99       14231.4   3.17834e-06       5079.84           1           1      129   
    Iter      log prob        ||dx||      ||grad||       alpha      alpha0  # evals  Notes 
     141       14231.7   8.17835e-09       4998.19      0.3752      0.3752      184   
Optimization terminated normally: 
  Convergence detected: absolute parameter change was below tolerance
[I 2020-10-01 03:47:11,631] Trial 371 finished with value: 0.04089985626881266 and parameters: {'changepoint_prior_scale': 0.0010052763555675336, 'seasonality_prior_scale': 0.3986448402974083, 'holidays_prior_scale': 0.15103126608696743, 'seasonality_mode': 'additive', 'changepoint_range': 0.535143911914817}. Best is trial 96 with value: 0.038883738900888705.
Initial log joint probability = -28.8311
    Iter      log prob        ||dx||      ||grad||       alpha      alpha0  # evals  Notes 
      99         18913   1.53303e-06       3402.54           1           1      121   
    Iter      log prob        ||dx||      ||grad||       alpha      alpha0  # evals  Notes 
     114         18913   6.33966e-08       2913.85      0.3187           1      140   
Optimization terminated normally: 
  Convergence detected: relative gradient magnitude is below tolerance
INFO:fbprophet:Making 5 forecasts with cutoffs between 2013-10-07 00:00:00 and 2015-10-18 00:00:00
INFO:fbprophet:Applying in parallel with <concurrent.futures.process.ProcessPoolExecutor object at 0x7fc84dbf3a10>
Initial log joint probability = -8.95172
    Iter      log prob        ||dx||      ||grad||       alpha      alpha0  # evals  Notes 
Initial log joint probability = -12.7302
    Iter      log prob        ||dx||      ||grad||       alpha      alpha0  # evals  Notes 
      99       4679.32   2.63602e-08       2975.31           1           1      131   
    Iter      log prob        ||dx||      ||grad||       alpha      alpha0  # evals  Notes 
Initial log joint probability = -15.1549
    Iter      log prob        ||dx||      ||grad||       alpha      alpha0  # evals  Notes 
     104       4679.32    5.4733e-09       3233.77      0.4701      0.4701      136   
Optimization terminated normally: 
  Convergence detected: absolute parameter change was below tolerance
Initial log joint probability = -18.717
    Iter      log prob        ||dx||      ||grad||       alpha      alpha0  # evals  Notes 
Initial log joint probability = -23.5879
    Iter      log prob        ||dx||      ||grad||       alpha      alpha0  # evals  Notes 
      65       7029.45   3.48318e-05        3027.7   1.079e-08       0.001      113  LS failed, Hessian reset 
      99       7029.55   3.40105e-07       2820.44       0.603       0.603      152   
    Iter      log prob        ||dx||      ||grad||       alpha      alpha0  # evals  Notes 
     127       7029.56   9.06518e-09        3101.5       0.348       0.348      191   
Optimization terminated normally: 
  Convergence detected: absolute parameter change was below tolerance
      67       9582.43   8.07015e-09       3177.99      0.4382      0.4382       95   
Optimization terminated normally: 
  Convergence detected: absolute parameter change was below tolerance
      38       11811.9   0.000315025       3242.47   1.099e-07       0.001      106  LS failed, Hessian reset 
      99       14229.6   2.12903e-06       2791.26      0.7767      0.7767      139   
    Iter      log prob        ||dx||      ||grad||       alpha      alpha0  # evals  Notes 
      92       11813.2   3.42599e-09       3196.08      0.1672      0.1672      175   
Optimization terminated normally: 
  Convergence detected: absolute parameter change was below tolerance
     167       14230.8   1.33567e-08       3185.26      0.7112      0.7112      221   
Optimization terminated normally: 
  Convergence detected: relative gradient magnitude is below tolerance
[I 2020-10-01 03:47:26,509] Trial 372 finished with value: 0.04115056514336907 and parameters: {'changepoint_prior_scale': 0.0015453659324538252, 'seasonality_prior_scale': 0.5447313608834994, 'holidays_prior_scale': 0.22507477672858847, 'seasonality_mode': 'additive', 'changepoint_range': 0.550971709783359}. Best is trial 96 with value: 0.038883738900888705.
Initial log joint probability = -28.8311
    Iter      log prob        ||dx||      ||grad||       alpha      alpha0  # evals  Notes 
      99       18912.9   1.90685e-06       3628.03      0.9458      0.9458      122   
    Iter      log prob        ||dx||      ||grad||       alpha      alpha0  # evals  Notes 
     122         18913   1.69976e-08       3504.95      0.4548           1      156   
Optimization terminated normally: 
  Convergence detected: relative gradient magnitude is below tolerance
INFO:fbprophet:Making 5 forecasts with cutoffs between 2013-10-07 00:00:00 and 2015-10-18 00:00:00
INFO:fbprophet:Applying in parallel with <concurrent.futures.process.ProcessPoolExecutor object at 0x7fc84dbfded0>
Initial log joint probability = -8.95172
    Iter      log prob        ||dx||      ||grad||       alpha      alpha0  # evals  Notes 
Initial log joint probability = -12.7302
    Iter      log prob        ||dx||      ||grad||       alpha      alpha0  # evals  Notes 
Initial log joint probability = -15.1549
    Iter      log prob        ||dx||      ||grad||       alpha      alpha0  # evals  Notes 
Initial log joint probability = -18.717
    Iter      log prob        ||dx||      ||grad||       alpha      alpha0  # evals  Notes 
      57       4677.99   9.33336e-09       3884.33      0.3518      0.9773       81   
Optimization terminated normally: 
  Convergence detected: absolute parameter change was below tolerance
Initial log joint probability = -23.5879
    Iter      log prob        ||dx||      ||grad||       alpha      alpha0  # evals  Notes 
      99       7028.94   6.73878e-08        3314.5       0.246       0.246      129   
    Iter      log prob        ||dx||      ||grad||       alpha      alpha0  # evals  Notes 
     113       7028.94   4.62909e-09       3091.85       0.533       0.533      143   
Optimization terminated normally: 
  Convergence detected: absolute parameter change was below tolerance
      99        9582.6   6.39702e-08       3594.47      0.4106      0.4106      121   
    Iter      log prob        ||dx||      ||grad||       alpha      alpha0  # evals  Notes 
     104        9582.6   7.49372e-09       3736.14      0.4259      0.4259      127   
Optimization terminated normally: 
  Convergence detected: absolute parameter change was below tolerance
      35       11811.7   0.000273878       4365.15   8.247e-08       0.001       95  LS failed, Hessian reset 
      87       11813.3   5.50638e-09        3810.9      0.2729      0.2729      158   
Optimization terminated normally: 
  Convergence detected: absolute parameter change was below tolerance
      99       14232.8   1.05678e-07       4083.47      0.3602      0.3602      124   
    Iter      log prob        ||dx||      ||grad||       alpha      alpha0  # evals  Notes 
     146         14233   7.33025e-09       3933.92      0.4873      0.4873      183   
Optimization terminated normally: 
  Convergence detected: absolute parameter change was below tolerance
