[I 2020-10-01 03:24:07,166] Trial 281 finished with value: 0.04192935418960262 and parameters: {'changepoint_prior_scale': 0.001855832562093398, 'seasonality_prior_scale': 0.2815161028742993, 'holidays_prior_scale': 0.2539140405739782, 'seasonality_mode': 'additive', 'changepoint_range': 0.539142912511129}. Best is trial 96 with value: 0.038883738900888705.
Initial log joint probability = -28.8311
    Iter      log prob        ||dx||      ||grad||       alpha      alpha0  # evals  Notes 
      99       18912.7    1.9337e-06       2204.19           1           1      124   
    Iter      log prob        ||dx||      ||grad||       alpha      alpha0  # evals  Notes 
     131       18912.7    1.2325e-07       3286.42   3.914e-11       0.001      209  LS failed, Hessian reset 
     133       18912.7    2.8973e-08       1900.72           1           1      211   
Optimization terminated normally: 
  Convergence detected: relative gradient magnitude is below tolerance
INFO:fbprophet:Making 5 forecasts with cutoffs between 2013-10-07 00:00:00 and 2015-10-18 00:00:00
INFO:fbprophet:Applying in parallel with <concurrent.futures.process.ProcessPoolExecutor object at 0x7fc84dc2f2d0>
Initial log joint probability = -8.95172
    Iter      log prob        ||dx||      ||grad||       alpha      alpha0  # evals  Notes 
Initial log joint probability = -12.7302
    Iter      log prob        ||dx||      ||grad||       alpha      alpha0  # evals  Notes 
Initial log joint probability = -15.1549
    Iter      log prob        ||dx||      ||grad||       alpha      alpha0  # evals  Notes 
Initial log joint probability = -18.717
    Iter      log prob        ||dx||      ||grad||       alpha      alpha0  # evals  Notes 
Initial log joint probability = -23.5879
    Iter      log prob        ||dx||      ||grad||       alpha      alpha0  # evals  Notes 
      61       4675.53    0.00040584       3192.44   1.303e-07       0.001      113  LS failed, Hessian reset 
      86       4678.29   0.000336532       3171.72   1.153e-07       0.001      180  LS failed, Hessian reset 
      99       4678.97   5.40103e-06       3122.92       0.556       0.556      196   
    Iter      log prob        ||dx||      ||grad||       alpha      alpha0  # evals  Notes 
      99          7030   1.52852e-06       3261.48           1           1      124   
    Iter      log prob        ||dx||      ||grad||       alpha      alpha0  # evals  Notes 
     156       4679.01   7.17994e-09       3220.55      0.4586      0.4586      271   
Optimization terminated normally: 
  Convergence detected: absolute parameter change was below tolerance
      53       9582.42   1.47116e-06        2986.7    4.98e-10       0.001      122  LS failed, Hessian reset 
     127       7030.01   3.12333e-07       3011.85    9.69e-11       0.001      200  LS failed, Hessian reset 
      62       11813.2   1.10177e-08       3056.62      0.3023           1       90   
Optimization terminated normally: 
  Convergence detected: relative gradient magnitude is below tolerance
     135       7030.01   9.76878e-10        2954.4     0.05566     0.05566      211   
Optimization terminated normally: 
  Convergence detected: absolute parameter change was below tolerance
      83       9582.43    1.0291e-06        3131.8   3.181e-10       0.001      205  LS failed, Hessian reset 
      99       9582.43   5.48451e-08       2504.09      0.3897           1      227   
    Iter      log prob        ||dx||      ||grad||       alpha      alpha0  # evals  Notes 
      75       14232.8   9.08898e-05       2818.39   2.777e-08       0.001      136  LS failed, Hessian reset 
      99         14233   3.89254e-07        2432.7      0.3472      0.3472      167   
    Iter      log prob        ||dx||      ||grad||       alpha      alpha0  # evals  Notes 
     122       9582.44   1.77339e-06       2696.07   4.887e-10       0.001      301  LS failed, Hessian reset 
     146       9582.44   1.11309e-08       2972.44      0.3241      0.3241      330   
Optimization terminated normally: 
  Convergence detected: relative gradient magnitude is below tolerance
     156         14233   2.85177e-07       2331.54   1.039e-10       0.001      279  LS failed, Hessian reset 
     169         14233   1.22704e-08       2763.32     0.06675           1      298   
Optimization terminated normally: 
  Convergence detected: relative gradient magnitude is below tolerance
[I 2020-10-01 03:24:23,860] Trial 282 finished with value: 0.04161341117775872 and parameters: {'changepoint_prior_scale': 0.0016241537432301705, 'seasonality_prior_scale': 0.09331114336896579, 'holidays_prior_scale': 3.4069762959859204, 'seasonality_mode': 'additive', 'changepoint_range': 0.5479155003543524}. Best is trial 96 with value: 0.038883738900888705.
Initial log joint probability = -28.8311
    Iter      log prob        ||dx||      ||grad||       alpha      alpha0  # evals  Notes 
      99       18912.3   5.10567e-06       4278.22      0.8501      0.8501      123   
    Iter      log prob        ||dx||      ||grad||       alpha      alpha0  # evals  Notes 
     126       18912.4   1.45873e-08       4488.18      0.3534      0.8502      156   
Optimization terminated normally: 
  Convergence detected: relative gradient magnitude is below tolerance
INFO:fbprophet:Making 5 forecasts with cutoffs between 2013-10-07 00:00:00 and 2015-10-18 00:00:00
INFO:fbprophet:Applying in parallel with <concurrent.futures.process.ProcessPoolExecutor object at 0x7fc84dc28610>
Initial log joint probability = -8.95172
    Iter      log prob        ||dx||      ||grad||       alpha      alpha0  # evals  Notes 
Initial log joint probability = -12.7302
    Iter      log prob        ||dx||      ||grad||       alpha      alpha0  # evals  Notes 
Initial log joint probability = -15.1549
    Iter      log prob        ||dx||      ||grad||       alpha      alpha0  # evals  Notes 
Initial log joint probability = -18.717
    Iter      log prob        ||dx||      ||grad||       alpha      alpha0  # evals  Notes 
      62       4678.73   6.57644e-09        4475.9      0.2331      0.2331       79   
Optimization terminated normally: 
  Convergence detected: absolute parameter change was below tolerance
Initial log joint probability = -23.5879
    Iter      log prob        ||dx||      ||grad||       alpha      alpha0  # evals  Notes 
      99       7028.06   5.76049e-05       4444.68           1           1      119   
    Iter      log prob        ||dx||      ||grad||       alpha      alpha0  # evals  Notes 
      66       9582.04   7.60597e-09       4646.07      0.4461      0.4461       87   
Optimization terminated normally: 
  Convergence detected: absolute parameter change was below tolerance
     102       7028.21    5.7437e-05       4693.91   1.333e-08       0.001      170  LS failed, Hessian reset 
     138        7028.4   7.73772e-09       4337.62      0.2572      0.2572      218   
Optimization terminated normally: 
  Convergence detected: absolute parameter change was below tolerance
      79         11813   1.00296e-08       4358.22      0.7088      0.7088      115   
Optimization terminated normally: 
  Convergence detected: relative gradient magnitude is below tolerance
      99       14233.1   8.39797e-09       4416.43      0.3945           1      131   
Optimization terminated normally: 
  Convergence detected: absolute parameter change was below tolerance
[I 2020-10-01 03:24:39,404] Trial 283 finished with value: 0.04103311789235791 and parameters: {'changepoint_prior_scale': 0.0011140516406984856, 'seasonality_prior_scale': 0.10349392436493696, 'holidays_prior_scale': 0.11096809021236967, 'seasonality_mode': 'additive', 'changepoint_range': 0.5178955633919369}. Best is trial 96 with value: 0.038883738900888705.
Initial log joint probability = -28.8311
    Iter      log prob        ||dx||      ||grad||       alpha      alpha0  # evals  Notes 
      99       18912.8   6.01565e-08       3571.05           1           1      125   
    Iter      log prob        ||dx||      ||grad||       alpha      alpha0  # evals  Notes 
     102       18912.8   2.15088e-08       3635.42      0.1508           1      129   
Optimization terminated normally: 
  Convergence detected: relative gradient magnitude is below tolerance
INFO:fbprophet:Making 5 forecasts with cutoffs between 2013-10-07 00:00:00 and 2015-10-18 00:00:00
INFO:fbprophet:Applying in parallel with <concurrent.futures.process.ProcessPoolExecutor object at 0x7fc84dbf93d0>
Initial log joint probability = -8.95172
    Iter      log prob        ||dx||      ||grad||       alpha      alpha0  # evals  Notes 
Initial log joint probability = -12.7302
    Iter      log prob        ||dx||      ||grad||       alpha      alpha0  # evals  Notes 
Initial log joint probability = -15.1549
    Iter      log prob        ||dx||      ||grad||       alpha      alpha0  # evals  Notes 
      82       4679.07   9.99373e-09       3696.17           1           1      115   
Optimization terminated normally: 
  Convergence detected: absolute parameter change was below tolerance
Initial log joint probability = -18.717
    Iter      log prob        ||dx||      ||grad||       alpha      alpha0  # evals  Notes 
Initial log joint probability = -23.5879
    Iter      log prob        ||dx||      ||grad||       alpha      alpha0  # evals  Notes 
      99       7029.04   9.61657e-07       4051.16      0.4187           1      128   
    Iter      log prob        ||dx||      ||grad||       alpha      alpha0  # evals  Notes 
      99       9582.17   7.28511e-08       3330.44           1           1      130   
    Iter      log prob        ||dx||      ||grad||       alpha      alpha0  # evals  Notes 
     104       9582.17   1.04368e-08       3461.89       0.873       0.873      139   
Optimization terminated normally: 
  Convergence detected: relative gradient magnitude is below tolerance
     183       7031.45   5.15523e-09       3783.69      0.1367      0.1367      234   
Optimization terminated normally: 
  Convergence detected: absolute parameter change was below tolerance
      55       11813.3   3.99329e-09       3563.52      0.1046      0.1046       80   
Optimization terminated normally: 
  Convergence detected: absolute parameter change was below tolerance
      99       14233.5   6.14631e-08       3630.09      0.2806           1      132   
    Iter      log prob        ||dx||      ||grad||       alpha      alpha0  # evals  Notes 
     105       14233.5   8.61069e-09       3563.18      0.3081      0.3081      140   
Optimization terminated normally: 
  Convergence detected: absolute parameter change was below tolerance
[I 2020-10-01 03:24:54,254] Trial 284 finished with value: 0.041726912029053265 and parameters: {'changepoint_prior_scale': 0.0013150791461413137, 'seasonality_prior_scale': 0.2860803589830494, 'holidays_prior_scale': 0.18984740785286033, 'seasonality_mode': 'additive', 'changepoint_range': 0.5284995378064016}. Best is trial 96 with value: 0.038883738900888705.
Initial log joint probability = -28.8311
    Iter      log prob        ||dx||      ||grad||       alpha      alpha0  # evals  Notes 
      99       18912.8   5.27395e-07        3184.4      0.3403           1      131   
    Iter      log prob        ||dx||      ||grad||       alpha      alpha0  # evals  Notes 
     118       18912.8   3.85134e-09       3525.59      0.1488      0.1488      156   
Optimization terminated normally: 
  Convergence detected: absolute parameter change was below tolerance
INFO:fbprophet:Making 5 forecasts with cutoffs between 2013-10-07 00:00:00 and 2015-10-18 00:00:00
INFO:fbprophet:Applying in parallel with <concurrent.futures.process.ProcessPoolExecutor object at 0x7fc84dc04610>
Initial log joint probability = -8.95172
    Iter      log prob        ||dx||      ||grad||       alpha      alpha0  # evals  Notes 
Initial log joint probability = -12.7302
    Iter      log prob        ||dx||      ||grad||       alpha      alpha0  # evals  Notes 
Initial log joint probability = -15.1549
    Iter      log prob        ||dx||      ||grad||       alpha      alpha0  # evals  Notes 
Initial log joint probability = -18.717
    Iter      log prob        ||dx||      ||grad||       alpha      alpha0  # evals  Notes 
Initial log joint probability = -23.5879
    Iter      log prob        ||dx||      ||grad||       alpha      alpha0  # evals  Notes 
      91       4679.14   6.61814e-09       3500.61      0.4957      0.4957      121   
Optimization terminated normally: 
  Convergence detected: absolute parameter change was below tolerance
      80       7028.54   1.13095e-05       3192.24   3.664e-09       0.001      142  LS failed, Hessian reset 
      99       7028.63   8.08446e-07       2737.22           1           1      166   
    Iter      log prob        ||dx||      ||grad||       alpha      alpha0  # evals  Notes 
     121       7028.63   8.79952e-09       3183.85       0.393           1      195   
Optimization terminated normally: 
  Convergence detected: absolute parameter change was below tolerance
      65       9582.41      3.38e-07       3454.65   9.703e-11       0.001      133  LS failed, Hessian reset 
      73       11813.1   3.07879e-09       3251.46       0.239       0.239       99   
Optimization terminated normally: 
  Convergence detected: absolute parameter change was below tolerance
      79       9582.41    6.5229e-09       3047.55      0.7631      0.7631      152   
Optimization terminated normally: 
  Convergence detected: absolute parameter change was below tolerance
      72       14231.8   5.00505e-05        3547.2   1.872e-08       0.001      140  LS failed, Hessian reset 
      99       14231.9   3.01647e-07       2687.77      0.1988       0.613      177   
    Iter      log prob        ||dx||      ||grad||       alpha      alpha0  # evals  Notes 
     147       14231.9   1.56107e-08       2315.37      0.2525      0.8036      245   
Optimization terminated normally: 
  Convergence detected: relative gradient magnitude is below tolerance
[I 2020-10-01 03:25:09,040] Trial 285 finished with value: 0.04047038507868652 and parameters: {'changepoint_prior_scale': 0.0014282188339379861, 'seasonality_prior_scale': 0.1357343633820572, 'holidays_prior_scale': 0.16258405027421058, 'seasonality_mode': 'additive', 'changepoint_range': 0.5603579114993118}. Best is trial 96 with value: 0.038883738900888705.
Initial log joint probability = -28.8311
    Iter      log prob        ||dx||      ||grad||       alpha      alpha0  # evals  Notes 
      99       18912.2   0.000302893       4270.14      0.9621      0.9621      119   
    Iter      log prob        ||dx||      ||grad||       alpha      alpha0  # evals  Notes 
     180       18912.9   7.21907e-09       4547.26      0.3007      0.3007      217   
Optimization terminated normally: 
  Convergence detected: absolute parameter change was below tolerance
INFO:fbprophet:Making 5 forecasts with cutoffs between 2013-10-07 00:00:00 and 2015-10-18 00:00:00
INFO:fbprophet:Applying in parallel with <concurrent.futures.process.ProcessPoolExecutor object at 0x7fc84dc0bfd0>
Initial log joint probability = -8.95172
    Iter      log prob        ||dx||      ||grad||       alpha      alpha0  # evals  Notes 
Initial log joint probability = -12.7302
    Iter      log prob        ||dx||      ||grad||       alpha      alpha0  # evals  Notes 
Initial log joint probability = -15.1549
    Iter      log prob        ||dx||      ||grad||       alpha      alpha0  # evals  Notes 
Initial log joint probability = -18.717
    Iter      log prob        ||dx||      ||grad||       alpha      alpha0  # evals  Notes 
      63       4679.12   5.04899e-09          4365      0.2961      0.2961       83   
Optimization terminated normally: 
  Convergence detected: absolute parameter change was below tolerance
Initial log joint probability = -23.5879
    Iter      log prob        ||dx||      ||grad||       alpha      alpha0  # evals  Notes 
      64        9582.4    4.7668e-09       3724.09      0.1505      0.1505       90   
Optimization terminated normally: 
  Convergence detected: absolute parameter change was below tolerance
      94       7027.76   2.11069e-05       4268.54   4.792e-09       0.001      170  LS failed, Hessian reset 
      99       7027.83   3.32316e-06       4343.12      0.5379      0.5379      175   
    Iter      log prob        ||dx||      ||grad||       alpha      alpha0  # evals  Notes 
     139       7027.96   7.22069e-09       3749.73       0.536       0.536      236   
Optimization terminated normally: 
  Convergence detected: absolute parameter change was below tolerance
      63       11813.1   2.82617e-05       4757.16   6.054e-09       0.001      130  LS failed, Hessian reset 
      89       11813.2   8.16085e-09       4284.94      0.2995      0.2995      163   
Optimization terminated normally: 
  Convergence detected: absolute parameter change was below tolerance
      99       14231.1   1.42868e-06       4517.19      0.3108      0.7659      131   
    Iter      log prob        ||dx||      ||grad||       alpha      alpha0  # evals  Notes 
     113       14231.1   8.09308e-09       4326.78      0.3486      0.3486      147   
Optimization terminated normally: 
  Convergence detected: absolute parameter change was below tolerance
[I 2020-10-01 03:25:25,591] Trial 286 finished with value: 0.041117638182088564 and parameters: {'changepoint_prior_scale': 0.001108338040820514, 'seasonality_prior_scale': 0.6189920982258339, 'holidays_prior_scale': 0.20523627474796546, 'seasonality_mode': 'additive', 'changepoint_range': 0.5618434228365808}. Best is trial 96 with value: 0.038883738900888705.
Initial log joint probability = -28.8311
    Iter      log prob        ||dx||      ||grad||       alpha      alpha0  # evals  Notes 
      99       18912.7   8.52193e-08       3666.38      0.4617      0.4617      127   
    Iter      log prob        ||dx||      ||grad||       alpha      alpha0  # evals  Notes 
     164       18912.8   1.74451e-08       3552.67      0.4256           1      202   
Optimization terminated normally: 
  Convergence detected: relative gradient magnitude is below tolerance
INFO:fbprophet:Making 5 forecasts with cutoffs between 2013-10-07 00:00:00 and 2015-10-18 00:00:00
INFO:fbprophet:Applying in parallel with <concurrent.futures.process.ProcessPoolExecutor object at 0x7fc84dc256d0>
Initial log joint probability = -8.95172
    Iter      log prob        ||dx||      ||grad||       alpha      alpha0  # evals  Notes 
Initial log joint probability = -12.7302
    Iter      log prob        ||dx||      ||grad||       alpha      alpha0  # evals  Notes 
Initial log joint probability = -15.1549
    Iter      log prob        ||dx||      ||grad||       alpha      alpha0  # evals  Notes 
Initial log joint probability = -18.717
    Iter      log prob        ||dx||      ||grad||       alpha      alpha0  # evals  Notes 
Initial log joint probability = -23.5879
      70       4678.94   7.10275e-09        3690.1      0.3659           1       91   
Optimization terminated normally: 
  Convergence detected: absolute parameter change was below tolerance
    Iter      log prob        ||dx||      ||grad||       alpha      alpha0  # evals  Notes 
      74       7028.78   2.94918e-05       3435.53   7.957e-09       0.001      127  LS failed, Hessian reset 
      64       9582.54   5.05829e-09       3163.17      0.5621      0.5621       89   
Optimization terminated normally: 
  Convergence detected: absolute parameter change was below tolerance
      99       7028.89   3.04794e-07       2848.69      0.7245      0.7245      159   
    Iter      log prob        ||dx||      ||grad||       alpha      alpha0  # evals  Notes 
      29       11811.5   0.000360969       3533.07   1.042e-07       0.001       79  LS failed, Hessian reset 
     142       7028.89   9.48094e-09       3608.94      0.3125      0.3125      210   
Optimization terminated normally: 
  Convergence detected: absolute parameter change was below tolerance
      80       11813.3   5.50202e-09       3577.46      0.2966      0.2966      142   
Optimization terminated normally: 
  Convergence detected: absolute parameter change was below tolerance
      97       14233.1   5.81428e-09       3347.36      0.4673      0.4673      121   
Optimization terminated normally: 
  Convergence detected: absolute parameter change was below tolerance
