[I 2020-10-01 03:41:38,404] Trial 349 finished with value: 0.04110667829915196 and parameters: {'changepoint_prior_scale': 0.0011418079366938797, 'seasonality_prior_scale': 0.29344486820950455, 'holidays_prior_scale': 3.869936000332366, 'seasonality_mode': 'additive', 'changepoint_range': 0.5561858637709504}. Best is trial 96 with value: 0.038883738900888705.
Initial log joint probability = -28.8311
    Iter      log prob        ||dx||      ||grad||       alpha      alpha0  # evals  Notes 
      99       18912.9   4.52153e-06       3618.24           1           1      121   
    Iter      log prob        ||dx||      ||grad||       alpha      alpha0  # evals  Notes 
     124       18912.9   4.23708e-08       3432.67           1           1      155   
Optimization terminated normally: 
  Convergence detected: relative gradient magnitude is below tolerance
INFO:fbprophet:Making 5 forecasts with cutoffs between 2013-10-07 00:00:00 and 2015-10-18 00:00:00
INFO:fbprophet:Applying in parallel with <concurrent.futures.process.ProcessPoolExecutor object at 0x7fc84dc20390>
Initial log joint probability = -8.95172
    Iter      log prob        ||dx||      ||grad||       alpha      alpha0  # evals  Notes 
Initial log joint probability = -12.7302
    Iter      log prob        ||dx||      ||grad||       alpha      alpha0  # evals  Notes 
Initial log joint probability = -15.1549
    Iter      log prob        ||dx||      ||grad||       alpha      alpha0  # evals  Notes 
Initial log joint probability = -18.717
    Iter      log prob        ||dx||      ||grad||       alpha      alpha0  # evals  Notes 
Initial log joint probability = -23.5879
    Iter      log prob        ||dx||      ||grad||       alpha      alpha0  # evals  Notes 
      71       4679.13   1.45497e-06       3264.74   3.712e-10       0.001      142  LS failed, Hessian reset 
      90       4679.14   8.85224e-09       3244.66           1           1      168   
Optimization terminated normally: 
  Convergence detected: absolute parameter change was below tolerance
      96       7028.82   9.08739e-09       3419.68      0.2189      0.2189      125   
Optimization terminated normally: 
  Convergence detected: absolute parameter change was below tolerance
      33       11811.7   0.000226724        3309.3    7.95e-08       0.001       84  LS failed, Hessian reset 
      85       9582.51   5.32932e-09       3328.19      0.3353      0.3353      123   
Optimization terminated normally: 
  Convergence detected: absolute parameter change was below tolerance
      85       11813.1   6.40836e-09          3538      0.3955           1      151   
Optimization terminated normally: 
  Convergence detected: absolute parameter change was below tolerance
      99       14233.1   1.84643e-07        3078.7           1           1      126   
    Iter      log prob        ||dx||      ||grad||       alpha      alpha0  # evals  Notes 
     111       14233.1   1.30276e-08       3529.13      0.5071      0.5071      143   
Optimization terminated normally: 
  Convergence detected: relative gradient magnitude is below tolerance
[I 2020-10-01 03:41:52,570] Trial 350 finished with value: 0.0406155612121463 and parameters: {'changepoint_prior_scale': 0.0014203442714361303, 'seasonality_prior_scale': 0.45155597984504975, 'holidays_prior_scale': 0.16767826184916157, 'seasonality_mode': 'additive', 'changepoint_range': 0.5359378478064696}. Best is trial 96 with value: 0.038883738900888705.
Initial log joint probability = -28.8311
    Iter      log prob        ||dx||      ||grad||       alpha      alpha0  # evals  Notes 
      99       18912.7   4.53414e-08       2711.91      0.5541      0.5541      124   
    Iter      log prob        ||dx||      ||grad||       alpha      alpha0  # evals  Notes 
     107       18912.7   3.19138e-08       2681.59      0.7876      0.7876      134   
Optimization terminated normally: 
  Convergence detected: relative gradient magnitude is below tolerance
INFO:fbprophet:Making 5 forecasts with cutoffs between 2013-10-07 00:00:00 and 2015-10-18 00:00:00
INFO:fbprophet:Applying in parallel with <concurrent.futures.process.ProcessPoolExecutor object at 0x7fc84dc25b50>
Initial log joint probability = -8.95172
    Iter      log prob        ||dx||      ||grad||       alpha      alpha0  # evals  Notes 
Initial log joint probability = -12.7302
    Iter      log prob        ||dx||      ||grad||       alpha      alpha0  # evals  Notes 
Initial log joint probability = -15.1549
    Iter      log prob        ||dx||      ||grad||       alpha      alpha0  # evals  Notes 
Initial log joint probability = -18.717
    Iter      log prob        ||dx||      ||grad||       alpha      alpha0  # evals  Notes 
      61       4679.31   6.94159e-09       2897.37      0.6115      0.6115       88   
Optimization terminated normally: 
  Convergence detected: absolute parameter change was below tolerance
Initial log joint probability = -23.5879
    Iter      log prob        ||dx||      ||grad||       alpha      alpha0  # evals  Notes 
      99       7030.86   0.000207792       2737.64      0.6782      0.6782      118   
    Iter      log prob        ||dx||      ||grad||       alpha      alpha0  # evals  Notes 
      99       9582.49   2.24364e-07        2855.8           1           1      124   
    Iter      log prob        ||dx||      ||grad||       alpha      alpha0  # evals  Notes 
      65       11813.3   8.83933e-09       2933.68      0.4447      0.4447       89   
Optimization terminated normally: 
  Convergence detected: absolute parameter change was below tolerance
     170       7031.98   9.85985e-09       3142.35      0.3922      0.3922      208   
Optimization terminated normally: 
  Convergence detected: absolute parameter change was below tolerance
     107       9582.49    2.2527e-09       2711.06      0.1341      0.1341      135   
Optimization terminated normally: 
  Convergence detected: absolute parameter change was below tolerance
      99       14233.3   1.17861e-07       2434.94           1           1      131   
    Iter      log prob        ||dx||      ||grad||       alpha      alpha0  # evals  Notes 
     120       14233.4   3.80103e-07        2484.4   1.309e-10       0.001      199  LS failed, Hessian reset 
     139       14233.4   8.36046e-09       2407.49      0.4879      0.4879      221   
Optimization terminated normally: 
  Convergence detected: absolute parameter change was below tolerance
[I 2020-10-01 03:42:07,637] Trial 351 finished with value: 0.04158571251684159 and parameters: {'changepoint_prior_scale': 0.0017217798394245662, 'seasonality_prior_scale': 0.6388327706095491, 'holidays_prior_scale': 0.17250876597910186, 'seasonality_mode': 'additive', 'changepoint_range': 0.5248938378475242}. Best is trial 96 with value: 0.038883738900888705.
Initial log joint probability = -28.8311
    Iter      log prob        ||dx||      ||grad||       alpha      alpha0  # evals  Notes 
      99         18913   2.80808e-07       3073.53      0.1839           1      126   
    Iter      log prob        ||dx||      ||grad||       alpha      alpha0  # evals  Notes 
     126         18913   3.10999e-08       3124.02      0.1796           1      167   
Optimization terminated normally: 
  Convergence detected: relative gradient magnitude is below tolerance
INFO:fbprophet:Making 5 forecasts with cutoffs between 2013-10-07 00:00:00 and 2015-10-18 00:00:00
INFO:fbprophet:Applying in parallel with <concurrent.futures.process.ProcessPoolExecutor object at 0x7fc84dc204d0>
Initial log joint probability = -8.95172
    Iter      log prob        ||dx||      ||grad||       alpha      alpha0  # evals  Notes 
Initial log joint probability = -12.7302
    Iter      log prob        ||dx||      ||grad||       alpha      alpha0  # evals  Notes 
Initial log joint probability = -15.1549
    Iter      log prob        ||dx||      ||grad||       alpha      alpha0  # evals  Notes 
Initial log joint probability = -18.717
    Iter      log prob        ||dx||      ||grad||       alpha      alpha0  # evals  Notes 
Initial log joint probability = -23.5879
    Iter      log prob        ||dx||      ||grad||       alpha      alpha0  # evals  Notes 
      73       4679.09   9.53556e-09       3035.62      0.3644      0.3644       98   
Optimization terminated normally: 
  Convergence detected: absolute parameter change was below tolerance
      79       7029.28   5.74566e-05       3637.17   1.844e-08       0.001      135  LS failed, Hessian reset 
      99       7029.43   8.06055e-07       3211.42      0.7407      0.7407      161   
    Iter      log prob        ||dx||      ||grad||       alpha      alpha0  # evals  Notes 
      75       9582.52   5.31682e-09       3304.94      0.6052      0.6052      103   
Optimization terminated normally: 
  Convergence detected: absolute parameter change was below tolerance
     135       7029.43   5.53444e-09       3026.74     0.04911           1      206   
Optimization terminated normally: 
  Convergence detected: absolute parameter change was below tolerance
      70       11813.3   7.67524e-09        3336.7      0.4454      0.4454      100   
Optimization terminated normally: 
  Convergence detected: absolute parameter change was below tolerance
      99       14232.8   6.52832e-07       3052.02      0.3341           1      131   
    Iter      log prob        ||dx||      ||grad||       alpha      alpha0  # evals  Notes 
     128       14232.8   3.34844e-08        2887.4           1           1      170   
Optimization terminated normally: 
  Convergence detected: relative gradient magnitude is below tolerance
[I 2020-10-01 03:42:22,709] Trial 352 finished with value: 0.04062008301004749 and parameters: {'changepoint_prior_scale': 0.0015090486214934626, 'seasonality_prior_scale': 0.568778423088578, 'holidays_prior_scale': 0.18765532843319077, 'seasonality_mode': 'additive', 'changepoint_range': 0.5363810178453852}. Best is trial 96 with value: 0.038883738900888705.
Initial log joint probability = -28.8311
    Iter      log prob        ||dx||      ||grad||       alpha      alpha0  # evals  Notes 
      78       18912.9   1.10213e-05       2270.92   5.761e-09       0.001      157  LS failed, Hessian reset 
      99         18913    4.0284e-08          2234      0.1995      0.1995      182   
    Iter      log prob        ||dx||      ||grad||       alpha      alpha0  # evals  Notes 
     116         18913   1.28536e-08       2103.19      0.3028           1      204   
Optimization terminated normally: 
  Convergence detected: relative gradient magnitude is below tolerance
INFO:fbprophet:Making 5 forecasts with cutoffs between 2013-10-07 00:00:00 and 2015-10-18 00:00:00
INFO:fbprophet:Applying in parallel with <concurrent.futures.process.ProcessPoolExecutor object at 0x7fc84dc20210>
Initial log joint probability = -8.95172
    Iter      log prob        ||dx||      ||grad||       alpha      alpha0  # evals  Notes 
Initial log joint probability = -12.7302
    Iter      log prob        ||dx||      ||grad||       alpha      alpha0  # evals  Notes 
Initial log joint probability = -15.1549
    Iter      log prob        ||dx||      ||grad||       alpha      alpha0  # evals  Notes 
Initial log joint probability = -18.717
    Iter      log prob        ||dx||      ||grad||       alpha      alpha0  # evals  Notes 
      56       4679.45   7.87413e-09       2323.58      0.6427      0.6427       78   
Optimization terminated normally: 
  Convergence detected: absolute parameter change was below tolerance
Initial log joint probability = -23.5879
    Iter      log prob        ||dx||      ||grad||       alpha      alpha0  # evals  Notes 
      99       7031.68   0.000111269        2231.4       0.393           1      126   
    Iter      log prob        ||dx||      ||grad||       alpha      alpha0  # evals  Notes 
      69       9581.81   6.44048e-09       2257.92      0.2152      0.2152       94   
Optimization terminated normally: 
  Convergence detected: absolute parameter change was below tolerance
     126       7031.96   5.40051e-05       2335.27   2.435e-08       0.001      195  LS failed, Hessian reset 
     160       7032.08   8.71876e-09       2327.88      0.7191      0.7191      237   
Optimization terminated normally: 
  Convergence detected: absolute parameter change was below tolerance
      90       11812.8   6.96947e-05       2417.71   2.999e-08       0.001      186  LS failed, Hessian reset 
      99         11813     6.782e-06        2169.3      0.3544      0.3544      196   
    Iter      log prob        ||dx||      ||grad||       alpha      alpha0  # evals  Notes 
      99       14232.7   6.61603e-05       2381.64           1           1      127   
    Iter      log prob        ||dx||      ||grad||       alpha      alpha0  # evals  Notes 
     164       11813.1   9.76602e-09        2148.4      0.2862      0.2862      281   
Optimization terminated normally: 
  Convergence detected: absolute parameter change was below tolerance
     149       14232.9    1.1756e-06       2430.38   6.532e-10       0.001      244  LS failed, Hessian reset 
     161       14232.9   2.51685e-08       1941.51      0.2677      0.8485      261   
Optimization terminated normally: 
  Convergence detected: relative gradient magnitude is below tolerance
[I 2020-10-01 03:42:38,574] Trial 353 finished with value: 0.041815686956703235 and parameters: {'changepoint_prior_scale': 0.0021596486627037175, 'seasonality_prior_scale': 0.5264889598520011, 'holidays_prior_scale': 0.19420310418806286, 'seasonality_mode': 'additive', 'changepoint_range': 0.5096199659630202}. Best is trial 96 with value: 0.038883738900888705.
Initial log joint probability = -28.8311
    Iter      log prob        ||dx||      ||grad||       alpha      alpha0  # evals  Notes 
      99       18912.5   1.43724e-05       2839.39           1           1      122   
    Iter      log prob        ||dx||      ||grad||       alpha      alpha0  # evals  Notes 
     175       18912.7   1.76201e-08       2793.73           1           1      219   
Optimization terminated normally: 
  Convergence detected: relative gradient magnitude is below tolerance
INFO:fbprophet:Making 5 forecasts with cutoffs between 2013-10-07 00:00:00 and 2015-10-18 00:00:00
INFO:fbprophet:Applying in parallel with <concurrent.futures.process.ProcessPoolExecutor object at 0x7fc84dc0a190>
Initial log joint probability = -8.95172
    Iter      log prob        ||dx||      ||grad||       alpha      alpha0  # evals  Notes 
Initial log joint probability = -12.7302
    Iter      log prob        ||dx||      ||grad||       alpha      alpha0  # evals  Notes 
Initial log joint probability = -15.1549
    Iter      log prob        ||dx||      ||grad||       alpha      alpha0  # evals  Notes 
Initial log joint probability = -18.717
    Iter      log prob        ||dx||      ||grad||       alpha      alpha0  # evals  Notes 
Initial log joint probability = -23.5879
    Iter      log prob        ||dx||      ||grad||       alpha      alpha0  # evals  Notes 
      90       4679.14   4.64541e-09       3116.03      0.6292      0.6292      116   
Optimization terminated normally: 
  Convergence detected: absolute parameter change was below tolerance
      88        7029.5   2.33527e-05       3128.33   7.012e-09       0.001      144  LS failed, Hessian reset 
      61       9582.52    9.8344e-09       2987.68      0.2573      0.2573       90   
Optimization terminated normally: 
  Convergence detected: absolute parameter change was below tolerance
      99       7029.59   1.09258e-05       2724.76           1           1      157   
    Iter      log prob        ||dx||      ||grad||       alpha      alpha0  # evals  Notes 
      75       11813.3   5.21018e-09       3294.22      0.2846      0.2846      109   
Optimization terminated normally: 
  Convergence detected: absolute parameter change was below tolerance
     143       7029.61    3.4398e-07       3340.28   1.125e-10       0.001      249  LS failed, Hessian reset 
     153       7029.61   6.63213e-09       3069.51      0.2674      0.2674      261   
Optimization terminated normally: 
  Convergence detected: absolute parameter change was below tolerance
      99       14233.2   0.000127396        3118.2      0.1668           1      130   
    Iter      log prob        ||dx||      ||grad||       alpha      alpha0  # evals  Notes 
     132       14233.3   3.48027e-06       3221.18   1.083e-09       0.001      214  LS failed, Hessian reset 
     161       14233.3   8.62896e-09       3106.52      0.1628           1      248   
Optimization terminated normally: 
  Convergence detected: absolute parameter change was below tolerance
[I 2020-10-01 03:42:54,801] Trial 354 finished with value: 0.04092672886921797 and parameters: {'changepoint_prior_scale': 0.0015151588129913725, 'seasonality_prior_scale': 0.7089888870172475, 'holidays_prior_scale': 0.2152330702799675, 'seasonality_mode': 'additive', 'changepoint_range': 0.5367641210423517}. Best is trial 96 with value: 0.038883738900888705.
Initial log joint probability = -28.8311
    Iter      log prob        ||dx||      ||grad||       alpha      alpha0  # evals  Notes 
      99       18912.3   1.29047e-06       3393.81      0.1839           1      125   
    Iter      log prob        ||dx||      ||grad||       alpha      alpha0  # evals  Notes 
     118       18912.4    3.2114e-08       3690.17      0.7801      0.7801      148   
Optimization terminated normally: 
  Convergence detected: relative gradient magnitude is below tolerance
INFO:fbprophet:Making 5 forecasts with cutoffs between 2013-10-07 00:00:00 and 2015-10-18 00:00:00
INFO:fbprophet:Applying in parallel with <concurrent.futures.process.ProcessPoolExecutor object at 0x7fc84dbe89d0>
Initial log joint probability = -8.95172
    Iter      log prob        ||dx||      ||grad||       alpha      alpha0  # evals  Notes 
Initial log joint probability = -12.7302
    Iter      log prob        ||dx||      ||grad||       alpha      alpha0  # evals  Notes 
Initial log joint probability = -15.1549
    Iter      log prob        ||dx||      ||grad||       alpha      alpha0  # evals  Notes 
Initial log joint probability = -18.717
    Iter      log prob        ||dx||      ||grad||       alpha      alpha0  # evals  Notes 
Initial log joint probability = -23.5879
    Iter      log prob        ||dx||      ||grad||       alpha      alpha0  # evals  Notes 
      65       4678.78   3.90796e-05       3873.36    1.06e-08       0.001      143  LS failed, Hessian reset 
      99       4679.29     1.045e-07       3679.14      0.2143       0.949      187   
    Iter      log prob        ||dx||      ||grad||       alpha      alpha0  # evals  Notes 
     107       4679.29   3.24519e-09       3727.13      0.1829      0.1829      196   
Optimization terminated normally: 
  Convergence detected: absolute parameter change was below tolerance
      99       7028.97   6.64977e-06       3316.53           1           1      125   
    Iter      log prob        ||dx||      ||grad||       alpha      alpha0  # evals  Notes 
      45       9582.41    3.7251e-05       3950.43   9.801e-09       0.001      107  LS failed, Hessian reset 
      33       11811.8   0.000245662       3350.39   6.221e-08       0.001       90  LS failed, Hessian reset 
     199       7031.57   1.42443e-05       3729.29      0.2994      0.2994      247   
    Iter      log prob        ||dx||      ||grad||       alpha      alpha0  # evals  Notes 
     239       7031.83    1.1579e-08       3709.36      0.7409      0.7409      300   
Optimization terminated normally: 
  Convergence detected: relative gradient magnitude is below tolerance
      95        9582.5   8.93506e-08       3800.69   2.357e-11       0.001      206  LS failed, Hessian reset 
      99        9582.5   2.88483e-08        3155.1      0.6647           1      211   
    Iter      log prob        ||dx||      ||grad||       alpha      alpha0  # evals  Notes 
     101        9582.5   7.48057e-09        3656.9        0.34        0.34      213   
Optimization terminated normally: 
  Convergence detected: absolute parameter change was below tolerance
      99       11813.2   7.29145e-07       3691.48       0.513       0.513      170   
    Iter      log prob        ||dx||      ||grad||       alpha      alpha0  # evals  Notes 
      99       14233.1   3.12438e-07       3754.96           1           1      130   
    Iter      log prob        ||dx||      ||grad||       alpha      alpha0  # evals  Notes 
     110       11813.2   8.69594e-09       3680.46      0.3843      0.3843      185   
Optimization terminated normally: 
  Convergence detected: absolute parameter change was below tolerance
     111       14233.1   7.60806e-09       3516.18      0.3295      0.3295      146   
Optimization terminated normally: 
  Convergence detected: absolute parameter change was below tolerance
