[I 2020-10-01 02:38:01,935] Trial 99 finished with value: 0.04155544796227489 and parameters: {'changepoint_prior_scale': 0.0016244520170877207, 'seasonality_prior_scale': 0.2759140563869009, 'holidays_prior_scale': 0.13432551082881503, 'seasonality_mode': 'additive', 'changepoint_range': 0.5347830312299137}. Best is trial 96 with value: 0.038883738900888705.
Initial log joint probability = -28.8311
    Iter      log prob        ||dx||      ||grad||       alpha      alpha0  # evals  Notes 
      99       18912.6   7.20549e-05       4317.42       1.039      0.2316      127   
    Iter      log prob        ||dx||      ||grad||       alpha      alpha0  # evals  Notes 
     154       18912.7    7.4206e-09       4132.77       0.487       0.487      194   
Optimization terminated normally: 
  Convergence detected: absolute parameter change was below tolerance
INFO:fbprophet:Making 5 forecasts with cutoffs between 2013-10-07 00:00:00 and 2015-10-18 00:00:00
INFO:fbprophet:Applying in parallel with <concurrent.futures.process.ProcessPoolExecutor object at 0x7fc88e651510>
Initial log joint probability = -8.95172
    Iter      log prob        ||dx||      ||grad||       alpha      alpha0  # evals  Notes 
Initial log joint probability = -12.7302
    Iter      log prob        ||dx||      ||grad||       alpha      alpha0  # evals  Notes 
Initial log joint probability = -15.1549
    Iter      log prob        ||dx||      ||grad||       alpha      alpha0  # evals  Notes 
Initial log joint probability = -18.717
    Iter      log prob        ||dx||      ||grad||       alpha      alpha0  # evals  Notes 
Initial log joint probability = -23.5879
    Iter      log prob        ||dx||      ||grad||       alpha      alpha0  # evals  Notes 
      49       4671.79   0.000533676       3849.56   1.659e-07       0.001      114  LS failed, Hessian reset 
      99       4678.93    6.5348e-08       4331.73      0.2233           1      178   
    Iter      log prob        ||dx||      ||grad||       alpha      alpha0  # evals  Notes 
     100       4678.93   5.53956e-09       4220.49      0.1699      0.1699      179   
Optimization terminated normally: 
  Convergence detected: absolute parameter change was below tolerance
      98       7028.38   9.66317e-09       4325.15       0.422       0.422      124   
Optimization terminated normally: 
  Convergence detected: absolute parameter change was below tolerance
      58       9582.37   3.52727e-09       4097.05      0.2916      0.2916       89   
Optimization terminated normally: 
  Convergence detected: absolute parameter change was below tolerance
      58       11813.1   7.47158e-09       4123.73      0.4918      0.4918       83   
Optimization terminated normally: 
  Convergence detected: absolute parameter change was below tolerance
      99       14233.4   1.72232e-08        4168.6       0.484       0.484      130   
    Iter      log prob        ||dx||      ||grad||       alpha      alpha0  # evals  Notes 
     104       14233.4   9.02862e-09       4024.34      0.3632           1      136   
Optimization terminated normally: 
  Convergence detected: absolute parameter change was below tolerance
[I 2020-10-01 02:38:12,550] Trial 100 finished with value: 0.04173068133212834 and parameters: {'changepoint_prior_scale': 0.0011462979052516524, 'seasonality_prior_scale': 0.1468152632184004, 'holidays_prior_scale': 0.050495068531562916, 'seasonality_mode': 'additive', 'changepoint_range': 0.5796680631577004}. Best is trial 96 with value: 0.038883738900888705.
Initial log joint probability = -28.8311
    Iter      log prob        ||dx||      ||grad||       alpha      alpha0  # evals  Notes 
      99       18912.6   3.25149e-05       4158.79      0.7075      0.7075      124   
    Iter      log prob        ||dx||      ||grad||       alpha      alpha0  # evals  Notes 
     140       18912.9   6.13477e-09       3633.26      0.3261      0.3261      178   
Optimization terminated normally: 
  Convergence detected: absolute parameter change was below tolerance
INFO:fbprophet:Making 5 forecasts with cutoffs between 2013-10-07 00:00:00 and 2015-10-18 00:00:00
INFO:fbprophet:Applying in parallel with <concurrent.futures.process.ProcessPoolExecutor object at 0x7fc88e683390>
Initial log joint probability = -8.95172
    Iter      log prob        ||dx||      ||grad||       alpha      alpha0  # evals  Notes 
Initial log joint probability = -12.7302
    Iter      log prob        ||dx||      ||grad||       alpha      alpha0  # evals  Notes 
Initial log joint probability = -15.1549
    Iter      log prob        ||dx||      ||grad||       alpha      alpha0  # evals  Notes 
Initial log joint probability = -18.717
    Iter      log prob        ||dx||      ||grad||       alpha      alpha0  # evals  Notes 
Initial log joint probability = -23.5879
    Iter      log prob        ||dx||      ||grad||       alpha      alpha0  # evals  Notes 
      71        4679.2   6.21038e-09       3970.45      0.2931      0.2931       92   
Optimization terminated normally: 
  Convergence detected: absolute parameter change was below tolerance
      49       7027.83   6.41343e-05       4047.67   1.637e-08       0.001       96  LS failed, Hessian reset 
      99        7028.2    9.0348e-07       4256.47     0.01325           1      158   
    Iter      log prob        ||dx||      ||grad||       alpha      alpha0  # evals  Notes 
     100        7028.2   3.55978e-09        4322.2    0.009976    0.009976      159   
Optimization terminated normally: 
  Convergence detected: absolute parameter change was below tolerance
      74       9582.44   8.58877e-09       4048.94      0.6747      0.6747       98   
Optimization terminated normally: 
  Convergence detected: absolute parameter change was below tolerance
      65       11813.1   6.17728e-09        3748.4      0.2264      0.2264       95   
Optimization terminated normally: 
  Convergence detected: absolute parameter change was below tolerance
      99       14231.7   4.38894e-05       3988.35      0.3527           1      130   
    Iter      log prob        ||dx||      ||grad||       alpha      alpha0  # evals  Notes 
     134       14231.9   8.69695e-09       4092.03        0.31        0.31      179   
Optimization terminated normally: 
  Convergence detected: absolute parameter change was below tolerance
[I 2020-10-01 02:38:25,523] Trial 101 finished with value: 0.04114296292673256 and parameters: {'changepoint_prior_scale': 0.001213432939518002, 'seasonality_prior_scale': 0.131492910185584, 'holidays_prior_scale': 0.09046632186398082, 'seasonality_mode': 'additive', 'changepoint_range': 0.5707871763445717}. Best is trial 96 with value: 0.038883738900888705.
Initial log joint probability = -28.8311
    Iter      log prob        ||dx||      ||grad||       alpha      alpha0  # evals  Notes 
      99       18912.5   0.000491056       4097.11      0.9956      0.9956      129   
    Iter      log prob        ||dx||      ||grad||       alpha      alpha0  # evals  Notes 
     143       18912.9   6.66612e-09       4057.36      0.3086           1      186   
Optimization terminated normally: 
  Convergence detected: absolute parameter change was below tolerance
INFO:fbprophet:Making 5 forecasts with cutoffs between 2013-10-07 00:00:00 and 2015-10-18 00:00:00
INFO:fbprophet:Applying in parallel with <concurrent.futures.process.ProcessPoolExecutor object at 0x7fc88e65e150>
Initial log joint probability = -8.95172
    Iter      log prob        ||dx||      ||grad||       alpha      alpha0  # evals  Notes 
Initial log joint probability = -12.7302
    Iter      log prob        ||dx||      ||grad||       alpha      alpha0  # evals  Notes 
Initial log joint probability = -15.1549
    Iter      log prob        ||dx||      ||grad||       alpha      alpha0  # evals  Notes 
Initial log joint probability = -18.717
    Iter      log prob        ||dx||      ||grad||       alpha      alpha0  # evals  Notes 
      59       4677.18   6.30347e-09       4430.83     0.09554     0.09554       79   
Optimization terminated normally: 
  Convergence detected: absolute parameter change was below tolerance
Initial log joint probability = -23.5879
    Iter      log prob        ||dx||      ||grad||       alpha      alpha0  # evals  Notes 
      99       7027.66   8.44533e-07       4189.93           1           1      120   
    Iter      log prob        ||dx||      ||grad||       alpha      alpha0  # evals  Notes 
      72       9582.34   5.22331e-09       4374.65      0.3449           1      100   
Optimization terminated normally: 
  Convergence detected: absolute parameter change was below tolerance
      54         11813    8.2724e-09       4110.79       0.519       0.519       82   
Optimization terminated normally: 
  Convergence detected: absolute parameter change was below tolerance
     121        7027.8   1.14253e-05       4421.99   2.764e-09       0.001      198  LS failed, Hessian reset 
     174       7027.89   2.10544e-09          4420    0.003227    0.003227      269   
Optimization terminated normally: 
  Convergence detected: absolute parameter change was below tolerance
      99       14233.4   2.04286e-06       4309.35      0.2735           1      124   
    Iter      log prob        ||dx||      ||grad||       alpha      alpha0  # evals  Notes 
     115       14233.5   1.70571e-05       3981.61   3.233e-09       0.001      192  LS failed, Hessian reset 
     170       14233.6   8.44299e-09        4165.4      0.4529      0.4529      256   
Optimization terminated normally: 
  Convergence detected: absolute parameter change was below tolerance
[I 2020-10-01 02:38:41,880] Trial 102 finished with value: 0.041245547991268 and parameters: {'changepoint_prior_scale': 0.0011033624460047313, 'seasonality_prior_scale': 0.40466218427036593, 'holidays_prior_scale': 0.07831770079095571, 'seasonality_mode': 'additive', 'changepoint_range': 0.5543530589751533}. Best is trial 96 with value: 0.038883738900888705.
Initial log joint probability = -28.8311
    Iter      log prob        ||dx||      ||grad||       alpha      alpha0  # evals  Notes 
      79       18911.1   5.63533e-06       3881.31   9.999e-10       0.001      148  LS failed, Hessian reset 
      99       18911.1   6.16953e-07       5628.17           1           1      169   
    Iter      log prob        ||dx||      ||grad||       alpha      alpha0  # evals  Notes 
     120       18911.1   8.59512e-07       4853.78   1.707e-10       0.001      233  LS failed, Hessian reset 
     140       18911.1   2.85531e-08       4746.47           1           1      259   
Optimization terminated normally: 
  Convergence detected: relative gradient magnitude is below tolerance
INFO:fbprophet:Making 5 forecasts with cutoffs between 2013-10-07 00:00:00 and 2015-10-18 00:00:00
INFO:fbprophet:Applying in parallel with <concurrent.futures.process.ProcessPoolExecutor object at 0x7fc88e69add0>
Initial log joint probability = -8.95172
    Iter      log prob        ||dx||      ||grad||       alpha      alpha0  # evals  Notes 
Initial log joint probability = -12.7302
    Iter      log prob        ||dx||      ||grad||       alpha      alpha0  # evals  Notes 
Initial log joint probability = -15.1549
    Iter      log prob        ||dx||      ||grad||       alpha      alpha0  # evals  Notes 
Initial log joint probability = -18.717
    Iter      log prob        ||dx||      ||grad||       alpha      alpha0  # evals  Notes 
      70        4678.9    8.2006e-09       5186.06      0.5818      0.5818       91   
Optimization terminated normally: 
  Convergence detected: absolute parameter change was below tolerance
Initial log joint probability = -23.5879
    Iter      log prob        ||dx||      ||grad||       alpha      alpha0  # evals  Notes 
      75       7027.84   2.11427e-05       4915.89   4.367e-09       0.001      138  LS failed, Hessian reset 
      64       9582.23   9.85173e-09       4614.02      0.2162      0.2162       87   
Optimization terminated normally: 
  Convergence detected: absolute parameter change was below tolerance
      99       7027.99   5.14551e-07       4956.03      0.6974      0.1884      170   
    Iter      log prob        ||dx||      ||grad||       alpha      alpha0  # evals  Notes 
      54       11812.9   3.77244e-09       4884.14      0.1395      0.1395       77   
Optimization terminated normally: 
  Convergence detected: absolute parameter change was below tolerance
     117       7027.99   2.15087e-09       4749.04      0.2342      0.2342      195   
Optimization terminated normally: 
  Convergence detected: absolute parameter change was below tolerance
      99       14232.8   2.88134e-07       5134.55      0.7826      0.7826      128   
    Iter      log prob        ||dx||      ||grad||       alpha      alpha0  # evals  Notes 
     115       14232.8   7.60867e-09       4859.72      0.1695      0.1695      146   
Optimization terminated normally: 
  Convergence detected: absolute parameter change was below tolerance
[I 2020-10-01 02:38:57,830] Trial 103 finished with value: 0.0409383953643373 and parameters: {'changepoint_prior_scale': 0.0010017151647178095, 'seasonality_prior_scale': 0.16730441083837788, 'holidays_prior_scale': 0.0627527149173076, 'seasonality_mode': 'additive', 'changepoint_range': 0.5434945041950097}. Best is trial 96 with value: 0.038883738900888705.
Initial log joint probability = -28.8311
    Iter      log prob        ||dx||      ||grad||       alpha      alpha0  # evals  Notes 
      99       18911.2   1.03942e-07       4735.37      0.3271      0.3271      128   
    Iter      log prob        ||dx||      ||grad||       alpha      alpha0  # evals  Notes 
     117       18911.2   2.29401e-06       5286.37   6.059e-10       0.001      186  LS failed, Hessian reset 
     152       18911.2   6.15208e-09        4254.8      0.1443      0.1443      236   
Optimization terminated normally: 
  Convergence detected: absolute parameter change was below tolerance
INFO:fbprophet:Making 5 forecasts with cutoffs between 2013-10-07 00:00:00 and 2015-10-18 00:00:00
INFO:fbprophet:Applying in parallel with <concurrent.futures.process.ProcessPoolExecutor object at 0x7fc88e6a65d0>
Initial log joint probability = -8.95172
    Iter      log prob        ||dx||      ||grad||       alpha      alpha0  # evals  Notes 
Initial log joint probability = -12.7302
    Iter      log prob        ||dx||      ||grad||       alpha      alpha0  # evals  Notes 
Initial log joint probability = -15.1549
    Iter      log prob        ||dx||      ||grad||       alpha      alpha0  # evals  Notes 
Initial log joint probability = -18.717
    Iter      log prob        ||dx||      ||grad||       alpha      alpha0  # evals  Notes 
      60       4678.99   8.03928e-09       4509.36      0.2185      0.2185       81   
Optimization terminated normally: 
  Convergence detected: absolute parameter change was below tolerance
Initial log joint probability = -23.5879
    Iter      log prob        ||dx||      ||grad||       alpha      alpha0  # evals  Notes 
      99       7027.36   1.07816e-07       4680.94           1           1      129   
    Iter      log prob        ||dx||      ||grad||       alpha      alpha0  # evals  Notes 
      64       9582.28   5.50446e-09        4840.1      0.4049      0.4049       85   
Optimization terminated normally: 
  Convergence detected: absolute parameter change was below tolerance
      53       11812.9    5.5375e-09       5069.17     0.07844     0.07844       79   
Optimization terminated normally: 
  Convergence detected: absolute parameter change was below tolerance
     102       7027.65   2.36331e-05       5172.48   5.462e-09       0.001      190  LS failed, Hessian reset 
     140       7027.75   2.93291e-09        4469.1      0.1788      0.1788      238   
Optimization terminated normally: 
  Convergence detected: absolute parameter change was below tolerance
      91         14233   5.59498e-06       5043.95   1.124e-09       0.001      167  LS failed, Hessian reset 
      99       14233.1   2.60151e-07       5142.22      0.4937      0.4937      177   
    Iter      log prob        ||dx||      ||grad||       alpha      alpha0  # evals  Notes 
     116       14233.1   6.81941e-09       4977.91       0.253       0.253      199   
Optimization terminated normally: 
  Convergence detected: absolute parameter change was below tolerance
[I 2020-10-01 02:39:14,287] Trial 104 finished with value: 0.04086868416165386 and parameters: {'changepoint_prior_scale': 0.0010017884871300433, 'seasonality_prior_scale': 0.24364924859698722, 'holidays_prior_scale': 0.03721803454045445, 'seasonality_mode': 'additive', 'changepoint_range': 0.5437690947929786}. Best is trial 96 with value: 0.038883738900888705.
Initial log joint probability = -28.8311
    Iter      log prob        ||dx||      ||grad||       alpha      alpha0  # evals  Notes 
      99       18912.7   4.98213e-07       3779.93           1           1      124   
    Iter      log prob        ||dx||      ||grad||       alpha      alpha0  # evals  Notes 
     165       18912.9   7.54458e-09       3370.84      0.2768      0.2768      201   
Optimization terminated normally: 
  Convergence detected: absolute parameter change was below tolerance
INFO:fbprophet:Making 5 forecasts with cutoffs between 2013-10-07 00:00:00 and 2015-10-18 00:00:00
INFO:fbprophet:Applying in parallel with <concurrent.futures.process.ProcessPoolExecutor object at 0x7fc88e67fa10>
Initial log joint probability = -8.95172
    Iter      log prob        ||dx||      ||grad||       alpha      alpha0  # evals  Notes 
Initial log joint probability = -12.7302
    Iter      log prob        ||dx||      ||grad||       alpha      alpha0  # evals  Notes 
Initial log joint probability = -15.1549
    Iter      log prob        ||dx||      ||grad||       alpha      alpha0  # evals  Notes 
Initial log joint probability = -18.717
    Iter      log prob        ||dx||      ||grad||       alpha      alpha0  # evals  Notes 
      60       4677.91   3.23545e-09       3776.09       0.204       0.204       83   
Optimization terminated normally: 
  Convergence detected: absolute parameter change was below tolerance
Initial log joint probability = -23.5879
    Iter      log prob        ||dx||      ||grad||       alpha      alpha0  # evals  Notes 
      79       7029.17   2.83049e-05       3931.11   7.422e-09       0.001      145  LS failed, Hessian reset 
      99       7029.24   2.51896e-07       3703.39      0.4162      0.4162      171   
    Iter      log prob        ||dx||      ||grad||       alpha      alpha0  # evals  Notes 
     104       7029.24   9.49699e-09       3326.95      0.1893      0.1893      180   
Optimization terminated normally: 
  Convergence detected: absolute parameter change was below tolerance
      33       11811.7   0.000250969       3414.21   6.175e-08       0.001       80  LS failed, Hessian reset 
      93       9582.52   9.55498e-09       3314.55      0.3635      0.3635      129   
Optimization terminated normally: 
  Convergence detected: absolute parameter change was below tolerance
      99       11813.2   2.23276e-08       3715.62      0.4692      0.4692      163   
    Iter      log prob        ||dx||      ||grad||       alpha      alpha0  # evals  Notes 
     104       11813.2   7.84942e-09       3703.17      0.3706      0.3706      170   
Optimization terminated normally: 
  Convergence detected: absolute parameter change was below tolerance
      99         14233   2.49757e-06        3752.1      0.6747      0.6747      128   
    Iter      log prob        ||dx||      ||grad||       alpha      alpha0  # evals  Notes 
     159       14233.6   9.12389e-09        3204.7      0.4475      0.4475      206   
Optimization terminated normally: 
  Convergence detected: absolute parameter change was below tolerance
