[I 2020-10-01 02:42:28,957] Trial 117 finished with value: 0.04174342854058536 and parameters: {'changepoint_prior_scale': 0.0011404175607676074, 'seasonality_prior_scale': 0.10507100629936315, 'holidays_prior_scale': 0.013893095066562585, 'seasonality_mode': 'additive', 'changepoint_range': 0.5786729620853147}. Best is trial 96 with value: 0.038883738900888705.
Initial log joint probability = -28.8311
    Iter      log prob        ||dx||      ||grad||       alpha      alpha0  # evals  Notes 
      99       18912.4    5.7295e-06        4664.3      0.2927      0.2927      125   
    Iter      log prob        ||dx||      ||grad||       alpha      alpha0  # evals  Notes 
     133       18912.4   7.71767e-09       4939.57      0.5725      0.5725      169   
Optimization terminated normally: 
  Convergence detected: absolute parameter change was below tolerance
INFO:fbprophet:Making 5 forecasts with cutoffs between 2013-10-07 00:00:00 and 2015-10-18 00:00:00
INFO:fbprophet:Applying in parallel with <concurrent.futures.process.ProcessPoolExecutor object at 0x7fc88e664590>
Initial log joint probability = -8.95172
    Iter      log prob        ||dx||      ||grad||       alpha      alpha0  # evals  Notes 
Initial log joint probability = -12.7302
    Iter      log prob        ||dx||      ||grad||       alpha      alpha0  # evals  Notes 
Initial log joint probability = -15.1549
    Iter      log prob        ||dx||      ||grad||       alpha      alpha0  # evals  Notes 
Initial log joint probability = -18.717
    Iter      log prob        ||dx||      ||grad||       alpha      alpha0  # evals  Notes 
      56       4679.11     9.869e-09       4881.15       0.342       0.342       80   
Optimization terminated normally: 
  Convergence detected: absolute parameter change was below tolerance
Initial log joint probability = -23.5879
    Iter      log prob        ||dx||      ||grad||       alpha      alpha0  # evals  Notes 
      73          7028   1.70141e-05       5149.56   3.412e-09       0.001      133  LS failed, Hessian reset 
      76       9582.21   8.72725e-09       4702.88      0.2417           1       98   
Optimization terminated normally: 
  Convergence detected: absolute parameter change was below tolerance
      99       7028.09   2.72903e-08       4559.83       0.506       0.506      164   
    Iter      log prob        ||dx||      ||grad||       alpha      alpha0  # evals  Notes 
      55       11812.9    9.7344e-09       4572.63      0.3035      0.3035       78   
Optimization terminated normally: 
  Convergence detected: absolute parameter change was below tolerance
     109       7028.09   7.72977e-09       4362.26      0.3755      0.3755      178   
Optimization terminated normally: 
  Convergence detected: absolute parameter change was below tolerance
      99       14233.7   3.37648e-06       4978.52       2.542      0.2542      130   
    Iter      log prob        ||dx||      ||grad||       alpha      alpha0  # evals  Notes 
     113       14233.7   8.68656e-09       4932.59      0.1931      0.1931      147   
Optimization terminated normally: 
  Convergence detected: absolute parameter change was below tolerance
[I 2020-10-01 02:42:41,685] Trial 118 finished with value: 0.04128904071577426 and parameters: {'changepoint_prior_scale': 0.0010003006951833679, 'seasonality_prior_scale': 0.4605559668793508, 'holidays_prior_scale': 0.19666654095102223, 'seasonality_mode': 'additive', 'changepoint_range': 0.560377189758749}. Best is trial 96 with value: 0.038883738900888705.
Initial log joint probability = -28.8311
    Iter      log prob        ||dx||      ||grad||       alpha      alpha0  # evals  Notes 
      99       18912.9   4.00055e-07       3307.78           1           1      128   
    Iter      log prob        ||dx||      ||grad||       alpha      alpha0  # evals  Notes 
     111       18912.9   8.73075e-09       3319.25      0.3209      0.3209      143   
Optimization terminated normally: 
  Convergence detected: absolute parameter change was below tolerance
INFO:fbprophet:Making 5 forecasts with cutoffs between 2013-10-07 00:00:00 and 2015-10-18 00:00:00
INFO:fbprophet:Applying in parallel with <concurrent.futures.process.ProcessPoolExecutor object at 0x7fc88e664590>
Initial log joint probability = -8.95172
    Iter      log prob        ||dx||      ||grad||       alpha      alpha0  # evals  Notes 
Initial log joint probability = -12.7302
    Iter      log prob        ||dx||      ||grad||       alpha      alpha0  # evals  Notes 
Initial log joint probability = -15.1549
    Iter      log prob        ||dx||      ||grad||       alpha      alpha0  # evals  Notes 
Initial log joint probability = -18.717
    Iter      log prob        ||dx||      ||grad||       alpha      alpha0  # evals  Notes 
Initial log joint probability = -23.5879
    Iter      log prob        ||dx||      ||grad||       alpha      alpha0  # evals  Notes 
      99        4679.1   3.27236e-08       3456.08      0.5638      0.5638      124   
    Iter      log prob        ||dx||      ||grad||       alpha      alpha0  # evals  Notes 
     110        4679.1   6.37043e-09        3451.2      0.5684      0.5684      136   
Optimization terminated normally: 
  Convergence detected: absolute parameter change was below tolerance
      99       7028.77   4.64173e-05       3233.47           1           1      126   
    Iter      log prob        ||dx||      ||grad||       alpha      alpha0  # evals  Notes 
      79       9582.51   4.56756e-09        3130.8      0.2053      0.2053      106   
Optimization terminated normally: 
  Convergence detected: absolute parameter change was below tolerance
     103       7028.87   2.19304e-05       3588.41   6.749e-09       0.001      178  LS failed, Hessian reset 
      63       11813.2   8.58486e-09       3414.94      0.4416      0.4416       90   
Optimization terminated normally: 
  Convergence detected: absolute parameter change was below tolerance
     199       7030.83    0.00113134       3207.61      0.3686           1      311   
    Iter      log prob        ||dx||      ||grad||       alpha      alpha0  # evals  Notes 
      99       14232.3    2.0237e-08       2351.79      0.3253      0.7915      125   
    Iter      log prob        ||dx||      ||grad||       alpha      alpha0  # evals  Notes 
     103       14232.3   3.01193e-09       3263.05      0.1411      0.1411      130   
Optimization terminated normally: 
  Convergence detected: absolute parameter change was below tolerance
     296       7031.81   6.42404e-09       3505.83      0.2123      0.2123      430   
Optimization terminated normally: 
  Convergence detected: absolute parameter change was below tolerance
[I 2020-10-01 02:42:56,470] Trial 119 finished with value: 0.04175262787955606 and parameters: {'changepoint_prior_scale': 0.0014459676181875945, 'seasonality_prior_scale': 0.14225747142092188, 'holidays_prior_scale': 0.0741273356400892, 'seasonality_mode': 'additive', 'changepoint_range': 0.601378327611183}. Best is trial 96 with value: 0.038883738900888705.
Initial log joint probability = -28.8311
    Iter      log prob        ||dx||      ||grad||       alpha      alpha0  # evals  Notes 
      99       18911.9   3.93815e-05       4559.77      0.6328      0.6328      123   
    Iter      log prob        ||dx||      ||grad||       alpha      alpha0  # evals  Notes 
     177       18912.6   8.59089e-09       4795.14      0.5897      0.5897      213   
Optimization terminated normally: 
  Convergence detected: absolute parameter change was below tolerance
INFO:fbprophet:Making 5 forecasts with cutoffs between 2013-10-07 00:00:00 and 2015-10-18 00:00:00
INFO:fbprophet:Applying in parallel with <concurrent.futures.process.ProcessPoolExecutor object at 0x7fc88e664350>
Initial log joint probability = -8.95172
    Iter      log prob        ||dx||      ||grad||       alpha      alpha0  # evals  Notes 
Initial log joint probability = -12.7302
    Iter      log prob        ||dx||      ||grad||       alpha      alpha0  # evals  Notes 
Initial log joint probability = -15.1549
    Iter      log prob        ||dx||      ||grad||       alpha      alpha0  # evals  Notes 
Initial log joint probability = -18.717
    Iter      log prob        ||dx||      ||grad||       alpha      alpha0  # evals  Notes 
Initial log joint probability = -23.5879
    Iter      log prob        ||dx||      ||grad||       alpha      alpha0  # evals  Notes 
      99       4679.11   0.000200816       4979.29           1           1      129   
    Iter      log prob        ||dx||      ||grad||       alpha      alpha0  # evals  Notes 
     133       4679.26    7.5065e-09       4982.63      0.2922      0.2922      173   
Optimization terminated normally: 
  Convergence detected: absolute parameter change was below tolerance
      67       7027.72   6.87312e-05        5046.6   1.329e-08       0.001      122  LS failed, Hessian reset 
      63       9582.19   9.58046e-09       4614.77      0.6174      0.6174       88   
Optimization terminated normally: 
  Convergence detected: absolute parameter change was below tolerance
      48         11813   7.97194e-09       4640.88      0.2789      0.2789       72   
Optimization terminated normally: 
  Convergence detected: absolute parameter change was below tolerance
      99       7027.88   5.06891e-08       4532.02      0.4793      0.4793      162   
    Iter      log prob        ||dx||      ||grad||       alpha      alpha0  # evals  Notes 
     125        7027.9   1.54857e-06       4636.31   3.078e-10       0.001      233  LS failed, Hessian reset 
     159       7027.91   3.58003e-09       4678.84      0.2318      0.2318      274   
Optimization terminated normally: 
  Convergence detected: absolute parameter change was below tolerance
      99       14232.6    1.5416e-06       4525.67      0.6624      0.6624      121   
    Iter      log prob        ||dx||      ||grad||       alpha      alpha0  # evals  Notes 
     168       14232.9   1.49838e-06       4341.34    2.88e-10       0.001      245  LS failed, Hessian reset 
     199       14232.9   4.67883e-07       4802.64      0.3177      0.3177      283   
    Iter      log prob        ||dx||      ||grad||       alpha      alpha0  # evals  Notes 
     223       14232.9   1.50156e-08       4638.77       0.877       0.877      317   
Optimization terminated normally: 
  Convergence detected: relative gradient magnitude is below tolerance
[I 2020-10-01 02:43:11,112] Trial 120 finished with value: 0.041265953496761654 and parameters: {'changepoint_prior_scale': 0.0010001315963814776, 'seasonality_prior_scale': 0.12226456286532573, 'holidays_prior_scale': 0.11892026957257193, 'seasonality_mode': 'additive', 'changepoint_range': 0.5894085780929329}. Best is trial 96 with value: 0.038883738900888705.
Initial log joint probability = -28.8311
    Iter      log prob        ||dx||      ||grad||       alpha      alpha0  # evals  Notes 
      99       18911.9   2.08069e-05       4847.61      0.5521           1      131   
    Iter      log prob        ||dx||      ||grad||       alpha      alpha0  # evals  Notes 
     146       18912.6    2.5202e-05          5118   4.965e-09       0.001      229  LS failed, Hessian reset 
     199       18912.7   7.80306e-08       4440.96           1           1      296   
    Iter      log prob        ||dx||      ||grad||       alpha      alpha0  # evals  Notes 
     208       18912.7   9.84936e-09       5022.81      0.1782           1      311   
Optimization terminated normally: 
  Convergence detected: absolute parameter change was below tolerance
INFO:fbprophet:Making 5 forecasts with cutoffs between 2013-10-07 00:00:00 and 2015-10-18 00:00:00
INFO:fbprophet:Applying in parallel with <concurrent.futures.process.ProcessPoolExecutor object at 0x7fc88e685e10>
Initial log joint probability = -8.95172
    Iter      log prob        ||dx||      ||grad||       alpha      alpha0  # evals  Notes 
Initial log joint probability = -12.7302
    Iter      log prob        ||dx||      ||grad||       alpha      alpha0  # evals  Notes 
Initial log joint probability = -15.1549
    Iter      log prob        ||dx||      ||grad||       alpha      alpha0  # evals  Notes 
Initial log joint probability = -18.717
    Iter      log prob        ||dx||      ||grad||       alpha      alpha0  # evals  Notes 
      59       4678.93   7.16705e-09       5224.44      0.3704      0.3704       80   
Optimization terminated normally: 
  Convergence detected: absolute parameter change was below tolerance
Initial log joint probability = -23.5879
    Iter      log prob        ||dx||      ||grad||       alpha      alpha0  # evals  Notes 
      52       7028.21   1.56631e-05       5180.22   3.427e-09       0.001      110  LS failed, Hessian reset 
      55       9582.45   7.93457e-09       4966.92      0.5723      0.5723       75   
Optimization terminated normally: 
  Convergence detected: absolute parameter change was below tolerance
      99       7028.41   1.01134e-07       5237.11           1           1      167   
    Iter      log prob        ||dx||      ||grad||       alpha      alpha0  # evals  Notes 
     112       7028.42   8.43162e-09       4985.07      0.4034      0.4034      183   
Optimization terminated normally: 
  Convergence detected: absolute parameter change was below tolerance
      55         11813    7.9871e-06       4809.76   1.632e-09       0.001      112  LS failed, Hessian reset 
      80         11813   9.12449e-09       4802.69      0.5106      0.5106      145   
Optimization terminated normally: 
  Convergence detected: absolute parameter change was below tolerance
      99         14232   0.000242826       5416.14           1           1      116   
    Iter      log prob        ||dx||      ||grad||       alpha      alpha0  # evals  Notes 
     137       14232.3   3.28041e-09       4538.35      0.2055      0.2055      167   
Optimization terminated normally: 
  Convergence detected: absolute parameter change was below tolerance
[I 2020-10-01 02:43:27,468] Trial 121 finished with value: 0.04093937927539289 and parameters: {'changepoint_prior_scale': 0.0010049521139584687, 'seasonality_prior_scale': 0.17543406081566526, 'holidays_prior_scale': 0.054928853632041724, 'seasonality_mode': 'additive', 'changepoint_range': 0.5407315514037765}. Best is trial 96 with value: 0.038883738900888705.
Initial log joint probability = -28.8311
    Iter      log prob        ||dx||      ||grad||       alpha      alpha0  # evals  Notes 
      99       18912.7    4.0641e-06       3484.09      0.1486      0.4159      129   
    Iter      log prob        ||dx||      ||grad||       alpha      alpha0  # evals  Notes 
     145       18912.8    6.3279e-09       3196.72      0.1343      0.1343      185   
Optimization terminated normally: 
  Convergence detected: absolute parameter change was below tolerance
INFO:fbprophet:Making 5 forecasts with cutoffs between 2013-10-07 00:00:00 and 2015-10-18 00:00:00
INFO:fbprophet:Applying in parallel with <concurrent.futures.process.ProcessPoolExecutor object at 0x7fc88e6509d0>
Initial log joint probability = -8.95172
    Iter      log prob        ||dx||      ||grad||       alpha      alpha0  # evals  Notes 
Initial log joint probability = -12.7302
    Iter      log prob        ||dx||      ||grad||       alpha      alpha0  # evals  Notes 
Initial log joint probability = -15.1549
    Iter      log prob        ||dx||      ||grad||       alpha      alpha0  # evals  Notes 
Initial log joint probability = -18.717
    Iter      log prob        ||dx||      ||grad||       alpha      alpha0  # evals  Notes 
Initial log joint probability = -23.5879
    Iter      log prob        ||dx||      ||grad||       alpha      alpha0  # evals  Notes 
      54       4679.14   1.24792e-05       3920.45   3.342e-09       0.001      110  LS failed, Hessian reset 
      77       4679.21   4.13837e-06       3775.45    1.01e-09       0.001      175  LS failed, Hessian reset 
      97       4679.22    4.2836e-09       3685.22      0.2806      0.2806      203   
Optimization terminated normally: 
  Convergence detected: absolute parameter change was below tolerance
      69        7028.8   3.61631e-05       3985.94   9.372e-09       0.001      130  LS failed, Hessian reset 
      99       7028.95    8.2824e-08        3776.1      0.1722           1      168   
    Iter      log prob        ||dx||      ||grad||       alpha      alpha0  # evals  Notes 
     104       7028.95   4.65771e-09       3277.99      0.3565      0.3565      174   
Optimization terminated normally: 
  Convergence detected: absolute parameter change was below tolerance
      88       9582.38   1.20015e-08       3845.04      0.1612           1      121   
Optimization terminated normally: 
  Convergence detected: relative gradient magnitude is below tolerance
      37       11811.6   0.000215234       3170.88   6.305e-08       0.001       95  LS failed, Hessian reset 
      90         11813   1.09821e-08       3367.06      0.4398      0.4398      159   
Optimization terminated normally: 
  Convergence detected: relative gradient magnitude is below tolerance
      99       14232.2   2.29928e-08       3586.38       0.402           1      131   
    Iter      log prob        ||dx||      ||grad||       alpha      alpha0  # evals  Notes 
     104       14232.2   6.29709e-09       3168.93      0.2365           1      138   
Optimization terminated normally: 
  Convergence detected: absolute parameter change was below tolerance
[I 2020-10-01 02:43:42,969] Trial 122 finished with value: 0.0409814501958033 and parameters: {'changepoint_prior_scale': 0.001283103067938264, 'seasonality_prior_scale': 0.16235028722731115, 'holidays_prior_scale': 0.1434351009956126, 'seasonality_mode': 'additive', 'changepoint_range': 0.5496370209166119}. Best is trial 96 with value: 0.038883738900888705.
Initial log joint probability = -28.8311
    Iter      log prob        ||dx||      ||grad||       alpha      alpha0  # evals  Notes 
      99       18912.8    2.9287e-06       2565.34      0.5068      0.5068      121   
    Iter      log prob        ||dx||      ||grad||       alpha      alpha0  # evals  Notes 
     133       18912.8   6.59049e-07       3183.25   2.408e-10       0.001      204  LS failed, Hessian reset 
     146       18912.8   1.15328e-08       3037.17      0.2286      0.9621      218   
Optimization terminated normally: 
  Convergence detected: relative gradient magnitude is below tolerance
INFO:fbprophet:Making 5 forecasts with cutoffs between 2013-10-07 00:00:00 and 2015-10-18 00:00:00
INFO:fbprophet:Applying in parallel with <concurrent.futures.process.ProcessPoolExecutor object at 0x7fc88e650d50>
Initial log joint probability = -8.95172
    Iter      log prob        ||dx||      ||grad||       alpha      alpha0  # evals  Notes 
Initial log joint probability = -12.7302
    Iter      log prob        ||dx||      ||grad||       alpha      alpha0  # evals  Notes 
      47       4679.17   0.000106853       3166.11   3.406e-08       0.001       98  LS failed, Hessian reset 
Initial log joint probability = -15.1549
    Iter      log prob        ||dx||      ||grad||       alpha      alpha0  # evals  Notes 
      82       4679.45   7.98865e-09       3150.92           1           1      147   
Optimization terminated normally: 
  Convergence detected: absolute parameter change was below tolerance
Initial log joint probability = -18.717
    Iter      log prob        ||dx||      ||grad||       alpha      alpha0  # evals  Notes 
Initial log joint probability = -23.5879
    Iter      log prob        ||dx||      ||grad||       alpha      alpha0  # evals  Notes 
      99       7029.62   6.65887e-07       2752.89      0.6096      0.6096      123   
    Iter      log prob        ||dx||      ||grad||       alpha      alpha0  # evals  Notes 
     124       7029.63   6.19513e-09       2739.98      0.2794      0.2794      156   
Optimization terminated normally: 
  Convergence detected: absolute parameter change was below tolerance
      56       11813.3   8.86456e-09       3111.87      0.8317      0.8317       82   
Optimization terminated normally: 
  Convergence detected: absolute parameter change was below tolerance
      95       9582.54   8.08627e-09       3036.68      0.2742           1      122   
Optimization terminated normally: 
  Convergence detected: absolute parameter change was below tolerance
      99       14232.8   2.73096e-05       3445.43           1           1      129   
    Iter      log prob        ||dx||      ||grad||       alpha      alpha0  # evals  Notes 
     156         14233   2.33113e-08       3050.74      0.5398      0.5398      198   
Optimization terminated normally: 
  Convergence detected: relative gradient magnitude is below tolerance
