[I 2020-10-01 02:21:14,925] Trial 34 finished with value: 0.04270060191811938 and parameters: {'changepoint_prior_scale': 0.0013896484134359281, 'seasonality_prior_scale': 0.03465337993079866, 'holidays_prior_scale': 3.3222611123439902, 'seasonality_mode': 'multiplicative', 'changepoint_range': 0.7426739711873883}. Best is trial 3 with value: 0.04098090703811677.
Initial log joint probability = -28.8311
    Iter      log prob        ||dx||      ||grad||       alpha      alpha0  # evals  Notes 
      65       18913.3   1.52117e-07       536.743           1           1       91   
Optimization terminated normally: 
  Convergence detected: relative gradient magnitude is below tolerance
INFO:fbprophet:Making 5 forecasts with cutoffs between 2013-10-07 00:00:00 and 2015-10-18 00:00:00
INFO:fbprophet:Applying in parallel with <concurrent.futures.process.ProcessPoolExecutor object at 0x7fc88e651f50>
Initial log joint probability = -8.95172
    Iter      log prob        ||dx||      ||grad||       alpha      alpha0  # evals  Notes 
Initial log joint probability = -12.7302
    Iter      log prob        ||dx||      ||grad||       alpha      alpha0  # evals  Notes 
Initial log joint probability = -15.1549
    Iter      log prob        ||dx||      ||grad||       alpha      alpha0  # evals  Notes 
Initial log joint probability = -18.717
    Iter      log prob        ||dx||      ||grad||       alpha      alpha0  # evals  Notes 
      55       4679.47   2.11156e-08       818.016      0.2829      0.7363       80   
Optimization terminated normally: 
  Convergence detected: relative gradient magnitude is below tolerance
Initial log joint probability = -23.5879
    Iter      log prob        ||dx||      ||grad||       alpha      alpha0  # evals  Notes 
      91       7032.13   4.61603e-06       547.563   7.768e-09       0.001      147  LS failed, Hessian reset 
      99       7032.13   2.12785e-07       401.799      0.2853           1      156   
    Iter      log prob        ||dx||      ||grad||       alpha      alpha0  # evals  Notes 
     112       7032.13   1.41013e-07       533.815           1           1      172   
Optimization terminated normally: 
  Convergence detected: relative gradient magnitude is below tolerance
      99       9582.68   4.39886e-08       667.884       0.491       0.491      140   
    Iter      log prob        ||dx||      ||grad||       alpha      alpha0  # evals  Notes 
      49       11813.2   2.62365e-05       649.933   3.268e-08       0.001      104  LS failed, Hessian reset 
     104       9582.68   4.01459e-09       617.136    0.003671           1      149   
Optimization terminated normally: 
  Convergence detected: absolute parameter change was below tolerance
      84       11813.2     6.069e-08       568.601      0.4765           1      147   
Optimization terminated normally: 
  Convergence detected: relative gradient magnitude is below tolerance
      92       14233.8   1.36377e-05       598.703   2.881e-08       0.001      174  LS failed, Hessian reset 
      99       14233.8   1.30641e-05       693.236      0.2513           1      182   
    Iter      log prob        ||dx||      ||grad||       alpha      alpha0  # evals  Notes 
     135       14233.8   1.69558e-06       672.624   2.593e-09       0.001      265  LS failed, Hessian reset 
     144       14233.8    1.0189e-07       639.825      0.2173           1      278   
Optimization terminated normally: 
  Convergence detected: relative gradient magnitude is below tolerance
[I 2020-10-01 02:21:30,694] Trial 35 finished with value: 0.042139905376051084 and parameters: {'changepoint_prior_scale': 0.006039977633637023, 'seasonality_prior_scale': 0.2906877817818821, 'holidays_prior_scale': 5.884322558195005, 'seasonality_mode': 'additive', 'changepoint_range': 0.7255012675259868}. Best is trial 3 with value: 0.04098090703811677.
Initial log joint probability = -28.8311
    Iter      log prob        ||dx||      ||grad||       alpha      alpha0  # evals  Notes 
      94       18911.6   2.94763e-08       2242.06      0.8388      0.8388      118   
Optimization terminated normally: 
  Convergence detected: relative gradient magnitude is below tolerance
INFO:fbprophet:Making 5 forecasts with cutoffs between 2013-10-07 00:00:00 and 2015-10-18 00:00:00
INFO:fbprophet:Applying in parallel with <concurrent.futures.process.ProcessPoolExecutor object at 0x7fc88e5ecd50>
Initial log joint probability = -8.95172
    Iter      log prob        ||dx||      ||grad||       alpha      alpha0  # evals  Notes 
Initial log joint probability = -12.7302
    Iter      log prob        ||dx||      ||grad||       alpha      alpha0  # evals  Notes 
Initial log joint probability = -15.1549
    Iter      log prob        ||dx||      ||grad||       alpha      alpha0  # evals  Notes 
Initial log joint probability = -18.717
    Iter      log prob        ||dx||      ||grad||       alpha      alpha0  # evals  Notes 
      42       4677.93   3.70454e-05       2949.93   1.286e-08       0.001       89  LS failed, Hessian reset 
Initial log joint probability = -23.5879
    Iter      log prob        ||dx||      ||grad||       alpha      alpha0  # evals  Notes 
      81       4678.01   5.31371e-07       3167.12   1.769e-10       0.001      182  LS failed, Hessian reset 
      99       4678.01   1.70062e-07       2890.77           1           1      202   
    Iter      log prob        ||dx||      ||grad||       alpha      alpha0  # evals  Notes 
      76       7028.61   6.65474e-05        3140.5   2.405e-08       0.001      127  LS failed, Hessian reset 
     119       4678.02    1.6707e-06       3136.35   5.473e-10       0.001      259  LS failed, Hessian reset 
      99       7028.72   2.10993e-07       2826.96     0.07258           1      159   
    Iter      log prob        ||dx||      ||grad||       alpha      alpha0  # evals  Notes 
     143       4678.03   8.76346e-09       2731.65       0.522       0.522      287   
Optimization terminated normally: 
  Convergence detected: absolute parameter change was below tolerance
      79       9581.14   1.24848e-05        2477.5   4.489e-09       0.001      149  LS failed, Hessian reset 
     142       7028.74   9.59703e-07       2762.29   3.097e-10       0.001      246  LS failed, Hessian reset 
      86       11811.9   7.75147e-09       2445.11      0.1925      0.5388      118   
Optimization terminated normally: 
  Convergence detected: absolute parameter change was below tolerance
      99       9581.19   1.34684e-07       2386.65      0.7069      0.7069      175   
    Iter      log prob        ||dx||      ||grad||       alpha      alpha0  # evals  Notes 
     170       7028.75   8.71265e-09       2841.57      0.5591      0.5591      282   
Optimization terminated normally: 
  Convergence detected: absolute parameter change was below tolerance
     135       9581.19   8.28326e-09       2402.89      0.5562      0.5562      220   
Optimization terminated normally: 
  Convergence detected: absolute parameter change was below tolerance
      99       14231.3   9.15913e-08       2159.17      0.7702      0.7702      130   
    Iter      log prob        ||dx||      ||grad||       alpha      alpha0  # evals  Notes 
     115       14231.3   1.87959e-08       2794.15      0.2686           1      151   
Optimization terminated normally: 
  Convergence detected: relative gradient magnitude is below tolerance
[I 2020-10-01 02:21:45,331] Trial 36 finished with value: 0.041142807150742394 and parameters: {'changepoint_prior_scale': 0.0017144489410310137, 'seasonality_prior_scale': 0.024327654265443723, 'holidays_prior_scale': 9.688564469241124, 'seasonality_mode': 'additive', 'changepoint_range': 0.6791631414326574}. Best is trial 3 with value: 0.04098090703811677.
Initial log joint probability = -28.8311
    Iter      log prob        ||dx||      ||grad||       alpha      alpha0  # evals  Notes 
      92       18910.2   1.07735e-05       2445.97   4.408e-09       0.001      155  LS failed, Hessian reset 
      99       18910.2   5.86949e-07       2184.42           1           1      163   
    Iter      log prob        ||dx||      ||grad||       alpha      alpha0  # evals  Notes 
     117       18910.2   1.03368e-07       2263.99           1           1      189   
Optimization terminated normally: 
  Convergence detected: relative gradient magnitude is below tolerance
INFO:fbprophet:Making 5 forecasts with cutoffs between 2013-10-07 00:00:00 and 2015-10-18 00:00:00
INFO:fbprophet:Applying in parallel with <concurrent.futures.process.ProcessPoolExecutor object at 0x7fc88e6a6710>
Initial log joint probability = -8.95172
    Iter      log prob        ||dx||      ||grad||       alpha      alpha0  # evals  Notes 
Initial log joint probability = -12.7302
    Iter      log prob        ||dx||      ||grad||       alpha      alpha0  # evals  Notes 
Initial log joint probability = -15.1549
    Iter      log prob        ||dx||      ||grad||       alpha      alpha0  # evals  Notes 
Initial log joint probability = -18.717
    Iter      log prob        ||dx||      ||grad||       alpha      alpha0  # evals  Notes 
Initial log joint probability = -23.5879
    Iter      log prob        ||dx||      ||grad||       alpha      alpha0  # evals  Notes 
      99       4676.72   1.19415e-07       2331.83           1           1      126   
    Iter      log prob        ||dx||      ||grad||       alpha      alpha0  # evals  Notes 
     108       4676.72   6.03145e-09       2335.56      0.6821      0.6821      139   
Optimization terminated normally: 
  Convergence detected: absolute parameter change was below tolerance
      99       7027.37   6.74312e-05       2708.45      0.3489           1      126   
    Iter      log prob        ||dx||      ||grad||       alpha      alpha0  # evals  Notes 
     157       7028.56   2.61766e-09       2246.64      0.2204      0.2204      199   
Optimization terminated normally: 
  Convergence detected: absolute parameter change was below tolerance
      79       9579.46   4.33059e-07        2488.3   2.243e-10       0.001      142  LS failed, Hessian reset 
      54       11809.7   0.000121805       2464.22   4.954e-08       0.001      118  LS failed, Hessian reset 
      99       9579.46   9.61032e-09        2260.1       0.302           1      167   
Optimization terminated normally: 
  Convergence detected: absolute parameter change was below tolerance
      94       11810.3   8.44435e-07       2545.59    3.35e-10       0.001      208  LS failed, Hessian reset 
      99       11810.3    3.4335e-07       2341.28           1           1      214   
    Iter      log prob        ||dx||      ||grad||       alpha      alpha0  # evals  Notes 
      86       14230.3    4.7709e-06       2191.77   2.109e-09       0.001      155  LS failed, Hessian reset 
      99       14230.3   4.53485e-07       1762.57      0.9381      0.4087      170   
    Iter      log prob        ||dx||      ||grad||       alpha      alpha0  # evals  Notes 
     122       11810.3   2.68308e-07       2373.03   1.093e-10       0.001      281  LS failed, Hessian reset 
     113       14230.3   1.43253e-08       1813.97      0.3783           1      189   
Optimization terminated normally: 
  Convergence detected: relative gradient magnitude is below tolerance
     134       11810.3    1.9654e-08       2275.63       0.223           1      294   
Optimization terminated normally: 
  Convergence detected: relative gradient magnitude is below tolerance
[I 2020-10-01 02:22:00,916] Trial 37 finished with value: 0.04162911745287204 and parameters: {'changepoint_prior_scale': 0.0020950659156753677, 'seasonality_prior_scale': 0.016133100212428524, 'holidays_prior_scale': 2.227883866151264, 'seasonality_mode': 'additive', 'changepoint_range': 0.6774863368565124}. Best is trial 3 with value: 0.04098090703811677.
Initial log joint probability = -28.8311
    Iter      log prob        ||dx||      ||grad||       alpha      alpha0  # evals  Notes 
      52       18911.4   6.08133e-06       461.332   1.334e-08       0.001      124  LS failed, Hessian reset 
      68       18911.4   9.36305e-08       520.119      0.4496           1      149   
Optimization terminated normally: 
  Convergence detected: relative gradient magnitude is below tolerance
INFO:fbprophet:Making 5 forecasts with cutoffs between 2013-10-07 00:00:00 and 2015-10-18 00:00:00
INFO:fbprophet:Applying in parallel with <concurrent.futures.process.ProcessPoolExecutor object at 0x7fc88e6511d0>
Initial log joint probability = -8.95172
    Iter      log prob        ||dx||      ||grad||       alpha      alpha0  # evals  Notes 
Initial log joint probability = -12.7302
    Iter      log prob        ||dx||      ||grad||       alpha      alpha0  # evals  Notes 
Initial log joint probability = -15.1549
    Iter      log prob        ||dx||      ||grad||       alpha      alpha0  # evals  Notes 
Initial log joint probability = -18.717
    Iter      log prob        ||dx||      ||grad||       alpha      alpha0  # evals  Notes 
Initial log joint probability = -23.5879
    Iter      log prob        ||dx||      ||grad||       alpha      alpha0  # evals  Notes 
      52       4677.62   9.35476e-06       617.137   1.264e-08       0.001      111  LS failed, Hessian reset 
      85       4677.63   2.14161e-08       597.119      0.2783           1      151   
Optimization terminated normally: 
  Convergence detected: relative gradient magnitude is below tolerance
      72       7029.57   0.000124727       449.908   2.336e-07       0.001      135  LS failed, Hessian reset 
      99        7029.6   3.60844e-06        513.18           1           1      167   
    Iter      log prob        ||dx||      ||grad||       alpha      alpha0  # evals  Notes 
      53       9580.03   1.06005e-05       407.818   1.876e-08       0.001      115  LS failed, Hessian reset 
      42       11810.7   4.71178e-05       617.707   7.005e-08       0.001       99  LS failed, Hessian reset 
      86       9580.04    7.1167e-08       459.556     0.07611           1      163   
Optimization terminated normally: 
  Convergence detected: relative gradient magnitude is below tolerance
      99       11810.8   2.93253e-06       540.767      0.8952      0.8952      173   
    Iter      log prob        ||dx||      ||grad||       alpha      alpha0  # evals  Notes 
      99       14231.7   1.48619e-07       493.527       0.767       0.767      132   
    Iter      log prob        ||dx||      ||grad||       alpha      alpha0  # evals  Notes 
     101       14231.7   4.10411e-08       532.145      0.1434      0.3878      136   
Optimization terminated normally: 
  Convergence detected: relative gradient magnitude is below tolerance
     179       7029.64   2.44198e-06       498.089   4.844e-09       0.001      338  LS failed, Hessian reset 
     199       7029.64   1.27286e-07       427.994           1           1      363   
Optimization terminated normally: 
  Convergence detected: relative gradient magnitude is below tolerance
     152       11810.8   1.07404e-07       403.915      0.4379           1      247   
Optimization terminated normally: 
  Convergence detected: relative gradient magnitude is below tolerance
[I 2020-10-01 02:22:15,575] Trial 38 finished with value: 0.042951897804688645 and parameters: {'changepoint_prior_scale': 0.007488276044957569, 'seasonality_prior_scale': 0.02544388038954345, 'holidays_prior_scale': 9.739421550965524, 'seasonality_mode': 'multiplicative', 'changepoint_range': 0.6475910269092531}. Best is trial 3 with value: 0.04098090703811677.
Initial log joint probability = -28.8311
    Iter      log prob        ||dx||      ||grad||       alpha      alpha0  # evals  Notes 
      99       18909.8   2.16253e-06       1168.21      0.6769      0.6769      129   
    Iter      log prob        ||dx||      ||grad||       alpha      alpha0  # evals  Notes 
     141         18910    2.5225e-10        1093.2   0.0001578           1      196   
Optimization terminated normally: 
  Convergence detected: absolute parameter change was below tolerance
INFO:fbprophet:Making 5 forecasts with cutoffs between 2013-10-07 00:00:00 and 2015-10-18 00:00:00
INFO:fbprophet:Applying in parallel with <concurrent.futures.process.ProcessPoolExecutor object at 0x7fc88e651710>
Initial log joint probability = -8.95172
    Iter      log prob        ||dx||      ||grad||       alpha      alpha0  # evals  Notes 
Initial log joint probability = -12.7302
    Iter      log prob        ||dx||      ||grad||       alpha      alpha0  # evals  Notes 
Initial log joint probability = -15.1549
    Iter      log prob        ||dx||      ||grad||       alpha      alpha0  # evals  Notes 
      72       4676.94   1.14101e-06       1523.46   7.122e-10       0.001      139  LS failed, Hessian reset 
      83       4676.94    5.5904e-09       1410.18     0.05135           1      156   
Optimization terminated normally: 
  Convergence detected: absolute parameter change was below tolerance
Initial log joint probability = -18.717
    Iter      log prob        ||dx||      ||grad||       alpha      alpha0  # evals  Notes 
Initial log joint probability = -23.5879
    Iter      log prob        ||dx||      ||grad||       alpha      alpha0  # evals  Notes 
      99       7028.52   7.94758e-06        1643.7           1           1      127   
    Iter      log prob        ||dx||      ||grad||       alpha      alpha0  # evals  Notes 
     101       7028.53   2.40789e-06        1589.5   1.512e-09       0.001      170  LS failed, Hessian reset 
     120       7028.53   1.58787e-09        1551.9       0.138       0.138      196   
Optimization terminated normally: 
  Convergence detected: absolute parameter change was below tolerance
      95       9579.53   6.94284e-08       1288.41      0.6492      0.6492      120   
Optimization terminated normally: 
  Convergence detected: relative gradient magnitude is below tolerance
      72       11810.4   2.36135e-08       1491.79      0.7216      0.7216      104   
Optimization terminated normally: 
  Convergence detected: relative gradient magnitude is below tolerance
      99       14230.3   8.32671e-07       1716.26           1           1      132   
    Iter      log prob        ||dx||      ||grad||       alpha      alpha0  # evals  Notes 
     109       14230.3   4.32351e-08       1018.64      0.2263           1      146   
Optimization terminated normally: 
  Convergence detected: relative gradient magnitude is below tolerance
[I 2020-10-01 02:22:30,213] Trial 39 finished with value: 0.041643576610170346 and parameters: {'changepoint_prior_scale': 0.0031628943982944177, 'seasonality_prior_scale': 0.016167933901493858, 'holidays_prior_scale': 0.41903036988443665, 'seasonality_mode': 'additive', 'changepoint_range': 0.6934680961499168}. Best is trial 3 with value: 0.04098090703811677.
Initial log joint probability = -28.8311
    Iter      log prob        ||dx||      ||grad||       alpha      alpha0  # evals  Notes 
      99         18911   1.27883e-06       5672.65           1           1      137   
    Iter      log prob        ||dx||      ||grad||       alpha      alpha0  # evals  Notes 
     199       18912.3   3.40209e-06       4849.26      0.4617      0.4617      258   
    Iter      log prob        ||dx||      ||grad||       alpha      alpha0  # evals  Notes 
     222       18912.3   8.95159e-09        4223.9      0.4053      0.4053      290   
Optimization terminated normally: 
  Convergence detected: absolute parameter change was below tolerance
INFO:fbprophet:Making 5 forecasts with cutoffs between 2013-10-07 00:00:00 and 2015-10-18 00:00:00
INFO:fbprophet:Applying in parallel with <concurrent.futures.process.ProcessPoolExecutor object at 0x7fc88e616310>
Initial log joint probability = -8.95172
    Iter      log prob        ||dx||      ||grad||       alpha      alpha0  # evals  Notes 
Initial log joint probability = -12.7302
    Iter      log prob        ||dx||      ||grad||       alpha      alpha0  # evals  Notes 
Initial log joint probability = -15.1549
    Iter      log prob        ||dx||      ||grad||       alpha      alpha0  # evals  Notes 
Initial log joint probability = -18.717
    Iter      log prob        ||dx||      ||grad||       alpha      alpha0  # evals  Notes 
Initial log joint probability = -23.5879
    Iter      log prob        ||dx||      ||grad||       alpha      alpha0  # evals  Notes 
      85       4678.94   8.57629e-09       4922.53      0.3308      0.3308      118   
Optimization terminated normally: 
  Convergence detected: absolute parameter change was below tolerance
      73       7028.49   2.35386e-05        4498.2    4.59e-09       0.001      133  LS failed, Hessian reset 
      60       9581.76   6.78913e-09       4052.12      0.6662      0.6662       85   
Optimization terminated normally: 
  Convergence detected: absolute parameter change was below tolerance
      99       7028.74   3.65418e-07       4807.36      0.6638      0.6638      164   
    Iter      log prob        ||dx||      ||grad||       alpha      alpha0  # evals  Notes 
     116       7028.74   9.71912e-09       4790.24      0.6619      0.6619      183   
Optimization terminated normally: 
  Convergence detected: absolute parameter change was below tolerance
      55       11812.8   1.22007e-05       5179.41    2.47e-09       0.001      128  LS failed, Hessian reset 
      90       11812.9   7.92849e-09       4666.27      0.4583      0.4583      175   
Optimization terminated normally: 
  Convergence detected: absolute parameter change was below tolerance
      99       14231.2   2.93505e-07       2803.37      0.5129           1      140   
    Iter      log prob        ||dx||      ||grad||       alpha      alpha0  # evals  Notes 
     122       14231.2   6.98139e-09       4286.82      0.4861      0.4861      171   
Optimization terminated normally: 
  Convergence detected: absolute parameter change was below tolerance
