[I 2020-10-01 03:50:42,515] Trial 385 finished with value: 0.040696637231018865 and parameters: {'changepoint_prior_scale': 0.0011040520088483313, 'seasonality_prior_scale': 0.8549550701030957, 'holidays_prior_scale': 0.3088537096285911, 'seasonality_mode': 'additive', 'changepoint_range': 0.5004374326975392}. Best is trial 96 with value: 0.038883738900888705.
Initial log joint probability = -28.8311
    Iter      log prob        ||dx||      ||grad||       alpha      alpha0  # evals  Notes 
      99       18911.1   1.49274e-06       3677.84           1           1      127   
    Iter      log prob        ||dx||      ||grad||       alpha      alpha0  # evals  Notes 
     186       18912.8   2.70855e-08       4672.29      0.3004           1      235   
Optimization terminated normally: 
  Convergence detected: relative gradient magnitude is below tolerance
INFO:fbprophet:Making 5 forecasts with cutoffs between 2013-10-07 00:00:00 and 2015-10-18 00:00:00
INFO:fbprophet:Applying in parallel with <concurrent.futures.process.ProcessPoolExecutor object at 0x7fc84dc1ed50>
Initial log joint probability = -8.95172
    Iter      log prob        ||dx||      ||grad||       alpha      alpha0  # evals  Notes 
Initial log joint probability = -12.7302
    Iter      log prob        ||dx||      ||grad||       alpha      alpha0  # evals  Notes 
Initial log joint probability = -15.1549
    Iter      log prob        ||dx||      ||grad||       alpha      alpha0  # evals  Notes 
Initial log joint probability = -18.717
    Iter      log prob        ||dx||      ||grad||       alpha      alpha0  # evals  Notes 
Initial log joint probability = -23.5879
      45       4678.84   1.24087e-05       4904.16   2.439e-09       0.001       96  LS failed, Hessian reset 
    Iter      log prob        ||dx||      ||grad||       alpha      alpha0  # evals  Notes 
      80       4678.97   3.51692e-06       5003.35    6.99e-10       0.001      193  LS failed, Hessian reset 
      87       7028.12   3.38568e-09       4972.34      0.2266      0.2266      111   
Optimization terminated normally: 
  Convergence detected: absolute parameter change was below tolerance
      99       4679.01   3.11069e-07       4905.55           1           1      216   
    Iter      log prob        ||dx||      ||grad||       alpha      alpha0  # evals  Notes 
     113       4679.01   3.46514e-07       5042.63   7.052e-11       0.001      276  LS failed, Hessian reset 
     130       4679.01   5.19473e-09        4973.4      0.5197      0.5197      296   
Optimization terminated normally: 
  Convergence detected: absolute parameter change was below tolerance
      35       11811.2   0.000287213        4854.6    5.79e-08       0.001       87  LS failed, Hessian reset 
      99       9582.12   3.15282e-08       4525.19       0.614       0.614      125   
    Iter      log prob        ||dx||      ||grad||       alpha      alpha0  # evals  Notes 
     149       9582.38   6.40697e-09       5260.28      0.2182      0.2182      193   
Optimization terminated normally: 
  Convergence detected: absolute parameter change was below tolerance
      99       14232.9   2.30109e-06       4849.22      0.6419      0.6419      128   
    Iter      log prob        ||dx||      ||grad||       alpha      alpha0  # evals  Notes 
      69       11811.9    1.1562e-06       5047.12   2.331e-10       0.001      170  LS failed, Hessian reset 
      79       11811.9    9.2744e-09       4897.12      0.1984      0.1984      184   
Optimization terminated normally: 
  Convergence detected: absolute parameter change was below tolerance
     117       14232.9    1.6656e-08       5182.12      0.2771           1      151   
Optimization terminated normally: 
  Convergence detected: relative gradient magnitude is below tolerance
[I 2020-10-01 03:50:57,573] Trial 386 finished with value: 0.040859153094286234 and parameters: {'changepoint_prior_scale': 0.0010125005369133137, 'seasonality_prior_scale': 0.5958147327405408, 'holidays_prior_scale': 0.31351517569711324, 'seasonality_mode': 'additive', 'changepoint_range': 0.5050873391439985}. Best is trial 96 with value: 0.038883738900888705.
Initial log joint probability = -28.8311
    Iter      log prob        ||dx||      ||grad||       alpha      alpha0  # evals  Notes 
      99       18911.6   6.06886e-07       3421.15      0.9909      0.9909      130   
    Iter      log prob        ||dx||      ||grad||       alpha      alpha0  # evals  Notes 
     104       18911.6   9.54453e-07       4455.03   2.432e-10       0.001      172  LS failed, Hessian reset 
     120       18911.6   2.41664e-08       3192.24           1           1      192   
Optimization terminated normally: 
  Convergence detected: relative gradient magnitude is below tolerance
INFO:fbprophet:Making 5 forecasts with cutoffs between 2013-10-07 00:00:00 and 2015-10-18 00:00:00
INFO:fbprophet:Applying in parallel with <concurrent.futures.process.ProcessPoolExecutor object at 0x7fc84dbf95d0>
Initial log joint probability = -8.95172
    Iter      log prob        ||dx||      ||grad||       alpha      alpha0  # evals  Notes 
Initial log joint probability = -12.7302
    Iter      log prob        ||dx||      ||grad||       alpha      alpha0  # evals  Notes 
Initial log joint probability = -15.1549
    Iter      log prob        ||dx||      ||grad||       alpha      alpha0  # evals  Notes 
Initial log joint probability = -18.717
    Iter      log prob        ||dx||      ||grad||       alpha      alpha0  # evals  Notes 
Initial log joint probability = -23.5879
    Iter      log prob        ||dx||      ||grad||       alpha      alpha0  # evals  Notes 
      99       4677.52   4.67561e-08       3795.17      0.2242      0.2242      133   
    Iter      log prob        ||dx||      ||grad||       alpha      alpha0  # evals  Notes 
     121       4677.52   8.72641e-08       4306.89    2.11e-11       0.001      200  LS failed, Hessian reset 
      93        7029.2   8.66812e-09       4550.99      0.3236           1      113   
Optimization terminated normally: 
  Convergence detected: absolute parameter change was below tolerance
     131       4677.52   5.76614e-09        3828.3        0.62        0.62      211   
Optimization terminated normally: 
  Convergence detected: absolute parameter change was below tolerance
      78       9581.76   6.88925e-09       4423.17      0.2777      0.2777      107   
Optimization terminated normally: 
  Convergence detected: absolute parameter change was below tolerance
      59       11812.8   6.04438e-09       4473.73      0.4744      0.4744       88   
Optimization terminated normally: 
  Convergence detected: absolute parameter change was below tolerance
      99       14232.7   5.11654e-08       4619.64           1           1      125   
    Iter      log prob        ||dx||      ||grad||       alpha      alpha0  # evals  Notes 
     106       14232.7   8.14822e-09       4566.79      0.3558      0.3558      133   
Optimization terminated normally: 
  Convergence detected: absolute parameter change was below tolerance
[I 2020-10-01 03:51:12,680] Trial 387 finished with value: 0.04254895996288847 and parameters: {'changepoint_prior_scale': 0.0011069846679410938, 'seasonality_prior_scale': 0.1686266046951494, 'holidays_prior_scale': 0.3533643152233253, 'seasonality_mode': 'multiplicative', 'changepoint_range': 0.56167416437102}. Best is trial 96 with value: 0.038883738900888705.
Initial log joint probability = -28.8311
    Iter      log prob        ||dx||      ||grad||       alpha      alpha0  # evals  Notes 
      70         18911   3.56438e-05       5678.43    8.17e-09       0.001      139  LS failed, Hessian reset 
      99       18911.1    9.8785e-07       4671.53           1           1      174   
    Iter      log prob        ||dx||      ||grad||       alpha      alpha0  # evals  Notes 
     199       18912.8   1.13186e-06       5303.81           1           1      294   
    Iter      log prob        ||dx||      ||grad||       alpha      alpha0  # evals  Notes 
     226       18912.8   4.81375e-07       4499.33   9.346e-11       0.001      377  LS failed, Hessian reset 
     244       18912.8   9.42893e-09       4611.07      0.4608      0.4608      397   
Optimization terminated normally: 
  Convergence detected: absolute parameter change was below tolerance
INFO:fbprophet:Making 5 forecasts with cutoffs between 2013-10-07 00:00:00 and 2015-10-18 00:00:00
INFO:fbprophet:Applying in parallel with <concurrent.futures.process.ProcessPoolExecutor object at 0x7fc84dca4610>
Initial log joint probability = -8.95172
    Iter      log prob        ||dx||      ||grad||       alpha      alpha0  # evals  Notes 
Initial log joint probability = -12.7302
    Iter      log prob        ||dx||      ||grad||       alpha      alpha0  # evals  Notes 
Initial log joint probability = -15.1549
    Iter      log prob        ||dx||      ||grad||       alpha      alpha0  # evals  Notes 
Initial log joint probability = -18.717
    Iter      log prob        ||dx||      ||grad||       alpha      alpha0  # evals  Notes 
Initial log joint probability = -23.5879
    Iter      log prob        ||dx||      ||grad||       alpha      alpha0  # evals  Notes 
      72       4678.99   5.90311e-09       5001.92      0.4801      0.4801      100   
Optimization terminated normally: 
  Convergence detected: absolute parameter change was below tolerance
      94       7028.31   5.26207e-06       4479.34   1.144e-09       0.001      158  LS failed, Hessian reset 
      99       7028.32   4.02385e-06       5022.03      0.8581      0.8581      163   
    Iter      log prob        ||dx||      ||grad||       alpha      alpha0  # evals  Notes 
      85        9582.5   8.93642e-09       4019.59      0.3882      0.3882      116   
Optimization terminated normally: 
  Convergence detected: absolute parameter change was below tolerance
     128       7028.34   8.52418e-09       5230.43      0.2794      0.2794      200   
Optimization terminated normally: 
  Convergence detected: absolute parameter change was below tolerance
      37       11811.8   0.000216405       4811.12   4.184e-08       0.001      103  LS failed, Hessian reset 
      96       14233.6   8.16974e-09       4665.37      0.2235      0.2235      125   
Optimization terminated normally: 
  Convergence detected: absolute parameter change was below tolerance
      93       11813.2   8.34091e-09       4871.25      0.2888      0.2888      179   
Optimization terminated normally: 
  Convergence detected: absolute parameter change was below tolerance
[I 2020-10-01 03:51:28,049] Trial 388 finished with value: 0.04108156208493951 and parameters: {'changepoint_prior_scale': 0.0010062928079450676, 'seasonality_prior_scale': 0.7443819185525913, 'holidays_prior_scale': 0.41271260896491957, 'seasonality_mode': 'additive', 'changepoint_range': 0.511941688842676}. Best is trial 96 with value: 0.038883738900888705.
Initial log joint probability = -28.8311
    Iter      log prob        ||dx||      ||grad||       alpha      alpha0  # evals  Notes 
      99       18912.4   3.17021e-05       2946.99           1           1      128   
    Iter      log prob        ||dx||      ||grad||       alpha      alpha0  # evals  Notes 
     129       18912.5    8.5571e-06       3793.27   1.756e-09       0.001      206  LS failed, Hessian reset 
     159       18912.6   3.89195e-09       3200.39      0.1163      0.1163      251   
Optimization terminated normally: 
  Convergence detected: absolute parameter change was below tolerance
INFO:fbprophet:Making 5 forecasts with cutoffs between 2013-10-07 00:00:00 and 2015-10-18 00:00:00
INFO:fbprophet:Applying in parallel with <concurrent.futures.process.ProcessPoolExecutor object at 0x7fc84dc765d0>
Initial log joint probability = -8.95172
    Iter      log prob        ||dx||      ||grad||       alpha      alpha0  # evals  Notes 
Initial log joint probability = -12.7302
    Iter      log prob        ||dx||      ||grad||       alpha      alpha0  # evals  Notes 
Initial log joint probability = -15.1549
    Iter      log prob        ||dx||      ||grad||       alpha      alpha0  # evals  Notes 
Initial log joint probability = -18.717
    Iter      log prob        ||dx||      ||grad||       alpha      alpha0  # evals  Notes 
Initial log joint probability = -23.5879
    Iter      log prob        ||dx||      ||grad||       alpha      alpha0  # evals  Notes 
      82       4675.24    0.00101969       4390.39   2.296e-07       0.001      154  LS failed, Hessian reset 
      99       4678.64   1.83445e-05       4451.44      0.8563      0.8563      176   
    Iter      log prob        ||dx||      ||grad||       alpha      alpha0  # evals  Notes 
      99       7028.68   3.76109e-07        4129.3           1           1      120   
    Iter      log prob        ||dx||      ||grad||       alpha      alpha0  # evals  Notes 
     113       7028.68    6.8389e-09       4419.13      0.3304      0.3304      140   
Optimization terminated normally: 
  Convergence detected: absolute parameter change was below tolerance
     185       4679.38   4.05248e-09       4298.67      0.4008      0.4008      280   
Optimization terminated normally: 
  Convergence detected: absolute parameter change was below tolerance
      52       9582.04   1.14328e-05       4330.55   2.849e-09       0.001      111  LS failed, Hessian reset 
      72       11813.1   3.52164e-09       4191.37      0.2183      0.2183      109   
Optimization terminated normally: 
  Convergence detected: absolute parameter change was below tolerance
      99       9582.15   5.41928e-08       4122.79       2.606      0.2606      169   
    Iter      log prob        ||dx||      ||grad||       alpha      alpha0  # evals  Notes 
     102       9582.15   7.31776e-09       4045.32       0.387       0.387      173   
Optimization terminated normally: 
  Convergence detected: absolute parameter change was below tolerance
      95       14232.9    8.9073e-09       4425.55      0.5493      0.5493      130   
Optimization terminated normally: 
  Convergence detected: absolute parameter change was below tolerance
[I 2020-10-01 03:51:43,973] Trial 389 finished with value: 0.041358561104760605 and parameters: {'changepoint_prior_scale': 0.0011645103562880727, 'seasonality_prior_scale': 1.076990217513904, 'holidays_prior_scale': 0.3097188427950292, 'seasonality_mode': 'additive', 'changepoint_range': 0.5488980020386703}. Best is trial 96 with value: 0.038883738900888705.
Initial log joint probability = -28.8311
    Iter      log prob        ||dx||      ||grad||       alpha      alpha0  # evals  Notes 
      99       18911.3   0.000355512       3792.26           1           1      128   
    Iter      log prob        ||dx||      ||grad||       alpha      alpha0  # evals  Notes 
     194       18912.1   1.04289e-08       3097.46      0.3528      0.3528      246   
Optimization terminated normally: 
  Convergence detected: relative gradient magnitude is below tolerance
INFO:fbprophet:Making 5 forecasts with cutoffs between 2013-10-07 00:00:00 and 2015-10-18 00:00:00
INFO:fbprophet:Applying in parallel with <concurrent.futures.process.ProcessPoolExecutor object at 0x7fc84dc92c10>
Initial log joint probability = -8.95172
    Iter      log prob        ||dx||      ||grad||       alpha      alpha0  # evals  Notes 
Initial log joint probability = -12.7302
    Iter      log prob        ||dx||      ||grad||       alpha      alpha0  # evals  Notes 
Initial log joint probability = -15.1549
    Iter      log prob        ||dx||      ||grad||       alpha      alpha0  # evals  Notes 
      93       4678.96   6.03888e-09        3336.1      0.4767      0.4767      127   
Optimization terminated normally: 
  Convergence detected: absolute parameter change was below tolerance
Initial log joint probability = -18.717
    Iter      log prob        ||dx||      ||grad||       alpha      alpha0  # evals  Notes 
Initial log joint probability = -23.5879
    Iter      log prob        ||dx||      ||grad||       alpha      alpha0  # evals  Notes 
      78       7029.05   4.82824e-05       3742.71   1.288e-08       0.001      138  LS failed, Hessian reset 
      99       7029.16   9.48081e-07       3642.05      0.7852      0.7852      165   
    Iter      log prob        ||dx||      ||grad||       alpha      alpha0  # evals  Notes 
      60        9582.5   9.96323e-09       4047.66      0.2676      0.8094       78   
Optimization terminated normally: 
  Convergence detected: absolute parameter change was below tolerance
     132       7029.18   7.33025e-09       3819.94      0.5293      0.5293      209   
Optimization terminated normally: 
  Convergence detected: absolute parameter change was below tolerance
      33       11810.1   0.000837042       3775.82   2.095e-07       0.001       80  LS failed, Hessian reset 
      99       14233.2    2.2064e-05       4090.53      0.1804      0.9407      126   
    Iter      log prob        ||dx||      ||grad||       alpha      alpha0  # evals  Notes 
      87       11812.9   1.01923e-08       4098.13      0.2772           1      149   
Optimization terminated normally: 
  Convergence detected: relative gradient magnitude is below tolerance
     173       14233.4   4.40547e-09        3389.3      0.2044      0.2044      217   
Optimization terminated normally: 
  Convergence detected: absolute parameter change was below tolerance
[I 2020-10-01 03:51:59,533] Trial 390 finished with value: 0.0407794810316015 and parameters: {'changepoint_prior_scale': 0.0012825815765018817, 'seasonality_prior_scale': 0.7681462561604842, 'holidays_prior_scale': 0.27915947996093493, 'seasonality_mode': 'additive', 'changepoint_range': 0.5721503506429448}. Best is trial 96 with value: 0.038883738900888705.
Initial log joint probability = -28.8311
    Iter      log prob        ||dx||      ||grad||       alpha      alpha0  # evals  Notes 
      99       18911.3   1.43149e-05       5029.45           1           1      131   
    Iter      log prob        ||dx||      ||grad||       alpha      alpha0  # evals  Notes 
     176       18912.3   4.75145e-06       5182.74   8.433e-10       0.001      276  LS failed, Hessian reset 
     199       18912.3    3.4275e-08       4423.87           1           1      305   
    Iter      log prob        ||dx||      ||grad||       alpha      alpha0  # evals  Notes 
     203       18912.3   2.83543e-08       4012.63      0.9409      0.2069      312   
Optimization terminated normally: 
  Convergence detected: relative gradient magnitude is below tolerance
INFO:fbprophet:Making 5 forecasts with cutoffs between 2013-10-07 00:00:00 and 2015-10-18 00:00:00
INFO:fbprophet:Applying in parallel with <concurrent.futures.process.ProcessPoolExecutor object at 0x7fc84dc72bd0>
Initial log joint probability = -8.95172
    Iter      log prob        ||dx||      ||grad||       alpha      alpha0  # evals  Notes 
Initial log joint probability = -12.7302
    Iter      log prob        ||dx||      ||grad||       alpha      alpha0  # evals  Notes 
Initial log joint probability = -15.1549
    Iter      log prob        ||dx||      ||grad||       alpha      alpha0  # evals  Notes 
Initial log joint probability = -18.717
    Iter      log prob        ||dx||      ||grad||       alpha      alpha0  # evals  Notes 
Initial log joint probability = -23.5879
    Iter      log prob        ||dx||      ||grad||       alpha      alpha0  # evals  Notes 
      72       4678.79   2.64243e-09       4805.38      0.1491      0.1491      104   
Optimization terminated normally: 
  Convergence detected: absolute parameter change was below tolerance
      99       7027.77    1.1785e-08       4592.75      0.6381      0.6381      126   
    Iter      log prob        ||dx||      ||grad||       alpha      alpha0  # evals  Notes 
     102       7027.77    8.5832e-09       4420.37      0.3454      0.3454      129   
Optimization terminated normally: 
  Convergence detected: absolute parameter change was below tolerance
      52       11812.8   6.36321e-09       4923.09     0.07837     0.07837       76   
Optimization terminated normally: 
  Convergence detected: absolute parameter change was below tolerance
      68       9582.25   2.17009e-05       4498.18   4.386e-09       0.001      125  LS failed, Hessian reset 
      99       9582.33   2.28596e-08       5010.47      0.6966      0.6966      165   
    Iter      log prob        ||dx||      ||grad||       alpha      alpha0  # evals  Notes 
     105       9582.33   4.29147e-09       4616.89      0.3517      0.8808      174   
Optimization terminated normally: 
  Convergence detected: absolute parameter change was below tolerance
      99         14233   5.82863e-06       4012.18           1           1      125   
    Iter      log prob        ||dx||      ||grad||       alpha      alpha0  # evals  Notes 
     126         14233   9.38941e-09       4683.17      0.5553      0.5553      157   
Optimization terminated normally: 
  Convergence detected: absolute parameter change was below tolerance
