Importing plotly failed. Interactive plots will not work.
[I 2020-10-01 02:12:02,918] A new study created in memory with name: no-name-1b62b68e-85d6-48ca-b25d-2f1cd8ceae84
Initial log joint probability = -28.8311
    Iter      log prob        ||dx||      ||grad||       alpha      alpha0  # evals  Notes 
      63       18918.9   7.56395e-05       192.504   3.828e-07       0.001      129  LS failed, Hessian reset 
      98       18919.1   7.54562e-05       188.691   5.602e-07       0.001      216  LS failed, Hessian reset 
      99       18919.1   5.20653e-05       140.304           1           1      217   
    Iter      log prob        ||dx||      ||grad||       alpha      alpha0  # evals  Notes 
     199       18919.5   3.83691e-06       94.0164           1           1      343   
    Iter      log prob        ||dx||      ||grad||       alpha      alpha0  # evals  Notes 
     233       18919.5    1.0099e-06       98.2892      0.3999           1      390   
Optimization terminated normally: 
  Convergence detected: relative gradient magnitude is below tolerance
INFO:fbprophet:Making 5 forecasts with cutoffs between 2013-10-07 00:00:00 and 2015-10-18 00:00:00
INFO:fbprophet:Applying in parallel with <concurrent.futures.process.ProcessPoolExecutor object at 0x7fc890508f10>
Initial log joint probability = -8.95172
    Iter      log prob        ||dx||      ||grad||       alpha      alpha0  # evals  Notes 
Initial log joint probability = -12.7302
    Iter      log prob        ||dx||      ||grad||       alpha      alpha0  # evals  Notes 
Initial log joint probability = -15.1549
    Iter      log prob        ||dx||      ||grad||       alpha      alpha0  # evals  Notes 
Initial log joint probability = -18.717
    Iter      log prob        ||dx||      ||grad||       alpha      alpha0  # evals  Notes 
Initial log joint probability = -23.5879
    Iter      log prob        ||dx||      ||grad||       alpha      alpha0  # evals  Notes 
      85       4678.88   9.99263e-08       130.615      0.1877      0.3956      105   
Optimization terminated normally: 
  Convergence detected: relative gradient magnitude is below tolerance
      99       7036.87   8.61442e-05       73.3046           1           1      127   
    Iter      log prob        ||dx||      ||grad||       alpha      alpha0  # evals  Notes 
      99       9584.08   1.85239e-05       93.2322      0.3479      0.3479      128   
    Iter      log prob        ||dx||      ||grad||       alpha      alpha0  # evals  Notes 
     135       7036.91   0.000126399       87.6921   1.292e-06       0.001      227  LS failed, Hessian reset 
      99       11815.2   0.000236039       109.666           1           1      123   
    Iter      log prob        ||dx||      ||grad||       alpha      alpha0  # evals  Notes 
     172       7036.92   7.46175e-07       56.0633     0.04364           1      275   
Optimization terminated normally: 
  Convergence detected: relative gradient magnitude is below tolerance
      61       14236.7   7.17785e-05       156.991    4.17e-07       0.001      113  LS failed, Hessian reset 
     142       9584.08   1.01722e-05       112.747   9.675e-08       0.001      238  LS failed, Hessian reset 
     104       11815.3   0.000119725       143.912   1.091e-06       0.001      174  LS failed, Hessian reset 
      99       14236.9   0.000159515       125.078      0.4371           1      165   
    Iter      log prob        ||dx||      ||grad||       alpha      alpha0  # evals  Notes 
     172       9584.08   5.23468e-07       84.0379      0.3908           1      287   
Optimization terminated normally: 
  Convergence detected: relative gradient magnitude is below tolerance
     184       11815.4   0.000126484       198.702   9.203e-07       0.001      329  LS failed, Hessian reset 
     199       11815.4   1.75397e-05       94.1233      0.5963      0.5963      346   
    Iter      log prob        ||dx||      ||grad||       alpha      alpha0  # evals  Notes 
     215       11815.4   1.05678e-06       101.552           1           1      368   
Optimization terminated normally: 
  Convergence detected: relative gradient magnitude is below tolerance
     184       14237.2   9.96594e-05       196.872   5.961e-07       0.001      331  LS failed, Hessian reset 
     199       14237.3   0.000166518        91.743      0.1363           1      351   
    Iter      log prob        ||dx||      ||grad||       alpha      alpha0  # evals  Notes 
     201       14237.3   2.62913e-05       85.6472   3.026e-07       0.001      396  LS failed, Hessian reset 
     212       14237.3    1.4732e-05       74.3711   2.286e-07       0.001      452  LS failed, Hessian reset 
     220       14237.3   9.50837e-07       62.2298      0.5928           1      467   
Optimization terminated normally: 
  Convergence detected: relative gradient magnitude is below tolerance
[I 2020-10-01 02:12:22,896] Trial 0 finished with value: 0.04704030628031993 and parameters: {'changepoint_prior_scale': 0.03781113738706493, 'seasonality_prior_scale': 0.04535919313659576, 'holidays_prior_scale': 0.23501044968719295, 'seasonality_mode': 'multiplicative', 'changepoint_range': 0.856103923318288}. Best is trial 0 with value: 0.04704030628031993.
Initial log joint probability = -28.8311
    Iter      log prob        ||dx||      ||grad||       alpha      alpha0  # evals  Notes 
      99       18916.6    0.00343692       168.169           1           1      124   
    Iter      log prob        ||dx||      ||grad||       alpha      alpha0  # evals  Notes 
     191       18917.3   6.41657e-05       128.351   9.189e-07       0.001      288  LS failed, Hessian reset 
     199       18917.3   1.03515e-05        64.218      0.2731           1      297   
    Iter      log prob        ||dx||      ||grad||       alpha      alpha0  # evals  Notes 
     228       18917.3   2.89845e-05       64.4838   3.108e-07       0.001      376  LS failed, Hessian reset 
     235       18917.3   2.21516e-07       58.1138      0.2537      0.2537      387   
Optimization terminated normally: 
  Convergence detected: relative gradient magnitude is below tolerance
INFO:fbprophet:Making 5 forecasts with cutoffs between 2013-10-07 00:00:00 and 2015-10-18 00:00:00
INFO:fbprophet:Applying in parallel with <concurrent.futures.process.ProcessPoolExecutor object at 0x7fc88f771150>
Initial log joint probability = -8.95172
    Iter      log prob        ||dx||      ||grad||       alpha      alpha0  # evals  Notes 
Initial log joint probability = -12.7302
    Iter      log prob        ||dx||      ||grad||       alpha      alpha0  # evals  Notes 
Initial log joint probability = -15.1549
    Iter      log prob        ||dx||      ||grad||       alpha      alpha0  # evals  Notes 
Initial log joint probability = -18.717
    Iter      log prob        ||dx||      ||grad||       alpha      alpha0  # evals  Notes 
Initial log joint probability = -23.5879
    Iter      log prob        ||dx||      ||grad||       alpha      alpha0  # evals  Notes 
      99       4675.81   4.59232e-05       88.9632           1           1      118   
    Iter      log prob        ||dx||      ||grad||       alpha      alpha0  # evals  Notes 
     123       4675.86   5.13503e-05       93.5409   5.628e-07       0.001      197  LS failed, Hessian reset 
      99       7034.67    0.00058599       90.7397           1           1      125   
    Iter      log prob        ||dx||      ||grad||       alpha      alpha0  # evals  Notes 
     181       4675.87   3.04643e-07       88.1885           1           1      272   
Optimization terminated normally: 
  Convergence detected: relative gradient magnitude is below tolerance
     103       7034.68   0.000168132       150.635   1.942e-06       0.001      173  LS failed, Hessian reset 
      99       9579.99   9.81168e-05       74.1176      0.9579      0.9579      124   
    Iter      log prob        ||dx||      ||grad||       alpha      alpha0  # evals  Notes 
     135        7034.7   4.48343e-07       67.1199           1           1      216   
Optimization terminated normally: 
  Convergence detected: relative gradient magnitude is below tolerance
      99       11811.6    0.00254133        81.677           1           1      118   
    Iter      log prob        ||dx||      ||grad||       alpha      alpha0  # evals  Notes 
      65       14232.9   0.000161267       194.096   1.646e-06       0.001      123  LS failed, Hessian reset 
     187       9580.23    2.5278e-07        75.667      0.3684      0.2404      247   
Optimization terminated normally: 
  Convergence detected: relative gradient magnitude is below tolerance
      99       14233.3   9.53071e-05       63.7301           1           1      165   
    Iter      log prob        ||dx||      ||grad||       alpha      alpha0  # evals  Notes 
     159       11812.1   0.000179796       200.951     2.2e-06       0.001      247  LS failed, Hessian reset 
     124       14233.3   5.79961e-05       88.3487   2.825e-07       0.001      233  LS failed, Hessian reset 
     199       11812.1   4.91632e-06       63.6174      0.9249      0.9249      303   
    Iter      log prob        ||dx||      ||grad||       alpha      alpha0  # evals  Notes 
     252       11812.1   1.51441e-06       66.7526      0.4583           1      369   
Optimization terminated normally: 
  Convergence detected: relative gradient magnitude is below tolerance
     199       14233.5   1.49313e-05       79.7892       0.205       0.205      353   
    Iter      log prob        ||dx||      ||grad||       alpha      alpha0  # evals  Notes 
     229       14233.5   4.61102e-05       75.8925   5.703e-07       0.001      434  LS failed, Hessian reset 
     249       14233.5   5.68364e-07       49.2696      0.2602           1      460   
Optimization terminated normally: 
  Convergence detected: relative gradient magnitude is below tolerance
[I 2020-10-01 02:12:38,435] Trial 1 finished with value: 0.052268370256779835 and parameters: {'changepoint_prior_scale': 0.04946729512087123, 'seasonality_prior_scale': 0.017252647403453756, 'holidays_prior_scale': 8.708987058957788, 'seasonality_mode': 'multiplicative', 'changepoint_range': 0.9157872995238581}. Best is trial 0 with value: 0.04704030628031993.
Initial log joint probability = -28.8311
    Iter      log prob        ||dx||      ||grad||       alpha      alpha0  # evals  Notes 
      53       18913.4    2.4403e-07       444.657      0.9644      0.9644       80   
Optimization terminated normally: 
  Convergence detected: relative gradient magnitude is below tolerance
INFO:fbprophet:Making 5 forecasts with cutoffs between 2013-10-07 00:00:00 and 2015-10-18 00:00:00
INFO:fbprophet:Applying in parallel with <concurrent.futures.process.ProcessPoolExecutor object at 0x7fc8a0208c10>
Initial log joint probability = -8.95172
    Iter      log prob        ||dx||      ||grad||       alpha      alpha0  # evals  Notes 
Initial log joint probability = -12.7302
    Iter      log prob        ||dx||      ||grad||       alpha      alpha0  # evals  Notes 
Initial log joint probability = -15.1549
    Iter      log prob        ||dx||      ||grad||       alpha      alpha0  # evals  Notes 
Initial log joint probability = -18.717
    Iter      log prob        ||dx||      ||grad||       alpha      alpha0  # evals  Notes 
      55       4679.45   2.40298e-08       720.996      0.4811      0.4811       82   
Optimization terminated normally: 
  Convergence detected: relative gradient magnitude is below tolerance
Initial log joint probability = -23.5879
    Iter      log prob        ||dx||      ||grad||       alpha      alpha0  # evals  Notes 
      99       7032.08   6.21035e-06       711.031      0.2505      0.9941      129   
    Iter      log prob        ||dx||      ||grad||       alpha      alpha0  # evals  Notes 
     167       7032.09    5.2184e-09       584.982      0.1433      0.1433      210   
Optimization terminated normally: 
  Convergence detected: absolute parameter change was below tolerance
      93       9582.53   1.55376e-06       404.943   3.407e-09       0.001      176  LS failed, Hessian reset 
      99       9582.53   2.47639e-07       409.351      0.1356      0.5657      184   
    Iter      log prob        ||dx||      ||grad||       alpha      alpha0  # evals  Notes 
      99       11813.2    2.0389e-06       475.246           1           1      140   
    Iter      log prob        ||dx||      ||grad||       alpha      alpha0  # evals  Notes 
     104       9582.53   7.98905e-08       301.895      0.1752      0.4666      191   
Optimization terminated normally: 
  Convergence detected: relative gradient magnitude is below tolerance
     192       11813.3   1.45478e-07       744.858      0.2454           1      251   
Optimization terminated normally: 
  Convergence detected: relative gradient magnitude is below tolerance
      99       14233.8   1.82181e-07       598.601           1           1      137   
    Iter      log prob        ||dx||      ||grad||       alpha      alpha0  # evals  Notes 
     103       14233.8   1.40924e-07       607.129           1           1      142   
Optimization terminated normally: 
  Convergence detected: relative gradient magnitude is below tolerance
[I 2020-10-01 02:12:52,816] Trial 2 finished with value: 0.04308874928484182 and parameters: {'changepoint_prior_scale': 0.006885107520287427, 'seasonality_prior_scale': 1.5362933011487179, 'holidays_prior_scale': 0.30626607656108934, 'seasonality_mode': 'multiplicative', 'changepoint_range': 0.5615049727156047}. Best is trial 2 with value: 0.04308874928484182.
Initial log joint probability = -28.8311
    Iter      log prob        ||dx||      ||grad||       alpha      alpha0  # evals  Notes 
      99       18912.6    7.1733e-06       3248.32           1           1      122   
    Iter      log prob        ||dx||      ||grad||       alpha      alpha0  # evals  Notes 
     167       18912.8   2.03491e-06       3161.97   5.133e-10       0.001      243  LS failed, Hessian reset 
     199       18912.8    5.3404e-08       2944.53      0.8256      0.8256      286   
    Iter      log prob        ||dx||      ||grad||       alpha      alpha0  # evals  Notes 
     204       18912.8   1.49869e-08       2949.98      0.2876           1      292   
Optimization terminated normally: 
  Convergence detected: relative gradient magnitude is below tolerance
INFO:fbprophet:Making 5 forecasts with cutoffs between 2013-10-07 00:00:00 and 2015-10-18 00:00:00
INFO:fbprophet:Applying in parallel with <concurrent.futures.process.ProcessPoolExecutor object at 0x7fc88fc5a050>
Initial log joint probability = -8.95172
    Iter      log prob        ||dx||      ||grad||       alpha      alpha0  # evals  Notes 
Initial log joint probability = -12.7302
    Iter      log prob        ||dx||      ||grad||       alpha      alpha0  # evals  Notes 
Initial log joint probability = -15.1549
    Iter      log prob        ||dx||      ||grad||       alpha      alpha0  # evals  Notes 
Initial log joint probability = -18.717
    Iter      log prob        ||dx||      ||grad||       alpha      alpha0  # evals  Notes 
Initial log joint probability = -23.5879
    Iter      log prob        ||dx||      ||grad||       alpha      alpha0  # evals  Notes 
      76       4678.84   9.69123e-09       3647.88      0.8577      0.8577      103   
Optimization terminated normally: 
  Convergence detected: absolute parameter change was below tolerance
      56       9582.37   8.80091e-09       3866.87      0.2924      0.2924       75   
Optimization terminated normally: 
  Convergence detected: absolute parameter change was below tolerance
      99       7028.43    1.7127e-05       3602.71   4.476e-09       0.001      159  LS failed, Hessian reset 
    Iter      log prob        ||dx||      ||grad||       alpha      alpha0  # evals  Notes 
      58       11812.9   1.16228e-08       3542.19      0.3437      0.8993       86   
Optimization terminated normally: 
  Convergence detected: relative gradient magnitude is below tolerance
     152       7028.49    7.7341e-07       3477.26   2.152e-10       0.001      258  LS failed, Hessian reset 
     166       7028.49   9.84695e-09       2813.54      0.6042      0.6042      277   
Optimization terminated normally: 
  Convergence detected: absolute parameter change was below tolerance
      98       14233.1   6.80693e-09       3060.91      0.2277           1      131   
Optimization terminated normally: 
  Convergence detected: absolute parameter change was below tolerance
[I 2020-10-01 02:13:08,710] Trial 3 finished with value: 0.04098090703811677 and parameters: {'changepoint_prior_scale': 0.0013514374616324762, 'seasonality_prior_scale': 0.06691974523721679, 'holidays_prior_scale': 8.685316162208096, 'seasonality_mode': 'additive', 'changepoint_range': 0.5986519466232618}. Best is trial 3 with value: 0.04098090703811677.
Initial log joint probability = -28.8311
    Iter      log prob        ||dx||      ||grad||       alpha      alpha0  # evals  Notes 
      88       18917.4   0.000266638       292.504    1.61e-06       0.001      149  LS failed, Hessian reset 
      99       18917.4   4.89441e-05       105.945      0.4402      0.4402      160   
    Iter      log prob        ||dx||      ||grad||       alpha      alpha0  # evals  Notes 
     128       18917.4   2.07222e-07       94.7524      0.1951      0.6148      206   
Optimization terminated normally: 
  Convergence detected: relative gradient magnitude is below tolerance
INFO:fbprophet:Making 5 forecasts with cutoffs between 2013-10-07 00:00:00 and 2015-10-18 00:00:00
INFO:fbprophet:Applying in parallel with <concurrent.futures.process.ProcessPoolExecutor object at 0x7fc88f416790>
Initial log joint probability = -8.95172
    Iter      log prob        ||dx||      ||grad||       alpha      alpha0  # evals  Notes 
Initial log joint probability = -12.7302
    Iter      log prob        ||dx||      ||grad||       alpha      alpha0  # evals  Notes 
Initial log joint probability = -15.1549
    Iter      log prob        ||dx||      ||grad||       alpha      alpha0  # evals  Notes 
Initial log joint probability = -18.717
    Iter      log prob        ||dx||      ||grad||       alpha      alpha0  # evals  Notes 
Initial log joint probability = -23.5879
    Iter      log prob        ||dx||      ||grad||       alpha      alpha0  # evals  Notes 
      79       4679.45   1.56319e-07       156.372           1           1      106   
Optimization terminated normally: 
  Convergence detected: relative gradient magnitude is below tolerance
      71       7036.58   0.000215041        195.75   1.833e-06       0.001      129  LS failed, Hessian reset 
      99       7036.63   2.15788e-07       93.5253      0.4229      0.4229      171   
    Iter      log prob        ||dx||      ||grad||       alpha      alpha0  # evals  Notes 
     101       7036.63    1.5014e-07       82.1354       0.427       0.427      173   
Optimization terminated normally: 
  Convergence detected: relative gradient magnitude is below tolerance
      99        9584.4   0.000408451       140.923           1           1      128   
    Iter      log prob        ||dx||      ||grad||       alpha      alpha0  # evals  Notes 
      99       11815.2   0.000831702       212.576           1           1      129   
    Iter      log prob        ||dx||      ||grad||       alpha      alpha0  # evals  Notes 
      99         14237   0.000110107       129.771      0.6185      0.6185      123   
    Iter      log prob        ||dx||      ||grad||       alpha      alpha0  # evals  Notes 
     193       9584.68   2.43853e-07       134.725      0.9269      0.9269      257   
Optimization terminated normally: 
  Convergence detected: relative gradient magnitude is below tolerance
     177       11815.4    7.7614e-05       168.517   7.471e-07       0.001      283  LS failed, Hessian reset 
     199       11815.4   4.67294e-05       117.659           1           1      316   
    Iter      log prob        ||dx||      ||grad||       alpha      alpha0  # evals  Notes 
     199       14237.2   9.19379e-06       127.571       1.745       0.464      248   
    Iter      log prob        ||dx||      ||grad||       alpha      alpha0  # evals  Notes 
     208       14237.2   1.91024e-05       133.274    1.13e-07       0.001      300  LS failed, Hessian reset 
     222       14237.2   3.14098e-07       88.0867      0.2943           1      320   
Optimization terminated normally: 
  Convergence detected: relative gradient magnitude is below tolerance
     229       11815.4   5.86417e-06       81.9198   4.902e-08       0.001      414  LS failed, Hessian reset 
     234       11815.4   2.06154e-07       98.5205      0.1007      0.4186      423   
Optimization terminated normally: 
  Convergence detected: relative gradient magnitude is below tolerance
