[I 2020-10-01 02:40:58,746] Trial 111 finished with value: 0.04097330448499323 and parameters: {'changepoint_prior_scale': 0.0013293629318365846, 'seasonality_prior_scale': 0.7008553001654947, 'holidays_prior_scale': 0.02298530064496294, 'seasonality_mode': 'additive', 'changepoint_range': 0.5384586699891625}. Best is trial 96 with value: 0.038883738900888705.
Initial log joint probability = -28.8311
    Iter      log prob        ||dx||      ||grad||       alpha      alpha0  # evals  Notes 
      99       18912.3    9.3345e-05       4463.66      0.6024      0.6024      125   
    Iter      log prob        ||dx||      ||grad||       alpha      alpha0  # evals  Notes 
     193       18912.8    8.3335e-07       4371.13   1.927e-10       0.001      281  LS failed, Hessian reset 
     199       18912.8    1.0176e-07       4322.36      0.2346      0.2346      288   
    Iter      log prob        ||dx||      ||grad||       alpha      alpha0  # evals  Notes 
     221       18912.8   8.61097e-09       3856.43      0.2475      0.6055      316   
Optimization terminated normally: 
  Convergence detected: absolute parameter change was below tolerance
INFO:fbprophet:Making 5 forecasts with cutoffs between 2013-10-07 00:00:00 and 2015-10-18 00:00:00
INFO:fbprophet:Applying in parallel with <concurrent.futures.process.ProcessPoolExecutor object at 0x7fc88e6b7390>
Initial log joint probability = -8.95172
    Iter      log prob        ||dx||      ||grad||       alpha      alpha0  # evals  Notes 
Initial log joint probability = -12.7302
    Iter      log prob        ||dx||      ||grad||       alpha      alpha0  # evals  Notes 
Initial log joint probability = -15.1549
    Iter      log prob        ||dx||      ||grad||       alpha      alpha0  # evals  Notes 
Initial log joint probability = -18.717
    Iter      log prob        ||dx||      ||grad||       alpha      alpha0  # evals  Notes 
      66       4679.05    8.4139e-09       4459.78      0.4132      0.4132       91   
Optimization terminated normally: 
  Convergence detected: absolute parameter change was below tolerance
Initial log joint probability = -23.5879
    Iter      log prob        ||dx||      ||grad||       alpha      alpha0  # evals  Notes 
      74       7027.86   1.37048e-05        4419.7    2.95e-09       0.001      130  LS failed, Hessian reset 
      99        7027.9   3.24914e-07       4462.93           1           1      159   
    Iter      log prob        ||dx||      ||grad||       alpha      alpha0  # evals  Notes 
      61        9582.3   2.82834e-05       4455.73   5.858e-09       0.001      125  LS failed, Hessian reset 
      72       11813.2   4.38908e-09       3801.54      0.5434      0.5434      102   
Optimization terminated normally: 
  Convergence detected: absolute parameter change was below tolerance
     140       7028.02   1.84711e-05       4235.63   3.977e-09       0.001      256  LS failed, Hessian reset 
      99       9582.39   1.21965e-08       4298.47      0.4129      0.4129      169   
    Iter      log prob        ||dx||      ||grad||       alpha      alpha0  # evals  Notes 
     105       9582.39   7.45946e-09       4189.54      0.6662      0.6662      176   
Optimization terminated normally: 
  Convergence detected: absolute parameter change was below tolerance
     169       7028.08   6.71303e-09       3288.41       0.347       0.347      294   
Optimization terminated normally: 
  Convergence detected: absolute parameter change was below tolerance
      99       14233.5   7.08504e-07       4500.04       0.259           1      135   
    Iter      log prob        ||dx||      ||grad||       alpha      alpha0  # evals  Notes 
     125       14233.5    5.0232e-09       4185.04      0.3358      0.3358      170   
Optimization terminated normally: 
  Convergence detected: absolute parameter change was below tolerance
[I 2020-10-01 02:41:13,780] Trial 112 finished with value: 0.04130948052161768 and parameters: {'changepoint_prior_scale': 0.0011281605595142347, 'seasonality_prior_scale': 0.1622577667625627, 'holidays_prior_scale': 0.04794571944740945, 'seasonality_mode': 'additive', 'changepoint_range': 0.5257142292671052}. Best is trial 96 with value: 0.038883738900888705.
Initial log joint probability = -28.8311
    Iter      log prob        ||dx||      ||grad||       alpha      alpha0  # evals  Notes 
      99       18912.8    8.3906e-06       2822.29           1           1      124   
    Iter      log prob        ||dx||      ||grad||       alpha      alpha0  # evals  Notes 
     120         18913   1.47256e-06        2790.1   6.337e-10       0.001      193  LS failed, Hessian reset 
     159         18913   1.55912e-08       2750.92       0.268           1      242   
Optimization terminated normally: 
  Convergence detected: relative gradient magnitude is below tolerance
INFO:fbprophet:Making 5 forecasts with cutoffs between 2013-10-07 00:00:00 and 2015-10-18 00:00:00
INFO:fbprophet:Applying in parallel with <concurrent.futures.process.ProcessPoolExecutor object at 0x7fc84dc6f0d0>
Initial log joint probability = -8.95172
    Iter      log prob        ||dx||      ||grad||       alpha      alpha0  # evals  Notes 
Initial log joint probability = -12.7302
    Iter      log prob        ||dx||      ||grad||       alpha      alpha0  # evals  Notes 
Initial log joint probability = -15.1549
    Iter      log prob        ||dx||      ||grad||       alpha      alpha0  # evals  Notes 
Initial log joint probability = -18.717
    Iter      log prob        ||dx||      ||grad||       alpha      alpha0  # evals  Notes 
Initial log joint probability = -23.5879
    Iter      log prob        ||dx||      ||grad||       alpha      alpha0  # evals  Notes 
      85       4679.44    9.0014e-09       3191.95      0.8099      0.8099      113   
Optimization terminated normally: 
  Convergence detected: absolute parameter change was below tolerance
      99       7029.58   9.81374e-07       2523.71      0.6963      0.6963      124   
    Iter      log prob        ||dx||      ||grad||       alpha      alpha0  # evals  Notes 
     125       7029.59   3.54429e-09        3381.4      0.1726      0.1726      158   
Optimization terminated normally: 
  Convergence detected: absolute parameter change was below tolerance
      79       9582.58   8.39785e-09       2946.73     0.09515     0.09515      107   
Optimization terminated normally: 
  Convergence detected: absolute parameter change was below tolerance
      60       11813.2   8.44562e-09       3200.45      0.1413      0.1413       88   
Optimization terminated normally: 
  Convergence detected: absolute parameter change was below tolerance
      69       14232.6   6.84116e-05       3214.35    2.07e-08       0.001      132  LS failed, Hessian reset 
      99       14232.7   5.74332e-08       2957.16      0.1418      0.6112      170   
    Iter      log prob        ||dx||      ||grad||       alpha      alpha0  # evals  Notes 
     107       14232.7   4.43127e-09       3103.52      0.2592      0.2592      180   
Optimization terminated normally: 
  Convergence detected: absolute parameter change was below tolerance
[I 2020-10-01 02:41:27,492] Trial 113 finished with value: 0.04102538659289285 and parameters: {'changepoint_prior_scale': 0.0015781060644854347, 'seasonality_prior_scale': 0.36068336113510313, 'holidays_prior_scale': 0.09871250621995721, 'seasonality_mode': 'additive', 'changepoint_range': 0.5468388341044506}. Best is trial 96 with value: 0.038883738900888705.
Initial log joint probability = -28.8311
    Iter      log prob        ||dx||      ||grad||       alpha      alpha0  # evals  Notes 
      99       18912.2   2.15348e-05       3667.61           1           1      133   
    Iter      log prob        ||dx||      ||grad||       alpha      alpha0  # evals  Notes 
     143       18912.4   9.79042e-09        3621.6      0.4149           1      189   
Optimization terminated normally: 
  Convergence detected: absolute parameter change was below tolerance
INFO:fbprophet:Making 5 forecasts with cutoffs between 2013-10-07 00:00:00 and 2015-10-18 00:00:00
INFO:fbprophet:Applying in parallel with <concurrent.futures.process.ProcessPoolExecutor object at 0x7fc88e6509d0>
Initial log joint probability = -8.95172
    Iter      log prob        ||dx||      ||grad||       alpha      alpha0  # evals  Notes 
Initial log joint probability = -12.7302
    Iter      log prob        ||dx||      ||grad||       alpha      alpha0  # evals  Notes 
Initial log joint probability = -15.1549
    Iter      log prob        ||dx||      ||grad||       alpha      alpha0  # evals  Notes 
Initial log joint probability = -18.717
    Iter      log prob        ||dx||      ||grad||       alpha      alpha0  # evals  Notes 
Initial log joint probability = -23.5879
    Iter      log prob        ||dx||      ||grad||       alpha      alpha0  # evals  Notes 
      79        4678.7   9.00589e-09       3975.68      0.2819      0.2819      101   
Optimization terminated normally: 
  Convergence detected: absolute parameter change was below tolerance
      56       9582.56   9.20068e-09       3352.14      0.3327           1       78   
Optimization terminated normally: 
  Convergence detected: absolute parameter change was below tolerance
      79       7028.31    2.1671e-05       3071.79   5.598e-09       0.001      143  LS failed, Hessian reset 
      99        7028.4   4.24226e-07       3215.62           1           1      168   
    Iter      log prob        ||dx||      ||grad||       alpha      alpha0  # evals  Notes 
     123        7028.4   9.74443e-09       3004.07           1           1      197   
Optimization terminated normally: 
  Convergence detected: absolute parameter change was below tolerance
      65         11813   6.44847e-09       3247.47      0.6321      0.6321       98   
Optimization terminated normally: 
  Convergence detected: absolute parameter change was below tolerance
      99       14233.2   4.81419e-07       3908.76    0.007835           1      128   
    Iter      log prob        ||dx||      ||grad||       alpha      alpha0  # evals  Notes 
     163       14233.4   1.16444e-06       3604.15   3.043e-10       0.001      255  LS failed, Hessian reset 
     188       14233.4   9.93994e-09       3457.68      0.6169      0.6169      289   
Optimization terminated normally: 
  Convergence detected: absolute parameter change was below tolerance
[I 2020-10-01 02:41:43,034] Trial 114 finished with value: 0.041032276803944535 and parameters: {'changepoint_prior_scale': 0.0013355758401827045, 'seasonality_prior_scale': 0.2555586911320858, 'holidays_prior_scale': 0.040190155787627045, 'seasonality_mode': 'additive', 'changepoint_range': 0.6122691147036236}. Best is trial 96 with value: 0.038883738900888705.
Initial log joint probability = -28.8311
    Iter      log prob        ||dx||      ||grad||       alpha      alpha0  # evals  Notes 
      99       18911.9   6.94125e-05       4096.38           1           1      123   
    Iter      log prob        ||dx||      ||grad||       alpha      alpha0  # evals  Notes 
     140       18912.2   9.58519e-09       4837.66      0.1658      0.1658      178   
Optimization terminated normally: 
  Convergence detected: absolute parameter change was below tolerance
INFO:fbprophet:Making 5 forecasts with cutoffs between 2013-10-07 00:00:00 and 2015-10-18 00:00:00
INFO:fbprophet:Applying in parallel with <concurrent.futures.process.ProcessPoolExecutor object at 0x7fc88e6838d0>
Initial log joint probability = -8.95172
    Iter      log prob        ||dx||      ||grad||       alpha      alpha0  # evals  Notes 
Initial log joint probability = -12.7302
    Iter      log prob        ||dx||      ||grad||       alpha      alpha0  # evals  Notes 
Initial log joint probability = -15.1549
    Iter      log prob        ||dx||      ||grad||       alpha      alpha0  # evals  Notes 
Initial log joint probability = -18.717
    Iter      log prob        ||dx||      ||grad||       alpha      alpha0  # evals  Notes 
Initial log joint probability = -23.5879
    Iter      log prob        ||dx||      ||grad||       alpha      alpha0  # evals  Notes 
      66       4678.87   3.90751e-07       5135.58   7.507e-11       0.001      127  LS failed, Hessian reset 
      81       4678.87   4.82935e-09       4492.67      0.3361      0.8232      149   
Optimization terminated normally: 
  Convergence detected: absolute parameter change was below tolerance
      91       7027.59   7.13898e-09        4522.9      0.3802           1      120   
Optimization terminated normally: 
  Convergence detected: absolute parameter change was below tolerance
      61       9582.24   5.44204e-09       4736.01      0.2422      0.7928       87   
Optimization terminated normally: 
  Convergence detected: absolute parameter change was below tolerance
      61         11813   1.24827e-06       4944.02    2.73e-10       0.001      135  LS failed, Hessian reset 
      80         11813   5.63039e-09       5097.78      0.5461      0.5461      162   
Optimization terminated normally: 
  Convergence detected: absolute parameter change was below tolerance
      99         14232   4.80487e-08       4869.01           1           1      130   
    Iter      log prob        ||dx||      ||grad||       alpha      alpha0  # evals  Notes 
     101         14232   5.39903e-09        4457.7      0.2456      0.2456      133   
Optimization terminated normally: 
  Convergence detected: absolute parameter change was below tolerance
[I 2020-10-01 02:41:59,058] Trial 115 finished with value: 0.04079019073023584 and parameters: {'changepoint_prior_scale': 0.001024708145940205, 'seasonality_prior_scale': 0.1736358136115427, 'holidays_prior_scale': 0.14367345546668703, 'seasonality_mode': 'additive', 'changepoint_range': 0.5690175668635761}. Best is trial 96 with value: 0.038883738900888705.
Initial log joint probability = -28.8311
    Iter      log prob        ||dx||      ||grad||       alpha      alpha0  # evals  Notes 
      99         18913   4.88217e-06       3042.05     0.08075           1      129   
    Iter      log prob        ||dx||      ||grad||       alpha      alpha0  # evals  Notes 
     113         18913   6.09122e-08       2311.52      0.2761      0.9136      147   
Optimization terminated normally: 
  Convergence detected: relative gradient magnitude is below tolerance
INFO:fbprophet:Making 5 forecasts with cutoffs between 2013-10-07 00:00:00 and 2015-10-18 00:00:00
INFO:fbprophet:Applying in parallel with <concurrent.futures.process.ProcessPoolExecutor object at 0x7fc88e69a1d0>
Initial log joint probability = -8.95172
    Iter      log prob        ||dx||      ||grad||       alpha      alpha0  # evals  Notes 
Initial log joint probability = -12.7302
    Iter      log prob        ||dx||      ||grad||       alpha      alpha0  # evals  Notes 
Initial log joint probability = -15.1549
    Iter      log prob        ||dx||      ||grad||       alpha      alpha0  # evals  Notes 
      74       4679.42   6.34953e-09       2683.65      0.3266      0.3266      101   
Optimization terminated normally: 
  Convergence detected: absolute parameter change was below tolerance
Initial log joint probability = -18.717
    Iter      log prob        ||dx||      ||grad||       alpha      alpha0  # evals  Notes 
Initial log joint probability = -23.5879
    Iter      log prob        ||dx||      ||grad||       alpha      alpha0  # evals  Notes 
      99       7030.12   4.37471e-07       2323.18      0.2774           1      121   
    Iter      log prob        ||dx||      ||grad||       alpha      alpha0  # evals  Notes 
      49       9582.52   8.21117e-06       2732.28    2.93e-09       0.001      106  LS failed, Hessian reset 
     117        7030.2   2.51157e-05       2569.39   8.018e-09       0.001      185  LS failed, Hessian reset 
      78       9582.54   9.34162e-09       2449.14      0.2706           1      142   
Optimization terminated normally: 
  Convergence detected: absolute parameter change was below tolerance
      52       11813.2   1.32308e-08       2438.14      0.7015      0.7015       80   
Optimization terminated normally: 
  Convergence detected: relative gradient magnitude is below tolerance
     162       7030.28   4.62619e-07       2554.71   1.786e-10       0.001      284  LS failed, Hessian reset 
     178       7030.28    5.6074e-09       2726.62      0.4716      0.4716      303   
Optimization terminated normally: 
  Convergence detected: absolute parameter change was below tolerance
      99       14233.3   7.77966e-07       2391.53           1           1      134   
    Iter      log prob        ||dx||      ||grad||       alpha      alpha0  # evals  Notes 
     120       14233.3   3.15772e-08       2655.48       0.267           1      161   
Optimization terminated normally: 
  Convergence detected: relative gradient magnitude is below tolerance
[I 2020-10-01 02:42:13,278] Trial 116 finished with value: 0.04113814242206252 and parameters: {'changepoint_prior_scale': 0.001869942425829055, 'seasonality_prior_scale': 0.2040148405566313, 'holidays_prior_scale': 0.1286223711707476, 'seasonality_mode': 'additive', 'changepoint_range': 0.5677670445746326}. Best is trial 96 with value: 0.038883738900888705.
Initial log joint probability = -28.8311
    Iter      log prob        ||dx||      ||grad||       alpha      alpha0  # evals  Notes 
      99       18911.8   1.51068e-06       4536.01      0.4619      0.4619      124   
    Iter      log prob        ||dx||      ||grad||       alpha      alpha0  # evals  Notes 
     172       18912.1    4.7875e-09       3747.53      0.1624      0.1624      212   
Optimization terminated normally: 
  Convergence detected: absolute parameter change was below tolerance
INFO:fbprophet:Making 5 forecasts with cutoffs between 2013-10-07 00:00:00 and 2015-10-18 00:00:00
INFO:fbprophet:Applying in parallel with <concurrent.futures.process.ProcessPoolExecutor object at 0x7fc84dc6f790>
Initial log joint probability = -8.95172
    Iter      log prob        ||dx||      ||grad||       alpha      alpha0  # evals  Notes 
Initial log joint probability = -12.7302
    Iter      log prob        ||dx||      ||grad||       alpha      alpha0  # evals  Notes 
Initial log joint probability = -15.1549
    Iter      log prob        ||dx||      ||grad||       alpha      alpha0  # evals  Notes 
Initial log joint probability = -18.717
    Iter      log prob        ||dx||      ||grad||       alpha      alpha0  # evals  Notes 
Initial log joint probability = -23.5879
    Iter      log prob        ||dx||      ||grad||       alpha      alpha0  # evals  Notes 
      71       4673.79   0.000474421       4236.25   1.162e-07       0.001      168  LS failed, Hessian reset 
      99       4678.93   1.04228e-05       4595.12      0.4992      0.4992      202   
    Iter      log prob        ||dx||      ||grad||       alpha      alpha0  # evals  Notes 
      60       7027.75   4.13981e-05        4375.9   9.421e-09       0.001      117  LS failed, Hessian reset 
     132       4679.01    7.3364e-09       4294.65      0.4477      0.4477      246   
Optimization terminated normally: 
  Convergence detected: absolute parameter change was below tolerance
      66       9582.32    1.2959e-08        3878.6           1           1       89   
Optimization terminated normally: 
  Convergence detected: relative gradient magnitude is below tolerance
      99       7028.09   1.34508e-06       4447.41           1           1      165   
    Iter      log prob        ||dx||      ||grad||       alpha      alpha0  # evals  Notes 
      53       11813.1   6.64697e-09       4235.01      0.4775      0.4775       81   
Optimization terminated normally: 
  Convergence detected: absolute parameter change was below tolerance
     105       7028.11   1.09018e-06        3728.5   2.727e-10       0.001      209  LS failed, Hessian reset 
     198        7028.2   9.53955e-09       3711.19      0.6333      0.6333      325   
Optimization terminated normally: 
  Convergence detected: absolute parameter change was below tolerance
      98       14233.5   7.26143e-09       4497.59      0.3036      0.3036      135   
Optimization terminated normally: 
  Convergence detected: absolute parameter change was below tolerance
