[I 2020-10-01 02:19:45,168] Trial 28 finished with value: 0.04127195651359716 and parameters: {'changepoint_prior_scale': 0.0015214430282852807, 'seasonality_prior_scale': 0.1304316889056998, 'holidays_prior_scale': 5.588102283133185, 'seasonality_mode': 'additive', 'changepoint_range': 0.7467716871245548}. Best is trial 3 with value: 0.04098090703811677.
Initial log joint probability = -28.8311
    Iter      log prob        ||dx||      ||grad||       alpha      alpha0  # evals  Notes 
      48         18915   0.000113353        309.09    4.94e-07       0.001      104  LS failed, Hessian reset 
      75         18915   1.93126e-07       192.452     0.05689           1      145   
Optimization terminated normally: 
  Convergence detected: relative gradient magnitude is below tolerance
INFO:fbprophet:Making 5 forecasts with cutoffs between 2013-10-07 00:00:00 and 2015-10-18 00:00:00
INFO:fbprophet:Applying in parallel with <concurrent.futures.process.ProcessPoolExecutor object at 0x7fc88e6ae5d0>
Initial log joint probability = -8.95172
    Iter      log prob        ||dx||      ||grad||       alpha      alpha0  # evals  Notes 
Initial log joint probability = -12.7302
    Iter      log prob        ||dx||      ||grad||       alpha      alpha0  # evals  Notes 
Initial log joint probability = -15.1549
    Iter      log prob        ||dx||      ||grad||       alpha      alpha0  # evals  Notes 
Initial log joint probability = -18.717
    Iter      log prob        ||dx||      ||grad||       alpha      alpha0  # evals  Notes 
      72       4679.14   1.65828e-07       254.966           1           1       88   
Optimization terminated normally: 
  Convergence detected: relative gradient magnitude is below tolerance
Initial log joint probability = -23.5879
    Iter      log prob        ||dx||      ||grad||       alpha      alpha0  # evals  Notes 
      99       7034.81   5.92803e-07       189.647      0.5818      0.5818      145   
    Iter      log prob        ||dx||      ||grad||       alpha      alpha0  # evals  Notes 
     106       7034.81   1.34059e-07       124.544      0.9184      0.3211      157   
Optimization terminated normally: 
  Convergence detected: relative gradient magnitude is below tolerance
      99       9582.97   2.37624e-06       130.621      0.5237      0.5237      134   
    Iter      log prob        ||dx||      ||grad||       alpha      alpha0  # evals  Notes 
     123       9582.98   8.69389e-07       153.853       0.274      0.9348      171   
Optimization terminated normally: 
  Convergence detected: relative gradient magnitude is below tolerance
      56       14235.5    7.0078e-05       197.813   3.246e-07       0.001      116  LS failed, Hessian reset 
      98       11813.3   1.75136e-05       193.535   9.134e-08       0.001      184  LS failed, Hessian reset 
      99       11813.3   7.22046e-06       155.357           1           1      185   
    Iter      log prob        ||dx||      ||grad||       alpha      alpha0  # evals  Notes 
      68       14235.6   2.89302e-05       131.285   1.606e-07       0.001      164  LS failed, Hessian reset 
      83       14235.6   3.03731e-07       122.299       0.302           1      185   
Optimization terminated normally: 
  Convergence detected: relative gradient magnitude is below tolerance
     142       11813.3   4.59725e-05       185.536    2.27e-07       0.001      270  LS failed, Hessian reset 
     171       11813.3   4.23819e-07       166.776           1           1      306   
Optimization terminated normally: 
  Convergence detected: relative gradient magnitude is below tolerance
[I 2020-10-01 02:20:00,780] Trial 29 finished with value: 0.04265966007107027 and parameters: {'changepoint_prior_scale': 0.018635704613515065, 'seasonality_prior_scale': 0.04466756208061051, 'holidays_prior_scale': 0.32265557410948037, 'seasonality_mode': 'additive', 'changepoint_range': 0.6544779578002801}. Best is trial 3 with value: 0.04098090703811677.
Initial log joint probability = -28.8311
    Iter      log prob        ||dx||      ||grad||       alpha      alpha0  # evals  Notes 
      99       18905.2   2.88196e-05       4040.31      0.6815      0.6815      123   
    Iter      log prob        ||dx||      ||grad||       alpha      alpha0  # evals  Notes 
     147       18906.2   2.03606e-06       4623.24    4.31e-10       0.001      232  LS failed, Hessian reset 
     167       18906.2   3.35087e-09       4519.53       0.273       0.273      259   
Optimization terminated normally: 
  Convergence detected: absolute parameter change was below tolerance
INFO:fbprophet:Making 5 forecasts with cutoffs between 2013-10-07 00:00:00 and 2015-10-18 00:00:00
INFO:fbprophet:Applying in parallel with <concurrent.futures.process.ProcessPoolExecutor object at 0x7fc88e616250>
Initial log joint probability = -8.95172
    Iter      log prob        ||dx||      ||grad||       alpha      alpha0  # evals  Notes 
Initial log joint probability = -12.7302
    Iter      log prob        ||dx||      ||grad||       alpha      alpha0  # evals  Notes 
Initial log joint probability = -15.1549
    Iter      log prob        ||dx||      ||grad||       alpha      alpha0  # evals  Notes 
Initial log joint probability = -18.717
    Iter      log prob        ||dx||      ||grad||       alpha      alpha0  # evals  Notes 
Initial log joint probability = -23.5879
    Iter      log prob        ||dx||      ||grad||       alpha      alpha0  # evals  Notes 
      49       4667.03   0.000640547       4762.81   1.367e-07       0.001      101  LS failed, Hessian reset 
      89       4669.02    7.1111e-09       4667.82      0.6361      0.6361      155   
Optimization terminated normally: 
  Convergence detected: absolute parameter change was below tolerance
      71       7019.69   8.94718e-05       4801.48   1.865e-08       0.001      125  LS failed, Hessian reset 
      99       7019.97   1.65167e-07       4097.04      0.4214           1      160   
    Iter      log prob        ||dx||      ||grad||       alpha      alpha0  # evals  Notes 
      77       9574.47   9.93138e-09       4550.88      0.8034      0.8034      103   
Optimization terminated normally: 
  Convergence detected: absolute parameter change was below tolerance
      66       11805.4   8.45553e-09       4704.22      0.4871      0.4871       96   
Optimization terminated normally: 
  Convergence detected: absolute parameter change was below tolerance
     142       7020.15   2.05924e-05        4450.9   4.311e-09       0.001      267  LS failed, Hessian reset 
      99       14224.5   1.16608e-05       4999.47           1           1      131   
    Iter      log prob        ||dx||      ||grad||       alpha      alpha0  # evals  Notes 
     184       7020.36    9.2915e-06       4934.25   2.023e-09       0.001      359  LS failed, Hessian reset 
     199       7020.43   1.91437e-07       3608.07       0.208       0.208      379   
    Iter      log prob        ||dx||      ||grad||       alpha      alpha0  # evals  Notes 
     219       7020.44   4.30555e-09       4093.99      0.1527      0.1527      404   
Optimization terminated normally: 
  Convergence detected: absolute parameter change was below tolerance
     181       14224.8   5.66176e-09       4742.93      0.6234      0.6234      231   
Optimization terminated normally: 
  Convergence detected: absolute parameter change was below tolerance
[I 2020-10-01 02:20:16,370] Trial 30 finished with value: 0.041866855921488415 and parameters: {'changepoint_prior_scale': 0.0010559995897269686, 'seasonality_prior_scale': 0.010022707848259463, 'holidays_prior_scale': 0.2224191007765955, 'seasonality_mode': 'additive', 'changepoint_range': 0.6076092147731293}. Best is trial 3 with value: 0.04098090703811677.
Initial log joint probability = -28.8311
    Iter      log prob        ||dx||      ||grad||       alpha      alpha0  # evals  Notes 
      99       18912.9   2.16583e-06       2474.48      0.5589      0.5589      129   
    Iter      log prob        ||dx||      ||grad||       alpha      alpha0  # evals  Notes 
     147       18912.9   9.49739e-09       2444.04      0.2917      0.2917      194   
Optimization terminated normally: 
  Convergence detected: absolute parameter change was below tolerance
INFO:fbprophet:Making 5 forecasts with cutoffs between 2013-10-07 00:00:00 and 2015-10-18 00:00:00
INFO:fbprophet:Applying in parallel with <concurrent.futures.process.ProcessPoolExecutor object at 0x7fc88e69ab10>
Initial log joint probability = -8.95172
    Iter      log prob        ||dx||      ||grad||       alpha      alpha0  # evals  Notes 
Initial log joint probability = -12.7302
    Iter      log prob        ||dx||      ||grad||       alpha      alpha0  # evals  Notes 
Initial log joint probability = -15.1549
    Iter      log prob        ||dx||      ||grad||       alpha      alpha0  # evals  Notes 
Initial log joint probability = -18.717
    Iter      log prob        ||dx||      ||grad||       alpha      alpha0  # evals  Notes 
      59       4679.03   4.89802e-09       2971.87      0.3315      0.3315       83   
Optimization terminated normally: 
  Convergence detected: absolute parameter change was below tolerance
Initial log joint probability = -23.5879
    Iter      log prob        ||dx||      ||grad||       alpha      alpha0  # evals  Notes 
      99       7030.34   0.000710359       3068.16           1           1      124   
    Iter      log prob        ||dx||      ||grad||       alpha      alpha0  # evals  Notes 
      79       9582.47   5.92943e-09       2729.04       0.293       0.293      107   
Optimization terminated normally: 
  Convergence detected: absolute parameter change was below tolerance
     181       7032.08   4.53436e-09       2837.07      0.1137      0.1137      229   
Optimization terminated normally: 
  Convergence detected: absolute parameter change was below tolerance
      63       11813.1   3.23788e-06       3236.66     1.1e-09       0.001      133  LS failed, Hessian reset 
      83       11813.1   9.96256e-09       2645.69      0.4774      0.4774      160   
Optimization terminated normally: 
  Convergence detected: absolute parameter change was below tolerance
      99       14232.6   1.21743e-08       2301.67      0.3358           1      129   
Optimization terminated normally: 
  Convergence detected: relative gradient magnitude is below tolerance
[I 2020-10-01 02:20:31,740] Trial 31 finished with value: 0.04214283888533042 and parameters: {'changepoint_prior_scale': 0.0016473179866985587, 'seasonality_prior_scale': 0.11190108992811172, 'holidays_prior_scale': 6.033857669630604, 'seasonality_mode': 'additive', 'changepoint_range': 0.7548621663873603}. Best is trial 3 with value: 0.04098090703811677.
Initial log joint probability = -28.8311
    Iter      log prob        ||dx||      ||grad||       alpha      alpha0  # evals  Notes 
      99       18912.6   8.73183e-06       2020.88           1           1      125   
    Iter      log prob        ||dx||      ||grad||       alpha      alpha0  # evals  Notes 
     105       18912.6   3.05729e-06       2016.97   1.322e-09       0.001      179  LS failed, Hessian reset 
     132       18912.6   3.38541e-08       2014.66           1           1      213   
Optimization terminated normally: 
  Convergence detected: relative gradient magnitude is below tolerance
INFO:fbprophet:Making 5 forecasts with cutoffs between 2013-10-07 00:00:00 and 2015-10-18 00:00:00
INFO:fbprophet:Applying in parallel with <concurrent.futures.process.ProcessPoolExecutor object at 0x7fc88e6d4910>
Initial log joint probability = -8.95172
    Iter      log prob        ||dx||      ||grad||       alpha      alpha0  # evals  Notes 
Initial log joint probability = -12.7302
    Iter      log prob        ||dx||      ||grad||       alpha      alpha0  # evals  Notes 
Initial log joint probability = -15.1549
    Iter      log prob        ||dx||      ||grad||       alpha      alpha0  # evals  Notes 
      76       4679.25   7.35725e-09        2346.9      0.6062      0.6062       96   
Optimization terminated normally: 
  Convergence detected: absolute parameter change was below tolerance
Initial log joint probability = -18.717
    Iter      log prob        ||dx||      ||grad||       alpha      alpha0  # evals  Notes 
Initial log joint probability = -23.5879
    Iter      log prob        ||dx||      ||grad||       alpha      alpha0  # evals  Notes 
      99       7031.63   0.000281413       2179.13           1           1      118   
    Iter      log prob        ||dx||      ||grad||       alpha      alpha0  # evals  Notes 
      72       9582.37    2.4252e-08       2108.05     0.04663           1       99   
Optimization terminated normally: 
  Convergence detected: relative gradient magnitude is below tolerance
     136       7031.86    1.8236e-05       2381.83   7.606e-09       0.001      213  LS failed, Hessian reset 
     163       7031.92   7.43258e-06        2448.1    3.37e-09       0.001      286  LS failed, Hessian reset 
     192       7031.93   1.30622e-08       2006.46      0.2672           1      321   
Optimization terminated normally: 
  Convergence detected: relative gradient magnitude is below tolerance
      78       11813.1   2.22345e-05       2307.77   9.205e-09       0.001      169  LS failed, Hessian reset 
      99       14232.8   1.45892e-06       2147.91      0.2671      0.2671      144   
    Iter      log prob        ||dx||      ||grad||       alpha      alpha0  # evals  Notes 
      99       11813.1   8.86564e-08       2135.27           1           1      196   
    Iter      log prob        ||dx||      ||grad||       alpha      alpha0  # evals  Notes 
     107       11813.1   2.41666e-08       2143.62      0.7562      0.7562      205   
Optimization terminated normally: 
  Convergence detected: relative gradient magnitude is below tolerance
     147       14232.8   1.02097e-08          1725      0.5677      0.5677      200   
Optimization terminated normally: 
  Convergence detected: relative gradient magnitude is below tolerance
[I 2020-10-01 02:20:43,787] Trial 32 finished with value: 0.04203342589370138 and parameters: {'changepoint_prior_scale': 0.002205472480580425, 'seasonality_prior_scale': 0.06139817004133632, 'holidays_prior_scale': 5.484898333453817, 'seasonality_mode': 'additive', 'changepoint_range': 0.8745159383963368}. Best is trial 3 with value: 0.04098090703811677.
Initial log joint probability = -28.8311
    Iter      log prob        ||dx||      ||grad||       alpha      alpha0  # evals  Notes 
      88       18912.4   3.15992e-08        914.38     0.06512           1      123   
Optimization terminated normally: 
  Convergence detected: relative change in objective function was below tolerance
INFO:fbprophet:Making 5 forecasts with cutoffs between 2013-10-07 00:00:00 and 2015-10-18 00:00:00
INFO:fbprophet:Applying in parallel with <concurrent.futures.process.ProcessPoolExecutor object at 0x7fc88e5eccd0>
Initial log joint probability = -8.95172
    Iter      log prob        ||dx||      ||grad||       alpha      alpha0  # evals  Notes 
Initial log joint probability = -12.7302
    Iter      log prob        ||dx||      ||grad||       alpha      alpha0  # evals  Notes 
Initial log joint probability = -15.1549
    Iter      log prob        ||dx||      ||grad||       alpha      alpha0  # evals  Notes 
Initial log joint probability = -18.717
    Iter      log prob        ||dx||      ||grad||       alpha      alpha0  # evals  Notes 
      53       4679.34   3.63639e-05       1330.82   2.649e-08       0.001       95  LS failed, Hessian reset 
Initial log joint probability = -23.5879
    Iter      log prob        ||dx||      ||grad||       alpha      alpha0  # evals  Notes 
      82       4679.38   8.39635e-09       1362.31      0.4956      0.4956      135   
Optimization terminated normally: 
  Convergence detected: absolute parameter change was below tolerance
      99       7032.01   2.06701e-06        1449.5           1           1      125   
    Iter      log prob        ||dx||      ||grad||       alpha      alpha0  # evals  Notes 
     107       7032.01   3.41145e-07       1247.08   2.652e-10       0.001      172  LS failed, Hessian reset 
     118       7032.01   1.25516e-08       1318.49      0.2764           1      185   
Optimization terminated normally: 
  Convergence detected: relative gradient magnitude is below tolerance
      99       9582.64   2.09598e-06       1462.58           1           1      134   
    Iter      log prob        ||dx||      ||grad||       alpha      alpha0  # evals  Notes 
      47       11813.2   2.61183e-05       1381.95    1.98e-08       0.001      110  LS failed, Hessian reset 
      74       11813.2   5.12591e-08       1326.79      0.4181           1      144   
Optimization terminated normally: 
  Convergence detected: relative gradient magnitude is below tolerance
     151       9582.65   2.75398e-08       1175.32      0.2689           1      198   
Optimization terminated normally: 
  Convergence detected: relative gradient magnitude is below tolerance
      99       14233.2   3.24807e-05          1219           1           1      138   
    Iter      log prob        ||dx||      ||grad||       alpha      alpha0  # evals  Notes 
     171       14233.4   5.09267e-08       809.045      0.7086      0.7086      234   
Optimization terminated normally: 
  Convergence detected: relative gradient magnitude is below tolerance
[I 2020-10-01 02:20:59,640] Trial 33 finished with value: 0.04163804961375135 and parameters: {'changepoint_prior_scale': 0.0036875000406602215, 'seasonality_prior_scale': 0.16377234874999128, 'holidays_prior_scale': 1.339279966550534, 'seasonality_mode': 'additive', 'changepoint_range': 0.8012164566507822}. Best is trial 3 with value: 0.04098090703811677.
Initial log joint probability = -28.8311
    Iter      log prob        ||dx||      ||grad||       alpha      alpha0  # evals  Notes 
      99       18911.4   4.28817e-06       2892.93           1           1      118   
    Iter      log prob        ||dx||      ||grad||       alpha      alpha0  # evals  Notes 
     132       18911.4   5.66641e-09       2875.96      0.1906      0.1906      161   
Optimization terminated normally: 
  Convergence detected: absolute parameter change was below tolerance
INFO:fbprophet:Making 5 forecasts with cutoffs between 2013-10-07 00:00:00 and 2015-10-18 00:00:00
INFO:fbprophet:Applying in parallel with <concurrent.futures.process.ProcessPoolExecutor object at 0x7fc88e685b50>
Initial log joint probability = -8.95172
    Iter      log prob        ||dx||      ||grad||       alpha      alpha0  # evals  Notes 
Initial log joint probability = -12.7302
    Iter      log prob        ||dx||      ||grad||       alpha      alpha0  # evals  Notes 
Initial log joint probability = -15.1549
    Iter      log prob        ||dx||      ||grad||       alpha      alpha0  # evals  Notes 
Initial log joint probability = -18.717
    Iter      log prob        ||dx||      ||grad||       alpha      alpha0  # evals  Notes 
Initial log joint probability = -23.5879
    Iter      log prob        ||dx||      ||grad||       alpha      alpha0  # evals  Notes 
      89       4677.75   1.39826e-07       3711.48   3.977e-11       0.001      164  LS failed, Hessian reset 
      99       4677.75   1.45048e-08       3674.67      0.7547      0.7547      176   
    Iter      log prob        ||dx||      ||grad||       alpha      alpha0  # evals  Notes 
      50       7028.23   5.59244e-05       3476.36   1.579e-08       0.001      100  LS failed, Hessian reset 
     101       4677.75   9.16699e-09       3431.67      0.4107      0.4107      178   
Optimization terminated normally: 
  Convergence detected: absolute parameter change was below tolerance
      86       7028.36   5.36798e-09       3327.28      0.5608      0.5608      145   
Optimization terminated normally: 
  Convergence detected: absolute parameter change was below tolerance
      62       9580.97   1.52209e-05       3611.47   4.282e-09       0.001      123  LS failed, Hessian reset 
      92          9581   5.26105e-09       3250.64      0.4825      0.4825      165   
Optimization terminated normally: 
  Convergence detected: absolute parameter change was below tolerance
      99         14231   4.34339e-05       3304.35      0.4539      0.4539      121   
    Iter      log prob        ||dx||      ||grad||       alpha      alpha0  # evals  Notes 
      92       11811.8   2.88965e-07       3342.84    7.47e-11       0.001      174  LS failed, Hessian reset 
      99       11811.8   6.34156e-08       3425.71        1.28      0.2729      184   
    Iter      log prob        ||dx||      ||grad||       alpha      alpha0  # evals  Notes 
     103       11811.8   7.32119e-09       3423.01      0.2523           1      191   
Optimization terminated normally: 
  Convergence detected: absolute parameter change was below tolerance
     133       14231.1   1.83609e-08       3557.92      0.7853      0.7853      163   
Optimization terminated normally: 
  Convergence detected: relative gradient magnitude is below tolerance
