[I 2020-10-01 03:05:55,320] Trial 210 finished with value: 0.042027625357858506 and parameters: {'changepoint_prior_scale': 0.0017483958989304874, 'seasonality_prior_scale': 0.19326797152130282, 'holidays_prior_scale': 0.11202440749764152, 'seasonality_mode': 'additive', 'changepoint_range': 0.5001949276234625}. Best is trial 96 with value: 0.038883738900888705.
Initial log joint probability = -28.8311
    Iter      log prob        ||dx||      ||grad||       alpha      alpha0  # evals  Notes 
      99       18912.6   1.46258e-06       3607.21      0.3905      0.3905      129   
    Iter      log prob        ||dx||      ||grad||       alpha      alpha0  # evals  Notes 
     125       18912.6   1.29364e-07       3521.28   3.556e-11       0.001      198  LS failed, Hessian reset 
     132       18912.6   1.02134e-08       3510.73      0.3786           1      207   
Optimization terminated normally: 
  Convergence detected: relative gradient magnitude is below tolerance
INFO:fbprophet:Making 5 forecasts with cutoffs between 2013-10-07 00:00:00 and 2015-10-18 00:00:00
INFO:fbprophet:Applying in parallel with <concurrent.futures.process.ProcessPoolExecutor object at 0x7fc88e67fe50>
Initial log joint probability = -8.95172
    Iter      log prob        ||dx||      ||grad||       alpha      alpha0  # evals  Notes 
Initial log joint probability = -12.7302
    Iter      log prob        ||dx||      ||grad||       alpha      alpha0  # evals  Notes 
Initial log joint probability = -15.1549
    Iter      log prob        ||dx||      ||grad||       alpha      alpha0  # evals  Notes 
Initial log joint probability = -18.717
    Iter      log prob        ||dx||      ||grad||       alpha      alpha0  # evals  Notes 
Initial log joint probability = -23.5879
    Iter      log prob        ||dx||      ||grad||       alpha      alpha0  # evals  Notes 
      99       4679.35   6.43349e-09       3770.16      0.2392      0.2392      130   
Optimization terminated normally: 
  Convergence detected: absolute parameter change was below tolerance
      60       7028.83   6.03997e-05        3412.6   1.488e-08       0.001      110  LS failed, Hessian reset 
      99       7028.98   7.84402e-08       3338.86      0.5562      0.5562      165   
    Iter      log prob        ||dx||      ||grad||       alpha      alpha0  # evals  Notes 
      55       11813.3   5.77399e-09       3656.49      0.5098      0.5098       81   
Optimization terminated normally: 
  Convergence detected: absolute parameter change was below tolerance
      99       9582.47   6.17938e-07       3472.55        0.49      0.8856      124   
    Iter      log prob        ||dx||      ||grad||       alpha      alpha0  # evals  Notes 
     136       7028.99   3.73909e-09       3029.79      0.2429      0.2429      211   
Optimization terminated normally: 
  Convergence detected: absolute parameter change was below tolerance
     124       9582.48   1.55414e-08       3390.19      0.2126      0.8273      156   
Optimization terminated normally: 
  Convergence detected: relative gradient magnitude is below tolerance
      99       14233.5   2.61115e-05       3708.32      0.8812      0.8812      128   
    Iter      log prob        ||dx||      ||grad||       alpha      alpha0  # evals  Notes 
     120       14233.5   7.46584e-09       3889.33      0.3709      0.3709      154   
Optimization terminated normally: 
  Convergence detected: absolute parameter change was below tolerance
[I 2020-10-01 03:06:10,551] Trial 211 finished with value: 0.04143844153691767 and parameters: {'changepoint_prior_scale': 0.0013463455998964458, 'seasonality_prior_scale': 0.22336661932999383, 'holidays_prior_scale': 0.10733037963807522, 'seasonality_mode': 'additive', 'changepoint_range': 0.5334300692930022}. Best is trial 96 with value: 0.038883738900888705.
Initial log joint probability = -28.8311
    Iter      log prob        ||dx||      ||grad||       alpha      alpha0  # evals  Notes 
      99       18912.4   0.000327131       4002.82           1           1      117   
    Iter      log prob        ||dx||      ||grad||       alpha      alpha0  # evals  Notes 
     139       18912.6   8.26838e-09       3530.44      0.2841      0.2841      167   
Optimization terminated normally: 
  Convergence detected: absolute parameter change was below tolerance
INFO:fbprophet:Making 5 forecasts with cutoffs between 2013-10-07 00:00:00 and 2015-10-18 00:00:00
INFO:fbprophet:Applying in parallel with <concurrent.futures.process.ProcessPoolExecutor object at 0x7fc84dbb2b10>
Initial log joint probability = -8.95172
    Iter      log prob        ||dx||      ||grad||       alpha      alpha0  # evals  Notes 
Initial log joint probability = -12.7302
    Iter      log prob        ||dx||      ||grad||       alpha      alpha0  # evals  Notes 
Initial log joint probability = -15.1549
    Iter      log prob        ||dx||      ||grad||       alpha      alpha0  # evals  Notes 
Initial log joint probability = -18.717
    Iter      log prob        ||dx||      ||grad||       alpha      alpha0  # evals  Notes 
      61       4678.47   8.40881e-09       4026.12      0.3402      0.3402       83   
Optimization terminated normally: 
  Convergence detected: absolute parameter change was below tolerance
Initial log joint probability = -23.5879
    Iter      log prob        ||dx||      ||grad||       alpha      alpha0  # evals  Notes 
      80        7028.8   2.44497e-05       3850.54   6.311e-09       0.001      128  LS failed, Hessian reset 
      99       7028.94   7.20255e-07       3487.88      0.3339      0.3339      150   
    Iter      log prob        ||dx||      ||grad||       alpha      alpha0  # evals  Notes 
      72       9582.38   1.01649e-08       3244.87           1           1       95   
Optimization terminated normally: 
  Convergence detected: relative gradient magnitude is below tolerance
     121       7028.94   9.03719e-09       3301.44      0.8106      0.8106      182   
Optimization terminated normally: 
  Convergence detected: absolute parameter change was below tolerance
      99       11812.4   3.84168e-08       4006.86      0.3327           1      133   
    Iter      log prob        ||dx||      ||grad||       alpha      alpha0  # evals  Notes 
     107       11812.4    9.6518e-08       3936.71   2.408e-11       0.001      179  LS failed, Hessian reset 
      99       14232.4   3.49661e-06       3932.34       0.292           1      138   
    Iter      log prob        ||dx||      ||grad||       alpha      alpha0  # evals  Notes 
     113       11812.4   7.84395e-09       3917.28       0.373       0.373      186   
Optimization terminated normally: 
  Convergence detected: absolute parameter change was below tolerance
     137       14232.4   6.65783e-09       3823.25      0.2737      0.7745      184   
Optimization terminated normally: 
  Convergence detected: absolute parameter change was below tolerance
[I 2020-10-01 03:06:24,901] Trial 212 finished with value: 0.041272703155739845 and parameters: {'changepoint_prior_scale': 0.0012544571742100405, 'seasonality_prior_scale': 0.16034922628431938, 'holidays_prior_scale': 0.09327062106262297, 'seasonality_mode': 'additive', 'changepoint_range': 0.5178148984153809}. Best is trial 96 with value: 0.038883738900888705.
Initial log joint probability = -28.8311
    Iter      log prob        ||dx||      ||grad||       alpha      alpha0  # evals  Notes 
      99       18912.9   1.20891e-05       3246.91      0.1886           1      128   
    Iter      log prob        ||dx||      ||grad||       alpha      alpha0  # evals  Notes 
     132       18912.9   4.22046e-08       3070.41      0.9645      0.9645      168   
Optimization terminated normally: 
  Convergence detected: relative gradient magnitude is below tolerance
INFO:fbprophet:Making 5 forecasts with cutoffs between 2013-10-07 00:00:00 and 2015-10-18 00:00:00
INFO:fbprophet:Applying in parallel with <concurrent.futures.process.ProcessPoolExecutor object at 0x7fc84dc485d0>
Initial log joint probability = -8.95172
    Iter      log prob        ||dx||      ||grad||       alpha      alpha0  # evals  Notes 
Initial log joint probability = -12.7302
    Iter      log prob        ||dx||      ||grad||       alpha      alpha0  # evals  Notes 
Initial log joint probability = -15.1549
    Iter      log prob        ||dx||      ||grad||       alpha      alpha0  # evals  Notes 
Initial log joint probability = -18.717
    Iter      log prob        ||dx||      ||grad||       alpha      alpha0  # evals  Notes 
      75       4679.27   8.68468e-09       3172.59      0.2852           1       96   
Optimization terminated normally: 
  Convergence detected: absolute parameter change was below tolerance
Initial log joint probability = -23.5879
    Iter      log prob        ||dx||      ||grad||       alpha      alpha0  # evals  Notes 
      99        7029.6   1.89984e-06       3384.63           1           1      124   
    Iter      log prob        ||dx||      ||grad||       alpha      alpha0  # evals  Notes 
      60       9582.37   1.01575e-06       3154.05   3.126e-10       0.001      121  LS failed, Hessian reset 
     142       7029.69    8.3869e-06       3172.33   2.513e-09       0.001      211  LS failed, Hessian reset 
      77       9582.37   9.01414e-09       2666.52      0.3801      0.9714      142   
Optimization terminated normally: 
  Convergence detected: absolute parameter change was below tolerance
      36         11812   0.000326244       3049.56   1.107e-07       0.001      103  LS failed, Hessian reset 
     175        7029.7   6.88112e-09       2324.68       0.449       0.449      253   
Optimization terminated normally: 
  Convergence detected: absolute parameter change was below tolerance
      96       11813.3   2.41142e-09       3155.88      0.1269      0.1269      177   
Optimization terminated normally: 
  Convergence detected: absolute parameter change was below tolerance
      84       14231.9   0.000113882       3156.18   4.142e-08       0.001      147  LS failed, Hessian reset 
      99       14232.1   2.84985e-06       2563.94      0.4314      0.4314      165   
    Iter      log prob        ||dx||      ||grad||       alpha      alpha0  # evals  Notes 
     159       14232.2   2.46682e-08       2273.39      0.3806           1      241   
Optimization terminated normally: 
  Convergence detected: relative gradient magnitude is below tolerance
[I 2020-10-01 03:06:39,130] Trial 213 finished with value: 0.040763811453390336 and parameters: {'changepoint_prior_scale': 0.001564127100967154, 'seasonality_prior_scale': 0.20194059264018943, 'holidays_prior_scale': 0.13637958923124005, 'seasonality_mode': 'additive', 'changepoint_range': 0.5546814123265175}. Best is trial 96 with value: 0.038883738900888705.
Initial log joint probability = -28.8311
    Iter      log prob        ||dx||      ||grad||       alpha      alpha0  # evals  Notes 
      99       18912.9   7.63607e-06       2709.33           1           1      129   
    Iter      log prob        ||dx||      ||grad||       alpha      alpha0  # evals  Notes 
     105       18912.9   4.32848e-06       2505.35   1.673e-09       0.001      177  LS failed, Hessian reset 
     132       18912.9   1.76124e-08       2088.55      0.2605           1      212   
Optimization terminated normally: 
  Convergence detected: relative gradient magnitude is below tolerance
INFO:fbprophet:Making 5 forecasts with cutoffs between 2013-10-07 00:00:00 and 2015-10-18 00:00:00
INFO:fbprophet:Applying in parallel with <concurrent.futures.process.ProcessPoolExecutor object at 0x7fc84dc48890>
Initial log joint probability = -8.95172
    Iter      log prob        ||dx||      ||grad||       alpha      alpha0  # evals  Notes 
Initial log joint probability = -12.7302
    Iter      log prob        ||dx||      ||grad||       alpha      alpha0  # evals  Notes 
Initial log joint probability = -15.1549
    Iter      log prob        ||dx||      ||grad||       alpha      alpha0  # evals  Notes 
Initial log joint probability = -18.717
    Iter      log prob        ||dx||      ||grad||       alpha      alpha0  # evals  Notes 
      67       4679.38   4.75511e-09       2629.17        0.15        0.15       88   
Optimization terminated normally: 
  Convergence detected: absolute parameter change was below tolerance
Initial log joint probability = -23.5879
    Iter      log prob        ||dx||      ||grad||       alpha      alpha0  # evals  Notes 
      99       7031.49   0.000314044       2631.47       0.765       0.765      121   
    Iter      log prob        ||dx||      ||grad||       alpha      alpha0  # evals  Notes 
      62       9582.55   9.76252e-09       2572.12      0.3964      0.3964       88   
Optimization terminated normally: 
  Convergence detected: absolute parameter change was below tolerance
     138       7031.96   3.09002e-09       2543.84      0.2608      0.2608      173   
Optimization terminated normally: 
  Convergence detected: absolute parameter change was below tolerance
      54       11813.3   9.87408e-09       2640.12       0.355       0.355       84   
Optimization terminated normally: 
  Convergence detected: absolute parameter change was below tolerance
      99       14231.3   3.07028e-07       2865.59      0.7022      0.7022      126   
    Iter      log prob        ||dx||      ||grad||       alpha      alpha0  # evals  Notes 
     137       14231.3   8.76452e-09       2396.19      0.5509      0.5509      180   
Optimization terminated normally: 
  Convergence detected: absolute parameter change was below tolerance
[I 2020-10-01 03:06:54,793] Trial 214 finished with value: 0.04214777722283661 and parameters: {'changepoint_prior_scale': 0.0018937867619533042, 'seasonality_prior_scale': 0.20560129398980123, 'holidays_prior_scale': 0.15292078702260078, 'seasonality_mode': 'additive', 'changepoint_range': 0.5584250399678377}. Best is trial 96 with value: 0.038883738900888705.
Initial log joint probability = -28.8311
    Iter      log prob        ||dx||      ||grad||       alpha      alpha0  # evals  Notes 
      99       18912.9   2.20277e-05       3190.35           1           1      125   
    Iter      log prob        ||dx||      ||grad||       alpha      alpha0  # evals  Notes 
     124       18912.9   4.54083e-06       3135.28   1.312e-09       0.001      192  LS failed, Hessian reset 
     147       18912.9   2.40418e-08       2882.54      0.6521      0.1836      223   
Optimization terminated normally: 
  Convergence detected: relative gradient magnitude is below tolerance
INFO:fbprophet:Making 5 forecasts with cutoffs between 2013-10-07 00:00:00 and 2015-10-18 00:00:00
INFO:fbprophet:Applying in parallel with <concurrent.futures.process.ProcessPoolExecutor object at 0x7fc84dc1c610>
Initial log joint probability = -8.95172
    Iter      log prob        ||dx||      ||grad||       alpha      alpha0  # evals  Notes 
Initial log joint probability = -12.7302
    Iter      log prob        ||dx||      ||grad||       alpha      alpha0  # evals  Notes 
Initial log joint probability = -15.1549
    Iter      log prob        ||dx||      ||grad||       alpha      alpha0  # evals  Notes 
Initial log joint probability = -18.717
    Iter      log prob        ||dx||      ||grad||       alpha      alpha0  # evals  Notes 
      65       4679.33   8.07146e-09       3230.53      0.3553      0.3553       88   
Optimization terminated normally: 
  Convergence detected: absolute parameter change was below tolerance
Initial log joint probability = -23.5879
    Iter      log prob        ||dx||      ||grad||       alpha      alpha0  # evals  Notes 
      99       7029.63   1.58705e-06       3448.69           1           1      122   
    Iter      log prob        ||dx||      ||grad||       alpha      alpha0  # evals  Notes 
      66       9582.41   8.66508e-09        2595.6      0.4459      0.4459       94   
Optimization terminated normally: 
  Convergence detected: absolute parameter change was below tolerance
      27       11811.5   0.000313349       3200.28   1.073e-07       0.001      101  LS failed, Hessian reset 
     199       7031.51   5.31394e-08       3275.32       0.265       0.265      242   
    Iter      log prob        ||dx||      ||grad||       alpha      alpha0  # evals  Notes 
     217       7031.51   1.26944e-07       3277.66   4.023e-11       0.001      315  LS failed, Hessian reset 
     242       7031.51   7.99208e-09       3110.79      0.3045           1      343   
Optimization terminated normally: 
  Convergence detected: absolute parameter change was below tolerance
      85       11813.2    1.1916e-08       2929.28           1           1      171   
Optimization terminated normally: 
  Convergence detected: relative gradient magnitude is below tolerance
      88       14231.4   2.00734e-05        3082.4   5.675e-09       0.001      151  LS failed, Hessian reset 
      99       14231.4   6.71539e-07       2815.25      0.6725      0.6725      163   
    Iter      log prob        ||dx||      ||grad||       alpha      alpha0  # evals  Notes 
     152       14231.5   1.40713e-05       3171.97   4.732e-09       0.001      277  LS failed, Hessian reset 
     199       14231.5   2.76502e-08       3086.02      0.4357      0.4357      340   
    Iter      log prob        ||dx||      ||grad||       alpha      alpha0  # evals  Notes 
     207       14231.5   7.78718e-09       2016.89      0.2135      0.2135      350   
Optimization terminated normally: 
  Convergence detected: absolute parameter change was below tolerance
[I 2020-10-01 03:07:10,881] Trial 215 finished with value: 0.04101728868990747 and parameters: {'changepoint_prior_scale': 0.0015491710047410502, 'seasonality_prior_scale': 0.24827082057372388, 'holidays_prior_scale': 0.12820233598814199, 'seasonality_mode': 'additive', 'changepoint_range': 0.5487717015914544}. Best is trial 96 with value: 0.038883738900888705.
Initial log joint probability = -28.8311
    Iter      log prob        ||dx||      ||grad||       alpha      alpha0  # evals  Notes 
      99         18913   2.96478e-06        3031.7      0.4295      0.4295      115   
    Iter      log prob        ||dx||      ||grad||       alpha      alpha0  # evals  Notes 
     131         18913   4.93345e-08       2964.79      0.2986           1      157   
Optimization terminated normally: 
  Convergence detected: relative gradient magnitude is below tolerance
INFO:fbprophet:Making 5 forecasts with cutoffs between 2013-10-07 00:00:00 and 2015-10-18 00:00:00
INFO:fbprophet:Applying in parallel with <concurrent.futures.process.ProcessPoolExecutor object at 0x7fc84dbe84d0>
Initial log joint probability = -8.95172
    Iter      log prob        ||dx||      ||grad||       alpha      alpha0  # evals  Notes 
Initial log joint probability = -12.7302
    Iter      log prob        ||dx||      ||grad||       alpha      alpha0  # evals  Notes 
Initial log joint probability = -15.1549
    Iter      log prob        ||dx||      ||grad||       alpha      alpha0  # evals  Notes 
Initial log joint probability = -18.717
    Iter      log prob        ||dx||      ||grad||       alpha      alpha0  # evals  Notes 
      71       4679.05   8.29411e-09       3284.46      0.3341      0.3341       92   
Optimization terminated normally: 
  Convergence detected: absolute parameter change was below tolerance
Initial log joint probability = -23.5879
    Iter      log prob        ||dx||      ||grad||       alpha      alpha0  # evals  Notes 
      84       7029.28   3.02558e-05       3337.02   9.003e-09       0.001      137  LS failed, Hessian reset 
      99       7029.36   1.13351e-06       2966.68           1           1      155   
    Iter      log prob        ||dx||      ||grad||       alpha      alpha0  # evals  Notes 
      79       9582.47   3.07421e-09       3507.29      0.2841      0.2841      109   
Optimization terminated normally: 
  Convergence detected: absolute parameter change was below tolerance
     130       7029.37    9.8061e-09       3211.94           1           1      196   
Optimization terminated normally: 
  Convergence detected: absolute parameter change was below tolerance
      73       11813.2   5.54746e-09       3349.74     0.08409     0.08409      100   
Optimization terminated normally: 
  Convergence detected: absolute parameter change was below tolerance
      97       14233.4   5.32432e-09       2914.13       0.259       0.259      133   
Optimization terminated normally: 
  Convergence detected: absolute parameter change was below tolerance
