[I 2020-10-01 02:47:01,083] Trial 135 finished with value: 0.04089054951647289 and parameters: {'changepoint_prior_scale': 0.001254128982374097, 'seasonality_prior_scale': 0.122079748575876, 'holidays_prior_scale': 0.19367101186115915, 'seasonality_mode': 'additive', 'changepoint_range': 0.5520318395009363}. Best is trial 96 with value: 0.038883738900888705.
Initial log joint probability = -28.8311
    Iter      log prob        ||dx||      ||grad||       alpha      alpha0  # evals  Notes 
      99       18912.3   1.19846e-07       4353.72      0.2433      0.2433      128   
    Iter      log prob        ||dx||      ||grad||       alpha      alpha0  # evals  Notes 
     190       18912.6   3.94597e-08       4327.92      0.3221           1      239   
Optimization terminated normally: 
  Convergence detected: relative gradient magnitude is below tolerance
INFO:fbprophet:Making 5 forecasts with cutoffs between 2013-10-07 00:00:00 and 2015-10-18 00:00:00
INFO:fbprophet:Applying in parallel with <concurrent.futures.process.ProcessPoolExecutor object at 0x7fc84dc48350>
Initial log joint probability = -8.95172
    Iter      log prob        ||dx||      ||grad||       alpha      alpha0  # evals  Notes 
Initial log joint probability = -12.7302
    Iter      log prob        ||dx||      ||grad||       alpha      alpha0  # evals  Notes 
Initial log joint probability = -15.1549
    Iter      log prob        ||dx||      ||grad||       alpha      alpha0  # evals  Notes 
      99       4678.56   0.000169485       4364.29      0.5615      0.5615      124   
    Iter      log prob        ||dx||      ||grad||       alpha      alpha0  # evals  Notes 
Initial log joint probability = -18.717
    Iter      log prob        ||dx||      ||grad||       alpha      alpha0  # evals  Notes 
Initial log joint probability = -23.5879
     142       4678.78   7.21159e-09       4461.85      0.7266      0.7266      175   
Optimization terminated normally: 
  Convergence detected: absolute parameter change was below tolerance
    Iter      log prob        ||dx||      ||grad||       alpha      alpha0  # evals  Notes 
      76       7028.34   2.09141e-05       4126.79   4.473e-09       0.001      139  LS failed, Hessian reset 
      62       9582.32   7.48575e-09       3574.92      0.2059      0.2059       90   
Optimization terminated normally: 
  Convergence detected: absolute parameter change was below tolerance
      99       7028.48   9.90338e-08       4360.78      0.2549           1      166   
    Iter      log prob        ||dx||      ||grad||       alpha      alpha0  # evals  Notes 
     119       7028.48   6.17919e-09        4421.6      0.2872      0.2872      190   
Optimization terminated normally: 
  Convergence detected: absolute parameter change was below tolerance
      61       11813.1    9.8225e-07       4228.41   2.173e-10       0.001      138  LS failed, Hessian reset 
      96       11813.1    4.6373e-09       4282.05      0.2939      0.2939      183   
Optimization terminated normally: 
  Convergence detected: absolute parameter change was below tolerance
      95         14233   4.40065e-06       4327.98    1.01e-09       0.001      171  LS failed, Hessian reset 
      99         14233   7.31418e-07       3880.33      0.8805      0.8805      176   
    Iter      log prob        ||dx||      ||grad||       alpha      alpha0  # evals  Notes 
     113         14233   4.78752e-09       4624.42       0.183       0.183      194   
Optimization terminated normally: 
  Convergence detected: absolute parameter change was below tolerance
[I 2020-10-01 02:47:16,809] Trial 136 finished with value: 0.041174127226365584 and parameters: {'changepoint_prior_scale': 0.0011398820460304681, 'seasonality_prior_scale': 0.08958520922012064, 'holidays_prior_scale': 0.17807323764903, 'seasonality_mode': 'additive', 'changepoint_range': 0.5734099491219622}. Best is trial 96 with value: 0.038883738900888705.
Initial log joint probability = -28.8311
    Iter      log prob        ||dx||      ||grad||       alpha      alpha0  # evals  Notes 
      99       18914.9   2.14717e-06       176.925      0.3481           1      142   
    Iter      log prob        ||dx||      ||grad||       alpha      alpha0  # evals  Notes 
     120       18914.9   6.36816e-06       191.199   2.161e-08       0.001      208  LS failed, Hessian reset 
     144       18914.9   4.62243e-08        222.87      0.1479      0.1479      240   
Optimization terminated normally: 
  Convergence detected: relative gradient magnitude is below tolerance
INFO:fbprophet:Making 5 forecasts with cutoffs between 2013-10-07 00:00:00 and 2015-10-18 00:00:00
INFO:fbprophet:Applying in parallel with <concurrent.futures.process.ProcessPoolExecutor object at 0x7fc88e6aeb90>
Initial log joint probability = -8.95172
    Iter      log prob        ||dx||      ||grad||       alpha      alpha0  # evals  Notes 
Initial log joint probability = -12.7302
    Iter      log prob        ||dx||      ||grad||       alpha      alpha0  # evals  Notes 
Initial log joint probability = -15.1549
    Iter      log prob        ||dx||      ||grad||       alpha      alpha0  # evals  Notes 
Initial log joint probability = -18.717
    Iter      log prob        ||dx||      ||grad||       alpha      alpha0  # evals  Notes 
Initial log joint probability = -23.5879
    Iter      log prob        ||dx||      ||grad||       alpha      alpha0  # evals  Notes 
      70       4679.43   1.27784e-05       350.439   3.563e-08       0.001      134  LS failed, Hessian reset 
      96       4679.44   5.87209e-08       354.567           1           1      170   
Optimization terminated normally: 
  Convergence detected: relative gradient magnitude is below tolerance
      99       7033.91   1.40137e-05       205.408     0.06492           1      136   
    Iter      log prob        ||dx||      ||grad||       alpha      alpha0  # evals  Notes 
     100       7033.91   4.71213e-06       151.209   2.294e-08       0.001      178  LS failed, Hessian reset 
     116       7033.91   5.80046e-07       148.944    2.46e-09       0.001      249  LS failed, Hessian reset 
     118       7033.91   1.63096e-07       183.743           1           1      252   
Optimization terminated normally: 
  Convergence detected: relative gradient magnitude is below tolerance
      96       9583.01   7.89638e-06       173.844   5.963e-08       0.001      176  LS failed, Hessian reset 
      99       9583.01   3.19061e-07        221.88     0.04875           1      181   
    Iter      log prob        ||dx||      ||grad||       alpha      alpha0  # evals  Notes 
      90       11813.3   1.67199e-07       161.194      0.4772      0.4772      132   
Optimization terminated normally: 
  Convergence detected: relative gradient magnitude is below tolerance
      74       14235.4   9.97672e-05       307.103   3.292e-07       0.001      141  LS failed, Hessian reset 
     135       9583.01   1.25608e-06       225.949   6.596e-09       0.001      286  LS failed, Hessian reset 
     141       9583.01   7.37019e-08       162.862      0.3147      0.3147      296   
Optimization terminated normally: 
  Convergence detected: relative gradient magnitude is below tolerance
      99       14235.4   3.26389e-07       269.733      0.3649      0.3649      177   
    Iter      log prob        ||dx||      ||grad||       alpha      alpha0  # evals  Notes 
     112       14235.4   3.38728e-07       278.041           1           1      196   
Optimization terminated normally: 
  Convergence detected: relative gradient magnitude is below tolerance
[I 2020-10-01 02:47:32,696] Trial 137 finished with value: 0.041304538843292084 and parameters: {'changepoint_prior_scale': 0.013961336730197739, 'seasonality_prior_scale': 0.1209413069536262, 'holidays_prior_scale': 0.2551994722147779, 'seasonality_mode': 'additive', 'changepoint_range': 0.6068973605450366}. Best is trial 96 with value: 0.038883738900888705.
Initial log joint probability = -28.8311
    Iter      log prob        ||dx||      ||grad||       alpha      alpha0  # evals  Notes 
      87       18911.6   1.33834e-09       3172.37     0.02912     0.02912      119   
Optimization terminated normally: 
  Convergence detected: absolute parameter change was below tolerance
INFO:fbprophet:Making 5 forecasts with cutoffs between 2013-10-07 00:00:00 and 2015-10-18 00:00:00
INFO:fbprophet:Applying in parallel with <concurrent.futures.process.ProcessPoolExecutor object at 0x7fc88e6ae250>
Initial log joint probability = -8.95172
    Iter      log prob        ||dx||      ||grad||       alpha      alpha0  # evals  Notes 
Initial log joint probability = -12.7302
    Iter      log prob        ||dx||      ||grad||       alpha      alpha0  # evals  Notes 
Initial log joint probability = -15.1549
    Iter      log prob        ||dx||      ||grad||       alpha      alpha0  # evals  Notes 
Initial log joint probability = -18.717
    Iter      log prob        ||dx||      ||grad||       alpha      alpha0  # evals  Notes 
Initial log joint probability = -23.5879
    Iter      log prob        ||dx||      ||grad||       alpha      alpha0  # evals  Notes 
      90       4678.45   4.36725e-07       3931.62   1.106e-10       0.001      176  LS failed, Hessian reset 
      99       4678.45   2.69681e-08       3826.06      0.5598      0.5598      187   
    Iter      log prob        ||dx||      ||grad||       alpha      alpha0  # evals  Notes 
     102       4678.45   8.89985e-09       3958.74      0.6119      0.6119      190   
Optimization terminated normally: 
  Convergence detected: absolute parameter change was below tolerance
      99       7029.43    8.5636e-06       3956.49           1           1      125   
    Iter      log prob        ||dx||      ||grad||       alpha      alpha0  # evals  Notes 
      77        9581.9   4.38074e-09       4261.96      0.1392      0.1392      103   
Optimization terminated normally: 
  Convergence detected: absolute parameter change was below tolerance
     102       7029.45   4.57403e-06       4062.14   1.139e-09       0.001      165  LS failed, Hessian reset 
     147       7029.46   8.79759e-09       3984.83      0.9076      0.9076      219   
Optimization terminated normally: 
  Convergence detected: absolute parameter change was below tolerance
      57         11813   6.39352e-07       3941.46   1.587e-10       0.001      126  LS failed, Hessian reset 
      99       14233.1   5.02391e-07       3946.78      0.7546      0.7546      126   
    Iter      log prob        ||dx||      ||grad||       alpha      alpha0  # evals  Notes 
      72         11813   6.11661e-09       3984.37      0.2462      0.2462      148   
Optimization terminated normally: 
  Convergence detected: absolute parameter change was below tolerance
     117       14233.1   5.95737e-09       4083.38      0.5997      0.5997      147   
Optimization terminated normally: 
  Convergence detected: absolute parameter change was below tolerance
[I 2020-10-01 02:47:46,363] Trial 138 finished with value: 0.04277370116600897 and parameters: {'changepoint_prior_scale': 0.0012504650416942163, 'seasonality_prior_scale': 0.1416253682664926, 'holidays_prior_scale': 0.31964449017822677, 'seasonality_mode': 'multiplicative', 'changepoint_range': 0.5580678126900159}. Best is trial 96 with value: 0.038883738900888705.
Initial log joint probability = -28.8311
    Iter      log prob        ||dx||      ||grad||       alpha      alpha0  # evals  Notes 
      99       18920.4   8.25984e-05        60.248           1           1      116   
    Iter      log prob        ||dx||      ||grad||       alpha      alpha0  # evals  Notes 
     199         18921    0.00475246       143.111           1           1      232   
    Iter      log prob        ||dx||      ||grad||       alpha      alpha0  # evals  Notes 
     299       18921.3   0.000127253       64.0534           1           1      350   
    Iter      log prob        ||dx||      ||grad||       alpha      alpha0  # evals  Notes 
     393       18921.5   4.48944e-05       57.4954   1.023e-06       0.001      515  LS failed, Hessian reset 
     399       18921.6   3.23237e-05       49.3857      0.3679      0.3679      523   
    Iter      log prob        ||dx||      ||grad||       alpha      alpha0  # evals  Notes 
     448       18921.6   3.91973e-06       31.6945       0.235           1      589   
Optimization terminated normally: 
  Convergence detected: relative gradient magnitude is below tolerance
INFO:fbprophet:Making 5 forecasts with cutoffs between 2013-10-07 00:00:00 and 2015-10-18 00:00:00
INFO:fbprophet:Applying in parallel with <concurrent.futures.process.ProcessPoolExecutor object at 0x7fc88e69aa90>
Initial log joint probability = -8.95172
    Iter      log prob        ||dx||      ||grad||       alpha      alpha0  # evals  Notes 
Initial log joint probability = -12.7302
    Iter      log prob        ||dx||      ||grad||       alpha      alpha0  # evals  Notes 
Initial log joint probability = -15.1549
    Iter      log prob        ||dx||      ||grad||       alpha      alpha0  # evals  Notes 
Initial log joint probability = -18.717
    Iter      log prob        ||dx||      ||grad||       alpha      alpha0  # evals  Notes 
Initial log joint probability = -23.5879
    Iter      log prob        ||dx||      ||grad||       alpha      alpha0  # evals  Notes 
      98       4679.45    2.3429e-05       31.8295   4.203e-07       0.001      164  LS failed, Hessian reset 
      99       4679.45   1.10375e-05       32.4417           1           1      165   
    Iter      log prob        ||dx||      ||grad||       alpha      alpha0  # evals  Notes 
     125       4679.45   4.51431e-07       34.3076      0.4168           1      197   
Optimization terminated normally: 
  Convergence detected: relative gradient magnitude is below tolerance
      99       7039.04   0.000211237       145.355      0.2295           1      121   
    Iter      log prob        ||dx||      ||grad||       alpha      alpha0  # evals  Notes 
      99       9586.51   0.000445907       83.3675      0.8237      0.8237      127   
    Iter      log prob        ||dx||      ||grad||       alpha      alpha0  # evals  Notes 
      99       11818.9   0.000955313       75.0247       3.704      0.3704      123   
    Iter      log prob        ||dx||      ||grad||       alpha      alpha0  # evals  Notes 
     185       7039.38    1.0301e-05       19.6795   3.729e-07       0.001      277  LS failed, Hessian reset 
     199       7039.38   1.29652e-05       27.6404      0.8135      0.8135      294   
    Iter      log prob        ||dx||      ||grad||       alpha      alpha0  # evals  Notes 
     209       7039.38    8.8907e-07        22.815      0.4644     0.04644      320   
Optimization terminated normally: 
  Convergence detected: relative gradient magnitude is below tolerance
      99       14240.5   0.000300668       221.778           1           1      117   
    Iter      log prob        ||dx||      ||grad||       alpha      alpha0  # evals  Notes 
     199       9587.21   0.000170144       50.6908      0.2554           1      246   
    Iter      log prob        ||dx||      ||grad||       alpha      alpha0  # evals  Notes 
     216       9587.26   3.28803e-05       60.4961    5.38e-07       0.001      308  LS failed, Hessian reset 
     199       11819.4   0.000181934       42.8928           1           1      248   
    Iter      log prob        ||dx||      ||grad||       alpha      alpha0  # evals  Notes 
     267       9587.29   1.36337e-06       26.8767      0.3715           1      380   
Optimization terminated normally: 
  Convergence detected: relative gradient magnitude is below tolerance
     199         14241   0.000247849       73.0438           1           1      236   
    Iter      log prob        ||dx||      ||grad||       alpha      alpha0  # evals  Notes 
     257       11819.5     3.011e-05       59.6526   3.216e-07       0.001      370  LS failed, Hessian reset 
     299       11819.6   2.76837e-06       31.6894       1.275     0.01275      428   
    Iter      log prob        ||dx||      ||grad||       alpha      alpha0  # evals  Notes 
     228       14241.1   3.46734e-05       87.0622   2.956e-07       0.001      319  LS failed, Hessian reset 
     322       11819.6   1.00227e-06        29.821      0.2722           1      464   
Optimization terminated normally: 
  Convergence detected: relative gradient magnitude is below tolerance
     260       14241.2    2.5097e-05       69.5218   3.618e-07       0.001      399  LS failed, Hessian reset 
     299       14241.3   1.55609e-05       34.3051      0.3179           1      448   
    Iter      log prob        ||dx||      ||grad||       alpha      alpha0  # evals  Notes 
     306       14241.3   3.82637e-05       66.0958   1.086e-06       0.001      495  LS failed, Hessian reset 
     328       14241.3   2.39633e-06       31.8024      0.6609      0.6609      523   
Optimization terminated normally: 
  Convergence detected: relative gradient magnitude is below tolerance
[I 2020-10-01 02:48:04,855] Trial 139 finished with value: 0.047784567774251975 and parameters: {'changepoint_prior_scale': 0.114160144134009, 'seasonality_prior_scale': 0.09727900700988229, 'holidays_prior_scale': 0.20929359257446806, 'seasonality_mode': 'additive', 'changepoint_range': 0.5889382192749496}. Best is trial 96 with value: 0.038883738900888705.
Initial log joint probability = -28.8311
    Iter      log prob        ||dx||      ||grad||       alpha      alpha0  # evals  Notes 
      99       18911.8   0.000158424       5470.05           1           1      120   
    Iter      log prob        ||dx||      ||grad||       alpha      alpha0  # evals  Notes 
     175         18912   7.61247e-09       3764.33      0.1592      0.1592      220   
Optimization terminated normally: 
  Convergence detected: absolute parameter change was below tolerance
INFO:fbprophet:Making 5 forecasts with cutoffs between 2013-10-07 00:00:00 and 2015-10-18 00:00:00
INFO:fbprophet:Applying in parallel with <concurrent.futures.process.ProcessPoolExecutor object at 0x7fc88e6aeb90>
Initial log joint probability = -8.95172
    Iter      log prob        ||dx||      ||grad||       alpha      alpha0  # evals  Notes 
Initial log joint probability = -12.7302
    Iter      log prob        ||dx||      ||grad||       alpha      alpha0  # evals  Notes 
Initial log joint probability = -15.1549
    Iter      log prob        ||dx||      ||grad||       alpha      alpha0  # evals  Notes 
Initial log joint probability = -18.717
    Iter      log prob        ||dx||      ||grad||       alpha      alpha0  # evals  Notes 
      64       4678.85   7.21519e-09       5256.15      0.4961      0.4961       85   
Optimization terminated normally: 
  Convergence detected: absolute parameter change was below tolerance
Initial log joint probability = -23.5879
    Iter      log prob        ||dx||      ||grad||       alpha      alpha0  # evals  Notes 
      60       9582.35   4.50737e-09       4610.68      0.2395      0.2395       81   
Optimization terminated normally: 
  Convergence detected: absolute parameter change was below tolerance
      89        7028.1    9.3079e-07       5014.23   1.711e-10       0.001      148  LS failed, Hessian reset 
      99        7028.1   3.92084e-08       4528.55      0.2782           1      160   
    Iter      log prob        ||dx||      ||grad||       alpha      alpha0  # evals  Notes 
     100        7028.1   8.93546e-09       4605.22      0.2565      0.2565      161   
Optimization terminated normally: 
  Convergence detected: absolute parameter change was below tolerance
      54       11812.9   3.90367e-09       4943.12       0.303       0.303       77   
Optimization terminated normally: 
  Convergence detected: absolute parameter change was below tolerance
      99       14232.7   4.68523e-05       4872.38           1           1      130   
    Iter      log prob        ||dx||      ||grad||       alpha      alpha0  # evals  Notes 
     138       14232.8     2.319e-07       4564.99   4.492e-11       0.001      218  LS failed, Hessian reset 
     146       14232.8   7.25677e-09       5070.45      0.2962      0.2962      229   
Optimization terminated normally: 
  Convergence detected: absolute parameter change was below tolerance
