[I 2020-10-01 02:13:24,337] Trial 4 finished with value: 0.044931323720580216 and parameters: {'changepoint_prior_scale': 0.028643676150922025, 'seasonality_prior_scale': 0.23713674157888615, 'holidays_prior_scale': 2.536701634122711, 'seasonality_mode': 'additive', 'changepoint_range': 0.7230161926061418}. Best is trial 3 with value: 0.04098090703811677.
Initial log joint probability = -28.8311
    Iter      log prob        ||dx||      ||grad||       alpha      alpha0  # evals  Notes 
      99       18922.6   0.000736816       91.7649           1           1      114   
    Iter      log prob        ||dx||      ||grad||       alpha      alpha0  # evals  Notes 
     199       18923.6    0.00197851        95.929      0.8669      0.8669      235   
    Iter      log prob        ||dx||      ||grad||       alpha      alpha0  # evals  Notes 
     222       18923.7   0.000196458       138.618   4.519e-06       0.001      307  LS failed, Hessian reset 
     299       18923.7   0.000396201        51.722           1           1      412   
    Iter      log prob        ||dx||      ||grad||       alpha      alpha0  # evals  Notes 
     349       18923.8   0.000214453       136.321   4.174e-06       0.001      518  LS failed, Hessian reset 
     399       18923.8   1.44154e-05        35.491           1           1      578   
    Iter      log prob        ||dx||      ||grad||       alpha      alpha0  # evals  Notes 
     464       18923.9   4.26264e-05       85.7417   7.629e-07       0.001      704  LS failed, Hessian reset 
     491       18923.9   4.28391e-06       40.9274           1           1      738   
Optimization terminated normally: 
  Convergence detected: relative gradient magnitude is below tolerance
INFO:fbprophet:Making 5 forecasts with cutoffs between 2013-10-07 00:00:00 and 2015-10-18 00:00:00
INFO:fbprophet:Applying in parallel with <concurrent.futures.process.ProcessPoolExecutor object at 0x7fc88f416750>
Initial log joint probability = -8.95172
    Iter      log prob        ||dx||      ||grad||       alpha      alpha0  # evals  Notes 
Initial log joint probability = -12.7302
    Iter      log prob        ||dx||      ||grad||       alpha      alpha0  # evals  Notes 
Initial log joint probability = -15.1549
    Iter      log prob        ||dx||      ||grad||       alpha      alpha0  # evals  Notes 
Initial log joint probability = -18.717
    Iter      log prob        ||dx||      ||grad||       alpha      alpha0  # evals  Notes 
Initial log joint probability = -23.5879
    Iter      log prob        ||dx||      ||grad||       alpha      alpha0  # evals  Notes 
      93       4679.51   1.36803e-07       62.0389      0.1565           1      119   
Optimization terminated normally: 
  Convergence detected: relative gradient magnitude is below tolerance
      99       7038.83   0.000447002       46.6578           1           1      122   
    Iter      log prob        ||dx||      ||grad||       alpha      alpha0  # evals  Notes 
     113       7038.88    0.00013812       81.0611   2.145e-06       0.001      186  LS failed, Hessian reset 
      99       9585.89    0.00175859       67.1877           1           1      115   
    Iter      log prob        ||dx||      ||grad||       alpha      alpha0  # evals  Notes 
     165        7038.9   2.39611e-06       26.0313      0.1835      0.5377      254   
Optimization terminated normally: 
  Convergence detected: relative gradient magnitude is below tolerance
      99       11818.1   0.000999658       120.655           1           1      125   
    Iter      log prob        ||dx||      ||grad||       alpha      alpha0  # evals  Notes 
      99       14239.7   0.000650771       60.9364      0.3228           1      121   
    Iter      log prob        ||dx||      ||grad||       alpha      alpha0  # evals  Notes 
     199       9586.49    1.7539e-05       59.1399      0.5132      0.5132      237   
    Iter      log prob        ||dx||      ||grad||       alpha      alpha0  # evals  Notes 
     146       11818.4   7.79122e-05       134.584   5.104e-07       0.001      221  LS failed, Hessian reset 
     225       9586.49   1.29262e-05       46.1093   2.545e-07       0.001      307  LS failed, Hessian reset 
     245       9586.49   9.12621e-07       46.5345      0.6287      0.6287      334   
Optimization terminated normally: 
  Convergence detected: relative gradient magnitude is below tolerance
     199       11818.7    0.00114102       58.3081           1           1      282   
    Iter      log prob        ||dx||      ||grad||       alpha      alpha0  # evals  Notes 
     199       14240.4   5.14677e-05        52.755      0.4956      0.4956      241   
    Iter      log prob        ||dx||      ||grad||       alpha      alpha0  # evals  Notes 
     251       11818.9   3.30358e-05       60.3838   3.873e-07       0.001      379  LS failed, Hessian reset 
     240       14240.6   0.000109202       161.234    5.67e-07       0.001      329  LS failed, Hessian reset 
     299       11818.9   2.27847e-05       55.8919      0.7774      0.7774      438   
    Iter      log prob        ||dx||      ||grad||       alpha      alpha0  # evals  Notes 
     299       14240.6   1.28802e-06       43.6421      0.6037      0.6037      409   
    Iter      log prob        ||dx||      ||grad||       alpha      alpha0  # evals  Notes 
     322       11818.9   4.26515e-05       77.2855   5.035e-07       0.001      516  LS failed, Hessian reset 
     317       14240.7   3.17844e-06       54.3563           1           1      433   
Optimization terminated normally: 
  Convergence detected: relative gradient magnitude is below tolerance
     350       11818.9   3.16673e-07       41.0479      0.1025           1      553   
Optimization terminated normally: 
  Convergence detected: relative gradient magnitude is below tolerance
[I 2020-10-01 02:13:42,965] Trial 5 finished with value: 0.048960482741057416 and parameters: {'changepoint_prior_scale': 0.07654749202011547, 'seasonality_prior_scale': 4.1115698749786125, 'holidays_prior_scale': 1.893911505392635, 'seasonality_mode': 'additive', 'changepoint_range': 0.7624700596549938}. Best is trial 3 with value: 0.04098090703811677.
Initial log joint probability = -28.8311
    Iter      log prob        ||dx||      ||grad||       alpha      alpha0  # evals  Notes 
      99       18912.7   1.42959e-05       3956.66        0.27        0.27      126   
    Iter      log prob        ||dx||      ||grad||       alpha      alpha0  # evals  Notes 
     132       18912.8   1.77277e-08        3460.3      0.3658           1      167   
Optimization terminated normally: 
  Convergence detected: relative gradient magnitude is below tolerance
INFO:fbprophet:Making 5 forecasts with cutoffs between 2013-10-07 00:00:00 and 2015-10-18 00:00:00
INFO:fbprophet:Applying in parallel with <concurrent.futures.process.ProcessPoolExecutor object at 0x7fc88e693190>
Initial log joint probability = -8.95172
    Iter      log prob        ||dx||      ||grad||       alpha      alpha0  # evals  Notes 
Initial log joint probability = -12.7302
    Iter      log prob        ||dx||      ||grad||       alpha      alpha0  # evals  Notes 
Initial log joint probability = -15.1549
    Iter      log prob        ||dx||      ||grad||       alpha      alpha0  # evals  Notes 
      44       4678.08    8.5167e-05       3636.11   2.416e-08       0.001      103  LS failed, Hessian reset 
Initial log joint probability = -18.717
    Iter      log prob        ||dx||      ||grad||       alpha      alpha0  # evals  Notes 
      99       4678.85   4.39979e-07       3817.48      0.6335      0.6335      178   
    Iter      log prob        ||dx||      ||grad||       alpha      alpha0  # evals  Notes 
Initial log joint probability = -23.5879
    Iter      log prob        ||dx||      ||grad||       alpha      alpha0  # evals  Notes 
     106       4678.87     2.305e-06       3797.77   6.451e-10       0.001      235  LS failed, Hessian reset 
      80       7029.38   4.11666e-05       3530.87   1.226e-08       0.001      137  LS failed, Hessian reset 
      59       9582.07   8.87607e-09       3583.62      0.2176      0.2176       90   
Optimization terminated normally: 
  Convergence detected: absolute parameter change was below tolerance
      99       7029.54   6.55709e-07       3459.06       2.243      0.2243      161   
    Iter      log prob        ||dx||      ||grad||       alpha      alpha0  # evals  Notes 
     144       4678.94   4.35044e-06       3799.17   1.127e-09       0.001      322  LS failed, Hessian reset 
     186          4679   7.04831e-09       3807.42      0.2963      0.2963      376   
Optimization terminated normally: 
  Convergence detected: absolute parameter change was below tolerance
     136       7029.55   1.58091e-07       3964.36   4.415e-11       0.001      249  LS failed, Hessian reset 
      61       11812.6   5.27572e-09       3815.63      0.5308      0.5308       90   
Optimization terminated normally: 
  Convergence detected: absolute parameter change was below tolerance
     153       7029.55   9.80297e-09       3477.99      0.4119      0.4119      268   
Optimization terminated normally: 
  Convergence detected: absolute parameter change was below tolerance
      99       14232.1   5.99986e-08       3617.88       0.661       0.661      134   
    Iter      log prob        ||dx||      ||grad||       alpha      alpha0  # evals  Notes 
     108       14232.1   1.87166e-08       3236.93      0.9206      0.9206      147   
Optimization terminated normally: 
  Convergence detected: relative gradient magnitude is below tolerance
[I 2020-10-01 02:13:58,173] Trial 6 finished with value: 0.04207924252541777 and parameters: {'changepoint_prior_scale': 0.0013205616798111655, 'seasonality_prior_scale': 3.4570370246007074, 'holidays_prior_scale': 1.048224652818699, 'seasonality_mode': 'multiplicative', 'changepoint_range': 0.6621801828098576}. Best is trial 3 with value: 0.04098090703811677.
Initial log joint probability = -28.8311
    Iter      log prob        ||dx||      ||grad||       alpha      alpha0  # evals  Notes 
      99       18922.8    0.00056225       336.917      0.3762      0.3762      117   
    Iter      log prob        ||dx||      ||grad||       alpha      alpha0  # evals  Notes 
     199       18923.5   0.000113071       45.8175      0.9347   0.0009347      240   
    Iter      log prob        ||dx||      ||grad||       alpha      alpha0  # evals  Notes 
     224       18923.6   4.00075e-05       107.048   6.162e-07       0.001      322  LS failed, Hessian reset 
     299       18923.7   0.000610878       51.6776           1           1      410   
    Iter      log prob        ||dx||      ||grad||       alpha      alpha0  # evals  Notes 
     318       18923.7   7.17684e-05       135.823   1.076e-06       0.001      478  LS failed, Hessian reset 
     383       18923.7   2.01481e-06       35.7761      0.2288           1      557   
Optimization terminated normally: 
  Convergence detected: relative gradient magnitude is below tolerance
INFO:fbprophet:Making 5 forecasts with cutoffs between 2013-10-07 00:00:00 and 2015-10-18 00:00:00
INFO:fbprophet:Applying in parallel with <concurrent.futures.process.ProcessPoolExecutor object at 0x7fc88e6df250>
Initial log joint probability = -8.95172
    Iter      log prob        ||dx||      ||grad||       alpha      alpha0  # evals  Notes 
Initial log joint probability = -12.7302
    Iter      log prob        ||dx||      ||grad||       alpha      alpha0  # evals  Notes 
Initial log joint probability = -15.1549
    Iter      log prob        ||dx||      ||grad||       alpha      alpha0  # evals  Notes 
Initial log joint probability = -18.717
    Iter      log prob        ||dx||      ||grad||       alpha      alpha0  # evals  Notes 
Initial log joint probability = -23.5879
    Iter      log prob        ||dx||      ||grad||       alpha      alpha0  # evals  Notes 
      99       4679.49   9.23924e-06       63.3751      0.6229      0.6229      120   
    Iter      log prob        ||dx||      ||grad||       alpha      alpha0  # evals  Notes 
     120       4679.49   2.03089e-06       64.0387      0.3223           1      145   
Optimization terminated normally: 
  Convergence detected: relative gradient magnitude is below tolerance
      99       7038.86   0.000609179       84.6078           1           1      117   
    Iter      log prob        ||dx||      ||grad||       alpha      alpha0  # evals  Notes 
     106        7038.9   6.56042e-05       70.7948   8.051e-07       0.001      168  LS failed, Hessian reset 
      99       9586.03   0.000340574        70.906      0.6772      0.6772      124   
    Iter      log prob        ||dx||      ||grad||       alpha      alpha0  # evals  Notes 
     150       7038.92   1.78967e-06       41.1627   5.119e-08       0.001      269  LS failed, Hessian reset 
     152       7038.92   5.38886e-07       29.1533      0.3387           1      272   
Optimization terminated normally: 
  Convergence detected: relative gradient magnitude is below tolerance
      99       11818.2   0.000305324       75.0178      0.4416      0.4416      122   
    Iter      log prob        ||dx||      ||grad||       alpha      alpha0  # evals  Notes 
      99       14239.7    0.00090446        109.42      0.4069      0.4069      117   
    Iter      log prob        ||dx||      ||grad||       alpha      alpha0  # evals  Notes 
     185       9586.51   8.91434e-05       62.5852   1.394e-06       0.001      264  LS failed, Hessian reset 
     199       9586.51   1.99168e-06       46.1661      0.1828           1      279   
    Iter      log prob        ||dx||      ||grad||       alpha      alpha0  # evals  Notes 
     233       9586.52    1.2045e-07       37.5989     0.06384           1      328   
Optimization terminated normally: 
  Convergence detected: relative gradient magnitude is below tolerance
     199       11818.8     0.0110753       109.115           1           1      236   
    Iter      log prob        ||dx||      ||grad||       alpha      alpha0  # evals  Notes 
     199       14240.5    1.8365e-05       42.7608       0.432       0.432      239   
    Iter      log prob        ||dx||      ||grad||       alpha      alpha0  # evals  Notes 
     299         11819   5.88134e-05       41.7279           1           1      366   
    Iter      log prob        ||dx||      ||grad||       alpha      alpha0  # evals  Notes 
     243       14240.6   0.000159269       149.453   1.276e-06       0.001      344  LS failed, Hessian reset 
     330         11819   1.30039e-07       44.1588      0.1278      0.4948      411   
Optimization terminated normally: 
  Convergence detected: relative gradient magnitude is below tolerance
     295       14240.7   2.06877e-05       43.5791    5.16e-07       0.001      446  LS failed, Hessian reset 
     299       14240.7   5.39918e-06       41.0326     0.07086           1      452   
    Iter      log prob        ||dx||      ||grad||       alpha      alpha0  # evals  Notes 
     324       14240.7   1.61196e-05       43.1379   3.033e-07       0.001      527  LS failed, Hessian reset 
     364       14240.7   5.25519e-05       74.3543   8.882e-07       0.001      616  LS failed, Hessian reset 
     375       14240.7    8.8187e-07       55.5616      0.3853           1      634   
Optimization terminated normally: 
  Convergence detected: relative gradient magnitude is below tolerance
