[I 2020-10-01 04:01:16,550] Trial 427 finished with value: 0.042231695440684794 and parameters: {'changepoint_prior_scale': 0.0018505988671670475, 'seasonality_prior_scale': 0.19086329254727238, 'holidays_prior_scale': 0.10550815036918543, 'seasonality_mode': 'additive', 'changepoint_range': 0.5648008071593457}. Best is trial 96 with value: 0.038883738900888705.
Initial log joint probability = -28.8311
    Iter      log prob        ||dx||      ||grad||       alpha      alpha0  # evals  Notes 
      99       18912.8   3.61264e-06        4047.5      0.6255      0.6255      121   
    Iter      log prob        ||dx||      ||grad||       alpha      alpha0  # evals  Notes 
     117       18912.8   9.84253e-09       3884.37      0.4959      0.4959      142   
Optimization terminated normally: 
  Convergence detected: absolute parameter change was below tolerance
INFO:fbprophet:Making 5 forecasts with cutoffs between 2013-10-07 00:00:00 and 2015-10-18 00:00:00
INFO:fbprophet:Applying in parallel with <concurrent.futures.process.ProcessPoolExecutor object at 0x7fc84dcaadd0>
Initial log joint probability = -8.95172
    Iter      log prob        ||dx||      ||grad||       alpha      alpha0  # evals  Notes 
Initial log joint probability = -12.7302
    Iter      log prob        ||dx||      ||grad||       alpha      alpha0  # evals  Notes 
Initial log joint probability = -15.1549
    Iter      log prob        ||dx||      ||grad||       alpha      alpha0  # evals  Notes 
Initial log joint probability = -18.717
    Iter      log prob        ||dx||      ||grad||       alpha      alpha0  # evals  Notes 
Initial log joint probability = -23.5879
    Iter      log prob        ||dx||      ||grad||       alpha      alpha0  # evals  Notes 
      58       4679.17   3.30991e-06       3927.67   7.693e-10       0.001      121  LS failed, Hessian reset 
      88       4679.21   2.93219e-09       4122.83      0.1672      0.1672      159   
Optimization terminated normally: 
  Convergence detected: absolute parameter change was below tolerance
      98       7028.37   7.67534e-09       3707.69      0.2682      0.2682      122   
Optimization terminated normally: 
  Convergence detected: absolute parameter change was below tolerance
      60       9582.37   7.10154e-09       4132.62      0.2967      0.2967       89   
Optimization terminated normally: 
  Convergence detected: absolute parameter change was below tolerance
      50       11813.1   2.36865e-09       3848.79      0.1618      0.1618       73   
Optimization terminated normally: 
  Convergence detected: absolute parameter change was below tolerance
      96       14233.1   5.73254e-09       3738.47      0.3379      0.3379      122   
Optimization terminated normally: 
  Convergence detected: absolute parameter change was below tolerance
[I 2020-10-01 04:01:30,960] Trial 428 finished with value: 0.040864954567620126 and parameters: {'changepoint_prior_scale': 0.0011991159547232546, 'seasonality_prior_scale': 0.12029305930134127, 'holidays_prior_scale': 0.1570667827073368, 'seasonality_mode': 'additive', 'changepoint_range': 0.589243242038824}. Best is trial 96 with value: 0.038883738900888705.
Initial log joint probability = -28.8311
    Iter      log prob        ||dx||      ||grad||       alpha      alpha0  # evals  Notes 
      99       18912.5     2.455e-07       3302.22           1           1      125   
    Iter      log prob        ||dx||      ||grad||       alpha      alpha0  # evals  Notes 
     116       18912.5   2.95213e-08       3370.88      0.2746      0.7556      147   
Optimization terminated normally: 
  Convergence detected: relative gradient magnitude is below tolerance
INFO:fbprophet:Making 5 forecasts with cutoffs between 2013-10-07 00:00:00 and 2015-10-18 00:00:00
INFO:fbprophet:Applying in parallel with <concurrent.futures.process.ProcessPoolExecutor object at 0x7fc84dc723d0>
Initial log joint probability = -8.95172
    Iter      log prob        ||dx||      ||grad||       alpha      alpha0  # evals  Notes 
Initial log joint probability = -12.7302
    Iter      log prob        ||dx||      ||grad||       alpha      alpha0  # evals  Notes 
Initial log joint probability = -15.1549
    Iter      log prob        ||dx||      ||grad||       alpha      alpha0  # evals  Notes 
Initial log joint probability = -18.717
    Iter      log prob        ||dx||      ||grad||       alpha      alpha0  # evals  Notes 
Initial log joint probability = -23.5879
    Iter      log prob        ||dx||      ||grad||       alpha      alpha0  # evals  Notes 
      99       4678.78   1.29474e-06       3589.73           1           1      133   
    Iter      log prob        ||dx||      ||grad||       alpha      alpha0  # evals  Notes 
     145       4678.83   8.75352e-09       3505.42      0.5233      0.5233      190   
Optimization terminated normally: 
  Convergence detected: absolute parameter change was below tolerance
      99       7028.53   9.87785e-06       3409.86      0.3538           1      134   
    Iter      log prob        ||dx||      ||grad||       alpha      alpha0  # evals  Notes 
      68       9582.42   8.33513e-09       3106.73      0.4503      0.4503      102   
Optimization terminated normally: 
  Convergence detected: absolute parameter change was below tolerance
      32       11811.4   9.68577e-05       3138.03   3.158e-08       0.001      108  LS failed, Hessian reset 
     199       7030.74   9.90386e-08       3491.92      0.4647      0.4647      261   
    Iter      log prob        ||dx||      ||grad||       alpha      alpha0  # evals  Notes 
     207       7030.74   5.32094e-09       3089.37      0.2926      0.2926      272   
Optimization terminated normally: 
  Convergence detected: absolute parameter change was below tolerance
      72         11813   7.52001e-09       3443.06      0.1731      0.1731      154   
Optimization terminated normally: 
  Convergence detected: absolute parameter change was below tolerance
      99       14232.4   4.58728e-08       3136.57      0.4852      0.4852      130   
    Iter      log prob        ||dx||      ||grad||       alpha      alpha0  # evals  Notes 
     109       14232.4   1.31894e-07       2861.64   3.658e-11       0.001      181  LS failed, Hessian reset 
     115       14232.4   5.17454e-09       3131.37      0.1871      0.1871      189   
Optimization terminated normally: 
  Convergence detected: absolute parameter change was below tolerance
[I 2020-10-01 04:01:45,771] Trial 429 finished with value: 0.041672574050338064 and parameters: {'changepoint_prior_scale': 0.0014309352087119712, 'seasonality_prior_scale': 0.10212182015762683, 'holidays_prior_scale': 0.217480954640856, 'seasonality_mode': 'additive', 'changepoint_range': 0.5579375566398327}. Best is trial 96 with value: 0.038883738900888705.
Initial log joint probability = -28.8311
    Iter      log prob        ||dx||      ||grad||       alpha      alpha0  # evals  Notes 
      45       18913.5   1.79459e-07       460.359           1           1       73   
Optimization terminated normally: 
  Convergence detected: relative gradient magnitude is below tolerance
INFO:fbprophet:Making 5 forecasts with cutoffs between 2013-10-07 00:00:00 and 2015-10-18 00:00:00
INFO:fbprophet:Applying in parallel with <concurrent.futures.process.ProcessPoolExecutor object at 0x7fc84dca44d0>
Initial log joint probability = -8.95172
    Iter      log prob        ||dx||      ||grad||       alpha      alpha0  # evals  Notes 
Initial log joint probability = -12.7302
    Iter      log prob        ||dx||      ||grad||       alpha      alpha0  # evals  Notes 
Initial log joint probability = -15.1549
    Iter      log prob        ||dx||      ||grad||       alpha      alpha0  # evals  Notes 
Initial log joint probability = -18.717
    Iter      log prob        ||dx||      ||grad||       alpha      alpha0  # evals  Notes 
      57       4679.46   6.78598e-09         712.9      0.1872      0.1872       75   
Optimization terminated normally: 
  Convergence detected: absolute parameter change was below tolerance
Initial log joint probability = -23.5879
    Iter      log prob        ||dx||      ||grad||       alpha      alpha0  # evals  Notes 
      98       7032.16   1.05255e-06       477.516   3.203e-09       0.001      174  LS failed, Hessian reset 
      99       7032.16   4.10975e-07        429.14           1           1      175   
    Iter      log prob        ||dx||      ||grad||       alpha      alpha0  # evals  Notes 
     109       7032.16   3.17287e-08       388.421      0.2288           1      189   
Optimization terminated normally: 
  Convergence detected: relative gradient magnitude is below tolerance
      89       9582.65   6.76482e-08       369.915      0.3303           1      129   
Optimization terminated normally: 
  Convergence detected: relative gradient magnitude is below tolerance
      80       11813.1   1.98654e-07       548.371      0.6923      0.6923      125   
Optimization terminated normally: 
  Convergence detected: relative gradient magnitude is below tolerance
      99       14233.9   2.06017e-05       655.714           1           1      132   
    Iter      log prob        ||dx||      ||grad||       alpha      alpha0  # evals  Notes 
     105         14234    9.0795e-05       615.253   1.355e-07       0.001      183  LS failed, Hessian reset 
     138       14234.1   4.34619e-08       591.444      0.3188           1      230   
Optimization terminated normally: 
  Convergence detected: relative gradient magnitude is below tolerance
[I 2020-10-01 04:02:00,262] Trial 430 finished with value: 0.0421826702726651 and parameters: {'changepoint_prior_scale': 0.006971413000483471, 'seasonality_prior_scale': 0.13541931974349067, 'holidays_prior_scale': 0.1841687747635489, 'seasonality_mode': 'additive', 'changepoint_range': 0.5560498978546061}. Best is trial 96 with value: 0.038883738900888705.
Initial log joint probability = -28.8311
    Iter      log prob        ||dx||      ||grad||       alpha      alpha0  # evals  Notes 
      92       18912.6    5.9852e-08       2505.38           1           1      118   
Optimization terminated normally: 
  Convergence detected: relative gradient magnitude is below tolerance
INFO:fbprophet:Making 5 forecasts with cutoffs between 2013-10-07 00:00:00 and 2015-10-18 00:00:00
INFO:fbprophet:Applying in parallel with <concurrent.futures.process.ProcessPoolExecutor object at 0x7fc84dcafdd0>
Initial log joint probability = -8.95172
    Iter      log prob        ||dx||      ||grad||       alpha      alpha0  # evals  Notes 
Initial log joint probability = -12.7302
    Iter      log prob        ||dx||      ||grad||       alpha      alpha0  # evals  Notes 
Initial log joint probability = -15.1549
    Iter      log prob        ||dx||      ||grad||       alpha      alpha0  # evals  Notes 
Initial log joint probability = -18.717
    Iter      log prob        ||dx||      ||grad||       alpha      alpha0  # evals  Notes 
Initial log joint probability = -23.5879
    Iter      log prob        ||dx||      ||grad||       alpha      alpha0  # evals  Notes 
      85       4679.05   9.37145e-09       2750.53      0.4832      0.4832      111   
Optimization terminated normally: 
  Convergence detected: absolute parameter change was below tolerance
      99       7029.53   1.97803e-06       2975.05       0.475       0.475      125   
    Iter      log prob        ||dx||      ||grad||       alpha      alpha0  # evals  Notes 
      62         11813    8.0906e-09        2908.1      0.1923      0.1923       89   
Optimization terminated normally: 
  Convergence detected: absolute parameter change was below tolerance
      59       9582.43   7.03944e-06       3010.54   2.451e-09       0.001      130  LS failed, Hessian reset 
     199       7030.81   4.63905e-07       2532.17           1           1      252   
    Iter      log prob        ||dx||      ||grad||       alpha      alpha0  # evals  Notes 
      97       9582.45   4.48507e-09       2983.67      0.1619      0.1619      176   
Optimization terminated normally: 
  Convergence detected: absolute parameter change was below tolerance
     267       7031.36   3.64931e-06       2908.34   1.259e-09       0.001      374  LS failed, Hessian reset 
      81       14233.4   1.53379e-05       3204.96   5.733e-09       0.001      151  LS failed, Hessian reset 
     287       7031.36   7.62549e-09       2842.52      0.2567      0.2567      403   
Optimization terminated normally: 
  Convergence detected: absolute parameter change was below tolerance
      99       14233.4   5.58671e-06       2834.05           1           1      171   
    Iter      log prob        ||dx||      ||grad||       alpha      alpha0  # evals  Notes 
     137       14233.6   3.72691e-08       2737.22       0.759       0.759      218   
Optimization terminated normally: 
  Convergence detected: relative gradient magnitude is below tolerance
[I 2020-10-01 04:02:11,781] Trial 431 finished with value: 0.04199890548152468 and parameters: {'changepoint_prior_scale': 0.0017209158176068402, 'seasonality_prior_scale': 0.08541000752697342, 'holidays_prior_scale': 0.14362355879451222, 'seasonality_mode': 'additive', 'changepoint_range': 0.5761664311783429}. Best is trial 96 with value: 0.038883738900888705.
Initial log joint probability = -28.8311
    Iter      log prob        ||dx||      ||grad||       alpha      alpha0  # evals  Notes 
      99         18912   1.94855e-05          5168           1           1      129   
    Iter      log prob        ||dx||      ||grad||       alpha      alpha0  # evals  Notes 
     164       18912.5   5.69288e-09        4670.6      0.2919      0.2919      208   
Optimization terminated normally: 
  Convergence detected: absolute parameter change was below tolerance
INFO:fbprophet:Making 5 forecasts with cutoffs between 2013-10-07 00:00:00 and 2015-10-18 00:00:00
INFO:fbprophet:Applying in parallel with <concurrent.futures.process.ProcessPoolExecutor object at 0x7fc84db21790>
Initial log joint probability = -8.95172
    Iter      log prob        ||dx||      ||grad||       alpha      alpha0  # evals  Notes 
Initial log joint probability = -12.7302
    Iter      log prob        ||dx||      ||grad||       alpha      alpha0  # evals  Notes 
      60       4678.86   8.07926e-09       4533.12      0.3961           1       78   
Optimization terminated normally: 
  Convergence detected: absolute parameter change was below tolerance
Initial log joint probability = -15.1549
    Iter      log prob        ||dx||      ||grad||       alpha      alpha0  # evals  Notes 
Initial log joint probability = -18.717
    Iter      log prob        ||dx||      ||grad||       alpha      alpha0  # evals  Notes 
Initial log joint probability = -23.5879
    Iter      log prob        ||dx||      ||grad||       alpha      alpha0  # evals  Notes 
      78       7028.29   2.49374e-05       4294.08   5.337e-09       0.001      136  LS failed, Hessian reset 
      99       7028.39   1.77627e-07       4139.11           1           1      163   
    Iter      log prob        ||dx||      ||grad||       alpha      alpha0  # evals  Notes 
     114       7028.39   5.08652e-09       4306.16      0.3679      0.3679      186   
Optimization terminated normally: 
  Convergence detected: absolute parameter change was below tolerance
      66       9582.22   1.91188e-07       5244.87   4.169e-11       0.001      135  LS failed, Hessian reset 
      72       9582.22   5.35063e-09       4871.23      0.3438      0.3438      143   
Optimization terminated normally: 
  Convergence detected: absolute parameter change was below tolerance
      62       11812.8   1.79241e-06       5018.76   3.715e-10       0.001      125  LS failed, Hessian reset 
      83       11812.8   8.28387e-09       4776.27       0.495       0.495      151   
Optimization terminated normally: 
  Convergence detected: absolute parameter change was below tolerance
      99         14232   3.13974e-07       4790.26      0.6102      0.6102      130   
    Iter      log prob        ||dx||      ||grad||       alpha      alpha0  # evals  Notes 
     114         14232   5.23793e-09       4907.54      0.5299      0.5299      150   
Optimization terminated normally: 
  Convergence detected: absolute parameter change was below tolerance
[I 2020-10-01 04:02:26,464] Trial 432 finished with value: 0.040980302719145635 and parameters: {'changepoint_prior_scale': 0.0010227761196156696, 'seasonality_prior_scale': 0.1581695057410615, 'holidays_prior_scale': 0.11059618780670874, 'seasonality_mode': 'additive', 'changepoint_range': 0.5676195221375603}. Best is trial 96 with value: 0.038883738900888705.
Initial log joint probability = -28.8311
    Iter      log prob        ||dx||      ||grad||       alpha      alpha0  # evals  Notes 
      99       18911.9   0.000195186       4488.42           1           1      126   
    Iter      log prob        ||dx||      ||grad||       alpha      alpha0  # evals  Notes 
     199       18912.5   1.17434e-07       5110.89           1           1      247   
    Iter      log prob        ||dx||      ||grad||       alpha      alpha0  # evals  Notes 
     221       18912.5   1.53723e-08       4453.18      0.1687       0.645      278   
Optimization terminated normally: 
  Convergence detected: relative gradient magnitude is below tolerance
INFO:fbprophet:Making 5 forecasts with cutoffs between 2013-10-07 00:00:00 and 2015-10-18 00:00:00
INFO:fbprophet:Applying in parallel with <concurrent.futures.process.ProcessPoolExecutor object at 0x7fc84dbf3fd0>
Initial log joint probability = -8.95172
    Iter      log prob        ||dx||      ||grad||       alpha      alpha0  # evals  Notes 
Initial log joint probability = -12.7302
    Iter      log prob        ||dx||      ||grad||       alpha      alpha0  # evals  Notes 
Initial log joint probability = -15.1549
    Iter      log prob        ||dx||      ||grad||       alpha      alpha0  # evals  Notes 
Initial log joint probability = -18.717
    Iter      log prob        ||dx||      ||grad||       alpha      alpha0  # evals  Notes 
      62       4678.95   8.13085e-09       4877.01      0.5215      0.5215       83   
Optimization terminated normally: 
  Convergence detected: absolute parameter change was below tolerance
Initial log joint probability = -23.5879
    Iter      log prob        ||dx||      ||grad||       alpha      alpha0  # evals  Notes 
      94       7027.75   7.03462e-09        5324.2      0.4694      0.4694      119   
Optimization terminated normally: 
  Convergence detected: absolute parameter change was below tolerance
      49       9582.25   4.17344e-06       5003.59   8.085e-10       0.001      110  LS failed, Hessian reset 
      67       9582.26    8.5511e-09       5156.93      0.2488      0.2488      133   
Optimization terminated normally: 
  Convergence detected: absolute parameter change was below tolerance
      67       11812.9   8.90443e-09       4961.48      0.7236      0.7236       92   
Optimization terminated normally: 
  Convergence detected: absolute parameter change was below tolerance
      99       14232.7   1.49205e-07       5250.56      0.1945      0.9298      138   
    Iter      log prob        ||dx||      ||grad||       alpha      alpha0  # evals  Notes 
     105       14232.7   8.61565e-09       5177.76      0.5508      0.5508      144   
Optimization terminated normally: 
  Convergence detected: absolute parameter change was below tolerance
