[I 2020-10-01 03:27:11,963] Trial 293 finished with value: 0.040863952655156445 and parameters: {'changepoint_prior_scale': 0.0013318796736729076, 'seasonality_prior_scale': 0.1126792308786614, 'holidays_prior_scale': 0.151200108986151, 'seasonality_mode': 'additive', 'changepoint_range': 0.548233879270463}. Best is trial 96 with value: 0.038883738900888705.
Initial log joint probability = -28.8311
    Iter      log prob        ||dx||      ||grad||       alpha      alpha0  # evals  Notes 
      99         18912    3.6763e-06       4183.26      0.3704           1      130   
    Iter      log prob        ||dx||      ||grad||       alpha      alpha0  # evals  Notes 
     125       18912.1   9.90286e-09       4259.45      0.1745      0.1745      161   
Optimization terminated normally: 
  Convergence detected: absolute parameter change was below tolerance
INFO:fbprophet:Making 5 forecasts with cutoffs between 2013-10-07 00:00:00 and 2015-10-18 00:00:00
INFO:fbprophet:Applying in parallel with <concurrent.futures.process.ProcessPoolExecutor object at 0x7fc84dc1cfd0>
Initial log joint probability = -8.95172
    Iter      log prob        ||dx||      ||grad||       alpha      alpha0  # evals  Notes 
Initial log joint probability = -12.7302
    Iter      log prob        ||dx||      ||grad||       alpha      alpha0  # evals  Notes 
Initial log joint probability = -15.1549
    Iter      log prob        ||dx||      ||grad||       alpha      alpha0  # evals  Notes 
Initial log joint probability = -18.717
    Iter      log prob        ||dx||      ||grad||       alpha      alpha0  # evals  Notes 
Initial log joint probability = -23.5879
    Iter      log prob        ||dx||      ||grad||       alpha      alpha0  # evals  Notes 
      53       4679.12   1.60471e-05       4540.18   3.552e-09       0.001      128  LS failed, Hessian reset 
      98       4679.28   8.68689e-09       4553.23      0.1561      0.1561      189   
Optimization terminated normally: 
  Convergence detected: absolute parameter change was below tolerance
      71       7028.21    3.2616e-05          4065   7.905e-09       0.001      134  LS failed, Hessian reset 
      99       7028.35   2.89469e-07        4123.7      0.3443           1      168   
    Iter      log prob        ||dx||      ||grad||       alpha      alpha0  # evals  Notes 
     121       7028.36   8.51463e-09       3856.29      0.2293           1      198   
Optimization terminated normally: 
  Convergence detected: absolute parameter change was below tolerance
      64       9582.33   3.19314e-07       4373.01   7.071e-11       0.001      126  LS failed, Hessian reset 
      75       9582.33   7.85867e-09       4457.71      0.5421      0.5421      141   
Optimization terminated normally: 
  Convergence detected: absolute parameter change was below tolerance
      74         11813   6.03214e-09       4381.98      0.3394      0.3394      102   
Optimization terminated normally: 
  Convergence detected: absolute parameter change was below tolerance
      99       14233.2   4.98606e-05       4610.95      0.5652      0.5652      126   
    Iter      log prob        ||dx||      ||grad||       alpha      alpha0  # evals  Notes 
     129       14233.3   2.39248e-09        4077.3       0.225       0.225      162   
Optimization terminated normally: 
  Convergence detected: absolute parameter change was below tolerance
[I 2020-10-01 03:27:26,754] Trial 294 finished with value: 0.041170422744598305 and parameters: {'changepoint_prior_scale': 0.0011021940019355309, 'seasonality_prior_scale': 1.7722690958198977, 'holidays_prior_scale': 0.12447118832544371, 'seasonality_mode': 'additive', 'changepoint_range': 0.5232185651407171}. Best is trial 96 with value: 0.038883738900888705.
Initial log joint probability = -28.8311
    Iter      log prob        ||dx||      ||grad||       alpha      alpha0  # evals  Notes 
      77       18910.9   3.37046e-06       5108.42   6.593e-10       0.001      142  LS failed, Hessian reset 
      88       18910.9   5.31041e-09        4402.7     0.08865     0.08865      156   
Optimization terminated normally: 
  Convergence detected: absolute parameter change was below tolerance
INFO:fbprophet:Making 5 forecasts with cutoffs between 2013-10-07 00:00:00 and 2015-10-18 00:00:00
INFO:fbprophet:Applying in parallel with <concurrent.futures.process.ProcessPoolExecutor object at 0x7fc84dbf9bd0>
Initial log joint probability = -8.95172
    Iter      log prob        ||dx||      ||grad||       alpha      alpha0  # evals  Notes 
Initial log joint probability = -12.7302
    Iter      log prob        ||dx||      ||grad||       alpha      alpha0  # evals  Notes 
Initial log joint probability = -15.1549
    Iter      log prob        ||dx||      ||grad||       alpha      alpha0  # evals  Notes 
Initial log joint probability = -18.717
    Iter      log prob        ||dx||      ||grad||       alpha      alpha0  # evals  Notes 
      65       4678.51   6.22144e-09       4892.55       0.376      0.8519       94   
Optimization terminated normally: 
  Convergence detected: absolute parameter change was below tolerance
Initial log joint probability = -23.5879
    Iter      log prob        ||dx||      ||grad||       alpha      alpha0  # evals  Notes 
      66       7027.88   8.22073e-06       5201.61   1.504e-09       0.001      121  LS failed, Hessian reset 
      64       9582.02   8.49511e-09       5540.47      0.2307      0.2307       84   
Optimization terminated normally: 
  Convergence detected: absolute parameter change was below tolerance
      99       7027.91   2.37861e-08       4658.91      0.3853           1      163   
    Iter      log prob        ||dx||      ||grad||       alpha      alpha0  # evals  Notes 
     101       7027.91   4.32758e-09        5178.4      0.4608      0.4608      165   
Optimization terminated normally: 
  Convergence detected: absolute parameter change was below tolerance
      37       11810.9   0.000457048       5005.81   9.261e-08       0.001      114  LS failed, Hessian reset 
      99       14232.9   1.79152e-08       4977.91      0.2524           1      134   
    Iter      log prob        ||dx||      ||grad||       alpha      alpha0  # evals  Notes 
     100       14232.9   7.56912e-09       4966.33      0.2411      0.2411      135   
Optimization terminated normally: 
  Convergence detected: absolute parameter change was below tolerance
      82       11812.4   9.71319e-09       4652.48      0.3986           1      172   
Optimization terminated normally: 
  Convergence detected: absolute parameter change was below tolerance
[I 2020-10-01 03:27:41,709] Trial 295 finished with value: 0.041053306211547735 and parameters: {'changepoint_prior_scale': 0.0010029670878323425, 'seasonality_prior_scale': 0.15254277963070428, 'holidays_prior_scale': 0.23205021027248202, 'seasonality_mode': 'additive', 'changepoint_range': 0.5055748828826936}. Best is trial 96 with value: 0.038883738900888705.
Initial log joint probability = -28.8311
    Iter      log prob        ||dx||      ||grad||       alpha      alpha0  # evals  Notes 
      99       18912.5   1.46498e-05       3069.24      0.5534      0.5534      124   
    Iter      log prob        ||dx||      ||grad||       alpha      alpha0  # evals  Notes 
     183       18912.6   5.75664e-08       3651.23           1           1      227   
Optimization terminated normally: 
  Convergence detected: relative gradient magnitude is below tolerance
INFO:fbprophet:Making 5 forecasts with cutoffs between 2013-10-07 00:00:00 and 2015-10-18 00:00:00
INFO:fbprophet:Applying in parallel with <concurrent.futures.process.ProcessPoolExecutor object at 0x7fc84dc04f10>
Initial log joint probability = -8.95172
    Iter      log prob        ||dx||      ||grad||       alpha      alpha0  # evals  Notes 
Initial log joint probability = -12.7302
    Iter      log prob        ||dx||      ||grad||       alpha      alpha0  # evals  Notes 
Initial log joint probability = -15.1549
    Iter      log prob        ||dx||      ||grad||       alpha      alpha0  # evals  Notes 
Initial log joint probability = -18.717
    Iter      log prob        ||dx||      ||grad||       alpha      alpha0  # evals  Notes 
Initial log joint probability = -23.5879
    Iter      log prob        ||dx||      ||grad||       alpha      alpha0  # evals  Notes 
      55        4676.1   0.000419651       3103.83   1.273e-07       0.001      132  LS failed, Hessian reset 
      99       4679.22   1.09199e-07       3252.63       0.712       0.712      188   
    Iter      log prob        ||dx||      ||grad||       alpha      alpha0  # evals  Notes 
     106       4679.22   2.03334e-09       3384.26      0.1649      0.1649      200   
Optimization terminated normally: 
  Convergence detected: absolute parameter change was below tolerance
      99       7027.93     7.076e-06        2744.9       0.733       0.733      129   
    Iter      log prob        ||dx||      ||grad||       alpha      alpha0  # evals  Notes 
      73       9582.48   7.22838e-07       3643.59   2.103e-10       0.001      139  LS failed, Hessian reset 
      76       11813.1   4.91791e-09       3276.62      0.3138      0.3138      109   
Optimization terminated normally: 
  Convergence detected: absolute parameter change was below tolerance
      85       9582.48   7.85592e-09       3148.39      0.3706           1      158   
Optimization terminated normally: 
  Convergence detected: absolute parameter change was below tolerance
     199       7031.02   4.13084e-08       3453.92      0.3133           1      247   
    Iter      log prob        ||dx||      ||grad||       alpha      alpha0  # evals  Notes 
     206       7031.02   4.60416e-09       3535.87      0.4923      0.4923      257   
Optimization terminated normally: 
  Convergence detected: absolute parameter change was below tolerance
      99       14232.4   2.04743e-05       3300.46       2.956      0.5064      134   
    Iter      log prob        ||dx||      ||grad||       alpha      alpha0  # evals  Notes 
     199         14233   1.02369e-05       3128.38        2.87       0.287      251   
    Iter      log prob        ||dx||      ||grad||       alpha      alpha0  # evals  Notes 
     226         14233   9.67209e-09       2455.43      0.1198       0.417      288   
Optimization terminated normally: 
  Convergence detected: absolute parameter change was below tolerance
[I 2020-10-01 03:27:52,133] Trial 296 finished with value: 0.04220085163523209 and parameters: {'changepoint_prior_scale': 0.001441749838605193, 'seasonality_prior_scale': 0.13142192865910415, 'holidays_prior_scale': 0.08041726662962684, 'seasonality_mode': 'additive', 'changepoint_range': 0.5589393475452707}. Best is trial 96 with value: 0.038883738900888705.
Initial log joint probability = -28.8311
    Iter      log prob        ||dx||      ||grad||       alpha      alpha0  # evals  Notes 
      99       18912.9   2.70171e-06        3966.4      0.2421           1      123   
    Iter      log prob        ||dx||      ||grad||       alpha      alpha0  # evals  Notes 
     128       18912.9   4.82882e-09       4190.45      0.1272      0.1272      158   
Optimization terminated normally: 
  Convergence detected: absolute parameter change was below tolerance
INFO:fbprophet:Making 5 forecasts with cutoffs between 2013-10-07 00:00:00 and 2015-10-18 00:00:00
INFO:fbprophet:Applying in parallel with <concurrent.futures.process.ProcessPoolExecutor object at 0x7fc84dc04350>
Initial log joint probability = -8.95172
    Iter      log prob        ||dx||      ||grad||       alpha      alpha0  # evals  Notes 
Initial log joint probability = -12.7302
    Iter      log prob        ||dx||      ||grad||       alpha      alpha0  # evals  Notes 
Initial log joint probability = -15.1549
    Iter      log prob        ||dx||      ||grad||       alpha      alpha0  # evals  Notes 
Initial log joint probability = -18.717
    Iter      log prob        ||dx||      ||grad||       alpha      alpha0  # evals  Notes 
      86       4679.01   2.86665e-07       4078.38   6.846e-11       0.001      168  LS failed, Hessian reset 
Initial log joint probability = -23.5879
    Iter      log prob        ||dx||      ||grad||       alpha      alpha0  # evals  Notes 
      99       4679.02   8.33447e-09       4118.26      0.2259           1      187   
Optimization terminated normally: 
  Convergence detected: absolute parameter change was below tolerance
      74       7028.24   1.44679e-05        3985.6   3.749e-09       0.001      137  LS failed, Hessian reset 
      99       7028.29   5.16868e-08       4237.56      0.5209      0.5209      166   
    Iter      log prob        ||dx||      ||grad||       alpha      alpha0  # evals  Notes 
      30       11811.7   0.000258842       3806.56   6.147e-08       0.001       79  LS failed, Hessian reset 
      99       9582.42   2.24759e-07       3909.29           1           1      132   
    Iter      log prob        ||dx||      ||grad||       alpha      alpha0  # evals  Notes 
     134       7028.45   1.63467e-05        3596.1    3.81e-09       0.001      255  LS failed, Hessian reset 
     102       9582.42   2.85739e-07       3627.74   6.752e-11       0.001      174  LS failed, Hessian reset 
     117       9582.42   3.13896e-09       3609.99       0.345       0.345      191   
Optimization terminated normally: 
  Convergence detected: absolute parameter change was below tolerance
     176        7028.5   6.82111e-09       3832.87      0.2437      0.2437      305   
Optimization terminated normally: 
  Convergence detected: absolute parameter change was below tolerance
      89       11813.2   9.34375e-09       4127.29      0.5972      0.5972      152   
Optimization terminated normally: 
  Convergence detected: absolute parameter change was below tolerance
      99       14232.4   3.35799e-08       3870.37      0.3826           1      141   
    Iter      log prob        ||dx||      ||grad||       alpha      alpha0  # evals  Notes 
     104       14232.4   9.75091e-09       3565.91      0.4689      0.4689      146   
Optimization terminated normally: 
  Convergence detected: absolute parameter change was below tolerance
[I 2020-10-01 03:28:06,562] Trial 297 finished with value: 0.04104375013170462 and parameters: {'changepoint_prior_scale': 0.001213707518319169, 'seasonality_prior_scale': 0.11129408776962632, 'holidays_prior_scale': 0.10661403114179052, 'seasonality_mode': 'additive', 'changepoint_range': 0.5349042999322003}. Best is trial 96 with value: 0.038883738900888705.
Initial log joint probability = -28.8311
    Iter      log prob        ||dx||      ||grad||       alpha      alpha0  # evals  Notes 
      99       18912.7    1.5564e-06       2609.84           1           1      119   
    Iter      log prob        ||dx||      ||grad||       alpha      alpha0  # evals  Notes 
     130       18912.7   1.06726e-06       2859.52   3.503e-10       0.001      195  LS failed, Hessian reset 
     158       18912.7   2.80183e-09       2794.73     0.04792     0.04792      229   
Optimization terminated normally: 
  Convergence detected: absolute parameter change was below tolerance
INFO:fbprophet:Making 5 forecasts with cutoffs between 2013-10-07 00:00:00 and 2015-10-18 00:00:00
INFO:fbprophet:Applying in parallel with <concurrent.futures.process.ProcessPoolExecutor object at 0x7fc84dc2f1d0>
Initial log joint probability = -8.95172
    Iter      log prob        ||dx||      ||grad||       alpha      alpha0  # evals  Notes 
Initial log joint probability = -12.7302
    Iter      log prob        ||dx||      ||grad||       alpha      alpha0  # evals  Notes 
Initial log joint probability = -15.1549
    Iter      log prob        ||dx||      ||grad||       alpha      alpha0  # evals  Notes 
Initial log joint probability = -18.717
    Iter      log prob        ||dx||      ||grad||       alpha      alpha0  # evals  Notes 
      66       4679.39   9.56853e-09       2939.24      0.5528      0.5528       86   
Optimization terminated normally: 
  Convergence detected: absolute parameter change was below tolerance
Initial log joint probability = -23.5879
    Iter      log prob        ||dx||      ||grad||       alpha      alpha0  # evals  Notes 
      99       7029.86   1.11351e-07       2617.02      0.3805           1      122   
    Iter      log prob        ||dx||      ||grad||       alpha      alpha0  # evals  Notes 
     117       7029.86    6.0651e-09       3285.86      0.5729      0.5729      143   
Optimization terminated normally: 
  Convergence detected: absolute parameter change was below tolerance
      51       11813.2   9.58989e-09       3004.86       0.198       0.198       72   
Optimization terminated normally: 
  Convergence detected: absolute parameter change was below tolerance
      54       9582.32   2.52197e-05       2874.62   7.914e-09       0.001      115  LS failed, Hessian reset 
      99       9582.41   2.04316e-08       2755.21      0.3871      0.3871      174   
    Iter      log prob        ||dx||      ||grad||       alpha      alpha0  # evals  Notes 
     103       9582.41   3.58383e-09        2901.4      0.2692      0.2692      179   
Optimization terminated normally: 
  Convergence detected: absolute parameter change was below tolerance
      99       14232.8   6.43551e-07       2698.26      0.4799      0.4799      139   
    Iter      log prob        ||dx||      ||grad||       alpha      alpha0  # evals  Notes 
     174       14233.4   9.66154e-09       2995.79      0.3171      0.3171      227   
Optimization terminated normally: 
  Convergence detected: absolute parameter change was below tolerance
[I 2020-10-01 03:28:22,412] Trial 298 finished with value: 0.041236681218756295 and parameters: {'changepoint_prior_scale': 0.0016680068775774765, 'seasonality_prior_scale': 0.10003533215332625, 'holidays_prior_scale': 0.06549830627089673, 'seasonality_mode': 'additive', 'changepoint_range': 0.5153463015475502}. Best is trial 96 with value: 0.038883738900888705.
Initial log joint probability = -28.8311
    Iter      log prob        ||dx||      ||grad||       alpha      alpha0  # evals  Notes 
      99       18912.1   5.09442e-07       4831.25      0.6783      0.6783      121   
    Iter      log prob        ||dx||      ||grad||       alpha      alpha0  # evals  Notes 
     199       18912.6   2.80491e-08       4800.64      0.4716      0.4716      248   
    Iter      log prob        ||dx||      ||grad||       alpha      alpha0  # evals  Notes 
     208       18912.6   1.12169e-08       3210.78      0.4562      0.4562      257   
Optimization terminated normally: 
  Convergence detected: relative gradient magnitude is below tolerance
INFO:fbprophet:Making 5 forecasts with cutoffs between 2013-10-07 00:00:00 and 2015-10-18 00:00:00
INFO:fbprophet:Applying in parallel with <concurrent.futures.process.ProcessPoolExecutor object at 0x7fc84dc1c850>
Initial log joint probability = -8.95172
    Iter      log prob        ||dx||      ||grad||       alpha      alpha0  # evals  Notes 
Initial log joint probability = -12.7302
    Iter      log prob        ||dx||      ||grad||       alpha      alpha0  # evals  Notes 
Initial log joint probability = -15.1549
    Iter      log prob        ||dx||      ||grad||       alpha      alpha0  # evals  Notes 
Initial log joint probability = -18.717
    Iter      log prob        ||dx||      ||grad||       alpha      alpha0  # evals  Notes 
      52       4678.78   9.67107e-09       4502.05      0.2436           1       77   
Optimization terminated normally: 
  Convergence detected: absolute parameter change was below tolerance
Initial log joint probability = -23.5879
    Iter      log prob        ||dx||      ||grad||       alpha      alpha0  # evals  Notes 
      74       7028.19   4.43061e-05       4651.91   1.057e-08       0.001      137  LS failed, Hessian reset 
      99        7028.4   5.18747e-07       3503.36      0.3403      0.9289      171   
    Iter      log prob        ||dx||      ||grad||       alpha      alpha0  # evals  Notes 
      47       11812.8   9.85143e-09       4444.87      0.1289      0.1289       73   
Optimization terminated normally: 
  Convergence detected: absolute parameter change was below tolerance
     116        7028.4   3.78221e-09       3817.16      0.1532      0.1532      193   
Optimization terminated normally: 
  Convergence detected: absolute parameter change was below tolerance
      69       9582.21   3.56304e-07       4497.32   8.912e-11       0.001      138  LS failed, Hessian reset 
      99       9582.21   4.15492e-08       4117.99      0.2928           1      176   
    Iter      log prob        ||dx||      ||grad||       alpha      alpha0  # evals  Notes 
      99       14230.7   3.73022e-07       4569.19      0.5754      0.5754      130   
    Iter      log prob        ||dx||      ||grad||       alpha      alpha0  # evals  Notes 
     126       9582.29   3.73863e-06       4353.24   8.476e-10       0.001      270  LS failed, Hessian reset 
     147        9582.3   7.14528e-09       4854.68      0.5412      0.5412      297   
Optimization terminated normally: 
  Convergence detected: absolute parameter change was below tolerance
     119       14230.7   2.30958e-06       4703.31   5.242e-10       0.001      196  LS failed, Hessian reset 
     146       14230.7   9.24215e-09       4455.01      0.5283      0.5283      233   
Optimization terminated normally: 
  Convergence detected: absolute parameter change was below tolerance
