[I 2020-10-01 03:47:41,617] Trial 373 finished with value: 0.04143058744394372 and parameters: {'changepoint_prior_scale': 0.0012900560199494656, 'seasonality_prior_scale': 0.6858900405942007, 'holidays_prior_scale': 1.3436054805853994, 'seasonality_mode': 'additive', 'changepoint_range': 0.5240659887370147}. Best is trial 96 with value: 0.038883738900888705.
Initial log joint probability = -28.8311
    Iter      log prob        ||dx||      ||grad||       alpha      alpha0  # evals  Notes 
      99       18912.5   6.64896e-06        3825.8       0.892       0.892      123   
    Iter      log prob        ||dx||      ||grad||       alpha      alpha0  # evals  Notes 
     103       18912.6   1.48296e-05       4383.32   3.108e-09       0.001      165  LS failed, Hessian reset 
     141       18912.6   9.72426e-09       4240.89     0.07888     0.07888      211   
Optimization terminated normally: 
  Convergence detected: absolute parameter change was below tolerance
INFO:fbprophet:Making 5 forecasts with cutoffs between 2013-10-07 00:00:00 and 2015-10-18 00:00:00
INFO:fbprophet:Applying in parallel with <concurrent.futures.process.ProcessPoolExecutor object at 0x7fc84dbf9a10>
Initial log joint probability = -8.95172
    Iter      log prob        ||dx||      ||grad||       alpha      alpha0  # evals  Notes 
Initial log joint probability = -12.7302
    Iter      log prob        ||dx||      ||grad||       alpha      alpha0  # evals  Notes 
Initial log joint probability = -15.1549
    Iter      log prob        ||dx||      ||grad||       alpha      alpha0  # evals  Notes 
Initial log joint probability = -18.717
    Iter      log prob        ||dx||      ||grad||       alpha      alpha0  # evals  Notes 
      53       4679.01   4.49614e-09       4553.87      0.2536      0.2536       74   
Optimization terminated normally: 
  Convergence detected: absolute parameter change was below tolerance
Initial log joint probability = -23.5879
    Iter      log prob        ||dx||      ||grad||       alpha      alpha0  # evals  Notes 
      99       7028.24   1.83336e-06       4835.76       0.501       0.501      129   
    Iter      log prob        ||dx||      ||grad||       alpha      alpha0  # evals  Notes 
     102       7028.27   2.42653e-06       4506.06   5.461e-10       0.001      175  LS failed, Hessian reset 
      49         11813   7.58319e-09       4325.37      0.2577      0.2577       76   
Optimization terminated normally: 
  Convergence detected: absolute parameter change was below tolerance
      63       9582.34   1.49588e-06       4262.39   3.109e-10       0.001      127  LS failed, Hessian reset 
     131       7028.28   9.87781e-09       4356.15      0.4785      0.4785      213   
Optimization terminated normally: 
  Convergence detected: absolute parameter change was below tolerance
      91       9582.34   7.09859e-09       3727.11      0.4299      0.4299      162   
Optimization terminated normally: 
  Convergence detected: absolute parameter change was below tolerance
      99       14233.2   3.43208e-07       4489.53           1           1      127   
    Iter      log prob        ||dx||      ||grad||       alpha      alpha0  # evals  Notes 
     110       14233.2   3.42252e-09       4490.59      0.2079      0.2079      142   
Optimization terminated normally: 
  Convergence detected: absolute parameter change was below tolerance
[I 2020-10-01 03:47:54,796] Trial 374 finished with value: 0.04148047883597391 and parameters: {'changepoint_prior_scale': 0.0010983842893895952, 'seasonality_prior_scale': 0.3938591059923125, 'holidays_prior_scale': 2.710387346485179, 'seasonality_mode': 'additive', 'changepoint_range': 0.5416797397407376}. Best is trial 96 with value: 0.038883738900888705.
Initial log joint probability = -28.8311
    Iter      log prob        ||dx||      ||grad||       alpha      alpha0  # evals  Notes 
      99       18912.7   2.60626e-05       3527.82           1           1      127   
    Iter      log prob        ||dx||      ||grad||       alpha      alpha0  # evals  Notes 
     134       18912.8   3.13879e-06        3688.8   8.657e-10       0.001      208  LS failed, Hessian reset 
     154       18912.8   1.27535e-08       3440.25      0.7092      0.7092      234   
Optimization terminated normally: 
  Convergence detected: relative gradient magnitude is below tolerance
INFO:fbprophet:Making 5 forecasts with cutoffs between 2013-10-07 00:00:00 and 2015-10-18 00:00:00
INFO:fbprophet:Applying in parallel with <concurrent.futures.process.ProcessPoolExecutor object at 0x7fc84dbfdf10>
Initial log joint probability = -8.95172
    Iter      log prob        ||dx||      ||grad||       alpha      alpha0  # evals  Notes 
Initial log joint probability = -12.7302
    Iter      log prob        ||dx||      ||grad||       alpha      alpha0  # evals  Notes 
Initial log joint probability = -15.1549
    Iter      log prob        ||dx||      ||grad||       alpha      alpha0  # evals  Notes 
Initial log joint probability = -18.717
    Iter      log prob        ||dx||      ||grad||       alpha      alpha0  # evals  Notes 
Initial log joint probability = -23.5879
    Iter      log prob        ||dx||      ||grad||       alpha      alpha0  # evals  Notes 
      49       4679.23   1.12819e-05       3515.28    3.08e-09       0.001      108  LS failed, Hessian reset 
      77       4679.26   9.70597e-09       3446.14      0.2813      0.2813      145   
Optimization terminated normally: 
  Convergence detected: absolute parameter change was below tolerance
      99       7030.06   0.000132137       3654.05      0.6777      0.6777      133   
    Iter      log prob        ||dx||      ||grad||       alpha      alpha0  # evals  Notes 
      68       9582.43   4.08288e-09       3081.02      0.2819      0.2819       96   
Optimization terminated normally: 
  Convergence detected: absolute parameter change was below tolerance
      34       11811.9   0.000331817       3391.11   1.014e-07       0.001      105  LS failed, Hessian reset 
     187       7030.74   9.26692e-09       3355.73      0.1962      0.1962      245   
Optimization terminated normally: 
  Convergence detected: absolute parameter change was below tolerance
      91         14233    1.8535e-08       3424.86           1           1      125   
Optimization terminated normally: 
  Convergence detected: relative gradient magnitude is below tolerance
      89       11813.2   8.37386e-09       3425.95      0.3156      0.3156      172   
Optimization terminated normally: 
  Convergence detected: absolute parameter change was below tolerance
[I 2020-10-01 03:48:10,408] Trial 375 finished with value: 0.040950705557115774 and parameters: {'changepoint_prior_scale': 0.0013973224423193497, 'seasonality_prior_scale': 0.10804482180879084, 'holidays_prior_scale': 0.19929150695535838, 'seasonality_mode': 'additive', 'changepoint_range': 0.5334886204566982}. Best is trial 96 with value: 0.038883738900888705.
Initial log joint probability = -28.8311
    Iter      log prob        ||dx||      ||grad||       alpha      alpha0  # evals  Notes 
      92       18912.6   3.76583e-06       2700.85   1.333e-09       0.001      155  LS failed, Hessian reset 
      99       18912.6    3.0282e-07       1853.51      0.4942      0.4942      163   
    Iter      log prob        ||dx||      ||grad||       alpha      alpha0  # evals  Notes 
     115       18912.6   6.70955e-09       2690.21      0.2244      0.2244      184   
Optimization terminated normally: 
  Convergence detected: absolute parameter change was below tolerance
INFO:fbprophet:Making 5 forecasts with cutoffs between 2013-10-07 00:00:00 and 2015-10-18 00:00:00
INFO:fbprophet:Applying in parallel with <concurrent.futures.process.ProcessPoolExecutor object at 0x7fc84dcaf810>
Initial log joint probability = -8.95172
    Iter      log prob        ||dx||      ||grad||       alpha      alpha0  # evals  Notes 
Initial log joint probability = -12.7302
    Iter      log prob        ||dx||      ||grad||       alpha      alpha0  # evals  Notes 
Initial log joint probability = -15.1549
    Iter      log prob        ||dx||      ||grad||       alpha      alpha0  # evals  Notes 
Initial log joint probability = -18.717
    Iter      log prob        ||dx||      ||grad||       alpha      alpha0  # evals  Notes 
Initial log joint probability = -23.5879
    Iter      log prob        ||dx||      ||grad||       alpha      alpha0  # evals  Notes 
      53       4677.23   0.000626786       3449.53    2.46e-07       0.001      121  LS failed, Hessian reset 
      99        4678.9   6.18893e-08       2849.11      0.6598      0.6598      178   
    Iter      log prob        ||dx||      ||grad||       alpha      alpha0  # evals  Notes 
      99       7030.03   0.000129992       2679.92      0.9141      0.9141      120   
    Iter      log prob        ||dx||      ||grad||       alpha      alpha0  # evals  Notes 
      68       9582.49   6.83126e-09       2559.31      0.5886      0.5886       96   
Optimization terminated normally: 
  Convergence detected: absolute parameter change was below tolerance
     159       4679.25   1.94286e-06       2861.96   6.708e-10       0.001      297  LS failed, Hessian reset 
      68       11813.2   1.29249e-08       2866.86      0.8591      0.8591       93   
Optimization terminated normally: 
  Convergence detected: relative gradient magnitude is below tolerance
     193       4679.28   1.88722e-06        2862.9   6.609e-10       0.001      381  LS failed, Hessian reset 
     199       4679.28   2.14362e-07       2866.95      0.6034      0.6034      387   
    Iter      log prob        ||dx||      ||grad||       alpha      alpha0  # evals  Notes 
     199       7031.98   8.88197e-08       2728.98      0.4552      0.4552      243   
    Iter      log prob        ||dx||      ||grad||       alpha      alpha0  # evals  Notes 
     228       4679.29    7.1101e-09       2848.48      0.2449       0.746      420   
Optimization terminated normally: 
  Convergence detected: absolute parameter change was below tolerance
     207       7031.98   4.37379e-09       2750.56      0.3742      0.3742      253   
Optimization terminated normally: 
  Convergence detected: absolute parameter change was below tolerance
      99       14232.5   4.21942e-07       2405.52           1           1      137   
    Iter      log prob        ||dx||      ||grad||       alpha      alpha0  # evals  Notes 
     125       14232.5   1.50333e-08       2653.72      0.3691           1      170   
Optimization terminated normally: 
  Convergence detected: relative gradient magnitude is below tolerance
[I 2020-10-01 03:48:26,534] Trial 376 finished with value: 0.04185320155911708 and parameters: {'changepoint_prior_scale': 0.0017546390544539148, 'seasonality_prior_scale': 0.09201564799933223, 'holidays_prior_scale': 0.1631563906308536, 'seasonality_mode': 'additive', 'changepoint_range': 0.5551308878237828}. Best is trial 96 with value: 0.038883738900888705.
Initial log joint probability = -28.8311
    Iter      log prob        ||dx||      ||grad||       alpha      alpha0  # evals  Notes 
      99       18911.8   1.27498e-05       3906.36      0.8195      0.8195      118   
    Iter      log prob        ||dx||      ||grad||       alpha      alpha0  # evals  Notes 
     151       18912.3    4.5447e-09       3557.49     0.05049     0.05049      185   
Optimization terminated normally: 
  Convergence detected: absolute parameter change was below tolerance
INFO:fbprophet:Making 5 forecasts with cutoffs between 2013-10-07 00:00:00 and 2015-10-18 00:00:00
INFO:fbprophet:Applying in parallel with <concurrent.futures.process.ProcessPoolExecutor object at 0x7fc84dc0bf10>
Initial log joint probability = -8.95172
    Iter      log prob        ||dx||      ||grad||       alpha      alpha0  # evals  Notes 
Initial log joint probability = -12.7302
    Iter      log prob        ||dx||      ||grad||       alpha      alpha0  # evals  Notes 
Initial log joint probability = -15.1549
    Iter      log prob        ||dx||      ||grad||       alpha      alpha0  # evals  Notes 
Initial log joint probability = -18.717
    Iter      log prob        ||dx||      ||grad||       alpha      alpha0  # evals  Notes 
      56        4678.3   3.87963e-09       3971.85      0.1705      0.1705       73   
Optimization terminated normally: 
  Convergence detected: absolute parameter change was below tolerance
Initial log joint probability = -23.5879
    Iter      log prob        ||dx||      ||grad||       alpha      alpha0  # evals  Notes 
      55       9581.98   3.81401e-09       3736.83      0.2426      0.2426       79   
Optimization terminated normally: 
  Convergence detected: absolute parameter change was below tolerance
      89       7028.41   2.03733e-05       3599.47   4.912e-09       0.001      149  LS failed, Hessian reset 
      99       7028.45   1.35006e-06       3511.88      0.1754           1      163   
    Iter      log prob        ||dx||      ||grad||       alpha      alpha0  # evals  Notes 
      59       11813.1   7.43907e-09       3986.85      0.4201      0.4201       85   
Optimization terminated normally: 
  Convergence detected: absolute parameter change was below tolerance
     157       7028.57   5.97653e-06       4272.55     1.5e-09       0.001      270  LS failed, Hessian reset 
     186       7028.59   9.60614e-09       3328.86           1           1      308   
Optimization terminated normally: 
  Convergence detected: absolute parameter change was below tolerance
      99       14233.2   1.23009e-08       3721.83      0.3825      0.9965      124   
Optimization terminated normally: 
  Convergence detected: relative gradient magnitude is below tolerance
[I 2020-10-01 03:48:41,653] Trial 377 finished with value: 0.04115935670744633 and parameters: {'changepoint_prior_scale': 0.0012443070747807478, 'seasonality_prior_scale': 0.06219625892407495, 'holidays_prior_scale': 0.6330476129510134, 'seasonality_mode': 'additive', 'changepoint_range': 0.5083214767859897}. Best is trial 96 with value: 0.038883738900888705.
Initial log joint probability = -28.8311
    Iter      log prob        ||dx||      ||grad||       alpha      alpha0  # evals  Notes 
      98       18912.7   3.43828e-08       2840.95      0.9747      0.9747      118   
Optimization terminated normally: 
  Convergence detected: relative gradient magnitude is below tolerance
INFO:fbprophet:Making 5 forecasts with cutoffs between 2013-10-07 00:00:00 and 2015-10-18 00:00:00
INFO:fbprophet:Applying in parallel with <concurrent.futures.process.ProcessPoolExecutor object at 0x7fc84dc929d0>
Initial log joint probability = -8.95172
    Iter      log prob        ||dx||      ||grad||       alpha      alpha0  # evals  Notes 
Initial log joint probability = -12.7302
    Iter      log prob        ||dx||      ||grad||       alpha      alpha0  # evals  Notes 
      45       4678.39   0.000317904       3304.28   9.544e-08       0.001      127  LS failed, Hessian reset 
Initial log joint probability = -15.1549
    Iter      log prob        ||dx||      ||grad||       alpha      alpha0  # evals  Notes 
Initial log joint probability = -18.717
    Iter      log prob        ||dx||      ||grad||       alpha      alpha0  # evals  Notes 
      85        4679.4   5.59929e-09       3329.96      0.5885      0.5885      179   
Optimization terminated normally: 
  Convergence detected: absolute parameter change was below tolerance
Initial log joint probability = -23.5879
    Iter      log prob        ||dx||      ||grad||       alpha      alpha0  # evals  Notes 
      91       7029.09   5.94777e-05       2721.74   1.771e-08       0.001      166  LS failed, Hessian reset 
      99       7029.17   1.31294e-05       2564.29           1           1      177   
    Iter      log prob        ||dx||      ||grad||       alpha      alpha0  # evals  Notes 
      99       9582.61   2.75269e-08       2923.29      0.7734      0.7734      131   
    Iter      log prob        ||dx||      ||grad||       alpha      alpha0  # evals  Notes 
     101       9582.61   4.68533e-09       2928.76      0.1504      0.1504      134   
Optimization terminated normally: 
  Convergence detected: absolute parameter change was below tolerance
      66       11813.3   8.98754e-09       3366.73      0.5555      0.5555       95   
Optimization terminated normally: 
  Convergence detected: absolute parameter change was below tolerance
     199       7031.94   0.000107776       3224.51           1           1      290   
    Iter      log prob        ||dx||      ||grad||       alpha      alpha0  # evals  Notes 
     236       7032.07   5.65785e-09       3347.39      0.4555      0.4555      335   
Optimization terminated normally: 
  Convergence detected: absolute parameter change was below tolerance
      99       14231.6   0.000256595       3136.89           1           1      137   
    Iter      log prob        ||dx||      ||grad||       alpha      alpha0  # evals  Notes 
     139       14232.3   9.58686e-09       3125.84      0.3049           1      185   
Optimization terminated normally: 
  Convergence detected: absolute parameter change was below tolerance
[I 2020-10-01 03:48:56,438] Trial 378 finished with value: 0.04210071227314582 and parameters: {'changepoint_prior_scale': 0.001515192704109433, 'seasonality_prior_scale': 0.6733437583150171, 'holidays_prior_scale': 2.069671590534824, 'seasonality_mode': 'additive', 'changepoint_range': 0.5162613565626013}. Best is trial 96 with value: 0.038883738900888705.
Initial log joint probability = -28.8311
    Iter      log prob        ||dx||      ||grad||       alpha      alpha0  # evals  Notes 
      99       18911.3   3.93829e-06       5008.79      0.7267      0.7267      137   
    Iter      log prob        ||dx||      ||grad||       alpha      alpha0  # evals  Notes 
     199       18912.2   1.13447e-07       4576.85      0.2163      0.2163      252   
    Iter      log prob        ||dx||      ||grad||       alpha      alpha0  # evals  Notes 
     222       18912.2   8.34218e-09       4629.98      0.5389      0.5389      280   
Optimization terminated normally: 
  Convergence detected: absolute parameter change was below tolerance
INFO:fbprophet:Making 5 forecasts with cutoffs between 2013-10-07 00:00:00 and 2015-10-18 00:00:00
INFO:fbprophet:Applying in parallel with <concurrent.futures.process.ProcessPoolExecutor object at 0x7fc84dbf9e10>
Initial log joint probability = -8.95172
    Iter      log prob        ||dx||      ||grad||       alpha      alpha0  # evals  Notes 
Initial log joint probability = -12.7302
    Iter      log prob        ||dx||      ||grad||       alpha      alpha0  # evals  Notes 
Initial log joint probability = -15.1549
    Iter      log prob        ||dx||      ||grad||       alpha      alpha0  # evals  Notes 
Initial log joint probability = -18.717
    Iter      log prob        ||dx||      ||grad||       alpha      alpha0  # evals  Notes 
      54       4678.99   3.23177e-09        4641.2      0.1875      0.1875       76   
Optimization terminated normally: 
  Convergence detected: absolute parameter change was below tolerance
Initial log joint probability = -23.5879
    Iter      log prob        ||dx||      ||grad||       alpha      alpha0  # evals  Notes 
      99       7027.83   8.00336e-07       5002.28           1           1      121   
    Iter      log prob        ||dx||      ||grad||       alpha      alpha0  # evals  Notes 
     105       7027.83   1.84224e-07       4756.33   3.791e-11       0.001      172  LS failed, Hessian reset 
     108       7027.83   8.68063e-09       4198.99      0.1704      0.1704      176   
Optimization terminated normally: 
  Convergence detected: absolute parameter change was below tolerance
      61       9582.39   1.58174e-05       4867.36   3.254e-09       0.001      125  LS failed, Hessian reset 
      98        9582.5   6.89077e-09       4920.28      0.6783      0.6783      174   
Optimization terminated normally: 
  Convergence detected: absolute parameter change was below tolerance
      57       11812.9   6.73623e-06       5006.41   1.369e-09       0.001      130  LS failed, Hessian reset 
      99       14230.8   5.07792e-07       5143.13           1           1      130   
    Iter      log prob        ||dx||      ||grad||       alpha      alpha0  # evals  Notes 
      99         11813   7.31725e-09       4910.17      0.2695      0.2695      180   
Optimization terminated normally: 
  Convergence detected: absolute parameter change was below tolerance
     112       14230.8   8.11232e-09        4737.9      0.2126           1      148   
Optimization terminated normally: 
  Convergence detected: absolute parameter change was below tolerance
