[I 2020-10-01 02:28:11,908] Trial 61 finished with value: 0.040963826416986024 and parameters: {'changepoint_prior_scale': 0.0010116175625287617, 'seasonality_prior_scale': 0.11288446015425396, 'holidays_prior_scale': 3.600048031677686, 'seasonality_mode': 'additive', 'changepoint_range': 0.5421926920207436}. Best is trial 60 with value: 0.04083410605276838.
Initial log joint probability = -28.8311
    Iter      log prob        ||dx||      ||grad||       alpha      alpha0  # evals  Notes 
      99       18911.9   3.90178e-06       4510.51      0.6192      0.6192      121   
    Iter      log prob        ||dx||      ||grad||       alpha      alpha0  # evals  Notes 
     154       18912.8   1.09983e-08       4519.26      0.2825      0.8149      193   
Optimization terminated normally: 
  Convergence detected: relative gradient magnitude is below tolerance
INFO:fbprophet:Making 5 forecasts with cutoffs between 2013-10-07 00:00:00 and 2015-10-18 00:00:00
INFO:fbprophet:Applying in parallel with <concurrent.futures.process.ProcessPoolExecutor object at 0x7fc88e6d45d0>
Initial log joint probability = -8.95172
    Iter      log prob        ||dx||      ||grad||       alpha      alpha0  # evals  Notes 
Initial log joint probability = -12.7302
    Iter      log prob        ||dx||      ||grad||       alpha      alpha0  # evals  Notes 
Initial log joint probability = -15.1549
    Iter      log prob        ||dx||      ||grad||       alpha      alpha0  # evals  Notes 
Initial log joint probability = -18.717
    Iter      log prob        ||dx||      ||grad||       alpha      alpha0  # evals  Notes 
Initial log joint probability = -23.5879
    Iter      log prob        ||dx||      ||grad||       alpha      alpha0  # evals  Notes 
      58       4678.94   1.21187e-05       4772.93    2.52e-09       0.001      126  LS failed, Hessian reset 
      99       4679.05     3.903e-08       4767.66      0.3952           1      182   
    Iter      log prob        ||dx||      ||grad||       alpha      alpha0  # evals  Notes 
      59       9582.41   8.45149e-09       4066.09      0.5357      0.5357       73   
Optimization terminated normally: 
  Convergence detected: absolute parameter change was below tolerance
     110       4679.06   1.24212e-06       4685.15   2.504e-10       0.001      241  LS failed, Hessian reset 
     138       4679.07   8.63687e-09       4756.78      0.5244      0.5244      274   
Optimization terminated normally: 
  Convergence detected: absolute parameter change was below tolerance
      99       7028.24   6.51619e-06       4751.84   1.443e-09       0.001      160  LS failed, Hessian reset 
    Iter      log prob        ||dx||      ||grad||       alpha      alpha0  # evals  Notes 
     125       7028.26   9.08879e-09       4487.12      0.2968      0.2968      192   
Optimization terminated normally: 
  Convergence detected: absolute parameter change was below tolerance
      39       11811.9   0.000317548       4892.86   6.438e-08       0.001      107  LS failed, Hessian reset 
      99       14231.2   2.22664e-06       4614.44      0.1814           1      123   
    Iter      log prob        ||dx||      ||grad||       alpha      alpha0  # evals  Notes 
      99       11813.1   3.61944e-05       4854.82      0.5268      0.5268      180   
    Iter      log prob        ||dx||      ||grad||       alpha      alpha0  # evals  Notes 
     112       14231.2   9.37698e-09       4384.38      0.2406      0.2406      143   
Optimization terminated normally: 
  Convergence detected: absolute parameter change was below tolerance
     136       11813.2    7.1761e-09       4847.64      0.4572      0.4572      230   
Optimization terminated normally: 
  Convergence detected: absolute parameter change was below tolerance
[I 2020-10-01 02:28:24,776] Trial 62 finished with value: 0.04117071252708611 and parameters: {'changepoint_prior_scale': 0.0010324469060069522, 'seasonality_prior_scale': 0.10983712124729579, 'holidays_prior_scale': 2.8013629853147237, 'seasonality_mode': 'additive', 'changepoint_range': 0.520707655506471}. Best is trial 60 with value: 0.04083410605276838.
Initial log joint probability = -28.8311
    Iter      log prob        ||dx||      ||grad||       alpha      alpha0  # evals  Notes 
      99         18913   1.28808e-05       3252.22      0.6505      0.6505      122   
    Iter      log prob        ||dx||      ||grad||       alpha      alpha0  # evals  Notes 
     127         18913   8.14061e-09       3343.31      0.2561      0.2561      155   
Optimization terminated normally: 
  Convergence detected: absolute parameter change was below tolerance
INFO:fbprophet:Making 5 forecasts with cutoffs between 2013-10-07 00:00:00 and 2015-10-18 00:00:00
INFO:fbprophet:Applying in parallel with <concurrent.futures.process.ProcessPoolExecutor object at 0x7fc88e6b7f90>
Initial log joint probability = -8.95172
    Iter      log prob        ||dx||      ||grad||       alpha      alpha0  # evals  Notes 
Initial log joint probability = -12.7302
    Iter      log prob        ||dx||      ||grad||       alpha      alpha0  # evals  Notes 
Initial log joint probability = -15.1549
    Iter      log prob        ||dx||      ||grad||       alpha      alpha0  # evals  Notes 
Initial log joint probability = -18.717
    Iter      log prob        ||dx||      ||grad||       alpha      alpha0  # evals  Notes 
      66       4679.38    8.7149e-09       3232.42     0.03402      0.4827       84   
Optimization terminated normally: 
  Convergence detected: absolute parameter change was below tolerance
Initial log joint probability = -23.5879
    Iter      log prob        ||dx||      ||grad||       alpha      alpha0  # evals  Notes 
      99       7029.53   2.15093e-07       2926.35           1           1      123   
    Iter      log prob        ||dx||      ||grad||       alpha      alpha0  # evals  Notes 
      60         11813   1.09094e-08       3039.24      0.2151           1       82   
Optimization terminated normally: 
  Convergence detected: relative gradient magnitude is below tolerance
      56       9582.47   1.98454e-07       3316.99   6.585e-11       0.001      122  LS failed, Hessian reset 
     176       7031.77   6.59631e-09       3294.92      0.1146      0.1146      217   
Optimization terminated normally: 
  Convergence detected: absolute parameter change was below tolerance
      73       9582.47    6.3575e-09       3057.54      0.2863      0.2863      145   
Optimization terminated normally: 
  Convergence detected: absolute parameter change was below tolerance
      99       14232.8   3.69872e-05       2979.16      0.7261      0.7261      127   
    Iter      log prob        ||dx||      ||grad||       alpha      alpha0  # evals  Notes 
     108       14232.9   2.75292e-05       3190.95   8.186e-09       0.001      190  LS failed, Hessian reset 
     136         14233   5.82664e-09       2769.92      0.2395      0.2395      229   
Optimization terminated normally: 
  Convergence detected: absolute parameter change was below tolerance
[I 2020-10-01 02:28:40,051] Trial 63 finished with value: 0.04159993118132305 and parameters: {'changepoint_prior_scale': 0.001538312303071074, 'seasonality_prior_scale': 0.2386693447059458, 'holidays_prior_scale': 0.9147563764338671, 'seasonality_mode': 'additive', 'changepoint_range': 0.5433989143230158}. Best is trial 60 with value: 0.04083410605276838.
Initial log joint probability = -28.8311
    Iter      log prob        ||dx||      ||grad||       alpha      alpha0  # evals  Notes 
      99       18912.8   1.01693e-05       4087.13           1           1      123   
    Iter      log prob        ||dx||      ||grad||       alpha      alpha0  # evals  Notes 
     129       18912.9   1.80445e-07       4217.59   4.317e-11       0.001      200  LS failed, Hessian reset 
     140       18912.9   8.35943e-09       4320.96      0.3371       0.971      215   
Optimization terminated normally: 
  Convergence detected: absolute parameter change was below tolerance
INFO:fbprophet:Making 5 forecasts with cutoffs between 2013-10-07 00:00:00 and 2015-10-18 00:00:00
INFO:fbprophet:Applying in parallel with <concurrent.futures.process.ProcessPoolExecutor object at 0x7fc88e5ec9d0>
Initial log joint probability = -8.95172
    Iter      log prob        ||dx||      ||grad||       alpha      alpha0  # evals  Notes 
Initial log joint probability = -12.7302
    Iter      log prob        ||dx||      ||grad||       alpha      alpha0  # evals  Notes 
Initial log joint probability = -15.1549
    Iter      log prob        ||dx||      ||grad||       alpha      alpha0  # evals  Notes 
Initial log joint probability = -18.717
    Iter      log prob        ||dx||      ||grad||       alpha      alpha0  # evals  Notes 
Initial log joint probability = -23.5879
    Iter      log prob        ||dx||      ||grad||       alpha      alpha0  # evals  Notes 
      56       4679.09   3.76815e-06       4243.99   9.089e-10       0.001      123  LS failed, Hessian reset 
      76       4679.11   8.16073e-09       4109.35      0.4027      0.4027      152   
Optimization terminated normally: 
  Convergence detected: absolute parameter change was below tolerance
      99       7028.66   2.18657e-07       3794.67      0.2105      0.9622      129   
    Iter      log prob        ||dx||      ||grad||       alpha      alpha0  # evals  Notes 
      46        9582.2   5.24949e-05       4016.65   1.268e-08       0.001       94  LS failed, Hessian reset 
     117       7028.66    9.3453e-09       3851.47      0.7429      0.7429      153   
Optimization terminated normally: 
  Convergence detected: absolute parameter change was below tolerance
      52       11813.2   8.26225e-09       3948.34      0.4385      0.4385       76   
Optimization terminated normally: 
  Convergence detected: absolute parameter change was below tolerance
      81       9582.32   7.43687e-09       3666.93      0.3388      0.3388      136   
Optimization terminated normally: 
  Convergence detected: absolute parameter change was below tolerance
      99       14233.1   4.26054e-07       4221.12           1           1      127   
    Iter      log prob        ||dx||      ||grad||       alpha      alpha0  # evals  Notes 
     118       14233.1   1.84948e-06       4042.98   4.513e-10       0.001      203  LS failed, Hessian reset 
     150       14233.1   5.84411e-09       4063.01      0.4534      0.4534      242   
Optimization terminated normally: 
  Convergence detected: absolute parameter change was below tolerance
[I 2020-10-01 02:28:56,118] Trial 64 finished with value: 0.041362819982494185 and parameters: {'changepoint_prior_scale': 0.0012073642145152854, 'seasonality_prior_scale': 0.10103606430281932, 'holidays_prior_scale': 7.3380277945614445, 'seasonality_mode': 'additive', 'changepoint_range': 0.5318301926709157}. Best is trial 60 with value: 0.04083410605276838.
Initial log joint probability = -28.8311
    Iter      log prob        ||dx||      ||grad||       alpha      alpha0  # evals  Notes 
      87       18912.9   2.33153e-05        1987.5    1.15e-08       0.001      151  LS failed, Hessian reset 
      99       18912.9   1.25865e-06       1643.15      0.2687      0.8361      167   
    Iter      log prob        ||dx||      ||grad||       alpha      alpha0  # evals  Notes 
     117       18912.9   8.92288e-09       1818.81      0.1189      0.1189      190   
Optimization terminated normally: 
  Convergence detected: absolute parameter change was below tolerance
INFO:fbprophet:Making 5 forecasts with cutoffs between 2013-10-07 00:00:00 and 2015-10-18 00:00:00
INFO:fbprophet:Applying in parallel with <concurrent.futures.process.ProcessPoolExecutor object at 0x7fc88e65e890>
Initial log joint probability = -8.95172
    Iter      log prob        ||dx||      ||grad||       alpha      alpha0  # evals  Notes 
Initial log joint probability = -12.7302
    Iter      log prob        ||dx||      ||grad||       alpha      alpha0  # evals  Notes 
Initial log joint probability = -15.1549
    Iter      log prob        ||dx||      ||grad||       alpha      alpha0  # evals  Notes 
Initial log joint probability = -18.717
    Iter      log prob        ||dx||      ||grad||       alpha      alpha0  # evals  Notes 
Initial log joint probability = -23.5879
    Iter      log prob        ||dx||      ||grad||       alpha      alpha0  # evals  Notes 
      66        4679.3   1.10328e-06       2263.59   4.971e-10       0.001      118  LS failed, Hessian reset 
      86        4679.3   9.28931e-09       2292.36      0.7534      0.7534      146   
Optimization terminated normally: 
  Convergence detected: absolute parameter change was below tolerance
      99       7032.01   1.23137e-05       1986.76           1           1      117   
    Iter      log prob        ||dx||      ||grad||       alpha      alpha0  # evals  Notes 
      70       9582.59   7.93846e-09       2327.71      0.5852      0.5852       93   
Optimization terminated normally: 
  Convergence detected: absolute parameter change was below tolerance
      60       11813.3   3.95342e-09       2092.76      0.2387      0.2387       89   
Optimization terminated normally: 
  Convergence detected: absolute parameter change was below tolerance
     184       7032.17   1.77071e-08       2086.64      0.2317           1      231   
Optimization terminated normally: 
  Convergence detected: relative gradient magnitude is below tolerance
      99       14232.5    6.9756e-08       1808.62           1           1      130   
    Iter      log prob        ||dx||      ||grad||       alpha      alpha0  # evals  Notes 
     117       14232.5    6.8414e-07        2297.7   2.945e-10       0.001      191  LS failed, Hessian reset 
     130       14232.5   3.32703e-08       1887.44           1           1      210   
Optimization terminated normally: 
  Convergence detected: relative gradient magnitude is below tolerance
[I 2020-10-01 02:29:11,760] Trial 65 finished with value: 0.041842433002127345 and parameters: {'changepoint_prior_scale': 0.0022473663967986705, 'seasonality_prior_scale': 0.13406696494741674, 'holidays_prior_scale': 1.8580264490212037, 'seasonality_mode': 'additive', 'changepoint_range': 0.5813432332910125}. Best is trial 60 with value: 0.04083410605276838.
Initial log joint probability = -28.8311
    Iter      log prob        ||dx||      ||grad||       alpha      alpha0  # evals  Notes 
      99       18912.8   8.22573e-07       2705.73           1           1      123   
    Iter      log prob        ||dx||      ||grad||       alpha      alpha0  # evals  Notes 
     105       18912.8   6.29937e-07       2518.36    2.74e-10       0.001      173  LS failed, Hessian reset 
     114       18912.8   1.83254e-08       1862.23      0.4141      0.4141      184   
Optimization terminated normally: 
  Convergence detected: relative gradient magnitude is below tolerance
INFO:fbprophet:Making 5 forecasts with cutoffs between 2013-10-07 00:00:00 and 2015-10-18 00:00:00
INFO:fbprophet:Applying in parallel with <concurrent.futures.process.ProcessPoolExecutor object at 0x7fc88e6b7ad0>
Initial log joint probability = -8.95172
    Iter      log prob        ||dx||      ||grad||       alpha      alpha0  # evals  Notes 
Initial log joint probability = -12.7302
    Iter      log prob        ||dx||      ||grad||       alpha      alpha0  # evals  Notes 
Initial log joint probability = -15.1549
    Iter      log prob        ||dx||      ||grad||       alpha      alpha0  # evals  Notes 
Initial log joint probability = -18.717
    Iter      log prob        ||dx||      ||grad||       alpha      alpha0  # evals  Notes 
Initial log joint probability = -23.5879
    Iter      log prob        ||dx||      ||grad||       alpha      alpha0  # evals  Notes 
      86       4679.08   5.06434e-09       2524.25      0.4207      0.4207      116   
Optimization terminated normally: 
  Convergence detected: absolute parameter change was below tolerance
      99       7031.12   0.000168923       2479.69       0.687       0.687      118   
    Iter      log prob        ||dx||      ||grad||       alpha      alpha0  # evals  Notes 
      56       11813.3   9.25338e-09        2526.2      0.2169           1       83   
Optimization terminated normally: 
  Convergence detected: absolute parameter change was below tolerance
      62       9582.48   3.12554e-06       2722.84   1.248e-09       0.001      122  LS failed, Hessian reset 
      86       9582.49   2.06425e-08          2686      0.7737      0.7737      150   
Optimization terminated normally: 
  Convergence detected: relative gradient magnitude is below tolerance
     167       7032.11    2.3032e-07       2535.23   8.591e-11       0.001      242  LS failed, Hessian reset 
     176       7032.11   7.91644e-09       2363.97      0.4426      0.4426      252   
Optimization terminated normally: 
  Convergence detected: absolute parameter change was below tolerance
      72       14232.5   4.65718e-05       2554.57   1.847e-08       0.001      141  LS failed, Hessian reset 
      99       14232.6   1.83633e-07       2013.59           1           1      177   
    Iter      log prob        ||dx||      ||grad||       alpha      alpha0  # evals  Notes 
     116       14232.6   8.45925e-07       2122.83   3.941e-10       0.001      234  LS failed, Hessian reset 
     139       14232.6   1.23658e-08        2299.3     0.04679           1      264   
Optimization terminated normally: 
  Convergence detected: relative gradient magnitude is below tolerance
[I 2020-10-01 02:29:25,074] Trial 66 finished with value: 0.04164811285690916 and parameters: {'changepoint_prior_scale': 0.0019112483695924284, 'seasonality_prior_scale': 0.2121644814720882, 'holidays_prior_scale': 3.080345950320244, 'seasonality_mode': 'additive', 'changepoint_range': 0.573916441754145}. Best is trial 60 with value: 0.04083410605276838.
Initial log joint probability = -28.8311
    Iter      log prob        ||dx||      ||grad||       alpha      alpha0  # evals  Notes 
      99         18913   3.91376e-05       3382.18       0.322           1      126   
    Iter      log prob        ||dx||      ||grad||       alpha      alpha0  # evals  Notes 
     100         18913   4.40923e-06       3133.93   1.304e-09       0.001      165  LS failed, Hessian reset 
     133         18913   1.80454e-08       2953.14      0.2647           1      208   
Optimization terminated normally: 
  Convergence detected: relative gradient magnitude is below tolerance
INFO:fbprophet:Making 5 forecasts with cutoffs between 2013-10-07 00:00:00 and 2015-10-18 00:00:00
INFO:fbprophet:Applying in parallel with <concurrent.futures.process.ProcessPoolExecutor object at 0x7fc88e685450>
Initial log joint probability = -8.95172
    Iter      log prob        ||dx||      ||grad||       alpha      alpha0  # evals  Notes 
Initial log joint probability = -12.7302
    Iter      log prob        ||dx||      ||grad||       alpha      alpha0  # evals  Notes 
      72       4679.17   3.37951e-09       3048.96      0.2229      0.2229       94   
Optimization terminated normally: 
  Convergence detected: absolute parameter change was below tolerance
Initial log joint probability = -15.1549
    Iter      log prob        ||dx||      ||grad||       alpha      alpha0  # evals  Notes 
Initial log joint probability = -18.717
    Iter      log prob        ||dx||      ||grad||       alpha      alpha0  # evals  Notes 
Initial log joint probability = -23.5879
    Iter      log prob        ||dx||      ||grad||       alpha      alpha0  # evals  Notes 
      62       7029.26   5.15446e-05       3116.38   1.465e-08       0.001      119  LS failed, Hessian reset 
      99       7029.47   5.83674e-06       3333.26      0.3324           1      165   
    Iter      log prob        ||dx||      ||grad||       alpha      alpha0  # evals  Notes 
     125       7029.49   9.91675e-09       2550.93      0.2768      0.2768      197   
Optimization terminated normally: 
  Convergence detected: absolute parameter change was below tolerance
      73       9582.53   4.71773e-09       3143.69      0.1297      0.1297      105   
Optimization terminated normally: 
  Convergence detected: absolute parameter change was below tolerance
      63       11813.3   4.16727e-09       3275.75      0.3034      0.3034       95   
Optimization terminated normally: 
  Convergence detected: absolute parameter change was below tolerance
      99       14232.4   5.40377e-08       3141.54      0.2047           1      131   
    Iter      log prob        ||dx||      ||grad||       alpha      alpha0  # evals  Notes 
     100       14232.4   3.73345e-09       3398.89      0.1695      0.1695      132   
Optimization terminated normally: 
  Convergence detected: absolute parameter change was below tolerance
