[I 2020-10-01 02:15:31,341] Trial 12 finished with value: 0.04199021270330689 and parameters: {'changepoint_prior_scale': 0.004058220501731209, 'seasonality_prior_scale': 0.05170095581512183, 'holidays_prior_scale': 0.01926886450686672, 'seasonality_mode': 'additive', 'changepoint_range': 0.5059709997212573}. Best is trial 3 with value: 0.04098090703811677.
Initial log joint probability = -28.8311
    Iter      log prob        ||dx||      ||grad||       alpha      alpha0  # evals  Notes 
      99       18912.7   7.61465e-06       1297.32      0.3498      0.3498      121   
    Iter      log prob        ||dx||      ||grad||       alpha      alpha0  # evals  Notes 
     148       18912.7   1.10618e-06       1191.49   8.308e-10       0.001      231  LS failed, Hessian reset 
     161       18912.7    8.2615e-09       1135.41      0.1441      0.1441      251   
Optimization terminated normally: 
  Convergence detected: absolute parameter change was below tolerance
INFO:fbprophet:Making 5 forecasts with cutoffs between 2013-10-07 00:00:00 and 2015-10-18 00:00:00
INFO:fbprophet:Applying in parallel with <concurrent.futures.process.ProcessPoolExecutor object at 0x7fc88f51e590>
Initial log joint probability = -8.95172
    Iter      log prob        ||dx||      ||grad||       alpha      alpha0  # evals  Notes 
Initial log joint probability = -12.7302
    Iter      log prob        ||dx||      ||grad||       alpha      alpha0  # evals  Notes 
Initial log joint probability = -15.1549
    Iter      log prob        ||dx||      ||grad||       alpha      alpha0  # evals  Notes 
Initial log joint probability = -18.717
    Iter      log prob        ||dx||      ||grad||       alpha      alpha0  # evals  Notes 
Initial log joint probability = -23.5879
    Iter      log prob        ||dx||      ||grad||       alpha      alpha0  # evals  Notes 
      99       4679.35   1.12571e-07       1694.85      0.2629           1      124   
    Iter      log prob        ||dx||      ||grad||       alpha      alpha0  # evals  Notes 
     115       4679.35   7.47228e-09       1621.82      0.4406      0.4406      145   
Optimization terminated normally: 
  Convergence detected: absolute parameter change was below tolerance
      99        7031.5   8.42422e-07       1557.64           1           1      120   
    Iter      log prob        ||dx||      ||grad||       alpha      alpha0  # evals  Notes 
     121       7031.51   8.25132e-09       1517.97      0.4331      0.4331      146   
Optimization terminated normally: 
  Convergence detected: absolute parameter change was below tolerance
      90       9582.57   7.91975e-09       1779.66      0.0312           1      126   
Optimization terminated normally: 
  Convergence detected: absolute parameter change was below tolerance
      99       11812.6   0.000184076       1549.61      0.8717      0.8717      129   
    Iter      log prob        ||dx||      ||grad||       alpha      alpha0  # evals  Notes 
      99       14231.6   0.000201186       1577.72           1           1      127   
    Iter      log prob        ||dx||      ||grad||       alpha      alpha0  # evals  Notes 
     107       11812.7   2.55131e-05       1509.72   2.166e-08       0.001      214  LS failed, Hessian reset 
     105       14232.1   0.000109328       1492.67   6.922e-08       0.001      170  LS failed, Hessian reset 
     187         11813   4.65099e-06       1648.63   3.169e-09       0.001      346  LS failed, Hessian reset 
     199         11813   1.93275e-07        1237.7      0.4294      0.4294      363   
    Iter      log prob        ||dx||      ||grad||       alpha      alpha0  # evals  Notes 
     172       14232.4    1.3069e-05       1904.01   8.163e-09       0.001      308  LS failed, Hessian reset 
     213         11813   5.09342e-09       1484.38      0.1688      0.1688      382   
Optimization terminated normally: 
  Convergence detected: absolute parameter change was below tolerance
     199       14232.4   7.10924e-08        1519.9           1           1      343   
    Iter      log prob        ||dx||      ||grad||       alpha      alpha0  # evals  Notes 
     204       14232.4   2.06936e-08       1550.33      0.1695      0.8171      349   
Optimization terminated normally: 
  Convergence detected: relative gradient magnitude is below tolerance
[I 2020-10-01 02:15:47,796] Trial 13 finished with value: 0.04184747423407706 and parameters: {'changepoint_prior_scale': 0.00292694939354576, 'seasonality_prior_scale': 0.08566070916484604, 'holidays_prior_scale': 9.227861773366108, 'seasonality_mode': 'additive', 'changepoint_range': 0.5841957218393361}. Best is trial 3 with value: 0.04098090703811677.
Initial log joint probability = -28.8311
    Iter      log prob        ||dx||      ||grad||       alpha      alpha0  # evals  Notes 
      73       18914.2   1.67074e-07       290.335      0.7774      0.7774       99   
Optimization terminated normally: 
  Convergence detected: relative gradient magnitude is below tolerance
INFO:fbprophet:Making 5 forecasts with cutoffs between 2013-10-07 00:00:00 and 2015-10-18 00:00:00
INFO:fbprophet:Applying in parallel with <concurrent.futures.process.ProcessPoolExecutor object at 0x7fc88e616b10>
Initial log joint probability = -8.95172
    Iter      log prob        ||dx||      ||grad||       alpha      alpha0  # evals  Notes 
Initial log joint probability = -12.7302
    Iter      log prob        ||dx||      ||grad||       alpha      alpha0  # evals  Notes 
Initial log joint probability = -15.1549
    Iter      log prob        ||dx||      ||grad||       alpha      alpha0  # evals  Notes 
Initial log joint probability = -18.717
    Iter      log prob        ||dx||      ||grad||       alpha      alpha0  # evals  Notes 
      68       4679.48    3.0012e-09       485.985     0.05078     0.05078       88   
Optimization terminated normally: 
  Convergence detected: absolute parameter change was below tolerance
Initial log joint probability = -23.5879
    Iter      log prob        ||dx||      ||grad||       alpha      alpha0  # evals  Notes 
      88       7032.46   3.47403e-08       308.709     0.03377           1      126   
Optimization terminated normally: 
  Convergence detected: relative gradient magnitude is below tolerance
      64       9582.75    1.9731e-07       248.796           1           1       96   
Optimization terminated normally: 
  Convergence detected: relative gradient magnitude is below tolerance
      99       11813.3   2.36322e-06       331.009           1           1      138   
    Iter      log prob        ||dx||      ||grad||       alpha      alpha0  # evals  Notes 
      99       14234.7   1.21454e-05       402.037      0.1329           1      136   
    Iter      log prob        ||dx||      ||grad||       alpha      alpha0  # evals  Notes 
     118       11813.3   3.16932e-05       452.082   7.627e-08       0.001      209  LS failed, Hessian reset 
     102       14234.7   9.47607e-06       395.066   2.157e-08       0.001      192  LS failed, Hessian reset 
     151       11813.3   2.65051e-08       321.821      0.1454      0.1454      254   
Optimization terminated normally: 
  Convergence detected: relative gradient magnitude is below tolerance
     118       14234.7   1.60724e-07       414.024           1           1      216   
Optimization terminated normally: 
  Convergence detected: relative gradient magnitude is below tolerance
[I 2020-10-01 02:16:02,541] Trial 14 finished with value: 0.04188015880306011 and parameters: {'changepoint_prior_scale': 0.009655313233399396, 'seasonality_prior_scale': 0.5384971938197963, 'holidays_prior_scale': 0.044358296086601634, 'seasonality_mode': 'additive', 'changepoint_range': 0.6438270211373462}. Best is trial 3 with value: 0.04098090703811677.
Initial log joint probability = -28.8311
    Iter      log prob        ||dx||      ||grad||       alpha      alpha0  # evals  Notes 
      84       18908.6   9.73522e-05       3042.99   3.847e-08       0.001      149  LS failed, Hessian reset 
      99       18908.8   4.37259e-06        2499.6           1           1      167   
    Iter      log prob        ||dx||      ||grad||       alpha      alpha0  # evals  Notes 
     121       18908.8   9.47557e-09       2441.12      0.2387      0.2387      191   
Optimization terminated normally: 
  Convergence detected: absolute parameter change was below tolerance
INFO:fbprophet:Making 5 forecasts with cutoffs between 2013-10-07 00:00:00 and 2015-10-18 00:00:00
INFO:fbprophet:Applying in parallel with <concurrent.futures.process.ProcessPoolExecutor object at 0x7fc88f51e590>
Initial log joint probability = -8.95172
    Iter      log prob        ||dx||      ||grad||       alpha      alpha0  # evals  Notes 
Initial log joint probability = -12.7302
    Iter      log prob        ||dx||      ||grad||       alpha      alpha0  # evals  Notes 
Initial log joint probability = -15.1549
    Iter      log prob        ||dx||      ||grad||       alpha      alpha0  # evals  Notes 
Initial log joint probability = -18.717
    Iter      log prob        ||dx||      ||grad||       alpha      alpha0  # evals  Notes 
Initial log joint probability = -23.5879
    Iter      log prob        ||dx||      ||grad||       alpha      alpha0  # evals  Notes 
      63       4674.98   0.000215109       3006.67   6.993e-08       0.001      141  LS failed, Hessian reset 
      99       4675.62   1.14112e-07        2955.5      0.8346      0.8346      185   
    Iter      log prob        ||dx||      ||grad||       alpha      alpha0  # evals  Notes 
     113       4675.62   6.74218e-09       3041.65      0.4832      0.4832      203   
Optimization terminated normally: 
  Convergence detected: absolute parameter change was below tolerance
      99       7026.27   0.000298599       2884.05      0.5873      0.5873      122   
    Iter      log prob        ||dx||      ||grad||       alpha      alpha0  # evals  Notes 
      54       11808.7    1.9185e-08       2951.38           1           1       81   
Optimization terminated normally: 
  Convergence detected: relative gradient magnitude is below tolerance
      90       9577.66   3.70496e-09       2835.18      0.2639      0.2639      118   
Optimization terminated normally: 
  Convergence detected: absolute parameter change was below tolerance
     172          7027   2.62716e-09       2959.21      0.2705      0.2705      213   
Optimization terminated normally: 
  Convergence detected: absolute parameter change was below tolerance
      77       14227.5    6.7743e-05       2796.38   2.056e-08       0.001      147  LS failed, Hessian reset 
      99       14227.7   1.08351e-06       2305.34      0.4957      0.4957      174   
    Iter      log prob        ||dx||      ||grad||       alpha      alpha0  # evals  Notes 
     126       14227.7   5.76159e-09       3219.64      0.2392      0.2392      207   
Optimization terminated normally: 
  Convergence detected: absolute parameter change was below tolerance
[I 2020-10-01 02:16:18,539] Trial 15 finished with value: 0.04199299932524791 and parameters: {'changepoint_prior_scale': 0.0016813119531715376, 'seasonality_prior_scale': 0.012972821482440892, 'holidays_prior_scale': 0.011065950345746981, 'seasonality_mode': 'additive', 'changepoint_range': 0.5273911790956491}. Best is trial 3 with value: 0.04098090703811677.
Initial log joint probability = -28.8311
    Iter      log prob        ||dx||      ||grad||       alpha      alpha0  # evals  Notes 
      99       18923.6   0.000897712       294.525      0.2182           1      117   
    Iter      log prob        ||dx||      ||grad||       alpha      alpha0  # evals  Notes 
     199       18925.8   0.000583634       28.9835           1           1      225   
    Iter      log prob        ||dx||      ||grad||       alpha      alpha0  # evals  Notes 
     299       18926.1    0.00148704       70.7226      0.9643      0.9643      336   
    Iter      log prob        ||dx||      ||grad||       alpha      alpha0  # evals  Notes 
     399       18926.3   7.55991e-05        79.445       0.319       0.319      448   
    Iter      log prob        ||dx||      ||grad||       alpha      alpha0  # evals  Notes 
     499       18926.4    0.00031448       70.6304      0.7594      0.7594      555   
    Iter      log prob        ||dx||      ||grad||       alpha      alpha0  # evals  Notes 
     599       18926.8   0.000305674       40.2246      0.2808      0.2808      665   
    Iter      log prob        ||dx||      ||grad||       alpha      alpha0  # evals  Notes 
     699         18927   0.000925855       44.9984           1           1      774   
    Iter      log prob        ||dx||      ||grad||       alpha      alpha0  # evals  Notes 
     799       18927.1   0.000119125       57.7075      0.3184      0.3184      889   
    Iter      log prob        ||dx||      ||grad||       alpha      alpha0  # evals  Notes 
     848       18927.2   7.81528e-06        25.298   2.829e-07       0.001     1000  LS failed, Hessian reset 
     893       18927.2   5.94174e-06       15.3694           1           1     1064   
Optimization terminated normally: 
  Convergence detected: relative gradient magnitude is below tolerance
INFO:fbprophet:Making 5 forecasts with cutoffs between 2013-10-07 00:00:00 and 2015-10-18 00:00:00
INFO:fbprophet:Applying in parallel with <concurrent.futures.process.ProcessPoolExecutor object at 0x7fc88e6d4990>
Initial log joint probability = -8.95172
    Iter      log prob        ||dx||      ||grad||       alpha      alpha0  # evals  Notes 
Initial log joint probability = -12.7302
    Iter      log prob        ||dx||      ||grad||       alpha      alpha0  # evals  Notes 
Initial log joint probability = -15.1549
    Iter      log prob        ||dx||      ||grad||       alpha      alpha0  # evals  Notes 
Initial log joint probability = -18.717
    Iter      log prob        ||dx||      ||grad||       alpha      alpha0  # evals  Notes 
Initial log joint probability = -23.5879
    Iter      log prob        ||dx||      ||grad||       alpha      alpha0  # evals  Notes 
      79       4679.16    2.6051e-06       8.16183      0.2508           1      112   
Optimization terminated normally: 
  Convergence detected: relative gradient magnitude is below tolerance
      99       7039.79    0.00148825       31.6734      0.9693      0.9693      110   
    Iter      log prob        ||dx||      ||grad||       alpha      alpha0  # evals  Notes 
      99       9588.84    0.00573134       193.695      0.2361           1      114   
    Iter      log prob        ||dx||      ||grad||       alpha      alpha0  # evals  Notes 
     178       7039.87   1.41244e-05       17.7851   7.996e-07       0.001      250  LS failed, Hessian reset 
      99       11820.9      0.010126       536.511           1           1      122   
    Iter      log prob        ||dx||      ||grad||       alpha      alpha0  # evals  Notes 
     199       7039.89   5.96465e-05       12.7594      0.7527      0.7527      276   
    Iter      log prob        ||dx||      ||grad||       alpha      alpha0  # evals  Notes 
      99       14242.5     0.0029574       207.875           1           1      118   
    Iter      log prob        ||dx||      ||grad||       alpha      alpha0  # evals  Notes 
     199       9589.35    0.00129677       46.4784         0.4           1      227   
    Iter      log prob        ||dx||      ||grad||       alpha      alpha0  # evals  Notes 
     258       7039.91   3.47841e-05       35.1581    1.41e-06       0.001      394  LS failed, Hessian reset 
     296       7039.93    1.3511e-06        9.3582     0.05588     0.05588      444   
Optimization terminated normally: 
  Convergence detected: relative gradient magnitude is below tolerance
     199       11821.6   0.000660019       38.5635      0.7326      0.7326      232   
    Iter      log prob        ||dx||      ||grad||       alpha      alpha0  # evals  Notes 
     258       9589.48   2.19451e-05       26.0094   1.768e-06       0.001      349  LS failed, Hessian reset 
     299       9589.61   0.000199024       32.3977           1           1      394   
    Iter      log prob        ||dx||      ||grad||       alpha      alpha0  # evals  Notes 
     199       14243.3   0.000184573       40.4988           1           1      232   
    Iter      log prob        ||dx||      ||grad||       alpha      alpha0  # evals  Notes 
     278       11821.8   5.26726e-05       32.7859   1.463e-06       0.001      358  LS failed, Hessian reset 
     299       11821.8   0.000411364       31.9595       0.303           1      381   
    Iter      log prob        ||dx||      ||grad||       alpha      alpha0  # evals  Notes 
     343       9589.63   9.33776e-06       15.2107   3.825e-07       0.001      491  LS failed, Hessian reset 
     399       9589.64    7.1774e-05       14.3066           1           1      558   
    Iter      log prob        ||dx||      ||grad||       alpha      alpha0  # evals  Notes 
     299       14243.4   0.000223971       24.4453           1           1      352   
    Iter      log prob        ||dx||      ||grad||       alpha      alpha0  # evals  Notes 
     399       11822.1   0.000184133       17.4654      0.8045      0.8045      500   
    Iter      log prob        ||dx||      ||grad||       alpha      alpha0  # evals  Notes 
     471       9589.66   4.46604e-06       7.84751      0.3239           1      656   
Optimization terminated normally: 
  Convergence detected: relative gradient magnitude is below tolerance
     419       11822.1   1.25684e-05       18.9298    2.66e-07       0.001      570  LS failed, Hessian reset 
     399       14243.5    0.00076206       27.7935           1           1      463   
    Iter      log prob        ||dx||      ||grad||       alpha      alpha0  # evals  Notes 
     486       11822.2     1.344e-05       21.5629   2.679e-07       0.001      698  LS failed, Hessian reset 
     499       11822.2   9.13453e-05       16.4809      0.6908      0.6908      712   
    Iter      log prob        ||dx||      ||grad||       alpha      alpha0  # evals  Notes 
     436       14243.6    2.5804e-05          59.1   2.416e-07       0.001      545  LS failed, Hessian reset 
     599       11822.2   0.000206575       18.1388           1           1      831   
    Iter      log prob        ||dx||      ||grad||       alpha      alpha0  # evals  Notes 
     499       14243.8   0.000355802       22.1607      0.8344      0.8344      618   
    Iter      log prob        ||dx||      ||grad||       alpha      alpha0  # evals  Notes 
     644       11822.2   2.37125e-05       43.0806   7.024e-07       0.001      940  LS failed, Hessian reset 
     564       14243.8   8.87849e-06       22.6124   3.929e-07       0.001      734  LS failed, Hessian reset 
     699       11822.3   0.000291551       51.7577      0.2856           1     1005   
    Iter      log prob        ||dx||      ||grad||       alpha      alpha0  # evals  Notes 
     599       14243.8   3.00559e-05       10.3754      0.4559      0.4559      777   
    Iter      log prob        ||dx||      ||grad||       alpha      alpha0  # evals  Notes 
     799       11822.3   0.000107457       18.7043      0.3332           1     1125   
    Iter      log prob        ||dx||      ||grad||       alpha      alpha0  # evals  Notes 
     650       14243.8   4.82493e-06       7.74104      0.4987           1      850   
Optimization terminated normally: 
  Convergence detected: relative gradient magnitude is below tolerance
     846       11822.3   2.32804e-05       17.8349   1.677e-06       0.001     1222  LS failed, Hessian reset 
     899       11822.3    6.9361e-06       11.1218      0.7971      0.7971     1295   
    Iter      log prob        ||dx||      ||grad||       alpha      alpha0  # evals  Notes 
     904       11822.3   1.07605e-05       9.19604      0.3497           1     1302   
Optimization terminated normally: 
  Convergence detected: relative gradient magnitude is below tolerance
