[I 2020-10-01 03:56:49,881] Trial 409 finished with value: 0.04085528552119743 and parameters: {'changepoint_prior_scale': 0.0011245419691452538, 'seasonality_prior_scale': 0.09962731372276154, 'holidays_prior_scale': 0.16709969130161723, 'seasonality_mode': 'additive', 'changepoint_range': 0.5411492099708378}. Best is trial 96 with value: 0.038883738900888705.
Initial log joint probability = -28.8311
    Iter      log prob        ||dx||      ||grad||       alpha      alpha0  # evals  Notes 
      99       18912.4    8.9455e-06       864.671      0.5457      0.5457      128   
    Iter      log prob        ||dx||      ||grad||       alpha      alpha0  # evals  Notes 
     158       18912.6    2.2774e-05       1367.15       2e-08       0.001      255  LS failed, Hessian reset 
     199       18912.6   1.92457e-08       919.661      0.2241      0.2241      309   
    Iter      log prob        ||dx||      ||grad||       alpha      alpha0  # evals  Notes 
     202       18912.6   2.72577e-08       995.991      0.1068      0.5575      314   
Optimization terminated normally: 
  Convergence detected: relative gradient magnitude is below tolerance
INFO:fbprophet:Making 5 forecasts with cutoffs between 2013-10-07 00:00:00 and 2015-10-18 00:00:00
INFO:fbprophet:Applying in parallel with <concurrent.futures.process.ProcessPoolExecutor object at 0x7fc84dc0b250>
Initial log joint probability = -8.95172
    Iter      log prob        ||dx||      ||grad||       alpha      alpha0  # evals  Notes 
Initial log joint probability = -12.7302
    Iter      log prob        ||dx||      ||grad||       alpha      alpha0  # evals  Notes 
Initial log joint probability = -15.1549
    Iter      log prob        ||dx||      ||grad||       alpha      alpha0  # evals  Notes 
Initial log joint probability = -18.717
    Iter      log prob        ||dx||      ||grad||       alpha      alpha0  # evals  Notes 
Initial log joint probability = -23.5879
    Iter      log prob        ||dx||      ||grad||       alpha      alpha0  # evals  Notes 
      85       4679.45   8.84445e-07       1452.58   6.147e-10       0.001      157  LS failed, Hessian reset 
      99       4679.45   5.14894e-09       1450.11      0.2568      0.2568      175   
Optimization terminated normally: 
  Convergence detected: absolute parameter change was below tolerance
      99       7032.01   4.22522e-08       1325.44      0.6199      0.6199      123   
    Iter      log prob        ||dx||      ||grad||       alpha      alpha0  # evals  Notes 
     100       7032.01   1.92181e-08       1441.41      0.2042      0.6315      125   
Optimization terminated normally: 
  Convergence detected: relative gradient magnitude is below tolerance
      74       9582.63   1.34687e-06       1117.55   8.995e-10       0.001      133  LS failed, Hessian reset 
      99       9582.63   2.96176e-08       1127.21      0.5104      0.5104      165   
    Iter      log prob        ||dx||      ||grad||       alpha      alpha0  # evals  Notes 
     100       9582.63   3.58916e-08       1361.62       0.314      0.9436      167   
Optimization terminated normally: 
  Convergence detected: relative gradient magnitude is below tolerance
      92       11812.6   5.53102e-08       1156.41           1           1      124   
Optimization terminated normally: 
  Convergence detected: relative gradient magnitude is below tolerance
      79       14232.9   1.42328e-06       1094.39   9.478e-10       0.001      150  LS failed, Hessian reset 
      96       14232.9     2.445e-08        1072.3      0.1791           1      175   
Optimization terminated normally: 
  Convergence detected: relative gradient magnitude is below tolerance
[I 2020-10-01 03:57:06,324] Trial 410 finished with value: 0.0419007421210662 and parameters: {'changepoint_prior_scale': 0.0034722812236398573, 'seasonality_prior_scale': 0.21145867634832433, 'holidays_prior_scale': 0.2892981757128859, 'seasonality_mode': 'additive', 'changepoint_range': 0.5237059017560062}. Best is trial 96 with value: 0.038883738900888705.
Initial log joint probability = -28.8311
    Iter      log prob        ||dx||      ||grad||       alpha      alpha0  # evals  Notes 
      99       18912.5   4.35038e-06       3170.77      0.5771      0.5771      127   
    Iter      log prob        ||dx||      ||grad||       alpha      alpha0  # evals  Notes 
     163       18912.7    2.3279e-06       3230.54   6.985e-10       0.001      245  LS failed, Hessian reset 
     199       18912.8   7.82041e-08        3390.2           1           1      286   
    Iter      log prob        ||dx||      ||grad||       alpha      alpha0  # evals  Notes 
     201       18912.8   2.76655e-08        3297.5      0.2087           1      289   
Optimization terminated normally: 
  Convergence detected: relative gradient magnitude is below tolerance
INFO:fbprophet:Making 5 forecasts with cutoffs between 2013-10-07 00:00:00 and 2015-10-18 00:00:00
INFO:fbprophet:Applying in parallel with <concurrent.futures.process.ProcessPoolExecutor object at 0x7fc84dc0b690>
Initial log joint probability = -8.95172
    Iter      log prob        ||dx||      ||grad||       alpha      alpha0  # evals  Notes 
Initial log joint probability = -12.7302
    Iter      log prob        ||dx||      ||grad||       alpha      alpha0  # evals  Notes 
Initial log joint probability = -15.1549
    Iter      log prob        ||dx||      ||grad||       alpha      alpha0  # evals  Notes 
Initial log joint probability = -18.717
    Iter      log prob        ||dx||      ||grad||       alpha      alpha0  # evals  Notes 
Initial log joint probability = -23.5879
    Iter      log prob        ||dx||      ||grad||       alpha      alpha0  # evals  Notes 
      76       4678.88   6.62618e-09       3517.07      0.3593      0.3593       98   
Optimization terminated normally: 
  Convergence detected: absolute parameter change was below tolerance
      65       7028.39   6.40472e-05          3065   1.692e-08       0.001      117  LS failed, Hessian reset 
      63       9582.47   8.08358e-09       3162.36      0.3929      0.3929       86   
Optimization terminated normally: 
  Convergence detected: absolute parameter change was below tolerance
      99        7028.6   2.02098e-08       3212.29      0.3147      0.8743      154   
    Iter      log prob        ||dx||      ||grad||       alpha      alpha0  # evals  Notes 
     100        7028.6    9.0688e-09       3071.91         0.3         0.3      155   
Optimization terminated normally: 
  Convergence detected: absolute parameter change was below tolerance
      29       11811.6   0.000259756       3605.46   7.077e-08       0.001       90  LS failed, Hessian reset 
      96       11813.1   5.49771e-09       3572.59      0.2019      0.2019      175   
Optimization terminated normally: 
  Convergence detected: absolute parameter change was below tolerance
      99       14232.4   4.40776e-07       2713.82       0.337           1      135   
    Iter      log prob        ||dx||      ||grad||       alpha      alpha0  # evals  Notes 
     123       14232.4   1.18589e-08       2731.31      0.1561           1      164   
Optimization terminated normally: 
  Convergence detected: relative gradient magnitude is below tolerance
[I 2020-10-01 03:57:22,025] Trial 411 finished with value: 0.04039749636194983 and parameters: {'changepoint_prior_scale': 0.0013710400037796, 'seasonality_prior_scale': 0.1418282154032406, 'holidays_prior_scale': 0.15174824416238392, 'seasonality_mode': 'additive', 'changepoint_range': 0.5543239168103375}. Best is trial 96 with value: 0.038883738900888705.
Initial log joint probability = -28.8311
    Iter      log prob        ||dx||      ||grad||       alpha      alpha0  # evals  Notes 
      99       18912.6   1.11157e-05       3411.08      0.5511      0.5511      131   
    Iter      log prob        ||dx||      ||grad||       alpha      alpha0  # evals  Notes 
     128       18912.7   8.96511e-07       3272.81   2.393e-10       0.001      224  LS failed, Hessian reset 
     146       18912.7   3.07545e-08          2861           1           1      246   
Optimization terminated normally: 
  Convergence detected: relative gradient magnitude is below tolerance
INFO:fbprophet:Making 5 forecasts with cutoffs between 2013-10-07 00:00:00 and 2015-10-18 00:00:00
INFO:fbprophet:Applying in parallel with <concurrent.futures.process.ProcessPoolExecutor object at 0x7fc84dc9cf50>
Initial log joint probability = -8.95172
    Iter      log prob        ||dx||      ||grad||       alpha      alpha0  # evals  Notes 
Initial log joint probability = -12.7302
    Iter      log prob        ||dx||      ||grad||       alpha      alpha0  # evals  Notes 
Initial log joint probability = -15.1549
    Iter      log prob        ||dx||      ||grad||       alpha      alpha0  # evals  Notes 
Initial log joint probability = -18.717
    Iter      log prob        ||dx||      ||grad||       alpha      alpha0  # evals  Notes 
      71       4679.36   5.81408e-09       3466.25      0.4213      0.4213       95   
Optimization terminated normally: 
  Convergence detected: absolute parameter change was below tolerance
Initial log joint probability = -23.5879
    Iter      log prob        ||dx||      ||grad||       alpha      alpha0  # evals  Notes 
      99       7029.31    2.6408e-08       3289.08      0.3195           1      125   
    Iter      log prob        ||dx||      ||grad||       alpha      alpha0  # evals  Notes 
     100       7029.31   7.00195e-09       3176.68      0.3041      0.3041      126   
Optimization terminated normally: 
  Convergence detected: absolute parameter change was below tolerance
      74       9582.49   9.32044e-09       3098.63      0.2452      0.2452      113   
Optimization terminated normally: 
  Convergence detected: absolute parameter change was below tolerance
      74       11813.2   8.27606e-09       3445.05      0.2109      0.2109      105   
Optimization terminated normally: 
  Convergence detected: absolute parameter change was below tolerance
      98       14233.4   2.11891e-08       3460.69      0.3362           1      120   
Optimization terminated normally: 
  Convergence detected: relative gradient magnitude is below tolerance
[I 2020-10-01 03:57:36,202] Trial 412 finished with value: 0.04129557976744136 and parameters: {'changepoint_prior_scale': 0.0014331808674208817, 'seasonality_prior_scale': 0.14088828620104377, 'holidays_prior_scale': 0.15376546415707493, 'seasonality_mode': 'additive', 'changepoint_range': 0.554558780536047}. Best is trial 96 with value: 0.038883738900888705.
Initial log joint probability = -28.8311
    Iter      log prob        ||dx||      ||grad||       alpha      alpha0  # evals  Notes 
      99       18912.8   5.71545e-07       2563.09      0.2037           1      137   
    Iter      log prob        ||dx||      ||grad||       alpha      alpha0  # evals  Notes 
     112       18912.8   8.10198e-09       1939.32      0.3825      0.3825      150   
Optimization terminated normally: 
  Convergence detected: absolute parameter change was below tolerance
INFO:fbprophet:Making 5 forecasts with cutoffs between 2013-10-07 00:00:00 and 2015-10-18 00:00:00
INFO:fbprophet:Applying in parallel with <concurrent.futures.process.ProcessPoolExecutor object at 0x7fc84dc0b690>
Initial log joint probability = -8.95172
    Iter      log prob        ||dx||      ||grad||       alpha      alpha0  # evals  Notes 
Initial log joint probability = -12.7302
    Iter      log prob        ||dx||      ||grad||       alpha      alpha0  # evals  Notes 
Initial log joint probability = -15.1549
    Iter      log prob        ||dx||      ||grad||       alpha      alpha0  # evals  Notes 
Initial log joint probability = -18.717
    Iter      log prob        ||dx||      ||grad||       alpha      alpha0  # evals  Notes 
Initial log joint probability = -23.5879
    Iter      log prob        ||dx||      ||grad||       alpha      alpha0  # evals  Notes 
      78       4679.12   9.03425e-09       2380.06      0.3086      0.3086      110   
Optimization terminated normally: 
  Convergence detected: absolute parameter change was below tolerance
      99       7031.85   0.000669765       2255.62           1           1      118   
    Iter      log prob        ||dx||      ||grad||       alpha      alpha0  # evals  Notes 
     141       7032.12   5.16383e-09       1905.18      0.1776      0.1776      172   
Optimization terminated normally: 
  Convergence detected: absolute parameter change was below tolerance
      68       9582.51   9.94068e-06        2360.6   4.261e-09       0.001      124  LS failed, Hessian reset 
      67       11813.3   1.49543e-08       2492.72      0.4221           1       99   
Optimization terminated normally: 
  Convergence detected: relative gradient magnitude is below tolerance
      99       9582.54   9.18396e-07       2417.86      0.2346           1      165   
    Iter      log prob        ||dx||      ||grad||       alpha      alpha0  # evals  Notes 
     111       9582.55   7.52809e-09       2456.04      0.2299      0.2299      182   
Optimization terminated normally: 
  Convergence detected: absolute parameter change was below tolerance
      98       14233.1   6.82016e-09       2221.91      0.1651      0.1651      135   
Optimization terminated normally: 
  Convergence detected: absolute parameter change was below tolerance
[I 2020-10-01 03:57:51,897] Trial 413 finished with value: 0.04194951907238807 and parameters: {'changepoint_prior_scale': 0.001994714867068294, 'seasonality_prior_scale': 0.16069543667068248, 'holidays_prior_scale': 0.13515097199313963, 'seasonality_mode': 'additive', 'changepoint_range': 0.5684011572327126}. Best is trial 96 with value: 0.038883738900888705.
Initial log joint probability = -28.8311
    Iter      log prob        ||dx||      ||grad||       alpha      alpha0  # evals  Notes 
      99       18912.9   6.33253e-07        2662.7           1           1      123   
    Iter      log prob        ||dx||      ||grad||       alpha      alpha0  # evals  Notes 
     116       18912.9   6.14776e-07       3045.18   2.173e-10       0.001      188  LS failed, Hessian reset 
     132       18912.9   1.98066e-08       2539.68      0.5008      0.5008      208   
Optimization terminated normally: 
  Convergence detected: relative gradient magnitude is below tolerance
INFO:fbprophet:Making 5 forecasts with cutoffs between 2013-10-07 00:00:00 and 2015-10-18 00:00:00
INFO:fbprophet:Applying in parallel with <concurrent.futures.process.ProcessPoolExecutor object at 0x7fc84dca4750>
Initial log joint probability = -8.95172
    Iter      log prob        ||dx||      ||grad||       alpha      alpha0  # evals  Notes 
Initial log joint probability = -12.7302
    Iter      log prob        ||dx||      ||grad||       alpha      alpha0  # evals  Notes 
      88        4679.2   4.09077e-09        2761.2       0.277       0.277      114   
Optimization terminated normally: 
  Convergence detected: absolute parameter change was below tolerance
Initial log joint probability = -15.1549
    Iter      log prob        ||dx||      ||grad||       alpha      alpha0  # evals  Notes 
Initial log joint probability = -18.717
    Iter      log prob        ||dx||      ||grad||       alpha      alpha0  # evals  Notes 
Initial log joint probability = -23.5879
    Iter      log prob        ||dx||      ||grad||       alpha      alpha0  # evals  Notes 
      99       7029.36   9.28882e-05       3247.67     0.05806           1      130   
    Iter      log prob        ||dx||      ||grad||       alpha      alpha0  # evals  Notes 
     100       7029.38   0.000152822       3319.88   4.706e-08       0.001      167  LS failed, Hessian reset 
      54       9582.48   4.75832e-06       3152.83   1.678e-09       0.001      113  LS failed, Hessian reset 
      38       11811.9    0.00025621       2585.86    8.54e-08       0.001       96  LS failed, Hessian reset 
      79       9582.49   9.48697e-09       3014.06      0.4689      0.4689      144   
Optimization terminated normally: 
  Convergence detected: absolute parameter change was below tolerance
     162       7029.66   1.88332e-05       3124.19     6.5e-09       0.001      295  LS failed, Hessian reset 
     199       7029.72   2.63586e-06       2942.31           1           1      344   
    Iter      log prob        ||dx||      ||grad||       alpha      alpha0  # evals  Notes 
     209       7029.73   5.42803e-06       3070.47   1.958e-09       0.001      389  LS failed, Hessian reset 
      99       14232.2   1.87677e-07       2874.02      0.9784      0.9784      127   
    Iter      log prob        ||dx||      ||grad||       alpha      alpha0  # evals  Notes 
     103       14232.2   8.18143e-09       2507.02      0.1701      0.1701      132   
Optimization terminated normally: 
  Convergence detected: absolute parameter change was below tolerance
     238       7029.74   8.20287e-09       2706.57      0.2965      0.2965      428   
Optimization terminated normally: 
  Convergence detected: absolute parameter change was below tolerance
      99       11813.2   2.14734e-08       3055.65      0.5937           1      172   
    Iter      log prob        ||dx||      ||grad||       alpha      alpha0  # evals  Notes 
     100       11813.2   7.86329e-09       3035.87      0.1665      0.8269      174   
Optimization terminated normally: 
  Convergence detected: absolute parameter change was below tolerance
[I 2020-10-01 03:58:06,227] Trial 414 finished with value: 0.04056669882311325 and parameters: {'changepoint_prior_scale': 0.001654205844945638, 'seasonality_prior_scale': 0.13144934227516433, 'holidays_prior_scale': 0.11895853234338881, 'seasonality_mode': 'additive', 'changepoint_range': 0.5470005622264645}. Best is trial 96 with value: 0.038883738900888705.
Initial log joint probability = -28.8311
    Iter      log prob        ||dx||      ||grad||       alpha      alpha0  # evals  Notes 
      99       18912.9    6.5971e-07       2416.58      0.6621      0.6621      127   
    Iter      log prob        ||dx||      ||grad||       alpha      alpha0  # evals  Notes 
     117       18912.9   9.65091e-09       2849.81      0.2588      0.2588      152   
Optimization terminated normally: 
  Convergence detected: absolute parameter change was below tolerance
INFO:fbprophet:Making 5 forecasts with cutoffs between 2013-10-07 00:00:00 and 2015-10-18 00:00:00
INFO:fbprophet:Applying in parallel with <concurrent.futures.process.ProcessPoolExecutor object at 0x7fc84dc0b690>
Initial log joint probability = -8.95172
    Iter      log prob        ||dx||      ||grad||       alpha      alpha0  # evals  Notes 
Initial log joint probability = -12.7302
    Iter      log prob        ||dx||      ||grad||       alpha      alpha0  # evals  Notes 
Initial log joint probability = -15.1549
    Iter      log prob        ||dx||      ||grad||       alpha      alpha0  # evals  Notes 
Initial log joint probability = -18.717
    Iter      log prob        ||dx||      ||grad||       alpha      alpha0  # evals  Notes 
      59        4679.3   8.63668e-09       2831.93      0.3703      0.3703       78   
Optimization terminated normally: 
  Convergence detected: absolute parameter change was below tolerance
Initial log joint probability = -23.5879
    Iter      log prob        ||dx||      ||grad||       alpha      alpha0  # evals  Notes 
      71        7029.6   3.53948e-05       2735.05   1.089e-08       0.001      121  LS failed, Hessian reset 
      99       7029.69   7.65246e-07       2579.29      0.4136           1      158   
    Iter      log prob        ||dx||      ||grad||       alpha      alpha0  # evals  Notes 
     129       7029.69    7.7775e-09       2585.55      0.4282      0.4282      197   
Optimization terminated normally: 
  Convergence detected: absolute parameter change was below tolerance
      64       11813.2   1.33708e-09        2925.7     0.06293     0.06293       93   
Optimization terminated normally: 
  Convergence detected: absolute parameter change was below tolerance
      65       9582.53   6.51758e-07       2952.53   2.161e-10       0.001      143  LS failed, Hessian reset 
      79       9582.53   9.02503e-09        2602.2       0.268       0.268      161   
Optimization terminated normally: 
  Convergence detected: absolute parameter change was below tolerance
      94       14233.3   3.75482e-05       2834.47   1.295e-08       0.001      180  LS failed, Hessian reset 
      99       14233.3   3.24899e-05       3018.07       0.159           1      186   
    Iter      log prob        ||dx||      ||grad||       alpha      alpha0  # evals  Notes 
     144       14233.4     3.602e-10       2989.26    0.007341    0.007341      261   
Optimization terminated normally: 
  Convergence detected: absolute parameter change was below tolerance
