[I 2020-10-01 02:22:45,317] Trial 40 finished with value: 0.041375974042676594 and parameters: {'changepoint_prior_scale': 0.0010157067372396013, 'seasonality_prior_scale': 9.156344488750904, 'holidays_prior_scale': 0.07976912968678049, 'seasonality_mode': 'additive', 'changepoint_range': 0.7226932462571466}. Best is trial 3 with value: 0.04098090703811677.
Initial log joint probability = -28.8311
    Iter      log prob        ||dx||      ||grad||       alpha      alpha0  # evals  Notes 
      99       18912.7   3.69763e-07       3152.95      0.7327      0.7327      120   
    Iter      log prob        ||dx||      ||grad||       alpha      alpha0  # evals  Notes 
     117       18912.7   9.33596e-09       3403.88      0.1622      0.1622      142   
Optimization terminated normally: 
  Convergence detected: absolute parameter change was below tolerance
INFO:fbprophet:Making 5 forecasts with cutoffs between 2013-10-07 00:00:00 and 2015-10-18 00:00:00
INFO:fbprophet:Applying in parallel with <concurrent.futures.process.ProcessPoolExecutor object at 0x7fc88e651790>
Initial log joint probability = -8.95172
    Iter      log prob        ||dx||      ||grad||       alpha      alpha0  # evals  Notes 
Initial log joint probability = -12.7302
    Iter      log prob        ||dx||      ||grad||       alpha      alpha0  # evals  Notes 
Initial log joint probability = -15.1549
    Iter      log prob        ||dx||      ||grad||       alpha      alpha0  # evals  Notes 
Initial log joint probability = -18.717
    Iter      log prob        ||dx||      ||grad||       alpha      alpha0  # evals  Notes 
Initial log joint probability = -23.5879
    Iter      log prob        ||dx||      ||grad||       alpha      alpha0  # evals  Notes 
      72       4679.01   3.09728e-09       3637.85     0.03848    0.003848      102   
Optimization terminated normally: 
  Convergence detected: absolute parameter change was below tolerance
      87       7029.14   2.37808e-05       3641.38   7.439e-09       0.001      153  LS failed, Hessian reset 
      72       9582.31   1.74713e-08       3180.29      0.3987           1       99   
Optimization terminated normally: 
  Convergence detected: relative gradient magnitude is below tolerance
      99       7029.27   1.24071e-06       3075.08      0.2856      0.2856      168   
    Iter      log prob        ||dx||      ||grad||       alpha      alpha0  # evals  Notes 
      63       11812.9   1.68863e-08       3529.82      0.9374      0.9374       84   
Optimization terminated normally: 
  Convergence detected: relative gradient magnitude is below tolerance
     199       7029.31   1.10702e-07       3486.46           1           1      292   
    Iter      log prob        ||dx||      ||grad||       alpha      alpha0  # evals  Notes 
     206       7029.31   8.76577e-09       2778.15       0.478       0.478      300   
Optimization terminated normally: 
  Convergence detected: absolute parameter change was below tolerance
      99       14232.7   1.93057e-06       2976.91           1           1      131   
    Iter      log prob        ||dx||      ||grad||       alpha      alpha0  # evals  Notes 
     105       14232.7   4.72681e-06       3463.37   1.437e-09       0.001      178  LS failed, Hessian reset 
     134       14232.7   2.57321e-08       2611.07      0.4245           1      219   
Optimization terminated normally: 
  Convergence detected: relative gradient magnitude is below tolerance
[I 2020-10-01 02:23:00,297] Trial 41 finished with value: 0.04100056853757859 and parameters: {'changepoint_prior_scale': 0.001432243184248736, 'seasonality_prior_scale': 0.06489328477613573, 'holidays_prior_scale': 6.792873488686576, 'seasonality_mode': 'additive', 'changepoint_range': 0.6731356293348382}. Best is trial 3 with value: 0.04098090703811677.
Initial log joint probability = -28.8311
    Iter      log prob        ||dx||      ||grad||       alpha      alpha0  # evals  Notes 
      99       18911.3   1.12643e-06       3661.15      0.3157           1      130   
    Iter      log prob        ||dx||      ||grad||       alpha      alpha0  # evals  Notes 
     126       18911.3   1.56492e-09       4182.02      0.1081      0.1081      164   
Optimization terminated normally: 
  Convergence detected: absolute parameter change was below tolerance
INFO:fbprophet:Making 5 forecasts with cutoffs between 2013-10-07 00:00:00 and 2015-10-18 00:00:00
INFO:fbprophet:Applying in parallel with <concurrent.futures.process.ProcessPoolExecutor object at 0x7fc88e616b10>
Initial log joint probability = -8.95172
    Iter      log prob        ||dx||      ||grad||       alpha      alpha0  # evals  Notes 
Initial log joint probability = -12.7302
    Iter      log prob        ||dx||      ||grad||       alpha      alpha0  # evals  Notes 
Initial log joint probability = -15.1549
    Iter      log prob        ||dx||      ||grad||       alpha      alpha0  # evals  Notes 
Initial log joint probability = -18.717
    Iter      log prob        ||dx||      ||grad||       alpha      alpha0  # evals  Notes 
      67       4677.33   6.29753e-09       4054.77       0.137       0.137       94   
Optimization terminated normally: 
  Convergence detected: absolute parameter change was below tolerance
Initial log joint probability = -23.5879
    Iter      log prob        ||dx||      ||grad||       alpha      alpha0  # evals  Notes 
      61       9580.59   7.87166e-09       3672.48      0.6416      0.6416       88   
Optimization terminated normally: 
  Convergence detected: absolute parameter change was below tolerance
      99       7026.65   1.40109e-07       4125.27   3.978e-11       0.001      169  LS failed, Hessian reset 
    Iter      log prob        ||dx||      ||grad||       alpha      alpha0  # evals  Notes 
     110       7026.65   7.11014e-09       3430.37      0.5735      0.5735      181   
Optimization terminated normally: 
  Convergence detected: absolute parameter change was below tolerance
      61       11811.3   9.81025e-09       4046.86      0.5699      0.5699       93   
Optimization terminated normally: 
  Convergence detected: absolute parameter change was below tolerance
      99       14231.5   4.86831e-07       4073.35      0.3547      0.3547      131   
    Iter      log prob        ||dx||      ||grad||       alpha      alpha0  # evals  Notes 
     153       14231.6      6.33e-09        3648.6      0.4462      0.4462      196   
Optimization terminated normally: 
  Convergence detected: absolute parameter change was below tolerance
[I 2020-10-01 02:23:15,871] Trial 42 finished with value: 0.041226135214862354 and parameters: {'changepoint_prior_scale': 0.001243820205000208, 'seasonality_prior_scale': 0.021117242978701815, 'holidays_prior_scale': 3.2343789762749764, 'seasonality_mode': 'additive', 'changepoint_range': 0.6392183069764357}. Best is trial 3 with value: 0.04098090703811677.
Initial log joint probability = -28.8311
    Iter      log prob        ||dx||      ||grad||       alpha      alpha0  # evals  Notes 
      99       18912.8   4.85013e-08       2170.46      0.2337           1      125   
    Iter      log prob        ||dx||      ||grad||       alpha      alpha0  # evals  Notes 
     100       18912.8   1.00118e-08       2069.82      0.2307           1      127   
Optimization terminated normally: 
  Convergence detected: relative gradient magnitude is below tolerance
INFO:fbprophet:Making 5 forecasts with cutoffs between 2013-10-07 00:00:00 and 2015-10-18 00:00:00
INFO:fbprophet:Applying in parallel with <concurrent.futures.process.ProcessPoolExecutor object at 0x7fc88e616310>
Initial log joint probability = -8.95172
    Iter      log prob        ||dx||      ||grad||       alpha      alpha0  # evals  Notes 
Initial log joint probability = -12.7302
    Iter      log prob        ||dx||      ||grad||       alpha      alpha0  # evals  Notes 
Initial log joint probability = -15.1549
    Iter      log prob        ||dx||      ||grad||       alpha      alpha0  # evals  Notes 
Initial log joint probability = -18.717
    Iter      log prob        ||dx||      ||grad||       alpha      alpha0  # evals  Notes 
Initial log joint probability = -23.5879
    Iter      log prob        ||dx||      ||grad||       alpha      alpha0  # evals  Notes 
      45       4679.09    2.3716e-05       2367.68   9.522e-09       0.001      101  LS failed, Hessian reset 
      96       4679.22   7.92708e-09       2551.96      0.5323      0.5323      168   
Optimization terminated normally: 
  Convergence detected: absolute parameter change was below tolerance
      99        7030.2   5.80077e-07       2051.55      0.6241      0.6241      123   
    Iter      log prob        ||dx||      ||grad||       alpha      alpha0  # evals  Notes 
      99       9582.44   3.83799e-08       2647.22      0.6222      0.6222      136   
    Iter      log prob        ||dx||      ||grad||       alpha      alpha0  # evals  Notes 
     105       9582.44   1.33294e-08       2211.41      0.2221           1      143   
Optimization terminated normally: 
  Convergence detected: relative gradient magnitude is below tolerance
     199       7031.37   9.69218e-06       2476.97           1           1      248   
    Iter      log prob        ||dx||      ||grad||       alpha      alpha0  # evals  Notes 
      61       11812.6   0.000140057       2321.25   4.971e-08       0.001      127  LS failed, Hessian reset 
      99       11813.2   6.69681e-07       2448.45           1           1      169   
    Iter      log prob        ||dx||      ||grad||       alpha      alpha0  # evals  Notes 
     276       7031.71   1.02195e-08       2334.11      0.1609           1      341   
Optimization terminated normally: 
  Convergence detected: relative gradient magnitude is below tolerance
     114       11813.2   5.56969e-09       2400.02      0.3993      0.3993      188   
Optimization terminated normally: 
  Convergence detected: absolute parameter change was below tolerance
      99         14233   2.08056e-07       2117.42        3.12       0.312      134   
    Iter      log prob        ||dx||      ||grad||       alpha      alpha0  # evals  Notes 
     109         14233   3.00642e-08       2423.71      0.7457      0.7457      145   
Optimization terminated normally: 
  Convergence detected: relative gradient magnitude is below tolerance
[I 2020-10-01 02:23:30,501] Trial 43 finished with value: 0.041580450721881226 and parameters: {'changepoint_prior_scale': 0.002032539520234857, 'seasonality_prior_scale': 0.07078838340396489, 'holidays_prior_scale': 1.531461945448218, 'seasonality_mode': 'additive', 'changepoint_range': 0.6622355485001075}. Best is trial 3 with value: 0.04098090703811677.
Initial log joint probability = -28.8311
    Iter      log prob        ||dx||      ||grad||       alpha      alpha0  # evals  Notes 
      99       18911.8   9.41621e-07        3737.5      0.5507      0.5507      125   
    Iter      log prob        ||dx||      ||grad||       alpha      alpha0  # evals  Notes 
     148       18911.9   2.30389e-06       3579.88   6.951e-10       0.001      219  LS failed, Hessian reset 
     172         18912   1.52978e-08       3694.08      0.3879           1      250   
Optimization terminated normally: 
  Convergence detected: relative gradient magnitude is below tolerance
INFO:fbprophet:Making 5 forecasts with cutoffs between 2013-10-07 00:00:00 and 2015-10-18 00:00:00
INFO:fbprophet:Applying in parallel with <concurrent.futures.process.ProcessPoolExecutor object at 0x7fc88e685110>
Initial log joint probability = -8.95172
    Iter      log prob        ||dx||      ||grad||       alpha      alpha0  # evals  Notes 
Initial log joint probability = -12.7302
    Iter      log prob        ||dx||      ||grad||       alpha      alpha0  # evals  Notes 
Initial log joint probability = -15.1549
    Iter      log prob        ||dx||      ||grad||       alpha      alpha0  # evals  Notes 
Initial log joint probability = -18.717
    Iter      log prob        ||dx||      ||grad||       alpha      alpha0  # evals  Notes 
Initial log joint probability = -23.5879
    Iter      log prob        ||dx||      ||grad||       alpha      alpha0  # evals  Notes 
      85       4677.28   8.47187e-09        3805.6      0.6491      0.6491      116   
Optimization terminated normally: 
  Convergence detected: absolute parameter change was below tolerance
      99       7028.32   6.17627e-08       3825.74           1           1      121   
    Iter      log prob        ||dx||      ||grad||       alpha      alpha0  # evals  Notes 
     110       7028.32   3.14739e-07       3517.35   8.898e-11       0.001      173  LS failed, Hessian reset 
      55       11812.1   9.65793e-09       3743.71      0.1856      0.7695       77   
Optimization terminated normally: 
  Convergence detected: absolute parameter change was below tolerance
     130       7028.32   4.74056e-09       3030.03      0.4708      0.4708      198   
Optimization terminated normally: 
  Convergence detected: absolute parameter change was below tolerance
      94       9580.92   2.75287e-09       3749.17     0.07662      0.3754      129   
Optimization terminated normally: 
  Convergence detected: absolute parameter change was below tolerance
      86       14231.6   9.87441e-09       3952.68      0.1823      0.1823      118   
Optimization terminated normally: 
  Convergence detected: absolute parameter change was below tolerance
[I 2020-10-01 02:23:46,444] Trial 44 finished with value: 0.04271539778491285 and parameters: {'changepoint_prior_scale': 0.0013348183311025596, 'seasonality_prior_scale': 0.0385692783842807, 'holidays_prior_scale': 7.744928633132769, 'seasonality_mode': 'multiplicative', 'changepoint_range': 0.5927039836596097}. Best is trial 3 with value: 0.04098090703811677.
Initial log joint probability = -28.8311
    Iter      log prob        ||dx||      ||grad||       alpha      alpha0  # evals  Notes 
      99       18912.6   5.15563e-06       1560.06      0.5831      0.5831      126   
    Iter      log prob        ||dx||      ||grad||       alpha      alpha0  # evals  Notes 
     127       18912.6    7.2034e-06       1773.45   4.189e-09       0.001      196  LS failed, Hessian reset 
     168       18912.6   6.43035e-08       1537.71      0.2954           1      247   
Optimization terminated normally: 
  Convergence detected: relative gradient magnitude is below tolerance
INFO:fbprophet:Making 5 forecasts with cutoffs between 2013-10-07 00:00:00 and 2015-10-18 00:00:00
INFO:fbprophet:Applying in parallel with <concurrent.futures.process.ProcessPoolExecutor object at 0x7fc88e683b90>
Initial log joint probability = -8.95172
    Iter      log prob        ||dx||      ||grad||       alpha      alpha0  # evals  Notes 
Initial log joint probability = -12.7302
    Iter      log prob        ||dx||      ||grad||       alpha      alpha0  # evals  Notes 
Initial log joint probability = -15.1549
    Iter      log prob        ||dx||      ||grad||       alpha      alpha0  # evals  Notes 
Initial log joint probability = -18.717
    Iter      log prob        ||dx||      ||grad||       alpha      alpha0  # evals  Notes 
Initial log joint probability = -23.5879
    Iter      log prob        ||dx||      ||grad||       alpha      alpha0  # evals  Notes 
      95        4679.2   2.77831e-07       1946.88   1.394e-10       0.001      170  LS failed, Hessian reset 
      99        4679.2    6.6508e-08       1895.49      0.7316      0.7316      174   
    Iter      log prob        ||dx||      ||grad||       alpha      alpha0  # evals  Notes 
     107        4679.2   7.16682e-09        1940.9       0.388       0.388      182   
Optimization terminated normally: 
  Convergence detected: absolute parameter change was below tolerance
      99       7030.92   7.20318e-08       1970.93      0.8756      0.8756      120   
    Iter      log prob        ||dx||      ||grad||       alpha      alpha0  # evals  Notes 
      61       9582.29   1.93534e-08       1574.79           1           1       86   
Optimization terminated normally: 
  Convergence detected: relative gradient magnitude is below tolerance
     109       7030.92   4.75598e-07       1984.32   2.491e-10       0.001      172  LS failed, Hessian reset 
     125       7030.92   2.42269e-08        1845.3       0.688       0.688      188   
Optimization terminated normally: 
  Convergence detected: relative gradient magnitude is below tolerance
      39       11812.3   0.000284647       2261.17   1.777e-07       0.001      103  LS failed, Hessian reset 
      63       14232.3   0.000154897       1818.12   8.421e-08       0.001      118  LS failed, Hessian reset 
      99       11812.8   9.36907e-07       1690.66      0.7392      0.7392      179   
    Iter      log prob        ||dx||      ||grad||       alpha      alpha0  # evals  Notes 
     115       11812.8   9.84516e-09       1591.48      0.1365      0.1365      199   
Optimization terminated normally: 
  Convergence detected: absolute parameter change was below tolerance
      99       14232.4    6.5137e-06       2024.55      0.2659           1      163   
    Iter      log prob        ||dx||      ||grad||       alpha      alpha0  # evals  Notes 
     165       14232.5   5.39734e-08        1737.4           1           1      247   
Optimization terminated normally: 
  Convergence detected: relative gradient magnitude is below tolerance
