[I 2020-10-01 03:52:15,853] Trial 391 finished with value: 0.040757721637288816 and parameters: {'changepoint_prior_scale': 0.0010019583885285766, 'seasonality_prior_scale': 0.9519034449644569, 'holidays_prior_scale': 0.26391675523441105, 'seasonality_mode': 'additive', 'changepoint_range': 0.5249773975285957}. Best is trial 96 with value: 0.038883738900888705.
Initial log joint probability = -28.8311
    Iter      log prob        ||dx||      ||grad||       alpha      alpha0  # evals  Notes 
      99       18912.5   0.000299384       4549.82           1           1      129   
    Iter      log prob        ||dx||      ||grad||       alpha      alpha0  # evals  Notes 
     153       18912.8   4.60427e-09       4298.55      0.4072      0.4072      194   
Optimization terminated normally: 
  Convergence detected: absolute parameter change was below tolerance
INFO:fbprophet:Making 5 forecasts with cutoffs between 2013-10-07 00:00:00 and 2015-10-18 00:00:00
INFO:fbprophet:Applying in parallel with <concurrent.futures.process.ProcessPoolExecutor object at 0x7fc84dc78a50>
Initial log joint probability = -8.95172
    Iter      log prob        ||dx||      ||grad||       alpha      alpha0  # evals  Notes 
Initial log joint probability = -12.7302
    Iter      log prob        ||dx||      ||grad||       alpha      alpha0  # evals  Notes 
Initial log joint probability = -15.1549
    Iter      log prob        ||dx||      ||grad||       alpha      alpha0  # evals  Notes 
Initial log joint probability = -18.717
    Iter      log prob        ||dx||      ||grad||       alpha      alpha0  # evals  Notes 
Initial log joint probability = -23.5879
    Iter      log prob        ||dx||      ||grad||       alpha      alpha0  # evals  Notes 
      75       4679.09   7.14762e-09       4315.63      0.5987      0.5987      101   
Optimization terminated normally: 
  Convergence detected: absolute parameter change was below tolerance
      99          7028   0.000141383       4041.87       3.326      0.3326      121   
    Iter      log prob        ||dx||      ||grad||       alpha      alpha0  # evals  Notes 
      49         11813   9.16246e-09       4390.95      0.2224      0.2224       74   
Optimization terminated normally: 
  Convergence detected: absolute parameter change was below tolerance
     155       7028.22   3.28057e-09       4141.95      0.3418      0.3418      192   
Optimization terminated normally: 
  Convergence detected: absolute parameter change was below tolerance
      92       9582.42   9.20179e-09       4609.53           1           1      124   
Optimization terminated normally: 
  Convergence detected: absolute parameter change was below tolerance
      91       14233.3    8.9973e-09       4233.14      0.2532      0.2532      122   
Optimization terminated normally: 
  Convergence detected: absolute parameter change was below tolerance
[I 2020-10-01 03:52:31,662] Trial 392 finished with value: 0.04119616743313384 and parameters: {'changepoint_prior_scale': 0.0011482599532579116, 'seasonality_prior_scale': 0.8866845318423457, 'holidays_prior_scale': 0.23469231766258786, 'seasonality_mode': 'additive', 'changepoint_range': 0.5602243166558061}. Best is trial 96 with value: 0.038883738900888705.
Initial log joint probability = -28.8311
    Iter      log prob        ||dx||      ||grad||       alpha      alpha0  # evals  Notes 
      99       18912.1   5.09305e-05       2975.95           1           1      124   
    Iter      log prob        ||dx||      ||grad||       alpha      alpha0  # evals  Notes 
     161       18912.6   9.78278e-09       3571.12       0.283       0.283      193   
Optimization terminated normally: 
  Convergence detected: absolute parameter change was below tolerance
INFO:fbprophet:Making 5 forecasts with cutoffs between 2013-10-07 00:00:00 and 2015-10-18 00:00:00
INFO:fbprophet:Applying in parallel with <concurrent.futures.process.ProcessPoolExecutor object at 0x7fc84dbf95d0>
Initial log joint probability = -8.95172
    Iter      log prob        ||dx||      ||grad||       alpha      alpha0  # evals  Notes 
Initial log joint probability = -12.7302
    Iter      log prob        ||dx||      ||grad||       alpha      alpha0  # evals  Notes 
Initial log joint probability = -15.1549
    Iter      log prob        ||dx||      ||grad||       alpha      alpha0  # evals  Notes 
Initial log joint probability = -18.717
    Iter      log prob        ||dx||      ||grad||       alpha      alpha0  # evals  Notes 
      58       4679.09   7.02373e-09       3534.17      0.2998      0.2998       77   
Optimization terminated normally: 
  Convergence detected: absolute parameter change was below tolerance
Initial log joint probability = -23.5879
    Iter      log prob        ||dx||      ||grad||       alpha      alpha0  # evals  Notes 
      77       7029.08   3.32175e-05       3768.52   9.067e-09       0.001      134  LS failed, Hessian reset 
      99       7029.19   5.79351e-07       3196.43      0.2409      0.8123      157   
    Iter      log prob        ||dx||      ||grad||       alpha      alpha0  # evals  Notes 
      37       11811.8   0.000306773       3267.86   8.647e-08       0.001       89  LS failed, Hessian reset 
     144        7029.2   3.37565e-09        3025.1      0.4865      0.4865      207   
Optimization terminated normally: 
  Convergence detected: absolute parameter change was below tolerance
      70       9582.43   2.14659e-05       3716.74   6.235e-09       0.001      133  LS failed, Hessian reset 
      99       9582.52   6.68006e-07       3435.25           1           1      172   
    Iter      log prob        ||dx||      ||grad||       alpha      alpha0  # evals  Notes 
      86       14233.2   9.72101e-09       3144.07      0.7789      0.7789      110   
Optimization terminated normally: 
  Convergence detected: absolute parameter change was below tolerance
     120       9582.52   2.81707e-09       3370.97      0.1235      0.1235      200   
Optimization terminated normally: 
  Convergence detected: absolute parameter change was below tolerance
      99       11813.3   3.89981e-08        3632.2      0.7147      0.7147      167   
    Iter      log prob        ||dx||      ||grad||       alpha      alpha0  # evals  Notes 
     102       11813.3   8.61262e-08       3622.04   2.303e-11       0.001      219  LS failed, Hessian reset 
     107       11813.3   7.69657e-09       3663.62      0.3564           1      227   
Optimization terminated normally: 
  Convergence detected: absolute parameter change was below tolerance
[I 2020-10-01 03:52:46,606] Trial 393 finished with value: 0.040877610955991 and parameters: {'changepoint_prior_scale': 0.0013640408588825364, 'seasonality_prior_scale': 0.8559881941339332, 'holidays_prior_scale': 2.862772470906311, 'seasonality_mode': 'additive', 'changepoint_range': 0.5038528496095058}. Best is trial 96 with value: 0.038883738900888705.
Initial log joint probability = -28.8311
    Iter      log prob        ||dx||      ||grad||       alpha      alpha0  # evals  Notes 
      99       18912.9   5.83547e-06       3251.45      0.5411      0.5411      126   
    Iter      log prob        ||dx||      ||grad||       alpha      alpha0  # evals  Notes 
     121       18912.9   8.30041e-09       2710.17     0.07291           1      157   
Optimization terminated normally: 
  Convergence detected: absolute parameter change was below tolerance
INFO:fbprophet:Making 5 forecasts with cutoffs between 2013-10-07 00:00:00 and 2015-10-18 00:00:00
INFO:fbprophet:Applying in parallel with <concurrent.futures.process.ProcessPoolExecutor object at 0x7fc84dc72550>
Initial log joint probability = -8.95172
    Iter      log prob        ||dx||      ||grad||       alpha      alpha0  # evals  Notes 
Initial log joint probability = -12.7302
    Iter      log prob        ||dx||      ||grad||       alpha      alpha0  # evals  Notes 
Initial log joint probability = -15.1549
    Iter      log prob        ||dx||      ||grad||       alpha      alpha0  # evals  Notes 
Initial log joint probability = -18.717
    Iter      log prob        ||dx||      ||grad||       alpha      alpha0  # evals  Notes 
Initial log joint probability = -23.5879
    Iter      log prob        ||dx||      ||grad||       alpha      alpha0  # evals  Notes 
      99       4679.21   1.12489e-07       3293.91     0.09178     0.09178      131   
    Iter      log prob        ||dx||      ||grad||       alpha      alpha0  # evals  Notes 
     111       4679.21   9.43251e-09       3299.57      0.3335           1      148   
Optimization terminated normally: 
  Convergence detected: absolute parameter change was below tolerance
      99       7029.65   1.51141e-06       3061.17      0.4027           1      121   
    Iter      log prob        ||dx||      ||grad||       alpha      alpha0  # evals  Notes 
      59       9582.58    5.1908e-09       2777.15      0.2889      0.2889       80   
Optimization terminated normally: 
  Convergence detected: absolute parameter change was below tolerance
     109        7029.7    8.4316e-06       3184.29   2.566e-09       0.001      169  LS failed, Hessian reset 
     148       7029.75   4.32027e-09       2900.05      0.3155      0.3155      217   
Optimization terminated normally: 
  Convergence detected: absolute parameter change was below tolerance
      41         11812   0.000195807       3664.27   7.393e-08       0.001      112  LS failed, Hessian reset 
      89       11813.3   7.75246e-09       3121.64      0.2399       0.821      169   
Optimization terminated normally: 
  Convergence detected: absolute parameter change was below tolerance
      89       14232.8   3.26613e-06       3275.82   1.188e-09       0.001      155  LS failed, Hessian reset 
      99       14232.8    1.7805e-07       2681.71     0.02983           1      168   
    Iter      log prob        ||dx||      ||grad||       alpha      alpha0  # evals  Notes 
     120       14232.8   7.20323e-09        3059.3      0.4748      0.4748      192   
Optimization terminated normally: 
  Convergence detected: absolute parameter change was below tolerance
[I 2020-10-01 03:52:59,626] Trial 394 finished with value: 0.04102759750830569 and parameters: {'changepoint_prior_scale': 0.0015274932828893053, 'seasonality_prior_scale': 1.1456308299795435, 'holidays_prior_scale': 0.15938187872960544, 'seasonality_mode': 'additive', 'changepoint_range': 0.5972411167791244}. Best is trial 96 with value: 0.038883738900888705.
Initial log joint probability = -28.8311
    Iter      log prob        ||dx||      ||grad||       alpha      alpha0  # evals  Notes 
      99       18912.6   9.31853e-08       4078.66      0.3292      0.3292      123   
    Iter      log prob        ||dx||      ||grad||       alpha      alpha0  # evals  Notes 
     104       18912.6   8.86187e-09       3848.04      0.2091      0.2091      130   
Optimization terminated normally: 
  Convergence detected: absolute parameter change was below tolerance
INFO:fbprophet:Making 5 forecasts with cutoffs between 2013-10-07 00:00:00 and 2015-10-18 00:00:00
INFO:fbprophet:Applying in parallel with <concurrent.futures.process.ProcessPoolExecutor object at 0x7fc84dc1e990>
Initial log joint probability = -8.95172
    Iter      log prob        ||dx||      ||grad||       alpha      alpha0  # evals  Notes 
Initial log joint probability = -12.7302
    Iter      log prob        ||dx||      ||grad||       alpha      alpha0  # evals  Notes 
Initial log joint probability = -15.1549
    Iter      log prob        ||dx||      ||grad||       alpha      alpha0  # evals  Notes 
Initial log joint probability = -18.717
    Iter      log prob        ||dx||      ||grad||       alpha      alpha0  # evals  Notes 
      62       4676.62   7.29441e-09       3668.06      0.4404      0.4404       88   
Optimization terminated normally: 
  Convergence detected: absolute parameter change was below tolerance
Initial log joint probability = -23.5879
    Iter      log prob        ||dx||      ||grad||       alpha      alpha0  # evals  Notes 
      96       7028.77   3.78693e-05       3944.28   8.578e-09       0.001      170  LS failed, Hessian reset 
      99       7028.82   5.32185e-06       3533.45      0.6068      0.6068      173   
    Iter      log prob        ||dx||      ||grad||       alpha      alpha0  # evals  Notes 
      31       11811.6   0.000252773       4503.14   6.112e-08       0.001       81  LS failed, Hessian reset 
      63       9582.36   9.53323e-07       4153.37   2.375e-10       0.001      121  LS failed, Hessian reset 
      79       9582.37   2.25354e-09       3410.28    0.004881           1      143   
Optimization terminated normally: 
  Convergence detected: absolute parameter change was below tolerance
     147       7028.86   6.49286e-09       3865.19      0.6979      0.6979      235   
Optimization terminated normally: 
  Convergence detected: absolute parameter change was below tolerance
      84       11813.2   6.17298e-09       4081.44      0.4801      0.4801      148   
Optimization terminated normally: 
  Convergence detected: absolute parameter change was below tolerance
      99       14233.1   1.22895e-06       4272.68           1           1      128   
    Iter      log prob        ||dx||      ||grad||       alpha      alpha0  # evals  Notes 
     102       14233.1   1.70392e-06       4144.97   4.195e-10       0.001      184  LS failed, Hessian reset 
     124       14233.1   2.80319e-09       4065.02      0.1575      0.1575      211   
Optimization terminated normally: 
  Convergence detected: absolute parameter change was below tolerance
[I 2020-10-01 03:53:15,628] Trial 395 finished with value: 0.0411712043598632 and parameters: {'changepoint_prior_scale': 0.0012240621878526234, 'seasonality_prior_scale': 0.12152824307398967, 'holidays_prior_scale': 3.7100905766510177, 'seasonality_mode': 'additive', 'changepoint_range': 0.5453605811780851}. Best is trial 96 with value: 0.038883738900888705.
Initial log joint probability = -28.8311
    Iter      log prob        ||dx||      ||grad||       alpha      alpha0  # evals  Notes 
      99       18917.8   0.000472629       117.245           1           1      129   
    Iter      log prob        ||dx||      ||grad||       alpha      alpha0  # evals  Notes 
     196       18918.3   5.65996e-05       199.094   3.225e-07       0.001      293  LS failed, Hessian reset 
     199       18918.3    6.5952e-05       90.1954       0.696       0.696      296   
    Iter      log prob        ||dx||      ||grad||       alpha      alpha0  # evals  Notes 
     267       18918.3   1.23406e-06       73.5917      0.7992      0.7992      383   
Optimization terminated normally: 
  Convergence detected: relative gradient magnitude is below tolerance
INFO:fbprophet:Making 5 forecasts with cutoffs between 2013-10-07 00:00:00 and 2015-10-18 00:00:00
INFO:fbprophet:Applying in parallel with <concurrent.futures.process.ProcessPoolExecutor object at 0x7fc84dc8c4d0>
Initial log joint probability = -8.95172
    Iter      log prob        ||dx||      ||grad||       alpha      alpha0  # evals  Notes 
Initial log joint probability = -12.7302
    Iter      log prob        ||dx||      ||grad||       alpha      alpha0  # evals  Notes 
      99       4679.46   1.06717e-06       101.554           1           1      123   
    Iter      log prob        ||dx||      ||grad||       alpha      alpha0  # evals  Notes 
Initial log joint probability = -15.1549
    Iter      log prob        ||dx||      ||grad||       alpha      alpha0  # evals  Notes 
     110       4679.46   1.77231e-07       109.283           1           1      137   
Optimization terminated normally: 
  Convergence detected: relative gradient magnitude is below tolerance
Initial log joint probability = -18.717
    Iter      log prob        ||dx||      ||grad||       alpha      alpha0  # evals  Notes 
Initial log joint probability = -23.5879
    Iter      log prob        ||dx||      ||grad||       alpha      alpha0  # evals  Notes 
      99       7037.77    0.00124114       70.7325           1           1      120   
    Iter      log prob        ||dx||      ||grad||       alpha      alpha0  # evals  Notes 
     159       7037.99   3.71772e-07       73.0833       0.288           1      202   
Optimization terminated normally: 
  Convergence detected: relative gradient magnitude is below tolerance
      99       9585.38   1.63632e-05       95.7467      0.1819      0.1819      128   
    Iter      log prob        ||dx||      ||grad||       alpha      alpha0  # evals  Notes 
      99       11816.4   0.000501567       233.924      0.9531      0.9531      125   
    Iter      log prob        ||dx||      ||grad||       alpha      alpha0  # evals  Notes 
     126       9585.51   0.000107048       195.108    8.55e-07       0.001      197  LS failed, Hessian reset 
     165       9585.55   5.75585e-07       78.6398      0.5311      0.5311      250   
Optimization terminated normally: 
  Convergence detected: relative gradient magnitude is below tolerance
      92       14238.3   0.000140739       216.971   1.315e-06       0.001      159  LS failed, Hessian reset 
      99       14238.4   0.000432996         372.3           1           1      166   
    Iter      log prob        ||dx||      ||grad||       alpha      alpha0  # evals  Notes 
     180       11816.7   2.29977e-07       64.2237      0.2447           1      227   
Optimization terminated normally: 
  Convergence detected: relative gradient magnitude is below tolerance
     199         14239   5.54152e-05         88.23      0.6208      0.6208      297   
    Iter      log prob        ||dx||      ||grad||       alpha      alpha0  # evals  Notes 
     239       14239.1   1.00115e-06       71.1526      0.3094           1      353   
Optimization terminated normally: 
  Convergence detected: relative gradient magnitude is below tolerance
[I 2020-10-01 03:53:32,150] Trial 396 finished with value: 0.04474131907292856 and parameters: {'changepoint_prior_scale': 0.04697366464321302, 'seasonality_prior_scale': 0.10895069415176727, 'holidays_prior_scale': 0.3273806022743844, 'seasonality_mode': 'additive', 'changepoint_range': 0.5353416407804907}. Best is trial 96 with value: 0.038883738900888705.
Initial log joint probability = -28.8311
    Iter      log prob        ||dx||      ||grad||       alpha      alpha0  # evals  Notes 
      99       18912.6    2.5716e-07        1941.1      0.7296      0.7296      128   
    Iter      log prob        ||dx||      ||grad||       alpha      alpha0  # evals  Notes 
     109       18912.6   2.35773e-06       1850.37   1.244e-09       0.001      175  LS failed, Hessian reset 
     149       18912.6   1.77077e-08       1640.51      0.3426      0.3426      231   
Optimization terminated normally: 
  Convergence detected: relative gradient magnitude is below tolerance
INFO:fbprophet:Making 5 forecasts with cutoffs between 2013-10-07 00:00:00 and 2015-10-18 00:00:00
INFO:fbprophet:Applying in parallel with <concurrent.futures.process.ProcessPoolExecutor object at 0x7fc84dc0b690>
Initial log joint probability = -8.95172
    Iter      log prob        ||dx||      ||grad||       alpha      alpha0  # evals  Notes 
Initial log joint probability = -12.7302
    Iter      log prob        ||dx||      ||grad||       alpha      alpha0  # evals  Notes 
Initial log joint probability = -15.1549
    Iter      log prob        ||dx||      ||grad||       alpha      alpha0  # evals  Notes 
Initial log joint probability = -18.717
    Iter      log prob        ||dx||      ||grad||       alpha      alpha0  # evals  Notes 
      57       4679.48   6.71225e-09       2189.17      0.2575           1       84   
Optimization terminated normally: 
  Convergence detected: absolute parameter change was below tolerance
Initial log joint probability = -23.5879
    Iter      log prob        ||dx||      ||grad||       alpha      alpha0  # evals  Notes 
      99       7031.87   1.43415e-06       2068.39      0.3303      0.3303      119   
    Iter      log prob        ||dx||      ||grad||       alpha      alpha0  # evals  Notes 
     108       7032.01   6.19419e-05       2121.78   2.843e-08       0.001      166  LS failed, Hessian reset 
     143       7032.08   6.10229e-09       1834.26      0.1653      0.1653      213   
Optimization terminated normally: 
  Convergence detected: absolute parameter change was below tolerance
      80       9582.06   6.81363e-05       2300.29   2.996e-08       0.001      157  LS failed, Hessian reset 
      57       11812.7   6.26966e-05        2216.7   2.915e-08       0.001      120  LS failed, Hessian reset 
      99        9582.4   0.000161701       2023.12           1           1      179   
    Iter      log prob        ||dx||      ||grad||       alpha      alpha0  # evals  Notes 
      99         11813    5.3471e-05        2059.2      0.1681           1      172   
    Iter      log prob        ||dx||      ||grad||       alpha      alpha0  # evals  Notes 
      99       14233.4   1.14783e-07       2390.18      0.3267           1      131   
    Iter      log prob        ||dx||      ||grad||       alpha      alpha0  # evals  Notes 
     163       9582.45   2.94164e-08        1542.2           1           1      260   
Optimization terminated normally: 
  Convergence detected: relative gradient magnitude is below tolerance
     123       14233.4   2.34154e-08       1949.84      0.8427      0.8427      166   
     102         11813    8.9473e-06       2155.36   5.585e-09       0.001      219  LS failed, Hessian reset 
Optimization terminated normally: 
  Convergence detected: relative gradient magnitude is below tolerance
     139         11813   5.12311e-09       1715.67      0.2004      0.2004      266   
Optimization terminated normally: 
  Convergence detected: absolute parameter change was below tolerance
