[I 2020-10-01 03:07:26,020] Trial 216 finished with value: 0.040759576233343836 and parameters: {'changepoint_prior_scale': 0.0014765767534530587, 'seasonality_prior_scale': 0.2851325069917145, 'holidays_prior_scale': 0.1909570792723073, 'seasonality_mode': 'additive', 'changepoint_range': 0.5763095128464272}. Best is trial 96 with value: 0.038883738900888705.
Initial log joint probability = -28.8311
    Iter      log prob        ||dx||      ||grad||       alpha      alpha0  # evals  Notes 
      99       18912.7   8.84932e-07       3331.51       1.937      0.4645      122   
    Iter      log prob        ||dx||      ||grad||       alpha      alpha0  # evals  Notes 
     169       18912.8   7.76043e-09       3253.23      0.2107      0.2107      210   
Optimization terminated normally: 
  Convergence detected: absolute parameter change was below tolerance
INFO:fbprophet:Making 5 forecasts with cutoffs between 2013-10-07 00:00:00 and 2015-10-18 00:00:00
INFO:fbprophet:Applying in parallel with <concurrent.futures.process.ProcessPoolExecutor object at 0x7fc84dc67450>
Initial log joint probability = -8.95172
    Iter      log prob        ||dx||      ||grad||       alpha      alpha0  # evals  Notes 
Initial log joint probability = -12.7302
    Iter      log prob        ||dx||      ||grad||       alpha      alpha0  # evals  Notes 
Initial log joint probability = -15.1549
    Iter      log prob        ||dx||      ||grad||       alpha      alpha0  # evals  Notes 
Initial log joint probability = -18.717
    Iter      log prob        ||dx||      ||grad||       alpha      alpha0  # evals  Notes 
      65       4679.27   5.98093e-09       3458.14       0.263       0.263       89   
Optimization terminated normally: 
  Convergence detected: absolute parameter change was below tolerance
Initial log joint probability = -23.5879
    Iter      log prob        ||dx||      ||grad||       alpha      alpha0  # evals  Notes 
      49       9582.45   8.90845e-09       3407.75      0.1575      0.1575       73   
Optimization terminated normally: 
  Convergence detected: absolute parameter change was below tolerance
      71       7028.97   4.30269e-05       3833.43   1.095e-08       0.001      140  LS failed, Hessian reset 
      99       7029.07   1.24731e-07       3362.74           1           1      177   
    Iter      log prob        ||dx||      ||grad||       alpha      alpha0  # evals  Notes 
      71       11813.2     9.234e-09       3441.62      0.6062      0.6062      104   
Optimization terminated normally: 
  Convergence detected: absolute parameter change was below tolerance
     118       7029.08   5.66261e-07       3598.23   1.511e-10       0.001      241  LS failed, Hessian reset 
     138       7029.08   7.38712e-09       3095.96           1           1      264   
Optimization terminated normally: 
  Convergence detected: absolute parameter change was below tolerance
      99       14232.8   1.49678e-05       3356.69           1           1      133   
    Iter      log prob        ||dx||      ||grad||       alpha      alpha0  # evals  Notes 
     126       14232.8   7.00471e-09       3588.47       0.253       0.253      170   
Optimization terminated normally: 
  Convergence detected: absolute parameter change was below tolerance
[I 2020-10-01 03:07:41,256] Trial 217 finished with value: 0.04095832157011713 and parameters: {'changepoint_prior_scale': 0.0013709934906006992, 'seasonality_prior_scale': 0.31084660335191094, 'holidays_prior_scale': 0.20000334705252776, 'seasonality_mode': 'additive', 'changepoint_range': 0.5789487623994167}. Best is trial 96 with value: 0.038883738900888705.
Initial log joint probability = -28.8311
    Iter      log prob        ||dx||      ||grad||       alpha      alpha0  # evals  Notes 
      99       18912.5   0.000139795       4708.52           1           1      118   
    Iter      log prob        ||dx||      ||grad||       alpha      alpha0  # evals  Notes 
     153         18913    3.3556e-09        4244.5     0.07437     0.07437      183   
Optimization terminated normally: 
  Convergence detected: absolute parameter change was below tolerance
INFO:fbprophet:Making 5 forecasts with cutoffs between 2013-10-07 00:00:00 and 2015-10-18 00:00:00
INFO:fbprophet:Applying in parallel with <concurrent.futures.process.ProcessPoolExecutor object at 0x7fc84dbb3790>
Initial log joint probability = -8.95172
    Iter      log prob        ||dx||      ||grad||       alpha      alpha0  # evals  Notes 
Initial log joint probability = -12.7302
    Iter      log prob        ||dx||      ||grad||       alpha      alpha0  # evals  Notes 
Initial log joint probability = -15.1549
    Iter      log prob        ||dx||      ||grad||       alpha      alpha0  # evals  Notes 
Initial log joint probability = -18.717
    Iter      log prob        ||dx||      ||grad||       alpha      alpha0  # evals  Notes 
      60       4679.19   4.10637e-09       4580.37       0.237           1       81   
Optimization terminated normally: 
  Convergence detected: absolute parameter change was below tolerance
Initial log joint probability = -23.5879
    Iter      log prob        ||dx||      ||grad||       alpha      alpha0  # evals  Notes 
      55       9582.31   9.70393e-09       4583.63      0.3798      0.3798       78   
Optimization terminated normally: 
  Convergence detected: absolute parameter change was below tolerance
      99       7026.75   1.36431e-07       4113.27           1           1      126   
    Iter      log prob        ||dx||      ||grad||       alpha      alpha0  # evals  Notes 
     115       7027.04   9.34597e-05       4893.26   2.042e-08       0.001      202  LS failed, Hessian reset 
      81       11813.1   8.63048e-09       4114.29      0.4374      0.4374      113   
Optimization terminated normally: 
  Convergence detected: absolute parameter change was below tolerance
     193       7027.79   7.05286e-05       4661.28   1.497e-08       0.001      334  LS failed, Hessian reset 
     199       7027.93   9.86877e-06       4417.18      0.6158      0.6158      340   
    Iter      log prob        ||dx||      ||grad||       alpha      alpha0  # evals  Notes 
      99       14233.4   2.06083e-06       4142.92      0.5414      0.5414      128   
    Iter      log prob        ||dx||      ||grad||       alpha      alpha0  # evals  Notes 
     231       7027.97   7.46603e-09       3889.86      0.5574      0.5574      382   
Optimization terminated normally: 
  Convergence detected: absolute parameter change was below tolerance
     134       14233.4   3.08351e-07       4399.96   6.554e-11       0.001      229  LS failed, Hessian reset 
     144       14233.4   7.21405e-09       4423.65      0.1796      0.1796      242   
Optimization terminated normally: 
  Convergence detected: absolute parameter change was below tolerance
[I 2020-10-01 03:07:56,658] Trial 218 finished with value: 0.041113397899843106 and parameters: {'changepoint_prior_scale': 0.0011093485608855082, 'seasonality_prior_scale': 0.36566638366887866, 'holidays_prior_scale': 0.24033252321854995, 'seasonality_mode': 'additive', 'changepoint_range': 0.5861918378260095}. Best is trial 96 with value: 0.038883738900888705.
Initial log joint probability = -28.8311
    Iter      log prob        ||dx||      ||grad||       alpha      alpha0  # evals  Notes 
      99         18912   5.96436e-06       4428.57           1           1      127   
    Iter      log prob        ||dx||      ||grad||       alpha      alpha0  # evals  Notes 
     164       18912.5   6.03931e-07       4962.06   1.374e-10       0.001      248  LS failed, Hessian reset 
     184       18912.5   8.52038e-09       4826.25      0.5772      0.5772      273   
Optimization terminated normally: 
  Convergence detected: absolute parameter change was below tolerance
INFO:fbprophet:Making 5 forecasts with cutoffs between 2013-10-07 00:00:00 and 2015-10-18 00:00:00
INFO:fbprophet:Applying in parallel with <concurrent.futures.process.ProcessPoolExecutor object at 0x7fc84dc67410>
Initial log joint probability = -8.95172
    Iter      log prob        ||dx||      ||grad||       alpha      alpha0  # evals  Notes 
Initial log joint probability = -12.7302
    Iter      log prob        ||dx||      ||grad||       alpha      alpha0  # evals  Notes 
Initial log joint probability = -15.1549
    Iter      log prob        ||dx||      ||grad||       alpha      alpha0  # evals  Notes 
Initial log joint probability = -18.717
    Iter      log prob        ||dx||      ||grad||       alpha      alpha0  # evals  Notes 
Initial log joint probability = -23.5879
    Iter      log prob        ||dx||      ||grad||       alpha      alpha0  # evals  Notes 
      44       4675.35   0.000423378       4998.39   8.672e-08       0.001      105  LS failed, Hessian reset 
      99       4679.13    3.0427e-06       4826.89           1           1      172   
    Iter      log prob        ||dx||      ||grad||       alpha      alpha0  # evals  Notes 
     123       4679.16   9.12611e-09       5116.13      0.2673      0.2673      204   
Optimization terminated normally: 
  Convergence detected: absolute parameter change was below tolerance
      65       7028.41   1.68011e-05       4716.55   3.154e-09       0.001      120  LS failed, Hessian reset 
      94       7028.49   4.14175e-09       4387.13      0.1837      0.1837      156   
Optimization terminated normally: 
  Convergence detected: absolute parameter change was below tolerance
      54       9582.15   2.31623e-06       4412.41   4.983e-10       0.001      114  LS failed, Hessian reset 
      73       9582.16   3.10556e-09       4784.92      0.1814      0.1814      139   
Optimization terminated normally: 
  Convergence detected: absolute parameter change was below tolerance
      56       11812.9   4.77183e-06       4928.38   1.045e-09       0.001      123  LS failed, Hessian reset 
      93       11812.9   4.08432e-09       4682.09      0.3804      0.3804      172   
Optimization terminated normally: 
  Convergence detected: absolute parameter change was below tolerance
      93       14232.6   3.92463e-06       4821.95   7.415e-10       0.001      159  LS failed, Hessian reset 
      99       14232.6   8.06135e-07       4761.43           1           1      166   
    Iter      log prob        ||dx||      ||grad||       alpha      alpha0  # evals  Notes 
     126       14232.6   9.21258e-09       4806.38      0.6328      0.6328      201   
Optimization terminated normally: 
  Convergence detected: absolute parameter change was below tolerance
[I 2020-10-01 03:08:12,330] Trial 219 finished with value: 0.04125493643579887 and parameters: {'changepoint_prior_scale': 0.0010040635226279692, 'seasonality_prior_scale': 0.18892673763269197, 'holidays_prior_scale': 0.17946948038146754, 'seasonality_mode': 'additive', 'changepoint_range': 0.5491573853425463}. Best is trial 96 with value: 0.038883738900888705.
Initial log joint probability = -28.8311
    Iter      log prob        ||dx||      ||grad||       alpha      alpha0  # evals  Notes 
      99       18912.7   8.97907e-07       3470.38           1           1      118   
    Iter      log prob        ||dx||      ||grad||       alpha      alpha0  # evals  Notes 
     127       18912.8   1.83516e-08       2897.08      0.3065           1      157   
Optimization terminated normally: 
  Convergence detected: relative gradient magnitude is below tolerance
INFO:fbprophet:Making 5 forecasts with cutoffs between 2013-10-07 00:00:00 and 2015-10-18 00:00:00
INFO:fbprophet:Applying in parallel with <concurrent.futures.process.ProcessPoolExecutor object at 0x7fc84dc049d0>
Initial log joint probability = -8.95172
    Iter      log prob        ||dx||      ||grad||       alpha      alpha0  # evals  Notes 
Initial log joint probability = -12.7302
    Iter      log prob        ||dx||      ||grad||       alpha      alpha0  # evals  Notes 
Initial log joint probability = -15.1549
    Iter      log prob        ||dx||      ||grad||       alpha      alpha0  # evals  Notes 
      66       4679.35   2.04356e-09       3302.42      0.1423      0.1423       90   
Optimization terminated normally: 
  Convergence detected: absolute parameter change was below tolerance
Initial log joint probability = -18.717
    Iter      log prob        ||dx||      ||grad||       alpha      alpha0  # evals  Notes 
Initial log joint probability = -23.5879
    Iter      log prob        ||dx||      ||grad||       alpha      alpha0  # evals  Notes 
      60       9582.51   4.95538e-09       3138.75      0.2885      0.2885       83   
Optimization terminated normally: 
  Convergence detected: absolute parameter change was below tolerance
      72       7029.05   2.97125e-05       3628.82   1.011e-08       0.001      135  LS failed, Hessian reset 
      99       7029.24   4.54451e-07       3397.47      0.6115      0.6115      164   
    Iter      log prob        ||dx||      ||grad||       alpha      alpha0  # evals  Notes 
     132       7029.25   4.02561e-09        3209.5      0.3481      0.3481      203   
Optimization terminated normally: 
  Convergence detected: absolute parameter change was below tolerance
      96       11813.2   8.16564e-09       3480.01      0.2804      0.2804      122   
Optimization terminated normally: 
  Convergence detected: absolute parameter change was below tolerance
      99       14233.3    2.5576e-07       3129.65      0.3603           1      131   
    Iter      log prob        ||dx||      ||grad||       alpha      alpha0  # evals  Notes 
     111       14233.4   2.43211e-05       3583.86   7.296e-09       0.001      206  LS failed, Hessian reset 
     146       14233.5   9.74865e-09       3070.95      0.2443      0.2443      250   
Optimization terminated normally: 
  Convergence detected: absolute parameter change was below tolerance
[I 2020-10-01 03:08:28,694] Trial 220 finished with value: 0.04090738485829376 and parameters: {'changepoint_prior_scale': 0.0014562988275264453, 'seasonality_prior_scale': 0.2932524083761182, 'holidays_prior_scale': 0.06508995850308422, 'seasonality_mode': 'additive', 'changepoint_range': 0.5725319231165394}. Best is trial 96 with value: 0.038883738900888705.
Initial log joint probability = -28.8311
    Iter      log prob        ||dx||      ||grad||       alpha      alpha0  # evals  Notes 
      99       18912.6   1.78523e-07       3150.19      0.5139      0.5139      116   
    Iter      log prob        ||dx||      ||grad||       alpha      alpha0  # evals  Notes 
     110       18912.6   1.18178e-08       2873.86      0.2994           1      133   
Optimization terminated normally: 
  Convergence detected: relative gradient magnitude is below tolerance
INFO:fbprophet:Making 5 forecasts with cutoffs between 2013-10-07 00:00:00 and 2015-10-18 00:00:00
INFO:fbprophet:Applying in parallel with <concurrent.futures.process.ProcessPoolExecutor object at 0x7fc84dc48350>
Initial log joint probability = -8.95172
    Iter      log prob        ||dx||      ||grad||       alpha      alpha0  # evals  Notes 
Initial log joint probability = -12.7302
    Iter      log prob        ||dx||      ||grad||       alpha      alpha0  # evals  Notes 
Initial log joint probability = -15.1549
    Iter      log prob        ||dx||      ||grad||       alpha      alpha0  # evals  Notes 
Initial log joint probability = -18.717
    Iter      log prob        ||dx||      ||grad||       alpha      alpha0  # evals  Notes 
      68       4679.31   8.90682e-09       2974.52      0.6885      0.6885       84   
Optimization terminated normally: 
  Convergence detected: absolute parameter change was below tolerance
Initial log joint probability = -23.5879
    Iter      log prob        ||dx||      ||grad||       alpha      alpha0  # evals  Notes 
      99       7029.66    1.4911e-07       2908.64     0.01834           1      124   
    Iter      log prob        ||dx||      ||grad||       alpha      alpha0  # evals  Notes 
     139       7029.67   1.40249e-08       2758.31      0.3042           1      175   
Optimization terminated normally: 
  Convergence detected: relative gradient magnitude is below tolerance
      66       9582.45    1.8929e-07       2774.02   6.375e-11       0.001      129  LS failed, Hessian reset 
      73       9582.45   8.39279e-09       2414.09      0.3139      0.3139      137   
Optimization terminated normally: 
  Convergence detected: absolute parameter change was below tolerance
      39       11811.7   0.000248704       2847.63   8.367e-08       0.001      100  LS failed, Hessian reset 
      98       11813.1    6.9582e-09       3009.84      0.2448           1      171   
Optimization terminated normally: 
  Convergence detected: absolute parameter change was below tolerance
      99       14231.9   1.69384e-06       2789.34       0.657       0.657      133   
    Iter      log prob        ||dx||      ||grad||       alpha      alpha0  # evals  Notes 
     136       14231.9   3.25609e-08       3344.56       0.488       0.488      188   
Optimization terminated normally: 
  Convergence detected: relative gradient magnitude is below tolerance
[I 2020-10-01 03:08:43,512] Trial 221 finished with value: 0.04062682348132166 and parameters: {'changepoint_prior_scale': 0.0016078262875341815, 'seasonality_prior_scale': 0.23605324504166766, 'holidays_prior_scale': 0.1676086286967493, 'seasonality_mode': 'additive', 'changepoint_range': 0.558222566532452}. Best is trial 96 with value: 0.038883738900888705.
Initial log joint probability = -28.8311
    Iter      log prob        ||dx||      ||grad||       alpha      alpha0  # evals  Notes 
      99       18912.8   2.82009e-07       3023.39           1           1      127   
    Iter      log prob        ||dx||      ||grad||       alpha      alpha0  # evals  Notes 
     119       18912.8   2.95039e-08       2890.57      0.3184           1      150   
Optimization terminated normally: 
  Convergence detected: relative gradient magnitude is below tolerance
INFO:fbprophet:Making 5 forecasts with cutoffs between 2013-10-07 00:00:00 and 2015-10-18 00:00:00
INFO:fbprophet:Applying in parallel with <concurrent.futures.process.ProcessPoolExecutor object at 0x7fc84dc48b50>
Initial log joint probability = -8.95172
    Iter      log prob        ||dx||      ||grad||       alpha      alpha0  # evals  Notes 
Initial log joint probability = -12.7302
    Iter      log prob        ||dx||      ||grad||       alpha      alpha0  # evals  Notes 
Initial log joint probability = -15.1549
    Iter      log prob        ||dx||      ||grad||       alpha      alpha0  # evals  Notes 
Initial log joint probability = -18.717
    Iter      log prob        ||dx||      ||grad||       alpha      alpha0  # evals  Notes 
      61       4679.26   3.40134e-09       2645.74      0.2755      0.2755       77   
Optimization terminated normally: 
  Convergence detected: absolute parameter change was below tolerance
Initial log joint probability = -23.5879
    Iter      log prob        ||dx||      ||grad||       alpha      alpha0  # evals  Notes 
      99       7029.94   7.86028e-06       2548.22      0.6677      0.6677      129   
    Iter      log prob        ||dx||      ||grad||       alpha      alpha0  # evals  Notes 
      67       9582.52   6.93188e-09       2490.41      0.3536       0.892       96   
Optimization terminated normally: 
  Convergence detected: absolute parameter change was below tolerance
     103       7029.97   1.18719e-05       3047.39   4.247e-09       0.001      170  LS failed, Hessian reset 
     135       7030.01   1.33022e-08       2544.99      0.8498      0.8498      210   
Optimization terminated normally: 
  Convergence detected: relative gradient magnitude is below tolerance
      71       11813.3   9.40836e-09       2918.44      0.6085      0.6085      101   
Optimization terminated normally: 
  Convergence detected: absolute parameter change was below tolerance
      72       14233.3   9.20785e-05       2872.09   2.928e-08       0.001      135  LS failed, Hessian reset 
      99       14233.5   3.49066e-07       2625.94       1.522      0.3754      175   
    Iter      log prob        ||dx||      ||grad||       alpha      alpha0  # evals  Notes 
     113       14233.5   1.67124e-08       2760.71      0.3646      0.3646      195   
Optimization terminated normally: 
  Convergence detected: relative gradient magnitude is below tolerance
