[I 2020-10-01 02:55:39,062] Trial 169 finished with value: 0.041180458718664006 and parameters: {'changepoint_prior_scale': 0.0017287293887845838, 'seasonality_prior_scale': 0.1694714084288976, 'holidays_prior_scale': 0.14985091255142702, 'seasonality_mode': 'additive', 'changepoint_range': 0.5949512477624331}. Best is trial 96 with value: 0.038883738900888705.
Initial log joint probability = -28.8311
    Iter      log prob        ||dx||      ||grad||       alpha      alpha0  # evals  Notes 
      99         18913   1.09592e-07        3537.6           1           1      126   
    Iter      log prob        ||dx||      ||grad||       alpha      alpha0  # evals  Notes 
     107         18913   1.17682e-07       3360.88   3.609e-11       0.001      175  LS failed, Hessian reset 
     112         18913   2.37065e-08       2938.34      0.3115      0.7387      181   
Optimization terminated normally: 
  Convergence detected: relative gradient magnitude is below tolerance
INFO:fbprophet:Making 5 forecasts with cutoffs between 2013-10-07 00:00:00 and 2015-10-18 00:00:00
INFO:fbprophet:Applying in parallel with <concurrent.futures.process.ProcessPoolExecutor object at 0x7fc88e683c10>
Initial log joint probability = -8.95172
    Iter      log prob        ||dx||      ||grad||       alpha      alpha0  # evals  Notes 
Initial log joint probability = -12.7302
    Iter      log prob        ||dx||      ||grad||       alpha      alpha0  # evals  Notes 
Initial log joint probability = -15.1549
    Iter      log prob        ||dx||      ||grad||       alpha      alpha0  # evals  Notes 
Initial log joint probability = -18.717
    Iter      log prob        ||dx||      ||grad||       alpha      alpha0  # evals  Notes 
Initial log joint probability = -23.5879
    Iter      log prob        ||dx||      ||grad||       alpha      alpha0  # evals  Notes 
      79       4679.11   1.67506e-05       3550.56    4.85e-09       0.001      139  LS failed, Hessian reset 
      99       4679.16   2.44868e-07       3408.78      0.7755      0.7755      162   
    Iter      log prob        ||dx||      ||grad||       alpha      alpha0  # evals  Notes 
     135       4679.16   1.12963e-07       3459.34   3.344e-11       0.001      243  LS failed, Hessian reset 
      99        7029.5    3.6109e-05       3468.39           1           1      133   
    Iter      log prob        ||dx||      ||grad||       alpha      alpha0  # evals  Notes 
     138       4679.16   7.65024e-09       2924.79      0.3881      0.3881      247   
Optimization terminated normally: 
  Convergence detected: absolute parameter change was below tolerance
      82       9582.49   8.18932e-09       3273.74     0.07626     0.07626      111   
Optimization terminated normally: 
  Convergence detected: absolute parameter change was below tolerance
      32       11811.5   0.000202643       3414.13   6.263e-08       0.001      105  LS failed, Hessian reset 
     187       7032.06   9.75387e-09       3332.26      0.3024           1      236   
Optimization terminated normally: 
  Convergence detected: absolute parameter change was below tolerance
      80         11813   1.22845e-08       3351.84      0.3612           1      167   
Optimization terminated normally: 
  Convergence detected: relative gradient magnitude is below tolerance
      99       14232.9   2.00866e-07       3426.89           1           1      137   
    Iter      log prob        ||dx||      ||grad||       alpha      alpha0  # evals  Notes 
     102       14232.9   9.24017e-09       2667.78      0.3685      0.3685      140   
Optimization terminated normally: 
  Convergence detected: absolute parameter change was below tolerance
[I 2020-10-01 02:55:54,681] Trial 170 finished with value: 0.04152263837925636 and parameters: {'changepoint_prior_scale': 0.001465794343350337, 'seasonality_prior_scale': 0.22146428520424313, 'holidays_prior_scale': 0.1788355704058327, 'seasonality_mode': 'additive', 'changepoint_range': 0.5415979309016525}. Best is trial 96 with value: 0.038883738900888705.
Initial log joint probability = -28.8311
    Iter      log prob        ||dx||      ||grad||       alpha      alpha0  # evals  Notes 
      99       18912.1    4.2052e-05       3876.43      0.4305           1      123   
    Iter      log prob        ||dx||      ||grad||       alpha      alpha0  # evals  Notes 
     199       18912.2    2.1092e-08       3706.81      0.4988      0.4988      240   
    Iter      log prob        ||dx||      ||grad||       alpha      alpha0  # evals  Notes 
     200       18912.2   2.64723e-08       3656.67      0.2819           1      242   
Optimization terminated normally: 
  Convergence detected: relative gradient magnitude is below tolerance
INFO:fbprophet:Making 5 forecasts with cutoffs between 2013-10-07 00:00:00 and 2015-10-18 00:00:00
INFO:fbprophet:Applying in parallel with <concurrent.futures.process.ProcessPoolExecutor object at 0x7fc88e6839d0>
Initial log joint probability = -8.95172
    Iter      log prob        ||dx||      ||grad||       alpha      alpha0  # evals  Notes 
Initial log joint probability = -12.7302
    Iter      log prob        ||dx||      ||grad||       alpha      alpha0  # evals  Notes 
Initial log joint probability = -15.1549
    Iter      log prob        ||dx||      ||grad||       alpha      alpha0  # evals  Notes 
Initial log joint probability = -18.717
    Iter      log prob        ||dx||      ||grad||       alpha      alpha0  # evals  Notes 
Initial log joint probability = -23.5879
    Iter      log prob        ||dx||      ||grad||       alpha      alpha0  # evals  Notes 
      73       4679.03    8.6947e-09       3662.71      0.7019      0.7019       98   
Optimization terminated normally: 
  Convergence detected: absolute parameter change was below tolerance
      99       7028.72   2.45862e-06       3444.49      0.7068      0.7068      132   
    Iter      log prob        ||dx||      ||grad||       alpha      alpha0  # evals  Notes 
      72       9582.38   4.49532e-09        3633.4      0.4768      0.4768       99   
Optimization terminated normally: 
  Convergence detected: absolute parameter change was below tolerance
      55       11813.3   8.23235e-09       3711.82      0.4073      0.4073       86   
Optimization terminated normally: 
  Convergence detected: absolute parameter change was below tolerance
     141       7028.91   3.22642e-05       3601.83   1.031e-08       0.001      231  LS failed, Hessian reset 
     193       7029.04   1.84835e-06       3325.59   5.413e-10       0.001      332  LS failed, Hessian reset 
      99       14233.1   2.91612e-08        3897.5      0.4159      0.4159      130   
    Iter      log prob        ||dx||      ||grad||       alpha      alpha0  # evals  Notes 
     199       7029.05   4.17294e-07       3178.91      0.5504      0.5504      338   
    Iter      log prob        ||dx||      ||grad||       alpha      alpha0  # evals  Notes 
     104       14233.1   8.52045e-09       3832.35      0.2972           1      136   
Optimization terminated normally: 
  Convergence detected: absolute parameter change was below tolerance
     220       7029.05    5.1002e-07       3587.84   1.251e-10       0.001      404  LS failed, Hessian reset 
     239       7029.05   6.01103e-09       3687.75      0.5384      0.5384      428   
Optimization terminated normally: 
  Convergence detected: absolute parameter change was below tolerance
[I 2020-10-01 02:56:10,284] Trial 171 finished with value: 0.040878633877439924 and parameters: {'changepoint_prior_scale': 0.0013186882873078777, 'seasonality_prior_scale': 0.1860423003853067, 'holidays_prior_scale': 0.16360410072546053, 'seasonality_mode': 'additive', 'changepoint_range': 0.5529774313419074}. Best is trial 96 with value: 0.038883738900888705.
Initial log joint probability = -28.8311
    Iter      log prob        ||dx||      ||grad||       alpha      alpha0  # evals  Notes 
      99       18911.8   4.55026e-05       5045.81       0.447       0.447      123   
    Iter      log prob        ||dx||      ||grad||       alpha      alpha0  # evals  Notes 
     188       18912.7   1.50667e-08       4293.07      0.3067      0.7197      236   
Optimization terminated normally: 
  Convergence detected: relative gradient magnitude is below tolerance
INFO:fbprophet:Making 5 forecasts with cutoffs between 2013-10-07 00:00:00 and 2015-10-18 00:00:00
INFO:fbprophet:Applying in parallel with <concurrent.futures.process.ProcessPoolExecutor object at 0x7fc84dc34190>
Initial log joint probability = -8.95172
    Iter      log prob        ||dx||      ||grad||       alpha      alpha0  # evals  Notes 
Initial log joint probability = -12.7302
    Iter      log prob        ||dx||      ||grad||       alpha      alpha0  # evals  Notes 
Initial log joint probability = -15.1549
    Iter      log prob        ||dx||      ||grad||       alpha      alpha0  # evals  Notes 
      69       4678.65   4.83613e-09       5041.94      0.3955      0.3955       96   
Optimization terminated normally: 
  Convergence detected: absolute parameter change was below tolerance
Initial log joint probability = -18.717
    Iter      log prob        ||dx||      ||grad||       alpha      alpha0  # evals  Notes 
Initial log joint probability = -23.5879
    Iter      log prob        ||dx||      ||grad||       alpha      alpha0  # evals  Notes 
      99       7028.55   2.85136e-06       4706.77      0.5239      0.5239      123   
    Iter      log prob        ||dx||      ||grad||       alpha      alpha0  # evals  Notes 
      69       9582.24   4.65701e-09       4657.74      0.0544      0.0544       97   
Optimization terminated normally: 
  Convergence detected: absolute parameter change was below tolerance
     128       7028.56   7.67847e-09       4397.09       0.401           1      156   
Optimization terminated normally: 
  Convergence detected: absolute parameter change was below tolerance
      72       11812.7    9.4543e-09       4836.12      0.5092      0.5092      103   
Optimization terminated normally: 
  Convergence detected: absolute parameter change was below tolerance
      99       14233.1   1.79448e-06       4724.08      0.5937      0.5937      127   
    Iter      log prob        ||dx||      ||grad||       alpha      alpha0  # evals  Notes 
     124       14233.1   2.50217e-08        5062.1           1           1      155   
Optimization terminated normally: 
  Convergence detected: relative gradient magnitude is below tolerance
[I 2020-10-01 02:56:24,885] Trial 172 finished with value: 0.04116588660906188 and parameters: {'changepoint_prior_scale': 0.0010080626229791202, 'seasonality_prior_scale': 0.13674395849050652, 'holidays_prior_scale': 0.1239915308244447, 'seasonality_mode': 'additive', 'changepoint_range': 0.5746896819586552}. Best is trial 96 with value: 0.038883738900888705.
Initial log joint probability = -28.8311
    Iter      log prob        ||dx||      ||grad||       alpha      alpha0  # evals  Notes 
      99       18912.4    3.1569e-05       4425.94      0.8557      0.8557      122   
    Iter      log prob        ||dx||      ||grad||       alpha      alpha0  # evals  Notes 
     168       18912.7   9.86503e-09        3973.9      0.2448      0.9425      203   
Optimization terminated normally: 
  Convergence detected: absolute parameter change was below tolerance
INFO:fbprophet:Making 5 forecasts with cutoffs between 2013-10-07 00:00:00 and 2015-10-18 00:00:00
INFO:fbprophet:Applying in parallel with <concurrent.futures.process.ProcessPoolExecutor object at 0x7fc88e66c790>
Initial log joint probability = -8.95172
    Iter      log prob        ||dx||      ||grad||       alpha      alpha0  # evals  Notes 
Initial log joint probability = -12.7302
    Iter      log prob        ||dx||      ||grad||       alpha      alpha0  # evals  Notes 
Initial log joint probability = -15.1549
    Iter      log prob        ||dx||      ||grad||       alpha      alpha0  # evals  Notes 
Initial log joint probability = -18.717
    Iter      log prob        ||dx||      ||grad||       alpha      alpha0  # evals  Notes 
Initial log joint probability = -23.5879
      75       4678.76   9.45399e-09       4240.98      0.2071      0.2071       96   
Optimization terminated normally: 
  Convergence detected: absolute parameter change was below tolerance
    Iter      log prob        ||dx||      ||grad||       alpha      alpha0  # evals  Notes 
      71       7028.49   3.02056e-05          4253   6.698e-09       0.001      127  LS failed, Hessian reset 
      99       7028.61   8.53257e-08       4334.03       1.338      0.3454      160   
    Iter      log prob        ||dx||      ||grad||       alpha      alpha0  # evals  Notes 
     106       7028.61   9.54654e-09       4053.66      0.4448      0.4448      167   
Optimization terminated normally: 
  Convergence detected: absolute parameter change was below tolerance
      76       9582.39   5.98289e-09       4154.29      0.5617      0.5617      107   
Optimization terminated normally: 
  Convergence detected: absolute parameter change was below tolerance
      48         11813   8.94006e-09       4186.29      0.3374      0.3374       79   
Optimization terminated normally: 
  Convergence detected: absolute parameter change was below tolerance
      99       14232.8   1.58234e-07       3944.51      0.4933      0.4933      126   
    Iter      log prob        ||dx||      ||grad||       alpha      alpha0  # evals  Notes 
     112       14232.8   3.65074e-09       4087.28      0.1961      0.1961      143   
Optimization terminated normally: 
  Convergence detected: absolute parameter change was below tolerance
[I 2020-10-01 02:56:39,801] Trial 173 finished with value: 0.040805827024951724 and parameters: {'changepoint_prior_scale': 0.0011360387070089815, 'seasonality_prior_scale': 0.20664226775267208, 'holidays_prior_scale': 0.2857148749963701, 'seasonality_mode': 'additive', 'changepoint_range': 0.5605056298494311}. Best is trial 96 with value: 0.038883738900888705.
Initial log joint probability = -28.8311
    Iter      log prob        ||dx||      ||grad||       alpha      alpha0  # evals  Notes 
      99       18912.5   1.59026e-05        4542.2      0.3787      0.3787      127   
    Iter      log prob        ||dx||      ||grad||       alpha      alpha0  # evals  Notes 
     164       18912.9    9.8199e-09       4505.06      0.4229           1      209   
Optimization terminated normally: 
  Convergence detected: absolute parameter change was below tolerance
INFO:fbprophet:Making 5 forecasts with cutoffs between 2013-10-07 00:00:00 and 2015-10-18 00:00:00
INFO:fbprophet:Applying in parallel with <concurrent.futures.process.ProcessPoolExecutor object at 0x7fc88e67fb50>
Initial log joint probability = -8.95172
    Iter      log prob        ||dx||      ||grad||       alpha      alpha0  # evals  Notes 
Initial log joint probability = -12.7302
    Iter      log prob        ||dx||      ||grad||       alpha      alpha0  # evals  Notes 
Initial log joint probability = -15.1549
    Iter      log prob        ||dx||      ||grad||       alpha      alpha0  # evals  Notes 
Initial log joint probability = -18.717
    Iter      log prob        ||dx||      ||grad||       alpha      alpha0  # evals  Notes 
      71       4679.04   9.00723e-09          4428      0.7372      0.7372       88   
Optimization terminated normally: 
  Convergence detected: absolute parameter change was below tolerance
Initial log joint probability = -23.5879
    Iter      log prob        ||dx||      ||grad||       alpha      alpha0  # evals  Notes 
      68       9582.36   2.35494e-09       4074.77      0.1511      0.1511       96   
Optimization terminated normally: 
  Convergence detected: absolute parameter change was below tolerance
      89       7028.72   1.11967e-05       4227.76   2.617e-09       0.001      154  LS failed, Hessian reset 
      99       7028.76   9.49619e-07       4322.43      0.2498           1      168   
    Iter      log prob        ||dx||      ||grad||       alpha      alpha0  # evals  Notes 
      74       11813.1   9.78943e-09       4410.62      0.4681      0.4681      101   
Optimization terminated normally: 
  Convergence detected: absolute parameter change was below tolerance
     156       7028.86   2.95375e-06       4322.87   6.351e-10       0.001      280  LS failed, Hessian reset 
      99       14232.2   1.11114e-07       4529.78      0.5444      0.5444      121   
    Iter      log prob        ||dx||      ||grad||       alpha      alpha0  # evals  Notes 
     174       7028.87   7.53397e-09       4250.25      0.2831      0.2831      304   
Optimization terminated normally: 
  Convergence detected: absolute parameter change was below tolerance
     118       14232.2   8.62227e-09       4214.02        0.35           1      146   
Optimization terminated normally: 
  Convergence detected: absolute parameter change was below tolerance
[I 2020-10-01 02:56:54,517] Trial 174 finished with value: 0.04098516905575849 and parameters: {'changepoint_prior_scale': 0.0011191845874586233, 'seasonality_prior_scale': 0.25960371846731867, 'holidays_prior_scale': 0.08435274067794163, 'seasonality_mode': 'additive', 'changepoint_range': 0.5688369480025603}. Best is trial 96 with value: 0.038883738900888705.
Initial log joint probability = -28.8311
    Iter      log prob        ||dx||      ||grad||       alpha      alpha0  # evals  Notes 
      99       18912.1   3.84235e-05       3186.88      0.7446      0.7446      127   
    Iter      log prob        ||dx||      ||grad||       alpha      alpha0  # evals  Notes 
     185       18912.7   7.96686e-09       3977.21      0.4041      0.4041      233   
Optimization terminated normally: 
  Convergence detected: absolute parameter change was below tolerance
INFO:fbprophet:Making 5 forecasts with cutoffs between 2013-10-07 00:00:00 and 2015-10-18 00:00:00
INFO:fbprophet:Applying in parallel with <concurrent.futures.process.ProcessPoolExecutor object at 0x7fc88e683b10>
Initial log joint probability = -8.95172
    Iter      log prob        ||dx||      ||grad||       alpha      alpha0  # evals  Notes 
Initial log joint probability = -12.7302
    Iter      log prob        ||dx||      ||grad||       alpha      alpha0  # evals  Notes 
Initial log joint probability = -15.1549
    Iter      log prob        ||dx||      ||grad||       alpha      alpha0  # evals  Notes 
Initial log joint probability = -18.717
    Iter      log prob        ||dx||      ||grad||       alpha      alpha0  # evals  Notes 
Initial log joint probability = -23.5879
    Iter      log prob        ||dx||      ||grad||       alpha      alpha0  # evals  Notes 
      69       4679.09   4.34271e-07       4577.76   9.943e-11       0.001      132  LS failed, Hessian reset 
      79       4679.09   6.03247e-09        4103.2      0.1415      0.1415      145   
Optimization terminated normally: 
  Convergence detected: absolute parameter change was below tolerance
      78       7028.18     2.559e-05        4402.7   5.617e-09       0.001      141  LS failed, Hessian reset 
      71       9582.38    3.4603e-10       4605.35     0.04184     0.04184      100   
Optimization terminated normally: 
  Convergence detected: absolute parameter change was below tolerance
      99       7028.25   1.71336e-07       4547.46      0.9848      0.9848      167   
    Iter      log prob        ||dx||      ||grad||       alpha      alpha0  # evals  Notes 
      51       11813.1   4.03128e-09       4116.08       0.255       0.255       79   
Optimization terminated normally: 
  Convergence detected: absolute parameter change was below tolerance
     113       7028.25   8.56353e-10       4031.74      0.1528      0.1528      186   
Optimization terminated normally: 
  Convergence detected: absolute parameter change was below tolerance
      99       14232.9   1.51416e-05       4439.42           1           1      128   
    Iter      log prob        ||dx||      ||grad||       alpha      alpha0  # evals  Notes 
     156       14233.4   9.75084e-09       4252.72      0.3452      0.3452      198   
Optimization terminated normally: 
  Convergence detected: absolute parameter change was below tolerance
