[I 2020-10-01 03:18:22,707] Trial 259 finished with value: 0.04091273554914868 and parameters: {'changepoint_prior_scale': 0.0013058786788746578, 'seasonality_prior_scale': 0.1331268859165354, 'holidays_prior_scale': 0.08237992371160875, 'seasonality_mode': 'additive', 'changepoint_range': 0.5324787688769836}. Best is trial 96 with value: 0.038883738900888705.
Initial log joint probability = -28.8311
    Iter      log prob        ||dx||      ||grad||       alpha      alpha0  # evals  Notes 
      99       18911.5   0.000696134       4528.76           1           1      125   
    Iter      log prob        ||dx||      ||grad||       alpha      alpha0  # evals  Notes 
     186       18912.1   8.10314e-09       4124.56      0.3666      0.3666      238   
Optimization terminated normally: 
  Convergence detected: absolute parameter change was below tolerance
INFO:fbprophet:Making 5 forecasts with cutoffs between 2013-10-07 00:00:00 and 2015-10-18 00:00:00
INFO:fbprophet:Applying in parallel with <concurrent.futures.process.ProcessPoolExecutor object at 0x7fc84dc4de10>
Initial log joint probability = -8.95172
    Iter      log prob        ||dx||      ||grad||       alpha      alpha0  # evals  Notes 
Initial log joint probability = -12.7302
    Iter      log prob        ||dx||      ||grad||       alpha      alpha0  # evals  Notes 
Initial log joint probability = -15.1549
    Iter      log prob        ||dx||      ||grad||       alpha      alpha0  # evals  Notes 
Initial log joint probability = -18.717
    Iter      log prob        ||dx||      ||grad||       alpha      alpha0  # evals  Notes 
Initial log joint probability = -23.5879
    Iter      log prob        ||dx||      ||grad||       alpha      alpha0  # evals  Notes 
      51       4679.06   4.32456e-06       4517.89   9.553e-10       0.001      120  LS failed, Hessian reset 
      87        4679.1   9.39307e-09       4541.88        0.45        0.45      169   
Optimization terminated normally: 
  Convergence detected: absolute parameter change was below tolerance
      74       7028.16    4.9146e-06       4306.42   1.189e-09       0.001      143  LS failed, Hessian reset 
      47        9582.2   4.07297e-06       4667.23   9.847e-10       0.001      109  LS failed, Hessian reset 
      99       7028.18   5.23852e-08       3938.64           1           1      172   
    Iter      log prob        ||dx||      ||grad||       alpha      alpha0  # evals  Notes 
     109       7028.18   6.87344e-09       4495.08      0.2821           1      185   
Optimization terminated normally: 
  Convergence detected: absolute parameter change was below tolerance
      76       9582.22   8.85337e-09       4143.46      0.2244      0.2244      147   
Optimization terminated normally: 
  Convergence detected: absolute parameter change was below tolerance
      64       11812.9   1.48233e-07       4393.97   3.242e-11       0.001      145  LS failed, Hessian reset 
      69       11812.9   9.91274e-09       4392.81      0.1734      0.1734      151   
Optimization terminated normally: 
  Convergence detected: absolute parameter change was below tolerance
      99       14232.6   3.46958e-08       4430.37      0.5189      0.5189      137   
    Iter      log prob        ||dx||      ||grad||       alpha      alpha0  # evals  Notes 
     103       14232.6   1.01609e-08       4493.99      0.2727           1      142   
Optimization terminated normally: 
  Convergence detected: relative gradient magnitude is below tolerance
[I 2020-10-01 03:18:38,236] Trial 260 finished with value: 0.04146773388576435 and parameters: {'changepoint_prior_scale': 0.0011016734886006897, 'seasonality_prior_scale': 0.12068667707275786, 'holidays_prior_scale': 0.11346868151040511, 'seasonality_mode': 'additive', 'changepoint_range': 0.5445555041460062}. Best is trial 96 with value: 0.038883738900888705.
Initial log joint probability = -28.8311
    Iter      log prob        ||dx||      ||grad||       alpha      alpha0  # evals  Notes 
      99       18912.4   0.000166992       4807.89           1           1      121   
    Iter      log prob        ||dx||      ||grad||       alpha      alpha0  # evals  Notes 
     149       18912.8   2.69515e-07       4587.74   5.006e-11       0.001      226  LS failed, Hessian reset 
     163       18912.8   2.36616e-09       5068.13     0.07064     0.07064      244   
Optimization terminated normally: 
  Convergence detected: absolute parameter change was below tolerance
INFO:fbprophet:Making 5 forecasts with cutoffs between 2013-10-07 00:00:00 and 2015-10-18 00:00:00
INFO:fbprophet:Applying in parallel with <concurrent.futures.process.ProcessPoolExecutor object at 0x7fc84dc28b50>
Initial log joint probability = -8.95172
    Iter      log prob        ||dx||      ||grad||       alpha      alpha0  # evals  Notes 
Initial log joint probability = -12.7302
    Iter      log prob        ||dx||      ||grad||       alpha      alpha0  # evals  Notes 
Initial log joint probability = -15.1549
    Iter      log prob        ||dx||      ||grad||       alpha      alpha0  # evals  Notes 
Initial log joint probability = -18.717
    Iter      log prob        ||dx||      ||grad||       alpha      alpha0  # evals  Notes 
Initial log joint probability = -23.5879
    Iter      log prob        ||dx||      ||grad||       alpha      alpha0  # evals  Notes 
      57       4678.49   3.34259e-06       4955.01   6.684e-10       0.001      119  LS failed, Hessian reset 
      76        4678.5   9.28423e-09       4978.58      0.5057      0.5057      143   
Optimization terminated normally: 
  Convergence detected: absolute parameter change was below tolerance
      99       7027.93   3.34992e-07        4967.7      0.3295           1      121   
    Iter      log prob        ||dx||      ||grad||       alpha      alpha0  # evals  Notes 
      62       9582.13   3.03146e-09        4669.7      0.1972      0.1972       88   
Optimization terminated normally: 
  Convergence detected: absolute parameter change was below tolerance
     103       7027.94   1.83283e-06       4948.63   3.803e-10       0.001      161  LS failed, Hessian reset 
      57       11812.9    4.9535e-09       4534.91      0.2137      0.2137       85   
Optimization terminated normally: 
  Convergence detected: absolute parameter change was below tolerance
     131       7027.96   8.52808e-09       4365.19      0.5274      0.5274      193   
Optimization terminated normally: 
  Convergence detected: absolute parameter change was below tolerance
      93       14233.5   9.70517e-09       4826.38      0.8056      0.8056      127   
Optimization terminated normally: 
  Convergence detected: absolute parameter change was below tolerance
[I 2020-10-01 03:18:54,262] Trial 261 finished with value: 0.041303439153817706 and parameters: {'changepoint_prior_scale': 0.0010134880594442337, 'seasonality_prior_scale': 0.08795358283575619, 'holidays_prior_scale': 0.17264086395603645, 'seasonality_mode': 'additive', 'changepoint_range': 0.5656658111175475}. Best is trial 96 with value: 0.038883738900888705.
Initial log joint probability = -28.8311
    Iter      log prob        ||dx||      ||grad||       alpha      alpha0  # evals  Notes 
      99       18912.8   8.38994e-07       3213.03      0.3565      0.3565      125   
    Iter      log prob        ||dx||      ||grad||       alpha      alpha0  # evals  Notes 
     137       18912.8   8.00962e-09       3550.17      0.2233      0.2233      172   
Optimization terminated normally: 
  Convergence detected: absolute parameter change was below tolerance
INFO:fbprophet:Making 5 forecasts with cutoffs between 2013-10-07 00:00:00 and 2015-10-18 00:00:00
INFO:fbprophet:Applying in parallel with <concurrent.futures.process.ProcessPoolExecutor object at 0x7fc84dc25a90>
Initial log joint probability = -8.95172
    Iter      log prob        ||dx||      ||grad||       alpha      alpha0  # evals  Notes 
Initial log joint probability = -12.7302
    Iter      log prob        ||dx||      ||grad||       alpha      alpha0  # evals  Notes 
Initial log joint probability = -15.1549
    Iter      log prob        ||dx||      ||grad||       alpha      alpha0  # evals  Notes 
Initial log joint probability = -18.717
    Iter      log prob        ||dx||      ||grad||       alpha      alpha0  # evals  Notes 
Initial log joint probability = -23.5879
    Iter      log prob        ||dx||      ||grad||       alpha      alpha0  # evals  Notes 
      60        4678.6   0.000148525       3433.97   4.451e-08       0.001      110  LS failed, Hessian reset 
      94          4679   8.71592e-09       3497.56      0.2452           1      158   
Optimization terminated normally: 
  Convergence detected: absolute parameter change was below tolerance
      99       7029.04   6.93547e-06       2972.05      0.7021      0.7021      134   
    Iter      log prob        ||dx||      ||grad||       alpha      alpha0  # evals  Notes 
      71       9582.15   6.90536e-09       3173.37      0.3376           1      109   
Optimization terminated normally: 
  Convergence detected: absolute parameter change was below tolerance
      67       11813.1   1.15999e-08       3238.01           1           1       95   
Optimization terminated normally: 
  Convergence detected: relative gradient magnitude is below tolerance
     141       7029.33   7.84274e-05       3818.49    2.27e-08       0.001      232  LS failed, Hessian reset 
      99       14232.8   8.48522e-08       2991.12       0.386           1      134   
    Iter      log prob        ||dx||      ||grad||       alpha      alpha0  # evals  Notes 
     105       14232.8   2.66932e-08       2662.31      0.2164           1      141   
Optimization terminated normally: 
  Convergence detected: relative gradient magnitude is below tolerance
     193       7029.65   7.45162e-07       3382.57   2.103e-10       0.001      340  LS failed, Hessian reset 
     199       7029.65   8.38875e-08       3437.46      0.3013      0.3013      347   
    Iter      log prob        ||dx||      ||grad||       alpha      alpha0  # evals  Notes 
     212       7029.65   8.38946e-09       2998.21      0.6271      0.6271      363   
Optimization terminated normally: 
  Convergence detected: absolute parameter change was below tolerance
[I 2020-10-01 03:19:09,404] Trial 262 finished with value: 0.04102660536738847 and parameters: {'changepoint_prior_scale': 0.0014701856270197674, 'seasonality_prior_scale': 0.1154348870632708, 'holidays_prior_scale': 0.21445265848447576, 'seasonality_mode': 'additive', 'changepoint_range': 0.9067721665114261}. Best is trial 96 with value: 0.038883738900888705.
Initial log joint probability = -28.8311
    Iter      log prob        ||dx||      ||grad||       alpha      alpha0  # evals  Notes 
      99       18912.2   6.59465e-08       2487.34      0.5282      0.5282      131   
    Iter      log prob        ||dx||      ||grad||       alpha      alpha0  # evals  Notes 
     123       18912.2   3.88522e-06       2500.05   1.782e-09       0.001      198  LS failed, Hessian reset 
     154       18912.2   1.23505e-08       2601.67      0.3531           1      239   
Optimization terminated normally: 
  Convergence detected: relative gradient magnitude is below tolerance
INFO:fbprophet:Making 5 forecasts with cutoffs between 2013-10-07 00:00:00 and 2015-10-18 00:00:00
INFO:fbprophet:Applying in parallel with <concurrent.futures.process.ProcessPoolExecutor object at 0x7fc84dc2fe90>
Initial log joint probability = -8.95172
    Iter      log prob        ||dx||      ||grad||       alpha      alpha0  # evals  Notes 
Initial log joint probability = -12.7302
    Iter      log prob        ||dx||      ||grad||       alpha      alpha0  # evals  Notes 
      54        4679.3   1.06978e-05       2903.84   4.014e-09       0.001      111  LS failed, Hessian reset 
Initial log joint probability = -15.1549
    Iter      log prob        ||dx||      ||grad||       alpha      alpha0  # evals  Notes 
      80       4679.33   9.67438e-09        2665.7      0.2071      0.2071      146   
Optimization terminated normally: 
  Convergence detected: absolute parameter change was below tolerance
Initial log joint probability = -18.717
    Iter      log prob        ||dx||      ||grad||       alpha      alpha0  # evals  Notes 
Initial log joint probability = -23.5879
    Iter      log prob        ||dx||      ||grad||       alpha      alpha0  # evals  Notes 
      99        7030.9   0.000286734       2835.83      0.5183      0.5183      122   
    Iter      log prob        ||dx||      ||grad||       alpha      alpha0  # evals  Notes 
     174       7031.71   6.19771e-09       2620.43      0.1501           1      213   
Optimization terminated normally: 
  Convergence detected: absolute parameter change was below tolerance
      55       11813.3   9.16702e-09       2673.57      0.3978      0.8121       80   
Optimization terminated normally: 
  Convergence detected: absolute parameter change was below tolerance
      62       9582.54   3.44112e-07       2538.47   1.338e-10       0.001      120  LS failed, Hessian reset 
      79       9582.55   3.48978e-09        2514.1      0.3508      0.3508      144   
Optimization terminated normally: 
  Convergence detected: absolute parameter change was below tolerance
      99       14233.2   1.86837e-06       2883.66           1           1      132   
    Iter      log prob        ||dx||      ||grad||       alpha      alpha0  # evals  Notes 
     119       14233.2   2.53497e-08       2246.29       0.466       0.466      160   
Optimization terminated normally: 
  Convergence detected: relative gradient magnitude is below tolerance
[I 2020-10-01 03:19:23,958] Trial 263 finished with value: 0.04173540500191641 and parameters: {'changepoint_prior_scale': 0.001798101453281773, 'seasonality_prior_scale': 0.14357235318364292, 'holidays_prior_scale': 0.13473822339193137, 'seasonality_mode': 'additive', 'changepoint_range': 0.5575931186861589}. Best is trial 96 with value: 0.038883738900888705.
Initial log joint probability = -28.8311
    Iter      log prob        ||dx||      ||grad||       alpha      alpha0  # evals  Notes 
      99       18910.9   2.23415e-05       4320.29           1           1      130   
    Iter      log prob        ||dx||      ||grad||       alpha      alpha0  # evals  Notes 
     183       18912.6   1.23083e-08       4559.51     0.04607           1      240   
Optimization terminated normally: 
  Convergence detected: relative gradient magnitude is below tolerance
INFO:fbprophet:Making 5 forecasts with cutoffs between 2013-10-07 00:00:00 and 2015-10-18 00:00:00
INFO:fbprophet:Applying in parallel with <concurrent.futures.process.ProcessPoolExecutor object at 0x7fc84dc1c290>
Initial log joint probability = -8.95172
    Iter      log prob        ||dx||      ||grad||       alpha      alpha0  # evals  Notes 
Initial log joint probability = -12.7302
    Iter      log prob        ||dx||      ||grad||       alpha      alpha0  # evals  Notes 
Initial log joint probability = -15.1549
    Iter      log prob        ||dx||      ||grad||       alpha      alpha0  # evals  Notes 
Initial log joint probability = -18.717
    Iter      log prob        ||dx||      ||grad||       alpha      alpha0  # evals  Notes 
      61       4678.57   5.49223e-09       4922.08      0.3029      0.3029       84   
Optimization terminated normally: 
  Convergence detected: absolute parameter change was below tolerance
Initial log joint probability = -23.5879
    Iter      log prob        ||dx||      ||grad||       alpha      alpha0  # evals  Notes 
      93       7027.88    5.5883e-09          4309      0.3048      0.3048      120   
Optimization terminated normally: 
  Convergence detected: absolute parameter change was below tolerance
      68       9582.05    7.1644e-09       4516.05      0.6198      0.6198       92   
Optimization terminated normally: 
  Convergence detected: absolute parameter change was below tolerance
      53       11812.7    5.8962e-09       4993.96      0.3462      0.3462       79   
Optimization terminated normally: 
  Convergence detected: absolute parameter change was below tolerance
      99       14233.2   3.56309e-07       4858.59      0.6566      0.6566      124   
    Iter      log prob        ||dx||      ||grad||       alpha      alpha0  # evals  Notes 
     128       14233.3   6.04292e-09       4845.18      0.2119      0.2119      164   
Optimization terminated normally: 
  Convergence detected: absolute parameter change was below tolerance
[I 2020-10-01 03:19:39,958] Trial 264 finished with value: 0.04119123866508434 and parameters: {'changepoint_prior_scale': 0.0010017884382790398, 'seasonality_prior_scale': 0.06712198977241682, 'holidays_prior_scale': 3.209723135321591, 'seasonality_mode': 'additive', 'changepoint_range': 0.5799936838195949}. Best is trial 96 with value: 0.038883738900888705.
Initial log joint probability = -28.8311
    Iter      log prob        ||dx||      ||grad||       alpha      alpha0  # evals  Notes 
      99         18912   5.21924e-07       3854.62           1           1      124   
    Iter      log prob        ||dx||      ||grad||       alpha      alpha0  # evals  Notes 
     120         18912   2.03817e-06       3715.55   5.203e-10       0.001      195  LS failed, Hessian reset 
     143         18912   8.00225e-09       3501.05      0.2418      0.2418      225   
Optimization terminated normally: 
  Convergence detected: absolute parameter change was below tolerance
INFO:fbprophet:Making 5 forecasts with cutoffs between 2013-10-07 00:00:00 and 2015-10-18 00:00:00
INFO:fbprophet:Applying in parallel with <concurrent.futures.process.ProcessPoolExecutor object at 0x7fc84dc4d650>
Initial log joint probability = -8.95172
    Iter      log prob        ||dx||      ||grad||       alpha      alpha0  # evals  Notes 
Initial log joint probability = -12.7302
    Iter      log prob        ||dx||      ||grad||       alpha      alpha0  # evals  Notes 
Initial log joint probability = -15.1549
    Iter      log prob        ||dx||      ||grad||       alpha      alpha0  # evals  Notes 
Initial log joint probability = -18.717
    Iter      log prob        ||dx||      ||grad||       alpha      alpha0  # evals  Notes 
      69          4679   8.97325e-09          3550       0.319       0.319       91   
Optimization terminated normally: 
  Convergence detected: absolute parameter change was below tolerance
Initial log joint probability = -23.5879
    Iter      log prob        ||dx||      ||grad||       alpha      alpha0  # evals  Notes 
      63        9582.4   3.84981e-09       3509.39      0.2626      0.2626       86   
Optimization terminated normally: 
  Convergence detected: absolute parameter change was below tolerance
      83       7028.48   4.14717e-05       3919.84   9.214e-09       0.001      162  LS failed, Hessian reset 
      99       7028.62   2.80804e-07        3849.6      0.2885      0.2885      181   
    Iter      log prob        ||dx||      ||grad||       alpha      alpha0  # evals  Notes 
      34       11811.3   0.000323584       3775.85   8.211e-08       0.001       93  LS failed, Hessian reset 
     122       7028.62   3.75367e-09       3889.47      0.2527      0.2527      208   
Optimization terminated normally: 
  Convergence detected: absolute parameter change was below tolerance
      85       11812.8   9.52327e-09       4118.13           1           1      155   
Optimization terminated normally: 
  Convergence detected: absolute parameter change was below tolerance
      99       14233.2   2.46887e-05       4061.79      0.3743      0.3743      129   
    Iter      log prob        ||dx||      ||grad||       alpha      alpha0  # evals  Notes 
     137       14233.3   1.23923e-08       3885.35           1           1      180   
Optimization terminated normally: 
  Convergence detected: relative gradient magnitude is below tolerance
