[I 2020-10-01 02:57:09,836] Trial 175 finished with value: 0.04108552552949718 and parameters: {'changepoint_prior_scale': 0.0011219270128261325, 'seasonality_prior_scale': 0.2917688569349086, 'holidays_prior_scale': 0.27793075140735285, 'seasonality_mode': 'additive', 'changepoint_range': 0.5834180554049941}. Best is trial 96 with value: 0.038883738900888705.
Initial log joint probability = -28.8311
    Iter      log prob        ||dx||      ||grad||       alpha      alpha0  # evals  Notes 
      99       18911.6   6.49103e-06       5217.18           1           1      118   
    Iter      log prob        ||dx||      ||grad||       alpha      alpha0  # evals  Notes 
     165         18912   5.27087e-09       4680.86      0.3243      0.3243      201   
Optimization terminated normally: 
  Convergence detected: absolute parameter change was below tolerance
INFO:fbprophet:Making 5 forecasts with cutoffs between 2013-10-07 00:00:00 and 2015-10-18 00:00:00
INFO:fbprophet:Applying in parallel with <concurrent.futures.process.ProcessPoolExecutor object at 0x7fc88e69a090>
Initial log joint probability = -8.95172
    Iter      log prob        ||dx||      ||grad||       alpha      alpha0  # evals  Notes 
Initial log joint probability = -12.7302
    Iter      log prob        ||dx||      ||grad||       alpha      alpha0  # evals  Notes 
Initial log joint probability = -15.1549
    Iter      log prob        ||dx||      ||grad||       alpha      alpha0  # evals  Notes 
Initial log joint probability = -18.717
    Iter      log prob        ||dx||      ||grad||       alpha      alpha0  # evals  Notes 
Initial log joint probability = -23.5879
    Iter      log prob        ||dx||      ||grad||       alpha      alpha0  # evals  Notes 
      68       4677.84   1.67434e-07       4854.41   3.351e-11       0.001      125  LS failed, Hessian reset 
      79       4677.84   3.61143e-09       5007.05      0.2362      0.2362      138   
Optimization terminated normally: 
  Convergence detected: absolute parameter change was below tolerance
      64       9582.21   8.13852e-09       5014.64      0.5837      0.5837       90   
Optimization terminated normally: 
  Convergence detected: absolute parameter change was below tolerance
      79       7028.05   4.11732e-06       4800.05   8.109e-10       0.001      148  LS failed, Hessian reset 
      99       7028.07   1.41689e-07       4892.49      0.7563      0.7563      172   
    Iter      log prob        ||dx||      ||grad||       alpha      alpha0  # evals  Notes 
     111       7028.07   6.24865e-09       4998.45       0.173       0.173      186   
Optimization terminated normally: 
  Convergence detected: absolute parameter change was below tolerance
      68       11812.9   2.43421e-06       4730.77   4.864e-10       0.001      137  LS failed, Hessian reset 
      87       11812.9   2.49943e-09       4550.43      0.1681      0.1681      164   
Optimization terminated normally: 
  Convergence detected: absolute parameter change was below tolerance
      99       14231.5   2.51525e-06       5026.25      0.7157      0.7157      127   
    Iter      log prob        ||dx||      ||grad||       alpha      alpha0  # evals  Notes 
     118       14231.5   5.00785e-09        5031.3      0.3521      0.3521      151   
Optimization terminated normally: 
  Convergence detected: absolute parameter change was below tolerance
[I 2020-10-01 02:57:23,006] Trial 176 finished with value: 0.04148048696540668 and parameters: {'changepoint_prior_scale': 0.0010109679670356278, 'seasonality_prior_scale': 0.21266706586623751, 'holidays_prior_scale': 0.4488829702382075, 'seasonality_mode': 'additive', 'changepoint_range': 0.5615866148245585}. Best is trial 96 with value: 0.038883738900888705.
Initial log joint probability = -28.8311
    Iter      log prob        ||dx||      ||grad||       alpha      alpha0  # evals  Notes 
      99       18912.5   3.73805e-06       3293.74           1           1      121   
    Iter      log prob        ||dx||      ||grad||       alpha      alpha0  # evals  Notes 
     115       18912.5   1.53264e-07        3129.6       1.412       0.502      140   
Optimization terminated normally: 
  Convergence detected: relative gradient magnitude is below tolerance
INFO:fbprophet:Making 5 forecasts with cutoffs between 2013-10-07 00:00:00 and 2015-10-18 00:00:00
INFO:fbprophet:Applying in parallel with <concurrent.futures.process.ProcessPoolExecutor object at 0x7fc84dc48410>
Initial log joint probability = -8.95172
    Iter      log prob        ||dx||      ||grad||       alpha      alpha0  # evals  Notes 
Initial log joint probability = -12.7302
    Iter      log prob        ||dx||      ||grad||       alpha      alpha0  # evals  Notes 
Initial log joint probability = -15.1549
    Iter      log prob        ||dx||      ||grad||       alpha      alpha0  # evals  Notes 
Initial log joint probability = -18.717
    Iter      log prob        ||dx||      ||grad||       alpha      alpha0  # evals  Notes 
Initial log joint probability = -23.5879
    Iter      log prob        ||dx||      ||grad||       alpha      alpha0  # evals  Notes 
      70       4678.78   0.000160371       3165.08   5.124e-08       0.001      145  LS failed, Hessian reset 
      99       4679.23   4.59752e-06       3193.81           1           1      182   
    Iter      log prob        ||dx||      ||grad||       alpha      alpha0  # evals  Notes 
      74       7029.41   3.54557e-05       3228.44   1.154e-08       0.001      132  LS failed, Hessian reset 
     115       4679.33   2.21025e-05       3136.14   6.996e-09       0.001      257  LS failed, Hessian reset 
      48       9582.45   3.20243e-06       2777.74   9.459e-10       0.001      104  LS failed, Hessian reset 
      99       7029.58   1.06521e-07       2900.49      0.3311      0.3311      164   
    Iter      log prob        ||dx||      ||grad||       alpha      alpha0  # evals  Notes 
     158       4679.44   1.95125e-06       3127.08   6.122e-10       0.001      365  LS failed, Hessian reset 
      82       9582.46    7.3779e-09       3429.89      0.3515           1      150   
Optimization terminated normally: 
  Convergence detected: absolute parameter change was below tolerance
     188       4679.45   9.13212e-09       3172.42       0.544       0.544      402   
Optimization terminated normally: 
  Convergence detected: absolute parameter change was below tolerance
     124       7029.58   3.23619e-07       2948.76   1.092e-10       0.001      238  LS failed, Hessian reset 
      43       11813.2   3.64415e-06       3226.49   1.142e-09       0.001      115  LS failed, Hessian reset 
     150       7029.59   1.34229e-09       2603.17      0.0945      0.0945      269   
Optimization terminated normally: 
  Convergence detected: absolute parameter change was below tolerance
      65       11813.2   9.68795e-09       3178.93      0.2734           1      143   
Optimization terminated normally: 
  Convergence detected: absolute parameter change was below tolerance
      99       14232.7   6.00566e-07       2732.18       1.755      0.4338      128   
    Iter      log prob        ||dx||      ||grad||       alpha      alpha0  # evals  Notes 
     126       14232.7   5.02804e-08       2699.55      0.6943      0.6943      159   
Optimization terminated normally: 
  Convergence detected: relative gradient magnitude is below tolerance
[I 2020-10-01 02:57:38,068] Trial 177 finished with value: 0.041041309133030376 and parameters: {'changepoint_prior_scale': 0.0015914372896548886, 'seasonality_prior_scale': 0.15350214902977508, 'holidays_prior_scale': 0.2145559635635244, 'seasonality_mode': 'additive', 'changepoint_range': 0.5322024865521395}. Best is trial 96 with value: 0.038883738900888705.
Initial log joint probability = -28.8311
    Iter      log prob        ||dx||      ||grad||       alpha      alpha0  # evals  Notes 
      99       18912.4   1.20817e-05       4016.69           1           1      128   
    Iter      log prob        ||dx||      ||grad||       alpha      alpha0  # evals  Notes 
     165       18912.6   6.10767e-09       3779.28      0.0864      0.0864      212   
Optimization terminated normally: 
  Convergence detected: absolute parameter change was below tolerance
INFO:fbprophet:Making 5 forecasts with cutoffs between 2013-10-07 00:00:00 and 2015-10-18 00:00:00
INFO:fbprophet:Applying in parallel with <concurrent.futures.process.ProcessPoolExecutor object at 0x7fc88e65ec50>
Initial log joint probability = -8.95172
    Iter      log prob        ||dx||      ||grad||       alpha      alpha0  # evals  Notes 
Initial log joint probability = -12.7302
    Iter      log prob        ||dx||      ||grad||       alpha      alpha0  # evals  Notes 
Initial log joint probability = -15.1549
    Iter      log prob        ||dx||      ||grad||       alpha      alpha0  # evals  Notes 
Initial log joint probability = -18.717
    Iter      log prob        ||dx||      ||grad||       alpha      alpha0  # evals  Notes 
Initial log joint probability = -23.5879
    Iter      log prob        ||dx||      ||grad||       alpha      alpha0  # evals  Notes 
      74       4679.13   2.55333e-07       3843.42   6.336e-11       0.001      139  LS failed, Hessian reset 
      81       4679.13   5.70147e-09       3799.91      0.2499      0.2499      147   
Optimization terminated normally: 
  Convergence detected: absolute parameter change was below tolerance
      99       7028.97   1.48484e-06       4271.07           1           1      125   
    Iter      log prob        ||dx||      ||grad||       alpha      alpha0  # evals  Notes 
     124       7028.97   6.18046e-09       4263.24     0.07611     0.07611      156   
Optimization terminated normally: 
  Convergence detected: absolute parameter change was below tolerance
      76       9582.33   5.35722e-09        3791.4      0.4705      0.4705      106   
Optimization terminated normally: 
  Convergence detected: absolute parameter change was below tolerance
      35       11811.2   0.000242113       3893.07    8.19e-08       0.001      107  LS failed, Hessian reset 
      99         11813   8.32243e-08       3702.55           1           1      188   
    Iter      log prob        ||dx||      ||grad||       alpha      alpha0  # evals  Notes 
      99       14233.3   2.13313e-06       3764.19      0.6597      0.6597      127   
    Iter      log prob        ||dx||      ||grad||       alpha      alpha0  # evals  Notes 
     120       14233.3   5.21647e-09       4039.07      0.4054      0.4054      157   
Optimization terminated normally: 
  Convergence detected: absolute parameter change was below tolerance
     112       11813.1   2.94565e-07       3632.17   7.487e-11       0.001      260  LS failed, Hessian reset 
     132       11813.1    7.1698e-09       3743.94       0.159       0.159      286   
Optimization terminated normally: 
  Convergence detected: absolute parameter change was below tolerance
[I 2020-10-01 02:57:52,559] Trial 178 finished with value: 0.04119309814130921 and parameters: {'changepoint_prior_scale': 0.0012715937510323263, 'seasonality_prior_scale': 0.1155599123900889, 'holidays_prior_scale': 0.05814704208974363, 'seasonality_mode': 'additive', 'changepoint_range': 0.5497020978224094}. Best is trial 96 with value: 0.038883738900888705.
Initial log joint probability = -28.8311
    Iter      log prob        ||dx||      ||grad||       alpha      alpha0  # evals  Notes 
      99       18912.4   4.02801e-07       3149.94      0.5957      0.5957      129   
    Iter      log prob        ||dx||      ||grad||       alpha      alpha0  # evals  Notes 
     116       18912.4   3.20065e-08       3391.11           1           1      151   
Optimization terminated normally: 
  Convergence detected: relative gradient magnitude is below tolerance
INFO:fbprophet:Making 5 forecasts with cutoffs between 2013-10-07 00:00:00 and 2015-10-18 00:00:00
INFO:fbprophet:Applying in parallel with <concurrent.futures.process.ProcessPoolExecutor object at 0x7fc88e67fa90>
Initial log joint probability = -8.95172
    Iter      log prob        ||dx||      ||grad||       alpha      alpha0  # evals  Notes 
Initial log joint probability = -12.7302
    Iter      log prob        ||dx||      ||grad||       alpha      alpha0  # evals  Notes 
      65       4678.28   2.45552e-07       3703.27   6.828e-11       0.001      127  LS failed, Hessian reset 
Initial log joint probability = -15.1549
    Iter      log prob        ||dx||      ||grad||       alpha      alpha0  # evals  Notes 
      77       4678.28   8.99741e-09       3045.88      0.5418      0.5418      141   
Optimization terminated normally: 
  Convergence detected: absolute parameter change was below tolerance
Initial log joint probability = -18.717
    Iter      log prob        ||dx||      ||grad||       alpha      alpha0  # evals  Notes 
Initial log joint probability = -23.5879
    Iter      log prob        ||dx||      ||grad||       alpha      alpha0  # evals  Notes 
      99       7029.07   7.32148e-05       3372.78      0.4853      0.4853      119   
    Iter      log prob        ||dx||      ||grad||       alpha      alpha0  # evals  Notes 
      47       9580.59   0.000264739        3458.5   7.115e-08       0.001       99  LS failed, Hessian reset 
     199       7031.18   8.80226e-07          3631      0.2508           1      247   
    Iter      log prob        ||dx||      ||grad||       alpha      alpha0  # evals  Notes 
      32       11812.1    0.00024779       3641.32   6.963e-08       0.001       91  LS failed, Hessian reset 
     215       7031.18   8.92251e-09       3484.94      0.6373      0.6373      270   
Optimization terminated normally: 
  Convergence detected: absolute parameter change was below tolerance
      83       9581.67   3.31493e-05       3713.68   8.917e-09       0.001      194  LS failed, Hessian reset 
      99       9581.77   1.11348e-06        3242.3           1           1      212   
    Iter      log prob        ||dx||      ||grad||       alpha      alpha0  # evals  Notes 
      99       14233.5   1.81013e-06       3472.37      0.4493           1      123   
    Iter      log prob        ||dx||      ||grad||       alpha      alpha0  # evals  Notes 
     125       9581.77   7.65324e-09       3366.22      0.3113           1      246   
Optimization terminated normally: 
  Convergence detected: absolute parameter change was below tolerance
      94         11813   9.94457e-06       3694.89    2.98e-09       0.001      213  LS failed, Hessian reset 
      99         11813   2.21916e-06       3369.65      0.5693      0.5693      218   
    Iter      log prob        ||dx||      ||grad||       alpha      alpha0  # evals  Notes 
     124       14233.5   2.29175e-07       3492.42   6.472e-11       0.001      193  LS failed, Hessian reset 
     133       14233.5   4.96168e-09       3729.93      0.2709      0.2709      204   
Optimization terminated normally: 
  Convergence detected: absolute parameter change was below tolerance
     143         11813   1.62366e-08       3515.55           1           1      274   
Optimization terminated normally: 
  Convergence detected: relative gradient magnitude is below tolerance
[I 2020-10-01 02:58:07,924] Trial 179 finished with value: 0.04336486759546114 and parameters: {'changepoint_prior_scale': 0.001392149181973412, 'seasonality_prior_scale': 0.41234890367340277, 'holidays_prior_scale': 0.06249261756881781, 'seasonality_mode': 'multiplicative', 'changepoint_range': 0.5191502824720118}. Best is trial 96 with value: 0.038883738900888705.
Initial log joint probability = -28.8311
    Iter      log prob        ||dx||      ||grad||       alpha      alpha0  # evals  Notes 
      99       18912.6    1.0562e-06       4485.26           1           1      122   
    Iter      log prob        ||dx||      ||grad||       alpha      alpha0  # evals  Notes 
     121       18912.6   1.38136e-08       4557.98      0.4086           1      152   
Optimization terminated normally: 
  Convergence detected: relative gradient magnitude is below tolerance
INFO:fbprophet:Making 5 forecasts with cutoffs between 2013-10-07 00:00:00 and 2015-10-18 00:00:00
INFO:fbprophet:Applying in parallel with <concurrent.futures.process.ProcessPoolExecutor object at 0x7fc88e66cb90>
Initial log joint probability = -8.95172
    Iter      log prob        ||dx||      ||grad||       alpha      alpha0  # evals  Notes 
Initial log joint probability = -12.7302
    Iter      log prob        ||dx||      ||grad||       alpha      alpha0  # evals  Notes 
Initial log joint probability = -15.1549
    Iter      log prob        ||dx||      ||grad||       alpha      alpha0  # evals  Notes 
Initial log joint probability = -18.717
    Iter      log prob        ||dx||      ||grad||       alpha      alpha0  # evals  Notes 
      62          4679   5.42964e-09       4298.07      0.3787      0.3787       89   
Optimization terminated normally: 
  Convergence detected: absolute parameter change was below tolerance
Initial log joint probability = -23.5879
    Iter      log prob        ||dx||      ||grad||       alpha      alpha0  # evals  Notes 
      85        7028.5   1.85344e-05       4526.03   4.245e-09       0.001      152  LS failed, Hessian reset 
      99       7028.57   2.31555e-07       3976.71      0.2563      0.2563      169   
    Iter      log prob        ||dx||      ||grad||       alpha      alpha0  # evals  Notes 
      97        9582.5   2.25709e-09       3507.23      0.1692      0.1692      125   
Optimization terminated normally: 
  Convergence detected: absolute parameter change was below tolerance
      62         11813   9.86198e-09       4307.35      0.7926      0.7926       90   
Optimization terminated normally: 
  Convergence detected: absolute parameter change was below tolerance
     144       7028.67   1.55499e-05       3866.66   3.656e-09       0.001      269  LS failed, Hessian reset 
     172       7028.71   2.93545e-09       4374.55      0.1264      0.1264      303   
Optimization terminated normally: 
  Convergence detected: absolute parameter change was below tolerance
      99       14233.5   0.000219322       4112.91           1           1      127   
    Iter      log prob        ||dx||      ||grad||       alpha      alpha0  # evals  Notes 
     135       14233.6   2.77343e-09       4369.45      0.1994      0.1994      175   
Optimization terminated normally: 
  Convergence detected: absolute parameter change was below tolerance
