[I 2020-10-01 03:55:20,078] Trial 403 finished with value: 0.04119581356383575 and parameters: {'changepoint_prior_scale': 0.001000915962205439, 'seasonality_prior_scale': 0.11329020875779079, 'holidays_prior_scale': 0.24808190059606106, 'seasonality_mode': 'additive', 'changepoint_range': 0.5643150837448423}. Best is trial 96 with value: 0.038883738900888705.
Initial log joint probability = -28.8311
    Iter      log prob        ||dx||      ||grad||       alpha      alpha0  # evals  Notes 
      99       18912.2   4.80647e-06       3632.87      0.2814      0.2814      121   
    Iter      log prob        ||dx||      ||grad||       alpha      alpha0  # evals  Notes 
     142       18912.3   7.94038e-09       3315.83      0.2114      0.2114      170   
Optimization terminated normally: 
  Convergence detected: absolute parameter change was below tolerance
INFO:fbprophet:Making 5 forecasts with cutoffs between 2013-10-07 00:00:00 and 2015-10-18 00:00:00
INFO:fbprophet:Applying in parallel with <concurrent.futures.process.ProcessPoolExecutor object at 0x7fc84dc78e90>
Initial log joint probability = -8.95172
    Iter      log prob        ||dx||      ||grad||       alpha      alpha0  # evals  Notes 
Initial log joint probability = -12.7302
    Iter      log prob        ||dx||      ||grad||       alpha      alpha0  # evals  Notes 
Initial log joint probability = -15.1549
    Iter      log prob        ||dx||      ||grad||       alpha      alpha0  # evals  Notes 
Initial log joint probability = -18.717
    Iter      log prob        ||dx||      ||grad||       alpha      alpha0  # evals  Notes 
      65       4679.02   9.95138e-09       3428.73      0.3266      0.3266       85   
Optimization terminated normally: 
  Convergence detected: absolute parameter change was below tolerance
Initial log joint probability = -23.5879
    Iter      log prob        ||dx||      ||grad||       alpha      alpha0  # evals  Notes 
      99       7029.49   7.07337e-06       3615.62      0.6621      0.6621      123   
    Iter      log prob        ||dx||      ||grad||       alpha      alpha0  # evals  Notes 
      61        9582.5   9.38179e-09       3085.79      0.7103      0.7103       82   
Optimization terminated normally: 
  Convergence detected: absolute parameter change was below tolerance
      33       11811.7   0.000246786       3469.82   7.537e-08       0.001       82  LS failed, Hessian reset 
     199       7031.66   2.94763e-07        3527.7           1           1      250   
    Iter      log prob        ||dx||      ||grad||       alpha      alpha0  # evals  Notes 
     213       7031.66   7.49191e-09       3556.94      0.2274           1      267   
Optimization terminated normally: 
  Convergence detected: absolute parameter change was below tolerance
      99       11813.3    4.4261e-07       3547.01      0.1973      0.1973      163   
    Iter      log prob        ||dx||      ||grad||       alpha      alpha0  # evals  Notes 
     110       11813.3   8.08168e-09       3498.86      0.2546      0.2546      176   
Optimization terminated normally: 
  Convergence detected: absolute parameter change was below tolerance
      71       14233.1   7.61505e-05       3464.57    2.35e-08       0.001      138  LS failed, Hessian reset 
      99       14233.5   4.07518e-07       3401.06           1           1      171   
    Iter      log prob        ||dx||      ||grad||       alpha      alpha0  # evals  Notes 
     127       14233.5   3.11673e-09       3216.29      0.2778      0.2778      205   
Optimization terminated normally: 
  Convergence detected: absolute parameter change was below tolerance
[I 2020-10-01 03:55:34,713] Trial 404 finished with value: 0.04121866665435206 and parameters: {'changepoint_prior_scale': 0.001420456470135798, 'seasonality_prior_scale': 0.15306638174143178, 'holidays_prior_scale': 0.13392554152311645, 'seasonality_mode': 'additive', 'changepoint_range': 0.548369844338616}. Best is trial 96 with value: 0.038883738900888705.
Initial log joint probability = -28.8311
    Iter      log prob        ||dx||      ||grad||       alpha      alpha0  # evals  Notes 
      99       18912.2   1.16033e-06       4827.66      0.2172           1      126   
    Iter      log prob        ||dx||      ||grad||       alpha      alpha0  # evals  Notes 
     168       18912.5   3.91866e-08       3998.73           1           1      207   
Optimization terminated normally: 
  Convergence detected: relative gradient magnitude is below tolerance
INFO:fbprophet:Making 5 forecasts with cutoffs between 2013-10-07 00:00:00 and 2015-10-18 00:00:00
INFO:fbprophet:Applying in parallel with <concurrent.futures.process.ProcessPoolExecutor object at 0x7fc84dc0bd90>
Initial log joint probability = -8.95172
    Iter      log prob        ||dx||      ||grad||       alpha      alpha0  # evals  Notes 
Initial log joint probability = -12.7302
    Iter      log prob        ||dx||      ||grad||       alpha      alpha0  # evals  Notes 
Initial log joint probability = -15.1549
    Iter      log prob        ||dx||      ||grad||       alpha      alpha0  # evals  Notes 
Initial log joint probability = -18.717
    Iter      log prob        ||dx||      ||grad||       alpha      alpha0  # evals  Notes 
Initial log joint probability = -23.5879
    Iter      log prob        ||dx||      ||grad||       alpha      alpha0  # evals  Notes 
      99       4678.97   2.43621e-08       4487.71      0.5924      0.5924      132   
    Iter      log prob        ||dx||      ||grad||       alpha      alpha0  # evals  Notes 
     112       4678.97   5.24813e-09       4276.35      0.2593      0.2593      148   
Optimization terminated normally: 
  Convergence detected: absolute parameter change was below tolerance
      55       7027.87   0.000110404       4654.87   2.583e-08       0.001      104  LS failed, Hessian reset 
      62       9582.34   2.49119e-09       4340.01      0.1018      0.1018       85   
Optimization terminated normally: 
  Convergence detected: absolute parameter change was below tolerance
      99       7028.27   1.18452e-07       4597.86      0.8891      0.8891      160   
    Iter      log prob        ||dx||      ||grad||       alpha      alpha0  # evals  Notes 
     132       7028.27   4.19621e-09       3843.81      0.3201      0.3201      206   
Optimization terminated normally: 
  Convergence detected: absolute parameter change was below tolerance
      76       11813.1   5.42814e-09        4514.1      0.4111      0.4111      110   
Optimization terminated normally: 
  Convergence detected: absolute parameter change was below tolerance
      98       14232.5   8.33081e-09        4046.9      0.3165      0.3165      128   
Optimization terminated normally: 
  Convergence detected: absolute parameter change was below tolerance
[I 2020-10-01 03:55:50,486] Trial 405 finished with value: 0.04079043805215998 and parameters: {'changepoint_prior_scale': 0.0011281779615002125, 'seasonality_prior_scale': 0.5487941682434143, 'holidays_prior_scale': 2.128232111287809, 'seasonality_mode': 'additive', 'changepoint_range': 0.5743071238635725}. Best is trial 96 with value: 0.038883738900888705.
Initial log joint probability = -28.8311
    Iter      log prob        ||dx||      ||grad||       alpha      alpha0  # evals  Notes 
      99         18913   1.64095e-07       2830.23      0.7799      0.7799      121   
    Iter      log prob        ||dx||      ||grad||       alpha      alpha0  # evals  Notes 
     109         18913   2.01951e-07       2793.47   6.844e-11       0.001      172  LS failed, Hessian reset 
     119         18913   1.84439e-08       2850.95      0.4306           1      186   
Optimization terminated normally: 
  Convergence detected: relative gradient magnitude is below tolerance
INFO:fbprophet:Making 5 forecasts with cutoffs between 2013-10-07 00:00:00 and 2015-10-18 00:00:00
INFO:fbprophet:Applying in parallel with <concurrent.futures.process.ProcessPoolExecutor object at 0x7fc84dc0b250>
Initial log joint probability = -8.95172
    Iter      log prob        ||dx||      ||grad||       alpha      alpha0  # evals  Notes 
Initial log joint probability = -12.7302
    Iter      log prob        ||dx||      ||grad||       alpha      alpha0  # evals  Notes 
Initial log joint probability = -15.1549
    Iter      log prob        ||dx||      ||grad||       alpha      alpha0  # evals  Notes 
Initial log joint probability = -18.717
    Iter      log prob        ||dx||      ||grad||       alpha      alpha0  # evals  Notes 
      61       4677.59   5.02837e-09       2907.63      0.2514      0.2514       82   
Optimization terminated normally: 
  Convergence detected: absolute parameter change was below tolerance
Initial log joint probability = -23.5879
    Iter      log prob        ||dx||      ||grad||       alpha      alpha0  # evals  Notes 
      99       7031.61   1.35366e-05       2479.44      0.5113      0.5113      122   
    Iter      log prob        ||dx||      ||grad||       alpha      alpha0  # evals  Notes 
      57       9582.58   6.08665e-09       2392.67       0.335       0.335       80   
Optimization terminated normally: 
  Convergence detected: absolute parameter change was below tolerance
      53       11813.3   1.88643e-08       2811.85      0.3827           1       77   
Optimization terminated normally: 
  Convergence detected: relative gradient magnitude is below tolerance
     164       7031.97   9.63375e-09       2777.11      0.3771      0.3771      200   
Optimization terminated normally: 
  Convergence detected: absolute parameter change was below tolerance
      73         14233   0.000147482       2721.59   4.957e-08       0.001      131  LS failed, Hessian reset 
      99       14233.2   1.08994e-06       2418.62           1           1      168   
    Iter      log prob        ||dx||      ||grad||       alpha      alpha0  # evals  Notes 
     119       14233.2   6.84952e-09       2299.31      0.3227      0.3227      191   
Optimization terminated normally: 
  Convergence detected: absolute parameter change was below tolerance
[I 2020-10-01 03:56:05,774] Trial 406 finished with value: 0.04242209299985385 and parameters: {'changepoint_prior_scale': 0.0017195479477044374, 'seasonality_prior_scale': 0.17485288513354524, 'holidays_prior_scale': 0.18412838119133085, 'seasonality_mode': 'additive', 'changepoint_range': 0.5305894876601278}. Best is trial 96 with value: 0.038883738900888705.
Initial log joint probability = -28.8311
    Iter      log prob        ||dx||      ||grad||       alpha      alpha0  # evals  Notes 
      99       18912.6   2.38299e-07       3818.98      0.3925      0.3925      125   
    Iter      log prob        ||dx||      ||grad||       alpha      alpha0  # evals  Notes 
     141       18912.8   7.18069e-09       3806.39      0.1899      0.1899      177   
Optimization terminated normally: 
  Convergence detected: absolute parameter change was below tolerance
INFO:fbprophet:Making 5 forecasts with cutoffs between 2013-10-07 00:00:00 and 2015-10-18 00:00:00
INFO:fbprophet:Applying in parallel with <concurrent.futures.process.ProcessPoolExecutor object at 0x7fc84dbf3c90>
Initial log joint probability = -8.95172
    Iter      log prob        ||dx||      ||grad||       alpha      alpha0  # evals  Notes 
Initial log joint probability = -12.7302
    Iter      log prob        ||dx||      ||grad||       alpha      alpha0  # evals  Notes 
Initial log joint probability = -15.1549
    Iter      log prob        ||dx||      ||grad||       alpha      alpha0  # evals  Notes 
Initial log joint probability = -18.717
    Iter      log prob        ||dx||      ||grad||       alpha      alpha0  # evals  Notes 
Initial log joint probability = -23.5879
    Iter      log prob        ||dx||      ||grad||       alpha      alpha0  # evals  Notes 
      70       4678.23   2.00079e-06       3750.16   5.044e-10       0.001      139  LS failed, Hessian reset 
      99       4678.24   1.02067e-06        3924.1           1           1      173   
    Iter      log prob        ||dx||      ||grad||       alpha      alpha0  # evals  Notes 
     102       4678.71    7.3373e-05       3882.03   1.864e-08       0.001      228  LS failed, Hessian reset 
      99       7028.77   1.86153e-07       3558.18      0.3433      0.3433      130   
    Iter      log prob        ||dx||      ||grad||       alpha      alpha0  # evals  Notes 
     116       7028.77   8.81232e-09       3377.14      0.4928      0.4928      151   
Optimization terminated normally: 
  Convergence detected: absolute parameter change was below tolerance
      44       11813.1   5.48659e-09       3819.42      0.1864      0.1864       73   
Optimization terminated normally: 
  Convergence detected: absolute parameter change was below tolerance
     148          4679   1.01865e-06       3977.64   2.687e-10       0.001      333  LS failed, Hessian reset 
     170       4679.01   6.19663e-09       3823.75        0.29        0.29      361   
Optimization terminated normally: 
  Convergence detected: absolute parameter change was below tolerance
      84       9582.16   1.63188e-07       4046.95   4.449e-11       0.001      161  LS failed, Hessian reset 
      91       9582.16   5.13586e-09       3405.46      0.2516      0.2516      171   
Optimization terminated normally: 
  Convergence detected: absolute parameter change was below tolerance
      99       14233.1   9.15614e-08       3738.31      0.5554      0.5554      124   
    Iter      log prob        ||dx||      ||grad||       alpha      alpha0  # evals  Notes 
     112       14233.1   3.92037e-09       3475.25      0.1743      0.1743      141   
Optimization terminated normally: 
  Convergence detected: absolute parameter change was below tolerance
[I 2020-10-01 03:56:20,103] Trial 407 finished with value: 0.041248135767930835 and parameters: {'changepoint_prior_scale': 0.001287949816044654, 'seasonality_prior_scale': 0.06912304202427293, 'holidays_prior_scale': 1.7233869327912494, 'seasonality_mode': 'additive', 'changepoint_range': 0.5141637400368725}. Best is trial 96 with value: 0.038883738900888705.
Initial log joint probability = -28.8311
    Iter      log prob        ||dx||      ||grad||       alpha      alpha0  # evals  Notes 
      99         18913   1.42979e-07       2928.82      0.5284      0.5284      128   
    Iter      log prob        ||dx||      ||grad||       alpha      alpha0  # evals  Notes 
     111         18913   1.28303e-08       3114.26      0.4221           1      144   
Optimization terminated normally: 
  Convergence detected: relative gradient magnitude is below tolerance
INFO:fbprophet:Making 5 forecasts with cutoffs between 2013-10-07 00:00:00 and 2015-10-18 00:00:00
INFO:fbprophet:Applying in parallel with <concurrent.futures.process.ProcessPoolExecutor object at 0x7fc84dc72350>
Initial log joint probability = -8.95172
    Iter      log prob        ||dx||      ||grad||       alpha      alpha0  # evals  Notes 
Initial log joint probability = -12.7302
    Iter      log prob        ||dx||      ||grad||       alpha      alpha0  # evals  Notes 
      57       4679.32   4.03921e-06       3199.32   1.187e-09       0.001      113  LS failed, Hessian reset 
Initial log joint probability = -15.1549
    Iter      log prob        ||dx||      ||grad||       alpha      alpha0  # evals  Notes 
      77       4679.33   4.32257e-09       3167.77      0.4222      0.4222      137   
Optimization terminated normally: 
  Convergence detected: absolute parameter change was below tolerance
Initial log joint probability = -18.717
    Iter      log prob        ||dx||      ||grad||       alpha      alpha0  # evals  Notes 
Initial log joint probability = -23.5879
    Iter      log prob        ||dx||      ||grad||       alpha      alpha0  # evals  Notes 
      99       7029.36   1.93188e-05       3333.34           1           1      124   
    Iter      log prob        ||dx||      ||grad||       alpha      alpha0  # evals  Notes 
     117       7029.55   1.69267e-05       3168.56   5.498e-09       0.001      184  LS failed, Hessian reset 
      84        9582.5   7.57693e-09       3125.35      0.4695      0.4695      116   
Optimization terminated normally: 
  Convergence detected: absolute parameter change was below tolerance
      50       11813.3   9.86228e-09       3053.66      0.4209      0.4209       84   
Optimization terminated normally: 
  Convergence detected: absolute parameter change was below tolerance
     168       7029.61   5.85288e-09       2569.44      0.4666      0.4666      250   
Optimization terminated normally: 
  Convergence detected: absolute parameter change was below tolerance
      99       14232.3   5.48457e-07       2921.52       0.265       0.265      128   
    Iter      log prob        ||dx||      ||grad||       alpha      alpha0  # evals  Notes 
     199         14233   4.93266e-08       3136.43      0.4688      0.4688      247   
    Iter      log prob        ||dx||      ||grad||       alpha      alpha0  # evals  Notes 
     216         14233   7.19967e-09       3071.84      0.3248      0.3248      268   
Optimization terminated normally: 
  Convergence detected: absolute parameter change was below tolerance
[I 2020-10-01 03:56:34,883] Trial 408 finished with value: 0.04116681131452974 and parameters: {'changepoint_prior_scale': 0.001535494531646833, 'seasonality_prior_scale': 0.4728107000194994, 'holidays_prior_scale': 0.2130994351693251, 'seasonality_mode': 'additive', 'changepoint_range': 0.5603771734373163}. Best is trial 96 with value: 0.038883738900888705.
Initial log joint probability = -28.8311
    Iter      log prob        ||dx||      ||grad||       alpha      alpha0  # evals  Notes 
      99       18911.9   0.000289704       4647.92      0.5493      0.5493      127   
    Iter      log prob        ||dx||      ||grad||       alpha      alpha0  # evals  Notes 
     173       18912.9   2.18848e-08       3992.67      0.7604      0.7604      215   
Optimization terminated normally: 
  Convergence detected: relative gradient magnitude is below tolerance
INFO:fbprophet:Making 5 forecasts with cutoffs between 2013-10-07 00:00:00 and 2015-10-18 00:00:00
INFO:fbprophet:Applying in parallel with <concurrent.futures.process.ProcessPoolExecutor object at 0x7fc84dc0bb10>
Initial log joint probability = -8.95172
    Iter      log prob        ||dx||      ||grad||       alpha      alpha0  # evals  Notes 
Initial log joint probability = -12.7302
    Iter      log prob        ||dx||      ||grad||       alpha      alpha0  # evals  Notes 
Initial log joint probability = -15.1549
    Iter      log prob        ||dx||      ||grad||       alpha      alpha0  # evals  Notes 
Initial log joint probability = -18.717
    Iter      log prob        ||dx||      ||grad||       alpha      alpha0  # evals  Notes 
      56       4679.05   5.33839e-09        4342.8      0.2238      0.2238       80   
Optimization terminated normally: 
  Convergence detected: absolute parameter change was below tolerance
Initial log joint probability = -23.5879
    Iter      log prob        ||dx||      ||grad||       alpha      alpha0  # evals  Notes 
      89       7028.42   1.82077e-05       4118.86   3.897e-09       0.001      160  LS failed, Hessian reset 
      99       7028.52     2.484e-06       3750.11      0.2858      0.2858      172   
    Iter      log prob        ||dx||      ||grad||       alpha      alpha0  # evals  Notes 
      99       9582.38   7.63594e-08       4049.13      0.9421      0.9421      127   
    Iter      log prob        ||dx||      ||grad||       alpha      alpha0  # evals  Notes 
     163       7028.56   2.96712e-09        3808.9      0.2098      0.2098      255   
Optimization terminated normally: 
  Convergence detected: absolute parameter change was below tolerance
     112       9582.38    2.6036e-07       4972.29   6.128e-11       0.001      177  LS failed, Hessian reset 
     124       9582.38   9.57051e-09       3936.22      0.3661           1      193   
Optimization terminated normally: 
  Convergence detected: absolute parameter change was below tolerance
      91       11813.1   6.37453e-07        4452.3   1.418e-10       0.001      182  LS failed, Hessian reset 
      99       11813.1   3.05845e-08       4361.53      0.4684           1      195   
    Iter      log prob        ||dx||      ||grad||       alpha      alpha0  # evals  Notes 
     105       11813.1   8.69225e-09       4549.62      0.8343      0.8343      202   
Optimization terminated normally: 
  Convergence detected: absolute parameter change was below tolerance
      94       14231.6   9.42106e-06       4016.46   2.029e-09       0.001      174  LS failed, Hessian reset 
      99       14231.6   4.66228e-06       3350.28           1           1      181   
    Iter      log prob        ||dx||      ||grad||       alpha      alpha0  # evals  Notes 
     131       14231.6   5.65364e-09       4147.37       0.473       0.473      221   
Optimization terminated normally: 
  Convergence detected: absolute parameter change was below tolerance
