[I 2020-10-01 03:22:50,264] Trial 276 finished with value: 0.0404529440532308 and parameters: {'changepoint_prior_scale': 0.0012723338886696535, 'seasonality_prior_scale': 0.6995857800193871, 'holidays_prior_scale': 2.708879138525267, 'seasonality_mode': 'additive', 'changepoint_range': 0.5346889553071278}. Best is trial 96 with value: 0.038883738900888705.
Initial log joint probability = -28.8311
    Iter      log prob        ||dx||      ||grad||       alpha      alpha0  # evals  Notes 
      55       18913.2   9.33009e-08       532.026      0.3616           1       78   
Optimization terminated normally: 
  Convergence detected: relative gradient magnitude is below tolerance
INFO:fbprophet:Making 5 forecasts with cutoffs between 2013-10-07 00:00:00 and 2015-10-18 00:00:00
INFO:fbprophet:Applying in parallel with <concurrent.futures.process.ProcessPoolExecutor object at 0x7fc84dc4d3d0>
Initial log joint probability = -8.95172
    Iter      log prob        ||dx||      ||grad||       alpha      alpha0  # evals  Notes 
Initial log joint probability = -12.7302
    Iter      log prob        ||dx||      ||grad||       alpha      alpha0  # evals  Notes 
Initial log joint probability = -15.1549
    Iter      log prob        ||dx||      ||grad||       alpha      alpha0  # evals  Notes 
Initial log joint probability = -18.717
    Iter      log prob        ||dx||      ||grad||       alpha      alpha0  # evals  Notes 
Initial log joint probability = -23.5879
    Iter      log prob        ||dx||      ||grad||       alpha      alpha0  # evals  Notes 
      86        4679.5    2.0096e-08       817.213      0.9196      0.9196      119   
Optimization terminated normally: 
  Convergence detected: relative gradient magnitude is below tolerance
      99       7032.04    3.7424e-07       635.186           1           1      131   
    Iter      log prob        ||dx||      ||grad||       alpha      alpha0  # evals  Notes 
      86         11813   6.28923e-08        793.85      0.3245      0.7991      112   
Optimization terminated normally: 
  Convergence detected: relative gradient magnitude is below tolerance
      90       9582.69   1.19119e-07       633.043   1.635e-10       0.001      167  LS failed, Hessian reset 
      96       9582.69     5.104e-08       591.835      0.2059           1      177   
Optimization terminated normally: 
  Convergence detected: relative gradient magnitude is below tolerance
     179       7032.06   2.41865e-06       605.319   2.958e-09       0.001      273  LS failed, Hessian reset 
     190       7032.06    7.9591e-08       549.801           1           1      289   
Optimization terminated normally: 
  Convergence detected: relative gradient magnitude is below tolerance
      90       14233.3   7.39535e-08       688.631      0.2523           1      120   
Optimization terminated normally: 
  Convergence detected: relative gradient magnitude is below tolerance
[I 2020-10-01 03:23:05,935] Trial 277 finished with value: 0.04221119092176265 and parameters: {'changepoint_prior_scale': 0.005878474078454212, 'seasonality_prior_scale': 1.0202559377351643, 'holidays_prior_scale': 2.6912112630580554, 'seasonality_mode': 'additive', 'changepoint_range': 0.5234775619141208}. Best is trial 96 with value: 0.038883738900888705.
Initial log joint probability = -28.8311
    Iter      log prob        ||dx||      ||grad||       alpha      alpha0  # evals  Notes 
      99       18912.2   0.000212223        3959.7           1           1      124   
    Iter      log prob        ||dx||      ||grad||       alpha      alpha0  # evals  Notes 
     136       18912.5   8.19564e-09       4543.33      0.5392      0.5392      167   
Optimization terminated normally: 
  Convergence detected: absolute parameter change was below tolerance
INFO:fbprophet:Making 5 forecasts with cutoffs between 2013-10-07 00:00:00 and 2015-10-18 00:00:00
INFO:fbprophet:Applying in parallel with <concurrent.futures.process.ProcessPoolExecutor object at 0x7fc84dc4ddd0>
Initial log joint probability = -8.95172
    Iter      log prob        ||dx||      ||grad||       alpha      alpha0  # evals  Notes 
Initial log joint probability = -12.7302
    Iter      log prob        ||dx||      ||grad||       alpha      alpha0  # evals  Notes 
Initial log joint probability = -15.1549
    Iter      log prob        ||dx||      ||grad||       alpha      alpha0  # evals  Notes 
Initial log joint probability = -18.717
    Iter      log prob        ||dx||      ||grad||       alpha      alpha0  # evals  Notes 
Initial log joint probability = -23.5879
    Iter      log prob        ||dx||      ||grad||       alpha      alpha0  # evals  Notes 
      53        4679.2   2.43295e-05       4288.24   5.745e-09       0.001      121  LS failed, Hessian reset 
      98       4679.36   2.29888e-06       4171.83   5.355e-10       0.001      230  LS failed, Hessian reset 
      99       4679.36   1.20616e-06       4167.21           1           1      231   
    Iter      log prob        ||dx||      ||grad||       alpha      alpha0  # evals  Notes 
      78        7028.4   1.50436e-06       3807.54   3.608e-10       0.001      137  LS failed, Hessian reset 
     137       4679.37   8.27286e-09       4260.58      0.4922      0.4922      276   
Optimization terminated normally: 
  Convergence detected: absolute parameter change was below tolerance
      99        7028.4   1.32122e-08       4401.64       0.644       0.644      165   
    Iter      log prob        ||dx||      ||grad||       alpha      alpha0  # evals  Notes 
     101        7028.4   7.09398e-09       4352.53      0.4128      0.4128      168   
Optimization terminated normally: 
  Convergence detected: absolute parameter change was below tolerance
      28       11811.5   0.000298976       4071.14   6.769e-08       0.001       84  LS failed, Hessian reset 
      99       9582.45   1.04975e-08       3615.92      0.2772           1      138   
    Iter      log prob        ||dx||      ||grad||       alpha      alpha0  # evals  Notes 
     105       9582.45   7.65888e-09        3240.5      0.4283           1      146   
Optimization terminated normally: 
  Convergence detected: absolute parameter change was below tolerance
      60       11813.1   7.64521e-06       4096.13   1.747e-09       0.001      161  LS failed, Hessian reset 
      99       14231.4   2.46717e-07       4180.51       1.281      0.4766      136   
    Iter      log prob        ||dx||      ||grad||       alpha      alpha0  # evals  Notes 
     108       14231.4   2.65299e-09       4172.66     0.09484     0.09484      148   
Optimization terminated normally: 
  Convergence detected: absolute parameter change was below tolerance
      91       11813.2   7.68285e-09       4244.23      0.1865      0.1865      204   
Optimization terminated normally: 
  Convergence detected: absolute parameter change was below tolerance
[I 2020-10-01 03:23:20,529] Trial 278 finished with value: 0.040817499675349984 and parameters: {'changepoint_prior_scale': 0.0011819578770052583, 'seasonality_prior_scale': 0.7704731975974143, 'holidays_prior_scale': 2.950198243355037, 'seasonality_mode': 'additive', 'changepoint_range': 0.5328032917642208}. Best is trial 96 with value: 0.038883738900888705.
Initial log joint probability = -28.8311
    Iter      log prob        ||dx||      ||grad||       alpha      alpha0  # evals  Notes 
      99         18912   2.74509e-06       5051.64      0.3739      0.3739      124   
    Iter      log prob        ||dx||      ||grad||       alpha      alpha0  # evals  Notes 
     171       18912.8   8.84216e-09       4509.63      0.3861      0.3861      209   
Optimization terminated normally: 
  Convergence detected: absolute parameter change was below tolerance
INFO:fbprophet:Making 5 forecasts with cutoffs between 2013-10-07 00:00:00 and 2015-10-18 00:00:00
INFO:fbprophet:Applying in parallel with <concurrent.futures.process.ProcessPoolExecutor object at 0x7fc84dc04350>
Initial log joint probability = -8.95172
    Iter      log prob        ||dx||      ||grad||       alpha      alpha0  # evals  Notes 
Initial log joint probability = -12.7302
    Iter      log prob        ||dx||      ||grad||       alpha      alpha0  # evals  Notes 
Initial log joint probability = -15.1549
    Iter      log prob        ||dx||      ||grad||       alpha      alpha0  # evals  Notes 
Initial log joint probability = -18.717
    Iter      log prob        ||dx||      ||grad||       alpha      alpha0  # evals  Notes 
Initial log joint probability = -23.5879
    Iter      log prob        ||dx||      ||grad||       alpha      alpha0  # evals  Notes 
      57        4678.9   2.35007e-05        5087.8   4.635e-09       0.001      124  LS failed, Hessian reset 
      99       4679.04   1.98738e-08       5093.54           1           1      177   
    Iter      log prob        ||dx||      ||grad||       alpha      alpha0  # evals  Notes 
     100       4679.04   9.50367e-09       4973.45      0.3041           1      179   
Optimization terminated normally: 
  Convergence detected: absolute parameter change was below tolerance
      97       7027.87   9.75877e-09       4476.67       0.676       0.676      127   
Optimization terminated normally: 
  Convergence detected: absolute parameter change was below tolerance
      57       9582.07   2.69744e-05        5514.6   6.481e-09       0.001      112  LS failed, Hessian reset 
      37       11811.7   0.000108965       4855.06   2.203e-08       0.001       95  LS failed, Hessian reset 
      89       9582.16   4.41618e-09       4732.31      0.1559      0.1559      149   
Optimization terminated normally: 
  Convergence detected: absolute parameter change was below tolerance
      94       14232.3   2.86903e-09       5135.29      0.1226      0.1226      130   
Optimization terminated normally: 
  Convergence detected: absolute parameter change was below tolerance
      75         11813   7.08957e-05       4963.78   1.437e-08       0.001      184  LS failed, Hessian reset 
      99       11813.3   4.00861e-08       4912.28      0.6467      0.6467      218   
    Iter      log prob        ||dx||      ||grad||       alpha      alpha0  # evals  Notes 
     109       11813.3   3.77276e-09       4881.72      0.4838      0.4838      230   
Optimization terminated normally: 
  Convergence detected: absolute parameter change was below tolerance
[I 2020-10-01 03:23:36,113] Trial 279 finished with value: 0.041084183205565124 and parameters: {'changepoint_prior_scale': 0.0010038459990345673, 'seasonality_prior_scale': 1.1495378286091626, 'holidays_prior_scale': 1.5216437876100828, 'seasonality_mode': 'additive', 'changepoint_range': 0.5082313279404447}. Best is trial 96 with value: 0.038883738900888705.
Initial log joint probability = -28.8311
    Iter      log prob        ||dx||      ||grad||       alpha      alpha0  # evals  Notes 
      99       18912.6   6.68927e-07       3819.38      0.3996           1      125   
    Iter      log prob        ||dx||      ||grad||       alpha      alpha0  # evals  Notes 
     119       18912.6   1.88013e-08       3648.75      0.2497           1      149   
Optimization terminated normally: 
  Convergence detected: relative gradient magnitude is below tolerance
INFO:fbprophet:Making 5 forecasts with cutoffs between 2013-10-07 00:00:00 and 2015-10-18 00:00:00
INFO:fbprophet:Applying in parallel with <concurrent.futures.process.ProcessPoolExecutor object at 0x7fc84dc4d0d0>
Initial log joint probability = -8.95172
    Iter      log prob        ||dx||      ||grad||       alpha      alpha0  # evals  Notes 
Initial log joint probability = -12.7302
    Iter      log prob        ||dx||      ||grad||       alpha      alpha0  # evals  Notes 
Initial log joint probability = -15.1549
    Iter      log prob        ||dx||      ||grad||       alpha      alpha0  # evals  Notes 
Initial log joint probability = -18.717
    Iter      log prob        ||dx||      ||grad||       alpha      alpha0  # evals  Notes 
Initial log joint probability = -23.5879
    Iter      log prob        ||dx||      ||grad||       alpha      alpha0  # evals  Notes 
      80          4679   2.13394e-09       3824.03      0.3058      0.3058      108   
Optimization terminated normally: 
  Convergence detected: absolute parameter change was below tolerance
      99       7028.92    8.9148e-07       3978.63           1           1      129   
    Iter      log prob        ||dx||      ||grad||       alpha      alpha0  # evals  Notes 
     119       7028.92   8.23852e-09        4073.8      0.5007      0.5007      151   
Optimization terminated normally: 
  Convergence detected: absolute parameter change was below tolerance
      63       9582.35   3.03804e-07       4208.56   8.551e-11       0.001      126  LS failed, Hessian reset 
      79       9582.35   5.33315e-09       3266.84      0.6242      0.6242      145   
Optimization terminated normally: 
  Convergence detected: absolute parameter change was below tolerance
      99       11812.2   1.14365e-08       4275.77     0.09217     0.09217      135   
    Iter      log prob        ||dx||      ||grad||       alpha      alpha0  # evals  Notes 
     108       11812.2    1.3875e-08       3840.34      0.7309      0.7309      146   
Optimization terminated normally: 
  Convergence detected: relative gradient magnitude is below tolerance
      99       14233.6   7.74443e-06       4034.37   1.879e-09       0.001      168  LS failed, Hessian reset 
    Iter      log prob        ||dx||      ||grad||       alpha      alpha0  # evals  Notes 
     128       14233.6   1.09932e-08       3820.22      0.2803      0.9782      204   
Optimization terminated normally: 
  Convergence detected: relative gradient magnitude is below tolerance
[I 2020-10-01 03:23:51,271] Trial 280 finished with value: 0.04092718512019982 and parameters: {'changepoint_prior_scale': 0.0012456959940491722, 'seasonality_prior_scale': 0.7600584219633322, 'holidays_prior_scale': 4.194415913749425, 'seasonality_mode': 'additive', 'changepoint_range': 0.5557669871524401}. Best is trial 96 with value: 0.038883738900888705.
Initial log joint probability = -28.8311
    Iter      log prob        ||dx||      ||grad||       alpha      alpha0  # evals  Notes 
      99       18912.8   1.98463e-05       2932.53   6.605e-09       0.001      167  LS failed, Hessian reset 
    Iter      log prob        ||dx||      ||grad||       alpha      alpha0  # evals  Notes 
     139       18912.8   9.50557e-09       2079.04      0.1158      0.1158      219   
Optimization terminated normally: 
  Convergence detected: absolute parameter change was below tolerance
INFO:fbprophet:Making 5 forecasts with cutoffs between 2013-10-07 00:00:00 and 2015-10-18 00:00:00
INFO:fbprophet:Applying in parallel with <concurrent.futures.process.ProcessPoolExecutor object at 0x7fc84dc1c550>
Initial log joint probability = -8.95172
    Iter      log prob        ||dx||      ||grad||       alpha      alpha0  # evals  Notes 
Initial log joint probability = -12.7302
    Iter      log prob        ||dx||      ||grad||       alpha      alpha0  # evals  Notes 
Initial log joint probability = -15.1549
    Iter      log prob        ||dx||      ||grad||       alpha      alpha0  # evals  Notes 
Initial log joint probability = -18.717
    Iter      log prob        ||dx||      ||grad||       alpha      alpha0  # evals  Notes 
      39       4679.18   0.000114153       2741.77   4.283e-08       0.001       92  LS failed, Hessian reset 
Initial log joint probability = -23.5879
    Iter      log prob        ||dx||      ||grad||       alpha      alpha0  # evals  Notes 
      74       4679.44   6.03854e-06       2645.94   2.209e-09       0.001      176  LS failed, Hessian reset 
      99       4679.45   4.30673e-08       2701.32      0.7094      0.7094      206   
    Iter      log prob        ||dx||      ||grad||       alpha      alpha0  # evals  Notes 
     106       4679.45   9.53883e-09       2722.71           1           1      215   
Optimization terminated normally: 
  Convergence detected: absolute parameter change was below tolerance
      99       7031.34    0.00205457       2599.81           1           1      118   
    Iter      log prob        ||dx||      ||grad||       alpha      alpha0  # evals  Notes 
     135       7031.94    9.2118e-09       2698.48      0.3203      0.3203      165   
Optimization terminated normally: 
  Convergence detected: absolute parameter change was below tolerance
      57       11813.3   9.91936e-09       2662.16      0.4245      0.4245       80   
Optimization terminated normally: 
  Convergence detected: absolute parameter change was below tolerance
      83       9582.56   7.96899e-06        2852.1   3.139e-09       0.001      171  LS failed, Hessian reset 
      99       9582.58   2.65834e-07       2312.62           1           1      191   
    Iter      log prob        ||dx||      ||grad||       alpha      alpha0  # evals  Notes 
      67       14232.2   0.000165475        2594.4   5.985e-08       0.001      131  LS failed, Hessian reset 
     110       9582.58   7.04596e-09       2672.51       0.211       0.211      206   
Optimization terminated normally: 
  Convergence detected: absolute parameter change was below tolerance
      99       14232.8   1.76552e-07       2611.52      0.4112      0.4112      168   
    Iter      log prob        ||dx||      ||grad||       alpha      alpha0  # evals  Notes 
     111       14232.8   6.60212e-09       2783.33      0.2115      0.2115      182   
Optimization terminated normally: 
  Convergence detected: absolute parameter change was below tolerance
