[I 2020-10-01 02:14:16,702] Trial 7 finished with value: 0.049498265245743585 and parameters: {'changepoint_prior_scale': 0.07838362326145573, 'seasonality_prior_scale': 0.17823104044979074, 'holidays_prior_scale': 0.10577527646533404, 'seasonality_mode': 'additive', 'changepoint_range': 0.758065661486534}. Best is trial 3 with value: 0.04098090703811677.
Initial log joint probability = -28.8311
    Iter      log prob        ||dx||      ||grad||       alpha      alpha0  # evals  Notes 
      99       18924.8    0.00132553       92.1561       1.319      0.1319      119   
    Iter      log prob        ||dx||      ||grad||       alpha      alpha0  # evals  Notes 
     199       18925.5    0.00121494       49.4992           1           1      237   
    Iter      log prob        ||dx||      ||grad||       alpha      alpha0  # evals  Notes 
     299       18926.3   0.000281421       92.9772      0.3038           1      362   
    Iter      log prob        ||dx||      ||grad||       alpha      alpha0  # evals  Notes 
     399       18926.4   3.50023e-05       15.6425      0.4189      0.4189      492   
    Iter      log prob        ||dx||      ||grad||       alpha      alpha0  # evals  Notes 
     437       18926.5   1.21205e-05       30.1402   1.804e-07       0.001      574  LS failed, Hessian reset 
     499       18926.6   2.36386e-05       43.2443      0.5755      0.5755      649   
    Iter      log prob        ||dx||      ||grad||       alpha      alpha0  # evals  Notes 
     599       18926.7   0.000102527       31.9803       1.778      0.1778      770   
    Iter      log prob        ||dx||      ||grad||       alpha      alpha0  # evals  Notes 
     614       18926.7   6.23491e-06       18.7616      0.4183           1      794   
Optimization terminated normally: 
  Convergence detected: relative gradient magnitude is below tolerance
INFO:fbprophet:Making 5 forecasts with cutoffs between 2013-10-07 00:00:00 and 2015-10-18 00:00:00
INFO:fbprophet:Applying in parallel with <concurrent.futures.process.ProcessPoolExecutor object at 0x7fc88f7710d0>
Initial log joint probability = -8.95172
    Iter      log prob        ||dx||      ||grad||       alpha      alpha0  # evals  Notes 
Initial log joint probability = -12.7302
    Iter      log prob        ||dx||      ||grad||       alpha      alpha0  # evals  Notes 
Initial log joint probability = -15.1549
    Iter      log prob        ||dx||      ||grad||       alpha      alpha0  # evals  Notes 
Initial log joint probability = -18.717
    Iter      log prob        ||dx||      ||grad||       alpha      alpha0  # evals  Notes 
Initial log joint probability = -23.5879
    Iter      log prob        ||dx||      ||grad||       alpha      alpha0  # evals  Notes 
      99       4679.52   2.73615e-05       26.5826      0.2956           1      120   
    Iter      log prob        ||dx||      ||grad||       alpha      alpha0  # evals  Notes 
     142       4679.52    2.4788e-05       34.0739    8.19e-07       0.001      208  LS failed, Hessian reset 
      99       7039.65   0.000313613        46.238           1           1      119   
    Iter      log prob        ||dx||      ||grad||       alpha      alpha0  # evals  Notes 
     160       4679.52   2.39709e-07       30.3859      0.2327           1      231   
Optimization terminated normally: 
  Convergence detected: relative gradient magnitude is below tolerance
      99       9587.29    0.00158456       63.1701           1           1      117   
    Iter      log prob        ||dx||      ||grad||       alpha      alpha0  # evals  Notes 
     181       7039.78   4.82732e-05       51.7959   1.109e-06       0.001      250  LS failed, Hessian reset 
      99       11819.6   5.88763e-05       55.8993      0.5347      0.5347      117   
    Iter      log prob        ||dx||      ||grad||       alpha      alpha0  # evals  Notes 
     199        7039.8   5.44806e-05       17.9059      0.5858      0.5858      272   
    Iter      log prob        ||dx||      ||grad||       alpha      alpha0  # evals  Notes 
      99       14241.1    0.00475474       457.827       0.238           1      118   
    Iter      log prob        ||dx||      ||grad||       alpha      alpha0  # evals  Notes 
     220        7039.8   6.85959e-06        15.705   3.734e-07       0.001      344  LS failed, Hessian reset 
     223        7039.8   3.61837e-07       17.0937       0.053           1      351   
Optimization terminated normally: 
  Convergence detected: relative gradient magnitude is below tolerance
     199       9587.95   0.000198415       38.5749           1           1      242   
    Iter      log prob        ||dx||      ||grad||       alpha      alpha0  # evals  Notes 
     199         11820   0.000131706       36.3771      0.3437      0.3437      239   
    Iter      log prob        ||dx||      ||grad||       alpha      alpha0  # evals  Notes 
     299       9588.15    4.4408e-05       27.0924           1           1      355   
    Iter      log prob        ||dx||      ||grad||       alpha      alpha0  # evals  Notes 
     217       11820.1   7.62625e-05       66.5036   1.523e-06       0.001      301  LS failed, Hessian reset 
     199       14241.7   0.000160256       39.4827      0.1146      0.1146      234   
    Iter      log prob        ||dx||      ||grad||       alpha      alpha0  # evals  Notes 
     346       9588.15   2.59818e-05       48.4594   6.794e-07       0.001      446  LS failed, Hessian reset 
     362       9588.16   2.83563e-06       20.1245      0.3459      0.8789      472   
Optimization terminated normally: 
  Convergence detected: relative gradient magnitude is below tolerance
     262       11820.2   2.12835e-06       17.7816      0.3682           1      360   
Optimization terminated normally: 
  Convergence detected: relative gradient magnitude is below tolerance
     281         14242   2.97914e-05       69.8134   3.114e-07       0.001      375  LS failed, Hessian reset 
     299         14242   0.000127289       33.7998      0.3928      0.3928      397   
    Iter      log prob        ||dx||      ||grad||       alpha      alpha0  # evals  Notes 
     322         14242   1.70678e-05       40.8885   3.585e-07       0.001      470  LS failed, Hessian reset 
     377       14242.1   1.17173e-05        32.228   3.899e-07       0.001      594  LS failed, Hessian reset 
     398       14242.1    2.9114e-06       19.8367      0.5643      0.5643      619   
Optimization terminated normally: 
  Convergence detected: relative gradient magnitude is below tolerance
[I 2020-10-01 02:14:32,655] Trial 8 finished with value: 0.04955532286849363 and parameters: {'changepoint_prior_scale': 0.16510564692226437, 'seasonality_prior_scale': 0.6476283597433541, 'holidays_prior_scale': 0.47578865708801105, 'seasonality_mode': 'multiplicative', 'changepoint_range': 0.6705228075418525}. Best is trial 3 with value: 0.04098090703811677.
Initial log joint probability = -28.8311
    Iter      log prob        ||dx||      ||grad||       alpha      alpha0  # evals  Notes 
      47       18912.1    4.4679e-05       138.113   1.549e-07       0.001      107  LS failed, Hessian reset 
      83       18912.1   7.13019e-07       75.2403      0.2705      0.2705      165   
Optimization terminated normally: 
  Convergence detected: relative gradient magnitude is below tolerance
INFO:fbprophet:Making 5 forecasts with cutoffs between 2013-10-07 00:00:00 and 2015-10-18 00:00:00
INFO:fbprophet:Applying in parallel with <concurrent.futures.process.ProcessPoolExecutor object at 0x7fc88e727d90>
Initial log joint probability = -8.95172
    Iter      log prob        ||dx||      ||grad||       alpha      alpha0  # evals  Notes 
Initial log joint probability = -12.7302
    Iter      log prob        ||dx||      ||grad||       alpha      alpha0  # evals  Notes 
Initial log joint probability = -15.1549
    Iter      log prob        ||dx||      ||grad||       alpha      alpha0  # evals  Notes 
Initial log joint probability = -18.717
    Iter      log prob        ||dx||      ||grad||       alpha      alpha0  # evals  Notes 
Initial log joint probability = -23.5879
    Iter      log prob        ||dx||      ||grad||       alpha      alpha0  # evals  Notes 
      85       4676.38    3.6244e-05       189.504    2.41e-07       0.001      141  LS failed, Hessian reset 
      99       4676.39    3.4571e-06       140.958           1           1      157   
    Iter      log prob        ||dx||      ||grad||       alpha      alpha0  # evals  Notes 
     123       4676.39   1.25352e-07       139.194      0.3469           1      188   
Optimization terminated normally: 
  Convergence detected: relative gradient magnitude is below tolerance
      99       7033.68   4.26678e-05        203.19     0.07258           1      128   
    Iter      log prob        ||dx||      ||grad||       alpha      alpha0  # evals  Notes 
     120       7033.73   4.57953e-05       138.507   3.872e-07       0.001      196  LS failed, Hessian reset 
      99       9579.96   0.000137259       146.592           1           1      131   
    Iter      log prob        ||dx||      ||grad||       alpha      alpha0  # evals  Notes 
     139       7033.73   3.07791e-07       109.035           1           1      222   
Optimization terminated normally: 
  Convergence detected: relative gradient magnitude is below tolerance
     133       9579.97    4.6855e-07       77.7234           1           1      175   
Optimization terminated normally: 
  Convergence detected: relative gradient magnitude is below tolerance
      99       11810.4   2.43067e-05       117.108      0.3221           1      131   
    Iter      log prob        ||dx||      ||grad||       alpha      alpha0  # evals  Notes 
      99       14232.2   8.81304e-05       158.298           1           1      142   
    Iter      log prob        ||dx||      ||grad||       alpha      alpha0  # evals  Notes 
     122       11810.4   0.000128466       221.765   8.457e-07       0.001      206  LS failed, Hessian reset 
     113       14232.2   4.81251e-05        148.89   5.021e-07       0.001      203  LS failed, Hessian reset 
     182       11810.4   3.30552e-07       114.531      0.4749           1      285   
Optimization terminated normally: 
  Convergence detected: relative gradient magnitude is below tolerance
     166       14232.3   1.32055e-07       95.2472     0.06355           1      278   
Optimization terminated normally: 
  Convergence detected: relative gradient magnitude is below tolerance
[I 2020-10-01 02:14:47,217] Trial 9 finished with value: 0.04615519413356951 and parameters: {'changepoint_prior_scale': 0.02936472857601443, 'seasonality_prior_scale': 0.01883798259118917, 'holidays_prior_scale': 0.07850764404512697, 'seasonality_mode': 'multiplicative', 'changepoint_range': 0.5047006898849966}. Best is trial 3 with value: 0.04098090703811677.
Initial log joint probability = -28.8311
    Iter      log prob        ||dx||      ||grad||       alpha      alpha0  # evals  Notes 
      99       18911.1   4.53818e-08       2903.25      0.2912           1      132   
    Iter      log prob        ||dx||      ||grad||       alpha      alpha0  # evals  Notes 
     103       18911.1   1.46737e-09       4089.63     0.01518      0.9215      140   
Optimization terminated normally: 
  Convergence detected: absolute parameter change was below tolerance
INFO:fbprophet:Making 5 forecasts with cutoffs between 2013-10-07 00:00:00 and 2015-10-18 00:00:00
INFO:fbprophet:Applying in parallel with <concurrent.futures.process.ProcessPoolExecutor object at 0x7fc88f39a510>
Initial log joint probability = -8.95172
    Iter      log prob        ||dx||      ||grad||       alpha      alpha0  # evals  Notes 
Initial log joint probability = -12.7302
    Iter      log prob        ||dx||      ||grad||       alpha      alpha0  # evals  Notes 
      99       4679.27   6.26545e-07       4549.34           1           1      128   
    Iter      log prob        ||dx||      ||grad||       alpha      alpha0  # evals  Notes 
Initial log joint probability = -15.1549
    Iter      log prob        ||dx||      ||grad||       alpha      alpha0  # evals  Notes 
     111       4679.27   5.35906e-09       4524.93       0.263       0.263      144   
Optimization terminated normally: 
  Convergence detected: absolute parameter change was below tolerance
Initial log joint probability = -18.717
    Iter      log prob        ||dx||      ||grad||       alpha      alpha0  # evals  Notes 
Initial log joint probability = -23.5879
    Iter      log prob        ||dx||      ||grad||       alpha      alpha0  # evals  Notes 
      60       9582.21   6.93238e-09       4415.31      0.6238      0.6238       82   
Optimization terminated normally: 
  Convergence detected: absolute parameter change was below tolerance
      79       7028.25   2.63158e-05       4090.24   6.238e-09       0.001      145  LS failed, Hessian reset 
      99       7028.39     5.988e-07       4447.87      0.6436      0.6436      167   
    Iter      log prob        ||dx||      ||grad||       alpha      alpha0  # evals  Notes 
     129        7028.4   7.61053e-07       4974.39   1.879e-10       0.001      248  LS failed, Hessian reset 
     147        7028.4   7.13029e-09       3686.14      0.2814      0.2814      271   
Optimization terminated normally: 
  Convergence detected: absolute parameter change was below tolerance
      59       11812.9   1.09005e-05       4428.46   2.445e-09       0.001      123  LS failed, Hessian reset 
      98       14232.7   2.70847e-05       4761.72     6.5e-09       0.001      155  LS failed, Hessian reset 
      99       14232.7   9.13777e-06       4350.39           1           1      156   
    Iter      log prob        ||dx||      ||grad||       alpha      alpha0  # evals  Notes 
      99       11812.9   4.01873e-08       4391.33           1           1      175   
    Iter      log prob        ||dx||      ||grad||       alpha      alpha0  # evals  Notes 
     105       11812.9    2.0501e-08       4513.43       0.265           1      182   
Optimization terminated normally: 
  Convergence detected: relative gradient magnitude is below tolerance
     123       14232.8   8.49327e-09       3930.97      0.1862      0.1862      185   
Optimization terminated normally: 
  Convergence detected: absolute parameter change was below tolerance
[I 2020-10-01 02:15:01,157] Trial 10 finished with value: 0.04132289964901337 and parameters: {'changepoint_prior_scale': 0.0011029443203629296, 'seasonality_prior_scale': 0.06811597948914272, 'holidays_prior_scale': 0.013330299090898943, 'seasonality_mode': 'additive', 'changepoint_range': 0.5642407412333263}. Best is trial 3 with value: 0.04098090703811677.
Initial log joint probability = -28.8311
    Iter      log prob        ||dx||      ||grad||       alpha      alpha0  # evals  Notes 
      93         18911   5.17062e-06        5256.1   1.165e-09       0.001      155  LS failed, Hessian reset 
      99         18911    4.5568e-07       4635.37      0.4146      0.4146      164   
    Iter      log prob        ||dx||      ||grad||       alpha      alpha0  # evals  Notes 
     108         18911    7.3653e-09       3900.46      0.1041      0.1041      174   
Optimization terminated normally: 
  Convergence detected: absolute parameter change was below tolerance
INFO:fbprophet:Making 5 forecasts with cutoffs between 2013-10-07 00:00:00 and 2015-10-18 00:00:00
INFO:fbprophet:Applying in parallel with <concurrent.futures.process.ProcessPoolExecutor object at 0x7fc88e5ecad0>
Initial log joint probability = -8.95172
    Iter      log prob        ||dx||      ||grad||       alpha      alpha0  # evals  Notes 
Initial log joint probability = -12.7302
    Iter      log prob        ||dx||      ||grad||       alpha      alpha0  # evals  Notes 
Initial log joint probability = -15.1549
    Iter      log prob        ||dx||      ||grad||       alpha      alpha0  # evals  Notes 
Initial log joint probability = -18.717
    Iter      log prob        ||dx||      ||grad||       alpha      alpha0  # evals  Notes 
Initial log joint probability = -23.5879
    Iter      log prob        ||dx||      ||grad||       alpha      alpha0  # evals  Notes 
      44       4669.55   0.000489532       3759.84   9.231e-08       0.001      101  LS failed, Hessian reset 
      99       4677.07   2.01324e-08       4811.87      0.7988     0.07988      170   
    Iter      log prob        ||dx||      ||grad||       alpha      alpha0  # evals  Notes 
     105       4677.07   8.91998e-09       4832.39      0.2981      0.2981      178   
Optimization terminated normally: 
  Convergence detected: absolute parameter change was below tolerance
      74       9582.16   5.05407e-09        4455.8      0.2138      0.2138       98   
Optimization terminated normally: 
  Convergence detected: absolute parameter change was below tolerance
      88       7028.07   1.60483e-05       5234.75   3.289e-09       0.001      169  LS failed, Hessian reset 
      99       7028.22    1.4322e-05       4544.66      0.7093      0.7093      182   
    Iter      log prob        ||dx||      ||grad||       alpha      alpha0  # evals  Notes 
     131       7028.27   5.01814e-09       4631.01      0.3094      0.3094      224   
Optimization terminated normally: 
  Convergence detected: absolute parameter change was below tolerance
      71       11812.9   7.57972e-09        4614.2      0.2573      0.2573      104   
Optimization terminated normally: 
  Convergence detected: absolute parameter change was below tolerance
      99       14233.2   2.73197e-07       4826.21      0.2648      0.2648      131   
    Iter      log prob        ||dx||      ||grad||       alpha      alpha0  # evals  Notes 
     115       14233.2   9.45124e-07        5354.5   2.002e-10       0.001      194  LS failed, Hessian reset 
     143       14233.2   1.04081e-08       3837.22      0.3103           1      228   
Optimization terminated normally: 
  Convergence detected: relative gradient magnitude is below tolerance
[I 2020-10-01 02:15:16,356] Trial 11 finished with value: 0.04140830294991291 and parameters: {'changepoint_prior_scale': 0.0010293888729177882, 'seasonality_prior_scale': 0.08621400907981504, 'holidays_prior_scale': 0.010447746941971434, 'seasonality_mode': 'additive', 'changepoint_range': 0.5761801014427418}. Best is trial 3 with value: 0.04098090703811677.
Initial log joint probability = -28.8311
    Iter      log prob        ||dx||      ||grad||       alpha      alpha0  # evals  Notes 
      80       18912.3   1.11654e-05       1012.82   1.199e-08       0.001      160  LS failed, Hessian reset 
      99       18912.3   2.18693e-06       851.464      0.8453      0.8453      183   
    Iter      log prob        ||dx||      ||grad||       alpha      alpha0  # evals  Notes 
     113       18912.3   8.29313e-08       762.044     0.07918           1      205   
Optimization terminated normally: 
  Convergence detected: relative gradient magnitude is below tolerance
INFO:fbprophet:Making 5 forecasts with cutoffs between 2013-10-07 00:00:00 and 2015-10-18 00:00:00
INFO:fbprophet:Applying in parallel with <concurrent.futures.process.ProcessPoolExecutor object at 0x7fc88f39bbd0>
Initial log joint probability = -8.95172
    Iter      log prob        ||dx||      ||grad||       alpha      alpha0  # evals  Notes 
Initial log joint probability = -12.7302
    Iter      log prob        ||dx||      ||grad||       alpha      alpha0  # evals  Notes 
Initial log joint probability = -15.1549
    Iter      log prob        ||dx||      ||grad||       alpha      alpha0  # evals  Notes 
Initial log joint probability = -18.717
    Iter      log prob        ||dx||      ||grad||       alpha      alpha0  # evals  Notes 
Initial log joint probability = -23.5879
    Iter      log prob        ||dx||      ||grad||       alpha      alpha0  # evals  Notes 
      62       4679.14   3.11096e-06       1245.68   2.561e-09       0.001      117  LS failed, Hessian reset 
      96       4679.14   5.66038e-09       1220.58      0.3607      0.3607      164   
Optimization terminated normally: 
  Convergence detected: absolute parameter change was below tolerance
      99       7031.77   1.54115e-07       1049.64           1           1      126   
    Iter      log prob        ||dx||      ||grad||       alpha      alpha0  # evals  Notes 
     104       7031.77   5.79193e-09       1182.02      0.2208      0.2208      133   
Optimization terminated normally: 
  Convergence detected: absolute parameter change was below tolerance
      70       9582.35   1.30831e-05       1158.12   9.608e-09       0.001      128  LS failed, Hessian reset 
      99       9582.36   7.72564e-08       892.396           1           1      163   
    Iter      log prob        ||dx||      ||grad||       alpha      alpha0  # evals  Notes 
     101       9582.36   3.55673e-08       763.413      0.8056      0.8056      165   
Optimization terminated normally: 
  Convergence detected: relative gradient magnitude is below tolerance
      99       11812.9   2.04315e-05       945.391      0.2996           1      131   
    Iter      log prob        ||dx||      ||grad||       alpha      alpha0  # evals  Notes 
      94       14232.6   1.96646e-07       1021.65   1.921e-10       0.001      171  LS failed, Hessian reset 
      97       14232.6   5.00075e-08       775.876      0.7549      0.7549      174   
Optimization terminated normally: 
  Convergence detected: relative gradient magnitude is below tolerance
     144         11813   5.46484e-06       979.827   4.916e-09       0.001      235  LS failed, Hessian reset 
     177         11813   5.71395e-09       1160.75      0.1067      0.1067      278   
Optimization terminated normally: 
  Convergence detected: absolute parameter change was below tolerance
