[I 2020-10-01 03:58:20,526] Trial 415 finished with value: 0.040848526828811585 and parameters: {'changepoint_prior_scale': 0.0017016536934232503, 'seasonality_prior_scale': 0.12445288377211813, 'holidays_prior_scale': 0.12796729665125367, 'seasonality_mode': 'additive', 'changepoint_range': 0.5539120240505733}. Best is trial 96 with value: 0.038883738900888705.
Initial log joint probability = -28.8311
    Iter      log prob        ||dx||      ||grad||       alpha      alpha0  # evals  Notes 
      99       18912.6   2.80723e-06       3006.32           1           1      120   
    Iter      log prob        ||dx||      ||grad||       alpha      alpha0  # evals  Notes 
     123       18912.7   1.56049e-06       3075.94   4.106e-10       0.001      187  LS failed, Hessian reset 
     140       18912.7   8.86981e-09        3132.1      0.2199      0.2199      210   
Optimization terminated normally: 
  Convergence detected: absolute parameter change was below tolerance
INFO:fbprophet:Making 5 forecasts with cutoffs between 2013-10-07 00:00:00 and 2015-10-18 00:00:00
INFO:fbprophet:Applying in parallel with <concurrent.futures.process.ProcessPoolExecutor object at 0x7fc84dbf3790>
Initial log joint probability = -8.95172
    Iter      log prob        ||dx||      ||grad||       alpha      alpha0  # evals  Notes 
Initial log joint probability = -12.7302
    Iter      log prob        ||dx||      ||grad||       alpha      alpha0  # evals  Notes 
Initial log joint probability = -15.1549
    Iter      log prob        ||dx||      ||grad||       alpha      alpha0  # evals  Notes 
Initial log joint probability = -18.717
    Iter      log prob        ||dx||      ||grad||       alpha      alpha0  # evals  Notes 
Initial log joint probability = -23.5879
    Iter      log prob        ||dx||      ||grad||       alpha      alpha0  # evals  Notes 
      88       4679.34   4.64164e-09       3694.95      0.3027      0.3027      121   
Optimization terminated normally: 
  Convergence detected: absolute parameter change was below tolerance
      99       7029.37   9.87795e-07       3541.83           1           1      131   
    Iter      log prob        ||dx||      ||grad||       alpha      alpha0  # evals  Notes 
     127       7029.38   4.73895e-09       3502.17      0.3951      0.3951      166   
Optimization terminated normally: 
  Convergence detected: absolute parameter change was below tolerance
      52       11812.9   5.99373e-09       3641.94       0.331           1       82   
Optimization terminated normally: 
  Convergence detected: absolute parameter change was below tolerance
      99       9582.11   1.45024e-08       3592.77      0.2437           1      132   
    Iter      log prob        ||dx||      ||grad||       alpha      alpha0  # evals  Notes 
     100       9582.11   2.57532e-09       3660.67      0.2417      0.2417      133   
Optimization terminated normally: 
  Convergence detected: absolute parameter change was below tolerance
      99       14232.8   2.03658e-07       3876.78      0.4061      0.4061      123   
    Iter      log prob        ||dx||      ||grad||       alpha      alpha0  # evals  Notes 
     134       14232.8   7.91569e-09       3646.27      0.4095      0.4095      165   
Optimization terminated normally: 
  Convergence detected: absolute parameter change was below tolerance
[I 2020-10-01 03:58:34,755] Trial 416 finished with value: 0.04285852801580078 and parameters: {'changepoint_prior_scale': 0.0013353947423498079, 'seasonality_prior_scale': 0.13970499535304243, 'holidays_prior_scale': 0.1505726363289224, 'seasonality_mode': 'multiplicative', 'changepoint_range': 0.5479382826512081}. Best is trial 96 with value: 0.038883738900888705.
Initial log joint probability = -28.8311
    Iter      log prob        ||dx||      ||grad||       alpha      alpha0  # evals  Notes 
      99       18912.8   6.97064e-07       2012.41      0.9013      0.9013      132   
    Iter      log prob        ||dx||      ||grad||       alpha      alpha0  # evals  Notes 
     129       18912.8   1.63238e-05       2482.78   5.857e-09       0.001      214  LS failed, Hessian reset 
     175       18912.9   1.67472e-10       2966.99   4.463e-05           1      278   
Optimization terminated normally: 
  Convergence detected: absolute parameter change was below tolerance
INFO:fbprophet:Making 5 forecasts with cutoffs between 2013-10-07 00:00:00 and 2015-10-18 00:00:00
INFO:fbprophet:Applying in parallel with <concurrent.futures.process.ProcessPoolExecutor object at 0x7fc84dc72710>
Initial log joint probability = -8.95172
    Iter      log prob        ||dx||      ||grad||       alpha      alpha0  # evals  Notes 
Initial log joint probability = -12.7302
    Iter      log prob        ||dx||      ||grad||       alpha      alpha0  # evals  Notes 
Initial log joint probability = -15.1549
    Iter      log prob        ||dx||      ||grad||       alpha      alpha0  # evals  Notes 
Initial log joint probability = -18.717
    Iter      log prob        ||dx||      ||grad||       alpha      alpha0  # evals  Notes 
Initial log joint probability = -23.5879
    Iter      log prob        ||dx||      ||grad||       alpha      alpha0  # evals  Notes 
      89       4679.13   6.57202e-09       2909.66      0.5972      0.5972      119   
Optimization terminated normally: 
  Convergence detected: absolute parameter change was below tolerance
      99       7029.89   1.57611e-07       2752.34      0.4182           1      121   
    Iter      log prob        ||dx||      ||grad||       alpha      alpha0  # evals  Notes 
     116       7029.91   5.12446e-06       2679.36   1.992e-09       0.001      181  LS failed, Hessian reset 
      57       9582.53   3.69949e-06       2834.58   1.265e-09       0.001      122  LS failed, Hessian reset 
     147       7029.94   9.30011e-09       2783.45      0.6116      0.6116      224   
Optimization terminated normally: 
  Convergence detected: absolute parameter change was below tolerance
      96       9582.54   1.30609e-08       2741.85      0.3834           1      173   
Optimization terminated normally: 
  Convergence detected: relative gradient magnitude is below tolerance
      58       11813.2   2.22695e-07       2666.47   7.975e-11       0.001      125  LS failed, Hessian reset 
      64       11813.2   1.02498e-08       2692.76      0.2969           1      134   
Optimization terminated normally: 
  Convergence detected: relative gradient magnitude is below tolerance
      99       14232.8   7.65851e-07       2526.45      0.5488      0.5488      127   
    Iter      log prob        ||dx||      ||grad||       alpha      alpha0  # evals  Notes 
     125       14232.8   6.68374e-07       2103.71   2.073e-10       0.001      199  LS failed, Hessian reset 
     144       14232.8   8.26435e-09       2457.46      0.4512      0.4512      222   
Optimization terminated normally: 
  Convergence detected: absolute parameter change was below tolerance
[I 2020-10-01 03:58:50,229] Trial 417 finished with value: 0.04086954374240367 and parameters: {'changepoint_prior_scale': 0.0018064654112796602, 'seasonality_prior_scale': 0.11670257462079645, 'holidays_prior_scale': 0.11811737591763657, 'seasonality_mode': 'additive', 'changepoint_range': 0.5644243390670936}. Best is trial 96 with value: 0.038883738900888705.
Initial log joint probability = -28.8311
    Iter      log prob        ||dx||      ||grad||       alpha      alpha0  # evals  Notes 
      99         18913   6.66416e-08       3127.31      0.2618      0.2618      128   
    Iter      log prob        ||dx||      ||grad||       alpha      alpha0  # evals  Notes 
     114         18913   1.47372e-08       3054.24      0.3903      0.3903      147   
Optimization terminated normally: 
  Convergence detected: relative gradient magnitude is below tolerance
INFO:fbprophet:Making 5 forecasts with cutoffs between 2013-10-07 00:00:00 and 2015-10-18 00:00:00
INFO:fbprophet:Applying in parallel with <concurrent.futures.process.ProcessPoolExecutor object at 0x7fc84dc72550>
Initial log joint probability = -8.95172
    Iter      log prob        ||dx||      ||grad||       alpha      alpha0  # evals  Notes 
Initial log joint probability = -12.7302
    Iter      log prob        ||dx||      ||grad||       alpha      alpha0  # evals  Notes 
Initial log joint probability = -15.1549
    Iter      log prob        ||dx||      ||grad||       alpha      alpha0  # evals  Notes 
Initial log joint probability = -18.717
    Iter      log prob        ||dx||      ||grad||       alpha      alpha0  # evals  Notes 
Initial log joint probability = -23.5879
    Iter      log prob        ||dx||      ||grad||       alpha      alpha0  # evals  Notes 
      81       4679.38   3.84205e-09       3118.04      0.3796           1      117   
Optimization terminated normally: 
  Convergence detected: absolute parameter change was below tolerance
      99       7029.65   2.03442e-06       2727.13      0.7645      0.7645      122   
    Iter      log prob        ||dx||      ||grad||       alpha      alpha0  # evals  Notes 
     154       7031.64   4.95534e-05          3189   1.508e-08       0.001      234  LS failed, Hessian reset 
      97       9582.51   1.25639e-05       3009.03   3.699e-09       0.001      167  LS failed, Hessian reset 
      99       9582.52   5.81832e-06       2584.68           1           1      169   
    Iter      log prob        ||dx||      ||grad||       alpha      alpha0  # evals  Notes 
     185       7031.86   8.86113e-09       3212.92      0.2036      0.2036      271   
Optimization terminated normally: 
  Convergence detected: absolute parameter change was below tolerance
      78       11813.3   2.19075e-07       3242.18   6.792e-11       0.001      153  LS failed, Hessian reset 
     134       9582.53   4.80917e-09       2838.99      0.3501      0.3501      218   
Optimization terminated normally: 
  Convergence detected: absolute parameter change was below tolerance
      96       11813.3   6.33429e-09       3209.67     0.05541           1      177   
Optimization terminated normally: 
  Convergence detected: absolute parameter change was below tolerance
      99       14232.7   0.000685989        3070.3           1           1      133   
    Iter      log prob        ||dx||      ||grad||       alpha      alpha0  # evals  Notes 
     192         14233   3.89953e-06       3309.41   1.244e-09       0.001      291  LS failed, Hessian reset 
     199         14233   2.23564e-06       3255.49           1           1      298   
    Iter      log prob        ||dx||      ||grad||       alpha      alpha0  # evals  Notes 
     215         14233   1.03532e-06       3391.95   3.327e-10       0.001      349  LS failed, Hessian reset 
     229         14233   7.37212e-09       3190.47      0.4911      0.4911      366   
Optimization terminated normally: 
  Convergence detected: absolute parameter change was below tolerance
[I 2020-10-01 03:59:06,164] Trial 418 finished with value: 0.04186050870464012 and parameters: {'changepoint_prior_scale': 0.001555911540663452, 'seasonality_prior_scale': 0.18144204397705443, 'holidays_prior_scale': 0.11910391864653117, 'seasonality_mode': 'additive', 'changepoint_range': 0.5447589838191171}. Best is trial 96 with value: 0.038883738900888705.
Initial log joint probability = -28.8311
    Iter      log prob        ||dx||      ||grad||       alpha      alpha0  # evals  Notes 
      99       18912.8   1.83643e-07       3808.98      0.7101      0.7101      134   
    Iter      log prob        ||dx||      ||grad||       alpha      alpha0  # evals  Notes 
     105       18912.8   8.05665e-09        3953.6      0.1867      0.1867      142   
Optimization terminated normally: 
  Convergence detected: absolute parameter change was below tolerance
INFO:fbprophet:Making 5 forecasts with cutoffs between 2013-10-07 00:00:00 and 2015-10-18 00:00:00
INFO:fbprophet:Applying in parallel with <concurrent.futures.process.ProcessPoolExecutor object at 0x7fc84dcafc10>
Initial log joint probability = -8.95172
    Iter      log prob        ||dx||      ||grad||       alpha      alpha0  # evals  Notes 
Initial log joint probability = -12.7302
    Iter      log prob        ||dx||      ||grad||       alpha      alpha0  # evals  Notes 
Initial log joint probability = -15.1549
    Iter      log prob        ||dx||      ||grad||       alpha      alpha0  # evals  Notes 
Initial log joint probability = -18.717
    Iter      log prob        ||dx||      ||grad||       alpha      alpha0  # evals  Notes 
      56       4679.29   4.23472e-09       3732.03      0.3686      0.3686       77   
Optimization terminated normally: 
  Convergence detected: absolute parameter change was below tolerance
Initial log joint probability = -23.5879
    Iter      log prob        ||dx||      ||grad||       alpha      alpha0  # evals  Notes 
      99       7029.07   2.93423e-06       3226.44      0.3393      0.3393      132   
    Iter      log prob        ||dx||      ||grad||       alpha      alpha0  # evals  Notes 
      58       9582.41   7.70362e-09       3725.38      0.3175      0.3175       86   
Optimization terminated normally: 
  Convergence detected: absolute parameter change was below tolerance
      55       11813.1   5.77716e-09       3727.11      0.2158      0.2158       81   
Optimization terminated normally: 
  Convergence detected: absolute parameter change was below tolerance
     144       7029.09   5.51011e-09       3209.12       0.406       0.406      187   
Optimization terminated normally: 
  Convergence detected: absolute parameter change was below tolerance
      76       14231.8   0.000219461       3083.75   5.321e-08       0.001      146  LS failed, Hessian reset 
      99       14232.6   2.01676e-05       3635.96           1           1      176   
    Iter      log prob        ||dx||      ||grad||       alpha      alpha0  # evals  Notes 
     153       14232.9   7.74551e-09       3410.74      0.2703      0.2703      244   
Optimization terminated normally: 
  Convergence detected: absolute parameter change was below tolerance
[I 2020-10-01 03:59:21,775] Trial 419 finished with value: 0.0409695139913157 and parameters: {'changepoint_prior_scale': 0.0012644108387803081, 'seasonality_prior_scale': 0.13887213481951274, 'holidays_prior_scale': 0.17733852285565405, 'seasonality_mode': 'additive', 'changepoint_range': 0.5893656902086556}. Best is trial 96 with value: 0.038883738900888705.
Initial log joint probability = -28.8311
    Iter      log prob        ||dx||      ||grad||       alpha      alpha0  # evals  Notes 
      99       18912.8    1.3178e-08       3022.87      0.2893      0.2893      123   
    Iter      log prob        ||dx||      ||grad||       alpha      alpha0  # evals  Notes 
     102       18912.8   1.74309e-08       3385.13      0.2248           1      128   
Optimization terminated normally: 
  Convergence detected: relative gradient magnitude is below tolerance
INFO:fbprophet:Making 5 forecasts with cutoffs between 2013-10-07 00:00:00 and 2015-10-18 00:00:00
INFO:fbprophet:Applying in parallel with <concurrent.futures.process.ProcessPoolExecutor object at 0x7fc84dc92f90>
Initial log joint probability = -8.95172
    Iter      log prob        ||dx||      ||grad||       alpha      alpha0  # evals  Notes 
Initial log joint probability = -12.7302
    Iter      log prob        ||dx||      ||grad||       alpha      alpha0  # evals  Notes 
      96       4679.02   5.76485e-09       3211.66      0.1747      0.1747      128   
Optimization terminated normally: 
  Convergence detected: absolute parameter change was below tolerance
Initial log joint probability = -15.1549
    Iter      log prob        ||dx||      ||grad||       alpha      alpha0  # evals  Notes 
Initial log joint probability = -18.717
    Iter      log prob        ||dx||      ||grad||       alpha      alpha0  # evals  Notes 
      47       7028.54   7.12196e-05       3284.47   2.063e-08       0.001      103  LS failed, Hessian reset 
Initial log joint probability = -23.5879
    Iter      log prob        ||dx||      ||grad||       alpha      alpha0  # evals  Notes 
      95       7028.91   9.18837e-09       3703.04      0.2968           1      161   
Optimization terminated normally: 
  Convergence detected: absolute parameter change was below tolerance
      69       9582.42   4.31937e-09       3421.27      0.5956      0.5956       95   
Optimization terminated normally: 
  Convergence detected: absolute parameter change was below tolerance
      42       11811.9   0.000358863       3506.33    1.04e-07       0.001      104  LS failed, Hessian reset 
      99       14233.2    5.5758e-08       3395.91           1           1      131   
    Iter      log prob        ||dx||      ||grad||       alpha      alpha0  # evals  Notes 
     106       14233.2   8.42598e-09       3125.81      0.5439      0.5439      139   
Optimization terminated normally: 
  Convergence detected: absolute parameter change was below tolerance
      88         11813   2.51895e-05       3484.01   7.209e-09       0.001      208  LS failed, Hessian reset 
      99       11813.1   1.18435e-06       3487.71      0.2559           1      223   
    Iter      log prob        ||dx||      ||grad||       alpha      alpha0  # evals  Notes 
     144       11813.1   1.59564e-06       3360.56   4.612e-10       0.001      326  LS failed, Hessian reset 
     163       11813.1   9.06695e-09       3402.61      0.8283      0.8283      351   
Optimization terminated normally: 
  Convergence detected: absolute parameter change was below tolerance
[I 2020-10-01 03:59:36,750] Trial 420 finished with value: 0.04064464621174089 and parameters: {'changepoint_prior_scale': 0.0014332102792934916, 'seasonality_prior_scale': 0.1044906415212765, 'holidays_prior_scale': 0.14912602771998537, 'seasonality_mode': 'additive', 'changepoint_range': 0.5728926547414406}. Best is trial 96 with value: 0.038883738900888705.
Initial log joint probability = -28.8311
    Iter      log prob        ||dx||      ||grad||       alpha      alpha0  # evals  Notes 
      99       18912.8   1.29874e-06       1888.08      0.2695      0.2695      132   
    Iter      log prob        ||dx||      ||grad||       alpha      alpha0  # evals  Notes 
     111       18912.9    1.1722e-05       2299.68   3.708e-09       0.001      186  LS failed, Hessian reset 
     148       18912.9   3.16448e-08       2176.12           1           1      230   
Optimization terminated normally: 
  Convergence detected: relative gradient magnitude is below tolerance
INFO:fbprophet:Making 5 forecasts with cutoffs between 2013-10-07 00:00:00 and 2015-10-18 00:00:00
INFO:fbprophet:Applying in parallel with <concurrent.futures.process.ProcessPoolExecutor object at 0x7fc84dc72710>
Initial log joint probability = -8.95172
    Iter      log prob        ||dx||      ||grad||       alpha      alpha0  # evals  Notes 
Initial log joint probability = -12.7302
    Iter      log prob        ||dx||      ||grad||       alpha      alpha0  # evals  Notes 
Initial log joint probability = -15.1549
    Iter      log prob        ||dx||      ||grad||       alpha      alpha0  # evals  Notes 
Initial log joint probability = -18.717
    Iter      log prob        ||dx||      ||grad||       alpha      alpha0  # evals  Notes 
Initial log joint probability = -23.5879
    Iter      log prob        ||dx||      ||grad||       alpha      alpha0  # evals  Notes 
      54          4678   0.000555229       2854.38   2.252e-07       0.001      132  LS failed, Hessian reset 
      99       4679.12   3.68698e-07       2418.37       2.075      0.2075      192   
    Iter      log prob        ||dx||      ||grad||       alpha      alpha0  # evals  Notes 
     115       4679.12   9.04788e-09       2569.62           1           1      213   
Optimization terminated normally: 
  Convergence detected: absolute parameter change was below tolerance
      99       7029.85   3.75279e-07       2674.55       0.984       0.984      122   
    Iter      log prob        ||dx||      ||grad||       alpha      alpha0  # evals  Notes 
     114       7029.97   3.10042e-05       2483.54   9.918e-09       0.001      187  LS failed, Hessian reset 
      57       9582.51   1.93772e-06       2631.92   7.669e-10       0.001      121  LS failed, Hessian reset 
      68       11813.2   5.41026e-09       2421.74      0.2962      0.2962       99   
Optimization terminated normally: 
  Convergence detected: absolute parameter change was below tolerance
     154       7030.07   7.43729e-09       2152.85        0.34        0.34      235   
Optimization terminated normally: 
  Convergence detected: absolute parameter change was below tolerance
      82       9582.52   2.54421e-09       2543.31      0.2034      0.2034      153   
Optimization terminated normally: 
  Convergence detected: absolute parameter change was below tolerance
      99       14232.8   3.51932e-05       2677.55   1.522e-08       0.001      178  LS failed, Hessian reset 
    Iter      log prob        ||dx||      ||grad||       alpha      alpha0  # evals  Notes 
     166       14233.1   1.17217e-08       2263.94      0.3078           1      260   
Optimization terminated normally: 
  Convergence detected: relative gradient magnitude is below tolerance
