[I 2020-10-01 02:25:07,032] Trial 49 finished with value: 0.04969439937302006 and parameters: {'changepoint_prior_scale': 0.1414622501171402, 'seasonality_prior_scale': 0.08685201323708912, 'holidays_prior_scale': 0.05859413891079937, 'seasonality_mode': 'additive', 'changepoint_range': 0.6856307259793439}. Best is trial 3 with value: 0.04098090703811677.
Initial log joint probability = -28.8311
    Iter      log prob        ||dx||      ||grad||       alpha      alpha0  # evals  Notes 
      99       18912.1   1.00958e-06       1094.64      0.6514      0.6514      140   
    Iter      log prob        ||dx||      ||grad||       alpha      alpha0  # evals  Notes 
     130       18912.1   6.47338e-08       911.529      0.1892           1      186   
Optimization terminated normally: 
  Convergence detected: relative gradient magnitude is below tolerance
INFO:fbprophet:Making 5 forecasts with cutoffs between 2013-10-07 00:00:00 and 2015-10-18 00:00:00
INFO:fbprophet:Applying in parallel with <concurrent.futures.process.ProcessPoolExecutor object at 0x7fc88e664290>
Initial log joint probability = -8.95172
    Iter      log prob        ||dx||      ||grad||       alpha      alpha0  # evals  Notes 
Initial log joint probability = -12.7302
    Iter      log prob        ||dx||      ||grad||       alpha      alpha0  # evals  Notes 
Initial log joint probability = -15.1549
    Iter      log prob        ||dx||      ||grad||       alpha      alpha0  # evals  Notes 
Initial log joint probability = -18.717
    Iter      log prob        ||dx||      ||grad||       alpha      alpha0  # evals  Notes 
Initial log joint probability = -23.5879
      70       4679.05   8.14809e-09       1314.98      0.3393      0.3393       95   
Optimization terminated normally: 
  Convergence detected: absolute parameter change was below tolerance
    Iter      log prob        ||dx||      ||grad||       alpha      alpha0  # evals  Notes 
      99       7031.21    6.3233e-07       1408.38      0.3928           1      130   
    Iter      log prob        ||dx||      ||grad||       alpha      alpha0  # evals  Notes 
     115       7031.21   8.84393e-09        1396.8      0.3073      0.3073      151   
Optimization terminated normally: 
  Convergence detected: absolute parameter change was below tolerance
      97       9582.01   6.25999e-10       1335.49   0.0007258      0.2749      136   
Optimization terminated normally: 
  Convergence detected: absolute parameter change was below tolerance
      99       11812.6   5.73617e-07       931.314           1           1      131   
    Iter      log prob        ||dx||      ||grad||       alpha      alpha0  # evals  Notes 
      99       14232.7   0.000103893       1251.49           1           1      127   
    Iter      log prob        ||dx||      ||grad||       alpha      alpha0  # evals  Notes 
     122       11812.6   6.33935e-06        1047.2   4.295e-09       0.001      196  LS failed, Hessian reset 
     106       14232.8    5.1871e-05       1535.53   4.028e-08       0.001      176  LS failed, Hessian reset 
     170       11812.6   7.30274e-08       1011.34      0.3848      0.3848      264   
Optimization terminated normally: 
  Convergence detected: relative gradient magnitude is below tolerance
     192       14232.9    1.6238e-08       1173.57       0.277           1      290   
Optimization terminated normally: 
  Convergence detected: relative gradient magnitude is below tolerance
[I 2020-10-01 02:25:23,697] Trial 50 finished with value: 0.042863781626600816 and parameters: {'changepoint_prior_scale': 0.003502264070732633, 'seasonality_prior_scale': 0.05743930155875195, 'holidays_prior_scale': 0.015823135072167427, 'seasonality_mode': 'multiplicative', 'changepoint_range': 0.61426020476741}. Best is trial 3 with value: 0.04098090703811677.
Initial log joint probability = -28.8311
    Iter      log prob        ||dx||      ||grad||       alpha      alpha0  # evals  Notes 
      99       18911.2   6.66505e-07       4286.49      0.8321      0.8321      124   
    Iter      log prob        ||dx||      ||grad||       alpha      alpha0  # evals  Notes 
     147       18911.5   5.88748e-09       3999.09      0.4034      0.4034      185   
Optimization terminated normally: 
  Convergence detected: absolute parameter change was below tolerance
INFO:fbprophet:Making 5 forecasts with cutoffs between 2013-10-07 00:00:00 and 2015-10-18 00:00:00
INFO:fbprophet:Applying in parallel with <concurrent.futures.process.ProcessPoolExecutor object at 0x7fc88e6d4410>
Initial log joint probability = -8.95172
    Iter      log prob        ||dx||      ||grad||       alpha      alpha0  # evals  Notes 
Initial log joint probability = -12.7302
    Iter      log prob        ||dx||      ||grad||       alpha      alpha0  # evals  Notes 
Initial log joint probability = -15.1549
    Iter      log prob        ||dx||      ||grad||       alpha      alpha0  # evals  Notes 
Initial log joint probability = -18.717
    Iter      log prob        ||dx||      ||grad||       alpha      alpha0  # evals  Notes 
Initial log joint probability = -23.5879
    Iter      log prob        ||dx||      ||grad||       alpha      alpha0  # evals  Notes 
      60       4677.37   2.60432e-05       4258.43   6.222e-09       0.001      119  LS failed, Hessian reset 
      56       7026.33   9.16724e-05       3820.55   2.168e-08       0.001      103  LS failed, Hessian reset 
      96       4677.44   9.43716e-08        4052.5    2.15e-11       0.001      201  LS failed, Hessian reset 
      99       4677.44   3.66412e-09       3757.41      0.2941      0.2941      205   
Optimization terminated normally: 
  Convergence detected: absolute parameter change was below tolerance
      99       7026.68   2.66482e-07       3736.92      0.6159      0.6159      158   
    Iter      log prob        ||dx||      ||grad||       alpha      alpha0  # evals  Notes 
      66       9579.79   6.42062e-05       4119.85   1.586e-08       0.001      126  LS failed, Hessian reset 
      64       11811.6   5.83054e-09       4060.27      0.6447      0.6447       95   
Optimization terminated normally: 
  Convergence detected: absolute parameter change was below tolerance
     137       7026.97   2.30937e-05       4153.65   5.313e-09       0.001      249  LS failed, Hessian reset 
      99       9580.08   2.28802e-06       4014.12           1           1      168   
    Iter      log prob        ||dx||      ||grad||       alpha      alpha0  # evals  Notes 
     122       9580.09   7.74194e-09       3974.84      0.3316      0.3316      197   
Optimization terminated normally: 
  Convergence detected: absolute parameter change was below tolerance
      99       14231.3   5.64248e-07       3874.44           1           1      123   
    Iter      log prob        ||dx||      ||grad||       alpha      alpha0  # evals  Notes 
     180        7027.1   2.37238e-06       3822.97    6.05e-10       0.001      343  LS failed, Hessian reset 
     199       7027.11   7.40886e-08       3132.79           1           1      366   
    Iter      log prob        ||dx||      ||grad||       alpha      alpha0  # evals  Notes 
     111       14231.3    7.2224e-09       3736.08      0.5417      0.5417      137   
Optimization terminated normally: 
  Convergence detected: absolute parameter change was below tolerance
     211       7027.11   6.77014e-09       3813.98      0.7118      0.7118      380   
Optimization terminated normally: 
  Convergence detected: absolute parameter change was below tolerance
[I 2020-10-01 02:25:39,390] Trial 51 finished with value: 0.04086711905674389 and parameters: {'changepoint_prior_scale': 0.001207455991973145, 'seasonality_prior_scale': 0.022705169547508803, 'holidays_prior_scale': 3.2665716388588417, 'seasonality_mode': 'additive', 'changepoint_range': 0.637142894358298}. Best is trial 51 with value: 0.04086711905674389.
Initial log joint probability = -28.8311
    Iter      log prob        ||dx||      ||grad||       alpha      alpha0  # evals  Notes 
      99       18911.4   5.13768e-08       2779.55           1           1      125   
    Iter      log prob        ||dx||      ||grad||       alpha      alpha0  # evals  Notes 
     104       18911.4   4.60294e-08       2854.87       0.363           1      131   
Optimization terminated normally: 
  Convergence detected: relative gradient magnitude is below tolerance
INFO:fbprophet:Making 5 forecasts with cutoffs between 2013-10-07 00:00:00 and 2015-10-18 00:00:00
INFO:fbprophet:Applying in parallel with <concurrent.futures.process.ProcessPoolExecutor object at 0x7fc88e6d4b90>
Initial log joint probability = -8.95172
    Iter      log prob        ||dx||      ||grad||       alpha      alpha0  # evals  Notes 
Initial log joint probability = -12.7302
    Iter      log prob        ||dx||      ||grad||       alpha      alpha0  # evals  Notes 
Initial log joint probability = -15.1549
    Iter      log prob        ||dx||      ||grad||       alpha      alpha0  # evals  Notes 
      79       4678.01   1.79252e-05        2799.7   6.457e-09       0.001      159  LS failed, Hessian reset 
Initial log joint probability = -18.717
    Iter      log prob        ||dx||      ||grad||       alpha      alpha0  # evals  Notes 
Initial log joint probability = -23.5879
      99       4678.06    4.2893e-07       2748.33           1           1      185   
    Iter      log prob        ||dx||      ||grad||       alpha      alpha0  # evals  Notes 
    Iter      log prob        ||dx||      ||grad||       alpha      alpha0  # evals  Notes 
      99       7028.58   0.000142963       2838.96           1           1      122   
    Iter      log prob        ||dx||      ||grad||       alpha      alpha0  # evals  Notes 
     135       4678.07   8.59613e-09       2747.19           1           1      232   
Optimization terminated normally: 
  Convergence detected: absolute parameter change was below tolerance
     164       7030.35   8.61603e-09       2763.51      0.2499      0.8819      200   
Optimization terminated normally: 
  Convergence detected: absolute parameter change was below tolerance
      87       9580.87   1.04038e-06       2533.44   3.537e-10       0.001      165  LS failed, Hessian reset 
      66       11811.1   1.19513e-08       2811.93      0.3493           1       95   
Optimization terminated normally: 
  Convergence detected: relative gradient magnitude is below tolerance
      98       9580.87   9.49987e-09        2630.6      0.1778      0.1778      180   
Optimization terminated normally: 
  Convergence detected: absolute parameter change was below tolerance
      99       14231.2    4.3145e-05       2515.11     0.05553           1      125   
    Iter      log prob        ||dx||      ||grad||       alpha      alpha0  # evals  Notes 
     170       14231.7   3.74571e-09        2614.7      0.1479      0.1479      211   
Optimization terminated normally: 
  Convergence detected: absolute parameter change was below tolerance
[I 2020-10-01 02:25:53,778] Trial 52 finished with value: 0.04197889054623588 and parameters: {'changepoint_prior_scale': 0.0018094924480331637, 'seasonality_prior_scale': 0.021946489970746125, 'holidays_prior_scale': 7.380690987902025, 'seasonality_mode': 'additive', 'changepoint_range': 0.6375691167561504}. Best is trial 51 with value: 0.04086711905674389.
Initial log joint probability = -28.8311
    Iter      log prob        ||dx||      ||grad||       alpha      alpha0  # evals  Notes 
      99       18911.7   5.56944e-06       3698.42      0.6931      0.6931      121   
    Iter      log prob        ||dx||      ||grad||       alpha      alpha0  # evals  Notes 
     140       18911.9   2.53917e-08       3496.72      0.8748      0.8748      172   
Optimization terminated normally: 
  Convergence detected: relative gradient magnitude is below tolerance
INFO:fbprophet:Making 5 forecasts with cutoffs between 2013-10-07 00:00:00 and 2015-10-18 00:00:00
INFO:fbprophet:Applying in parallel with <concurrent.futures.process.ProcessPoolExecutor object at 0x7fc88e5ec750>
Initial log joint probability = -8.95172
    Iter      log prob        ||dx||      ||grad||       alpha      alpha0  # evals  Notes 
Initial log joint probability = -12.7302
    Iter      log prob        ||dx||      ||grad||       alpha      alpha0  # evals  Notes 
Initial log joint probability = -15.1549
    Iter      log prob        ||dx||      ||grad||       alpha      alpha0  # evals  Notes 
Initial log joint probability = -18.717
    Iter      log prob        ||dx||      ||grad||       alpha      alpha0  # evals  Notes 
Initial log joint probability = -23.5879
    Iter      log prob        ||dx||      ||grad||       alpha      alpha0  # evals  Notes 
      99       4677.31   1.50788e-06        3663.8      0.9259      0.9259      135   
    Iter      log prob        ||dx||      ||grad||       alpha      alpha0  # evals  Notes 
     118       4677.31   9.18636e-09       3598.68      0.3748      0.3748      159   
Optimization terminated normally: 
  Convergence detected: absolute parameter change was below tolerance
      83       7027.77    3.7957e-05       3495.09   1.073e-08       0.001      152  LS failed, Hessian reset 
      99       7027.89    1.7429e-06       3100.36           1           1      169   
    Iter      log prob        ||dx||      ||grad||       alpha      alpha0  # evals  Notes 
      79       9581.52   3.42026e-09       3584.77      0.3548      0.3548      109   
Optimization terminated normally: 
  Convergence detected: absolute parameter change was below tolerance
      73       11812.2    9.5404e-09       3753.82      0.3368      0.3368      100   
Optimization terminated normally: 
  Convergence detected: absolute parameter change was below tolerance
     127        7027.9   3.26123e-07        3850.8   8.643e-11       0.001      251  LS failed, Hessian reset 
     138        7027.9   7.42667e-09       2778.76      0.3081           1      266   
Optimization terminated normally: 
  Convergence detected: absolute parameter change was below tolerance
      99       14229.5   4.14761e-05       3708.65      0.3591      0.3591      124   
    Iter      log prob        ||dx||      ||grad||       alpha      alpha0  # evals  Notes 
     117       14229.6   1.98005e-05       3813.58   5.471e-09       0.001      181  LS failed, Hessian reset 
     152       14229.7   6.98882e-09       3582.18      0.4766      0.4766      235   
Optimization terminated normally: 
  Convergence detected: absolute parameter change was below tolerance
[I 2020-10-01 02:26:09,195] Trial 53 finished with value: 0.041098505813139376 and parameters: {'changepoint_prior_scale': 0.0013594556389320196, 'seasonality_prior_scale': 0.028468955546631612, 'holidays_prior_scale': 4.643380071321883, 'seasonality_mode': 'additive', 'changepoint_range': 0.6086895207860263}. Best is trial 51 with value: 0.04086711905674389.
Initial log joint probability = -28.8311
    Iter      log prob        ||dx||      ||grad||       alpha      alpha0  # evals  Notes 
      99         18912    1.9315e-05        3228.6       3.651      0.3651      125   
    Iter      log prob        ||dx||      ||grad||       alpha      alpha0  # evals  Notes 
     144       18912.1   9.37051e-07       3830.61   2.347e-10       0.001      229  LS failed, Hessian reset 
     159       18912.2   1.24394e-08       3801.05      0.3787           1      247   
Optimization terminated normally: 
  Convergence detected: relative gradient magnitude is below tolerance
INFO:fbprophet:Making 5 forecasts with cutoffs between 2013-10-07 00:00:00 and 2015-10-18 00:00:00
INFO:fbprophet:Applying in parallel with <concurrent.futures.process.ProcessPoolExecutor object at 0x7fc88e5ecbd0>
Initial log joint probability = -8.95172
    Iter      log prob        ||dx||      ||grad||       alpha      alpha0  # evals  Notes 
Initial log joint probability = -12.7302
    Iter      log prob        ||dx||      ||grad||       alpha      alpha0  # evals  Notes 
Initial log joint probability = -15.1549
    Iter      log prob        ||dx||      ||grad||       alpha      alpha0  # evals  Notes 
Initial log joint probability = -18.717
    Iter      log prob        ||dx||      ||grad||       alpha      alpha0  # evals  Notes 
      59        4678.6   7.18983e-09       3733.59      0.2598      0.2598       84   
Optimization terminated normally: 
  Convergence detected: absolute parameter change was below tolerance
Initial log joint probability = -23.5879
    Iter      log prob        ||dx||      ||grad||       alpha      alpha0  # evals  Notes 
      63       7027.68   0.000162091       3487.72   3.784e-08       0.001      119  LS failed, Hessian reset 
      61       9581.85   9.40418e-09        3832.2      0.2522      0.2522       84   
Optimization terminated normally: 
  Convergence detected: absolute parameter change was below tolerance
      99          7028   7.56654e-07       3827.21           1           1      167   
    Iter      log prob        ||dx||      ||grad||       alpha      alpha0  # evals  Notes 
     122          7028   7.03539e-09       3860.31       0.793       0.793      198   
Optimization terminated normally: 
  Convergence detected: absolute parameter change was below tolerance
      78       11812.5   8.38935e-09        3694.6      0.4396           1      117   
Optimization terminated normally: 
  Convergence detected: absolute parameter change was below tolerance
      99       14231.9    0.00014265        3751.8      0.8581      0.8581      128   
    Iter      log prob        ||dx||      ||grad||       alpha      alpha0  # evals  Notes 
     183       14232.4   7.17199e-09       3165.91      0.3219      0.3219      232   
Optimization terminated normally: 
  Convergence detected: absolute parameter change was below tolerance
[I 2020-10-01 02:26:25,276] Trial 54 finished with value: 0.04153159552704748 and parameters: {'changepoint_prior_scale': 0.0012877836338501954, 'seasonality_prior_scale': 0.03690937191011707, 'holidays_prior_scale': 2.7129262829038394, 'seasonality_mode': 'additive', 'changepoint_range': 0.6606813489793137}. Best is trial 51 with value: 0.04086711905674389.
Initial log joint probability = -28.8311
    Iter      log prob        ||dx||      ||grad||       alpha      alpha0  # evals  Notes 
      99         18911   0.000144365       4367.29           1           1      118   
    Iter      log prob        ||dx||      ||grad||       alpha      alpha0  # evals  Notes 
     154       18911.3   7.77608e-06       4359.07   1.461e-09       0.001      225  LS failed, Hessian reset 
     192       18911.4   8.64807e-09        4631.7       0.314      0.8402      274   
Optimization terminated normally: 
  Convergence detected: absolute parameter change was below tolerance
INFO:fbprophet:Making 5 forecasts with cutoffs between 2013-10-07 00:00:00 and 2015-10-18 00:00:00
INFO:fbprophet:Applying in parallel with <concurrent.futures.process.ProcessPoolExecutor object at 0x7fc88e6b7750>
Initial log joint probability = -8.95172
    Iter      log prob        ||dx||      ||grad||       alpha      alpha0  # evals  Notes 
Initial log joint probability = -12.7302
    Iter      log prob        ||dx||      ||grad||       alpha      alpha0  # evals  Notes 
Initial log joint probability = -15.1549
    Iter      log prob        ||dx||      ||grad||       alpha      alpha0  # evals  Notes 
Initial log joint probability = -18.717
    Iter      log prob        ||dx||      ||grad||       alpha      alpha0  # evals  Notes 
      62       4678.06   9.23253e-09       4925.22     0.08174           1       84   
Optimization terminated normally: 
  Convergence detected: absolute parameter change was below tolerance
Initial log joint probability = -23.5879
    Iter      log prob        ||dx||      ||grad||       alpha      alpha0  # evals  Notes 
      75        7026.5   3.55541e-05       4875.51   7.338e-09       0.001      134  LS failed, Hessian reset 
      44       9580.85   1.46549e-05       4970.89   3.071e-09       0.001      103  LS failed, Hessian reset 
      99       7026.67   1.52924e-07       4572.96           1           1      164   
    Iter      log prob        ||dx||      ||grad||       alpha      alpha0  # evals  Notes 
      53       11811.7   8.18385e-09       4837.71      0.1345      0.3017       82   
Optimization terminated normally: 
  Convergence detected: absolute parameter change was below tolerance
     138       7026.68   8.55927e-09       4251.97      0.1826      0.1826      219   
Optimization terminated normally: 
  Convergence detected: absolute parameter change was below tolerance
      90          9581   7.51833e-09       4679.12      0.3773      0.3773      166   
Optimization terminated normally: 
  Convergence detected: absolute parameter change was below tolerance
      99       14231.6   4.35009e-06       4861.63           1           1      129   
    Iter      log prob        ||dx||      ||grad||       alpha      alpha0  # evals  Notes 
     105       14231.8   1.92924e-05       5049.23   3.821e-09       0.001      172  LS failed, Hessian reset 
     128       14231.9   5.84637e-07       4851.95   1.144e-10       0.001      238  LS failed, Hessian reset 
     162       14231.9   5.15361e-09       4479.38      0.1847      0.1847      282   
Optimization terminated normally: 
  Convergence detected: absolute parameter change was below tolerance
