[I 2020-10-01 03:53:48,121] Trial 397 finished with value: 0.04212337243530022 and parameters: {'changepoint_prior_scale': 0.002280232366089368, 'seasonality_prior_scale': 0.15202988541515094, 'holidays_prior_scale': 0.20924468426829856, 'seasonality_mode': 'additive', 'changepoint_range': 0.5008142383078414}. Best is trial 96 with value: 0.038883738900888705.
Initial log joint probability = -28.8311
    Iter      log prob        ||dx||      ||grad||       alpha      alpha0  # evals  Notes 
      99       18911.8   1.80279e-06       5037.53           1           1      116   
    Iter      log prob        ||dx||      ||grad||       alpha      alpha0  # evals  Notes 
     149         18912   1.04829e-08       4168.97      0.6006      0.6006      175   
Optimization terminated normally: 
  Convergence detected: relative gradient magnitude is below tolerance
INFO:fbprophet:Making 5 forecasts with cutoffs between 2013-10-07 00:00:00 and 2015-10-18 00:00:00
INFO:fbprophet:Applying in parallel with <concurrent.futures.process.ProcessPoolExecutor object at 0x7fc84dc78210>
Initial log joint probability = -8.95172
    Iter      log prob        ||dx||      ||grad||       alpha      alpha0  # evals  Notes 
Initial log joint probability = -12.7302
    Iter      log prob        ||dx||      ||grad||       alpha      alpha0  # evals  Notes 
Initial log joint probability = -15.1549
    Iter      log prob        ||dx||      ||grad||       alpha      alpha0  # evals  Notes 
Initial log joint probability = -18.717
    Iter      log prob        ||dx||      ||grad||       alpha      alpha0  # evals  Notes 
Initial log joint probability = -23.5879
    Iter      log prob        ||dx||      ||grad||       alpha      alpha0  # evals  Notes 
      75       4678.64   5.98354e-09       4954.79      0.5259           1      107   
Optimization terminated normally: 
  Convergence detected: absolute parameter change was below tolerance
      85       7027.79   2.92237e-05       4940.98   6.115e-09       0.001      150  LS failed, Hessian reset 
      50       9582.32   4.94474e-05       4785.52   9.775e-09       0.001      101  LS failed, Hessian reset 
      99        7027.9   3.24789e-07       4676.19      0.4436      0.4436      166   
    Iter      log prob        ||dx||      ||grad||       alpha      alpha0  # evals  Notes 
      32         11812   0.000378211       4986.87   7.631e-08       0.001       86  LS failed, Hessian reset 
     122       7027.91   9.78624e-09        4430.1      0.4976      0.4976      194   
Optimization terminated normally: 
  Convergence detected: absolute parameter change was below tolerance
      86       9582.46    1.2683e-09       4555.27      0.1573      0.1573      149   
Optimization terminated normally: 
  Convergence detected: absolute parameter change was below tolerance
      72       11813.2   7.84282e-09        5121.2      0.4857      0.4857      136   
Optimization terminated normally: 
  Convergence detected: absolute parameter change was below tolerance
      99         14233   7.19532e-06       4787.46           1           1      124   
    Iter      log prob        ||dx||      ||grad||       alpha      alpha0  # evals  Notes 
     136       14233.4    9.4116e-09       4898.82      0.1761      0.1761      167   
Optimization terminated normally: 
  Convergence detected: absolute parameter change was below tolerance
[I 2020-10-01 03:54:03,217] Trial 398 finished with value: 0.04114446789330475 and parameters: {'changepoint_prior_scale': 0.0010028076039344212, 'seasonality_prior_scale': 0.19621813473004054, 'holidays_prior_scale': 0.13848045615785115, 'seasonality_mode': 'additive', 'changepoint_range': 0.5168308093476721}. Best is trial 96 with value: 0.038883738900888705.
Initial log joint probability = -28.8311
    Iter      log prob        ||dx||      ||grad||       alpha      alpha0  # evals  Notes 
      99       18912.9   3.45322e-07       3498.55      0.2586      0.2586      132   
    Iter      log prob        ||dx||      ||grad||       alpha      alpha0  # evals  Notes 
     106       18912.9   5.40995e-06       3713.08   1.457e-09       0.001      186  LS failed, Hessian reset 
     131       18912.9   8.78994e-09       3153.43      0.2939           1      220   
Optimization terminated normally: 
  Convergence detected: absolute parameter change was below tolerance
INFO:fbprophet:Making 5 forecasts with cutoffs between 2013-10-07 00:00:00 and 2015-10-18 00:00:00
INFO:fbprophet:Applying in parallel with <concurrent.futures.process.ProcessPoolExecutor object at 0x7fc84dc1edd0>
Initial log joint probability = -8.95172
    Iter      log prob        ||dx||      ||grad||       alpha      alpha0  # evals  Notes 
Initial log joint probability = -12.7302
    Iter      log prob        ||dx||      ||grad||       alpha      alpha0  # evals  Notes 
Initial log joint probability = -15.1549
    Iter      log prob        ||dx||      ||grad||       alpha      alpha0  # evals  Notes 
Initial log joint probability = -18.717
    Iter      log prob        ||dx||      ||grad||       alpha      alpha0  # evals  Notes 
Initial log joint probability = -23.5879
    Iter      log prob        ||dx||      ||grad||       alpha      alpha0  # evals  Notes 
      99        4679.3   9.14534e-05       3672.96           1           1      127   
    Iter      log prob        ||dx||      ||grad||       alpha      alpha0  # evals  Notes 
     130        4679.4   8.96379e-09        3565.6      0.3094      0.3094      175   
Optimization terminated normally: 
  Convergence detected: absolute parameter change was below tolerance
      99       7029.55   5.66556e-07       3295.89      0.3331           1      123   
    Iter      log prob        ||dx||      ||grad||       alpha      alpha0  # evals  Notes 
     114       7029.55   6.13598e-09       3649.25      0.2923      0.2923      144   
Optimization terminated normally: 
  Convergence detected: absolute parameter change was below tolerance
      35       11811.8   0.000202266       3291.77   5.244e-08       0.001       94  LS failed, Hessian reset 
      71       9582.48   5.24785e-06       3820.45   1.836e-09       0.001      134  LS failed, Hessian reset 
      94       9582.49   8.39894e-09       3235.25      0.6583      0.6583      169   
Optimization terminated normally: 
  Convergence detected: absolute parameter change was below tolerance
      80       11813.2   3.75766e-09       3391.74       0.169       0.169      152   
Optimization terminated normally: 
  Convergence detected: absolute parameter change was below tolerance
      99       14232.8   3.02365e-07       3159.54      0.7814      0.7814      134   
    Iter      log prob        ||dx||      ||grad||       alpha      alpha0  # evals  Notes 
     109       14232.9    7.2812e-07       3074.46   2.085e-10       0.001      184  LS failed, Hessian reset 
     127       14232.9   8.90605e-09       3200.94      0.3425           1      205   
Optimization terminated normally: 
  Convergence detected: absolute parameter change was below tolerance
[I 2020-10-01 03:54:18,039] Trial 399 finished with value: 0.04094397265727355 and parameters: {'changepoint_prior_scale': 0.0013936480225674444, 'seasonality_prior_scale': 0.6462581612893754, 'holidays_prior_scale': 2.4641742163363065, 'seasonality_mode': 'additive', 'changepoint_range': 0.5525546230443179}. Best is trial 96 with value: 0.038883738900888705.
Initial log joint probability = -28.8311
    Iter      log prob        ||dx||      ||grad||       alpha      alpha0  # evals  Notes 
      99       18912.3    2.4569e-06       3955.66           1           1      126   
    Iter      log prob        ||dx||      ||grad||       alpha      alpha0  # evals  Notes 
     167       18912.8   7.29428e-08       4574.43   1.702e-11       0.001      241  LS failed, Hessian reset 
     173       18912.8   7.14237e-09       4468.35      0.2812      0.9482      248   
Optimization terminated normally: 
  Convergence detected: absolute parameter change was below tolerance
INFO:fbprophet:Making 5 forecasts with cutoffs between 2013-10-07 00:00:00 and 2015-10-18 00:00:00
INFO:fbprophet:Applying in parallel with <concurrent.futures.process.ProcessPoolExecutor object at 0x7fc84dc8c310>
Initial log joint probability = -8.95172
    Iter      log prob        ||dx||      ||grad||       alpha      alpha0  # evals  Notes 
Initial log joint probability = -12.7302
    Iter      log prob        ||dx||      ||grad||       alpha      alpha0  # evals  Notes 
Initial log joint probability = -15.1549
    Iter      log prob        ||dx||      ||grad||       alpha      alpha0  # evals  Notes 
Initial log joint probability = -18.717
    Iter      log prob        ||dx||      ||grad||       alpha      alpha0  # evals  Notes 
Initial log joint probability = -23.5879
      68       4678.89   4.95253e-09       4562.09      0.3187      0.3187       95   
Optimization terminated normally: 
  Convergence detected: absolute parameter change was below tolerance
    Iter      log prob        ||dx||      ||grad||       alpha      alpha0  # evals  Notes 
      57       9581.99   8.65296e-09       4504.93      0.3567      0.3567       77   
Optimization terminated normally: 
  Convergence detected: absolute parameter change was below tolerance
      94       7027.99   2.20415e-05        4831.3   5.044e-09       0.001      164  LS failed, Hessian reset 
      99       7028.08   4.45862e-06       4080.48      0.4078      0.4078      170   
    Iter      log prob        ||dx||      ||grad||       alpha      alpha0  # evals  Notes 
     134       7028.12   5.88374e-09       4423.97      0.5395      0.5395      216   
Optimization terminated normally: 
  Convergence detected: absolute parameter change was below tolerance
      76       11813.1   4.95405e-06       4595.07   1.111e-09       0.001      149  LS failed, Hessian reset 
      99       14233.2   4.76317e-06       3926.06      0.6827      0.9697      125   
    Iter      log prob        ||dx||      ||grad||       alpha      alpha0  # evals  Notes 
      99       11813.1   1.33586e-08       4356.61      0.4844      0.4844      172   
    Iter      log prob        ||dx||      ||grad||       alpha      alpha0  # evals  Notes 
     101       11813.1   8.34703e-09          4602      0.5626      0.5626      174   
Optimization terminated normally: 
  Convergence detected: absolute parameter change was below tolerance
     199       14233.4   5.46345e-08       4354.96      0.8042      0.8042      249   
    Iter      log prob        ||dx||      ||grad||       alpha      alpha0  # evals  Notes 
     205       14233.4    7.5016e-08       4742.19   1.657e-11       0.001      300  LS failed, Hessian reset 
     210       14233.4   7.79482e-09       4673.22      0.5757      0.5757      306   
Optimization terminated normally: 
  Convergence detected: absolute parameter change was below tolerance
[I 2020-10-01 03:54:34,229] Trial 400 finished with value: 0.041142373019510625 and parameters: {'changepoint_prior_scale': 0.0011130727153501124, 'seasonality_prior_scale': 0.09578343406164959, 'holidays_prior_scale': 3.2001620464090186, 'seasonality_mode': 'additive', 'changepoint_range': 0.5268188102996217}. Best is trial 96 with value: 0.038883738900888705.
Initial log joint probability = -28.8311
    Iter      log prob        ||dx||      ||grad||       alpha      alpha0  # evals  Notes 
      99       18912.8   4.65582e-08        2840.7      0.5437      0.5437      122   
    Iter      log prob        ||dx||      ||grad||       alpha      alpha0  # evals  Notes 
     103       18912.8   1.74353e-08       2080.86      0.6318      0.6318      129   
Optimization terminated normally: 
  Convergence detected: relative gradient magnitude is below tolerance
INFO:fbprophet:Making 5 forecasts with cutoffs between 2013-10-07 00:00:00 and 2015-10-18 00:00:00
INFO:fbprophet:Applying in parallel with <concurrent.futures.process.ProcessPoolExecutor object at 0x7fc84dc728d0>
Initial log joint probability = -8.95172
    Iter      log prob        ||dx||      ||grad||       alpha      alpha0  # evals  Notes 
Initial log joint probability = -12.7302
    Iter      log prob        ||dx||      ||grad||       alpha      alpha0  # evals  Notes 
Initial log joint probability = -15.1549
    Iter      log prob        ||dx||      ||grad||       alpha      alpha0  # evals  Notes 
Initial log joint probability = -18.717
    Iter      log prob        ||dx||      ||grad||       alpha      alpha0  # evals  Notes 
Initial log joint probability = -23.5879
    Iter      log prob        ||dx||      ||grad||       alpha      alpha0  # evals  Notes 
      86       4679.22    5.4027e-09       3008.76      0.6677      0.6677      109   
Optimization terminated normally: 
  Convergence detected: absolute parameter change was below tolerance
      99       7031.02   0.000186089       3170.23           1           1      118   
    Iter      log prob        ||dx||      ||grad||       alpha      alpha0  # evals  Notes 
      71       9582.46   5.32813e-09          3020      0.2182      0.2182       97   
Optimization terminated normally: 
  Convergence detected: absolute parameter change was below tolerance
     150       7031.87   2.71523e-09       3068.79      0.2218      0.2218      179   
Optimization terminated normally: 
  Convergence detected: absolute parameter change was below tolerance
      29       11811.9   0.000279991       2647.56   1.017e-07       0.001       89  LS failed, Hessian reset 
      76       11813.2   8.67485e-09       3091.33      0.4379      0.4379      150   
Optimization terminated normally: 
  Convergence detected: absolute parameter change was below tolerance
      71       14231.3    0.00010772        3036.2   3.755e-08       0.001      130  LS failed, Hessian reset 
      99       14231.4   4.65546e-07       2396.69      0.7441      0.7441      166   
    Iter      log prob        ||dx||      ||grad||       alpha      alpha0  # evals  Notes 
     124       14231.4   1.23565e-08       2614.24      0.6087      0.6087      197   
Optimization terminated normally: 
  Convergence detected: relative gradient magnitude is below tolerance
[I 2020-10-01 03:54:48,890] Trial 401 finished with value: 0.041495279171304085 and parameters: {'changepoint_prior_scale': 0.001636129631262009, 'seasonality_prior_scale': 0.08275363033867515, 'holidays_prior_scale': 0.46328280737834937, 'seasonality_mode': 'additive', 'changepoint_range': 0.5816551638983353}. Best is trial 96 with value: 0.038883738900888705.
Initial log joint probability = -28.8311
    Iter      log prob        ||dx||      ||grad||       alpha      alpha0  # evals  Notes 
      99       18912.3   0.000105621       3746.09           1           1      122   
    Iter      log prob        ||dx||      ||grad||       alpha      alpha0  # evals  Notes 
     134       18912.4   7.06607e-06        4174.3   1.867e-09       0.001      210  LS failed, Hessian reset 
     172       18912.5   6.78937e-09        3864.6      0.2552      0.2552      262   
Optimization terminated normally: 
  Convergence detected: absolute parameter change was below tolerance
INFO:fbprophet:Making 5 forecasts with cutoffs between 2013-10-07 00:00:00 and 2015-10-18 00:00:00
INFO:fbprophet:Applying in parallel with <concurrent.futures.process.ProcessPoolExecutor object at 0x7fc84dc72490>
Initial log joint probability = -8.95172
    Iter      log prob        ||dx||      ||grad||       alpha      alpha0  # evals  Notes 
Initial log joint probability = -12.7302
    Iter      log prob        ||dx||      ||grad||       alpha      alpha0  # evals  Notes 
Initial log joint probability = -15.1549
    Iter      log prob        ||dx||      ||grad||       alpha      alpha0  # evals  Notes 
      77       4678.33   0.000155132       3999.63   3.959e-08       0.001      149  LS failed, Hessian reset 
Initial log joint probability = -18.717
    Iter      log prob        ||dx||      ||grad||       alpha      alpha0  # evals  Notes 
      99       4679.03    9.0092e-06       3836.07      0.7738      0.7738      176   
    Iter      log prob        ||dx||      ||grad||       alpha      alpha0  # evals  Notes 
Initial log joint probability = -23.5879
    Iter      log prob        ||dx||      ||grad||       alpha      alpha0  # evals  Notes 
     105        4679.2   2.72046e-05       4071.76   6.766e-09       0.001      218  LS failed, Hessian reset 
      81       7028.63   3.42224e-05       4117.39   7.462e-09       0.001      145  LS failed, Hessian reset 
      99       7028.75   4.76143e-07       4099.17      0.4638      0.4638      165   
    Iter      log prob        ||dx||      ||grad||       alpha      alpha0  # evals  Notes 
     142       4679.33   7.67379e-07       3957.51   1.889e-10       0.001      309  LS failed, Hessian reset 
     160       4679.33   3.10968e-09       4032.22      0.2324      0.2324      331   
Optimization terminated normally: 
  Convergence detected: absolute parameter change was below tolerance
     131       7028.76   1.02023e-08       3652.81      0.3775           1      204   
Optimization terminated normally: 
  Convergence detected: relative gradient magnitude is below tolerance
      80       9582.36    4.4556e-09       3942.67      0.2852      0.2852      114   
Optimization terminated normally: 
  Convergence detected: absolute parameter change was below tolerance
      99       11812.8   9.20739e-09       3972.91      0.3001      0.3001      129   
Optimization terminated normally: 
  Convergence detected: absolute parameter change was below tolerance
      93       14233.1   1.46917e-08       3515.06      0.1506           1      127   
Optimization terminated normally: 
  Convergence detected: relative gradient magnitude is below tolerance
[I 2020-10-01 03:55:04,405] Trial 402 finished with value: 0.04114061734118722 and parameters: {'changepoint_prior_scale': 0.0012517720710764702, 'seasonality_prior_scale': 0.13038665193253726, 'holidays_prior_scale': 0.17965101036583164, 'seasonality_mode': 'additive', 'changepoint_range': 0.5394135375404933}. Best is trial 96 with value: 0.038883738900888705.
Initial log joint probability = -28.8311
    Iter      log prob        ||dx||      ||grad||       alpha      alpha0  # evals  Notes 
      99       18911.9   1.04061e-05       5494.03      0.9475      0.9475      126   
    Iter      log prob        ||dx||      ||grad||       alpha      alpha0  # evals  Notes 
     175       18912.7   1.39495e-06       4708.42   2.762e-10       0.001      260  LS failed, Hessian reset 
     188       18912.7   6.88871e-09       4232.59      0.2052      0.2052      277   
Optimization terminated normally: 
  Convergence detected: absolute parameter change was below tolerance
INFO:fbprophet:Making 5 forecasts with cutoffs between 2013-10-07 00:00:00 and 2015-10-18 00:00:00
INFO:fbprophet:Applying in parallel with <concurrent.futures.process.ProcessPoolExecutor object at 0x7fc84dbf32d0>
Initial log joint probability = -8.95172
    Iter      log prob        ||dx||      ||grad||       alpha      alpha0  # evals  Notes 
Initial log joint probability = -12.7302
    Iter      log prob        ||dx||      ||grad||       alpha      alpha0  # evals  Notes 
Initial log joint probability = -15.1549
    Iter      log prob        ||dx||      ||grad||       alpha      alpha0  # evals  Notes 
Initial log joint probability = -18.717
    Iter      log prob        ||dx||      ||grad||       alpha      alpha0  # evals  Notes 
      65       4678.36    9.9261e-09       4894.35      0.5834      0.5834       82   
Optimization terminated normally: 
  Convergence detected: absolute parameter change was below tolerance
Initial log joint probability = -23.5879
    Iter      log prob        ||dx||      ||grad||       alpha      alpha0  # evals  Notes 
      54        7027.9   2.16234e-05       5301.85   4.558e-09       0.001      100  LS failed, Hessian reset 
      65       9582.14   5.11619e-09       4773.35        0.29        0.29       89   
Optimization terminated normally: 
  Convergence detected: absolute parameter change was below tolerance
      99       7028.13    1.3237e-06       4262.98     0.06507      0.2116      158   
    Iter      log prob        ||dx||      ||grad||       alpha      alpha0  # evals  Notes 
      71       11812.8   6.95814e-07       4975.66   1.427e-10       0.001      144  LS failed, Hessian reset 
      86       11812.8   8.28702e-09       5014.27      0.7323      0.7323      163   
Optimization terminated normally: 
  Convergence detected: absolute parameter change was below tolerance
     190       7028.61   6.47266e-09       4497.65      0.3962      0.3962      277   
Optimization terminated normally: 
  Convergence detected: absolute parameter change was below tolerance
      99       14233.1   3.24622e-07       5267.83           1           1      130   
    Iter      log prob        ||dx||      ||grad||       alpha      alpha0  # evals  Notes 
     146       14233.2   3.52481e-08       5228.93   7.033e-12       0.001      225  LS failed, Hessian reset 
     150       14233.2   4.93405e-09       5022.12      0.6159      0.6159      229   
Optimization terminated normally: 
  Convergence detected: absolute parameter change was below tolerance
