[I 2020-10-01 02:26:41,636] Trial 55 finished with value: 0.041140292097748984 and parameters: {'changepoint_prior_scale': 0.0010179814578664338, 'seasonality_prior_scale': 0.025035645115002093, 'holidays_prior_scale': 4.486875814043011, 'seasonality_mode': 'additive', 'changepoint_range': 0.6028517605431234}. Best is trial 51 with value: 0.04086711905674389.
Initial log joint probability = -28.8311
    Iter      log prob        ||dx||      ||grad||       alpha      alpha0  # evals  Notes 
      99       18912.1   8.56299e-05       5321.72           1           1      121   
    Iter      log prob        ||dx||      ||grad||       alpha      alpha0  # evals  Notes 
     160       18912.6   6.25188e-09       4958.56      0.3519      0.3519      194   
Optimization terminated normally: 
  Convergence detected: absolute parameter change was below tolerance
INFO:fbprophet:Making 5 forecasts with cutoffs between 2013-10-07 00:00:00 and 2015-10-18 00:00:00
INFO:fbprophet:Applying in parallel with <concurrent.futures.process.ProcessPoolExecutor object at 0x7fc88e616250>
Initial log joint probability = -8.95172
    Iter      log prob        ||dx||      ||grad||       alpha      alpha0  # evals  Notes 
Initial log joint probability = -12.7302
    Iter      log prob        ||dx||      ||grad||       alpha      alpha0  # evals  Notes 
Initial log joint probability = -15.1549
    Iter      log prob        ||dx||      ||grad||       alpha      alpha0  # evals  Notes 
Initial log joint probability = -18.717
    Iter      log prob        ||dx||      ||grad||       alpha      alpha0  # evals  Notes 
Initial log joint probability = -23.5879
    Iter      log prob        ||dx||      ||grad||       alpha      alpha0  # evals  Notes 
      82       4679.01   6.13962e-09       4634.04      0.2716      0.2716      116   
Optimization terminated normally: 
  Convergence detected: absolute parameter change was below tolerance
      61       7027.43   6.31702e-05       4716.29   1.348e-08       0.001      114  LS failed, Hessian reset 
      43       9582.14   2.13751e-06       4900.86   4.834e-10       0.001      100  LS failed, Hessian reset 
      99       7027.82   1.12623e-06       4718.19           1           1      162   
    Iter      log prob        ||dx||      ||grad||       alpha      alpha0  # evals  Notes 
     132       7027.83   7.10263e-09       4829.03      0.4518      0.4518      200   
Optimization terminated normally: 
  Convergence detected: absolute parameter change was below tolerance
      66       9582.15   4.06786e-09       4663.71      0.3584      0.3584      130   
Optimization terminated normally: 
  Convergence detected: absolute parameter change was below tolerance
      75       11812.9   4.96994e-09       4712.62      0.1892      0.1892      112   
Optimization terminated normally: 
  Convergence detected: absolute parameter change was below tolerance
      99       14232.9   1.99783e-08       4844.19      0.6366      0.6366      132   
    Iter      log prob        ||dx||      ||grad||       alpha      alpha0  # evals  Notes 
     101       14232.9   3.86745e-09       4619.28      0.3839      0.3839      134   
Optimization terminated normally: 
  Convergence detected: absolute parameter change was below tolerance
[I 2020-10-01 02:26:55,531] Trial 56 finished with value: 0.04108087070362605 and parameters: {'changepoint_prior_scale': 0.0010481082270394594, 'seasonality_prior_scale': 0.07163843408062436, 'holidays_prior_scale': 4.317232837208481, 'seasonality_mode': 'additive', 'changepoint_range': 0.5590640430863111}. Best is trial 51 with value: 0.04086711905674389.
Initial log joint probability = -28.8311
    Iter      log prob        ||dx||      ||grad||       alpha      alpha0  # evals  Notes 
      99       18912.6   2.95459e-06        3741.1      0.8232      0.8232      120   
    Iter      log prob        ||dx||      ||grad||       alpha      alpha0  # evals  Notes 
     143       18912.8   2.43424e-08        3557.1           1           1      172   
Optimization terminated normally: 
  Convergence detected: relative gradient magnitude is below tolerance
INFO:fbprophet:Making 5 forecasts with cutoffs between 2013-10-07 00:00:00 and 2015-10-18 00:00:00
INFO:fbprophet:Applying in parallel with <concurrent.futures.process.ProcessPoolExecutor object at 0x7fc88e6b7290>
Initial log joint probability = -8.95172
    Iter      log prob        ||dx||      ||grad||       alpha      alpha0  # evals  Notes 
Initial log joint probability = -12.7302
    Iter      log prob        ||dx||      ||grad||       alpha      alpha0  # evals  Notes 
Initial log joint probability = -15.1549
    Iter      log prob        ||dx||      ||grad||       alpha      alpha0  # evals  Notes 
Initial log joint probability = -18.717
    Iter      log prob        ||dx||      ||grad||       alpha      alpha0  # evals  Notes 
Initial log joint probability = -23.5879
    Iter      log prob        ||dx||      ||grad||       alpha      alpha0  # evals  Notes 
      73        4678.6   9.74824e-05       3844.93   2.575e-08       0.001      155  LS failed, Hessian reset 
      99       4678.96   0.000416594       3812.64           1           1      186   
    Iter      log prob        ||dx||      ||grad||       alpha      alpha0  # evals  Notes 
      77       7028.17   4.84941e-05       3702.53   1.168e-08       0.001      132  LS failed, Hessian reset 
     145        4679.2    7.0869e-09       3849.24      0.2081           1      249   
Optimization terminated normally: 
  Convergence detected: absolute parameter change was below tolerance
      99       7028.34   7.55722e-07       2990.43      0.6336      0.6336      158   
    Iter      log prob        ||dx||      ||grad||       alpha      alpha0  # evals  Notes 
      80       9582.31   1.90418e-09       3984.05      0.1754      0.1754      111   
Optimization terminated normally: 
  Convergence detected: absolute parameter change was below tolerance
     134       7028.35   6.25564e-07       3708.48   1.563e-10       0.001      244  LS failed, Hessian reset 
     153       7028.35   9.21485e-09       3600.12      0.2841      0.2841      268   
Optimization terminated normally: 
  Convergence detected: absolute parameter change was below tolerance
      80       11813.1   1.51301e-06       3816.85    3.92e-10       0.001      144  LS failed, Hessian reset 
      93       11813.1   2.37756e-09       3792.69      0.1725      0.1725      164   
Optimization terminated normally: 
  Convergence detected: absolute parameter change was below tolerance
      99       14233.4   3.31473e-07       3880.05      0.4535           1      129   
    Iter      log prob        ||dx||      ||grad||       alpha      alpha0  # evals  Notes 
     128       14233.4   8.68415e-09       3572.65      0.2869      0.2869      165   
Optimization terminated normally: 
  Convergence detected: absolute parameter change was below tolerance
[I 2020-10-01 02:27:09,153] Trial 57 finished with value: 0.041141420395226044 and parameters: {'changepoint_prior_scale': 0.0013028703795020485, 'seasonality_prior_scale': 0.08246195032788511, 'holidays_prior_scale': 2.1339041102656138, 'seasonality_mode': 'additive', 'changepoint_range': 0.5143799414238915}. Best is trial 51 with value: 0.04086711905674389.
Initial log joint probability = -28.8311
    Iter      log prob        ||dx||      ||grad||       alpha      alpha0  # evals  Notes 
      99       18912.4   6.14913e-06       1563.52      0.2542           1      126   
    Iter      log prob        ||dx||      ||grad||       alpha      alpha0  # evals  Notes 
     199       18912.5   1.65172e-05       2012.69           1           1      252   
    Iter      log prob        ||dx||      ||grad||       alpha      alpha0  # evals  Notes 
     231       18912.6   6.09809e-08       1691.78      0.7893      0.7893      292   
Optimization terminated normally: 
  Convergence detected: relative gradient magnitude is below tolerance
INFO:fbprophet:Making 5 forecasts with cutoffs between 2013-10-07 00:00:00 and 2015-10-18 00:00:00
INFO:fbprophet:Applying in parallel with <concurrent.futures.process.ProcessPoolExecutor object at 0x7fc88e69af10>
Initial log joint probability = -8.95172
    Iter      log prob        ||dx||      ||grad||       alpha      alpha0  # evals  Notes 
Initial log joint probability = -12.7302
    Iter      log prob        ||dx||      ||grad||       alpha      alpha0  # evals  Notes 
Initial log joint probability = -15.1549
    Iter      log prob        ||dx||      ||grad||       alpha      alpha0  # evals  Notes 
Initial log joint probability = -18.717
    Iter      log prob        ||dx||      ||grad||       alpha      alpha0  # evals  Notes 
Initial log joint probability = -23.5879
    Iter      log prob        ||dx||      ||grad||       alpha      alpha0  # evals  Notes 
      71       4679.08   6.92645e-07       1914.04   3.385e-10       0.001      128  LS failed, Hessian reset 
      85       4679.08   9.91853e-09       1788.61      0.2708           1      146   
Optimization terminated normally: 
  Convergence detected: absolute parameter change was below tolerance
      99       7030.88   2.08003e-07       1837.42      0.5303      0.5303      120   
    Iter      log prob        ||dx||      ||grad||       alpha      alpha0  # evals  Notes 
     118       7030.88     1.554e-08       1908.98      0.3071           1      144   
Optimization terminated normally: 
  Convergence detected: relative gradient magnitude is below tolerance
      46       9582.25   1.45395e-05       1778.99   7.079e-09       0.001       95  LS failed, Hessian reset 
      71       9582.27   8.94943e-09       1642.05      0.6197      0.6197      125   
Optimization terminated normally: 
  Convergence detected: absolute parameter change was below tolerance
      36       11812.2   0.000333015       1882.06   1.605e-07       0.001      102  LS failed, Hessian reset 
      82       11812.7    8.1349e-06       1706.15   5.296e-09       0.001      205  LS failed, Hessian reset 
      95       14233.2   4.15244e-06       1902.74   2.141e-09       0.001      163  LS failed, Hessian reset 
      99       11812.7   2.99133e-07       1601.95      0.3546           1      223   
    Iter      log prob        ||dx||      ||grad||       alpha      alpha0  # evals  Notes 
      99       14233.2   6.72028e-07       1310.52           1           1      168   
    Iter      log prob        ||dx||      ||grad||       alpha      alpha0  # evals  Notes 
     114       11812.7   3.10042e-08       1754.54       0.384      0.9617      243   
Optimization terminated normally: 
  Convergence detected: relative gradient magnitude is below tolerance
     117       14233.2    1.7274e-08       1549.72      0.6606      0.6606      192   
Optimization terminated normally: 
  Convergence detected: relative gradient magnitude is below tolerance
[I 2020-10-01 02:27:25,789] Trial 58 finished with value: 0.04133544081459642 and parameters: {'changepoint_prior_scale': 0.0025557922112778514, 'seasonality_prior_scale': 0.0492197009640067, 'holidays_prior_scale': 1.6088857241194612, 'seasonality_mode': 'additive', 'changepoint_range': 0.5590407189476042}. Best is trial 51 with value: 0.04086711905674389.
Initial log joint probability = -28.8311
    Iter      log prob        ||dx||      ||grad||       alpha      alpha0  # evals  Notes 
      99       18912.4     0.0003295       4713.65      0.9669      0.9669      117   
    Iter      log prob        ||dx||      ||grad||       alpha      alpha0  # evals  Notes 
     138       18912.5   3.55492e-09        4868.3       0.165       0.165      164   
Optimization terminated normally: 
  Convergence detected: absolute parameter change was below tolerance
INFO:fbprophet:Making 5 forecasts with cutoffs between 2013-10-07 00:00:00 and 2015-10-18 00:00:00
INFO:fbprophet:Applying in parallel with <concurrent.futures.process.ProcessPoolExecutor object at 0x7fc88e6ae950>
Initial log joint probability = -8.95172
    Iter      log prob        ||dx||      ||grad||       alpha      alpha0  # evals  Notes 
Initial log joint probability = -12.7302
    Iter      log prob        ||dx||      ||grad||       alpha      alpha0  # evals  Notes 
Initial log joint probability = -15.1549
    Iter      log prob        ||dx||      ||grad||       alpha      alpha0  # evals  Notes 
Initial log joint probability = -18.717
    Iter      log prob        ||dx||      ||grad||       alpha      alpha0  # evals  Notes 
Initial log joint probability = -23.5879
    Iter      log prob        ||dx||      ||grad||       alpha      alpha0  # evals  Notes 
      57       4678.81    2.3274e-06        4435.9   4.576e-10       0.001      115  LS failed, Hessian reset 
      99       4678.85   7.56428e-07       4686.42      0.3226           1      171   
    Iter      log prob        ||dx||      ||grad||       alpha      alpha0  # evals  Notes 
     112       4678.85   8.43438e-09       4771.92      0.2694      0.2694      187   
Optimization terminated normally: 
  Convergence detected: absolute parameter change was below tolerance
      63        7027.9   2.07214e-05       4844.12   4.487e-09       0.001      135  LS failed, Hessian reset 
      51        9582.2   1.94943e-06        5189.2   3.927e-10       0.001      102  LS failed, Hessian reset 
      99       7028.09   2.02861e-08       4389.04      0.7435      0.7435      180   
    Iter      log prob        ||dx||      ||grad||       alpha      alpha0  # evals  Notes 
     104       7028.09   8.05249e-09       4434.25      0.8183      0.8183      186   
Optimization terminated normally: 
  Convergence detected: absolute parameter change was below tolerance
      55       11812.9   3.75281e-09        4572.1      0.2882      0.2882       82   
Optimization terminated normally: 
  Convergence detected: absolute parameter change was below tolerance
      69       9582.21   7.24155e-09       4791.69      0.3648      0.3648      124   
Optimization terminated normally: 
  Convergence detected: absolute parameter change was below tolerance
      99       14233.2   1.86637e-05       4726.32          10           1      124   
    Iter      log prob        ||dx||      ||grad||       alpha      alpha0  # evals  Notes 
     151       14233.5   7.87263e-07       4920.15   1.684e-10       0.001      225  LS failed, Hessian reset 
     170       14233.5   7.71491e-09       4633.98      0.3413       0.827      249   
Optimization terminated normally: 
  Convergence detected: absolute parameter change was below tolerance
[I 2020-10-01 02:27:40,410] Trial 59 finished with value: 0.04084124947844796 and parameters: {'changepoint_prior_scale': 0.001018577752807078, 'seasonality_prior_scale': 0.09931388267371993, 'holidays_prior_scale': 2.8846965307323016, 'seasonality_mode': 'additive', 'changepoint_range': 0.5312595890834189}. Best is trial 59 with value: 0.04084124947844796.
Initial log joint probability = -28.8311
    Iter      log prob        ||dx||      ||grad||       alpha      alpha0  # evals  Notes 
      99       18912.2   1.68229e-05       4808.35      0.3485      0.8776      128   
    Iter      log prob        ||dx||      ||grad||       alpha      alpha0  # evals  Notes 
     180       18912.7   1.06286e-08       4361.52      0.1919           1      226   
Optimization terminated normally: 
  Convergence detected: relative gradient magnitude is below tolerance
INFO:fbprophet:Making 5 forecasts with cutoffs between 2013-10-07 00:00:00 and 2015-10-18 00:00:00
INFO:fbprophet:Applying in parallel with <concurrent.futures.process.ProcessPoolExecutor object at 0x7fc88e6b7690>
Initial log joint probability = -8.95172
    Iter      log prob        ||dx||      ||grad||       alpha      alpha0  # evals  Notes 
Initial log joint probability = -12.7302
    Iter      log prob        ||dx||      ||grad||       alpha      alpha0  # evals  Notes 
Initial log joint probability = -15.1549
    Iter      log prob        ||dx||      ||grad||       alpha      alpha0  # evals  Notes 
      65       4678.86   2.87439e-07       4841.45   6.058e-11       0.001      130  LS failed, Hessian reset 
      78       4678.87   7.28329e-09       4567.43      0.4098           1      149   
Optimization terminated normally: 
  Convergence detected: absolute parameter change was below tolerance
Initial log joint probability = -18.717
    Iter      log prob        ||dx||      ||grad||       alpha      alpha0  # evals  Notes 
Initial log joint probability = -23.5879
    Iter      log prob        ||dx||      ||grad||       alpha      alpha0  # evals  Notes 
      99       7028.46   2.24506e-08       4511.99       1.674      0.4112      126   
    Iter      log prob        ||dx||      ||grad||       alpha      alpha0  # evals  Notes 
      55       9582.07   5.48303e-09       4754.24      0.4402      0.4402       80   
     101       7028.46   9.90452e-09       4638.88      0.6285      0.6285      128   
Optimization terminated normally: 
  Convergence detected: absolute parameter change was below tolerance
Optimization terminated normally: 
  Convergence detected: absolute parameter change was below tolerance
      70       11812.9   9.05253e-09       4820.11       0.469       0.469      102   
Optimization terminated normally: 
  Convergence detected: absolute parameter change was below tolerance
      99       14232.6    1.1322e-05       5138.06           1           1      133   
    Iter      log prob        ||dx||      ||grad||       alpha      alpha0  # evals  Notes 
     152       14232.9   8.44376e-09       4744.69      0.3619      0.3619      198   
Optimization terminated normally: 
  Convergence detected: absolute parameter change was below tolerance
[I 2020-10-01 02:27:56,013] Trial 60 finished with value: 0.04083410605276838 and parameters: {'changepoint_prior_scale': 0.0010108016851037168, 'seasonality_prior_scale': 0.10803409127044064, 'holidays_prior_scale': 2.772923350448973, 'seasonality_mode': 'additive', 'changepoint_range': 0.536625808664449}. Best is trial 60 with value: 0.04083410605276838.
Initial log joint probability = -28.8311
    Iter      log prob        ||dx||      ||grad||       alpha      alpha0  # evals  Notes 
      99         18912   0.000148543       5007.77           1           1      120   
    Iter      log prob        ||dx||      ||grad||       alpha      alpha0  # evals  Notes 
     149       18912.4     1.009e-08       5009.14      0.8679      0.8679      183   
Optimization terminated normally: 
  Convergence detected: relative gradient magnitude is below tolerance
INFO:fbprophet:Making 5 forecasts with cutoffs between 2013-10-07 00:00:00 and 2015-10-18 00:00:00
INFO:fbprophet:Applying in parallel with <concurrent.futures.process.ProcessPoolExecutor object at 0x7fc88e6a68d0>
Initial log joint probability = -8.95172
    Iter      log prob        ||dx||      ||grad||       alpha      alpha0  # evals  Notes 
Initial log joint probability = -12.7302
    Iter      log prob        ||dx||      ||grad||       alpha      alpha0  # evals  Notes 
Initial log joint probability = -15.1549
    Iter      log prob        ||dx||      ||grad||       alpha      alpha0  # evals  Notes 
Initial log joint probability = -18.717
    Iter      log prob        ||dx||      ||grad||       alpha      alpha0  # evals  Notes 
      54       4678.96   3.43633e-09       4981.91       0.313       0.313       75   
Optimization terminated normally: 
  Convergence detected: absolute parameter change was below tolerance
Initial log joint probability = -23.5879
    Iter      log prob        ||dx||      ||grad||       alpha      alpha0  # evals  Notes 
      86       7027.62   7.91888e-09       4906.86      0.5073      0.5073      111   
Optimization terminated normally: 
  Convergence detected: absolute parameter change was below tolerance
      59       9582.32   7.68905e-06       4860.38   1.605e-09       0.001      111  LS failed, Hessian reset 
      57       11812.7   8.69642e-09       4922.01       0.373       0.373       86   
Optimization terminated normally: 
  Convergence detected: absolute parameter change was below tolerance
      85       9582.35   7.61755e-09       4841.22      0.2847           1      148   
Optimization terminated normally: 
  Convergence detected: absolute parameter change was below tolerance
      99       14229.9    1.6777e-06        4939.4      0.3395           1      131   
    Iter      log prob        ||dx||      ||grad||       alpha      alpha0  # evals  Notes 
     119       14229.9   8.56605e-07       5177.07    1.78e-10       0.001      202  LS failed, Hessian reset 
     146       14229.9   9.84228e-07       5056.93   1.936e-10       0.001      281  LS failed, Hessian reset 
     174       14229.9   7.21656e-09       4988.81       0.288           1      318   
Optimization terminated normally: 
  Convergence detected: absolute parameter change was below tolerance
