[I 2020-10-01 02:18:14,329] Trial 22 finished with value: 0.04129180337009914 and parameters: {'changepoint_prior_scale': 0.0017198563701765063, 'seasonality_prior_scale': 0.030575977243992813, 'holidays_prior_scale': 0.01982137107649336, 'seasonality_mode': 'additive', 'changepoint_range': 0.6182068060350158}. Best is trial 3 with value: 0.04098090703811677.
Initial log joint probability = -28.8311
    Iter      log prob        ||dx||      ||grad||       alpha      alpha0  # evals  Notes 
      99         18912   5.29465e-07       2206.18      0.5059      0.5059      129   
    Iter      log prob        ||dx||      ||grad||       alpha      alpha0  # evals  Notes 
     138         18912   3.61951e-08       2257.85      0.6354      0.6354      177   
Optimization terminated normally: 
  Convergence detected: relative gradient magnitude is below tolerance
INFO:fbprophet:Making 5 forecasts with cutoffs between 2013-10-07 00:00:00 and 2015-10-18 00:00:00
INFO:fbprophet:Applying in parallel with <concurrent.futures.process.ProcessPoolExecutor object at 0x7fc88e6d4210>
Initial log joint probability = -8.95172
    Iter      log prob        ||dx||      ||grad||       alpha      alpha0  # evals  Notes 
Initial log joint probability = -12.7302
    Iter      log prob        ||dx||      ||grad||       alpha      alpha0  # evals  Notes 
Initial log joint probability = -15.1549
    Iter      log prob        ||dx||      ||grad||       alpha      alpha0  # evals  Notes 
Initial log joint probability = -18.717
    Iter      log prob        ||dx||      ||grad||       alpha      alpha0  # evals  Notes 
Initial log joint probability = -23.5879
    Iter      log prob        ||dx||      ||grad||       alpha      alpha0  # evals  Notes 
      66       4678.47   1.73182e-06       2256.14    7.83e-10       0.001      121  LS failed, Hessian reset 
      79       4678.47    8.5568e-09       2228.01      0.3044      0.3044      137   
Optimization terminated normally: 
  Convergence detected: absolute parameter change was below tolerance
      99       7030.85   0.000143534       2238.07      0.8331      0.8331      122   
    Iter      log prob        ||dx||      ||grad||       alpha      alpha0  # evals  Notes 
      56       9581.49   1.50453e-06        2195.2   6.565e-10       0.001      117  LS failed, Hessian reset 
      77       9581.49   2.55618e-08        2121.6      0.2098      0.7258      149   
Optimization terminated normally: 
  Convergence detected: relative gradient magnitude is below tolerance
     164       7031.06   8.99986e-08       2391.37     3.8e-11       0.001      249  LS failed, Hessian reset 
     169       7031.06   9.31209e-09       2222.28      0.3045      0.3045      256   
Optimization terminated normally: 
  Convergence detected: absolute parameter change was below tolerance
      64       11812.2   2.07083e-05       2254.45   9.723e-09       0.001      127  LS failed, Hessian reset 
      95       11812.3   2.72512e-08       2269.32      0.7157      0.7157      171   
Optimization terminated normally: 
  Convergence detected: relative gradient magnitude is below tolerance
      87       14232.2   1.07234e-05       2256.77   5.456e-09       0.001      140  LS failed, Hessian reset 
      99       14232.2   6.06494e-07        2061.2           1           1      154   
    Iter      log prob        ||dx||      ||grad||       alpha      alpha0  # evals  Notes 
     122       14232.2   5.18235e-07       2163.74   2.586e-10       0.001      218  LS failed, Hessian reset 
     135       14232.2   2.18591e-08       1979.26      0.2921           1      233   
Optimization terminated normally: 
  Convergence detected: relative gradient magnitude is below tolerance
[I 2020-10-01 02:18:28,589] Trial 23 finished with value: 0.04181250925135715 and parameters: {'changepoint_prior_scale': 0.0021581194538283148, 'seasonality_prior_scale': 0.027563411056031408, 'holidays_prior_scale': 0.12425008472061547, 'seasonality_mode': 'additive', 'changepoint_range': 0.7850998704884563}. Best is trial 3 with value: 0.04098090703811677.
Initial log joint probability = -28.8311
    Iter      log prob        ||dx||      ||grad||       alpha      alpha0  # evals  Notes 
      99       18906.9   6.57595e-08       2524.17      0.2301           1      137   
    Iter      log prob        ||dx||      ||grad||       alpha      alpha0  # evals  Notes 
     101       18906.9   2.44395e-08        2105.9      0.2821           1      140   
Optimization terminated normally: 
  Convergence detected: relative gradient magnitude is below tolerance
INFO:fbprophet:Making 5 forecasts with cutoffs between 2013-10-07 00:00:00 and 2015-10-18 00:00:00
INFO:fbprophet:Applying in parallel with <concurrent.futures.process.ProcessPoolExecutor object at 0x7fc88e664ad0>
Initial log joint probability = -8.95172
    Iter      log prob        ||dx||      ||grad||       alpha      alpha0  # evals  Notes 
Initial log joint probability = -12.7302
    Iter      log prob        ||dx||      ||grad||       alpha      alpha0  # evals  Notes 
Initial log joint probability = -15.1549
    Iter      log prob        ||dx||      ||grad||       alpha      alpha0  # evals  Notes 
      81       4674.29   1.21116e-07       2843.87   4.196e-11       0.001      158  LS failed, Hessian reset 
Initial log joint probability = -18.717
      84       4674.29   7.44282e-09       2806.93      0.3022      0.3022      162   
    Iter      log prob        ||dx||      ||grad||       alpha      alpha0  # evals  Notes 
Optimization terminated normally: 
  Convergence detected: absolute parameter change was below tolerance
Initial log joint probability = -23.5879
    Iter      log prob        ||dx||      ||grad||       alpha      alpha0  # evals  Notes 
      55        9575.9   9.65562e-09       2772.96      0.3126      0.3126       82   
Optimization terminated normally: 
  Convergence detected: absolute parameter change was below tolerance
      89       7022.97   6.63563e-05       2925.13   2.336e-08       0.001      147  LS failed, Hessian reset 
      99       7023.16   6.07322e-06       2092.54           1           1      160   
    Iter      log prob        ||dx||      ||grad||       alpha      alpha0  # evals  Notes 
     154       7023.19   7.61321e-09       2701.34     0.00611     0.00611      234   
Optimization terminated normally: 
  Convergence detected: absolute parameter change was below tolerance
      49       11805.9   0.000183656        2524.3   6.598e-08       0.001      130  LS failed, Hessian reset 
      99       14225.4   3.70805e-07       2528.11           1           1      133   
    Iter      log prob        ||dx||      ||grad||       alpha      alpha0  # evals  Notes 
      92         11807   3.94978e-09       2813.61      0.2852      0.2852      183   
Optimization terminated normally: 
  Convergence detected: absolute parameter change was below tolerance
     128       14225.4   1.82735e-08       2235.04      0.3861           1      171   
Optimization terminated normally: 
  Convergence detected: relative gradient magnitude is below tolerance
[I 2020-10-01 02:18:43,478] Trial 24 finished with value: 0.04118886110681488 and parameters: {'changepoint_prior_scale': 0.001756479510619122, 'seasonality_prior_scale': 0.011001591865020267, 'holidays_prior_scale': 0.03159825882580942, 'seasonality_mode': 'additive', 'changepoint_range': 0.6195544930809738}. Best is trial 3 with value: 0.04098090703811677.
Initial log joint probability = -28.8311
    Iter      log prob        ||dx||      ||grad||       alpha      alpha0  # evals  Notes 
      55       18906.9   1.55085e-07       683.722      0.4466      0.4466       77   
Optimization terminated normally: 
  Convergence detected: relative gradient magnitude is below tolerance
INFO:fbprophet:Making 5 forecasts with cutoffs between 2013-10-07 00:00:00 and 2015-10-18 00:00:00
INFO:fbprophet:Applying in parallel with <concurrent.futures.process.ProcessPoolExecutor object at 0x7fc88e6aec50>
Initial log joint probability = -8.95172
    Iter      log prob        ||dx||      ||grad||       alpha      alpha0  # evals  Notes 
Initial log joint probability = -12.7302
    Iter      log prob        ||dx||      ||grad||       alpha      alpha0  # evals  Notes 
Initial log joint probability = -15.1549
    Iter      log prob        ||dx||      ||grad||       alpha      alpha0  # evals  Notes 
Initial log joint probability = -18.717
    Iter      log prob        ||dx||      ||grad||       alpha      alpha0  # evals  Notes 
Initial log joint probability = -23.5879
    Iter      log prob        ||dx||      ||grad||       alpha      alpha0  # evals  Notes 
      75       4673.94   4.83889e-06       881.363    5.57e-09       0.001      136  LS failed, Hessian reset 
      99       4673.95   7.98236e-08       865.309      0.4752           1      164   
    Iter      log prob        ||dx||      ||grad||       alpha      alpha0  # evals  Notes 
     113       4673.95   4.77061e-09       875.189      0.3651      0.3651      184   
Optimization terminated normally: 
  Convergence detected: absolute parameter change was below tolerance
      99       7024.93   1.02553e-06       710.118      0.4248      0.4248      133   
    Iter      log prob        ||dx||      ||grad||       alpha      alpha0  # evals  Notes 
     123       7024.93   1.65545e-07       601.046           1           1      167   
Optimization terminated normally: 
  Convergence detected: relative gradient magnitude is below tolerance
      75         11806   4.21543e-08       815.452       0.651       0.651       98   
Optimization terminated normally: 
  Convergence detected: relative gradient magnitude is below tolerance
      75       9575.32   8.67344e-06       840.903   9.368e-09       0.001      146  LS failed, Hessian reset 
      99       9575.32   2.46945e-07       755.027       2.035      0.2035      177   
    Iter      log prob        ||dx||      ||grad||       alpha      alpha0  # evals  Notes 
      44       14225.9   0.000189393       793.805   2.495e-07       0.001       92  LS failed, Hessian reset 
     114       9575.32   3.94901e-08       573.311      0.1948      0.7658      196   
Optimization terminated normally: 
  Convergence detected: relative gradient magnitude is below tolerance
      83         14226   2.15076e-05       660.685   2.863e-08       0.001      181  LS failed, Hessian reset 
      99         14226   4.35481e-07       727.831      0.2914      0.7697      205   
    Iter      log prob        ||dx||      ||grad||       alpha      alpha0  # evals  Notes 
     112         14226   5.86294e-08       600.295      0.7668      0.7668      221   
Optimization terminated normally: 
  Convergence detected: relative gradient magnitude is below tolerance
[I 2020-10-01 02:18:59,219] Trial 25 finished with value: 0.042602873873068624 and parameters: {'changepoint_prior_scale': 0.005403071016264673, 'seasonality_prior_scale': 0.010519373714280154, 'holidays_prior_scale': 0.0384973099822353, 'seasonality_mode': 'additive', 'changepoint_range': 0.8210534175146462}. Best is trial 3 with value: 0.04098090703811677.
Initial log joint probability = -28.8311
    Iter      log prob        ||dx||      ||grad||       alpha      alpha0  # evals  Notes 
      96       18908.3    1.9075e-07       280.129      0.1733           1      127   
Optimization terminated normally: 
  Convergence detected: relative gradient magnitude is below tolerance
INFO:fbprophet:Making 5 forecasts with cutoffs between 2013-10-07 00:00:00 and 2015-10-18 00:00:00
INFO:fbprophet:Applying in parallel with <concurrent.futures.process.ProcessPoolExecutor object at 0x7fc88e616190>
Initial log joint probability = -8.95172
    Iter      log prob        ||dx||      ||grad||       alpha      alpha0  # evals  Notes 
Initial log joint probability = -12.7302
    Iter      log prob        ||dx||      ||grad||       alpha      alpha0  # evals  Notes 
Initial log joint probability = -15.1549
    Iter      log prob        ||dx||      ||grad||       alpha      alpha0  # evals  Notes 
Initial log joint probability = -18.717
    Iter      log prob        ||dx||      ||grad||       alpha      alpha0  # evals  Notes 
Initial log joint probability = -23.5879
    Iter      log prob        ||dx||      ||grad||       alpha      alpha0  # evals  Notes 
      99       4674.61   1.28345e-06        411.28       0.268           1      123   
    Iter      log prob        ||dx||      ||grad||       alpha      alpha0  # evals  Notes 
     124       4674.61    6.3667e-08       417.179      0.8393      0.8393      152   
Optimization terminated normally: 
  Convergence detected: relative gradient magnitude is below tolerance
      51       7027.28   0.000267144       361.389   7.903e-07       0.001       99  LS failed, Hessian reset 
      62       9575.35   1.19787e-07       255.501      0.2716           1       87   
Optimization terminated normally: 
  Convergence detected: relative gradient magnitude is below tolerance
      98       7027.34   7.55297e-08       213.927      0.5839      0.5839      171   
Optimization terminated normally: 
  Convergence detected: relative gradient magnitude is below tolerance
      66       11806.3   7.53369e-08       204.702      0.2169           1      108   
Optimization terminated normally: 
  Convergence detected: relative gradient magnitude is below tolerance
      99       14227.6   6.46554e-07       320.538      0.2549           1      130   
    Iter      log prob        ||dx||      ||grad||       alpha      alpha0  # evals  Notes 
     107       14227.6   2.88948e-07       325.692      0.8433      0.8433      139   
Optimization terminated normally: 
  Convergence detected: relative gradient magnitude is below tolerance
[I 2020-10-01 02:19:14,047] Trial 26 finished with value: 0.04703470238374408 and parameters: {'changepoint_prior_scale': 0.01193182451566564, 'seasonality_prior_scale': 0.01043376240906999, 'holidays_prior_scale': 0.5079287012546737, 'seasonality_mode': 'additive', 'changepoint_range': 0.6294853477644373}. Best is trial 3 with value: 0.04098090703811677.
Initial log joint probability = -28.8311
    Iter      log prob        ||dx||      ||grad||       alpha      alpha0  # evals  Notes 
      99       18910.8   1.32212e-05       1530.08       0.721       0.721      130   
    Iter      log prob        ||dx||      ||grad||       alpha      alpha0  # evals  Notes 
     133       18910.9   7.73926e-06       1110.99   4.639e-09       0.001      217  LS failed, Hessian reset 
     155       18910.9    6.4113e-08       1221.38      0.2622      0.7379      244   
Optimization terminated normally: 
  Convergence detected: relative gradient magnitude is below tolerance
INFO:fbprophet:Making 5 forecasts with cutoffs between 2013-10-07 00:00:00 and 2015-10-18 00:00:00
INFO:fbprophet:Applying in parallel with <concurrent.futures.process.ProcessPoolExecutor object at 0x7fc88e664f50>
Initial log joint probability = -8.95172
    Iter      log prob        ||dx||      ||grad||       alpha      alpha0  # evals  Notes 
Initial log joint probability = -12.7302
    Iter      log prob        ||dx||      ||grad||       alpha      alpha0  # evals  Notes 
Initial log joint probability = -15.1549
    Iter      log prob        ||dx||      ||grad||       alpha      alpha0  # evals  Notes 
Initial log joint probability = -18.717
    Iter      log prob        ||dx||      ||grad||       alpha      alpha0  # evals  Notes 
Initial log joint probability = -23.5879
    Iter      log prob        ||dx||      ||grad||       alpha      alpha0  # evals  Notes 
      56       4677.74   1.87179e-05       1713.69    1.13e-08       0.001      108  LS failed, Hessian reset 
      80       4677.76   7.34844e-09       1618.59      0.3525      0.3525      141   
Optimization terminated normally: 
  Convergence detected: absolute parameter change was below tolerance
      99       7029.33   3.67086e-06       1656.55           1           1      121   
    Iter      log prob        ||dx||      ||grad||       alpha      alpha0  # evals  Notes 
     102       7029.34   3.21706e-06       1637.86   2.015e-09       0.001      163  LS failed, Hessian reset 
      83       9580.45   2.32239e-08       1316.16      0.2538           1      111   
Optimization terminated normally: 
  Convergence detected: relative gradient magnitude is below tolerance
      63       11811.2   2.86227e-08       1670.55      0.2751           1       92   
Optimization terminated normally: 
  Convergence detected: relative gradient magnitude is below tolerance
     138       7029.35   7.69247e-07       1613.96   4.439e-10       0.001      255  LS failed, Hessian reset 
     155       7029.35   1.22574e-08       1652.09      0.2984      0.9208      281   
Optimization terminated normally: 
  Convergence detected: relative gradient magnitude is below tolerance
      99         14231   2.51401e-07       1142.16      0.6351      0.6351      126   
    Iter      log prob        ||dx||      ||grad||       alpha      alpha0  # evals  Notes 
     108         14231   4.99721e-08       1113.13      0.4202           1      138   
Optimization terminated normally: 
  Convergence detected: relative gradient magnitude is below tolerance
[I 2020-10-01 02:19:30,031] Trial 27 finished with value: 0.041515856566967255 and parameters: {'changepoint_prior_scale': 0.00301890241249965, 'seasonality_prior_scale': 0.01938631649083483, 'holidays_prior_scale': 0.1626793909799986, 'seasonality_mode': 'additive', 'changepoint_range': 0.7019878279256146}. Best is trial 3 with value: 0.04098090703811677.
Initial log joint probability = -28.8311
    Iter      log prob        ||dx||      ||grad||       alpha      alpha0  # evals  Notes 
      99       18912.8   2.67995e-07        3219.1      0.4097      0.4097      123   
    Iter      log prob        ||dx||      ||grad||       alpha      alpha0  # evals  Notes 
     118       18912.8   2.64847e-08       3112.89      0.4141           1      150   
Optimization terminated normally: 
  Convergence detected: relative gradient magnitude is below tolerance
INFO:fbprophet:Making 5 forecasts with cutoffs between 2013-10-07 00:00:00 and 2015-10-18 00:00:00
INFO:fbprophet:Applying in parallel with <concurrent.futures.process.ProcessPoolExecutor object at 0x7fc88e693650>
Initial log joint probability = -8.95172
    Iter      log prob        ||dx||      ||grad||       alpha      alpha0  # evals  Notes 
Initial log joint probability = -12.7302
    Iter      log prob        ||dx||      ||grad||       alpha      alpha0  # evals  Notes 
Initial log joint probability = -15.1549
    Iter      log prob        ||dx||      ||grad||       alpha      alpha0  # evals  Notes 
Initial log joint probability = -18.717
    Iter      log prob        ||dx||      ||grad||       alpha      alpha0  # evals  Notes 
Initial log joint probability = -23.5879
    Iter      log prob        ||dx||      ||grad||       alpha      alpha0  # evals  Notes 
      70       4678.84   3.38598e-07       3288.63   1.004e-10       0.001      135  LS failed, Hessian reset 
      79       4678.84   7.40087e-09       3094.16      0.2518           1      148   
Optimization terminated normally: 
  Convergence detected: absolute parameter change was below tolerance
      72       7029.31    5.5046e-05       3170.69    1.65e-08       0.001      128  LS failed, Hessian reset 
      99        7029.4   7.19418e-08       3154.19      0.4662      0.4662      164   
    Iter      log prob        ||dx||      ||grad||       alpha      alpha0  # evals  Notes 
      76       9582.55   5.20152e-09       3072.15       0.267           1      101   
Optimization terminated normally: 
  Convergence detected: absolute parameter change was below tolerance
     142       7029.48   9.66207e-06       3341.31   2.601e-09       0.001      251  LS failed, Hessian reset 
     173        7029.5   3.38373e-09       3310.39    0.004346           1      294   
Optimization terminated normally: 
  Convergence detected: absolute parameter change was below tolerance
      99       14233.6   1.19138e-05       3273.14      0.5881      0.5881      124   
    Iter      log prob        ||dx||      ||grad||       alpha      alpha0  # evals  Notes 
      81       11813.1   2.16552e-09       3180.57     0.08922           1      116   
Optimization terminated normally: 
  Convergence detected: absolute parameter change was below tolerance
     131       14233.6   2.34919e-08       3083.62      0.8758      0.8758      164   
Optimization terminated normally: 
  Convergence detected: relative gradient magnitude is below tolerance
