[I 2020-10-01 04:05:45,762] Trial 445 finished with value: 0.04094920035551578 and parameters: {'changepoint_prior_scale': 0.001013812830071145, 'seasonality_prior_scale': 0.14331167910913453, 'holidays_prior_scale': 0.11263701561296213, 'seasonality_mode': 'additive', 'changepoint_range': 0.6092663950521724}. Best is trial 96 with value: 0.038883738900888705.
Initial log joint probability = -28.8311
    Iter      log prob        ||dx||      ||grad||       alpha      alpha0  # evals  Notes 
      99       18911.6   0.000100585       4613.63           1           1      121   
    Iter      log prob        ||dx||      ||grad||       alpha      alpha0  # evals  Notes 
     150       18912.5   7.75605e-07        4852.8   1.656e-10       0.001      217  LS failed, Hessian reset 
     164       18912.5    9.7206e-09       4260.38       0.308       0.308      233   
Optimization terminated normally: 
  Convergence detected: absolute parameter change was below tolerance
INFO:fbprophet:Making 5 forecasts with cutoffs between 2013-10-07 00:00:00 and 2015-10-18 00:00:00
INFO:fbprophet:Applying in parallel with <concurrent.futures.process.ProcessPoolExecutor object at 0x7fc84dc92c90>
Initial log joint probability = -8.95172
    Iter      log prob        ||dx||      ||grad||       alpha      alpha0  # evals  Notes 
Initial log joint probability = -12.7302
    Iter      log prob        ||dx||      ||grad||       alpha      alpha0  # evals  Notes 
Initial log joint probability = -15.1549
    Iter      log prob        ||dx||      ||grad||       alpha      alpha0  # evals  Notes 
Initial log joint probability = -18.717
    Iter      log prob        ||dx||      ||grad||       alpha      alpha0  # evals  Notes 
Initial log joint probability = -23.5879
    Iter      log prob        ||dx||      ||grad||       alpha      alpha0  # evals  Notes 
      43       4674.48   0.000266344       4539.33   5.922e-08       0.001      137  LS failed, Hessian reset 
      99       4677.89   4.75035e-08       5052.04      0.7193      0.7193      204   
    Iter      log prob        ||dx||      ||grad||       alpha      alpha0  # evals  Notes 
      72        7028.5   1.40694e-06       4415.16   3.295e-10       0.001      137  LS failed, Hessian reset 
     154       4678.56   9.96542e-09       4661.39      0.1663      0.1663      271   
Optimization terminated normally: 
  Convergence detected: absolute parameter change was below tolerance
      99       7028.52   1.40585e-08       3871.55      0.4924      0.4924      170   
    Iter      log prob        ||dx||      ||grad||       alpha      alpha0  # evals  Notes 
     102       7028.52   8.59623e-09       4435.55      0.3597      0.3597      173   
Optimization terminated normally: 
  Convergence detected: absolute parameter change was below tolerance
      57       9581.52   6.34305e-07       4618.31   1.314e-10       0.001      122  LS failed, Hessian reset 
      73       9581.52   8.49662e-09       4577.58      0.2661      0.2661      144   
Optimization terminated normally: 
  Convergence detected: absolute parameter change was below tolerance
      78       11813.1   7.76935e-09       4788.54      0.3346      0.3346      115   
Optimization terminated normally: 
  Convergence detected: absolute parameter change was below tolerance
      99       14232.3    4.5517e-07        4744.9           1           1      133   
    Iter      log prob        ||dx||      ||grad||       alpha      alpha0  # evals  Notes 
     167       14232.7   1.44093e-08       4477.21      0.2862      0.8513      222   
Optimization terminated normally: 
  Convergence detected: relative gradient magnitude is below tolerance
[I 2020-10-01 04:06:00,069] Trial 446 finished with value: 0.04257282338560509 and parameters: {'changepoint_prior_scale': 0.0010554302999604957, 'seasonality_prior_scale': 0.1760997000540677, 'holidays_prior_scale': 0.1174017101650499, 'seasonality_mode': 'multiplicative', 'changepoint_range': 0.6148047155116751}. Best is trial 96 with value: 0.038883738900888705.
Initial log joint probability = -28.8311
    Iter      log prob        ||dx||      ||grad||       alpha      alpha0  # evals  Notes 
      99       18911.2   4.14063e-07       5691.46           1           1      127   
    Iter      log prob        ||dx||      ||grad||       alpha      alpha0  # evals  Notes 
     199       18912.6   2.37724e-08       4504.67      0.9221      0.9221      247   
    Iter      log prob        ||dx||      ||grad||       alpha      alpha0  # evals  Notes 
     201       18912.6    3.7243e-08       4706.71       0.831       0.831      249   
Optimization terminated normally: 
  Convergence detected: relative gradient magnitude is below tolerance
INFO:fbprophet:Making 5 forecasts with cutoffs between 2013-10-07 00:00:00 and 2015-10-18 00:00:00
INFO:fbprophet:Applying in parallel with <concurrent.futures.process.ProcessPoolExecutor object at 0x7fc84dbf3c90>
Initial log joint probability = -8.95172
    Iter      log prob        ||dx||      ||grad||       alpha      alpha0  # evals  Notes 
Initial log joint probability = -12.7302
    Iter      log prob        ||dx||      ||grad||       alpha      alpha0  # evals  Notes 
Initial log joint probability = -15.1549
    Iter      log prob        ||dx||      ||grad||       alpha      alpha0  # evals  Notes 
Initial log joint probability = -18.717
    Iter      log prob        ||dx||      ||grad||       alpha      alpha0  # evals  Notes 
Initial log joint probability = -23.5879
    Iter      log prob        ||dx||      ||grad||       alpha      alpha0  # evals  Notes 
      99       4679.02   3.75344e-06       4817.36      0.6752      0.6752      120   
    Iter      log prob        ||dx||      ||grad||       alpha      alpha0  # evals  Notes 
     119       4679.02   3.95334e-09       4935.62      0.3064      0.3064      144   
Optimization terminated normally: 
  Convergence detected: absolute parameter change was below tolerance
      59       9582.17   8.61617e-09       4459.45      0.6364      0.6364       87   
Optimization terminated normally: 
  Convergence detected: absolute parameter change was below tolerance
      92       7028.36   2.52435e-05       4628.71   5.287e-09       0.001      157  LS failed, Hessian reset 
      99       7028.48   1.22574e-05       4687.46      0.7902      0.7902      165   
    Iter      log prob        ||dx||      ||grad||       alpha      alpha0  # evals  Notes 
      55         11813   7.16588e-09       4791.48      0.6418      0.6418       77   
Optimization terminated normally: 
  Convergence detected: absolute parameter change was below tolerance
     149       7028.52   8.81435e-09       4762.35      0.3589      0.3589      225   
Optimization terminated normally: 
  Convergence detected: absolute parameter change was below tolerance
      99       14233.4    9.4204e-08       4894.83      0.4799      0.4799      128   
    Iter      log prob        ||dx||      ||grad||       alpha      alpha0  # evals  Notes 
     127       14233.5   4.34013e-09       4788.98      0.1931      0.1931      163   
Optimization terminated normally: 
  Convergence detected: absolute parameter change was below tolerance
[I 2020-10-01 04:06:14,050] Trial 447 finished with value: 0.0412696819200446 and parameters: {'changepoint_prior_scale': 0.001001930372340427, 'seasonality_prior_scale': 0.16301621353760198, 'holidays_prior_scale': 0.10376988298947087, 'seasonality_mode': 'additive', 'changepoint_range': 0.591323977276015}. Best is trial 96 with value: 0.038883738900888705.
Initial log joint probability = -28.8311
    Iter      log prob        ||dx||      ||grad||       alpha      alpha0  # evals  Notes 
      99       18911.7   2.80873e-05       4765.48      0.6369      0.6369      126   
    Iter      log prob        ||dx||      ||grad||       alpha      alpha0  # evals  Notes 
     167       18911.9   3.37429e-09       5473.05      0.2428      0.2428      209   
Optimization terminated normally: 
  Convergence detected: absolute parameter change was below tolerance
INFO:fbprophet:Making 5 forecasts with cutoffs between 2013-10-07 00:00:00 and 2015-10-18 00:00:00
INFO:fbprophet:Applying in parallel with <concurrent.futures.process.ProcessPoolExecutor object at 0x7fc84dc78fd0>
Initial log joint probability = -8.95172
    Iter      log prob        ||dx||      ||grad||       alpha      alpha0  # evals  Notes 
Initial log joint probability = -12.7302
    Iter      log prob        ||dx||      ||grad||       alpha      alpha0  # evals  Notes 
Initial log joint probability = -15.1549
    Iter      log prob        ||dx||      ||grad||       alpha      alpha0  # evals  Notes 
Initial log joint probability = -18.717
    Iter      log prob        ||dx||      ||grad||       alpha      alpha0  # evals  Notes 
Initial log joint probability = -23.5879
    Iter      log prob        ||dx||      ||grad||       alpha      alpha0  # evals  Notes 
      55       4675.45   0.000516577       4473.31   1.023e-07       0.001      115  LS failed, Hessian reset 
      99       4678.19   7.40138e-07       4523.79      0.3785      0.9832      173   
    Iter      log prob        ||dx||      ||grad||       alpha      alpha0  # evals  Notes 
      78       7027.13   9.06039e-09       5179.45      0.2672      0.2672      101   
Optimization terminated normally: 
  Convergence detected: absolute parameter change was below tolerance
     124       4678.19   9.81269e-09       4550.14      0.4156      0.4156      208   
Optimization terminated normally: 
  Convergence detected: absolute parameter change was below tolerance
      57       9582.33   3.00389e-09       4517.02      0.1761      0.1761       80   
Optimization terminated normally: 
  Convergence detected: absolute parameter change was below tolerance
      73       11813.1   7.34547e-09       4920.15      0.3199      0.3199      101   
Optimization terminated normally: 
  Convergence detected: absolute parameter change was below tolerance
      99       14233.3    8.4595e-07       4799.73      0.3698           1      129   
    Iter      log prob        ||dx||      ||grad||       alpha      alpha0  # evals  Notes 
     108       14233.3   8.45585e-09       4782.44      0.2483      0.2483      139   
Optimization terminated normally: 
  Convergence detected: absolute parameter change was below tolerance
[I 2020-10-01 04:06:29,054] Trial 448 finished with value: 0.041906807916760096 and parameters: {'changepoint_prior_scale': 0.001023968892967031, 'seasonality_prior_scale': 0.1454987303064079, 'holidays_prior_scale': 0.1314761539598536, 'seasonality_mode': 'additive', 'changepoint_range': 0.5983620031395952}. Best is trial 96 with value: 0.038883738900888705.
Initial log joint probability = -28.8311
    Iter      log prob        ||dx||      ||grad||       alpha      alpha0  # evals  Notes 
      99       18912.5   4.55312e-05       4481.45      0.8246      0.8246      121   
    Iter      log prob        ||dx||      ||grad||       alpha      alpha0  # evals  Notes 
     133       18912.5   9.88476e-09       4237.41      0.4307      0.4307      163   
Optimization terminated normally: 
  Convergence detected: absolute parameter change was below tolerance
INFO:fbprophet:Making 5 forecasts with cutoffs between 2013-10-07 00:00:00 and 2015-10-18 00:00:00
INFO:fbprophet:Applying in parallel with <concurrent.futures.process.ProcessPoolExecutor object at 0x7fc84dcaac90>
Initial log joint probability = -8.95172
    Iter      log prob        ||dx||      ||grad||       alpha      alpha0  # evals  Notes 
Initial log joint probability = -12.7302
    Iter      log prob        ||dx||      ||grad||       alpha      alpha0  # evals  Notes 
Initial log joint probability = -15.1549
    Iter      log prob        ||dx||      ||grad||       alpha      alpha0  # evals  Notes 
Initial log joint probability = -18.717
    Iter      log prob        ||dx||      ||grad||       alpha      alpha0  # evals  Notes 
      48       4672.23    0.00107062       5250.82   2.563e-07       0.001       90  LS failed, Hessian reset 
Initial log joint probability = -23.5879
    Iter      log prob        ||dx||      ||grad||       alpha      alpha0  # evals  Notes 
      96       4678.83   7.65634e-09       4696.16      0.3219      0.3219      151   
Optimization terminated normally: 
  Convergence detected: absolute parameter change was below tolerance
      99       7028.06   1.41301e-07       4752.57           1           1      135   
    Iter      log prob        ||dx||      ||grad||       alpha      alpha0  # evals  Notes 
     107       7028.06   7.72627e-09       5102.72      0.4649      0.4649      144   
Optimization terminated normally: 
  Convergence detected: absolute parameter change was below tolerance
      62       9582.27   1.23523e-06       4491.74   2.612e-10       0.001      137  LS failed, Hessian reset 
      71       11813.1   9.30936e-09        4470.5      0.2644      0.2644      111   
Optimization terminated normally: 
  Convergence detected: absolute parameter change was below tolerance
      99       14231.6   2.12251e-06       4140.54           1           1      132   
    Iter      log prob        ||dx||      ||grad||       alpha      alpha0  # evals  Notes 
      96       9582.28   4.55942e-07       4214.11   8.197e-11       0.001      225  LS failed, Hessian reset 
      99       9582.28   9.35107e-08       4529.04      0.6018      0.6018      228   
    Iter      log prob        ||dx||      ||grad||       alpha      alpha0  # evals  Notes 
     108       9582.28   8.39877e-09       4296.87       0.238       0.238      240   
Optimization terminated normally: 
  Convergence detected: absolute parameter change was below tolerance
     186       14232.2   8.02785e-09       4984.14      0.3031      0.3031      239   
Optimization terminated normally: 
  Convergence detected: absolute parameter change was below tolerance
[I 2020-10-01 04:06:45,415] Trial 449 finished with value: 0.04142734790299208 and parameters: {'changepoint_prior_scale': 0.0010229937104715432, 'seasonality_prior_scale': 0.19239659964343328, 'holidays_prior_scale': 0.10662688618342209, 'seasonality_mode': 'additive', 'changepoint_range': 0.5999111824715735}. Best is trial 96 with value: 0.038883738900888705.
Initial log joint probability = -28.8311
    Iter      log prob        ||dx||      ||grad||       alpha      alpha0  # evals  Notes 
      99       18912.3   0.000247094       4864.27       0.319           1      120   
    Iter      log prob        ||dx||      ||grad||       alpha      alpha0  # evals  Notes 
     137       18912.6   4.43035e-07       5128.29   8.905e-11       0.001      206  LS failed, Hessian reset 
     153       18912.6   9.61641e-09        5065.6      0.4789      0.4789      224   
Optimization terminated normally: 
  Convergence detected: absolute parameter change was below tolerance
INFO:fbprophet:Making 5 forecasts with cutoffs between 2013-10-07 00:00:00 and 2015-10-18 00:00:00
INFO:fbprophet:Applying in parallel with <concurrent.futures.process.ProcessPoolExecutor object at 0x7fc84dca4910>
Initial log joint probability = -8.95172
    Iter      log prob        ||dx||      ||grad||       alpha      alpha0  # evals  Notes 
Initial log joint probability = -12.7302
    Iter      log prob        ||dx||      ||grad||       alpha      alpha0  # evals  Notes 
      72        4678.4   7.97407e-09       5162.77      0.3023      0.3023       91   
Optimization terminated normally: 
  Convergence detected: absolute parameter change was below tolerance
Initial log joint probability = -15.1549
    Iter      log prob        ||dx||      ||grad||       alpha      alpha0  # evals  Notes 
Initial log joint probability = -18.717
    Iter      log prob        ||dx||      ||grad||       alpha      alpha0  # evals  Notes 
Initial log joint probability = -23.5879
    Iter      log prob        ||dx||      ||grad||       alpha      alpha0  # evals  Notes 
      99       7028.12   1.76635e-07       4650.64           1           1      120   
    Iter      log prob        ||dx||      ||grad||       alpha      alpha0  # evals  Notes 
     104       7028.12   6.06502e-08       4651.54   1.239e-11       0.001      164  LS failed, Hessian reset 
     110       7028.12   9.66608e-09       4584.48      0.4045      0.4045      170   
Optimization terminated normally: 
  Convergence detected: absolute parameter change was below tolerance
      57       9582.17   8.15618e-09       4676.63      0.3279      0.3279       82   
Optimization terminated normally: 
  Convergence detected: absolute parameter change was below tolerance
      53         11813    5.9568e-09       5097.62      0.4766      0.4766       77   
Optimization terminated normally: 
  Convergence detected: absolute parameter change was below tolerance
      99       14233.4   7.10416e-07       5042.11      0.5457           1      130   
    Iter      log prob        ||dx||      ||grad||       alpha      alpha0  # evals  Notes 
     109       14233.4   4.36513e-09        4690.5      0.2564      0.2564      143   
Optimization terminated normally: 
  Convergence detected: absolute parameter change was below tolerance
[I 2020-10-01 04:07:00,889] Trial 450 finished with value: 0.04072315383937439 and parameters: {'changepoint_prior_scale': 0.0010091339259880516, 'seasonality_prior_scale': 0.13675576821891, 'holidays_prior_scale': 0.1241507063904143, 'seasonality_mode': 'additive', 'changepoint_range': 0.5887996960332172}. Best is trial 96 with value: 0.038883738900888705.
Initial log joint probability = -28.8311
    Iter      log prob        ||dx||      ||grad||       alpha      alpha0  # evals  Notes 
      99       18912.4   1.05381e-05       4133.19       0.578       0.578      124   
    Iter      log prob        ||dx||      ||grad||       alpha      alpha0  # evals  Notes 
     158         18913   5.06191e-08       4563.41           1           1      200   
Optimization terminated normally: 
  Convergence detected: relative gradient magnitude is below tolerance
INFO:fbprophet:Making 5 forecasts with cutoffs between 2013-10-07 00:00:00 and 2015-10-18 00:00:00
INFO:fbprophet:Applying in parallel with <concurrent.futures.process.ProcessPoolExecutor object at 0x7fc84dc76850>
Initial log joint probability = -8.95172
    Iter      log prob        ||dx||      ||grad||       alpha      alpha0  # evals  Notes 
Initial log joint probability = -12.7302
    Iter      log prob        ||dx||      ||grad||       alpha      alpha0  # evals  Notes 
Initial log joint probability = -15.1549
    Iter      log prob        ||dx||      ||grad||       alpha      alpha0  # evals  Notes 
Initial log joint probability = -18.717
    Iter      log prob        ||dx||      ||grad||       alpha      alpha0  # evals  Notes 
Initial log joint probability = -23.5879
    Iter      log prob        ||dx||      ||grad||       alpha      alpha0  # evals  Notes 
      54       4679.17   2.11377e-05        4438.7   4.778e-09       0.001      121  LS failed, Hessian reset 
      82       4679.24    5.4004e-09       4313.86      0.6404      0.6404      161   
Optimization terminated normally: 
  Convergence detected: absolute parameter change was below tolerance
      86       7028.28   2.34365e-06       4476.36   5.221e-10       0.001      158  LS failed, Hessian reset 
      77       9582.39   5.77464e-09       4258.84      0.1302      0.3943      107   
Optimization terminated normally: 
  Convergence detected: absolute parameter change was below tolerance
      99        7028.3   2.54017e-07       4174.62      0.7673      0.7673      174   
    Iter      log prob        ||dx||      ||grad||       alpha      alpha0  # evals  Notes 
     104        7028.3   5.63401e-09       4023.24      0.2763      0.2763      181   
Optimization terminated normally: 
  Convergence detected: absolute parameter change was below tolerance
      89         11813   5.36556e-09       4335.78      0.5666      0.5666      122   
Optimization terminated normally: 
  Convergence detected: absolute parameter change was below tolerance
      99       14233.3     3.234e-07       4066.64       0.262           1      131   
    Iter      log prob        ||dx||      ||grad||       alpha      alpha0  # evals  Notes 
     110       14233.3   8.69826e-09       4108.76      0.2689      0.2689      146   
Optimization terminated normally: 
  Convergence detected: absolute parameter change was below tolerance
