[I 2020-10-01 02:39:28,565] Trial 105 finished with value: 0.041579545300733184 and parameters: {'changepoint_prior_scale': 0.0013317192035638863, 'seasonality_prior_scale': 0.2294029609523109, 'holidays_prior_scale': 0.029828902935612907, 'seasonality_mode': 'additive', 'changepoint_range': 0.5243001160521462}. Best is trial 96 with value: 0.038883738900888705.
Initial log joint probability = -28.8311
    Iter      log prob        ||dx||      ||grad||       alpha      alpha0  # evals  Notes 
      99         18912   1.41526e-06       2733.04      0.4834      0.4834      144   
    Iter      log prob        ||dx||      ||grad||       alpha      alpha0  # evals  Notes 
     129       18912.1   8.10742e-05       3272.35   3.112e-08       0.001      221  LS failed, Hessian reset 
     199       18912.3   6.19199e-07       2517.73      0.9959      0.9959      311   
    Iter      log prob        ||dx||      ||grad||       alpha      alpha0  # evals  Notes 
     237       18912.3   2.20978e-08       2016.78      0.4807      0.4807      359   
Optimization terminated normally: 
  Convergence detected: relative gradient magnitude is below tolerance
INFO:fbprophet:Making 5 forecasts with cutoffs between 2013-10-07 00:00:00 and 2015-10-18 00:00:00
INFO:fbprophet:Applying in parallel with <concurrent.futures.process.ProcessPoolExecutor object at 0x7fc84dc6fe10>
Initial log joint probability = -8.95172
    Iter      log prob        ||dx||      ||grad||       alpha      alpha0  # evals  Notes 
Initial log joint probability = -12.7302
    Iter      log prob        ||dx||      ||grad||       alpha      alpha0  # evals  Notes 
Initial log joint probability = -15.1549
    Iter      log prob        ||dx||      ||grad||       alpha      alpha0  # evals  Notes 
Initial log joint probability = -18.717
    Iter      log prob        ||dx||      ||grad||       alpha      alpha0  # evals  Notes 
Initial log joint probability = -23.5879
    Iter      log prob        ||dx||      ||grad||       alpha      alpha0  # evals  Notes 
      54       4678.89   2.46346e-05       3077.75   9.005e-09       0.001      104  LS failed, Hessian reset 
      99          4679   1.72427e-07       3025.33      0.8169      0.8169      165   
    Iter      log prob        ||dx||      ||grad||       alpha      alpha0  # evals  Notes 
     106          4679    9.4867e-09        2901.6      0.2573      0.2573      174   
Optimization terminated normally: 
  Convergence detected: absolute parameter change was below tolerance
      99       7029.54   1.46563e-06        2793.6      0.6479      0.6479      121   
    Iter      log prob        ||dx||      ||grad||       alpha      alpha0  # evals  Notes 
      50       11813.3   4.64233e-09        2911.3       0.132       0.132       73   
Optimization terminated normally: 
  Convergence detected: absolute parameter change was below tolerance
      53       9582.39   2.62421e-05       3022.24   8.042e-09       0.001      109  LS failed, Hessian reset 
     162       7031.83   5.37757e-09       2841.58      0.3013      0.3013      200   
Optimization terminated normally: 
  Convergence detected: absolute parameter change was below tolerance
      99       9582.45   9.44552e-08       2842.34      0.4956      0.4956      166   
    Iter      log prob        ||dx||      ||grad||       alpha      alpha0  # evals  Notes 
     107       9582.45   1.47644e-08       2747.38      0.3704           1      177   
Optimization terminated normally: 
  Convergence detected: relative gradient magnitude is below tolerance
      98       14232.6   9.65227e-09       2699.24      0.1857      0.1857      136   
Optimization terminated normally: 
  Convergence detected: absolute parameter change was below tolerance
[I 2020-10-01 02:39:43,059] Trial 106 finished with value: 0.04202392432675365 and parameters: {'changepoint_prior_scale': 0.0016406269401428272, 'seasonality_prior_scale': 0.17960229574175463, 'holidays_prior_scale': 0.06745202309180576, 'seasonality_mode': 'additive', 'changepoint_range': 0.5103229851757176}. Best is trial 96 with value: 0.038883738900888705.
Initial log joint probability = -28.8311
    Iter      log prob        ||dx||      ||grad||       alpha      alpha0  # evals  Notes 
      99       18912.9   5.06299e-07       1958.56      0.2218           1      127   
    Iter      log prob        ||dx||      ||grad||       alpha      alpha0  # evals  Notes 
     144       18912.9   1.39561e-06       2527.15   5.486e-10       0.001      222  LS failed, Hessian reset 
     159       18912.9   1.78589e-08       1843.56      0.3255           1      241   
Optimization terminated normally: 
  Convergence detected: relative gradient magnitude is below tolerance
INFO:fbprophet:Making 5 forecasts with cutoffs between 2013-10-07 00:00:00 and 2015-10-18 00:00:00
INFO:fbprophet:Applying in parallel with <concurrent.futures.process.ProcessPoolExecutor object at 0x7fc84dc3e750>
Initial log joint probability = -8.95172
    Iter      log prob        ||dx||      ||grad||       alpha      alpha0  # evals  Notes 
Initial log joint probability = -12.7302
    Iter      log prob        ||dx||      ||grad||       alpha      alpha0  # evals  Notes 
Initial log joint probability = -15.1549
    Iter      log prob        ||dx||      ||grad||       alpha      alpha0  # evals  Notes 
Initial log joint probability = -18.717
    Iter      log prob        ||dx||      ||grad||       alpha      alpha0  # evals  Notes 
Initial log joint probability = -23.5879
    Iter      log prob        ||dx||      ||grad||       alpha      alpha0  # evals  Notes 
      58       4679.17   1.32831e-05       2372.84     5.5e-09       0.001      116  LS failed, Hessian reset 
      92       4679.23   4.45508e-07       2468.12   1.805e-10       0.001      202  LS failed, Hessian reset 
      99       7031.75    6.9817e-05       2373.18      0.5186      0.5186      115   
    Iter      log prob        ||dx||      ||grad||       alpha      alpha0  # evals  Notes 
      99       4679.23   8.24934e-08       2430.75           1           1      212   
    Iter      log prob        ||dx||      ||grad||       alpha      alpha0  # evals  Notes 
     105       4679.23   1.74216e-09       2289.66      0.1941      0.1941      221   
Optimization terminated normally: 
  Convergence detected: absolute parameter change was below tolerance
      56       9582.54   5.08554e-09       2657.53      0.2315      0.2315       77   
Optimization terminated normally: 
  Convergence detected: absolute parameter change was below tolerance
      47       11813.3   9.08748e-09       2493.76       0.122       0.122       68   
Optimization terminated normally: 
  Convergence detected: absolute parameter change was below tolerance
     142       7032.01   4.36051e-09       2409.56      0.2972      0.2972      165   
Optimization terminated normally: 
  Convergence detected: absolute parameter change was below tolerance
      99       14233.5   8.94602e-07       2354.74      0.8356      0.8356      134   
    Iter      log prob        ||dx||      ||grad||       alpha      alpha0  # evals  Notes 
     120       14233.5   9.13803e-09       2258.96      0.2387      0.7551      162   
Optimization terminated normally: 
  Convergence detected: absolute parameter change was below tolerance
[I 2020-10-01 02:39:58,894] Trial 107 finished with value: 0.041898357769809894 and parameters: {'changepoint_prior_scale': 0.001993772287470635, 'seasonality_prior_scale': 0.30968144564391675, 'holidays_prior_scale': 0.03492476058143799, 'seasonality_mode': 'additive', 'changepoint_range': 0.5629881126820054}. Best is trial 96 with value: 0.038883738900888705.
Initial log joint probability = -28.8311
    Iter      log prob        ||dx||      ||grad||       alpha      alpha0  # evals  Notes 
      99       18912.6   9.24576e-06       4441.88           1           1      134   
    Iter      log prob        ||dx||      ||grad||       alpha      alpha0  # evals  Notes 
     139       18912.7   4.11669e-08          3974           1           1      182   
Optimization terminated normally: 
  Convergence detected: relative gradient magnitude is below tolerance
INFO:fbprophet:Making 5 forecasts with cutoffs between 2013-10-07 00:00:00 and 2015-10-18 00:00:00
INFO:fbprophet:Applying in parallel with <concurrent.futures.process.ProcessPoolExecutor object at 0x7fc88e6a6210>
Initial log joint probability = -8.95172
    Iter      log prob        ||dx||      ||grad||       alpha      alpha0  # evals  Notes 
Initial log joint probability = -12.7302
    Iter      log prob        ||dx||      ||grad||       alpha      alpha0  # evals  Notes 
Initial log joint probability = -15.1549
    Iter      log prob        ||dx||      ||grad||       alpha      alpha0  # evals  Notes 
      41       4677.33   8.31682e-05       3899.16   1.755e-08       0.001       94  LS failed, Hessian reset 
      92       4677.73   9.16037e-09       4417.58      0.4274      0.4274      157   
Optimization terminated normally: 
  Convergence detected: absolute parameter change was below tolerance
Initial log joint probability = -18.717
    Iter      log prob        ||dx||      ||grad||       alpha      alpha0  # evals  Notes 
Initial log joint probability = -23.5879
    Iter      log prob        ||dx||      ||grad||       alpha      alpha0  # evals  Notes 
      99       7029.23   2.07577e-08        4615.7      0.5814      0.5814      129   
    Iter      log prob        ||dx||      ||grad||       alpha      alpha0  # evals  Notes 
     105       7029.23   6.90036e-09       3948.04      0.5672      0.5672      135   
Optimization terminated normally: 
  Convergence detected: absolute parameter change was below tolerance
      99       9581.85   1.76726e-06       4389.23      0.5906      0.5906      129   
    Iter      log prob        ||dx||      ||grad||       alpha      alpha0  # evals  Notes 
      46       11812.7    6.2769e-09       4498.76      0.2001      0.2001       67   
Optimization terminated normally: 
  Convergence detected: absolute parameter change was below tolerance
     128       9581.87   7.47572e-09       4489.14      0.2677      0.2677      168   
Optimization terminated normally: 
  Convergence detected: absolute parameter change was below tolerance
      99       14232.9   5.36475e-05       4601.53           1           1      124   
    Iter      log prob        ||dx||      ||grad||       alpha      alpha0  # evals  Notes 
     138       14233.3   9.51163e-09       4381.84      0.3689      0.3689      173   
Optimization terminated normally: 
  Convergence detected: absolute parameter change was below tolerance
[I 2020-10-01 02:40:14,019] Trial 108 finished with value: 0.042244290978229175 and parameters: {'changepoint_prior_scale': 0.001125368109800158, 'seasonality_prior_scale': 0.24372271554360636, 'holidays_prior_scale': 0.056267666391679086, 'seasonality_mode': 'multiplicative', 'changepoint_range': 0.586382038025774}. Best is trial 96 with value: 0.038883738900888705.
Initial log joint probability = -28.8311
    Iter      log prob        ||dx||      ||grad||       alpha      alpha0  # evals  Notes 
      99       18912.8   5.02143e-07       3867.31      0.7174      0.7174      123   
    Iter      log prob        ||dx||      ||grad||       alpha      alpha0  # evals  Notes 
     137       18912.9   3.12627e-08       3413.14           1           1      172   
Optimization terminated normally: 
  Convergence detected: relative gradient magnitude is below tolerance
INFO:fbprophet:Making 5 forecasts with cutoffs between 2013-10-07 00:00:00 and 2015-10-18 00:00:00
INFO:fbprophet:Applying in parallel with <concurrent.futures.process.ProcessPoolExecutor object at 0x7fc88e6aea10>
Initial log joint probability = -8.95172
    Iter      log prob        ||dx||      ||grad||       alpha      alpha0  # evals  Notes 
Initial log joint probability = -12.7302
    Iter      log prob        ||dx||      ||grad||       alpha      alpha0  # evals  Notes 
Initial log joint probability = -15.1549
    Iter      log prob        ||dx||      ||grad||       alpha      alpha0  # evals  Notes 
Initial log joint probability = -18.717
    Iter      log prob        ||dx||      ||grad||       alpha      alpha0  # evals  Notes 
      69       4679.05   5.60724e-09       3961.66      0.4751      0.4751       87   
Optimization terminated normally: 
  Convergence detected: absolute parameter change was below tolerance
Initial log joint probability = -23.5879
    Iter      log prob        ||dx||      ||grad||       alpha      alpha0  # evals  Notes 
      93       7028.86    3.1813e-05       3809.99   8.379e-09       0.001      166  LS failed, Hessian reset 
      99       7028.94   1.52541e-05       3234.77      0.4557           1      173   
    Iter      log prob        ||dx||      ||grad||       alpha      alpha0  # evals  Notes 
      49       11813.2   8.45983e-09       3593.26        0.32        0.32       74   
Optimization terminated normally: 
  Convergence detected: absolute parameter change was below tolerance
      65       9582.43   7.85947e-06       3753.83   2.025e-09       0.001      131  LS failed, Hessian reset 
      90       9582.45   9.24417e-09        3447.6       0.257       0.257      166   
Optimization terminated normally: 
  Convergence detected: absolute parameter change was below tolerance
     167          7029   6.37594e-08       4063.05   1.696e-11       0.001      293  LS failed, Hessian reset 
     172          7029   4.00342e-09          3234      0.1152      0.2948      300   
Optimization terminated normally: 
  Convergence detected: absolute parameter change was below tolerance
      99       14233.6   1.26795e-05       3510.29      0.2888      0.2888      129   
    Iter      log prob        ||dx||      ||grad||       alpha      alpha0  # evals  Notes 
     125       14233.6   1.44997e-06       4005.86   4.256e-10       0.001      202  LS failed, Hessian reset 
     140       14233.6   9.12865e-09       3533.04      0.1579      0.5714      221   
Optimization terminated normally: 
  Convergence detected: absolute parameter change was below tolerance
[I 2020-10-01 02:40:29,396] Trial 109 finished with value: 0.040923140472043686 and parameters: {'changepoint_prior_scale': 0.001348786446252075, 'seasonality_prior_scale': 0.2025841528512182, 'holidays_prior_scale': 0.024116392973850414, 'seasonality_mode': 'additive', 'changepoint_range': 0.5476333232007338}. Best is trial 96 with value: 0.038883738900888705.
Initial log joint probability = -28.8311
    Iter      log prob        ||dx||      ||grad||       alpha      alpha0  # evals  Notes 
      99       18912.8   2.51618e-07       2275.26           1           1      129   
    Iter      log prob        ||dx||      ||grad||       alpha      alpha0  # evals  Notes 
     100       18912.8   4.55765e-08       2160.16      0.7956      0.7956      130   
Optimization terminated normally: 
  Convergence detected: relative gradient magnitude is below tolerance
INFO:fbprophet:Making 5 forecasts with cutoffs between 2013-10-07 00:00:00 and 2015-10-18 00:00:00
INFO:fbprophet:Applying in parallel with <concurrent.futures.process.ProcessPoolExecutor object at 0x7fc88e664510>
Initial log joint probability = -8.95172
    Iter      log prob        ||dx||      ||grad||       alpha      alpha0  # evals  Notes 
Initial log joint probability = -12.7302
    Iter      log prob        ||dx||      ||grad||       alpha      alpha0  # evals  Notes 
Initial log joint probability = -15.1549
    Iter      log prob        ||dx||      ||grad||       alpha      alpha0  # evals  Notes 
Initial log joint probability = -18.717
    Iter      log prob        ||dx||      ||grad||       alpha      alpha0  # evals  Notes 
      71       4679.23   8.97018e-09       2018.92      0.2504      0.2504       89   
Optimization terminated normally: 
  Convergence detected: absolute parameter change was below tolerance
Initial log joint probability = -23.5879
    Iter      log prob        ||dx||      ||grad||       alpha      alpha0  # evals  Notes 
      99       7031.97   5.66179e-05       2199.08      0.6173      0.6173      112   
    Iter      log prob        ||dx||      ||grad||       alpha      alpha0  # evals  Notes 
     134       7032.05   5.76113e-09       2051.19      0.2634      0.2634      156   
Optimization terminated normally: 
  Convergence detected: absolute parameter change was below tolerance
      81        9582.6   1.30098e-08       2012.91      0.2583           1      104   
Optimization terminated normally: 
  Convergence detected: relative gradient magnitude is below tolerance
      61       11813.3   9.68478e-07       2238.37   4.238e-10       0.001      122  LS failed, Hessian reset 
      77       11813.3   6.75031e-09       2180.42      0.2574      0.2574      143   
Optimization terminated normally: 
  Convergence detected: absolute parameter change was below tolerance
      99       14233.5    7.5962e-07       1933.68           1           1      126   
    Iter      log prob        ||dx||      ||grad||       alpha      alpha0  # evals  Notes 
     165       14233.5   3.32743e-08        1922.9           1           1      206   
Optimization terminated normally: 
  Convergence detected: relative gradient magnitude is below tolerance
[I 2020-10-01 02:40:43,831] Trial 110 finished with value: 0.04174069193768059 and parameters: {'changepoint_prior_scale': 0.002227591106847592, 'seasonality_prior_scale': 0.20503772447648175, 'holidays_prior_scale': 0.019440658776158824, 'seasonality_mode': 'additive', 'changepoint_range': 0.5527443322133779}. Best is trial 96 with value: 0.038883738900888705.
Initial log joint probability = -28.8311
    Iter      log prob        ||dx||      ||grad||       alpha      alpha0  # evals  Notes 
      99       18912.9   3.43145e-05       3534.26      0.6858      0.6858      122   
    Iter      log prob        ||dx||      ||grad||       alpha      alpha0  # evals  Notes 
     129       18912.9   1.15863e-08       3034.13      0.4929      0.4929      164   
Optimization terminated normally: 
  Convergence detected: relative gradient magnitude is below tolerance
INFO:fbprophet:Making 5 forecasts with cutoffs between 2013-10-07 00:00:00 and 2015-10-18 00:00:00
INFO:fbprophet:Applying in parallel with <concurrent.futures.process.ProcessPoolExecutor object at 0x7fc88e685210>
Initial log joint probability = -8.95172
    Iter      log prob        ||dx||      ||grad||       alpha      alpha0  # evals  Notes 
Initial log joint probability = -12.7302
    Iter      log prob        ||dx||      ||grad||       alpha      alpha0  # evals  Notes 
Initial log joint probability = -15.1549
    Iter      log prob        ||dx||      ||grad||       alpha      alpha0  # evals  Notes 
Initial log joint probability = -18.717
    Iter      log prob        ||dx||      ||grad||       alpha      alpha0  # evals  Notes 
Initial log joint probability = -23.5879
    Iter      log prob        ||dx||      ||grad||       alpha      alpha0  # evals  Notes 
      66       4679.22   9.18556e-07       3675.41   2.417e-10       0.001      147  LS failed, Hessian reset 
      93       4679.23   9.35007e-09       3598.99      0.6735      0.6735      179   
Optimization terminated normally: 
  Convergence detected: absolute parameter change was below tolerance
      52       9582.42   8.30926e-09       3292.71      0.2922      0.2922       71   
Optimization terminated normally: 
  Convergence detected: absolute parameter change was below tolerance
      69       7028.76   2.65907e-05       3432.22   6.875e-09       0.001      125  LS failed, Hessian reset 
      99       7028.84   7.98362e-07       3515.58      0.1945           1      159   
    Iter      log prob        ||dx||      ||grad||       alpha      alpha0  # evals  Notes 
      26       11811.7   0.000358859       3803.57   9.898e-08       0.001       89  LS failed, Hessian reset 
     137       7028.87   8.01513e-09       2938.54      0.3612      0.3612      214   
Optimization terminated normally: 
  Convergence detected: absolute parameter change was below tolerance
      76       11813.2   1.16847e-08       3496.93      0.3398      0.8307      147   
Optimization terminated normally: 
  Convergence detected: relative gradient magnitude is below tolerance
      99       14233.6   5.41086e-07        3724.7      0.2034      0.2034      124   
    Iter      log prob        ||dx||      ||grad||       alpha      alpha0  # evals  Notes 
     137       14233.6   1.72641e-08       3809.07           1           1      168   
Optimization terminated normally: 
  Convergence detected: relative gradient magnitude is below tolerance
