[I 2020-10-01 03:17:18,911] Trial 255 finished with value: 0.041087159289546 and parameters: {'changepoint_prior_scale': 0.0015887703504456926, 'seasonality_prior_scale': 0.12375878834577687, 'holidays_prior_scale': 3.7628585655070497, 'seasonality_mode': 'additive', 'changepoint_range': 0.553115178848852}. Best is trial 96 with value: 0.038883738900888705.
Initial log joint probability = -28.8311
    Iter      log prob        ||dx||      ||grad||       alpha      alpha0  # evals  Notes 
      99       18922.6    0.00395265       47.6108           1           1      114   
    Iter      log prob        ||dx||      ||grad||       alpha      alpha0  # evals  Notes 
     199       18923.4    0.00141784        64.722           1           1      220   
    Iter      log prob        ||dx||      ||grad||       alpha      alpha0  # evals  Notes 
     299       18923.8   0.000815408        22.169           1           1      339   
    Iter      log prob        ||dx||      ||grad||       alpha      alpha0  # evals  Notes 
     362       18923.9   3.00888e-05        89.122   2.718e-07       0.001      448  LS failed, Hessian reset 
     399         18924   0.000800018       22.7768           1           1      493   
    Iter      log prob        ||dx||      ||grad||       alpha      alpha0  # evals  Notes 
     474       18924.1   6.21527e-06        14.695   1.545e-07       0.001      627  LS failed, Hessian reset 
Optimization terminated normally: 
  Convergence detected: relative gradient magnitude is below tolerance
INFO:fbprophet:Making 5 forecasts with cutoffs between 2013-10-07 00:00:00 and 2015-10-18 00:00:00
INFO:fbprophet:Applying in parallel with <concurrent.futures.process.ProcessPoolExecutor object at 0x7fc84dc25e50>
Initial log joint probability = -8.95172
    Iter      log prob        ||dx||      ||grad||       alpha      alpha0  # evals  Notes 
Initial log joint probability = -12.7302
    Iter      log prob        ||dx||      ||grad||       alpha      alpha0  # evals  Notes 
Initial log joint probability = -15.1549
    Iter      log prob        ||dx||      ||grad||       alpha      alpha0  # evals  Notes 
      99       4679.33   0.000141067       15.3796           1           1      128   
    Iter      log prob        ||dx||      ||grad||       alpha      alpha0  # evals  Notes 
Initial log joint probability = -18.717
    Iter      log prob        ||dx||      ||grad||       alpha      alpha0  # evals  Notes 
     133       4679.33   1.15379e-06       14.5868      0.2315      0.9669      167   
Optimization terminated normally: 
  Convergence detected: relative gradient magnitude is below tolerance
      52        7039.7     1.231e-05       13.2143   4.608e-07       0.001       99  LS failed, Hessian reset 
Initial log joint probability = -23.5879
    Iter      log prob        ||dx||      ||grad||       alpha      alpha0  # evals  Notes 
      99        7039.8   0.000994207       51.3693      0.8045      0.8045      158   
    Iter      log prob        ||dx||      ||grad||       alpha      alpha0  # evals  Notes 
      99       9588.52    0.00372573       133.868           1           1      115   
    Iter      log prob        ||dx||      ||grad||       alpha      alpha0  # evals  Notes 
     153       7039.91   1.24202e-05       16.4615   7.836e-07       0.001      268  LS failed, Hessian reset 
      99       11820.8    0.00745866       139.044           1           1      114   
    Iter      log prob        ||dx||      ||grad||       alpha      alpha0  # evals  Notes 
     199       7039.93   0.000602091       56.9538           1           1      327   
    Iter      log prob        ||dx||      ||grad||       alpha      alpha0  # evals  Notes 
     199       9589.21   0.000546005       48.8794           1           1      237   
    Iter      log prob        ||dx||      ||grad||       alpha      alpha0  # evals  Notes 
      99       14242.3    0.00127499       237.203      0.5317      0.5317      119   
    Iter      log prob        ||dx||      ||grad||       alpha      alpha0  # evals  Notes 
     223       7039.96   1.61215e-05       20.3953   8.616e-07       0.001      405  LS failed, Hessian reset 
     247       7039.97   3.57884e-05       9.57299   2.933e-06       0.001      480  LS failed, Hessian reset 
     199       11821.5    0.00153597       63.4014           1           1      231   
    Iter      log prob        ||dx||      ||grad||       alpha      alpha0  # evals  Notes 
     299       9589.49    0.00619828        97.761           1           1      368   
    Iter      log prob        ||dx||      ||grad||       alpha      alpha0  # evals  Notes 
     299       7039.98   7.03008e-06       9.59376      0.4381      0.4381      548   
    Iter      log prob        ||dx||      ||grad||       alpha      alpha0  # evals  Notes 
     304       7039.98   1.66061e-06       9.44089     0.03334           1      555   
Optimization terminated normally: 
  Convergence detected: relative gradient magnitude is below tolerance
     199       14243.1   5.19019e-05          21.5       0.352       0.352      237   
    Iter      log prob        ||dx||      ||grad||       alpha      alpha0  # evals  Notes 
     367       9589.56   1.12259e-05       20.8977   3.689e-07       0.001      485  LS failed, Hessian reset 
     299       11821.7    0.00622553       31.4525           1           1      357   
    Iter      log prob        ||dx||      ||grad||       alpha      alpha0  # evals  Notes 
     399       9589.57   2.96871e-05        12.982      0.4037           1      529   
    Iter      log prob        ||dx||      ||grad||       alpha      alpha0  # evals  Notes 
     231       14243.1   1.02707e-05       27.3236    2.97e-07       0.001      315  LS failed, Hessian reset 
     440       9589.59   2.84676e-05       32.6557   1.206e-06       0.001      626  LS failed, Hessian reset 
     351       11821.8   1.60611e-05       25.3061    9.89e-07       0.001      466  LS failed, Hessian reset 
     493       9589.61   3.88588e-06       8.22967       1.595      0.1595      696   
Optimization terminated normally: 
  Convergence detected: relative gradient magnitude is below tolerance
     299       14243.2   6.58664e-05       44.5206      0.2033      0.2033      398   
    Iter      log prob        ||dx||      ||grad||       alpha      alpha0  # evals  Notes 
     399       11821.8   0.000663537       30.0624           1           1      530   
    Iter      log prob        ||dx||      ||grad||       alpha      alpha0  # evals  Notes 
     443       11821.8   2.39608e-06       8.64599      0.2412      0.2412      589   
Optimization terminated normally: 
  Convergence detected: relative gradient magnitude is below tolerance
     381       14243.3   5.84018e-05       148.749   2.972e-07       0.001      536  LS failed, Hessian reset 
     399       14243.4   0.000453197       148.903      0.1894      0.1894      556   
    Iter      log prob        ||dx||      ||grad||       alpha      alpha0  # evals  Notes 
     499       14243.5   4.66617e-05       19.7775      0.7359      0.7359      675   
    Iter      log prob        ||dx||      ||grad||       alpha      alpha0  # evals  Notes 
     570       14243.6   1.60001e-05       37.6191   3.139e-07       0.001      805  LS failed, Hessian reset 
     599       14243.6   6.73594e-05       17.9303      0.3282           1      840   
    Iter      log prob        ||dx||      ||grad||       alpha      alpha0  # evals  Notes 
     638       14243.6    6.4733e-06       13.2876    2.14e-07       0.001      930  LS failed, Hessian reset 
     699       14243.6   0.000731004       42.1207           1           1     1008   
    Iter      log prob        ||dx||      ||grad||       alpha      alpha0  # evals  Notes 
     799       14243.7   0.000320709       47.5438      0.5913      0.5913     1125   
    Iter      log prob        ||dx||      ||grad||       alpha      alpha0  # evals  Notes 
     846       14243.7   3.64267e-06       9.74786   2.468e-07       0.001     1226  LS failed, Hessian reset 
Optimization terminated normally: 
  Convergence detected: relative gradient magnitude is below tolerance
[I 2020-10-01 03:17:35,911] Trial 256 finished with value: 0.04942242656027009 and parameters: {'changepoint_prior_scale': 0.3231791077259089, 'seasonality_prior_scale': 0.059455920605655556, 'holidays_prior_scale': 0.09745939002413073, 'seasonality_mode': 'additive', 'changepoint_range': 0.5697495629633822}. Best is trial 96 with value: 0.038883738900888705.
Initial log joint probability = -28.8311
    Iter      log prob        ||dx||      ||grad||       alpha      alpha0  # evals  Notes 
      99       18912.8   7.29536e-08       3065.19           1           1      125   
    Iter      log prob        ||dx||      ||grad||       alpha      alpha0  # evals  Notes 
     104       18912.8   4.79354e-09       3495.14      0.2389      0.2389      132   
Optimization terminated normally: 
  Convergence detected: absolute parameter change was below tolerance
INFO:fbprophet:Making 5 forecasts with cutoffs between 2013-10-07 00:00:00 and 2015-10-18 00:00:00
INFO:fbprophet:Applying in parallel with <concurrent.futures.process.ProcessPoolExecutor object at 0x7fc84dc4d3d0>
Initial log joint probability = -8.95172
    Iter      log prob        ||dx||      ||grad||       alpha      alpha0  # evals  Notes 
Initial log joint probability = -12.7302
    Iter      log prob        ||dx||      ||grad||       alpha      alpha0  # evals  Notes 
Initial log joint probability = -15.1549
    Iter      log prob        ||dx||      ||grad||       alpha      alpha0  # evals  Notes 
Initial log joint probability = -18.717
    Iter      log prob        ||dx||      ||grad||       alpha      alpha0  # evals  Notes 
Initial log joint probability = -23.5879
    Iter      log prob        ||dx||      ||grad||       alpha      alpha0  # evals  Notes 
      99       4678.97   1.90681e-06       3451.99       1.097      0.1097      121   
    Iter      log prob        ||dx||      ||grad||       alpha      alpha0  # evals  Notes 
     120       4678.98   8.81195e-09       3487.58      0.5515      0.5515      147   
Optimization terminated normally: 
  Convergence detected: absolute parameter change was below tolerance
      72       7028.51    7.1423e-05       3522.38   2.129e-08       0.001      124  LS failed, Hessian reset 
      99       7028.64   1.95006e-06       3159.02      0.2599           1      159   
    Iter      log prob        ||dx||      ||grad||       alpha      alpha0  # evals  Notes 
      76       9582.47   6.36076e-09       3223.02      0.1918      0.1918      106   
Optimization terminated normally: 
  Convergence detected: absolute parameter change was below tolerance
      40       11812.3   0.000173478       3107.83   4.961e-08       0.001       93  LS failed, Hessian reset 
     199       7030.35   8.77798e-05       2595.13      0.4089      0.4089      278   
    Iter      log prob        ||dx||      ||grad||       alpha      alpha0  # evals  Notes 
      97       11813.1   8.91359e-09       3448.37       0.403       0.403      164   
Optimization terminated normally: 
  Convergence detected: absolute parameter change was below tolerance
      99         14232   3.23221e-07       2449.27      0.5306      0.5306      124   
    Iter      log prob        ||dx||      ||grad||       alpha      alpha0  # evals  Notes 
     265       7031.97   1.82604e-09       3613.09      0.1148      0.1148      359   
Optimization terminated normally: 
  Convergence detected: absolute parameter change was below tolerance
     121         14232   6.10851e-09       3737.92      0.3816      0.3816      152   
Optimization terminated normally: 
  Convergence detected: absolute parameter change was below tolerance
[I 2020-10-01 03:17:51,469] Trial 257 finished with value: 0.04167350275556576 and parameters: {'changepoint_prior_scale': 0.001436186956736146, 'seasonality_prior_scale': 0.09503209535373426, 'holidays_prior_scale': 0.1443571881140023, 'seasonality_mode': 'additive', 'changepoint_range': 0.5928380909437398}. Best is trial 96 with value: 0.038883738900888705.
Initial log joint probability = -28.8311
    Iter      log prob        ||dx||      ||grad||       alpha      alpha0  # evals  Notes 
      99       18912.7   6.46925e-06       4061.06      0.7654      0.7654      134   
    Iter      log prob        ||dx||      ||grad||       alpha      alpha0  # evals  Notes 
     151       18912.8   1.96115e-07       4143.07   4.763e-11       0.001      247  LS failed, Hessian reset 
     163       18912.8   7.23777e-09       4506.56      0.4667      0.4667      261   
Optimization terminated normally: 
  Convergence detected: absolute parameter change was below tolerance
INFO:fbprophet:Making 5 forecasts with cutoffs between 2013-10-07 00:00:00 and 2015-10-18 00:00:00
INFO:fbprophet:Applying in parallel with <concurrent.futures.process.ProcessPoolExecutor object at 0x7fc84dc2f550>
Initial log joint probability = -8.95172
    Iter      log prob        ||dx||      ||grad||       alpha      alpha0  # evals  Notes 
Initial log joint probability = -12.7302
    Iter      log prob        ||dx||      ||grad||       alpha      alpha0  # evals  Notes 
Initial log joint probability = -15.1549
    Iter      log prob        ||dx||      ||grad||       alpha      alpha0  # evals  Notes 
Initial log joint probability = -18.717
    Iter      log prob        ||dx||      ||grad||       alpha      alpha0  # evals  Notes 
Initial log joint probability = -23.5879
    Iter      log prob        ||dx||      ||grad||       alpha      alpha0  # evals  Notes 
      64       4678.93   2.99553e-06       4434.47   6.912e-10       0.001      125  LS failed, Hessian reset 
      88       4678.94   3.22426e-09       4214.47      0.3945      0.3945      155   
Optimization terminated normally: 
  Convergence detected: absolute parameter change was below tolerance
      99       7028.21   2.21574e-07       4332.54       0.453       0.453      127   
    Iter      log prob        ||dx||      ||grad||       alpha      alpha0  # evals  Notes 
      66       9582.25   6.57408e-09       3624.26      0.3309           1       98   
Optimization terminated normally: 
  Convergence detected: absolute parameter change was below tolerance
      56         11813   8.72546e-09       4483.92      0.3376      0.3376       81   
Optimization terminated normally: 
  Convergence detected: absolute parameter change was below tolerance
     136       7028.44   1.40178e-05       4524.94   3.024e-09       0.001      211  LS failed, Hessian reset 
     172       7028.51   9.23898e-09       3924.99      0.2243      0.2243      256   
Optimization terminated normally: 
  Convergence detected: absolute parameter change was below tolerance
      99       14230.5    9.1438e-08       4442.13      0.4238      0.4238      129   
    Iter      log prob        ||dx||      ||grad||       alpha      alpha0  # evals  Notes 
     141       14230.5    6.3858e-09       4316.16      0.4002      0.4002      182   
Optimization terminated normally: 
  Convergence detected: absolute parameter change was below tolerance
[I 2020-10-01 03:18:06,638] Trial 258 finished with value: 0.041169799484900314 and parameters: {'changepoint_prior_scale': 0.001148254787487887, 'seasonality_prior_scale': 0.07816451086125654, 'holidays_prior_scale': 2.5457984446683897, 'seasonality_mode': 'additive', 'changepoint_range': 0.5763236368717406}. Best is trial 96 with value: 0.038883738900888705.
Initial log joint probability = -28.8311
    Iter      log prob        ||dx||      ||grad||       alpha      alpha0  # evals  Notes 
      99       18912.8   3.41942e-07       3960.07      0.4404      0.4404      121   
    Iter      log prob        ||dx||      ||grad||       alpha      alpha0  # evals  Notes 
     107       18912.8   6.61544e-06        3762.7   1.793e-09       0.001      170  LS failed, Hessian reset 
     134       18912.9   7.62924e-09       3799.58      0.3349      0.3349      203   
Optimization terminated normally: 
  Convergence detected: absolute parameter change was below tolerance
INFO:fbprophet:Making 5 forecasts with cutoffs between 2013-10-07 00:00:00 and 2015-10-18 00:00:00
INFO:fbprophet:Applying in parallel with <concurrent.futures.process.ProcessPoolExecutor object at 0x7fc84dc4de10>
Initial log joint probability = -8.95172
    Iter      log prob        ||dx||      ||grad||       alpha      alpha0  # evals  Notes 
Initial log joint probability = -12.7302
    Iter      log prob        ||dx||      ||grad||       alpha      alpha0  # evals  Notes 
Initial log joint probability = -15.1549
    Iter      log prob        ||dx||      ||grad||       alpha      alpha0  # evals  Notes 
Initial log joint probability = -18.717
    Iter      log prob        ||dx||      ||grad||       alpha      alpha0  # evals  Notes 
Initial log joint probability = -23.5879
    Iter      log prob        ||dx||      ||grad||       alpha      alpha0  # evals  Notes 
      73        4679.3   8.89666e-09       3834.48      0.1644      0.1644      100   
Optimization terminated normally: 
  Convergence detected: absolute parameter change was below tolerance
      87       7028.91   4.05228e-05       3480.01   9.839e-09       0.001      152  LS failed, Hessian reset 
      99       7029.02   1.46154e-06       3795.31      0.4067      0.4067      164   
    Iter      log prob        ||dx||      ||grad||       alpha      alpha0  # evals  Notes 
      99       9582.42   4.52953e-06       3875.04           1           1      125   
    Iter      log prob        ||dx||      ||grad||       alpha      alpha0  # evals  Notes 
     134       7029.03   6.67107e-09       3465.28      0.2215           1      209   
Optimization terminated normally: 
  Convergence detected: absolute parameter change was below tolerance
     115       9582.43   7.50547e-09       3692.61      0.2079      0.2079      145   
Optimization terminated normally: 
  Convergence detected: absolute parameter change was below tolerance
      77       11813.2   6.59492e-09       3875.59      0.3155      0.3155      111   
Optimization terminated normally: 
  Convergence detected: absolute parameter change was below tolerance
      99       14232.9   1.07702e-07       3628.84           1           1      130   
    Iter      log prob        ||dx||      ||grad||       alpha      alpha0  # evals  Notes 
     107       14232.9   9.80774e-09       3838.97      0.4589      0.4589      139   
Optimization terminated normally: 
  Convergence detected: absolute parameter change was below tolerance
