[I 2020-10-01 02:54:07,191] Trial 163 finished with value: 0.041197008149092 and parameters: {'changepoint_prior_scale': 0.0011235493794633478, 'seasonality_prior_scale': 0.14852073243310465, 'holidays_prior_scale': 0.2281046083775267, 'seasonality_mode': 'additive', 'changepoint_range': 0.5828243694381265}. Best is trial 96 with value: 0.038883738900888705.
Initial log joint probability = -28.8311
    Iter      log prob        ||dx||      ||grad||       alpha      alpha0  # evals  Notes 
      99       18911.7   5.44836e-06       5084.32      0.9401      0.9401      125   
    Iter      log prob        ||dx||      ||grad||       alpha      alpha0  # evals  Notes 
     161       18912.7   2.33949e-08       4914.55      0.2955           1      196   
Optimization terminated normally: 
  Convergence detected: relative gradient magnitude is below tolerance
INFO:fbprophet:Making 5 forecasts with cutoffs between 2013-10-07 00:00:00 and 2015-10-18 00:00:00
INFO:fbprophet:Applying in parallel with <concurrent.futures.process.ProcessPoolExecutor object at 0x7fc84dbb2a10>
Initial log joint probability = -8.95172
    Iter      log prob        ||dx||      ||grad||       alpha      alpha0  # evals  Notes 
Initial log joint probability = -12.7302
    Iter      log prob        ||dx||      ||grad||       alpha      alpha0  # evals  Notes 
Initial log joint probability = -15.1549
    Iter      log prob        ||dx||      ||grad||       alpha      alpha0  # evals  Notes 
      66       4678.78    8.0556e-09       4838.73      0.7789      0.7789       89   
Optimization terminated normally: 
  Convergence detected: absolute parameter change was below tolerance
Initial log joint probability = -18.717
    Iter      log prob        ||dx||      ||grad||       alpha      alpha0  # evals  Notes 
Initial log joint probability = -23.5879
    Iter      log prob        ||dx||      ||grad||       alpha      alpha0  # evals  Notes 
      99       7028.16   2.82515e-08       4870.76      0.3346      0.3346      130   
    Iter      log prob        ||dx||      ||grad||       alpha      alpha0  # evals  Notes 
      61       9582.19   4.03637e-09       5144.04      0.4469      0.4469       90   
Optimization terminated normally: 
  Convergence detected: absolute parameter change was below tolerance
     116       7028.16   4.61119e-09       4561.81       0.677       0.677      149   
Optimization terminated normally: 
  Convergence detected: absolute parameter change was below tolerance
      72       11812.7   4.24597e-09       4999.97       0.582       0.582      105   
Optimization terminated normally: 
  Convergence detected: absolute parameter change was below tolerance
      99       14232.3   1.63323e-05       5034.95      0.2339      0.2339      132   
    Iter      log prob        ||dx||      ||grad||       alpha      alpha0  # evals  Notes 
     124       14232.5   1.68015e-05       5191.83   3.335e-09       0.001      202  LS failed, Hessian reset 
     181       14232.6   8.23559e-09       4894.45      0.2593      0.2593      275   
Optimization terminated normally: 
  Convergence detected: absolute parameter change was below tolerance
[I 2020-10-01 02:54:23,036] Trial 164 finished with value: 0.040994143594229523 and parameters: {'changepoint_prior_scale': 0.0010019404479140422, 'seasonality_prior_scale': 0.10743954152292855, 'holidays_prior_scale': 0.5458425716191336, 'seasonality_mode': 'additive', 'changepoint_range': 0.5708164802864926}. Best is trial 96 with value: 0.038883738900888705.
Initial log joint probability = -28.8311
    Iter      log prob        ||dx||      ||grad||       alpha      alpha0  # evals  Notes 
      99       18912.8   2.57557e-06       3374.46      0.2478      0.2478      129   
    Iter      log prob        ||dx||      ||grad||       alpha      alpha0  # evals  Notes 
     122       18912.8   5.97803e-08       2815.64           1           1      159   
Optimization terminated normally: 
  Convergence detected: relative gradient magnitude is below tolerance
INFO:fbprophet:Making 5 forecasts with cutoffs between 2013-10-07 00:00:00 and 2015-10-18 00:00:00
INFO:fbprophet:Applying in parallel with <concurrent.futures.process.ProcessPoolExecutor object at 0x7fc88e683450>
Initial log joint probability = -8.95172
    Iter      log prob        ||dx||      ||grad||       alpha      alpha0  # evals  Notes 
Initial log joint probability = -12.7302
    Iter      log prob        ||dx||      ||grad||       alpha      alpha0  # evals  Notes 
Initial log joint probability = -15.1549
    Iter      log prob        ||dx||      ||grad||       alpha      alpha0  # evals  Notes 
Initial log joint probability = -18.717
    Iter      log prob        ||dx||      ||grad||       alpha      alpha0  # evals  Notes 
Initial log joint probability = -23.5879
    Iter      log prob        ||dx||      ||grad||       alpha      alpha0  # evals  Notes 
      99       4679.29   3.33318e-05       3216.91           1           1      138   
    Iter      log prob        ||dx||      ||grad||       alpha      alpha0  # evals  Notes 
     138       4679.43   9.87858e-09       3266.53      0.5623      0.5623      187   
Optimization terminated normally: 
  Convergence detected: absolute parameter change was below tolerance
      76       7029.13   3.54624e-05       3009.62   1.148e-08       0.001      143  LS failed, Hessian reset 
      99       7029.27   9.28134e-07       2973.13      0.5756      0.5756      171   
    Iter      log prob        ||dx||      ||grad||       alpha      alpha0  # evals  Notes 
      81       9582.53   7.62273e-09       3333.99      0.4586      0.4586      116   
Optimization terminated normally: 
  Convergence detected: absolute parameter change was below tolerance
     122       7029.27   7.48081e-09       3192.76      0.4027      0.4027      200   
Optimization terminated normally: 
  Convergence detected: absolute parameter change was below tolerance
      87       11813.3   3.96499e-07       3237.62    1.21e-10       0.001      169  LS failed, Hessian reset 
      99       14230.8   0.000278443       3029.57      0.4194      0.9067      135   
    Iter      log prob        ||dx||      ||grad||       alpha      alpha0  # evals  Notes 
      97       11813.3   8.76615e-09       3290.73      0.3067      0.3067      181   
Optimization terminated normally: 
  Convergence detected: absolute parameter change was below tolerance
     142       14231.1   8.24188e-09       3081.43     0.07796           1      190   
Optimization terminated normally: 
  Convergence detected: absolute parameter change was below tolerance
[I 2020-10-01 02:54:37,696] Trial 165 finished with value: 0.04126846556759829 and parameters: {'changepoint_prior_scale': 0.0015132499175830136, 'seasonality_prior_scale': 0.3563945015546311, 'holidays_prior_scale': 0.13552053489307272, 'seasonality_mode': 'additive', 'changepoint_range': 0.5330987539236537}. Best is trial 96 with value: 0.038883738900888705.
Initial log joint probability = -28.8311
    Iter      log prob        ||dx||      ||grad||       alpha      alpha0  # evals  Notes 
      99       18912.8   2.76227e-05       3991.59      0.2623      0.9394      127   
    Iter      log prob        ||dx||      ||grad||       alpha      alpha0  # evals  Notes 
     131       18912.9   6.20788e-09       4335.13      0.4779      0.4779      169   
Optimization terminated normally: 
  Convergence detected: absolute parameter change was below tolerance
INFO:fbprophet:Making 5 forecasts with cutoffs between 2013-10-07 00:00:00 and 2015-10-18 00:00:00
INFO:fbprophet:Applying in parallel with <concurrent.futures.process.ProcessPoolExecutor object at 0x7fc88e66c610>
Initial log joint probability = -8.95172
    Iter      log prob        ||dx||      ||grad||       alpha      alpha0  # evals  Notes 
Initial log joint probability = -12.7302
    Iter      log prob        ||dx||      ||grad||       alpha      alpha0  # evals  Notes 
Initial log joint probability = -15.1549
    Iter      log prob        ||dx||      ||grad||       alpha      alpha0  # evals  Notes 
Initial log joint probability = -18.717
    Iter      log prob        ||dx||      ||grad||       alpha      alpha0  # evals  Notes 
Initial log joint probability = -23.5879
    Iter      log prob        ||dx||      ||grad||       alpha      alpha0  # evals  Notes 
      48        4679.3   1.02262e-05       4167.37   2.564e-09       0.001      105  LS failed, Hessian reset 
      67       4679.32    9.9509e-09        4087.2      0.1529      0.1529      131   
Optimization terminated normally: 
  Convergence detected: absolute parameter change was below tolerance
      74       7028.69     4.729e-05       3921.27   1.089e-08       0.001      129  LS failed, Hessian reset 
      99       7028.82    3.7572e-06       3941.81      0.8093      0.8093      159   
    Iter      log prob        ||dx||      ||grad||       alpha      alpha0  # evals  Notes 
      75       9582.34   1.58929e-06       3993.36   3.661e-10       0.001      139  LS failed, Hessian reset 
     131       7028.83   2.29836e-07       4206.32   5.541e-11       0.001      242  LS failed, Hessian reset 
     147       7028.84   2.82528e-09       3889.33      0.1836      0.1836      261   
Optimization terminated normally: 
  Convergence detected: absolute parameter change was below tolerance
      89       11813.2   4.86547e-09       4151.75      0.4658      0.4658      120   
Optimization terminated normally: 
  Convergence detected: absolute parameter change was below tolerance
      99       9582.34   9.85309e-09       4333.04      0.4508      0.4508      172   
Optimization terminated normally: 
  Convergence detected: absolute parameter change was below tolerance
      99       14232.7   1.29226e-07       3944.18       0.386       0.386      130   
    Iter      log prob        ||dx||      ||grad||       alpha      alpha0  # evals  Notes 
     111       14232.7   3.69402e-09       4000.95      0.2035      0.2035      145   
Optimization terminated normally: 
  Convergence detected: absolute parameter change was below tolerance
[I 2020-10-01 02:54:53,516] Trial 166 finished with value: 0.04111300823033731 and parameters: {'changepoint_prior_scale': 0.001225434300602909, 'seasonality_prior_scale': 0.27916113782272656, 'holidays_prior_scale': 0.07149287721293496, 'seasonality_mode': 'additive', 'changepoint_range': 0.5251079856509105}. Best is trial 96 with value: 0.038883738900888705.
Initial log joint probability = -28.8311
    Iter      log prob        ||dx||      ||grad||       alpha      alpha0  # evals  Notes 
      99       18912.7   9.25391e-05       3748.01           1           1      120   
    Iter      log prob        ||dx||      ||grad||       alpha      alpha0  # evals  Notes 
     142       18912.9   4.93144e-08       3580.92      0.8322      0.8322      174   
Optimization terminated normally: 
  Convergence detected: relative gradient magnitude is below tolerance
INFO:fbprophet:Making 5 forecasts with cutoffs between 2013-10-07 00:00:00 and 2015-10-18 00:00:00
INFO:fbprophet:Applying in parallel with <concurrent.futures.process.ProcessPoolExecutor object at 0x7fc88e67f650>
Initial log joint probability = -8.95172
    Iter      log prob        ||dx||      ||grad||       alpha      alpha0  # evals  Notes 
Initial log joint probability = -12.7302
    Iter      log prob        ||dx||      ||grad||       alpha      alpha0  # evals  Notes 
Initial log joint probability = -15.1549
    Iter      log prob        ||dx||      ||grad||       alpha      alpha0  # evals  Notes 
Initial log joint probability = -18.717
    Iter      log prob        ||dx||      ||grad||       alpha      alpha0  # evals  Notes 
Initial log joint probability = -23.5879
    Iter      log prob        ||dx||      ||grad||       alpha      alpha0  # evals  Notes 
      75       4679.05   6.87231e-09       3492.25      0.2719      0.2719      102   
Optimization terminated normally: 
  Convergence detected: absolute parameter change was below tolerance
      89       7028.98   4.27862e-05       3446.96   1.066e-08       0.001      148  LS failed, Hessian reset 
      72       9582.36   8.87693e-09       2956.01      0.2296      0.2296       98   
Optimization terminated normally: 
  Convergence detected: absolute parameter change was below tolerance
      99       7029.06   4.74983e-06       3073.73           1           1      160   
    Iter      log prob        ||dx||      ||grad||       alpha      alpha0  # evals  Notes 
      25         11811   0.000634202       3655.61   1.531e-07       0.001       74  LS failed, Hessian reset 
     136       7029.07   4.73861e-09       3345.42      0.2091      0.2091      204   
Optimization terminated normally: 
  Convergence detected: absolute parameter change was below tolerance
      99       11813.1   1.87158e-08       3771.82      0.3742      0.3742      166   
    Iter      log prob        ||dx||      ||grad||       alpha      alpha0  # evals  Notes 
     105       11813.1   8.80555e-09       3771.14      0.2873       0.745      174   
Optimization terminated normally: 
  Convergence detected: absolute parameter change was below tolerance
      99         14233   1.19112e-07       3698.44           1           1      135   
    Iter      log prob        ||dx||      ||grad||       alpha      alpha0  # evals  Notes 
     108         14233    1.0013e-08       3526.95      0.2658           1      147   
Optimization terminated normally: 
  Convergence detected: relative gradient magnitude is below tolerance
[I 2020-10-01 02:55:08,807] Trial 167 finished with value: 0.040870673024270214 and parameters: {'changepoint_prior_scale': 0.0013261792086320286, 'seasonality_prior_scale': 0.08225612105372923, 'holidays_prior_scale': 0.0857087041122268, 'seasonality_mode': 'additive', 'changepoint_range': 0.5492164624356963}. Best is trial 96 with value: 0.038883738900888705.
Initial log joint probability = -28.8311
    Iter      log prob        ||dx||      ||grad||       alpha      alpha0  # evals  Notes 
      99       18911.3   1.40113e-05       5390.09           1           1      127   
    Iter      log prob        ||dx||      ||grad||       alpha      alpha0  # evals  Notes 
     148       18912.6   8.56102e-09       4434.47      0.3832      0.3832      190   
Optimization terminated normally: 
  Convergence detected: absolute parameter change was below tolerance
INFO:fbprophet:Making 5 forecasts with cutoffs between 2013-10-07 00:00:00 and 2015-10-18 00:00:00
INFO:fbprophet:Applying in parallel with <concurrent.futures.process.ProcessPoolExecutor object at 0x7fc88e69a090>
Initial log joint probability = -8.95172
    Iter      log prob        ||dx||      ||grad||       alpha      alpha0  # evals  Notes 
Initial log joint probability = -12.7302
    Iter      log prob        ||dx||      ||grad||       alpha      alpha0  # evals  Notes 
Initial log joint probability = -15.1549
    Iter      log prob        ||dx||      ||grad||       alpha      alpha0  # evals  Notes 
Initial log joint probability = -18.717
    Iter      log prob        ||dx||      ||grad||       alpha      alpha0  # evals  Notes 
Initial log joint probability = -23.5879
    Iter      log prob        ||dx||      ||grad||       alpha      alpha0  # evals  Notes 
      55       4678.19    0.00010883       5035.01   2.138e-08       0.001      114  LS failed, Hessian reset 
      99       4678.81    1.1094e-06       4869.61           1           1      172   
    Iter      log prob        ||dx||      ||grad||       alpha      alpha0  # evals  Notes 
     110       4678.86    2.4846e-06       4835.76    5.24e-10       0.001      226  LS failed, Hessian reset 
      96       7028.17   9.28949e-09       4773.47      0.3561           1      125   
Optimization terminated normally: 
  Convergence detected: absolute parameter change was below tolerance
      66       9582.24   9.28024e-09       4897.55      0.3058      0.8793       95   
Optimization terminated normally: 
  Convergence detected: absolute parameter change was below tolerance
     137       4678.87   1.83167e-07       4837.13    3.73e-11       0.001      304  LS failed, Hessian reset 
     145       4678.87   9.33972e-09       4796.37      0.6083      0.6083      313   
Optimization terminated normally: 
  Convergence detected: absolute parameter change was below tolerance
      60       11812.9   8.54787e-09       5044.68      0.4491      0.4491       87   
Optimization terminated normally: 
  Convergence detected: absolute parameter change was below tolerance
      99       14233.2   2.48889e-07       5123.85           1           1      132   
    Iter      log prob        ||dx||      ||grad||       alpha      alpha0  # evals  Notes 
     108       14233.2   4.95356e-09       4708.84      0.4968      0.4968      145   
Optimization terminated normally: 
  Convergence detected: absolute parameter change was below tolerance
[I 2020-10-01 02:55:23,691] Trial 168 finished with value: 0.04125884466029902 and parameters: {'changepoint_prior_scale': 0.001011701505971233, 'seasonality_prior_scale': 0.5029322111193427, 'holidays_prior_scale': 0.09782337540820737, 'seasonality_mode': 'additive', 'changepoint_range': 0.5607833833995243}. Best is trial 96 with value: 0.038883738900888705.
Initial log joint probability = -28.8311
    Iter      log prob        ||dx||      ||grad||       alpha      alpha0  # evals  Notes 
      99       18912.9   1.19835e-06       2652.72      0.8697      0.8697      116   
    Iter      log prob        ||dx||      ||grad||       alpha      alpha0  # evals  Notes 
     120       18912.9   1.01026e-07        2533.4      0.8605      0.8605      145   
Optimization terminated normally: 
  Convergence detected: relative gradient magnitude is below tolerance
INFO:fbprophet:Making 5 forecasts with cutoffs between 2013-10-07 00:00:00 and 2015-10-18 00:00:00
INFO:fbprophet:Applying in parallel with <concurrent.futures.process.ProcessPoolExecutor object at 0x7fc84dc4de10>
Initial log joint probability = -8.95172
    Iter      log prob        ||dx||      ||grad||       alpha      alpha0  # evals  Notes 
Initial log joint probability = -12.7302
    Iter      log prob        ||dx||      ||grad||       alpha      alpha0  # evals  Notes 
Initial log joint probability = -15.1549
    Iter      log prob        ||dx||      ||grad||       alpha      alpha0  # evals  Notes 
Initial log joint probability = -18.717
    Iter      log prob        ||dx||      ||grad||       alpha      alpha0  # evals  Notes 
Initial log joint probability = -23.5879
    Iter      log prob        ||dx||      ||grad||       alpha      alpha0  # evals  Notes 
      58       4678.68    4.9008e-05       2789.25   1.638e-08       0.001      117  LS failed, Hessian reset 
      97       4678.77   4.00161e-09       3097.72      0.4799      0.4799      167   
Optimization terminated normally: 
  Convergence detected: absolute parameter change was below tolerance
      57       9582.59   9.33657e-09       3073.58      0.2901      0.2901       80   
Optimization terminated normally: 
  Convergence detected: absolute parameter change was below tolerance
      99       7029.57   5.48921e-07       2728.89      0.9538      0.9538      133   
    Iter      log prob        ||dx||      ||grad||       alpha      alpha0  # evals  Notes 
     119       7029.57   6.05396e-09        2676.6      0.3382      0.3382      158   
Optimization terminated normally: 
  Convergence detected: absolute parameter change was below tolerance
      38       11811.9   0.000175401       2581.48    6.08e-08       0.001      108  LS failed, Hessian reset 
      80       11813.2    5.4652e-09       2954.38      0.3212      0.8632      168   
Optimization terminated normally: 
  Convergence detected: absolute parameter change was below tolerance
      99       14232.2   1.40904e-07       2507.51       0.482       0.482      135   
    Iter      log prob        ||dx||      ||grad||       alpha      alpha0  # evals  Notes 
     128       14232.2   8.46872e-07       2306.64   2.795e-10       0.001      224  LS failed, Hessian reset 
     145       14232.2    2.3387e-08       2462.74      0.9001      0.9001      245   
Optimization terminated normally: 
  Convergence detected: relative gradient magnitude is below tolerance
