[I 2020-10-01 04:02:41,427] Trial 433 finished with value: 0.04081897834087516 and parameters: {'changepoint_prior_scale': 0.001005256021887501, 'seasonality_prior_scale': 0.21024930986701726, 'holidays_prior_scale': 0.162547151966252, 'seasonality_mode': 'additive', 'changepoint_range': 0.5447017088292043}. Best is trial 96 with value: 0.038883738900888705.
Initial log joint probability = -28.8311
    Iter      log prob        ||dx||      ||grad||       alpha      alpha0  # evals  Notes 
      99       18912.7   9.84448e-06          3539           1           1      129   
    Iter      log prob        ||dx||      ||grad||       alpha      alpha0  # evals  Notes 
     115       18912.7   7.33769e-09          3485      0.2081      0.2081      149   
Optimization terminated normally: 
  Convergence detected: absolute parameter change was below tolerance
INFO:fbprophet:Making 5 forecasts with cutoffs between 2013-10-07 00:00:00 and 2015-10-18 00:00:00
INFO:fbprophet:Applying in parallel with <concurrent.futures.process.ProcessPoolExecutor object at 0x7fc84dbf3c90>
Initial log joint probability = -8.95172
    Iter      log prob        ||dx||      ||grad||       alpha      alpha0  # evals  Notes 
Initial log joint probability = -12.7302
    Iter      log prob        ||dx||      ||grad||       alpha      alpha0  # evals  Notes 
Initial log joint probability = -15.1549
    Iter      log prob        ||dx||      ||grad||       alpha      alpha0  # evals  Notes 
Initial log joint probability = -18.717
    Iter      log prob        ||dx||      ||grad||       alpha      alpha0  # evals  Notes 
      60        4679.1   5.99669e-09       3867.25      0.4565      0.4565       84   
Optimization terminated normally: 
  Convergence detected: absolute parameter change was below tolerance
Initial log joint probability = -23.5879
    Iter      log prob        ||dx||      ||grad||       alpha      alpha0  # evals  Notes 
      81        7028.8   4.10511e-05       3993.67   1.046e-08       0.001      133  LS failed, Hessian reset 
      99       7028.93   1.03846e-06       3716.55           1           1      156   
    Iter      log prob        ||dx||      ||grad||       alpha      alpha0  # evals  Notes 
      59       9582.39   1.70857e-05       3578.25   3.817e-09       0.001      117  LS failed, Hessian reset 
     133       7028.93   6.19393e-09       3968.13      0.4502      0.4502      198   
Optimization terminated normally: 
  Convergence detected: absolute parameter change was below tolerance
      42       11811.5    0.00017863       3161.23   3.831e-08       0.001      112  LS failed, Hessian reset 
      93       9582.43   8.89795e-09       3972.71      0.2447           1      158   
Optimization terminated normally: 
  Convergence detected: absolute parameter change was below tolerance
      99       14232.5   2.55848e-06       3659.26           1           1      127   
    Iter      log prob        ||dx||      ||grad||       alpha      alpha0  # evals  Notes 
      80       11812.9    6.4254e-06       4287.83   1.561e-09       0.001      200  LS failed, Hessian reset 
     121       14232.5   6.29053e-09       3722.78      0.3501      0.3501      154   
Optimization terminated normally: 
  Convergence detected: absolute parameter change was below tolerance
      99       11812.9   8.05182e-08       3463.14      0.3671      0.3671      223   
    Iter      log prob        ||dx||      ||grad||       alpha      alpha0  # evals  Notes 
     107       11812.9   8.72913e-09        3766.1      0.3853           1      235   
Optimization terminated normally: 
  Convergence detected: absolute parameter change was below tolerance
[I 2020-10-01 04:02:57,055] Trial 434 finished with value: 0.04130379071953546 and parameters: {'changepoint_prior_scale': 0.0012671150387476406, 'seasonality_prior_scale': 0.1130100706926399, 'holidays_prior_scale': 0.19781814264865083, 'seasonality_mode': 'additive', 'changepoint_range': 0.5504081252728525}. Best is trial 96 with value: 0.038883738900888705.
Initial log joint probability = -28.8311
    Iter      log prob        ||dx||      ||grad||       alpha      alpha0  # evals  Notes 
      99       18912.5   0.000263549       3370.64       0.169           1      115   
    Iter      log prob        ||dx||      ||grad||       alpha      alpha0  # evals  Notes 
     131       18912.6   2.77556e-08       3019.18      0.7887      0.7887      158   
Optimization terminated normally: 
  Convergence detected: relative gradient magnitude is below tolerance
INFO:fbprophet:Making 5 forecasts with cutoffs between 2013-10-07 00:00:00 and 2015-10-18 00:00:00
INFO:fbprophet:Applying in parallel with <concurrent.futures.process.ProcessPoolExecutor object at 0x7fc84dc1ead0>
Initial log joint probability = -8.95172
    Iter      log prob        ||dx||      ||grad||       alpha      alpha0  # evals  Notes 
Initial log joint probability = -12.7302
    Iter      log prob        ||dx||      ||grad||       alpha      alpha0  # evals  Notes 
Initial log joint probability = -15.1549
    Iter      log prob        ||dx||      ||grad||       alpha      alpha0  # evals  Notes 
Initial log joint probability = -18.717
    Iter      log prob        ||dx||      ||grad||       alpha      alpha0  # evals  Notes 
Initial log joint probability = -23.5879
    Iter      log prob        ||dx||      ||grad||       alpha      alpha0  # evals  Notes 
      84       4679.16   5.74009e-09       3417.25       0.352       0.352      113   
Optimization terminated normally: 
  Convergence detected: absolute parameter change was below tolerance
      71       7029.28   3.08493e-05       3152.78   9.469e-09       0.001      127  LS failed, Hessian reset 
      60       9582.47   6.83919e-09       3328.75      0.3083      0.3083       85   
Optimization terminated normally: 
  Convergence detected: absolute parameter change was below tolerance
      99       7029.37   1.95228e-07       3719.72        0.47        0.47      159   
    Iter      log prob        ||dx||      ||grad||       alpha      alpha0  # evals  Notes 
      67       11813.3   3.11752e-09       3351.51      0.1663      0.1663       97   
Optimization terminated normally: 
  Convergence detected: absolute parameter change was below tolerance
     145       7029.39   6.49666e-09       2703.07       0.245       0.245      221   
Optimization terminated normally: 
  Convergence detected: absolute parameter change was below tolerance
      99       14233.4   9.37653e-07       3116.32      0.2778           1      129   
    Iter      log prob        ||dx||      ||grad||       alpha      alpha0  # evals  Notes 
     136       14233.4   8.42427e-09       3229.63      0.2359      0.2359      179   
Optimization terminated normally: 
  Convergence detected: absolute parameter change was below tolerance
[I 2020-10-01 04:03:13,207] Trial 435 finished with value: 0.04080309857681911 and parameters: {'changepoint_prior_scale': 0.0015170202400178825, 'seasonality_prior_scale': 0.1851023655940855, 'holidays_prior_scale': 0.23444438818686805, 'seasonality_mode': 'additive', 'changepoint_range': 0.5358574912336138}. Best is trial 96 with value: 0.038883738900888705.
Initial log joint probability = -28.8311
    Iter      log prob        ||dx||      ||grad||       alpha      alpha0  # evals  Notes 
      99       18912.5   8.96254e-06       4048.48      0.5668      0.5668      121   
    Iter      log prob        ||dx||      ||grad||       alpha      alpha0  # evals  Notes 
     196       18912.8   8.62632e-09       3496.84      0.4701      0.4701      242   
Optimization terminated normally: 
  Convergence detected: absolute parameter change was below tolerance
INFO:fbprophet:Making 5 forecasts with cutoffs between 2013-10-07 00:00:00 and 2015-10-18 00:00:00
INFO:fbprophet:Applying in parallel with <concurrent.futures.process.ProcessPoolExecutor object at 0x7fc84dc76f50>
Initial log joint probability = -8.95172
    Iter      log prob        ||dx||      ||grad||       alpha      alpha0  # evals  Notes 
Initial log joint probability = -12.7302
    Iter      log prob        ||dx||      ||grad||       alpha      alpha0  # evals  Notes 
Initial log joint probability = -15.1549
    Iter      log prob        ||dx||      ||grad||       alpha      alpha0  # evals  Notes 
Initial log joint probability = -18.717
    Iter      log prob        ||dx||      ||grad||       alpha      alpha0  # evals  Notes 
Initial log joint probability = -23.5879
    Iter      log prob        ||dx||      ||grad||       alpha      alpha0  # evals  Notes 
      98       4679.27   4.79511e-09       4412.81      0.1763      0.1763      127   
Optimization terminated normally: 
  Convergence detected: absolute parameter change was below tolerance
      63       9582.36   4.24446e-09       4175.13      0.5212      0.5212       89   
Optimization terminated normally: 
  Convergence detected: absolute parameter change was below tolerance
      91       7027.67   2.17478e-05       4454.24   5.023e-09       0.001      160  LS failed, Hessian reset 
      99       7027.74   2.94219e-06       4012.91      0.5903      0.5903      168   
    Iter      log prob        ||dx||      ||grad||       alpha      alpha0  # evals  Notes 
     125       7027.77   9.25788e-09       3960.16      0.1609      0.1609      202   
Optimization terminated normally: 
  Convergence detected: absolute parameter change was below tolerance
      72         11813   5.46599e-09        4413.8      0.3677      0.3677      104   
Optimization terminated normally: 
  Convergence detected: absolute parameter change was below tolerance
      99       14232.8   3.96295e-08       4489.45      0.3607      0.3607      127   
    Iter      log prob        ||dx||      ||grad||       alpha      alpha0  # evals  Notes 
     108       14232.8    3.9852e-09       4591.49      0.1752      0.1752      137   
Optimization terminated normally: 
  Convergence detected: absolute parameter change was below tolerance
[I 2020-10-01 04:03:28,418] Trial 436 finished with value: 0.0411868373870409 and parameters: {'changepoint_prior_scale': 0.0011217746951834129, 'seasonality_prior_scale': 0.1298913568449991, 'holidays_prior_scale': 0.12563492963637415, 'seasonality_mode': 'additive', 'changepoint_range': 0.5623350593853801}. Best is trial 96 with value: 0.038883738900888705.
Initial log joint probability = -28.8311
    Iter      log prob        ||dx||      ||grad||       alpha      alpha0  # evals  Notes 
      99       18912.9    3.8079e-07       3281.83           1           1      128   
    Iter      log prob        ||dx||      ||grad||       alpha      alpha0  # evals  Notes 
     108       18912.9    2.1465e-07       3457.15    5.87e-11       0.001      179  LS failed, Hessian reset 
     113       18912.9   2.84626e-08       3550.11      0.2339           1      186   
Optimization terminated normally: 
  Convergence detected: relative gradient magnitude is below tolerance
INFO:fbprophet:Making 5 forecasts with cutoffs between 2013-10-07 00:00:00 and 2015-10-18 00:00:00
INFO:fbprophet:Applying in parallel with <concurrent.futures.process.ProcessPoolExecutor object at 0x7fc84dc9ccd0>
Initial log joint probability = -8.95172
    Iter      log prob        ||dx||      ||grad||       alpha      alpha0  # evals  Notes 
Initial log joint probability = -12.7302
    Iter      log prob        ||dx||      ||grad||       alpha      alpha0  # evals  Notes 
Initial log joint probability = -15.1549
    Iter      log prob        ||dx||      ||grad||       alpha      alpha0  # evals  Notes 
Initial log joint probability = -18.717
    Iter      log prob        ||dx||      ||grad||       alpha      alpha0  # evals  Notes 
Initial log joint probability = -23.5879
    Iter      log prob        ||dx||      ||grad||       alpha      alpha0  # evals  Notes 
      76          4679   4.79228e-09       3596.88      0.4498      0.4498      100   
Optimization terminated normally: 
  Convergence detected: absolute parameter change was below tolerance
      99       7029.18   2.77022e-06        3407.8       2.488      0.2488      124   
    Iter      log prob        ||dx||      ||grad||       alpha      alpha0  # evals  Notes 
      52       9582.47   9.80442e-09       3404.57      0.1664           1       77   
Optimization terminated normally: 
  Convergence detected: absolute parameter change was below tolerance
      30       11812.1   0.000214364       3852.86   5.702e-08       0.001       87  LS failed, Hessian reset 
     199       7031.99   3.07331e-05       3548.11      0.2066           1      239   
    Iter      log prob        ||dx||      ||grad||       alpha      alpha0  # evals  Notes 
     216          7032   9.73734e-09       3584.05      0.1744      0.1744      261   
Optimization terminated normally: 
  Convergence detected: absolute parameter change was below tolerance
      99       14233.3   7.71933e-08       3677.77      0.5398      0.5398      124   
    Iter      log prob        ||dx||      ||grad||       alpha      alpha0  # evals  Notes 
     104       14233.3   2.09069e-08       3764.12      0.2755           1      133   
Optimization terminated normally: 
  Convergence detected: relative gradient magnitude is below tolerance
      99       11813.1    2.3348e-06       3705.96           1           1      168   
    Iter      log prob        ||dx||      ||grad||       alpha      alpha0  # evals  Notes 
     114       11813.1   4.62714e-09       3574.05       0.291       0.291      185   
Optimization terminated normally: 
  Convergence detected: absolute parameter change was below tolerance
[I 2020-10-01 04:03:44,351] Trial 437 finished with value: 0.04213501503127831 and parameters: {'changepoint_prior_scale': 0.001376990903964118, 'seasonality_prior_scale': 0.2192096907492361, 'holidays_prior_scale': 0.1731987419384156, 'seasonality_mode': 'additive', 'changepoint_range': 0.583854187011559}. Best is trial 96 with value: 0.038883738900888705.
Initial log joint probability = -28.8311
    Iter      log prob        ||dx||      ||grad||       alpha      alpha0  # evals  Notes 
      99       18912.7   2.23639e-06       2592.51      0.3533           1      120   
    Iter      log prob        ||dx||      ||grad||       alpha      alpha0  # evals  Notes 
     128       18912.7   5.42121e-08       2810.86           1           1      159   
Optimization terminated normally: 
  Convergence detected: relative gradient magnitude is below tolerance
INFO:fbprophet:Making 5 forecasts with cutoffs between 2013-10-07 00:00:00 and 2015-10-18 00:00:00
INFO:fbprophet:Applying in parallel with <concurrent.futures.process.ProcessPoolExecutor object at 0x7fc84dc76cd0>
Initial log joint probability = -8.95172
    Iter      log prob        ||dx||      ||grad||       alpha      alpha0  # evals  Notes 
Initial log joint probability = -12.7302
    Iter      log prob        ||dx||      ||grad||       alpha      alpha0  # evals  Notes 
Initial log joint probability = -15.1549
    Iter      log prob        ||dx||      ||grad||       alpha      alpha0  # evals  Notes 
      68       4678.87   0.000201696       3131.16   6.327e-08       0.001      138  LS failed, Hessian reset 
Initial log joint probability = -18.717
    Iter      log prob        ||dx||      ||grad||       alpha      alpha0  # evals  Notes 
      99       4679.33   5.14644e-07       3094.72           1           1      175   
    Iter      log prob        ||dx||      ||grad||       alpha      alpha0  # evals  Notes 
Initial log joint probability = -23.5879
    Iter      log prob        ||dx||      ||grad||       alpha      alpha0  # evals  Notes 
      91       7029.49   9.98735e-06       3316.54   3.477e-09       0.001      145  LS failed, Hessian reset 
     109       4679.34   1.94879e-06       3100.85   6.308e-10       0.001      254  LS failed, Hessian reset 
      99       7029.54   1.16939e-05       3215.86      0.7719      0.7719      153   
    Iter      log prob        ||dx||      ||grad||       alpha      alpha0  # evals  Notes 
     132       4679.35   4.65367e-09        3088.2       0.203       0.203      281   
Optimization terminated normally: 
  Convergence detected: absolute parameter change was below tolerance
     130       7029.55   7.87155e-09       3150.31      0.2528           1      192   
Optimization terminated normally: 
  Convergence detected: absolute parameter change was below tolerance
      67       9582.46   4.74133e-07       3366.62     1.6e-10       0.001      118  LS failed, Hessian reset 
      32       11811.8   0.000422986       3747.47   1.713e-07       0.001       92  LS failed, Hessian reset 
      80       9582.46   8.65229e-09       2951.37      0.3464      0.7224      133   
Optimization terminated normally: 
  Convergence detected: absolute parameter change was below tolerance
      90       11813.2   8.62301e-09        3054.4      0.2499      0.2499      166   
Optimization terminated normally: 
  Convergence detected: absolute parameter change was below tolerance
      99       14233.2    2.9019e-05       3010.16     0.05362      0.3101      132   
    Iter      log prob        ||dx||      ||grad||       alpha      alpha0  # evals  Notes 
     144       14233.4   9.06797e-09       2994.93       0.293       0.293      195   
Optimization terminated normally: 
  Convergence detected: absolute parameter change was below tolerance
[I 2020-10-01 04:03:59,252] Trial 438 finished with value: 0.04132055352285218 and parameters: {'changepoint_prior_scale': 0.0016089098359832843, 'seasonality_prior_scale': 0.10045886376945316, 'holidays_prior_scale': 6.3794142281104484, 'seasonality_mode': 'additive', 'changepoint_range': 0.5402179605059452}. Best is trial 96 with value: 0.038883738900888705.
Initial log joint probability = -28.8311
    Iter      log prob        ||dx||      ||grad||       alpha      alpha0  # evals  Notes 
      99       18912.4    1.2614e-05       3787.08      0.6626      0.6626      121   
    Iter      log prob        ||dx||      ||grad||       alpha      alpha0  # evals  Notes 
     128       18912.5   9.04494e-09       4047.49       0.474       0.474      156   
Optimization terminated normally: 
  Convergence detected: absolute parameter change was below tolerance
INFO:fbprophet:Making 5 forecasts with cutoffs between 2013-10-07 00:00:00 and 2015-10-18 00:00:00
INFO:fbprophet:Applying in parallel with <concurrent.futures.process.ProcessPoolExecutor object at 0x7fc84dbf3390>
Initial log joint probability = -8.95172
    Iter      log prob        ||dx||      ||grad||       alpha      alpha0  # evals  Notes 
Initial log joint probability = -12.7302
    Iter      log prob        ||dx||      ||grad||       alpha      alpha0  # evals  Notes 
Initial log joint probability = -15.1549
    Iter      log prob        ||dx||      ||grad||       alpha      alpha0  # evals  Notes 
Initial log joint probability = -18.717
    Iter      log prob        ||dx||      ||grad||       alpha      alpha0  # evals  Notes 
      63       4679.19   4.04503e-09        4215.8      0.4895      0.4895       85   
Optimization terminated normally: 
  Convergence detected: absolute parameter change was below tolerance
Initial log joint probability = -23.5879
    Iter      log prob        ||dx||      ||grad||       alpha      alpha0  # evals  Notes 
      73       7028.57   2.44096e-05       3942.12   6.009e-09       0.001      138  LS failed, Hessian reset 
      60       9582.25   3.29045e-09       3954.66      0.2674      0.2674       86   
Optimization terminated normally: 
  Convergence detected: absolute parameter change was below tolerance
      99       7028.66   2.89329e-07       4045.86      0.4991      0.4991      171   
    Iter      log prob        ||dx||      ||grad||       alpha      alpha0  # evals  Notes 
      33       11811.4   0.000210948       4116.39   4.966e-08       0.001       89  LS failed, Hessian reset 
     112       7028.67   1.72809e-06       4244.09   4.214e-10       0.001      228  LS failed, Hessian reset 
      81       11812.9   7.11378e-09       4214.04      0.3188           1      154   
Optimization terminated normally: 
  Convergence detected: absolute parameter change was below tolerance
     135       7028.67   9.71774e-09       3931.34      0.7071      0.7071      254   
Optimization terminated normally: 
  Convergence detected: absolute parameter change was below tolerance
      99       14232.5   2.39723e-06       3832.87           1           1      130   
    Iter      log prob        ||dx||      ||grad||       alpha      alpha0  # evals  Notes 
     117       14232.5   8.52735e-09       3698.39      0.2606      0.2606      153   
Optimization terminated normally: 
  Convergence detected: absolute parameter change was below tolerance
