[I 2020-10-01 02:36:29,956] Trial 93 finished with value: 0.03993363899918079 and parameters: {'changepoint_prior_scale': 0.001136776977644789, 'seasonality_prior_scale': 0.21551826750317352, 'holidays_prior_scale': 0.0780832101945271, 'seasonality_mode': 'additive', 'changepoint_range': 0.5735027230515968}. Best is trial 93 with value: 0.03993363899918079.
Initial log joint probability = -28.8311
    Iter      log prob        ||dx||      ||grad||       alpha      alpha0  # evals  Notes 
      99       18911.8   2.93125e-06       4793.06      0.3517           1      123   
    Iter      log prob        ||dx||      ||grad||       alpha      alpha0  # evals  Notes 
     180       18912.4    9.3411e-09       3654.93      0.3949           1      222   
Optimization terminated normally: 
  Convergence detected: absolute parameter change was below tolerance
INFO:fbprophet:Making 5 forecasts with cutoffs between 2013-10-07 00:00:00 and 2015-10-18 00:00:00
INFO:fbprophet:Applying in parallel with <concurrent.futures.process.ProcessPoolExecutor object at 0x7fc88e6d4a90>
Initial log joint probability = -8.95172
    Iter      log prob        ||dx||      ||grad||       alpha      alpha0  # evals  Notes 
Initial log joint probability = -12.7302
    Iter      log prob        ||dx||      ||grad||       alpha      alpha0  # evals  Notes 
Initial log joint probability = -15.1549
    Iter      log prob        ||dx||      ||grad||       alpha      alpha0  # evals  Notes 
Initial log joint probability = -18.717
    Iter      log prob        ||dx||      ||grad||       alpha      alpha0  # evals  Notes 
      65       4678.88   9.34069e-09       4860.34      0.6166      0.6166       88   
Optimization terminated normally: 
  Convergence detected: absolute parameter change was below tolerance
Initial log joint probability = -23.5879
    Iter      log prob        ||dx||      ||grad||       alpha      alpha0  # evals  Notes 
      67       7027.25   4.60212e-05       4850.57   9.983e-09       0.001      124  LS failed, Hessian reset 
      99       7027.43   2.27177e-08       4461.29      0.2409      0.2409      164   
    Iter      log prob        ||dx||      ||grad||       alpha      alpha0  # evals  Notes 
     105       7027.43   8.56581e-09       5161.28      0.2367      0.2367      173   
Optimization terminated normally: 
  Convergence detected: absolute parameter change was below tolerance
      58       11812.7   6.49151e-09       4940.66      0.1153      0.1153       88   
Optimization terminated normally: 
  Convergence detected: absolute parameter change was below tolerance
      73       9582.22   2.45258e-07       4587.09   4.918e-11       0.001      147  LS failed, Hessian reset 
      85       9582.22   9.87432e-09       4727.48      0.4114      0.7938      162   
Optimization terminated normally: 
  Convergence detected: absolute parameter change was below tolerance
      99       14233.5   3.94428e-07       5028.92       0.554       0.554      130   
    Iter      log prob        ||dx||      ||grad||       alpha      alpha0  # evals  Notes 
     131       14233.5   9.99077e-09       5053.79      0.5859      0.5859      167   
Optimization terminated normally: 
  Convergence detected: absolute parameter change was below tolerance
[I 2020-10-01 02:36:46,202] Trial 94 finished with value: 0.04121988050335619 and parameters: {'changepoint_prior_scale': 0.001000918869334642, 'seasonality_prior_scale': 0.22128072865318257, 'holidays_prior_scale': 0.0784166739969618, 'seasonality_mode': 'additive', 'changepoint_range': 0.5741767847297249}. Best is trial 93 with value: 0.03993363899918079.
Initial log joint probability = -28.8311
    Iter      log prob        ||dx||      ||grad||       alpha      alpha0  # evals  Notes 
      99       18912.6   0.000151356        4189.8      0.7929      0.7929      120   
    Iter      log prob        ||dx||      ||grad||       alpha      alpha0  # evals  Notes 
     163       18912.8   1.47492e-08       3914.03      0.3669      0.3669      193   
Optimization terminated normally: 
  Convergence detected: relative gradient magnitude is below tolerance
INFO:fbprophet:Making 5 forecasts with cutoffs between 2013-10-07 00:00:00 and 2015-10-18 00:00:00
INFO:fbprophet:Applying in parallel with <concurrent.futures.process.ProcessPoolExecutor object at 0x7fc88e69a890>
Initial log joint probability = -8.95172
    Iter      log prob        ||dx||      ||grad||       alpha      alpha0  # evals  Notes 
Initial log joint probability = -12.7302
    Iter      log prob        ||dx||      ||grad||       alpha      alpha0  # evals  Notes 
      64        4679.1   1.46572e-06       3998.08   3.605e-10       0.001      130  LS failed, Hessian reset 
Initial log joint probability = -15.1549
    Iter      log prob        ||dx||      ||grad||       alpha      alpha0  # evals  Notes 
      85        4679.1   8.07994e-09       4235.81      0.7318      0.7318      156   
Optimization terminated normally: 
  Convergence detected: absolute parameter change was below tolerance
Initial log joint probability = -18.717
    Iter      log prob        ||dx||      ||grad||       alpha      alpha0  # evals  Notes 
Initial log joint probability = -23.5879
    Iter      log prob        ||dx||      ||grad||       alpha      alpha0  # evals  Notes 
      82       7027.97   7.09367e-05       3969.13     1.7e-08       0.001      147  LS failed, Hessian reset 
      99       7028.15   1.45403e-06       3476.42      0.3901      0.3901      167   
    Iter      log prob        ||dx||      ||grad||       alpha      alpha0  # evals  Notes 
      63       9582.44   7.19366e-09       4122.68      0.6776      0.6776       86   
Optimization terminated normally: 
  Convergence detected: absolute parameter change was below tolerance
     148       7028.44   2.29855e-05       3546.86   6.533e-09       0.001      270  LS failed, Hessian reset 
      68       11813.1    5.7356e-09       4001.49      0.2884      0.2884      103   
Optimization terminated normally: 
  Convergence detected: absolute parameter change was below tolerance
     199       7028.77     2.988e-07       3629.52           1           1      334   
    Iter      log prob        ||dx||      ||grad||       alpha      alpha0  # evals  Notes 
     208       7028.77   7.84144e-07       3810.13   1.673e-10       0.001      382  LS failed, Hessian reset 
      99       14231.9   4.25802e-08       3676.19       0.567       0.567      128   
    Iter      log prob        ||dx||      ||grad||       alpha      alpha0  # evals  Notes 
     232       7028.78   6.40615e-09       3486.02      0.7375      0.7375      413   
Optimization terminated normally: 
  Convergence detected: absolute parameter change was below tolerance
     109       14231.9   7.17308e-09       4389.33      0.4865      0.4865      142   
Optimization terminated normally: 
  Convergence detected: absolute parameter change was below tolerance
[I 2020-10-01 02:37:00,394] Trial 95 finished with value: 0.04079309441132065 and parameters: {'changepoint_prior_scale': 0.0012265942974087397, 'seasonality_prior_scale': 0.18264604460111816, 'holidays_prior_scale': 0.06940700657851026, 'seasonality_mode': 'additive', 'changepoint_range': 0.5847155458769119}. Best is trial 93 with value: 0.03993363899918079.
Initial log joint probability = -28.8311
    Iter      log prob        ||dx||      ||grad||       alpha      alpha0  # evals  Notes 
      99       18912.5   8.10551e-06       4062.38      0.4544      0.4544      122   
    Iter      log prob        ||dx||      ||grad||       alpha      alpha0  # evals  Notes 
     124       18912.6   9.19348e-09       3979.59      0.2782      0.2782      152   
Optimization terminated normally: 
  Convergence detected: absolute parameter change was below tolerance
INFO:fbprophet:Making 5 forecasts with cutoffs between 2013-10-07 00:00:00 and 2015-10-18 00:00:00
INFO:fbprophet:Applying in parallel with <concurrent.futures.process.ProcessPoolExecutor object at 0x7fc88e6d4a90>
Initial log joint probability = -8.95172
    Iter      log prob        ||dx||      ||grad||       alpha      alpha0  # evals  Notes 
Initial log joint probability = -12.7302
    Iter      log prob        ||dx||      ||grad||       alpha      alpha0  # evals  Notes 
Initial log joint probability = -15.1549
    Iter      log prob        ||dx||      ||grad||       alpha      alpha0  # evals  Notes 
Initial log joint probability = -18.717
    Iter      log prob        ||dx||      ||grad||       alpha      alpha0  # evals  Notes 
      60       4668.33   9.83338e-09       4363.54      0.2825      0.2825       78   
Optimization terminated normally: 
  Convergence detected: absolute parameter change was below tolerance
Initial log joint probability = -23.5879
    Iter      log prob        ||dx||      ||grad||       alpha      alpha0  # evals  Notes 
      99       7028.35   2.00795e-05          4310           1           1      123   
    Iter      log prob        ||dx||      ||grad||       alpha      alpha0  # evals  Notes 
     101       7028.55   1.70085e-05       4144.28   4.097e-09       0.001      168  LS failed, Hessian reset 
      92       9582.38    6.5134e-09       4074.84      0.1831      0.7726      129   
Optimization terminated normally: 
  Convergence detected: absolute parameter change was below tolerance
      69         11813   5.39749e-09       4221.91       0.203       0.203       96   
Optimization terminated normally: 
  Convergence detected: absolute parameter change was below tolerance
     147       7028.66   3.88692e-09       4349.79      0.3293      0.3293      228   
Optimization terminated normally: 
  Convergence detected: absolute parameter change was below tolerance
      99       14233.2    1.1638e-06       3968.36      0.2963           1      123   
    Iter      log prob        ||dx||      ||grad||       alpha      alpha0  # evals  Notes 
     123       14233.2   3.85278e-07       4256.26   8.327e-11       0.001      192  LS failed, Hessian reset 
     130       14233.2   9.26236e-09       3163.77      0.3663      0.3663      200   
Optimization terminated normally: 
  Convergence detected: absolute parameter change was below tolerance
[I 2020-10-01 02:37:15,732] Trial 96 finished with value: 0.038883738900888705 and parameters: {'changepoint_prior_scale': 0.001148265615841428, 'seasonality_prior_scale': 0.18502076368187464, 'holidays_prior_scale': 0.08950161812346888, 'seasonality_mode': 'additive', 'changepoint_range': 0.5572609987905732}. Best is trial 96 with value: 0.038883738900888705.
Initial log joint probability = -28.8311
    Iter      log prob        ||dx||      ||grad||       alpha      alpha0  # evals  Notes 
      99       18911.9   0.000265708       5078.52           1           1      125   
    Iter      log prob        ||dx||      ||grad||       alpha      alpha0  # evals  Notes 
     155       18912.4    9.9324e-09       3808.17      0.4875      0.4875      195   
Optimization terminated normally: 
  Convergence detected: absolute parameter change was below tolerance
INFO:fbprophet:Making 5 forecasts with cutoffs between 2013-10-07 00:00:00 and 2015-10-18 00:00:00
INFO:fbprophet:Applying in parallel with <concurrent.futures.process.ProcessPoolExecutor object at 0x7fc88e651110>
Initial log joint probability = -8.95172
    Iter      log prob        ||dx||      ||grad||       alpha      alpha0  # evals  Notes 
Initial log joint probability = -12.7302
    Iter      log prob        ||dx||      ||grad||       alpha      alpha0  # evals  Notes 
Initial log joint probability = -15.1549
    Iter      log prob        ||dx||      ||grad||       alpha      alpha0  # evals  Notes 
Initial log joint probability = -18.717
    Iter      log prob        ||dx||      ||grad||       alpha      alpha0  # evals  Notes 
Initial log joint probability = -23.5879
      62       4679.13   5.73241e-09        5208.6     0.05407           1       94   
Optimization terminated normally: 
  Convergence detected: absolute parameter change was below tolerance
    Iter      log prob        ||dx||      ||grad||       alpha      alpha0  # evals  Notes 
      64       9582.25   6.66143e-09       4159.21      0.1237       0.474       89   
Optimization terminated normally: 
  Convergence detected: absolute parameter change was below tolerance
      82       7028.22   1.46936e-05       4500.39   3.171e-09       0.001      148  LS failed, Hessian reset 
      99        7028.4   6.10642e-06       4711.68      0.1818           1      168   
    Iter      log prob        ||dx||      ||grad||       alpha      alpha0  # evals  Notes 
     122       7028.44   9.72101e-09       4157.16      0.2057      0.2057      196   
Optimization terminated normally: 
  Convergence detected: absolute parameter change was below tolerance
      66       11812.9   6.66884e-07       5217.89   1.359e-10       0.001      137  LS failed, Hessian reset 
      88       11812.9   8.90992e-09       4952.34      0.6743      0.6743      162   
Optimization terminated normally: 
  Convergence detected: absolute parameter change was below tolerance
      99       14231.2   7.02023e-08       4727.14           1           1      135   
    Iter      log prob        ||dx||      ||grad||       alpha      alpha0  # evals  Notes 
     109       14231.2   7.34688e-09        4946.5      0.3836      0.3836      149   
Optimization terminated normally: 
  Convergence detected: absolute parameter change was below tolerance
[I 2020-10-01 02:37:30,754] Trial 97 finished with value: 0.04115548767916162 and parameters: {'changepoint_prior_scale': 0.0010022343594079928, 'seasonality_prior_scale': 0.18724032494747184, 'holidays_prior_scale': 0.09420429597884905, 'seasonality_mode': 'additive', 'changepoint_range': 0.5571322023262038}. Best is trial 96 with value: 0.038883738900888705.
Initial log joint probability = -28.8311
    Iter      log prob        ||dx||      ||grad||       alpha      alpha0  # evals  Notes 
      99       18912.3   1.48261e-05       3540.13      0.5192      0.5192      127   
    Iter      log prob        ||dx||      ||grad||       alpha      alpha0  # evals  Notes 
     199       18912.6   3.97485e-08       3324.99      0.3039      0.3039      248   
    Iter      log prob        ||dx||      ||grad||       alpha      alpha0  # evals  Notes 
     221       18912.6   2.10258e-08       3517.92      0.2633      0.7153      273   
Optimization terminated normally: 
  Convergence detected: relative gradient magnitude is below tolerance
INFO:fbprophet:Making 5 forecasts with cutoffs between 2013-10-07 00:00:00 and 2015-10-18 00:00:00
INFO:fbprophet:Applying in parallel with <concurrent.futures.process.ProcessPoolExecutor object at 0x7fc88e66c610>
Initial log joint probability = -8.95172
    Iter      log prob        ||dx||      ||grad||       alpha      alpha0  # evals  Notes 
Initial log joint probability = -12.7302
    Iter      log prob        ||dx||      ||grad||       alpha      alpha0  # evals  Notes 
Initial log joint probability = -15.1549
    Iter      log prob        ||dx||      ||grad||       alpha      alpha0  # evals  Notes 
Initial log joint probability = -18.717
    Iter      log prob        ||dx||      ||grad||       alpha      alpha0  # evals  Notes 
      65       4678.51   7.80875e-09       4144.31      0.5388      0.5388       86   
Optimization terminated normally: 
  Convergence detected: absolute parameter change was below tolerance
Initial log joint probability = -23.5879
    Iter      log prob        ||dx||      ||grad||       alpha      alpha0  # evals  Notes 
      76       7028.82   3.31502e-05       3845.91   7.325e-09       0.001      140  LS failed, Hessian reset 
      99       7028.89    1.8101e-07       3945.64           1           1      171   
    Iter      log prob        ||dx||      ||grad||       alpha      alpha0  # evals  Notes 
     107        7028.9   3.92948e-09       4003.17      0.3088     0.03088      184   
Optimization terminated normally: 
  Convergence detected: absolute parameter change was below tolerance
      94        9582.4    5.4386e-06       3703.37   1.263e-09       0.001      171  LS failed, Hessian reset 
      83       11813.2   8.90635e-09       4009.79      0.3139      0.3139      126   
Optimization terminated normally: 
  Convergence detected: absolute parameter change was below tolerance
      99       9582.41    1.4806e-06       3763.97       1.143      0.1143      178   
    Iter      log prob        ||dx||      ||grad||       alpha      alpha0  # evals  Notes 
     120       9582.42   9.45318e-09       3836.36      0.3111      0.3111      205   
Optimization terminated normally: 
  Convergence detected: absolute parameter change was below tolerance
      99       14233.4   1.70825e-06       4072.15           1           1      128   
    Iter      log prob        ||dx||      ||grad||       alpha      alpha0  # evals  Notes 
     131       14233.5   8.81625e-09       4327.35      0.6201      0.6201      171   
Optimization terminated normally: 
  Convergence detected: absolute parameter change was below tolerance
[I 2020-10-01 02:37:46,988] Trial 98 finished with value: 0.04137910094262137 and parameters: {'changepoint_prior_scale': 0.0012214748251263127, 'seasonality_prior_scale': 0.3285673989625741, 'holidays_prior_scale': 0.06303892592638595, 'seasonality_mode': 'additive', 'changepoint_range': 0.5168974293178529}. Best is trial 96 with value: 0.038883738900888705.
Initial log joint probability = -28.8311
    Iter      log prob        ||dx||      ||grad||       alpha      alpha0  # evals  Notes 
      99       18912.7   2.75658e-07       2798.12           1           1      126   
    Iter      log prob        ||dx||      ||grad||       alpha      alpha0  # evals  Notes 
     116       18912.7     3.686e-08       2368.34           1           1      149   
Optimization terminated normally: 
  Convergence detected: relative gradient magnitude is below tolerance
INFO:fbprophet:Making 5 forecasts with cutoffs between 2013-10-07 00:00:00 and 2015-10-18 00:00:00
INFO:fbprophet:Applying in parallel with <concurrent.futures.process.ProcessPoolExecutor object at 0x7fc88e651510>
Initial log joint probability = -8.95172
    Iter      log prob        ||dx||      ||grad||       alpha      alpha0  # evals  Notes 
Initial log joint probability = -12.7302
    Iter      log prob        ||dx||      ||grad||       alpha      alpha0  # evals  Notes 
Initial log joint probability = -15.1549
    Iter      log prob        ||dx||      ||grad||       alpha      alpha0  # evals  Notes 
Initial log joint probability = -18.717
    Iter      log prob        ||dx||      ||grad||       alpha      alpha0  # evals  Notes 
      66       4677.93    9.6951e-09       3027.82      0.3616      0.3616       90   
Optimization terminated normally: 
  Convergence detected: absolute parameter change was below tolerance
Initial log joint probability = -23.5879
    Iter      log prob        ||dx||      ||grad||       alpha      alpha0  # evals  Notes 
      99       7029.84   1.03765e-06       3266.78      0.2429       0.654      120   
    Iter      log prob        ||dx||      ||grad||       alpha      alpha0  # evals  Notes 
      57       9582.55   8.13106e-09       2769.19      0.5828      0.5828       79   
Optimization terminated normally: 
  Convergence detected: absolute parameter change was below tolerance
     129       7029.85   6.53748e-09        2615.6      0.2982      0.2982      162   
Optimization terminated normally: 
  Convergence detected: absolute parameter change was below tolerance
      59       11813.3   6.88485e-09       2948.04      0.3399      0.3399       77   
Optimization terminated normally: 
  Convergence detected: absolute parameter change was below tolerance
      99       14232.2   8.58875e-07       2283.95      0.7598      0.7598      137   
    Iter      log prob        ||dx||      ||grad||       alpha      alpha0  # evals  Notes 
     183         14233   2.50381e-08       2561.91      0.4086           1      244   
Optimization terminated normally: 
  Convergence detected: relative gradient magnitude is below tolerance
