[I 2020-10-01 03:04:28,612] Trial 204 finished with value: 0.04097525145067641 and parameters: {'changepoint_prior_scale': 0.0013598085504765427, 'seasonality_prior_scale': 0.14366466699414154, 'holidays_prior_scale': 2.393625470779955, 'seasonality_mode': 'additive', 'changepoint_range': 0.522310957256875}. Best is trial 96 with value: 0.038883738900888705.
Initial log joint probability = -28.8311
    Iter      log prob        ||dx||      ||grad||       alpha      alpha0  # evals  Notes 
      99       18912.3   5.38102e-07        3313.6      0.5798      0.5798      129   
    Iter      log prob        ||dx||      ||grad||       alpha      alpha0  # evals  Notes 
     116       18912.3   4.89505e-09       2506.95      0.2156      0.2156      150   
Optimization terminated normally: 
  Convergence detected: absolute parameter change was below tolerance
INFO:fbprophet:Making 5 forecasts with cutoffs between 2013-10-07 00:00:00 and 2015-10-18 00:00:00
INFO:fbprophet:Applying in parallel with <concurrent.futures.process.ProcessPoolExecutor object at 0x7fc88e67f610>
Initial log joint probability = -8.95172
    Iter      log prob        ||dx||      ||grad||       alpha      alpha0  # evals  Notes 
Initial log joint probability = -12.7302
    Iter      log prob        ||dx||      ||grad||       alpha      alpha0  # evals  Notes 
Initial log joint probability = -15.1549
    Iter      log prob        ||dx||      ||grad||       alpha      alpha0  # evals  Notes 
Initial log joint probability = -18.717
    Iter      log prob        ||dx||      ||grad||       alpha      alpha0  # evals  Notes 
Initial log joint probability = -23.5879
    Iter      log prob        ||dx||      ||grad||       alpha      alpha0  # evals  Notes 
      79       4679.23   7.50195e-05       2935.26   2.423e-08       0.001      137  LS failed, Hessian reset 
      99       4679.37   1.21989e-07       3201.82      0.2586           1      165   
    Iter      log prob        ||dx||      ||grad||       alpha      alpha0  # evals  Notes 
     109       4679.37   6.27456e-09        3139.1      0.2197      0.2197      179   
Optimization terminated normally: 
  Convergence detected: absolute parameter change was below tolerance
      99       7029.56   5.59268e-07       2509.03           1           1      119   
    Iter      log prob        ||dx||      ||grad||       alpha      alpha0  # evals  Notes 
      53       11813.3   8.44373e-09       2888.81      0.6031      0.6031       77   
Optimization terminated normally: 
  Convergence detected: absolute parameter change was below tolerance
     119       7029.58   1.63433e-06        3143.6    5.54e-10       0.001      185  LS failed, Hessian reset 
     147       7029.59   6.20351e-09       2630.11      0.4209      0.4209      217   
Optimization terminated normally: 
  Convergence detected: absolute parameter change was below tolerance
      71       9582.34   1.68433e-05       2770.64   5.316e-09       0.001      148  LS failed, Hessian reset 
      99       9582.42   3.88597e-07       2471.53           1           1      182   
    Iter      log prob        ||dx||      ||grad||       alpha      alpha0  # evals  Notes 
      99       14232.7   5.27667e-08       2574.64        0.73        0.73      133   
    Iter      log prob        ||dx||      ||grad||       alpha      alpha0  # evals  Notes 
     117       9582.42   4.34117e-07       2793.67   1.275e-10       0.001      252  LS failed, Hessian reset 
     144       9582.42   6.33274e-09       2644.91       0.482       0.482      282   
Optimization terminated normally: 
  Convergence detected: absolute parameter change was below tolerance
     111       14232.7   2.22869e-07       2631.74   7.416e-11       0.001      187  LS failed, Hessian reset 
     118       14232.7   1.66139e-08       2267.55      0.5773      0.5773      195   
Optimization terminated normally: 
  Convergence detected: relative gradient magnitude is below tolerance
[I 2020-10-01 03:04:40,123] Trial 205 finished with value: 0.04128227285765501 and parameters: {'changepoint_prior_scale': 0.0016379236755928162, 'seasonality_prior_scale': 0.17573739489937157, 'holidays_prior_scale': 2.7832710942697205, 'seasonality_mode': 'additive', 'changepoint_range': 0.5104959457101691}. Best is trial 96 with value: 0.038883738900888705.
Initial log joint probability = -28.8311
    Iter      log prob        ||dx||      ||grad||       alpha      alpha0  # evals  Notes 
      99       18912.6   2.08789e-05       4188.83           1           1      122   
    Iter      log prob        ||dx||      ||grad||       alpha      alpha0  # evals  Notes 
     151       18912.9   1.57609e-08       3856.65      0.2297      0.2297      185   
Optimization terminated normally: 
  Convergence detected: relative gradient magnitude is below tolerance
INFO:fbprophet:Making 5 forecasts with cutoffs between 2013-10-07 00:00:00 and 2015-10-18 00:00:00
INFO:fbprophet:Applying in parallel with <concurrent.futures.process.ProcessPoolExecutor object at 0x7fc84dc6f8d0>
Initial log joint probability = -8.95172
    Iter      log prob        ||dx||      ||grad||       alpha      alpha0  # evals  Notes 
Initial log joint probability = -12.7302
    Iter      log prob        ||dx||      ||grad||       alpha      alpha0  # evals  Notes 
Initial log joint probability = -15.1549
    Iter      log prob        ||dx||      ||grad||       alpha      alpha0  # evals  Notes 
Initial log joint probability = -18.717
    Iter      log prob        ||dx||      ||grad||       alpha      alpha0  # evals  Notes 
Initial log joint probability = -23.5879
    Iter      log prob        ||dx||      ||grad||       alpha      alpha0  # evals  Notes 
      66       4679.05   8.32433e-09       4061.93      0.3376      0.3376       96   
Optimization terminated normally: 
  Convergence detected: absolute parameter change was below tolerance
      78       7028.68   3.45166e-05       3841.64   9.158e-09       0.001      140  LS failed, Hessian reset 
      99       7028.78   1.78985e-06       3584.88           1           1      164   
    Iter      log prob        ||dx||      ||grad||       alpha      alpha0  # evals  Notes 
      28       11811.2   0.000256947       3830.78   5.882e-08       0.001       92  LS failed, Hessian reset 
      92        9582.4   4.44499e-09       4065.17      0.1533      0.1533      126   
Optimization terminated normally: 
  Convergence detected: absolute parameter change was below tolerance
     139       7028.79   3.31457e-09       3603.26      0.4424      0.4424      216   
Optimization terminated normally: 
  Convergence detected: absolute parameter change was below tolerance
      99       14232.7    0.00029765       3789.99      0.2511           1      129   
    Iter      log prob        ||dx||      ||grad||       alpha      alpha0  # evals  Notes 
      99       11813.1   4.62257e-07       4007.99           1           1      182   
    Iter      log prob        ||dx||      ||grad||       alpha      alpha0  # evals  Notes 
     114       11813.1   1.17118e-08       4051.17      0.6548      0.6548      201   
Optimization terminated normally: 
  Convergence detected: relative gradient magnitude is below tolerance
     146       14232.8   1.80266e-08       3851.49      0.3943      0.3943      187   
Optimization terminated normally: 
  Convergence detected: relative gradient magnitude is below tolerance
[I 2020-10-01 03:04:53,729] Trial 206 finished with value: 0.041179233618883454 and parameters: {'changepoint_prior_scale': 0.0012409756712097036, 'seasonality_prior_scale': 0.11391068629580965, 'holidays_prior_scale': 0.14449398928753868, 'seasonality_mode': 'additive', 'changepoint_range': 0.5264395696779365}. Best is trial 96 with value: 0.038883738900888705.
Initial log joint probability = -28.8311
    Iter      log prob        ||dx||      ||grad||       alpha      alpha0  # evals  Notes 
      99       18912.9   1.55772e-08       3076.47      0.3138      0.3138      121   
    Iter      log prob        ||dx||      ||grad||       alpha      alpha0  # evals  Notes 
     101       18912.9   7.73046e-09       3127.08      0.2652      0.2652      124   
Optimization terminated normally: 
  Convergence detected: absolute parameter change was below tolerance
INFO:fbprophet:Making 5 forecasts with cutoffs between 2013-10-07 00:00:00 and 2015-10-18 00:00:00
INFO:fbprophet:Applying in parallel with <concurrent.futures.process.ProcessPoolExecutor object at 0x7fc84dc25ed0>
Initial log joint probability = -8.95172
    Iter      log prob        ||dx||      ||grad||       alpha      alpha0  # evals  Notes 
Initial log joint probability = -12.7302
    Iter      log prob        ||dx||      ||grad||       alpha      alpha0  # evals  Notes 
      66       4679.35   3.54413e-09       3410.91      0.3494      0.3494       96   
Optimization terminated normally: 
  Convergence detected: absolute parameter change was below tolerance
Initial log joint probability = -15.1549
    Iter      log prob        ||dx||      ||grad||       alpha      alpha0  # evals  Notes 
Initial log joint probability = -18.717
    Iter      log prob        ||dx||      ||grad||       alpha      alpha0  # evals  Notes 
Initial log joint probability = -23.5879
    Iter      log prob        ||dx||      ||grad||       alpha      alpha0  # evals  Notes 
      99       7029.73   1.95574e-07       2953.25      0.9566     0.09566      120   
    Iter      log prob        ||dx||      ||grad||       alpha      alpha0  # evals  Notes 
     114       7029.73   9.62713e-09       3482.72       0.501       0.501      139   
Optimization terminated normally: 
  Convergence detected: absolute parameter change was below tolerance
      57       9582.53   5.13447e-09       2826.69       0.151       0.151       81   
Optimization terminated normally: 
  Convergence detected: absolute parameter change was below tolerance
      31       11810.9   0.000688893       3224.03    1.83e-07       0.001       87  LS failed, Hessian reset 
      99       14232.9   1.88526e-05        3478.9           1           1      124   
    Iter      log prob        ||dx||      ||grad||       alpha      alpha0  # evals  Notes 
      96       11813.2   9.41985e-09       3425.71      0.2614      0.2614      165   
Optimization terminated normally: 
  Convergence detected: absolute parameter change was below tolerance
     173       14233.2   6.33701e-09       3298.88      0.2891      0.2891      217   
Optimization terminated normally: 
  Convergence detected: absolute parameter change was below tolerance
[I 2020-10-01 03:05:08,647] Trial 207 finished with value: 0.040973548206111286 and parameters: {'changepoint_prior_scale': 0.0014792725747026774, 'seasonality_prior_scale': 0.3151295698774598, 'holidays_prior_scale': 2.1195854138209858, 'seasonality_mode': 'additive', 'changepoint_range': 0.5437366529050575}. Best is trial 96 with value: 0.038883738900888705.
Initial log joint probability = -28.8311
    Iter      log prob        ||dx||      ||grad||       alpha      alpha0  # evals  Notes 
      99       18912.4   9.97206e-06        4184.8      0.9425      0.9425      118   
    Iter      log prob        ||dx||      ||grad||       alpha      alpha0  # evals  Notes 
     128       18912.5   1.92146e-09       4510.72     0.07787           1      157   
Optimization terminated normally: 
  Convergence detected: absolute parameter change was below tolerance
INFO:fbprophet:Making 5 forecasts with cutoffs between 2013-10-07 00:00:00 and 2015-10-18 00:00:00
INFO:fbprophet:Applying in parallel with <concurrent.futures.process.ProcessPoolExecutor object at 0x7fc84dc67210>
Initial log joint probability = -8.95172
    Iter      log prob        ||dx||      ||grad||       alpha      alpha0  # evals  Notes 
Initial log joint probability = -12.7302
    Iter      log prob        ||dx||      ||grad||       alpha      alpha0  # evals  Notes 
Initial log joint probability = -15.1549
    Iter      log prob        ||dx||      ||grad||       alpha      alpha0  # evals  Notes 
Initial log joint probability = -18.717
    Iter      log prob        ||dx||      ||grad||       alpha      alpha0  # evals  Notes 
Initial log joint probability = -23.5879
    Iter      log prob        ||dx||      ||grad||       alpha      alpha0  # evals  Notes 
      56       4679.02   2.20585e-06       4495.55   4.809e-10       0.001      129  LS failed, Hessian reset 
      81       4679.02   4.45793e-09       4556.51      0.2283      0.2283      164   
Optimization terminated normally: 
  Convergence detected: absolute parameter change was below tolerance
      57       9582.22   9.64725e-09       4287.03        0.29        0.29       78   
Optimization terminated normally: 
  Convergence detected: absolute parameter change was below tolerance
      84       7027.84   2.66993e-05        4853.7    6.13e-09       0.001      154  LS failed, Hessian reset 
      99       7027.98   3.76197e-06        4742.7           1           1      174   
    Iter      log prob        ||dx||      ||grad||       alpha      alpha0  # evals  Notes 
      77       11813.1     9.139e-09       4520.53      0.4343      0.4343      109   
Optimization terminated normally: 
  Convergence detected: absolute parameter change was below tolerance
     144       7028.02   8.31904e-07        4514.2   1.781e-10       0.001      268  LS failed, Hessian reset 
     170       7028.03    4.2323e-09       4345.56      0.5323      0.5323      297   
Optimization terminated normally: 
  Convergence detected: absolute parameter change was below tolerance
      99       14233.5   1.51355e-07       4503.46      0.3449           1      136   
    Iter      log prob        ||dx||      ||grad||       alpha      alpha0  # evals  Notes 
     109       14233.5   1.23861e-08       4303.78      0.2539      0.7532      149   
Optimization terminated normally: 
  Convergence detected: relative gradient magnitude is below tolerance
[I 2020-10-01 03:05:23,117] Trial 208 finished with value: 0.041271175577230285 and parameters: {'changepoint_prior_scale': 0.0011048665464253502, 'seasonality_prior_scale': 0.26667405345531847, 'holidays_prior_scale': 1.8964369037956832, 'seasonality_mode': 'additive', 'changepoint_range': 0.5265572046027401}. Best is trial 96 with value: 0.038883738900888705.
Initial log joint probability = -28.8311
    Iter      log prob        ||dx||      ||grad||       alpha      alpha0  # evals  Notes 
      59       18911.8    0.00010913       3250.76   2.709e-08       0.001      115  LS failed, Hessian reset 
      99       18912.3   2.48201e-06       2687.21      0.7096     0.07096      164   
    Iter      log prob        ||dx||      ||grad||       alpha      alpha0  # evals  Notes 
     140       18912.3   1.83183e-08       2726.34      0.1748      0.6547      220   
Optimization terminated normally: 
  Convergence detected: relative gradient magnitude is below tolerance
INFO:fbprophet:Making 5 forecasts with cutoffs between 2013-10-07 00:00:00 and 2015-10-18 00:00:00
INFO:fbprophet:Applying in parallel with <concurrent.futures.process.ProcessPoolExecutor object at 0x7fc84dc25b50>
Initial log joint probability = -8.95172
    Iter      log prob        ||dx||      ||grad||       alpha      alpha0  # evals  Notes 
Initial log joint probability = -12.7302
    Iter      log prob        ||dx||      ||grad||       alpha      alpha0  # evals  Notes 
Initial log joint probability = -15.1549
    Iter      log prob        ||dx||      ||grad||       alpha      alpha0  # evals  Notes 
Initial log joint probability = -18.717
    Iter      log prob        ||dx||      ||grad||       alpha      alpha0  # evals  Notes 
Initial log joint probability = -23.5879
    Iter      log prob        ||dx||      ||grad||       alpha      alpha0  # evals  Notes 
      70       4672.52   6.34383e-09       3642.84      0.5008           1       99   
Optimization terminated normally: 
  Convergence detected: absolute parameter change was below tolerance
      77       7028.86   2.54531e-05       3546.08   6.921e-09       0.001      143  LS failed, Hessian reset 
      99       7028.92   2.54588e-07       3176.19      0.6061      0.6061      168   
    Iter      log prob        ||dx||      ||grad||       alpha      alpha0  # evals  Notes 
      52       11813.2   3.59598e-09       3718.33      0.2088      0.2088       78   
Optimization terminated normally: 
  Convergence detected: absolute parameter change was below tolerance
      51        9582.4   2.58842e-06       3848.83   7.791e-10       0.001      117  LS failed, Hessian reset 
     109       7028.93     2.081e-06       3950.09   5.701e-10       0.001      218  LS failed, Hessian reset 
     136       7028.94    3.4225e-09       3777.17       0.297       0.297      249   
Optimization terminated normally: 
  Convergence detected: absolute parameter change was below tolerance
      80       9582.41   6.10784e-09       3611.14      0.4859      0.4859      156   
Optimization terminated normally: 
  Convergence detected: absolute parameter change was below tolerance
      99       14232.9   7.50727e-08       3293.12      0.8995      0.8995      130   
    Iter      log prob        ||dx||      ||grad||       alpha      alpha0  # evals  Notes 
     116       14232.9   5.64026e-09       3375.51      0.2413      0.2413      152   
Optimization terminated normally: 
  Convergence detected: absolute parameter change was below tolerance
[I 2020-10-01 03:05:38,966] Trial 209 finished with value: 0.03979668622296623 and parameters: {'changepoint_prior_scale': 0.0013655234370960074, 'seasonality_prior_scale': 0.19336981712136134, 'holidays_prior_scale': 0.10490277007175552, 'seasonality_mode': 'additive', 'changepoint_range': 0.5344742454175878}. Best is trial 96 with value: 0.038883738900888705.
Initial log joint probability = -28.8311
    Iter      log prob        ||dx||      ||grad||       alpha      alpha0  # evals  Notes 
      89       18912.9   1.05615e-05       2513.72   4.097e-09       0.001      161  LS failed, Hessian reset 
      99       18912.9   2.39729e-06        2772.3      0.6275      0.6275      172   
    Iter      log prob        ||dx||      ||grad||       alpha      alpha0  # evals  Notes 
     125       18912.9   7.19822e-09       2612.49      0.2333      0.2333      204   
Optimization terminated normally: 
  Convergence detected: absolute parameter change was below tolerance
INFO:fbprophet:Making 5 forecasts with cutoffs between 2013-10-07 00:00:00 and 2015-10-18 00:00:00
INFO:fbprophet:Applying in parallel with <concurrent.futures.process.ProcessPoolExecutor object at 0x7fc84dbe8090>
Initial log joint probability = -8.95172
    Iter      log prob        ||dx||      ||grad||       alpha      alpha0  # evals  Notes 
Initial log joint probability = -12.7302
    Iter      log prob        ||dx||      ||grad||       alpha      alpha0  # evals  Notes 
Initial log joint probability = -15.1549
    Iter      log prob        ||dx||      ||grad||       alpha      alpha0  # evals  Notes 
Initial log joint probability = -18.717
    Iter      log prob        ||dx||      ||grad||       alpha      alpha0  # evals  Notes 
Initial log joint probability = -23.5879
    Iter      log prob        ||dx||      ||grad||       alpha      alpha0  # evals  Notes 
      80       4679.12   9.37381e-06       2789.25   3.445e-09       0.001      151  LS failed, Hessian reset 
      99       4679.15   9.62452e-08          2583      0.7964      0.7964      172   
    Iter      log prob        ||dx||      ||grad||       alpha      alpha0  # evals  Notes 
      99       7029.64   2.19491e-07       2525.63      0.7106      0.7106      127   
    Iter      log prob        ||dx||      ||grad||       alpha      alpha0  # evals  Notes 
     132       4679.16    2.5566e-07       2945.46   9.584e-11       0.001      256  LS failed, Hessian reset 
     141       4679.16   7.36418e-09       2642.25      0.2968      0.9336      267   
Optimization terminated normally: 
  Convergence detected: absolute parameter change was below tolerance
      91       9582.55   4.07712e-09        2691.4      0.1745      0.1745      120   
Optimization terminated normally: 
  Convergence detected: absolute parameter change was below tolerance
      47       11812.8    4.3485e-05       2955.71   1.477e-08       0.001       97  LS failed, Hessian reset 
     189       7031.76   3.41493e-09       2851.14      0.1878      0.1878      241   
Optimization terminated normally: 
  Convergence detected: absolute parameter change was below tolerance
      76       11812.9   9.11482e-09        2970.6      0.3987      0.3987      135   
Optimization terminated normally: 
  Convergence detected: absolute parameter change was below tolerance
      99       14233.1   1.43531e-06       2773.28           1           1      130   
    Iter      log prob        ||dx||      ||grad||       alpha      alpha0  # evals  Notes 
     125       14233.1   9.75625e-09       2623.51      0.3852      0.3852      162   
Optimization terminated normally: 
  Convergence detected: absolute parameter change was below tolerance
