[I 2020-10-01 03:32:43,166] Trial 315 finished with value: 0.04149279912385262 and parameters: {'changepoint_prior_scale': 0.0010109866503268208, 'seasonality_prior_scale': 0.12998824287573812, 'holidays_prior_scale': 0.08242972073722456, 'seasonality_mode': 'additive', 'changepoint_range': 0.5594219749171181}. Best is trial 96 with value: 0.038883738900888705.
Initial log joint probability = -28.8311
    Iter      log prob        ||dx||      ||grad||       alpha      alpha0  # evals  Notes 
      99       18912.7   1.36016e-06       2012.18      0.4143           1      131   
    Iter      log prob        ||dx||      ||grad||       alpha      alpha0  # evals  Notes 
     114       18912.8   3.85039e-05       1997.46   2.127e-08       0.001      187  LS failed, Hessian reset 
     143       18912.8   2.31798e-08       1810.14      0.2094           1      225   
Optimization terminated normally: 
  Convergence detected: relative gradient magnitude is below tolerance
INFO:fbprophet:Making 5 forecasts with cutoffs between 2013-10-07 00:00:00 and 2015-10-18 00:00:00
INFO:fbprophet:Applying in parallel with <concurrent.futures.process.ProcessPoolExecutor object at 0x7fc84dc2f090>
Initial log joint probability = -8.95172
    Iter      log prob        ||dx||      ||grad||       alpha      alpha0  # evals  Notes 
Initial log joint probability = -12.7302
    Iter      log prob        ||dx||      ||grad||       alpha      alpha0  # evals  Notes 
Initial log joint probability = -15.1549
    Iter      log prob        ||dx||      ||grad||       alpha      alpha0  # evals  Notes 
Initial log joint probability = -18.717
    Iter      log prob        ||dx||      ||grad||       alpha      alpha0  # evals  Notes 
Initial log joint probability = -23.5879
    Iter      log prob        ||dx||      ||grad||       alpha      alpha0  # evals  Notes 
      78       4678.75   0.000109147       1918.02   5.881e-08       0.001      134  LS failed, Hessian reset 
      99        4678.9   8.90317e-06       2189.93           1           1      158   
    Iter      log prob        ||dx||      ||grad||       alpha      alpha0  # evals  Notes 
     107       4679.28   0.000119577       2053.34   5.992e-08       0.001      208  LS failed, Hessian reset 
      99       7031.61   0.000111358        1792.9           1           1      116   
    Iter      log prob        ||dx||      ||grad||       alpha      alpha0  # evals  Notes 
     138       4679.41   7.06962e-09       2007.82      0.5312      0.5312      248   
Optimization terminated normally: 
  Convergence detected: absolute parameter change was below tolerance
      71       9582.54   9.63411e-09       1887.03      0.5148      0.5148       97   
Optimization terminated normally: 
  Convergence detected: absolute parameter change was below tolerance
     140       7031.69   1.72478e-08       1916.86       1.422       0.368      167   
Optimization terminated normally: 
  Convergence detected: relative gradient magnitude is below tolerance
      71       11812.2   7.08282e-09       1971.67      0.3249      0.3249      101   
Optimization terminated normally: 
  Convergence detected: absolute parameter change was below tolerance
      99       14233.2   4.76621e-07       1706.28      0.4674      0.4674      130   
    Iter      log prob        ||dx||      ||grad||       alpha      alpha0  # evals  Notes 
     122       14233.2   5.22532e-08        1406.4           1           1      164   
Optimization terminated normally: 
  Convergence detected: relative gradient magnitude is below tolerance
[I 2020-10-01 03:32:58,842] Trial 316 finished with value: 0.04181432521409339 and parameters: {'changepoint_prior_scale': 0.002475949728777726, 'seasonality_prior_scale': 0.10132790588462756, 'holidays_prior_scale': 2.0054556065609126, 'seasonality_mode': 'additive', 'changepoint_range': 0.5443824902086383}. Best is trial 96 with value: 0.038883738900888705.
Initial log joint probability = -28.8311
    Iter      log prob        ||dx||      ||grad||       alpha      alpha0  # evals  Notes 
      99         18913     1.046e-05       2515.07           1           1      122   
    Iter      log prob        ||dx||      ||grad||       alpha      alpha0  # evals  Notes 
     123         18913   9.15418e-08       1887.56      0.5368      0.5368      152   
Optimization terminated normally: 
  Convergence detected: relative gradient magnitude is below tolerance
INFO:fbprophet:Making 5 forecasts with cutoffs between 2013-10-07 00:00:00 and 2015-10-18 00:00:00
INFO:fbprophet:Applying in parallel with <concurrent.futures.process.ProcessPoolExecutor object at 0x7fc84dc2f390>
Initial log joint probability = -8.95172
    Iter      log prob        ||dx||      ||grad||       alpha      alpha0  # evals  Notes 
Initial log joint probability = -12.7302
    Iter      log prob        ||dx||      ||grad||       alpha      alpha0  # evals  Notes 
Initial log joint probability = -15.1549
    Iter      log prob        ||dx||      ||grad||       alpha      alpha0  # evals  Notes 
Initial log joint probability = -18.717
    Iter      log prob        ||dx||      ||grad||       alpha      alpha0  # evals  Notes 
      42       4679.45    7.2226e-06       2368.97   3.026e-09       0.001       94  LS failed, Hessian reset 
Initial log joint probability = -23.5879
    Iter      log prob        ||dx||      ||grad||       alpha      alpha0  # evals  Notes 
      77       4679.47   9.63635e-09       2349.73      0.2092      0.2092      136   
Optimization terminated normally: 
  Convergence detected: absolute parameter change was below tolerance
      99       7030.17   3.18209e-06       2397.13     0.07001           1      124   
    Iter      log prob        ||dx||      ||grad||       alpha      alpha0  # evals  Notes 
      76       9581.39   2.64492e-08       2408.52           1           1       95   
Optimization terminated normally: 
  Convergence detected: relative gradient magnitude is below tolerance
     197       7031.59   2.22654e-07       2329.57   9.299e-11       0.001      289  LS failed, Hessian reset 
     199       7031.59   7.32332e-08       2323.24      0.1984           1      292   
    Iter      log prob        ||dx||      ||grad||       alpha      alpha0  # evals  Notes 
     205       7031.59   1.36442e-08       2336.97      0.2585           1      299   
Optimization terminated normally: 
  Convergence detected: relative gradient magnitude is below tolerance
      73       11812.9   1.03281e-05       2183.85   4.795e-09       0.001      158  LS failed, Hessian reset 
      99       14233.4   2.75944e-06       2311.08       1.108      0.3018      128   
    Iter      log prob        ||dx||      ||grad||       alpha      alpha0  # evals  Notes 
      99         11813   3.95567e-08        2174.4           1           1      191   
    Iter      log prob        ||dx||      ||grad||       alpha      alpha0  # evals  Notes 
     105         11813   4.20737e-09       2276.83       0.194       0.194      198   
Optimization terminated normally: 
  Convergence detected: absolute parameter change was below tolerance
     153       14233.5   1.38646e-08       1862.25      0.3521           1      198   
Optimization terminated normally: 
  Convergence detected: relative gradient magnitude is below tolerance
[I 2020-10-01 03:33:14,043] Trial 317 finished with value: 0.04166322554147313 and parameters: {'changepoint_prior_scale': 0.0021170560662323677, 'seasonality_prior_scale': 0.22286754667158265, 'holidays_prior_scale': 0.2682720455717022, 'seasonality_mode': 'additive', 'changepoint_range': 0.5149188541333418}. Best is trial 96 with value: 0.038883738900888705.
Initial log joint probability = -28.8311
    Iter      log prob        ||dx||      ||grad||       alpha      alpha0  # evals  Notes 
      99       18912.2   1.05814e-07       4368.07      0.2505      0.2505      130   
    Iter      log prob        ||dx||      ||grad||       alpha      alpha0  # evals  Notes 
     167       18912.5   2.09704e-08       3007.45           1           1      212   
Optimization terminated normally: 
  Convergence detected: relative gradient magnitude is below tolerance
INFO:fbprophet:Making 5 forecasts with cutoffs between 2013-10-07 00:00:00 and 2015-10-18 00:00:00
INFO:fbprophet:Applying in parallel with <concurrent.futures.process.ProcessPoolExecutor object at 0x7fc84dc0a590>
Initial log joint probability = -8.95172
    Iter      log prob        ||dx||      ||grad||       alpha      alpha0  # evals  Notes 
Initial log joint probability = -12.7302
    Iter      log prob        ||dx||      ||grad||       alpha      alpha0  # evals  Notes 
Initial log joint probability = -15.1549
    Iter      log prob        ||dx||      ||grad||       alpha      alpha0  # evals  Notes 
Initial log joint probability = -18.717
    Iter      log prob        ||dx||      ||grad||       alpha      alpha0  # evals  Notes 
      61       4679.08   8.50647e-09       3803.92      0.3463           1       83   
Optimization terminated normally: 
  Convergence detected: absolute parameter change was below tolerance
Initial log joint probability = -23.5879
    Iter      log prob        ||dx||      ||grad||       alpha      alpha0  # evals  Notes 
      83       7028.48   1.23216e-05       4388.72   3.137e-09       0.001      153  LS failed, Hessian reset 
      99       7028.52   1.46394e-07       3567.55      0.5499      0.5499      174   
    Iter      log prob        ||dx||      ||grad||       alpha      alpha0  # evals  Notes 
      78       9582.34   3.89442e-09       3836.09      0.2678      0.2678      111   
Optimization terminated normally: 
  Convergence detected: absolute parameter change was below tolerance
     118       7028.52   4.48098e-09       3625.94      0.1878      0.1878      197   
Optimization terminated normally: 
  Convergence detected: absolute parameter change was below tolerance
      30       11811.8   0.000221197       4247.23   5.277e-08       0.001       89  LS failed, Hessian reset 
      79       11812.6   1.01261e-08        4098.4      0.3041           1      155   
Optimization terminated normally: 
  Convergence detected: relative gradient magnitude is below tolerance
      99       14233.4   8.28509e-07        3604.3      0.2371           1      131   
    Iter      log prob        ||dx||      ||grad||       alpha      alpha0  # evals  Notes 
     113       14233.4    2.2995e-08       3769.73      0.4263           1      150   
Optimization terminated normally: 
  Convergence detected: relative gradient magnitude is below tolerance
[I 2020-10-01 03:33:29,618] Trial 318 finished with value: 0.04097257478940713 and parameters: {'changepoint_prior_scale': 0.001235235771075468, 'seasonality_prior_scale': 0.1867509963285666, 'holidays_prior_scale': 0.10503248746963813, 'seasonality_mode': 'additive', 'changepoint_range': 0.5537002182840055}. Best is trial 96 with value: 0.038883738900888705.
Initial log joint probability = -28.8311
    Iter      log prob        ||dx||      ||grad||       alpha      alpha0  # evals  Notes 
      99         18913   1.67183e-08       3382.87      0.4141      0.4141      125   
    Iter      log prob        ||dx||      ||grad||       alpha      alpha0  # evals  Notes 
     103         18913   7.31742e-09       3234.19      0.2484      0.2484      131   
Optimization terminated normally: 
  Convergence detected: absolute parameter change was below tolerance
INFO:fbprophet:Making 5 forecasts with cutoffs between 2013-10-07 00:00:00 and 2015-10-18 00:00:00
INFO:fbprophet:Applying in parallel with <concurrent.futures.process.ProcessPoolExecutor object at 0x7fc84dc28fd0>
Initial log joint probability = -8.95172
    Iter      log prob        ||dx||      ||grad||       alpha      alpha0  # evals  Notes 
Initial log joint probability = -12.7302
    Iter      log prob        ||dx||      ||grad||       alpha      alpha0  # evals  Notes 
Initial log joint probability = -15.1549
    Iter      log prob        ||dx||      ||grad||       alpha      alpha0  # evals  Notes 
      82        4678.6   7.37093e-08       3263.82   2.081e-11       0.001      151  LS failed, Hessian reset 
Initial log joint probability = -18.717
    Iter      log prob        ||dx||      ||grad||       alpha      alpha0  # evals  Notes 
      85        4678.6   8.91346e-09       2788.84      0.4871           1      156   
Optimization terminated normally: 
  Convergence detected: absolute parameter change was below tolerance
Initial log joint probability = -23.5879
    Iter      log prob        ||dx||      ||grad||       alpha      alpha0  # evals  Notes 
      81       7028.48   4.07909e-05       3158.74   1.116e-08       0.001      134  LS failed, Hessian reset 
      99       7028.61   6.64807e-07       3187.25           1           1      155   
    Iter      log prob        ||dx||      ||grad||       alpha      alpha0  # evals  Notes 
     118       7028.61   8.48624e-09       3467.34      0.3027      0.3027      182   
Optimization terminated normally: 
  Convergence detected: absolute parameter change was below tolerance
      55        9582.5   3.56019e-07       3259.52    9.38e-11       0.001      126  LS failed, Hessian reset 
      65       11813.2   8.68062e-09       3270.46      0.4558      0.4558       90   
Optimization terminated normally: 
  Convergence detected: absolute parameter change was below tolerance
      69       9582.51    8.4749e-09       3289.61      0.2555      0.6925      145   
Optimization terminated normally: 
  Convergence detected: absolute parameter change was below tolerance
      83       14233.3   3.22086e-05       3508.57   1.162e-08       0.001      145  LS failed, Hessian reset 
      99       14233.3    4.3097e-07       3157.27           1           1      167   
    Iter      log prob        ||dx||      ||grad||       alpha      alpha0  # evals  Notes 
     129       14233.3   9.66314e-09        3321.5      0.1711      0.1711      205   
Optimization terminated normally: 
  Convergence detected: absolute parameter change was below tolerance
[I 2020-10-01 03:33:43,975] Trial 319 finished with value: 0.04088247409416105 and parameters: {'changepoint_prior_scale': 0.0014797634300714013, 'seasonality_prior_scale': 0.1434579273797169, 'holidays_prior_scale': 2.4185385807493245, 'seasonality_mode': 'additive', 'changepoint_range': 0.5858804864768803}. Best is trial 96 with value: 0.038883738900888705.
Initial log joint probability = -28.8311
    Iter      log prob        ||dx||      ||grad||       alpha      alpha0  # evals  Notes 
      68       18911.1   0.000131499       4617.88    2.57e-08       0.001      133  LS failed, Hessian reset 
      99       18911.6   1.62283e-07       4045.37      0.4181      0.4181      170   
    Iter      log prob        ||dx||      ||grad||       alpha      alpha0  # evals  Notes 
     153       18911.6   5.46337e-09       4926.12      0.3637      0.3637      237   
Optimization terminated normally: 
  Convergence detected: absolute parameter change was below tolerance
INFO:fbprophet:Making 5 forecasts with cutoffs between 2013-10-07 00:00:00 and 2015-10-18 00:00:00
INFO:fbprophet:Applying in parallel with <concurrent.futures.process.ProcessPoolExecutor object at 0x7fc84dc28fd0>
Initial log joint probability = -8.95172
    Iter      log prob        ||dx||      ||grad||       alpha      alpha0  # evals  Notes 
Initial log joint probability = -12.7302
    Iter      log prob        ||dx||      ||grad||       alpha      alpha0  # evals  Notes 
Initial log joint probability = -15.1549
    Iter      log prob        ||dx||      ||grad||       alpha      alpha0  # evals  Notes 
Initial log joint probability = -18.717
    Iter      log prob        ||dx||      ||grad||       alpha      alpha0  # evals  Notes 
Initial log joint probability = -23.5879
    Iter      log prob        ||dx||      ||grad||       alpha      alpha0  # evals  Notes 
      58       4678.62   1.30648e-05       4883.87   2.565e-09       0.001      120  LS failed, Hessian reset 
      91       4678.69   6.29276e-07       5036.86   1.247e-10       0.001      201  LS failed, Hessian reset 
      99       4678.69   3.45019e-08       5005.94      0.1988      0.1988      211   
    Iter      log prob        ||dx||      ||grad||       alpha      alpha0  # evals  Notes 
      99       7028.27   1.71876e-06       4492.37           1           1      121   
    Iter      log prob        ||dx||      ||grad||       alpha      alpha0  # evals  Notes 
     114       4678.69   9.97248e-09       4892.44      0.8495      0.8495      230   
Optimization terminated normally: 
  Convergence detected: absolute parameter change was below tolerance
     125       7028.27   7.47548e-08        4440.9   1.662e-11       0.001      193  LS failed, Hessian reset 
      28       11811.7   0.000420047       5118.19    8.51e-08       0.001       87  LS failed, Hessian reset 
      89        9582.3    5.6882e-09       4592.12      0.5272      0.5272      123   
Optimization terminated normally: 
  Convergence detected: absolute parameter change was below tolerance
     133       7028.27   4.80569e-09       4075.21      0.4079      0.4079      202   
Optimization terminated normally: 
  Convergence detected: absolute parameter change was below tolerance
      63       11813.1    9.6211e-09        4921.2      0.1876      0.1876      131   
Optimization terminated normally: 
  Convergence detected: absolute parameter change was below tolerance
      99       14231.6   1.47549e-05       4893.67      0.1952           1      127   
    Iter      log prob        ||dx||      ||grad||       alpha      alpha0  # evals  Notes 
     130       14231.6   5.89404e-08       4613.74           1           1      174   
Optimization terminated normally: 
  Convergence detected: relative gradient magnitude is below tolerance
[I 2020-10-01 03:33:59,449] Trial 320 finished with value: 0.04119602560519726 and parameters: {'changepoint_prior_scale': 0.00100579052404062, 'seasonality_prior_scale': 0.0835267454464974, 'holidays_prior_scale': 0.20251051756195065, 'seasonality_mode': 'additive', 'changepoint_range': 0.5013637414045391}. Best is trial 96 with value: 0.038883738900888705.
Initial log joint probability = -28.8311
    Iter      log prob        ||dx||      ||grad||       alpha      alpha0  # evals  Notes 
      99         18913   3.48916e-07       2617.65           1           1      122   
    Iter      log prob        ||dx||      ||grad||       alpha      alpha0  # evals  Notes 
     121         18913    1.2612e-06       2700.89   4.499e-10       0.001      198  LS failed, Hessian reset 
     147         18913   2.38519e-08       2498.12      0.6517      0.6517      229   
Optimization terminated normally: 
  Convergence detected: relative gradient magnitude is below tolerance
INFO:fbprophet:Making 5 forecasts with cutoffs between 2013-10-07 00:00:00 and 2015-10-18 00:00:00
INFO:fbprophet:Applying in parallel with <concurrent.futures.process.ProcessPoolExecutor object at 0x7fc84dc28ad0>
Initial log joint probability = -8.95172
    Iter      log prob        ||dx||      ||grad||       alpha      alpha0  # evals  Notes 
Initial log joint probability = -12.7302
    Iter      log prob        ||dx||      ||grad||       alpha      alpha0  # evals  Notes 
Initial log joint probability = -15.1549
    Iter      log prob        ||dx||      ||grad||       alpha      alpha0  # evals  Notes 
Initial log joint probability = -18.717
      53        4679.4   8.56233e-09       2614.01      0.4056      0.4056       69   
Optimization terminated normally: 
  Convergence detected: absolute parameter change was below tolerance
    Iter      log prob        ||dx||      ||grad||       alpha      alpha0  # evals  Notes 
Initial log joint probability = -23.5879
    Iter      log prob        ||dx||      ||grad||       alpha      alpha0  # evals  Notes 
      99       7029.71   1.22179e-06       2810.23           1           1      120   
    Iter      log prob        ||dx||      ||grad||       alpha      alpha0  # evals  Notes 
      59       9582.52   8.97952e-09       2422.07      0.3121      0.3121       84   
Optimization terminated normally: 
  Convergence detected: absolute parameter change was below tolerance
     143       7029.73   1.60559e-09       2873.74      0.1428      0.1428      179   
Optimization terminated normally: 
  Convergence detected: absolute parameter change was below tolerance
      55       11813.3   6.97244e-09       2789.27      0.4911      0.4911       80   
Optimization terminated normally: 
  Convergence detected: absolute parameter change was below tolerance
      82       14232.8   3.48782e-05       2867.16   1.214e-08       0.001      152  LS failed, Hessian reset 
      99         14233   6.39896e-06       2595.41           1           1      175   
    Iter      log prob        ||dx||      ||grad||       alpha      alpha0  # evals  Notes 
     147         14233   1.21425e-08       2181.52     0.09475           1      238   
Optimization terminated normally: 
  Convergence detected: relative gradient magnitude is below tolerance
