[I 2020-10-01 02:33:51,672] Trial 83 finished with value: 0.04178850434868712 and parameters: {'changepoint_prior_scale': 0.002013895807825272, 'seasonality_prior_scale': 0.04506362782559963, 'holidays_prior_scale': 3.895354213641323, 'seasonality_mode': 'additive', 'changepoint_range': 0.6279273401214037}. Best is trial 67 with value: 0.04069570224533105.
Initial log joint probability = -28.8311
    Iter      log prob        ||dx||      ||grad||       alpha      alpha0  # evals  Notes 
      99       18912.8   6.36536e-07       2950.18      0.3072      0.3072      136   
    Iter      log prob        ||dx||      ||grad||       alpha      alpha0  # evals  Notes 
     126       18912.8   3.31359e-08       3384.26           1           1      170   
Optimization terminated normally: 
  Convergence detected: relative gradient magnitude is below tolerance
INFO:fbprophet:Making 5 forecasts with cutoffs between 2013-10-07 00:00:00 and 2015-10-18 00:00:00
INFO:fbprophet:Applying in parallel with <concurrent.futures.process.ProcessPoolExecutor object at 0x7fc88e6ae250>
Initial log joint probability = -8.95172
    Iter      log prob        ||dx||      ||grad||       alpha      alpha0  # evals  Notes 
Initial log joint probability = -12.7302
    Iter      log prob        ||dx||      ||grad||       alpha      alpha0  # evals  Notes 
Initial log joint probability = -15.1549
    Iter      log prob        ||dx||      ||grad||       alpha      alpha0  # evals  Notes 
Initial log joint probability = -18.717
    Iter      log prob        ||dx||      ||grad||       alpha      alpha0  # evals  Notes 
      60       4679.17   7.39559e-09       3266.71      0.1751      0.1751       78   
Optimization terminated normally: 
  Convergence detected: absolute parameter change was below tolerance
Initial log joint probability = -23.5879
    Iter      log prob        ||dx||      ||grad||       alpha      alpha0  # evals  Notes 
      60       7028.62    9.9298e-05       3676.31   2.906e-08       0.001      114  LS failed, Hessian reset 
      99       7028.91   2.74502e-08       3305.94      0.3368      0.3368      163   
    Iter      log prob        ||dx||      ||grad||       alpha      alpha0  # evals  Notes 
      96       9582.54   1.85414e-08       3287.07      0.7661      0.7661      135   
Optimization terminated normally: 
  Convergence detected: relative gradient magnitude is below tolerance
     130       7029.25   3.58891e-05       3065.61   1.048e-08       0.001      246  LS failed, Hessian reset 
      64       11813.2   3.41379e-06       3208.97   9.212e-10       0.001      130  LS failed, Hessian reset 
     187       7029.31   5.57202e-09       3059.89      0.3055      0.3055      315   
Optimization terminated normally: 
  Convergence detected: absolute parameter change was below tolerance
      89       11813.2   3.22366e-09       3074.92      0.2315      0.2315      163   
Optimization terminated normally: 
  Convergence detected: absolute parameter change was below tolerance
      99       14233.1   1.13825e-06       3062.98      0.3947      0.3947      128   
    Iter      log prob        ||dx||      ||grad||       alpha      alpha0  # evals  Notes 
     110       14233.3   1.99252e-05       3275.13   5.193e-09       0.001      184  LS failed, Hessian reset 
     132       14233.4   1.16573e-06       3453.05    3.41e-10       0.001      245  LS failed, Hessian reset 
     156       14233.4   5.94565e-07       3296.19    1.71e-10       0.001      316  LS failed, Hessian reset 
     176       14233.4   2.03277e-07       3295.12   5.533e-11       0.001      386  LS failed, Hessian reset 
     183       14233.4   6.32077e-09       3033.65      0.3841      0.3841      394   
Optimization terminated normally: 
  Convergence detected: absolute parameter change was below tolerance
[I 2020-10-01 02:34:07,189] Trial 84 finished with value: 0.04121686062824837 and parameters: {'changepoint_prior_scale': 0.001477957354079168, 'seasonality_prior_scale': 0.4475654431205016, 'holidays_prior_scale': 1.1612039259900218, 'seasonality_mode': 'additive', 'changepoint_range': 0.9392965183978725}. Best is trial 67 with value: 0.04069570224533105.
Initial log joint probability = -28.8311
    Iter      log prob        ||dx||      ||grad||       alpha      alpha0  # evals  Notes 
      99       18922.5    0.00328324       188.944           1           1      112   
    Iter      log prob        ||dx||      ||grad||       alpha      alpha0  # evals  Notes 
     199         18923    0.00148207       67.2474           1           1      222   
    Iter      log prob        ||dx||      ||grad||       alpha      alpha0  # evals  Notes 
     299       18923.3   0.000291348       71.2058           1           1      336   
    Iter      log prob        ||dx||      ||grad||       alpha      alpha0  # evals  Notes 
     399       18923.4   0.000753793       63.7995           1           1      450   
    Iter      log prob        ||dx||      ||grad||       alpha      alpha0  # evals  Notes 
     499       18923.6   0.000143341       13.0187       0.233      0.9457      564   
    Iter      log prob        ||dx||      ||grad||       alpha      alpha0  # evals  Notes 
     599       18923.7   0.000638348       20.6933           1           1      685   
    Iter      log prob        ||dx||      ||grad||       alpha      alpha0  # evals  Notes 
     613       18923.7   9.13132e-06       29.6074   3.482e-07       0.001      771  LS failed, Hessian reset 
     699       18923.7   0.000150704       37.6074      0.7368      0.7368      878   
    Iter      log prob        ||dx||      ||grad||       alpha      alpha0  # evals  Notes 
     799       18923.8   5.67587e-05       39.5553       0.353       0.353      997   
    Iter      log prob        ||dx||      ||grad||       alpha      alpha0  # evals  Notes 
     842       18923.8   1.19516e-05       41.6012   2.244e-07       0.001     1096  LS failed, Hessian reset 
     899       18923.8   0.000112674       19.2475      0.8404      0.8404     1163   
    Iter      log prob        ||dx||      ||grad||       alpha      alpha0  # evals  Notes 
     935       18923.8   3.90742e-06       9.78752      0.3618      0.8587     1210   
Optimization terminated normally: 
  Convergence detected: relative gradient magnitude is below tolerance
INFO:fbprophet:Making 5 forecasts with cutoffs between 2013-10-07 00:00:00 and 2015-10-18 00:00:00
INFO:fbprophet:Applying in parallel with <concurrent.futures.process.ProcessPoolExecutor object at 0x7fc88e664310>
Initial log joint probability = -8.95172
    Iter      log prob        ||dx||      ||grad||       alpha      alpha0  # evals  Notes 
Initial log joint probability = -12.7302
    Iter      log prob        ||dx||      ||grad||       alpha      alpha0  # evals  Notes 
Initial log joint probability = -15.1549
    Iter      log prob        ||dx||      ||grad||       alpha      alpha0  # evals  Notes 
Initial log joint probability = -18.717
    Iter      log prob        ||dx||      ||grad||       alpha      alpha0  # evals  Notes 
Initial log joint probability = -23.5879
    Iter      log prob        ||dx||      ||grad||       alpha      alpha0  # evals  Notes 
      99       4679.14   4.97749e-05       13.4766      0.2571           1      126   
    Iter      log prob        ||dx||      ||grad||       alpha      alpha0  # evals  Notes 
     142       4679.14   2.59178e-06       10.5246           1           1      181   
Optimization terminated normally: 
  Convergence detected: relative gradient magnitude is below tolerance
      99       7039.59   0.000979697       21.6652           1           1      114   
    Iter      log prob        ||dx||      ||grad||       alpha      alpha0  # evals  Notes 
      99       9588.24   9.62813e-05       29.2325           1           1      115   
    Iter      log prob        ||dx||      ||grad||       alpha      alpha0  # evals  Notes 
     199       7039.78   0.000106437        27.444      0.4421      0.4421      256   
    Iter      log prob        ||dx||      ||grad||       alpha      alpha0  # evals  Notes 
      99       11819.8    0.00140161       66.1456           1           1      119   
    Iter      log prob        ||dx||      ||grad||       alpha      alpha0  # evals  Notes 
     218        7039.8     2.369e-05       28.4234    4.78e-07       0.001      321  LS failed, Hessian reset 
      99       14242.3     0.0011415       155.159      0.4222      0.4222      124   
    Iter      log prob        ||dx||      ||grad||       alpha      alpha0  # evals  Notes 
     199       9588.91     0.0034288       144.879           1           1      223   
    Iter      log prob        ||dx||      ||grad||       alpha      alpha0  # evals  Notes 
     270       7039.82   1.30444e-06       8.86798      0.3827      0.3827      383   
Optimization terminated normally: 
  Convergence detected: relative gradient magnitude is below tolerance
     199       11820.2   0.000517134       37.5001      0.9175      0.9175      234   
    Iter      log prob        ||dx||      ||grad||       alpha      alpha0  # evals  Notes 
     299       9589.16    0.00212851       42.6736      0.8867     0.08867      351   
    Iter      log prob        ||dx||      ||grad||       alpha      alpha0  # evals  Notes 
     194       14242.8   1.38315e-05       31.6616   2.274e-07       0.001      292  LS failed, Hessian reset 
     199       14242.8   0.000281044         61.79           1           1      297   
    Iter      log prob        ||dx||      ||grad||       alpha      alpha0  # evals  Notes 
     299       11820.5   9.48131e-05       17.8087           1           1      350   
    Iter      log prob        ||dx||      ||grad||       alpha      alpha0  # evals  Notes 
     384       9589.26   1.18038e-05       23.0637   5.674e-07       0.001      509  LS failed, Hessian reset 
     399       9589.27   0.000103942       23.2603           1           1      528   
    Iter      log prob        ||dx||      ||grad||       alpha      alpha0  # evals  Notes 
     451       9589.28   9.78268e-06       19.6584   4.277e-07       0.001      642  LS failed, Hessian reset 
     399       11820.7   4.03287e-05       20.9374      0.7748      0.7748      482   
    Iter      log prob        ||dx||      ||grad||       alpha      alpha0  # evals  Notes 
     299       14243.1   9.64127e-05       52.5462      0.5759      0.5759      411   
    Iter      log prob        ||dx||      ||grad||       alpha      alpha0  # evals  Notes 
     493       9589.29   1.78236e-06       11.2324      0.2945      0.2945      694   
Optimization terminated normally: 
  Convergence detected: relative gradient magnitude is below tolerance
     310       14243.1   2.09878e-05       34.3668   9.111e-07       0.001      470  LS failed, Hessian reset 
     458       11820.7   4.11883e-05       20.2922   3.052e-06       0.001      601  LS failed, Hessian reset 
     399       14243.2   0.000915314       51.3051           1           1      566   
    Iter      log prob        ||dx||      ||grad||       alpha      alpha0  # evals  Notes 
     499       11820.7   2.33852e-05       14.6584      0.9678      0.9678      653   
    Iter      log prob        ||dx||      ||grad||       alpha      alpha0  # evals  Notes 
     534       11820.7   3.34363e-06        12.083       0.237           1      697   
Optimization terminated normally: 
  Convergence detected: relative gradient magnitude is below tolerance
     499       14243.4    0.00119573       54.6159      0.9154           1      685   
    Iter      log prob        ||dx||      ||grad||       alpha      alpha0  # evals  Notes 
     576       14243.5   1.48047e-05       37.4306    3.14e-07       0.001      836  LS failed, Hessian reset 
     599       14243.5   0.000461824       29.4809           1           1      861   
    Iter      log prob        ||dx||      ||grad||       alpha      alpha0  # evals  Notes 
     674       14243.5   6.67277e-06       15.1465           1           1      955   
Optimization terminated normally: 
  Convergence detected: relative gradient magnitude is below tolerance
[I 2020-10-01 02:34:29,040] Trial 85 finished with value: 0.04834574687610298 and parameters: {'changepoint_prior_scale': 0.32047932418245967, 'seasonality_prior_scale': 0.04108614148049329, 'holidays_prior_scale': 3.441652160749405, 'seasonality_mode': 'additive', 'changepoint_range': 0.5308407609434349}. Best is trial 67 with value: 0.04069570224533105.
Initial log joint probability = -28.8311
    Iter      log prob        ||dx||      ||grad||       alpha      alpha0  # evals  Notes 
      99       18912.5   3.83196e-05       4669.22      0.3746           1      125   
    Iter      log prob        ||dx||      ||grad||       alpha      alpha0  # evals  Notes 
     142       18912.5   1.34656e-07       4480.34   2.905e-11       0.001      223  LS failed, Hessian reset 
     161       18912.5   2.37268e-08       4465.31         1.6        0.16      246   
Optimization terminated normally: 
  Convergence detected: relative gradient magnitude is below tolerance
INFO:fbprophet:Making 5 forecasts with cutoffs between 2013-10-07 00:00:00 and 2015-10-18 00:00:00
INFO:fbprophet:Applying in parallel with <concurrent.futures.process.ProcessPoolExecutor object at 0x7fc88e651710>
Initial log joint probability = -8.95172
    Iter      log prob        ||dx||      ||grad||       alpha      alpha0  # evals  Notes 
Initial log joint probability = -12.7302
    Iter      log prob        ||dx||      ||grad||       alpha      alpha0  # evals  Notes 
Initial log joint probability = -15.1549
    Iter      log prob        ||dx||      ||grad||       alpha      alpha0  # evals  Notes 
Initial log joint probability = -18.717
    Iter      log prob        ||dx||      ||grad||       alpha      alpha0  # evals  Notes 
Initial log joint probability = -23.5879
    Iter      log prob        ||dx||      ||grad||       alpha      alpha0  # evals  Notes 
      51       4672.32    0.00180129       5246.23   4.063e-07       0.001      105  LS failed, Hessian reset 
      99       4679.09   1.96736e-07       4854.67      0.4278      0.4278      159   
    Iter      log prob        ||dx||      ||grad||       alpha      alpha0  # evals  Notes 
     124        4679.1   8.82627e-09       4783.59      0.1835           1      195   
Optimization terminated normally: 
  Convergence detected: absolute parameter change was below tolerance
      57       9582.47   3.14008e-09       4756.32      0.2537      0.2537       81   
Optimization terminated normally: 
  Convergence detected: absolute parameter change was below tolerance
      87       7027.68   5.83063e-05        4662.8   1.132e-08       0.001      154  LS failed, Hessian reset 
      99       7027.86   1.10482e-06        4921.5      0.3079           1      173   
    Iter      log prob        ||dx||      ||grad||       alpha      alpha0  # evals  Notes 
      57       11812.6    5.3588e-09       4977.94      0.4448      0.4448       84   
Optimization terminated normally: 
  Convergence detected: absolute parameter change was below tolerance
     138       7027.88   1.36611e-06       4651.02   2.632e-10       0.001      258  LS failed, Hessian reset 
     159       7027.89   4.78152e-09       4500.48      0.3455      0.3455      285   
Optimization terminated normally: 
  Convergence detected: absolute parameter change was below tolerance
      99       14233.6   4.40595e-06       4799.03      0.5575      0.5575      129   
    Iter      log prob        ||dx||      ||grad||       alpha      alpha0  # evals  Notes 
     122       14233.6   9.52634e-09       4916.25      0.4802      0.4802      155   
Optimization terminated normally: 
  Convergence detected: absolute parameter change was below tolerance
[I 2020-10-01 02:34:44,345] Trial 86 finished with value: 0.04180082215607441 and parameters: {'changepoint_prior_scale': 0.0010194193638558646, 'seasonality_prior_scale': 0.2882440155679279, 'holidays_prior_scale': 1.729529706682379, 'seasonality_mode': 'additive', 'changepoint_range': 0.6464189555092522}. Best is trial 67 with value: 0.04069570224533105.
Initial log joint probability = -28.8311
    Iter      log prob        ||dx||      ||grad||       alpha      alpha0  # evals  Notes 
      99       18916.7   0.000841837       218.892           1           1      122   
    Iter      log prob        ||dx||      ||grad||       alpha      alpha0  # evals  Notes 
     185       18916.8     8.243e-07       95.0587      0.5405      0.5405      235   
Optimization terminated normally: 
  Convergence detected: relative gradient magnitude is below tolerance
INFO:fbprophet:Making 5 forecasts with cutoffs between 2013-10-07 00:00:00 and 2015-10-18 00:00:00
INFO:fbprophet:Applying in parallel with <concurrent.futures.process.ProcessPoolExecutor object at 0x7fc88e6d4a90>
Initial log joint probability = -8.95172
    Iter      log prob        ||dx||      ||grad||       alpha      alpha0  # evals  Notes 
Initial log joint probability = -12.7302
    Iter      log prob        ||dx||      ||grad||       alpha      alpha0  # evals  Notes 
Initial log joint probability = -15.1549
    Iter      log prob        ||dx||      ||grad||       alpha      alpha0  # evals  Notes 
Initial log joint probability = -18.717
    Iter      log prob        ||dx||      ||grad||       alpha      alpha0  # evals  Notes 
Initial log joint probability = -23.5879
    Iter      log prob        ||dx||      ||grad||       alpha      alpha0  # evals  Notes 
      99        4679.3   0.000306888       167.772           1           1      115   
    Iter      log prob        ||dx||      ||grad||       alpha      alpha0  # evals  Notes 
     142       4679.36   1.07124e-06       148.028   7.074e-09       0.001      199  LS failed, Hessian reset 
     152       4679.36   1.33886e-07       154.778       0.894       0.894      209   
Optimization terminated normally: 
  Convergence detected: relative gradient magnitude is below tolerance
      99       7036.99   6.12354e-05       112.611     0.06214           1      130   
    Iter      log prob        ||dx||      ||grad||       alpha      alpha0  # evals  Notes 
     136       7037.07   1.84585e-07       88.8764      0.3616           1      187   
Optimization terminated normally: 
  Convergence detected: relative gradient magnitude is below tolerance
      99       9584.75   0.000357405       145.018           1           1      122   
    Iter      log prob        ||dx||      ||grad||       alpha      alpha0  # evals  Notes 
     134       9584.78   3.45685e-07        111.42      0.2304           1      173   
Optimization terminated normally: 
  Convergence detected: relative gradient magnitude is below tolerance
      99       11815.3   0.000266419       170.064      0.6172      0.6172      126   
    Iter      log prob        ||dx||      ||grad||       alpha      alpha0  # evals  Notes 
      99         14237   3.56003e-05       76.1933      0.4817      0.4817      129   
    Iter      log prob        ||dx||      ||grad||       alpha      alpha0  # evals  Notes 
     143       11815.4   8.94854e-05       203.659   5.616e-07       0.001      229  LS failed, Hessian reset 
     199       11815.4   0.000241248       103.235           1           1      296   
    Iter      log prob        ||dx||      ||grad||       alpha      alpha0  # evals  Notes 
     199       14237.5   2.81899e-06       66.8404     0.08752           1      259   
    Iter      log prob        ||dx||      ||grad||       alpha      alpha0  # evals  Notes 
     221       11815.5   3.63715e-05       104.059   3.359e-07       0.001      378  LS failed, Hessian reset 
     253       14237.6   5.68346e-07       59.6566      0.3885     0.03885      323   
Optimization terminated normally: 
  Convergence detected: relative gradient magnitude is below tolerance
     299       11815.6   1.83013e-06       129.028      0.1933           1      481   
    Iter      log prob        ||dx||      ||grad||       alpha      alpha0  # evals  Notes 
     357       11815.6    2.3241e-07       94.9499     0.05651           1      558   
Optimization terminated normally: 
  Convergence detected: relative gradient magnitude is below tolerance
