[I 2020-10-01 04:11:47,689] Trial 469 finished with value: 0.040956088510737704 and parameters: {'changepoint_prior_scale': 0.001468551954450815, 'seasonality_prior_scale': 0.2092763765776871, 'holidays_prior_scale': 0.13740430400986178, 'seasonality_mode': 'additive', 'changepoint_range': 0.5246657805245165}. Best is trial 96 with value: 0.038883738900888705.
Initial log joint probability = -28.8311
    Iter      log prob        ||dx||      ||grad||       alpha      alpha0  # evals  Notes 
      99       18912.4   1.74392e-07       2449.13      0.6459      0.6459      135   
    Iter      log prob        ||dx||      ||grad||       alpha      alpha0  # evals  Notes 
     111       18912.4   2.14999e-06       2490.28   6.939e-10       0.001      195  LS failed, Hessian reset 
     145       18912.4   2.75732e-08       2912.42      0.3641      0.3641      235   
Optimization terminated normally: 
  Convergence detected: relative gradient magnitude is below tolerance
INFO:fbprophet:Making 5 forecasts with cutoffs between 2013-10-07 00:00:00 and 2015-10-18 00:00:00
INFO:fbprophet:Applying in parallel with <concurrent.futures.process.ProcessPoolExecutor object at 0x7fc84dc925d0>
Initial log joint probability = -8.95172
    Iter      log prob        ||dx||      ||grad||       alpha      alpha0  # evals  Notes 
Initial log joint probability = -12.7302
    Iter      log prob        ||dx||      ||grad||       alpha      alpha0  # evals  Notes 
Initial log joint probability = -15.1549
    Iter      log prob        ||dx||      ||grad||       alpha      alpha0  # evals  Notes 
Initial log joint probability = -18.717
    Iter      log prob        ||dx||      ||grad||       alpha      alpha0  # evals  Notes 
Initial log joint probability = -23.5879
    Iter      log prob        ||dx||      ||grad||       alpha      alpha0  # evals  Notes 
      72       4678.83   0.000182599       3235.77   5.849e-08       0.001      148  LS failed, Hessian reset 
      99       4679.43   2.91994e-07       3077.33      0.1548           1      187   
    Iter      log prob        ||dx||      ||grad||       alpha      alpha0  # evals  Notes 
     106       4679.43   7.40822e-09       3016.28      0.3718      0.3718      197   
Optimization terminated normally: 
  Convergence detected: absolute parameter change was below tolerance
      77       7029.53   6.75078e-05       3352.29    2.08e-08       0.001      137  LS failed, Hessian reset 
      65       9582.52   4.23674e-09       3098.58      0.2896           1       89   
Optimization terminated normally: 
  Convergence detected: absolute parameter change was below tolerance
      99       7029.67   3.85516e-07       3235.17      0.2421           1      165   
    Iter      log prob        ||dx||      ||grad||       alpha      alpha0  # evals  Notes 
     115       7029.67   8.02358e-09       2919.04      0.2875      0.9212      186   
Optimization terminated normally: 
  Convergence detected: absolute parameter change was below tolerance
      35       11812.1   0.000225668       3279.23   8.199e-08       0.001       91  LS failed, Hessian reset 
      75       11813.2   6.92038e-09        3097.3     0.06392     0.06392      142   
Optimization terminated normally: 
  Convergence detected: absolute parameter change was below tolerance
      99       14232.6   1.15467e-06        2894.8      0.4463      0.4463      131   
    Iter      log prob        ||dx||      ||grad||       alpha      alpha0  # evals  Notes 
     119       14232.6   3.23518e-08       2613.69      0.9797      0.9797      156   
Optimization terminated normally: 
  Convergence detected: relative gradient magnitude is below tolerance
[I 2020-10-01 04:12:03,022] Trial 470 finished with value: 0.04097569732805789 and parameters: {'changepoint_prior_scale': 0.0016082394694428685, 'seasonality_prior_scale': 0.16941451795930523, 'holidays_prior_scale': 0.16457286748475305, 'seasonality_mode': 'additive', 'changepoint_range': 0.5402494862910763}. Best is trial 96 with value: 0.038883738900888705.
{'changepoint_prior_scale': 0.001148265615841428, 'seasonality_prior_scale': 0.18502076368187464, 'holidays_prior_scale': 0.08950161812346888, 'seasonality_mode': 'additive', 'changepoint_range': 0.5572609987905732}
Initial log joint probability = -28.8311
    Iter      log prob        ||dx||      ||grad||       alpha      alpha0  # evals  Notes 
      99       18912.5   8.10551e-06       4062.38      0.4544      0.4544      122   
    Iter      log prob        ||dx||      ||grad||       alpha      alpha0  # evals  Notes 
     124       18912.6   9.19348e-09       3979.59      0.2782      0.2782      152   
Optimization terminated normally: 
  Convergence detected: absolute parameter change was below tolerance
