[I 2020-10-01 02:29:41,351] Trial 67 finished with value: 0.04069570224533105 and parameters: {'changepoint_prior_scale': 0.0015203940816942007, 'seasonality_prior_scale': 0.3596295700581048, 'holidays_prior_scale': 2.4043687962917235, 'seasonality_mode': 'additive', 'changepoint_range': 0.5356456864369543}. Best is trial 67 with value: 0.04069570224533105.
Initial log joint probability = -28.8311
    Iter      log prob        ||dx||      ||grad||       alpha      alpha0  # evals  Notes 
      99       18922.7   0.000787617       64.2832      0.7864      0.7864      113   
    Iter      log prob        ||dx||      ||grad||       alpha      alpha0  # evals  Notes 
     199         18924   0.000667322       33.5755           1           1      222   
    Iter      log prob        ||dx||      ||grad||       alpha      alpha0  # evals  Notes 
     299       18924.3   0.000840659       16.1208           1           1      327   
    Iter      log prob        ||dx||      ||grad||       alpha      alpha0  # evals  Notes 
     399       18924.5   0.000828859       23.3516           1           1      443   
    Iter      log prob        ||dx||      ||grad||       alpha      alpha0  # evals  Notes 
     427       18924.6   1.61688e-05       35.8644   4.343e-07       0.001      517  LS failed, Hessian reset 
     428       18924.6   1.12174e-05       12.9305           1           1      518   
Optimization terminated normally: 
  Convergence detected: relative gradient magnitude is below tolerance
INFO:fbprophet:Making 5 forecasts with cutoffs between 2013-10-07 00:00:00 and 2015-10-18 00:00:00
INFO:fbprophet:Applying in parallel with <concurrent.futures.process.ProcessPoolExecutor object at 0x7fc88e6d4310>
Initial log joint probability = -8.95172
    Iter      log prob        ||dx||      ||grad||       alpha      alpha0  # evals  Notes 
Initial log joint probability = -12.7302
    Iter      log prob        ||dx||      ||grad||       alpha      alpha0  # evals  Notes 
Initial log joint probability = -15.1549
    Iter      log prob        ||dx||      ||grad||       alpha      alpha0  # evals  Notes 
Initial log joint probability = -18.717
    Iter      log prob        ||dx||      ||grad||       alpha      alpha0  # evals  Notes 
Initial log joint probability = -23.5879
    Iter      log prob        ||dx||      ||grad||       alpha      alpha0  # evals  Notes 
      99       4679.51    0.00014434       18.4985           1           1      124   
    Iter      log prob        ||dx||      ||grad||       alpha      alpha0  # evals  Notes 
     126       4679.51   7.56898e-05       11.9529   5.879e-06       0.001      186  LS failed, Hessian reset 
     148       4679.51   1.94051e-06       9.80592           1           1      216   
Optimization terminated normally: 
  Convergence detected: relative gradient magnitude is below tolerance
      99       7040.05   7.03553e-06       10.1901   6.154e-07       0.001      162  LS failed, Hessian reset 
    Iter      log prob        ||dx||      ||grad||       alpha      alpha0  # evals  Notes 
      99       9589.46   0.000577913       35.6277           1           1      119   
    Iter      log prob        ||dx||      ||grad||       alpha      alpha0  # evals  Notes 
      99       11820.5   0.000734088       30.2235           1           1      122   
    Iter      log prob        ||dx||      ||grad||       alpha      alpha0  # evals  Notes 
     199       7040.21   0.000312952       28.1673           1           1      285   
    Iter      log prob        ||dx||      ||grad||       alpha      alpha0  # evals  Notes 
      99       14243.3   0.000927506        40.764       1.728      0.1728      120   
    Iter      log prob        ||dx||      ||grad||       alpha      alpha0  # evals  Notes 
     199       9589.98   4.95804e-05       36.5037      0.3529      0.3529      232   
    Iter      log prob        ||dx||      ||grad||       alpha      alpha0  # evals  Notes 
     299       7040.29   9.50257e-05        39.214      0.3384           1      411   
    Iter      log prob        ||dx||      ||grad||       alpha      alpha0  # evals  Notes 
     199         11821   0.000326194        44.237      0.3679      0.3679      235   
    Iter      log prob        ||dx||      ||grad||       alpha      alpha0  # evals  Notes 
     399       7040.32    0.00134252       13.8245       0.287           1      528   
    Iter      log prob        ||dx||      ||grad||       alpha      alpha0  # evals  Notes 
     299       9590.23    0.00120008       86.9621           1           1      349   
    Iter      log prob        ||dx||      ||grad||       alpha      alpha0  # evals  Notes 
     465       7040.34   2.98013e-06        8.5329      0.3249           1      616   
Optimization terminated normally: 
  Convergence detected: relative gradient magnitude is below tolerance
     199       14243.9   5.26535e-05       91.2646      0.2898      0.2898      237   
    Iter      log prob        ||dx||      ||grad||       alpha      alpha0  # evals  Notes 
     299       11821.4   0.000992094       33.8817      0.2228           1      348   
    Iter      log prob        ||dx||      ||grad||       alpha      alpha0  # evals  Notes 
     399       9590.37    5.1924e-05       9.51928      0.7471      0.7471      469   
    Iter      log prob        ||dx||      ||grad||       alpha      alpha0  # evals  Notes 
     300       11821.4   9.62742e-06       21.7105   2.841e-07       0.001      384  LS failed, Hessian reset 
     499       9590.42   4.06337e-05       11.8761           1           1      595   
    Iter      log prob        ||dx||      ||grad||       alpha      alpha0  # evals  Notes 
     299       14244.1   0.000235542       18.7685      0.8905      0.8905      358   
    Iter      log prob        ||dx||      ||grad||       alpha      alpha0  # evals  Notes 
     517       9590.42   1.00017e-05       18.7742   4.106e-07       0.001      657  LS failed, Hessian reset 
     399       11821.5   0.000453103       50.5591           1           1      500   
    Iter      log prob        ||dx||      ||grad||       alpha      alpha0  # evals  Notes 
     554       9590.42   3.89795e-06       7.52599           1           1      706   
Optimization terminated normally: 
  Convergence detected: relative gradient magnitude is below tolerance
     399       14244.2    1.1054e-05       21.5443      0.8006      0.8006      481   
    Iter      log prob        ||dx||      ||grad||       alpha      alpha0  # evals  Notes 
     475       11821.6   5.98347e-05       37.7051   3.857e-06       0.001      642  LS failed, Hessian reset 
     499       11821.6   9.63953e-05       22.7171           1           1      667   
    Iter      log prob        ||dx||      ||grad||       alpha      alpha0  # evals  Notes 
     561       11821.6   6.33966e-06       7.23226       0.313           1      751   
Optimization terminated normally: 
  Convergence detected: relative gradient magnitude is below tolerance
     462       14244.3   1.08715e-05       31.8582   2.704e-07       0.001      602  LS failed, Hessian reset 
     499       14244.3   8.33847e-05       21.6591      0.8766      0.8766      646   
    Iter      log prob        ||dx||      ||grad||       alpha      alpha0  # evals  Notes 
     599       14244.4   4.33214e-05       9.87856           1           1      769   
    Iter      log prob        ||dx||      ||grad||       alpha      alpha0  # evals  Notes 
     640       14244.4      3.07e-06       7.63557      0.2831      0.2831      816   
Optimization terminated normally: 
  Convergence detected: relative gradient magnitude is below tolerance
[I 2020-10-01 02:29:58,506] Trial 68 finished with value: 0.04627799125594664 and parameters: {'changepoint_prior_scale': 0.41643208798429987, 'seasonality_prior_scale': 0.5886933511230427, 'holidays_prior_scale': 1.3414954644092092, 'seasonality_mode': 'additive', 'changepoint_range': 0.5036453453156818}. Best is trial 67 with value: 0.04069570224533105.
Initial log joint probability = -28.8311
    Iter      log prob        ||dx||      ||grad||       alpha      alpha0  # evals  Notes 
      99         18913   7.59822e-06       1428.89           1           1      139   
    Iter      log prob        ||dx||      ||grad||       alpha      alpha0  # evals  Notes 
     133         18913   7.21233e-08       1563.97      0.2252           1      179   
Optimization terminated normally: 
  Convergence detected: relative gradient magnitude is below tolerance
INFO:fbprophet:Making 5 forecasts with cutoffs between 2013-10-07 00:00:00 and 2015-10-18 00:00:00
INFO:fbprophet:Applying in parallel with <concurrent.futures.process.ProcessPoolExecutor object at 0x7fc88e6a6b10>
Initial log joint probability = -8.95172
    Iter      log prob        ||dx||      ||grad||       alpha      alpha0  # evals  Notes 
Initial log joint probability = -12.7302
    Iter      log prob        ||dx||      ||grad||       alpha      alpha0  # evals  Notes 
Initial log joint probability = -15.1549
    Iter      log prob        ||dx||      ||grad||       alpha      alpha0  # evals  Notes 
Initial log joint probability = -18.717
    Iter      log prob        ||dx||      ||grad||       alpha      alpha0  # evals  Notes 
Initial log joint probability = -23.5879
    Iter      log prob        ||dx||      ||grad||       alpha      alpha0  # evals  Notes 
      93       4679.39   6.48946e-09       1924.26      0.1286      0.3143      133   
Optimization terminated normally: 
  Convergence detected: absolute parameter change was below tolerance
      99       7031.93   1.33115e-05       1950.46      0.9219      0.9219      126   
    Iter      log prob        ||dx||      ||grad||       alpha      alpha0  # evals  Notes 
      47        9582.6   5.30225e-06        1904.1   2.474e-09       0.001      105  LS failed, Hessian reset 
      66       9582.61   4.29985e-08        1684.4      0.9003      0.9003      128   
Optimization terminated normally: 
  Convergence detected: relative gradient magnitude is below tolerance
     126       7032.13   1.28933e-05        1816.6   6.637e-09       0.001      208  LS failed, Hessian reset 
      91       11812.4   1.23733e-08       1905.97      0.2832      0.2832      120   
Optimization terminated normally: 
  Convergence detected: relative gradient magnitude is below tolerance
     180       7032.17    6.3371e-09       1880.12      0.4881      0.4881      280   
Optimization terminated normally: 
  Convergence detected: absolute parameter change was below tolerance
      99       14233.2   2.45947e-07       1872.99           1           1      132   
    Iter      log prob        ||dx||      ||grad||       alpha      alpha0  # evals  Notes 
     110       14233.2   1.89399e-06       1655.06   9.774e-10       0.001      182  LS failed, Hessian reset 
     129       14233.2   3.22165e-08       1485.82      0.4665      0.4665      211   
Optimization terminated normally: 
  Convergence detected: relative gradient magnitude is below tolerance
[I 2020-10-01 02:30:12,948] Trial 69 finished with value: 0.04182372581640698 and parameters: {'changepoint_prior_scale': 0.0025716490299896554, 'seasonality_prior_scale': 0.4482733802244005, 'holidays_prior_scale': 3.7334922953313523, 'seasonality_mode': 'additive', 'changepoint_range': 0.5406874725684011}. Best is trial 67 with value: 0.04069570224533105.
Initial log joint probability = -28.8311
    Iter      log prob        ||dx||      ||grad||       alpha      alpha0  # evals  Notes 
      93       18912.9   1.84838e-08        3144.4      0.3166      0.3166      119   
Optimization terminated normally: 
  Convergence detected: relative gradient magnitude is below tolerance
INFO:fbprophet:Making 5 forecasts with cutoffs between 2013-10-07 00:00:00 and 2015-10-18 00:00:00
INFO:fbprophet:Applying in parallel with <concurrent.futures.process.ProcessPoolExecutor object at 0x7fc88e6d4e10>
Initial log joint probability = -8.95172
    Iter      log prob        ||dx||      ||grad||       alpha      alpha0  # evals  Notes 
Initial log joint probability = -12.7302
    Iter      log prob        ||dx||      ||grad||       alpha      alpha0  # evals  Notes 
Initial log joint probability = -15.1549
    Iter      log prob        ||dx||      ||grad||       alpha      alpha0  # evals  Notes 
Initial log joint probability = -18.717
    Iter      log prob        ||dx||      ||grad||       alpha      alpha0  # evals  Notes 
Initial log joint probability = -23.5879
    Iter      log prob        ||dx||      ||grad||       alpha      alpha0  # evals  Notes 
      49       4679.25   4.40491e-07       3267.25    1.36e-10       0.001      104  LS failed, Hessian reset 
      68       4679.25   6.95373e-09       3180.25      0.4157      0.4157      128   
Optimization terminated normally: 
  Convergence detected: absolute parameter change was below tolerance
      99       7029.42   2.03676e-06       3115.42      0.6883      0.6883      128   
    Iter      log prob        ||dx||      ||grad||       alpha      alpha0  # evals  Notes 
     117       7029.43   6.46573e-09       2794.01      0.2509      0.2509      151   
Optimization terminated normally: 
  Convergence detected: absolute parameter change was below tolerance
      48       11813.3   4.64212e-09        3237.3      0.3163      0.3163       74   
Optimization terminated normally: 
  Convergence detected: absolute parameter change was below tolerance
      95       9582.56   9.64913e-09       2885.95      0.3583      0.3583      129   
Optimization terminated normally: 
  Convergence detected: absolute parameter change was below tolerance
      73       14230.8   5.88483e-05       3182.06   2.051e-08       0.001      132  LS failed, Hessian reset 
      99       14231.1   4.07237e-07       2960.82      0.2283           1      164   
    Iter      log prob        ||dx||      ||grad||       alpha      alpha0  # evals  Notes 
     143       14231.1   1.64621e-08       3187.33      0.3733      0.7469      223   
Optimization terminated normally: 
  Convergence detected: relative gradient magnitude is below tolerance
[I 2020-10-01 02:30:28,415] Trial 70 finished with value: 0.04103684256853551 and parameters: {'changepoint_prior_scale': 0.0015281832440431171, 'seasonality_prior_scale': 0.35107115760838054, 'holidays_prior_scale': 2.416698396006604, 'seasonality_mode': 'additive', 'changepoint_range': 0.5002575246178452}. Best is trial 67 with value: 0.04069570224533105.
Initial log joint probability = -28.8311
    Iter      log prob        ||dx||      ||grad||       alpha      alpha0  # evals  Notes 
      99       18912.5   9.81728e-07       4129.43      0.8201      0.8201      126   
    Iter      log prob        ||dx||      ||grad||       alpha      alpha0  # evals  Notes 
     172       18912.7   7.85368e-07        4238.2   1.809e-10       0.001      259  LS failed, Hessian reset 
     186       18912.7   6.22875e-09       3987.15      0.1984      0.1984      279   
Optimization terminated normally: 
  Convergence detected: absolute parameter change was below tolerance
INFO:fbprophet:Making 5 forecasts with cutoffs between 2013-10-07 00:00:00 and 2015-10-18 00:00:00
INFO:fbprophet:Applying in parallel with <concurrent.futures.process.ProcessPoolExecutor object at 0x7fc88e6b7d90>
Initial log joint probability = -8.95172
    Iter      log prob        ||dx||      ||grad||       alpha      alpha0  # evals  Notes 
Initial log joint probability = -12.7302
    Iter      log prob        ||dx||      ||grad||       alpha      alpha0  # evals  Notes 
Initial log joint probability = -15.1549
    Iter      log prob        ||dx||      ||grad||       alpha      alpha0  # evals  Notes 
Initial log joint probability = -18.717
    Iter      log prob        ||dx||      ||grad||       alpha      alpha0  # evals  Notes 
Initial log joint probability = -23.5879
      71       4678.87   9.45582e-09        4327.7      0.6376      0.6376       95   
Optimization terminated normally: 
  Convergence detected: absolute parameter change was below tolerance
    Iter      log prob        ||dx||      ||grad||       alpha      alpha0  # evals  Notes 
      81       7028.37   1.40441e-05       3871.06   3.074e-09       0.001      137  LS failed, Hessian reset 
      99       7028.42   1.98763e-07       3328.43      0.2536           1      159   
    Iter      log prob        ||dx||      ||grad||       alpha      alpha0  # evals  Notes 
     117       7028.42   1.87967e-09       3147.35     0.04469      0.5248      182   
Optimization terminated normally: 
  Convergence detected: absolute parameter change was below tolerance
      28       11811.3   0.000259648       4432.71   6.375e-08       0.001       80  LS failed, Hessian reset 
      57       9582.28   2.09462e-05       4353.67   4.917e-09       0.001      113  LS failed, Hessian reset 
      90       9582.35   8.85733e-09       3777.74      0.5875      0.5875      159   
Optimization terminated normally: 
  Convergence detected: absolute parameter change was below tolerance
      88       11812.9    7.7766e-09       4110.62      0.2035      0.6795      153   
Optimization terminated normally: 
  Convergence detected: absolute parameter change was below tolerance
      99       14232.9   2.66394e-05       3318.59           1           1      127   
    Iter      log prob        ||dx||      ||grad||       alpha      alpha0  # evals  Notes 
     167       14233.6   7.81063e-09       4022.36      0.5107      0.5107      215   
Optimization terminated normally: 
  Convergence detected: absolute parameter change was below tolerance
[I 2020-10-01 02:30:44,804] Trial 71 finished with value: 0.041100197580850956 and parameters: {'changepoint_prior_scale': 0.0011588180656685327, 'seasonality_prior_scale': 0.26068488553969477, 'holidays_prior_scale': 6.258945394820898, 'seasonality_mode': 'additive', 'changepoint_range': 0.521936347094343}. Best is trial 67 with value: 0.04069570224533105.
Initial log joint probability = -28.8311
    Iter      log prob        ||dx||      ||grad||       alpha      alpha0  # evals  Notes 
      99       18912.7   2.25066e-06       3087.98           1           1      125   
    Iter      log prob        ||dx||      ||grad||       alpha      alpha0  # evals  Notes 
     122       18912.7    5.5455e-09       3347.75      0.1837      0.1837      152   
Optimization terminated normally: 
  Convergence detected: absolute parameter change was below tolerance
INFO:fbprophet:Making 5 forecasts with cutoffs between 2013-10-07 00:00:00 and 2015-10-18 00:00:00
INFO:fbprophet:Applying in parallel with <concurrent.futures.process.ProcessPoolExecutor object at 0x7fc88e6b7850>
Initial log joint probability = -8.95172
    Iter      log prob        ||dx||      ||grad||       alpha      alpha0  # evals  Notes 
Initial log joint probability = -12.7302
    Iter      log prob        ||dx||      ||grad||       alpha      alpha0  # evals  Notes 
Initial log joint probability = -15.1549
    Iter      log prob        ||dx||      ||grad||       alpha      alpha0  # evals  Notes 
Initial log joint probability = -18.717
    Iter      log prob        ||dx||      ||grad||       alpha      alpha0  # evals  Notes 
Initial log joint probability = -23.5879
    Iter      log prob        ||dx||      ||grad||       alpha      alpha0  # evals  Notes 
      83        4679.1   3.43694e-09       3246.14      0.3517      0.3517      107   
Optimization terminated normally: 
  Convergence detected: absolute parameter change was below tolerance
      54       9582.56   7.36603e-09       3057.92       0.642       0.642       73   
Optimization terminated normally: 
  Convergence detected: absolute parameter change was below tolerance
      80       7029.08   6.72641e-05       3564.17   1.991e-08       0.001      157  LS failed, Hessian reset 
      99       7029.28   9.07625e-07       3194.93      0.4294      0.4294      182   
    Iter      log prob        ||dx||      ||grad||       alpha      alpha0  # evals  Notes 
      39         11812   0.000170322       3369.72   4.767e-08       0.001       93  LS failed, Hessian reset 
      92       11813.3   4.92944e-09       3345.07       0.288       0.288      158   
Optimization terminated normally: 
  Convergence detected: absolute parameter change was below tolerance
      99       14231.7   1.71315e-06       3409.51      0.3859      0.3859      132   
    Iter      log prob        ||dx||      ||grad||       alpha      alpha0  # evals  Notes 
     199       7031.67   1.64417e-05       3470.37           1           1      302   
    Iter      log prob        ||dx||      ||grad||       alpha      alpha0  # evals  Notes 
     292       7031.97   8.29137e-09       3201.28      0.2312      0.2312      417   
Optimization terminated normally: 
  Convergence detected: absolute parameter change was below tolerance
     199       14232.4   2.07798e-05       3343.35      0.1193           1      253   
    Iter      log prob        ||dx||      ||grad||       alpha      alpha0  # evals  Notes 
     201       14232.4   4.80875e-06       3125.62   1.349e-09       0.001      297  LS failed, Hessian reset 
     231       14232.4   1.09479e-08       3331.63      0.3555           1      337   
Optimization terminated normally: 
  Convergence detected: relative gradient magnitude is below tolerance
