[I 2020-10-01 03:14:33,688] Trial 244 finished with value: 0.040680145345883524 and parameters: {'changepoint_prior_scale': 0.001246910995472385, 'seasonality_prior_scale': 0.08449708935578311, 'holidays_prior_scale': 0.21393044522785215, 'seasonality_mode': 'additive', 'changepoint_range': 0.5740791456387709}. Best is trial 96 with value: 0.038883738900888705.
Initial log joint probability = -28.8311
    Iter      log prob        ||dx||      ||grad||       alpha      alpha0  # evals  Notes 
      99       18912.9   2.84472e-07       3402.51       0.442       0.442      118   
    Iter      log prob        ||dx||      ||grad||       alpha      alpha0  # evals  Notes 
     113       18912.9   4.33645e-07       3800.04    1.18e-10       0.001      173  LS failed, Hessian reset 
     133       18912.9   3.15532e-08       3738.81      0.7485      0.7485      196   
Optimization terminated normally: 
  Convergence detected: relative gradient magnitude is below tolerance
INFO:fbprophet:Making 5 forecasts with cutoffs between 2013-10-07 00:00:00 and 2015-10-18 00:00:00
INFO:fbprophet:Applying in parallel with <concurrent.futures.process.ProcessPoolExecutor object at 0x7fc84dbb3c10>
Initial log joint probability = -8.95172
    Iter      log prob        ||dx||      ||grad||       alpha      alpha0  # evals  Notes 
Initial log joint probability = -12.7302
    Iter      log prob        ||dx||      ||grad||       alpha      alpha0  # evals  Notes 
Initial log joint probability = -15.1549
    Iter      log prob        ||dx||      ||grad||       alpha      alpha0  # evals  Notes 
Initial log joint probability = -18.717
    Iter      log prob        ||dx||      ||grad||       alpha      alpha0  # evals  Notes 
Initial log joint probability = -23.5879
    Iter      log prob        ||dx||      ||grad||       alpha      alpha0  # evals  Notes 
      72       4678.94   3.41347e-09       3647.89      0.2499      0.2499       95   
Optimization terminated normally: 
  Convergence detected: absolute parameter change was below tolerance
      99       7028.95   1.01986e-06       3420.81      0.7054      0.7054      143   
    Iter      log prob        ||dx||      ||grad||       alpha      alpha0  # evals  Notes 
      80       9582.35   6.45534e-09       3606.77      0.5275      0.5275      107   
Optimization terminated normally: 
  Convergence detected: absolute parameter change was below tolerance
      28       11811.5   0.000242552       3764.63   6.371e-08       0.001       81  LS failed, Hessian reset 
     134       7028.96   5.12315e-09       3551.12      0.1949      0.1949      184   
Optimization terminated normally: 
  Convergence detected: absolute parameter change was below tolerance
      84       11813.2   7.26966e-09       3757.82      0.3737      0.3737      154   
Optimization terminated normally: 
  Convergence detected: absolute parameter change was below tolerance
      99       14233.4   7.62178e-08       3346.08      0.4305           1      139   
    Iter      log prob        ||dx||      ||grad||       alpha      alpha0  # evals  Notes 
     103       14233.4   3.67196e-09       3360.19      0.2059      0.2059      144   
Optimization terminated normally: 
  Convergence detected: absolute parameter change was below tolerance
[I 2020-10-01 03:14:49,432] Trial 245 finished with value: 0.04059645637674013 and parameters: {'changepoint_prior_scale': 0.0013280817136727366, 'seasonality_prior_scale': 0.09795809204764011, 'holidays_prior_scale': 0.19303285957532973, 'seasonality_mode': 'additive', 'changepoint_range': 0.5814101843534187}. Best is trial 96 with value: 0.038883738900888705.
Initial log joint probability = -28.8311
    Iter      log prob        ||dx||      ||grad||       alpha      alpha0  # evals  Notes 
      99       18912.6   1.03072e-05       3774.96           1           1      123   
    Iter      log prob        ||dx||      ||grad||       alpha      alpha0  # evals  Notes 
     139       18912.9   2.51901e-08       3559.07           1           1      174   
Optimization terminated normally: 
  Convergence detected: relative gradient magnitude is below tolerance
INFO:fbprophet:Making 5 forecasts with cutoffs between 2013-10-07 00:00:00 and 2015-10-18 00:00:00
INFO:fbprophet:Applying in parallel with <concurrent.futures.process.ProcessPoolExecutor object at 0x7fc84dbb3ad0>
Initial log joint probability = -8.95172
    Iter      log prob        ||dx||      ||grad||       alpha      alpha0  # evals  Notes 
Initial log joint probability = -12.7302
    Iter      log prob        ||dx||      ||grad||       alpha      alpha0  # evals  Notes 
Initial log joint probability = -15.1549
    Iter      log prob        ||dx||      ||grad||       alpha      alpha0  # evals  Notes 
Initial log joint probability = -18.717
    Iter      log prob        ||dx||      ||grad||       alpha      alpha0  # evals  Notes 
      65       4678.96   3.18163e-09       3527.77      0.2296      0.2296       88   
Optimization terminated normally: 
  Convergence detected: absolute parameter change was below tolerance
Initial log joint probability = -23.5879
    Iter      log prob        ||dx||      ||grad||       alpha      alpha0  # evals  Notes 
      66       9582.36   7.38339e-09       3083.97      0.3671      0.3671       92   
Optimization terminated normally: 
  Convergence detected: absolute parameter change was below tolerance
      90        7028.8   2.05373e-05       3761.88   5.949e-09       0.001      154  LS failed, Hessian reset 
      99       7028.86   1.84303e-06       2881.14           1           1      166   
    Iter      log prob        ||dx||      ||grad||       alpha      alpha0  # evals  Notes 
      46       11813.1   9.88921e-09       3672.63      0.1033      0.2733       72   
Optimization terminated normally: 
  Convergence detected: absolute parameter change was below tolerance
     139       7028.88    6.5445e-09       3281.77      0.2139      0.2139      214   
Optimization terminated normally: 
  Convergence detected: absolute parameter change was below tolerance
      98       14233.1   4.37122e-09       3033.86      0.2183      0.2183      128   
Optimization terminated normally: 
  Convergence detected: absolute parameter change was below tolerance
[I 2020-10-01 03:15:03,935] Trial 246 finished with value: 0.04079969932907052 and parameters: {'changepoint_prior_scale': 0.0013481909349337788, 'seasonality_prior_scale': 0.08624042528115926, 'holidays_prior_scale': 0.20069870620132704, 'seasonality_mode': 'additive', 'changepoint_range': 0.5746469442982526}. Best is trial 96 with value: 0.038883738900888705.
Initial log joint probability = -28.8311
    Iter      log prob        ||dx||      ||grad||       alpha      alpha0  # evals  Notes 
      99       18912.7   1.77334e-07       3545.77      0.2749      0.2749      124   
    Iter      log prob        ||dx||      ||grad||       alpha      alpha0  # evals  Notes 
     109       18912.7   2.73381e-08       3363.06      0.8576      0.8576      138   
Optimization terminated normally: 
  Convergence detected: relative gradient magnitude is below tolerance
INFO:fbprophet:Making 5 forecasts with cutoffs between 2013-10-07 00:00:00 and 2015-10-18 00:00:00
INFO:fbprophet:Applying in parallel with <concurrent.futures.process.ProcessPoolExecutor object at 0x7fc84dbb27d0>
Initial log joint probability = -8.95172
    Iter      log prob        ||dx||      ||grad||       alpha      alpha0  # evals  Notes 
Initial log joint probability = -12.7302
    Iter      log prob        ||dx||      ||grad||       alpha      alpha0  # evals  Notes 
Initial log joint probability = -15.1549
    Iter      log prob        ||dx||      ||grad||       alpha      alpha0  # evals  Notes 
Initial log joint probability = -18.717
    Iter      log prob        ||dx||      ||grad||       alpha      alpha0  # evals  Notes 
      58       4679.02   9.68126e-09       3513.29      0.5327      0.5327       80   
Optimization terminated normally: 
  Convergence detected: absolute parameter change was below tolerance
Initial log joint probability = -23.5879
    Iter      log prob        ||dx||      ||grad||       alpha      alpha0  # evals  Notes 
      99       7028.79    3.0605e-06       3335.21           1           1      127   
    Iter      log prob        ||dx||      ||grad||       alpha      alpha0  # evals  Notes 
      52        9582.1   3.73027e-05       3641.74   1.003e-08       0.001      108  LS failed, Hessian reset 
     171       7030.95   4.88476e-09       3422.04      0.2462      0.2462      212   
Optimization terminated normally: 
  Convergence detected: absolute parameter change was below tolerance
      38       11811.3   0.000263601       3736.42   7.659e-08       0.001      103  LS failed, Hessian reset 
      90        9582.2   8.19238e-09       3644.23      0.2712      0.8433      156   
Optimization terminated normally: 
  Convergence detected: absolute parameter change was below tolerance
      99       14232.7   1.50259e-07       3190.62      0.7551      0.7551      129   
    Iter      log prob        ||dx||      ||grad||       alpha      alpha0  # evals  Notes 
      97         11813   7.38801e-09       3611.14      0.3381      0.3381      173   
Optimization terminated normally: 
  Convergence detected: absolute parameter change was below tolerance
     109       14232.7   8.73657e-09       3562.92      0.4656      0.4656      142   
Optimization terminated normally: 
  Convergence detected: absolute parameter change was below tolerance
[I 2020-10-01 03:15:19,441] Trial 247 finished with value: 0.04159224846095212 and parameters: {'changepoint_prior_scale': 0.0014127324109878075, 'seasonality_prior_scale': 0.053538249513705484, 'holidays_prior_scale': 0.2330772033598595, 'seasonality_mode': 'additive', 'changepoint_range': 0.5094443713906991}. Best is trial 96 with value: 0.038883738900888705.
Initial log joint probability = -28.8311
    Iter      log prob        ||dx||      ||grad||       alpha      alpha0  # evals  Notes 
      99       18911.9   2.65976e-06       4893.47           1           1      129   
    Iter      log prob        ||dx||      ||grad||       alpha      alpha0  # evals  Notes 
     199       18912.4   1.41744e-08       4003.63      0.2676      0.2676      253   
    Iter      log prob        ||dx||      ||grad||       alpha      alpha0  # evals  Notes 
     205       18912.4   1.60257e-08        4213.6     0.06769           1      262   
Optimization terminated normally: 
  Convergence detected: relative gradient magnitude is below tolerance
INFO:fbprophet:Making 5 forecasts with cutoffs between 2013-10-07 00:00:00 and 2015-10-18 00:00:00
INFO:fbprophet:Applying in parallel with <concurrent.futures.process.ProcessPoolExecutor object at 0x7fc84dc1c850>
Initial log joint probability = -8.95172
    Iter      log prob        ||dx||      ||grad||       alpha      alpha0  # evals  Notes 
Initial log joint probability = -12.7302
    Iter      log prob        ||dx||      ||grad||       alpha      alpha0  # evals  Notes 
Initial log joint probability = -15.1549
    Iter      log prob        ||dx||      ||grad||       alpha      alpha0  # evals  Notes 
      62       4678.82   6.64998e-09       5178.71     0.07502      0.3144       85   
Optimization terminated normally: 
  Convergence detected: absolute parameter change was below tolerance
Initial log joint probability = -18.717
    Iter      log prob        ||dx||      ||grad||       alpha      alpha0  # evals  Notes 
Initial log joint probability = -23.5879
    Iter      log prob        ||dx||      ||grad||       alpha      alpha0  # evals  Notes 
      97        7028.1   9.29389e-09       4745.75      0.3281      0.3281      126   
Optimization terminated normally: 
  Convergence detected: absolute parameter change was below tolerance
      69       9582.17   8.13143e-09       4975.47      0.2904      0.2904       91   
Optimization terminated normally: 
  Convergence detected: absolute parameter change was below tolerance
      59       11812.7   7.43646e-09       5014.66      0.6464      0.6464       89   
Optimization terminated normally: 
  Convergence detected: absolute parameter change was below tolerance
      99         14233   4.86134e-06       5030.94      0.3844      0.3844      133   
    Iter      log prob        ||dx||      ||grad||       alpha      alpha0  # evals  Notes 
     123         14233    3.1722e-09       5077.72      0.1066      0.1066      166   
Optimization terminated normally: 
  Convergence detected: absolute parameter change was below tolerance
[I 2020-10-01 03:15:33,126] Trial 248 finished with value: 0.04110017350357509 and parameters: {'changepoint_prior_scale': 0.0010061227057977934, 'seasonality_prior_scale': 0.09974381918290581, 'holidays_prior_scale': 0.1853857289746554, 'seasonality_mode': 'additive', 'changepoint_range': 0.5712050159884373}. Best is trial 96 with value: 0.038883738900888705.
Initial log joint probability = -28.8311
    Iter      log prob        ||dx||      ||grad||       alpha      alpha0  # evals  Notes 
      99       18912.6   3.81105e-07       3012.75           1           1      130   
    Iter      log prob        ||dx||      ||grad||       alpha      alpha0  # evals  Notes 
     142       18912.6   2.81463e-07        2524.8   9.445e-11       0.001      225  LS failed, Hessian reset 
     155       18912.6   2.04768e-08       2929.94      0.3655           1      241   
Optimization terminated normally: 
  Convergence detected: relative gradient magnitude is below tolerance
INFO:fbprophet:Making 5 forecasts with cutoffs between 2013-10-07 00:00:00 and 2015-10-18 00:00:00
INFO:fbprophet:Applying in parallel with <concurrent.futures.process.ProcessPoolExecutor object at 0x7fc84dbb2310>
Initial log joint probability = -8.95172
    Iter      log prob        ||dx||      ||grad||       alpha      alpha0  # evals  Notes 
Initial log joint probability = -12.7302
    Iter      log prob        ||dx||      ||grad||       alpha      alpha0  # evals  Notes 
Initial log joint probability = -15.1549
    Iter      log prob        ||dx||      ||grad||       alpha      alpha0  # evals  Notes 
Initial log joint probability = -18.717
    Iter      log prob        ||dx||      ||grad||       alpha      alpha0  # evals  Notes 
      67       4678.82   8.72099e-09        2827.3       0.692       0.692       93   
Optimization terminated normally: 
  Convergence detected: absolute parameter change was below tolerance
Initial log joint probability = -23.5879
    Iter      log prob        ||dx||      ||grad||       alpha      alpha0  # evals  Notes 
      99        7029.3    2.2971e-06       2971.82           1           1      125   
    Iter      log prob        ||dx||      ||grad||       alpha      alpha0  # evals  Notes 
      70       9582.48   6.14402e-09       3014.84      0.2678      0.2678      107   
Optimization terminated normally: 
  Convergence detected: absolute parameter change was below tolerance
     181       7031.87   7.05019e-09       2846.02      0.3399           1      227   
Optimization terminated normally: 
  Convergence detected: absolute parameter change was below tolerance
      80         11813   8.30761e-09       3084.91      0.3561      0.3561      109   
Optimization terminated normally: 
  Convergence detected: absolute parameter change was below tolerance
      97       14233.1   5.87599e-06       2403.31   1.772e-09       0.001      168  LS failed, Hessian reset 
      99       14233.1   2.24526e-06       2340.88           1           1      170   
    Iter      log prob        ||dx||      ||grad||       alpha      alpha0  # evals  Notes 
     118       14233.1   6.79134e-09        1920.4      0.1679      0.1679      194   
Optimization terminated normally: 
  Convergence detected: absolute parameter change was below tolerance
[I 2020-10-01 03:15:49,066] Trial 249 finished with value: 0.0413427916596228 and parameters: {'changepoint_prior_scale': 0.0016731309820788734, 'seasonality_prior_scale': 0.08877731199705231, 'holidays_prior_scale': 0.20446219884204483, 'seasonality_mode': 'additive', 'changepoint_range': 0.5844545488876703}. Best is trial 96 with value: 0.038883738900888705.
Initial log joint probability = -28.8311
    Iter      log prob        ||dx||      ||grad||       alpha      alpha0  # evals  Notes 
      99       18912.8   0.000164609       3542.73           1           1      121   
    Iter      log prob        ||dx||      ||grad||       alpha      alpha0  # evals  Notes 
     146       18912.9   8.14361e-09       4214.97      0.2663      0.2663      182   
Optimization terminated normally: 
  Convergence detected: absolute parameter change was below tolerance
INFO:fbprophet:Making 5 forecasts with cutoffs between 2013-10-07 00:00:00 and 2015-10-18 00:00:00
INFO:fbprophet:Applying in parallel with <concurrent.futures.process.ProcessPoolExecutor object at 0x7fc84dc34c90>
Initial log joint probability = -8.95172
    Iter      log prob        ||dx||      ||grad||       alpha      alpha0  # evals  Notes 
Initial log joint probability = -12.7302
    Iter      log prob        ||dx||      ||grad||       alpha      alpha0  # evals  Notes 
Initial log joint probability = -15.1549
    Iter      log prob        ||dx||      ||grad||       alpha      alpha0  # evals  Notes 
Initial log joint probability = -18.717
    Iter      log prob        ||dx||      ||grad||       alpha      alpha0  # evals  Notes 
Initial log joint probability = -23.5879
    Iter      log prob        ||dx||      ||grad||       alpha      alpha0  # evals  Notes 
      55        4679.2   1.58839e-05       4103.67   3.811e-09       0.001      113  LS failed, Hessian reset 
      88       4679.26   2.40328e-09       4116.93      0.2022      0.2022      156   
Optimization terminated normally: 
  Convergence detected: absolute parameter change was below tolerance
      69       7028.56   2.16964e-05       3788.67   5.433e-09       0.001      125  LS failed, Hessian reset 
      99       7028.64   2.81346e-06       3893.37           1           1      161   
    Iter      log prob        ||dx||      ||grad||       alpha      alpha0  # evals  Notes 
      80       9582.43   4.48107e-09       3686.07      0.1502      0.1502      111   
Optimization terminated normally: 
  Convergence detected: absolute parameter change was below tolerance
      58       11813.2     9.857e-09       4008.09      0.3891      0.3891       82   
Optimization terminated normally: 
  Convergence detected: absolute parameter change was below tolerance
     135       7028.69   4.60302e-09       4214.82      0.4405      0.4405      217   
Optimization terminated normally: 
  Convergence detected: absolute parameter change was below tolerance
      99       14232.3   3.30884e-07       3860.09      0.3673           1      133   
    Iter      log prob        ||dx||      ||grad||       alpha      alpha0  # evals  Notes 
     117       14232.3   5.92372e-09       4111.33      0.5512      0.5512      154   
Optimization terminated normally: 
  Convergence detected: absolute parameter change was below tolerance
