[I 2020-10-01 02:52:35,659] Trial 157 finished with value: 0.041278922784812044 and parameters: {'changepoint_prior_scale': 0.0018483251845395406, 'seasonality_prior_scale': 0.18169670660466458, 'holidays_prior_scale': 0.07617810151188587, 'seasonality_mode': 'additive', 'changepoint_range': 0.8641983326240391}. Best is trial 96 with value: 0.038883738900888705.
Initial log joint probability = -28.8311
    Iter      log prob        ||dx||      ||grad||       alpha      alpha0  # evals  Notes 
      99       18912.5   3.26949e-07       1605.93       0.512       0.512      125   
    Iter      log prob        ||dx||      ||grad||       alpha      alpha0  # evals  Notes 
     124       18912.5   7.10186e-09       3348.98      0.2307      0.2307      158   
Optimization terminated normally: 
  Convergence detected: absolute parameter change was below tolerance
INFO:fbprophet:Making 5 forecasts with cutoffs between 2013-10-07 00:00:00 and 2015-10-18 00:00:00
INFO:fbprophet:Applying in parallel with <concurrent.futures.process.ProcessPoolExecutor object at 0x7fc88e683410>
Initial log joint probability = -8.95172
    Iter      log prob        ||dx||      ||grad||       alpha      alpha0  # evals  Notes 
Initial log joint probability = -12.7302
    Iter      log prob        ||dx||      ||grad||       alpha      alpha0  # evals  Notes 
Initial log joint probability = -15.1549
    Iter      log prob        ||dx||      ||grad||       alpha      alpha0  # evals  Notes 
Initial log joint probability = -18.717
    Iter      log prob        ||dx||      ||grad||       alpha      alpha0  # evals  Notes 
      65       4679.34   4.22992e-09       3214.79      0.1671      0.1671       89   
Optimization terminated normally: 
  Convergence detected: absolute parameter change was below tolerance
Initial log joint probability = -23.5879
    Iter      log prob        ||dx||      ||grad||       alpha      alpha0  # evals  Notes 
      72       7029.43   4.82404e-05       3042.51   1.396e-08       0.001      125  LS failed, Hessian reset 
      99       7029.52   1.25993e-07       2781.43      0.6944      0.6944      157   
    Iter      log prob        ||dx||      ||grad||       alpha      alpha0  # evals  Notes 
     108       7029.52   7.80347e-09       2992.96      0.1616      0.1616      168   
Optimization terminated normally: 
  Convergence detected: absolute parameter change was below tolerance
      30       11812.3   0.000163064       3396.55   5.901e-08       0.001       87  LS failed, Hessian reset 
      96       9582.47   7.17132e-09       2856.56      0.3519      0.3519      137   
Optimization terminated normally: 
  Convergence detected: absolute parameter change was below tolerance
      85       11813.3   5.68082e-09       3196.38      0.3492           1      150   
Optimization terminated normally: 
  Convergence detected: absolute parameter change was below tolerance
      99       14233.1   2.22596e-08       3102.51       0.322       0.322      135   
    Iter      log prob        ||dx||      ||grad||       alpha      alpha0  # evals  Notes 
     105       14233.1   9.37963e-09       2837.49      0.4916      0.4916      142   
Optimization terminated normally: 
  Convergence detected: absolute parameter change was below tolerance
[I 2020-10-01 02:52:51,248] Trial 158 finished with value: 0.04081837382861675 and parameters: {'changepoint_prior_scale': 0.0015545129512494647, 'seasonality_prior_scale': 0.2359885072836542, 'holidays_prior_scale': 0.1543200438039705, 'seasonality_mode': 'additive', 'changepoint_range': 0.5613426714729557}. Best is trial 96 with value: 0.038883738900888705.
Initial log joint probability = -28.8311
    Iter      log prob        ||dx||      ||grad||       alpha      alpha0  # evals  Notes 
      99       18912.6   6.50992e-08       2717.52      0.2977       0.712      126   
    Iter      log prob        ||dx||      ||grad||       alpha      alpha0  # evals  Notes 
     110       18912.6   6.25639e-08       2865.03           1           1      139   
Optimization terminated normally: 
  Convergence detected: relative gradient magnitude is below tolerance
INFO:fbprophet:Making 5 forecasts with cutoffs between 2013-10-07 00:00:00 and 2015-10-18 00:00:00
INFO:fbprophet:Applying in parallel with <concurrent.futures.process.ProcessPoolExecutor object at 0x7fc88e67fe50>
Initial log joint probability = -8.95172
    Iter      log prob        ||dx||      ||grad||       alpha      alpha0  # evals  Notes 
Initial log joint probability = -12.7302
    Iter      log prob        ||dx||      ||grad||       alpha      alpha0  # evals  Notes 
Initial log joint probability = -15.1549
    Iter      log prob        ||dx||      ||grad||       alpha      alpha0  # evals  Notes 
Initial log joint probability = -18.717
    Iter      log prob        ||dx||      ||grad||       alpha      alpha0  # evals  Notes 
Initial log joint probability = -23.5879
    Iter      log prob        ||dx||      ||grad||       alpha      alpha0  # evals  Notes 
      87        4679.3   4.10076e-07       3213.42   1.383e-10       0.001      146  LS failed, Hessian reset 
      99        4679.3   1.72581e-08       2991.78      0.6111     0.06111      164   
    Iter      log prob        ||dx||      ||grad||       alpha      alpha0  # evals  Notes 
     110        4679.3   7.82584e-09       3008.56      0.3648           1      179   
Optimization terminated normally: 
  Convergence detected: absolute parameter change was below tolerance
      99        7029.6   8.87982e-06        2782.8       2.584      0.5501      130   
    Iter      log prob        ||dx||      ||grad||       alpha      alpha0  # evals  Notes 
      69       9582.52   1.60154e-08       2959.77      0.4735           1       92   
Optimization terminated normally: 
  Convergence detected: relative gradient magnitude is below tolerance
     199       7032.11   6.41222e-08       3106.01      0.5828      0.5828      256   
    Iter      log prob        ||dx||      ||grad||       alpha      alpha0  # evals  Notes 
     207       7032.11   7.73857e-09       2806.43        0.34           1      267   
Optimization terminated normally: 
  Convergence detected: absolute parameter change was below tolerance
      40       11812.2    0.00020447       2707.03   5.522e-08       0.001      110  LS failed, Hessian reset 
      99         14233   3.19719e-08       2537.42       0.248       0.248      138   
    Iter      log prob        ||dx||      ||grad||       alpha      alpha0  # evals  Notes 
     102         14233   7.70675e-09        2892.5      0.2759      0.2759      143   
Optimization terminated normally: 
  Convergence detected: absolute parameter change was below tolerance
      98       11813.2   7.87301e-09       3045.75      0.7759      0.7759      183   
Optimization terminated normally: 
  Convergence detected: absolute parameter change was below tolerance
[I 2020-10-01 02:53:05,519] Trial 159 finished with value: 0.041623360033563525 and parameters: {'changepoint_prior_scale': 0.0015836854847985087, 'seasonality_prior_scale': 0.31051235586455034, 'holidays_prior_scale': 0.10592233479255615, 'seasonality_mode': 'additive', 'changepoint_range': 0.5624848135577503}. Best is trial 96 with value: 0.038883738900888705.
Initial log joint probability = -28.8311
    Iter      log prob        ||dx||      ||grad||       alpha      alpha0  # evals  Notes 
      81       18912.9   2.73077e-08       2174.44      0.9016      0.9016      104   
Optimization terminated normally: 
  Convergence detected: relative gradient magnitude is below tolerance
INFO:fbprophet:Making 5 forecasts with cutoffs between 2013-10-07 00:00:00 and 2015-10-18 00:00:00
INFO:fbprophet:Applying in parallel with <concurrent.futures.process.ProcessPoolExecutor object at 0x7fc84dc4ded0>
Initial log joint probability = -8.95172
    Iter      log prob        ||dx||      ||grad||       alpha      alpha0  # evals  Notes 
Initial log joint probability = -12.7302
    Iter      log prob        ||dx||      ||grad||       alpha      alpha0  # evals  Notes 
Initial log joint probability = -15.1549
    Iter      log prob        ||dx||      ||grad||       alpha      alpha0  # evals  Notes 
Initial log joint probability = -18.717
    Iter      log prob        ||dx||      ||grad||       alpha      alpha0  # evals  Notes 
      54       4679.45   3.15152e-09       2426.08      0.1853      0.1853       77   
Optimization terminated normally: 
  Convergence detected: absolute parameter change was below tolerance
Initial log joint probability = -23.5879
    Iter      log prob        ||dx||      ||grad||       alpha      alpha0  # evals  Notes 
      99       7031.38   0.000594886       2292.66           1           1      117   
    Iter      log prob        ||dx||      ||grad||       alpha      alpha0  # evals  Notes 
      81       9582.52   1.28128e-05       2176.95   4.829e-09       0.001      148  LS failed, Hessian reset 
     190       7031.85   9.32593e-09       2299.46      0.6033      0.6033      227   
Optimization terminated normally: 
  Convergence detected: absolute parameter change was below tolerance
      99       9582.54     4.443e-07       2230.17      0.7484      0.7484      172   
    Iter      log prob        ||dx||      ||grad||       alpha      alpha0  # evals  Notes 
     109       9582.54   8.34945e-09       2186.72      0.3856      0.3856      185   
Optimization terminated normally: 
  Convergence detected: absolute parameter change was below tolerance
      99       14233.1   3.65553e-06       2029.83           1           1      130   
    Iter      log prob        ||dx||      ||grad||       alpha      alpha0  # evals  Notes 
      98         11813   6.95799e-06       2244.77       3e-09       0.001      173  LS failed, Hessian reset 
      99       11813.1   4.48843e-06       2542.34           1           1      174   
    Iter      log prob        ||dx||      ||grad||       alpha      alpha0  # evals  Notes 
     106       14233.2    2.6873e-05          2649   1.262e-08       0.001      174  LS failed, Hessian reset 
     144       14233.2   1.22277e-08        2318.6      0.2867      0.2867      223   
Optimization terminated normally: 
  Convergence detected: relative gradient magnitude is below tolerance
     134       11813.1   1.10029e-07       2528.73   4.597e-11       0.001      252  LS failed, Hessian reset 
     141       11813.1    1.4854e-08       2044.44       0.539       0.539      259   
Optimization terminated normally: 
  Convergence detected: relative gradient magnitude is below tolerance
[I 2020-10-01 02:53:21,459] Trial 160 finished with value: 0.041818120271134636 and parameters: {'changepoint_prior_scale': 0.002024050066774196, 'seasonality_prior_scale': 0.24478798041120978, 'holidays_prior_scale': 0.36715824552171783, 'seasonality_mode': 'additive', 'changepoint_range': 0.508802514134318}. Best is trial 96 with value: 0.038883738900888705.
Initial log joint probability = -28.8311
    Iter      log prob        ||dx||      ||grad||       alpha      alpha0  # evals  Notes 
      99       18912.5   3.20033e-06       3517.13           1           1      129   
    Iter      log prob        ||dx||      ||grad||       alpha      alpha0  # evals  Notes 
     144       18912.6   5.37707e-06       3834.71    1.33e-09       0.001      225  LS failed, Hessian reset 
     169       18912.6   9.91048e-09       3396.83      0.4314      0.9981      257   
Optimization terminated normally: 
  Convergence detected: absolute parameter change was below tolerance
INFO:fbprophet:Making 5 forecasts with cutoffs between 2013-10-07 00:00:00 and 2015-10-18 00:00:00
INFO:fbprophet:Applying in parallel with <concurrent.futures.process.ProcessPoolExecutor object at 0x7fc88e65e0d0>
Initial log joint probability = -8.95172
    Iter      log prob        ||dx||      ||grad||       alpha      alpha0  # evals  Notes 
Initial log joint probability = -12.7302
    Iter      log prob        ||dx||      ||grad||       alpha      alpha0  # evals  Notes 
Initial log joint probability = -15.1549
    Iter      log prob        ||dx||      ||grad||       alpha      alpha0  # evals  Notes 
Initial log joint probability = -18.717
    Iter      log prob        ||dx||      ||grad||       alpha      alpha0  # evals  Notes 
Initial log joint probability = -23.5879
    Iter      log prob        ||dx||      ||grad||       alpha      alpha0  # evals  Notes 
      76        4678.9   9.75769e-09       3951.53      0.5316      0.5316      106   
Optimization terminated normally: 
  Convergence detected: absolute parameter change was below tolerance
      58       9582.37   9.31606e-09       3771.66      0.6216      0.6216       86   
Optimization terminated normally: 
  Convergence detected: absolute parameter change was below tolerance
      98       7029.07   3.01605e-05       3937.46   8.377e-09       0.001      159  LS failed, Hessian reset 
      99        7029.1   1.50716e-05       3444.67           1           1      160   
    Iter      log prob        ||dx||      ||grad||       alpha      alpha0  # evals  Notes 
      38         11811   0.000224102       4204.67   7.878e-08       0.001      106  LS failed, Hessian reset 
     156       7029.18   7.90039e-09       3655.75      0.2443      0.2443      233   
Optimization terminated normally: 
  Convergence detected: absolute parameter change was below tolerance
      99       14231.3   7.53088e-08       3822.64           1           1      134   
    Iter      log prob        ||dx||      ||grad||       alpha      alpha0  # evals  Notes 
      86       11812.5   3.77487e-06       3821.15   9.977e-10       0.001      202  LS failed, Hessian reset 
     103       14231.3   1.04492e-08       3183.58      0.3929      0.9995      139   
Optimization terminated normally: 
  Convergence detected: relative gradient magnitude is below tolerance
      99       11812.5   5.59067e-08       3617.13      0.2053           1      220   
    Iter      log prob        ||dx||      ||grad||       alpha      alpha0  # evals  Notes 
     110       11812.5   6.96279e-09       3500.04      0.4843      0.4843      233   
Optimization terminated normally: 
  Convergence detected: absolute parameter change was below tolerance
[I 2020-10-01 02:53:35,518] Trial 161 finished with value: 0.040661475544338965 and parameters: {'changepoint_prior_scale': 0.001308285992839689, 'seasonality_prior_scale': 0.21059445822605602, 'holidays_prior_scale': 0.2401108587008249, 'seasonality_mode': 'additive', 'changepoint_range': 0.5558013347680871}. Best is trial 96 with value: 0.038883738900888705.
Initial log joint probability = -28.8311
    Iter      log prob        ||dx||      ||grad||       alpha      alpha0  # evals  Notes 
      99       18912.6   5.22678e-07       3723.82     0.05741           1      127   
    Iter      log prob        ||dx||      ||grad||       alpha      alpha0  # evals  Notes 
     150       18912.6   9.93898e-09       3803.36      0.5523      0.5523      185   
Optimization terminated normally: 
  Convergence detected: absolute parameter change was below tolerance
INFO:fbprophet:Making 5 forecasts with cutoffs between 2013-10-07 00:00:00 and 2015-10-18 00:00:00
INFO:fbprophet:Applying in parallel with <concurrent.futures.process.ProcessPoolExecutor object at 0x7fc84dc67c90>
Initial log joint probability = -8.95172
    Iter      log prob        ||dx||      ||grad||       alpha      alpha0  # evals  Notes 
Initial log joint probability = -12.7302
    Iter      log prob        ||dx||      ||grad||       alpha      alpha0  # evals  Notes 
Initial log joint probability = -15.1549
    Iter      log prob        ||dx||      ||grad||       alpha      alpha0  # evals  Notes 
Initial log joint probability = -18.717
    Iter      log prob        ||dx||      ||grad||       alpha      alpha0  # evals  Notes 
Initial log joint probability = -23.5879
    Iter      log prob        ||dx||      ||grad||       alpha      alpha0  # evals  Notes 
      74        4678.3   0.000333505        4045.1   8.188e-08       0.001      141  LS failed, Hessian reset 
      99       4679.22   2.38037e-07       4042.38      0.4087      0.4087      176   
    Iter      log prob        ||dx||      ||grad||       alpha      alpha0  # evals  Notes 
     112       4679.22   8.10466e-09       4034.87      0.2789      0.2789      193   
Optimization terminated normally: 
  Convergence detected: absolute parameter change was below tolerance
      61       9582.46   4.17267e-09       3926.01      0.2251      0.2251       85   
Optimization terminated normally: 
  Convergence detected: absolute parameter change was below tolerance
      85       7028.54   1.81307e-05       3886.01   4.777e-09       0.001      149  LS failed, Hessian reset 
      99        7028.7   5.86534e-07       3564.23      0.1544      0.1544      166   
    Iter      log prob        ||dx||      ||grad||       alpha      alpha0  # evals  Notes 
      99       11813.2   9.46114e-07       4014.61      0.8565      0.8565      130   
    Iter      log prob        ||dx||      ||grad||       alpha      alpha0  # evals  Notes 
     151       7028.72   3.69795e-07       4310.55   8.977e-11       0.001      280  LS failed, Hessian reset 
     163       7028.72   5.11199e-09       3782.12       0.236       0.236      294   
Optimization terminated normally: 
  Convergence detected: absolute parameter change was below tolerance
     108       11813.2   7.65844e-09       3973.99     0.05001           1      143   
Optimization terminated normally: 
  Convergence detected: absolute parameter change was below tolerance
      99       14232.7    3.6998e-06       3797.78      0.2244           1      127   
    Iter      log prob        ||dx||      ||grad||       alpha      alpha0  # evals  Notes 
     123       14232.7   6.97084e-09       4268.71      0.5033      0.5033      158   
Optimization terminated normally: 
  Convergence detected: absolute parameter change was below tolerance
[I 2020-10-01 02:53:51,234] Trial 162 finished with value: 0.041295540661313974 and parameters: {'changepoint_prior_scale': 0.0012373421451151816, 'seasonality_prior_scale': 0.22431965133054196, 'holidays_prior_scale': 0.25407238972642626, 'seasonality_mode': 'additive', 'changepoint_range': 0.5443476412183212}. Best is trial 96 with value: 0.038883738900888705.
Initial log joint probability = -28.8311
    Iter      log prob        ||dx||      ||grad||       alpha      alpha0  # evals  Notes 
      99       18912.4   4.24396e-07       4371.92      0.7264      0.7264      124   
    Iter      log prob        ||dx||      ||grad||       alpha      alpha0  # evals  Notes 
     182       18912.8   5.37883e-09       3624.13       0.132       0.132      237   
Optimization terminated normally: 
  Convergence detected: absolute parameter change was below tolerance
INFO:fbprophet:Making 5 forecasts with cutoffs between 2013-10-07 00:00:00 and 2015-10-18 00:00:00
INFO:fbprophet:Applying in parallel with <concurrent.futures.process.ProcessPoolExecutor object at 0x7fc88e683250>
Initial log joint probability = -8.95172
    Iter      log prob        ||dx||      ||grad||       alpha      alpha0  # evals  Notes 
Initial log joint probability = -12.7302
    Iter      log prob        ||dx||      ||grad||       alpha      alpha0  # evals  Notes 
Initial log joint probability = -15.1549
    Iter      log prob        ||dx||      ||grad||       alpha      alpha0  # evals  Notes 
Initial log joint probability = -18.717
    Iter      log prob        ||dx||      ||grad||       alpha      alpha0  # evals  Notes 
Initial log joint probability = -23.5879
    Iter      log prob        ||dx||      ||grad||       alpha      alpha0  # evals  Notes 
      79       4679.07   6.50594e-09       4470.86      0.3643      0.3643      109   
Optimization terminated normally: 
  Convergence detected: absolute parameter change was below tolerance
      67       7027.59   3.30648e-05       3984.43   7.408e-09       0.001      124  LS failed, Hessian reset 
      66       9582.34   6.94097e-09       4371.36      0.1205      0.1205       95   
Optimization terminated normally: 
  Convergence detected: absolute parameter change was below tolerance
      99       7028.03   2.15204e-07       3272.32       0.645       0.645      166   
    Iter      log prob        ||dx||      ||grad||       alpha      alpha0  # evals  Notes 
      58       11813.1   1.72413e-09       4669.59      0.1547      0.1547       86   
Optimization terminated normally: 
  Convergence detected: absolute parameter change was below tolerance
     146       7028.04   8.14031e-09       4080.23      0.4219      0.4219      226   
Optimization terminated normally: 
  Convergence detected: absolute parameter change was below tolerance
      99       14233.1   1.82581e-06       4212.23      0.7569      0.7569      121   
    Iter      log prob        ||dx||      ||grad||       alpha      alpha0  # evals  Notes 
     119       14233.1   6.08926e-09       4390.54      0.6064      0.6064      147   
Optimization terminated normally: 
  Convergence detected: absolute parameter change was below tolerance
