[I 2020-10-01 03:37:20,337] Trial 333 finished with value: 0.041511018092562385 and parameters: {'changepoint_prior_scale': 0.0018596884718899537, 'seasonality_prior_scale': 0.26115893915737265, 'holidays_prior_scale': 0.1230312669232972, 'seasonality_mode': 'additive', 'changepoint_range': 0.5685022052890071}. Best is trial 96 with value: 0.038883738900888705.
Initial log joint probability = -28.8311
    Iter      log prob        ||dx||      ||grad||       alpha      alpha0  # evals  Notes 
      91       18912.4   1.06327e-05       3081.62   3.665e-09       0.001      167  LS failed, Hessian reset 
      99       18912.5   4.35603e-06       2348.66       1.348      0.4137      179   
    Iter      log prob        ||dx||      ||grad||       alpha      alpha0  # evals  Notes 
     119       18912.5   7.36544e-09       2687.36      0.1647      0.1647      205   
Optimization terminated normally: 
  Convergence detected: absolute parameter change was below tolerance
INFO:fbprophet:Making 5 forecasts with cutoffs between 2013-10-07 00:00:00 and 2015-10-18 00:00:00
INFO:fbprophet:Applying in parallel with <concurrent.futures.process.ProcessPoolExecutor object at 0x7fc84dbe87d0>
Initial log joint probability = -8.95172
    Iter      log prob        ||dx||      ||grad||       alpha      alpha0  # evals  Notes 
Initial log joint probability = -12.7302
    Iter      log prob        ||dx||      ||grad||       alpha      alpha0  # evals  Notes 
Initial log joint probability = -15.1549
    Iter      log prob        ||dx||      ||grad||       alpha      alpha0  # evals  Notes 
Initial log joint probability = -18.717
    Iter      log prob        ||dx||      ||grad||       alpha      alpha0  # evals  Notes 
Initial log joint probability = -23.5879
    Iter      log prob        ||dx||      ||grad||       alpha      alpha0  # evals  Notes 
      59       4678.62   7.54723e-05       3100.62   2.453e-08       0.001      137  LS failed, Hessian reset 
      99        4679.4   1.72326e-07       3061.38           1           1      187   
    Iter      log prob        ||dx||      ||grad||       alpha      alpha0  # evals  Notes 
     108        4679.4   3.73767e-09       3050.79      0.1305      0.1305      198   
Optimization terminated normally: 
  Convergence detected: absolute parameter change was below tolerance
      99        7029.8   1.43409e-05       2996.23           1           1      124   
    Iter      log prob        ||dx||      ||grad||       alpha      alpha0  # evals  Notes 
      68        9582.5   7.73947e-09       2466.44      0.2661           1       93   
Optimization terminated normally: 
  Convergence detected: absolute parameter change was below tolerance
      51       11813.2   9.76433e-09       2997.59      0.2662      0.2662       76   
Optimization terminated normally: 
  Convergence detected: absolute parameter change was below tolerance
     199       7031.62   7.65171e-06       3073.39      0.3355      0.3355      244   
    Iter      log prob        ||dx||      ||grad||       alpha      alpha0  # evals  Notes 
     223       7031.63   9.53644e-09       3081.79      0.2807      0.8106      275   
Optimization terminated normally: 
  Convergence detected: absolute parameter change was below tolerance
      99       14232.6   4.79037e-06        3122.4           1           1      131   
    Iter      log prob        ||dx||      ||grad||       alpha      alpha0  # evals  Notes 
     199       14232.9   7.59692e-08       2251.84           1           1      250   
    Iter      log prob        ||dx||      ||grad||       alpha      alpha0  # evals  Notes 
     210       14232.9   2.61617e-08       2155.22      0.3849           1      264   
Optimization terminated normally: 
  Convergence detected: relative gradient magnitude is below tolerance
[I 2020-10-01 03:37:35,731] Trial 334 finished with value: 0.041797490431195655 and parameters: {'changepoint_prior_scale': 0.0016310604382682229, 'seasonality_prior_scale': 0.12124182051358269, 'holidays_prior_scale': 0.1530554242120954, 'seasonality_mode': 'additive', 'changepoint_range': 0.5317649752055281}. Best is trial 96 with value: 0.038883738900888705.
Initial log joint probability = -28.8311
    Iter      log prob        ||dx||      ||grad||       alpha      alpha0  # evals  Notes 
      99       18912.7   2.66239e-06       4243.12      0.4598      0.4598      121   
    Iter      log prob        ||dx||      ||grad||       alpha      alpha0  # evals  Notes 
     134       18912.7   2.37724e-07        3941.9    5.18e-11       0.001      209  LS failed, Hessian reset 
     143       18912.7   2.45771e-08       3730.18      0.4838      0.1266      222   
Optimization terminated normally: 
  Convergence detected: relative gradient magnitude is below tolerance
INFO:fbprophet:Making 5 forecasts with cutoffs between 2013-10-07 00:00:00 and 2015-10-18 00:00:00
INFO:fbprophet:Applying in parallel with <concurrent.futures.process.ProcessPoolExecutor object at 0x7fc84dca9f90>
Initial log joint probability = -8.95172
    Iter      log prob        ||dx||      ||grad||       alpha      alpha0  # evals  Notes 
Initial log joint probability = -12.7302
    Iter      log prob        ||dx||      ||grad||       alpha      alpha0  # evals  Notes 
Initial log joint probability = -15.1549
    Iter      log prob        ||dx||      ||grad||       alpha      alpha0  # evals  Notes 
Initial log joint probability = -18.717
    Iter      log prob        ||dx||      ||grad||       alpha      alpha0  # evals  Notes 
      61       4679.01   9.54186e-09       4241.95       0.682       0.682       85   
Optimization terminated normally: 
  Convergence detected: absolute parameter change was below tolerance
Initial log joint probability = -23.5879
    Iter      log prob        ||dx||      ||grad||       alpha      alpha0  # evals  Notes 
      82        7028.6   3.23794e-05       3893.81   7.928e-09       0.001      146  LS failed, Hessian reset 
      99       7028.69   1.60039e-06       3784.74      0.7121      0.7121      166   
    Iter      log prob        ||dx||      ||grad||       alpha      alpha0  # evals  Notes 
      58       9582.37   1.73151e-07       4029.16   4.327e-11       0.001      118  LS failed, Hessian reset 
     117        7028.7    6.8479e-09       3894.78      0.3779      0.3779      188   
Optimization terminated normally: 
  Convergence detected: absolute parameter change was below tolerance
      64       9582.37   4.07738e-09       3656.54       0.118       0.118      126   
Optimization terminated normally: 
  Convergence detected: absolute parameter change was below tolerance
      60       11813.1   1.65343e-08       3903.08      0.9179      0.9179       86   
Optimization terminated normally: 
  Convergence detected: relative gradient magnitude is below tolerance
      99       14232.5   2.63679e-06       3321.47      0.8901      0.8901      134   
    Iter      log prob        ||dx||      ||grad||       alpha      alpha0  # evals  Notes 
     103       14232.5   1.15944e-06       3456.39   2.821e-10       0.001      179  LS failed, Hessian reset 
     125       14232.6   7.38396e-09       3842.17      0.1649       0.481      208   
Optimization terminated normally: 
  Convergence detected: absolute parameter change was below tolerance
[I 2020-10-01 03:37:51,379] Trial 335 finished with value: 0.040855745575542016 and parameters: {'changepoint_prior_scale': 0.0012279848513767687, 'seasonality_prior_scale': 0.15254700380265468, 'holidays_prior_scale': 0.0847311866803138, 'seasonality_mode': 'additive', 'changepoint_range': 0.5904300436889124}. Best is trial 96 with value: 0.038883738900888705.
Initial log joint probability = -28.8311
    Iter      log prob        ||dx||      ||grad||       alpha      alpha0  # evals  Notes 
      99       18912.1   1.53118e-05        4287.9      0.2333           1      126   
    Iter      log prob        ||dx||      ||grad||       alpha      alpha0  # evals  Notes 
     164       18912.7   1.88485e-08       4302.97      0.3398      0.8278      199   
Optimization terminated normally: 
  Convergence detected: relative gradient magnitude is below tolerance
INFO:fbprophet:Making 5 forecasts with cutoffs between 2013-10-07 00:00:00 and 2015-10-18 00:00:00
INFO:fbprophet:Applying in parallel with <concurrent.futures.process.ProcessPoolExecutor object at 0x7fc84dc0acd0>
Initial log joint probability = -8.95172
    Iter      log prob        ||dx||      ||grad||       alpha      alpha0  # evals  Notes 
Initial log joint probability = -12.7302
    Iter      log prob        ||dx||      ||grad||       alpha      alpha0  # evals  Notes 
Initial log joint probability = -15.1549
    Iter      log prob        ||dx||      ||grad||       alpha      alpha0  # evals  Notes 
Initial log joint probability = -18.717
    Iter      log prob        ||dx||      ||grad||       alpha      alpha0  # evals  Notes 
Initial log joint probability = -23.5879
    Iter      log prob        ||dx||      ||grad||       alpha      alpha0  # evals  Notes 
      44       4679.01   1.53798e-05       4676.77   3.382e-09       0.001      105  LS failed, Hessian reset 
      87       4679.14   5.63821e-09       4516.56      0.2501           1      164   
Optimization terminated normally: 
  Convergence detected: absolute parameter change was below tolerance
      94       7028.27   5.30301e-09       4186.14      0.5137      0.5137      117   
Optimization terminated normally: 
  Convergence detected: absolute parameter change was below tolerance
      40       11811.3   0.000111155       4170.27   2.965e-08       0.001      107  LS failed, Hessian reset 
      96       14233.4   5.84686e-09       4356.69      0.2736      0.2736      130   
Optimization terminated normally: 
  Convergence detected: absolute parameter change was below tolerance
      96       11813.1   7.28741e-09       4553.87      0.4103      0.4103      182   
Optimization terminated normally: 
  Convergence detected: absolute parameter change was below tolerance
      86        9582.1   2.34497e-05       4329.07   4.883e-09       0.001      162  LS failed, Hessian reset 
      99       9582.16   5.93469e-07       4455.66      0.9604      0.9604      176   
    Iter      log prob        ||dx||      ||grad||       alpha      alpha0  # evals  Notes 
     115       9582.16   3.53732e-09       4515.16      0.1484      0.1484      197   
Optimization terminated normally: 
  Convergence detected: absolute parameter change was below tolerance
[I 2020-10-01 03:38:07,572] Trial 336 finished with value: 0.04138728797393065 and parameters: {'changepoint_prior_scale': 0.001093810596557183, 'seasonality_prior_scale': 0.09059729872397511, 'holidays_prior_scale': 0.23128398340346898, 'seasonality_mode': 'additive', 'changepoint_range': 0.5178982410781634}. Best is trial 96 with value: 0.038883738900888705.
Initial log joint probability = -28.8311
    Iter      log prob        ||dx||      ||grad||       alpha      alpha0  # evals  Notes 
      84       18911.2    5.7475e-06       4932.81    1.15e-09       0.001      142  LS failed, Hessian reset 
      99       18911.2   2.11586e-07       4260.03           1           1      161   
    Iter      log prob        ||dx||      ||grad||       alpha      alpha0  # evals  Notes 
     124       18911.3   2.91414e-06       4497.23    5.52e-10       0.001      237  LS failed, Hessian reset 
     150       18911.3   1.54683e-08       3255.75           1           1      267   
Optimization terminated normally: 
  Convergence detected: relative gradient magnitude is below tolerance
INFO:fbprophet:Making 5 forecasts with cutoffs between 2013-10-07 00:00:00 and 2015-10-18 00:00:00
INFO:fbprophet:Applying in parallel with <concurrent.futures.process.ProcessPoolExecutor object at 0x7fc84dbfd390>
Initial log joint probability = -8.95172
    Iter      log prob        ||dx||      ||grad||       alpha      alpha0  # evals  Notes 
Initial log joint probability = -12.7302
    Iter      log prob        ||dx||      ||grad||       alpha      alpha0  # evals  Notes 
Initial log joint probability = -15.1549
    Iter      log prob        ||dx||      ||grad||       alpha      alpha0  # evals  Notes 
Initial log joint probability = -18.717
    Iter      log prob        ||dx||      ||grad||       alpha      alpha0  # evals  Notes 
      67       4678.98    2.1758e-09       4875.23      0.4647      0.4647       88   
Optimization terminated normally: 
  Convergence detected: absolute parameter change was below tolerance
Initial log joint probability = -23.5879
    Iter      log prob        ||dx||      ||grad||       alpha      alpha0  # evals  Notes 
      82       7027.62   3.16368e-05       4832.75   6.201e-09       0.001      158  LS failed, Hessian reset 
      99       7027.81   1.42424e-06       4416.37      0.2257           1      178   
    Iter      log prob        ||dx||      ||grad||       alpha      alpha0  # evals  Notes 
      74       9582.28   3.78285e-06       4791.42   7.733e-10       0.001      139  LS failed, Hessian reset 
      50       11812.9    1.3485e-06       4825.34   2.692e-10       0.001      113  LS failed, Hessian reset 
      99        9582.3   7.18588e-09       4977.09       0.675       0.675      171   
Optimization terminated normally: 
  Convergence detected: absolute parameter change was below tolerance
     150       7027.82    1.5518e-07       4698.27   2.993e-11       0.001      293  LS failed, Hessian reset 
      72       11812.9   5.78326e-09       4982.32      0.1734      0.1734      143   
Optimization terminated normally: 
  Convergence detected: absolute parameter change was below tolerance
     159       7027.82   7.07757e-09       4884.15      0.1655      0.5643      306   
Optimization terminated normally: 
  Convergence detected: absolute parameter change was below tolerance
      99       14231.1    1.0159e-07       4892.27      0.4252      0.4252      138   
    Iter      log prob        ||dx||      ||grad||       alpha      alpha0  # evals  Notes 
     110       14231.1   9.75165e-09       4867.79      0.1925           1      152   
Optimization terminated normally: 
  Convergence detected: absolute parameter change was below tolerance
[I 2020-10-01 03:38:24,004] Trial 337 finished with value: 0.04084723054151213 and parameters: {'changepoint_prior_scale': 0.001000797652950046, 'seasonality_prior_scale': 0.18028347732243005, 'holidays_prior_scale': 0.09694787786921691, 'seasonality_mode': 'additive', 'changepoint_range': 0.5438881163442427}. Best is trial 96 with value: 0.038883738900888705.
Initial log joint probability = -28.8311
    Iter      log prob        ||dx||      ||grad||       alpha      alpha0  # evals  Notes 
      99         18913   5.11577e-07       3318.77       3.049      0.3049      124   
    Iter      log prob        ||dx||      ||grad||       alpha      alpha0  # evals  Notes 
     119         18913   3.65476e-07       3391.58   1.107e-10       0.001      181  LS failed, Hessian reset 
     129         18913   2.18036e-08       3248.03      0.9076      0.9076      191   
Optimization terminated normally: 
  Convergence detected: relative gradient magnitude is below tolerance
INFO:fbprophet:Making 5 forecasts with cutoffs between 2013-10-07 00:00:00 and 2015-10-18 00:00:00
INFO:fbprophet:Applying in parallel with <concurrent.futures.process.ProcessPoolExecutor object at 0x7fc84dc0a9d0>
Initial log joint probability = -8.95172
    Iter      log prob        ||dx||      ||grad||       alpha      alpha0  # evals  Notes 
Initial log joint probability = -12.7302
    Iter      log prob        ||dx||      ||grad||       alpha      alpha0  # evals  Notes 
Initial log joint probability = -15.1549
    Iter      log prob        ||dx||      ||grad||       alpha      alpha0  # evals  Notes 
Initial log joint probability = -18.717
    Iter      log prob        ||dx||      ||grad||       alpha      alpha0  # evals  Notes 
Initial log joint probability = -23.5879
    Iter      log prob        ||dx||      ||grad||       alpha      alpha0  # evals  Notes 
      68       4679.41   7.38548e-09       3433.77      0.2372      0.2372       98   
Optimization terminated normally: 
  Convergence detected: absolute parameter change was below tolerance
      99       7029.39   1.55298e-07       3258.25           1           1      125   
    Iter      log prob        ||dx||      ||grad||       alpha      alpha0  # evals  Notes 
     109       7029.39   3.34396e-09        3364.4      0.1879      0.1879      137   
Optimization terminated normally: 
  Convergence detected: absolute parameter change was below tolerance
      67       9582.53   9.36835e-09       2870.63      0.2085      0.2085      100   
Optimization terminated normally: 
  Convergence detected: absolute parameter change was below tolerance
      50       11813.3   3.07277e-09       3141.59      0.2598      0.2598       69   
Optimization terminated normally: 
  Convergence detected: absolute parameter change was below tolerance
      91         14233   2.92561e-05       3424.78   7.366e-09       0.001      174  LS failed, Hessian reset 
      99         14233   1.74988e-06       3045.58      0.3085           1      184   
    Iter      log prob        ||dx||      ||grad||       alpha      alpha0  # evals  Notes 
     135         14233   1.60222e-07       3181.68   4.485e-11       0.001      283  LS failed, Hessian reset 
     143         14233   7.83134e-09       2469.16      0.2895      0.2895      293   
Optimization terminated normally: 
  Convergence detected: absolute parameter change was below tolerance
[I 2020-10-01 03:38:40,293] Trial 338 finished with value: 0.04099904338319106 and parameters: {'changepoint_prior_scale': 0.0014605824231390591, 'seasonality_prior_scale': 0.304589758608381, 'holidays_prior_scale': 0.18816556710178176, 'seasonality_mode': 'additive', 'changepoint_range': 0.5561976573240415}. Best is trial 96 with value: 0.038883738900888705.
Initial log joint probability = -28.8311
    Iter      log prob        ||dx||      ||grad||       alpha      alpha0  # evals  Notes 
      99       18912.8   3.90134e-05       4096.64       0.739       0.739      115   
    Iter      log prob        ||dx||      ||grad||       alpha      alpha0  # evals  Notes 
     128       18912.8   1.55964e-07       4151.71      0.2727           1      156   
Optimization terminated normally: 
  Convergence detected: relative gradient magnitude is below tolerance
INFO:fbprophet:Making 5 forecasts with cutoffs between 2013-10-07 00:00:00 and 2015-10-18 00:00:00
INFO:fbprophet:Applying in parallel with <concurrent.futures.process.ProcessPoolExecutor object at 0x7fc84dbf3e10>
Initial log joint probability = -8.95172
    Iter      log prob        ||dx||      ||grad||       alpha      alpha0  # evals  Notes 
Initial log joint probability = -12.7302
    Iter      log prob        ||dx||      ||grad||       alpha      alpha0  # evals  Notes 
Initial log joint probability = -15.1549
    Iter      log prob        ||dx||      ||grad||       alpha      alpha0  # evals  Notes 
Initial log joint probability = -18.717
    Iter      log prob        ||dx||      ||grad||       alpha      alpha0  # evals  Notes 
      68       4678.54   9.87321e-09       4139.59      0.3538      0.3538       90   
Optimization terminated normally: 
  Convergence detected: absolute parameter change was below tolerance
Initial log joint probability = -23.5879
    Iter      log prob        ||dx||      ||grad||       alpha      alpha0  # evals  Notes 
      74       7028.39   5.20736e-05       3630.52    1.22e-08       0.001      125  LS failed, Hessian reset 
      99       7028.54   2.38706e-06       4029.27           1           1      157   
    Iter      log prob        ||dx||      ||grad||       alpha      alpha0  # evals  Notes 
      50       11812.9   3.63087e-09       4092.09        0.24        0.24       75   
Optimization terminated normally: 
  Convergence detected: absolute parameter change was below tolerance
      65       9582.45   5.70777e-07       4067.56   1.363e-10       0.001      124  LS failed, Hessian reset 
     137       7028.56    7.6886e-09       3453.48     0.01055           1      208   
Optimization terminated normally: 
  Convergence detected: absolute parameter change was below tolerance
      78       9582.46   3.58418e-09       3866.44      0.2985      0.2985      142   
Optimization terminated normally: 
  Convergence detected: absolute parameter change was below tolerance
      99       14232.5   0.000839889       4068.14           1           1      126   
    Iter      log prob        ||dx||      ||grad||       alpha      alpha0  # evals  Notes 
     135       14232.7   1.51313e-08       3858.49           1           1      175   
Optimization terminated normally: 
  Convergence detected: relative gradient magnitude is below tolerance
