[I 2020-10-01 04:07:16,462] Trial 451 finished with value: 0.04117556042500722 and parameters: {'changepoint_prior_scale': 0.0011282476481854244, 'seasonality_prior_scale': 0.1620563118828634, 'holidays_prior_scale': 0.08935943252310136, 'seasonality_mode': 'additive', 'changepoint_range': 0.5315038007205574}. Best is trial 96 with value: 0.038883738900888705.
Initial log joint probability = -28.8311
    Iter      log prob        ||dx||      ||grad||       alpha      alpha0  # evals  Notes 
      95       18915.3   6.50818e-05       236.568   2.854e-07       0.001      199  LS failed, Hessian reset 
      99       18915.3   1.23932e-05       173.855      0.9359      0.9359      203   
    Iter      log prob        ||dx||      ||grad||       alpha      alpha0  # evals  Notes 
     132       18915.4   6.27309e-07        162.54      0.3491      0.3491      250   
Optimization terminated normally: 
  Convergence detected: relative gradient magnitude is below tolerance
INFO:fbprophet:Making 5 forecasts with cutoffs between 2013-10-07 00:00:00 and 2015-10-18 00:00:00
INFO:fbprophet:Applying in parallel with <concurrent.futures.process.ProcessPoolExecutor object at 0x7fc84dca9d50>
Initial log joint probability = -8.95172
    Iter      log prob        ||dx||      ||grad||       alpha      alpha0  # evals  Notes 
Initial log joint probability = -12.7302
    Iter      log prob        ||dx||      ||grad||       alpha      alpha0  # evals  Notes 
Initial log joint probability = -15.1549
    Iter      log prob        ||dx||      ||grad||       alpha      alpha0  # evals  Notes 
Initial log joint probability = -18.717
    Iter      log prob        ||dx||      ||grad||       alpha      alpha0  # evals  Notes 
      67       4679.44   4.79523e-08       247.423      0.3851           1       89   
Optimization terminated normally: 
  Convergence detected: relative gradient magnitude is below tolerance
Initial log joint probability = -23.5879
    Iter      log prob        ||dx||      ||grad||       alpha      alpha0  # evals  Notes 
      70       7034.95   0.000205589       238.647   1.004e-06       0.001      124  LS failed, Hessian reset 
      99       7035.01   3.05821e-06       177.651           1           1      159   
    Iter      log prob        ||dx||      ||grad||       alpha      alpha0  # evals  Notes 
     107       7035.01   2.07018e-06        178.56   1.352e-08       0.001      202  LS failed, Hessian reset 
      99       9583.33   0.000105414        140.82           1           1      137   
    Iter      log prob        ||dx||      ||grad||       alpha      alpha0  # evals  Notes 
      65       11813.4   1.35955e-07       174.326      0.2677           1      100   
Optimization terminated normally: 
  Convergence detected: relative gradient magnitude is below tolerance
     125       7035.01   1.28413e-07        154.03      0.7872     0.07872      229   
Optimization terminated normally: 
  Convergence detected: relative gradient magnitude is below tolerance
      99       14235.7   8.80298e-07       152.919      0.8711      0.8711      136   
    Iter      log prob        ||dx||      ||grad||       alpha      alpha0  # evals  Notes 
     103       14235.7   6.34827e-07       155.116           1           1      141   
Optimization terminated normally: 
  Convergence detected: relative gradient magnitude is below tolerance
     168       9583.35    6.8917e-06       176.657   5.093e-08       0.001      268  LS failed, Hessian reset 
     181       9583.35    4.2045e-07        151.72      0.2547           1      290   
Optimization terminated normally: 
  Convergence detected: relative gradient magnitude is below tolerance
[I 2020-10-01 04:07:30,893] Trial 452 finished with value: 0.041217781548165584 and parameters: {'changepoint_prior_scale': 0.017997130989040593, 'seasonality_prior_scale': 0.1822695378024653, 'holidays_prior_scale': 0.13823606447698866, 'seasonality_mode': 'additive', 'changepoint_range': 0.5197604448125296}. Best is trial 96 with value: 0.038883738900888705.
Initial log joint probability = -28.8311
    Iter      log prob        ||dx||      ||grad||       alpha      alpha0  # evals  Notes 
      99       18911.7   5.93409e-06       4148.85           1           1      122   
    Iter      log prob        ||dx||      ||grad||       alpha      alpha0  # evals  Notes 
     199       18912.9   2.29212e-07       4135.57      0.6827      0.6827      247   
    Iter      log prob        ||dx||      ||grad||       alpha      alpha0  # evals  Notes 
     206       18912.9   9.05815e-09       3956.61      0.3843      0.3843      257   
Optimization terminated normally: 
  Convergence detected: absolute parameter change was below tolerance
INFO:fbprophet:Making 5 forecasts with cutoffs between 2013-10-07 00:00:00 and 2015-10-18 00:00:00
INFO:fbprophet:Applying in parallel with <concurrent.futures.process.ProcessPoolExecutor object at 0x7fc84dcaa910>
Initial log joint probability = -8.95172
    Iter      log prob        ||dx||      ||grad||       alpha      alpha0  # evals  Notes 
Initial log joint probability = -12.7302
    Iter      log prob        ||dx||      ||grad||       alpha      alpha0  # evals  Notes 
Initial log joint probability = -15.1549
    Iter      log prob        ||dx||      ||grad||       alpha      alpha0  # evals  Notes 
Initial log joint probability = -18.717
    Iter      log prob        ||dx||      ||grad||       alpha      alpha0  # evals  Notes 
Initial log joint probability = -23.5879
    Iter      log prob        ||dx||      ||grad||       alpha      alpha0  # evals  Notes 
      87        4679.2   3.18681e-09       4378.95      0.1914      0.1914      117   
Optimization terminated normally: 
  Convergence detected: absolute parameter change was below tolerance
      69       7028.38    4.3622e-05       4456.08   9.314e-09       0.001      127  LS failed, Hessian reset 
      69       9582.41   7.46873e-09       4174.13      0.3963      0.3963       89   
Optimization terminated normally: 
  Convergence detected: absolute parameter change was below tolerance
      99       7028.48   2.50291e-08       4716.91      0.2658      0.2658      166   
    Iter      log prob        ||dx||      ||grad||       alpha      alpha0  # evals  Notes 
     105       7028.48   6.78358e-09       4538.52      0.4492      0.4492      174   
Optimization terminated normally: 
  Convergence detected: absolute parameter change was below tolerance
      29         11811   0.000390261       4434.89   8.756e-08       0.001       84  LS failed, Hessian reset 
      73       11812.6   2.77968e-09       4412.24     0.06439     0.06439      147   
Optimization terminated normally: 
  Convergence detected: absolute parameter change was below tolerance
      99         14233   5.71219e-08       4563.26      0.2888      0.2888      142   
    Iter      log prob        ||dx||      ||grad||       alpha      alpha0  # evals  Notes 
     109         14233   1.27542e-08       4490.52      0.3228      0.3228      153   
Optimization terminated normally: 
  Convergence detected: relative gradient magnitude is below tolerance
[I 2020-10-01 04:07:46,644] Trial 453 finished with value: 0.04119977540952033 and parameters: {'changepoint_prior_scale': 0.001130774477621732, 'seasonality_prior_scale': 0.22731386985086446, 'holidays_prior_scale': 0.10805831601270054, 'seasonality_mode': 'additive', 'changepoint_range': 0.5319656121095695}. Best is trial 96 with value: 0.038883738900888705.
Initial log joint probability = -28.8311
    Iter      log prob        ||dx||      ||grad||       alpha      alpha0  # evals  Notes 
      99       18912.4   2.98829e-06        4871.8           1           1      125   
    Iter      log prob        ||dx||      ||grad||       alpha      alpha0  # evals  Notes 
     175       18912.8   2.01265e-08       4623.64      0.2533           1      217   
Optimization terminated normally: 
  Convergence detected: relative gradient magnitude is below tolerance
INFO:fbprophet:Making 5 forecasts with cutoffs between 2013-10-07 00:00:00 and 2015-10-18 00:00:00
INFO:fbprophet:Applying in parallel with <concurrent.futures.process.ProcessPoolExecutor object at 0x7fc84dca4e10>
Initial log joint probability = -8.95172
    Iter      log prob        ||dx||      ||grad||       alpha      alpha0  # evals  Notes 
Initial log joint probability = -12.7302
    Iter      log prob        ||dx||      ||grad||       alpha      alpha0  # evals  Notes 
Initial log joint probability = -15.1549
    Iter      log prob        ||dx||      ||grad||       alpha      alpha0  # evals  Notes 
Initial log joint probability = -18.717
    Iter      log prob        ||dx||      ||grad||       alpha      alpha0  # evals  Notes 
Initial log joint probability = -23.5879
    Iter      log prob        ||dx||      ||grad||       alpha      alpha0  # evals  Notes 
      79       4678.94   9.97154e-07       5234.12   1.969e-10       0.001      151  LS failed, Hessian reset 
      99       4678.95   3.38064e-07       5100.81   6.785e-11       0.001      207  LS failed, Hessian reset 
    Iter      log prob        ||dx||      ||grad||       alpha      alpha0  # evals  Notes 
     111       4678.95    6.5874e-09       4632.25      0.4843      0.4843      219   
Optimization terminated normally: 
  Convergence detected: absolute parameter change was below tolerance
      99       7027.77   9.19866e-05       4759.76     0.03063           1      133   
    Iter      log prob        ||dx||      ||grad||       alpha      alpha0  # evals  Notes 
      47       11812.9   2.85906e-09       4600.35      0.1826      0.1826       70   
Optimization terminated normally: 
  Convergence detected: absolute parameter change was below tolerance
     134       7027.94   8.51699e-09       4446.53      0.3855      0.3855      182   
Optimization terminated normally: 
  Convergence detected: absolute parameter change was below tolerance
      73       9582.36   1.68871e-05        4459.2   3.085e-09       0.001      135  LS failed, Hessian reset 
      93       9582.41   9.99783e-09       4931.54      0.1201      0.2914      163   
Optimization terminated normally: 
  Convergence detected: absolute parameter change was below tolerance
      99       14232.9    1.0301e-06       4700.21           1           1      128   
    Iter      log prob        ||dx||      ||grad||       alpha      alpha0  # evals  Notes 
     119       14232.9   7.86227e-09       4863.65      0.5139      0.5139      153   
Optimization terminated normally: 
  Convergence detected: absolute parameter change was below tolerance
[I 2020-10-01 04:08:01,445] Trial 454 finished with value: 0.04071389822805999 and parameters: {'changepoint_prior_scale': 0.001001047925783358, 'seasonality_prior_scale': 0.15210124993935367, 'holidays_prior_scale': 0.12452681080763563, 'seasonality_mode': 'additive', 'changepoint_range': 0.5446223353634186}. Best is trial 96 with value: 0.038883738900888705.
Initial log joint probability = -28.8311
    Iter      log prob        ||dx||      ||grad||       alpha      alpha0  # evals  Notes 
      99       18912.7   1.74524e-06       3886.03      0.4738           1      121   
    Iter      log prob        ||dx||      ||grad||       alpha      alpha0  # evals  Notes 
     119       18912.7   1.17453e-08       3759.46      0.3564      0.9771      148   
Optimization terminated normally: 
  Convergence detected: relative gradient magnitude is below tolerance
INFO:fbprophet:Making 5 forecasts with cutoffs between 2013-10-07 00:00:00 and 2015-10-18 00:00:00
INFO:fbprophet:Applying in parallel with <concurrent.futures.process.ProcessPoolExecutor object at 0x7fc84dc92c50>
Initial log joint probability = -8.95172
    Iter      log prob        ||dx||      ||grad||       alpha      alpha0  # evals  Notes 
Initial log joint probability = -12.7302
    Iter      log prob        ||dx||      ||grad||       alpha      alpha0  # evals  Notes 
Initial log joint probability = -15.1549
    Iter      log prob        ||dx||      ||grad||       alpha      alpha0  # evals  Notes 
Initial log joint probability = -18.717
    Iter      log prob        ||dx||      ||grad||       alpha      alpha0  # evals  Notes 
      65       4679.05   3.86124e-09       4252.35      0.4156      0.4156       83   
Optimization terminated normally: 
  Convergence detected: absolute parameter change was below tolerance
Initial log joint probability = -23.5879
    Iter      log prob        ||dx||      ||grad||       alpha      alpha0  # evals  Notes 
      66       7028.39   2.20503e-05        3685.2   5.604e-09       0.001      125  LS failed, Hessian reset 
      57       9582.47   3.51822e-09       3864.73      0.2289      0.2289       78   
Optimization terminated normally: 
  Convergence detected: absolute parameter change was below tolerance
      99        7028.5   9.78096e-08       3511.48           1           1      164   
    Iter      log prob        ||dx||      ||grad||       alpha      alpha0  # evals  Notes 
     110        7028.5    6.0866e-09       4058.87      0.5593      0.5593      176   
Optimization terminated normally: 
  Convergence detected: absolute parameter change was below tolerance
      56         11813   8.65343e-09       3843.56      0.1832      0.4844       86   
Optimization terminated normally: 
  Convergence detected: absolute parameter change was below tolerance
      99         14232   3.02397e-07       4117.01           1           1      128   
    Iter      log prob        ||dx||      ||grad||       alpha      alpha0  # evals  Notes 
     113         14232   1.72214e-06        4120.1    3.89e-10       0.001      188  LS failed, Hessian reset 
     133         14232   9.00096e-09       3738.68      0.5447      0.5447      216   
Optimization terminated normally: 
  Convergence detected: absolute parameter change was below tolerance
[I 2020-10-01 04:08:17,084] Trial 455 finished with value: 0.0410113739941214 and parameters: {'changepoint_prior_scale': 0.0012118653205413052, 'seasonality_prior_scale': 0.1318479804881471, 'holidays_prior_scale': 0.10408207197057535, 'seasonality_mode': 'additive', 'changepoint_range': 0.606510346671249}. Best is trial 96 with value: 0.038883738900888705.
Initial log joint probability = -28.8311
    Iter      log prob        ||dx||      ||grad||       alpha      alpha0  # evals  Notes 
      99         18911   8.98407e-06       5206.61           1           1      122   
    Iter      log prob        ||dx||      ||grad||       alpha      alpha0  # evals  Notes 
     158       18912.4   8.97006e-09        4805.9      0.2363      0.2363      195   
Optimization terminated normally: 
  Convergence detected: absolute parameter change was below tolerance
INFO:fbprophet:Making 5 forecasts with cutoffs between 2013-10-07 00:00:00 and 2015-10-18 00:00:00
INFO:fbprophet:Applying in parallel with <concurrent.futures.process.ProcessPoolExecutor object at 0x7fc84dcaa610>
Initial log joint probability = -8.95172
    Iter      log prob        ||dx||      ||grad||       alpha      alpha0  # evals  Notes 
Initial log joint probability = -12.7302
    Iter      log prob        ||dx||      ||grad||       alpha      alpha0  # evals  Notes 
      55       4678.95   8.08884e-09       4591.95       0.213       0.213       79   
Optimization terminated normally: 
  Convergence detected: absolute parameter change was below tolerance
Initial log joint probability = -15.1549
    Iter      log prob        ||dx||      ||grad||       alpha      alpha0  # evals  Notes 
Initial log joint probability = -18.717
    Iter      log prob        ||dx||      ||grad||       alpha      alpha0  # evals  Notes 
Initial log joint probability = -23.5879
    Iter      log prob        ||dx||      ||grad||       alpha      alpha0  # evals  Notes 
      99       7028.24   5.79271e-07       4504.41           1           1      120   
    Iter      log prob        ||dx||      ||grad||       alpha      alpha0  # evals  Notes 
     118       7028.26   2.62327e-06       5484.72   5.212e-10       0.001      180  LS failed, Hessian reset 
     136       7028.27   4.89177e-09       5164.82     0.09653     0.09653      206   
Optimization terminated normally: 
  Convergence detected: absolute parameter change was below tolerance
      48       9582.08   1.89661e-05       4464.35   3.976e-09       0.001      101  LS failed, Hessian reset 
      54       11813.1   6.36137e-09        5272.5     0.03997           1       80   
Optimization terminated normally: 
  Convergence detected: absolute parameter change was below tolerance
      81       9582.18   8.18878e-09       4551.14      0.5562      0.5562      140   
Optimization terminated normally: 
  Convergence detected: absolute parameter change was below tolerance
      99       14233.5   4.26438e-07       4931.34      0.2493           1      127   
    Iter      log prob        ||dx||      ||grad||       alpha      alpha0  # evals  Notes 
     114       14233.5   2.30582e-09       4806.87      0.1828      0.1828      146   
Optimization terminated normally: 
  Convergence detected: absolute parameter change was below tolerance
[I 2020-10-01 04:08:31,317] Trial 456 finished with value: 0.04100450571091183 and parameters: {'changepoint_prior_scale': 0.0010079219410443904, 'seasonality_prior_scale': 0.1966844435778548, 'holidays_prior_scale': 0.15123792024605764, 'seasonality_mode': 'additive', 'changepoint_range': 0.5279724737943188}. Best is trial 96 with value: 0.038883738900888705.
Initial log joint probability = -28.8311
    Iter      log prob        ||dx||      ||grad||       alpha      alpha0  # evals  Notes 
      99       18912.8   8.87481e-07       2263.57      0.8655      0.8655      126   
    Iter      log prob        ||dx||      ||grad||       alpha      alpha0  # evals  Notes 
     126       18912.8    2.5602e-08       1651.39       0.346           1      162   
Optimization terminated normally: 
  Convergence detected: relative gradient magnitude is below tolerance
INFO:fbprophet:Making 5 forecasts with cutoffs between 2013-10-07 00:00:00 and 2015-10-18 00:00:00
INFO:fbprophet:Applying in parallel with <concurrent.futures.process.ProcessPoolExecutor object at 0x7fc84dca4150>
Initial log joint probability = -8.95172
    Iter      log prob        ||dx||      ||grad||       alpha      alpha0  # evals  Notes 
Initial log joint probability = -12.7302
    Iter      log prob        ||dx||      ||grad||       alpha      alpha0  # evals  Notes 
Initial log joint probability = -15.1549
    Iter      log prob        ||dx||      ||grad||       alpha      alpha0  # evals  Notes 
Initial log joint probability = -18.717
    Iter      log prob        ||dx||      ||grad||       alpha      alpha0  # evals  Notes 
      61       4679.36   9.66497e-09       2302.37      0.8833      0.8833       83   
Optimization terminated normally: 
  Convergence detected: absolute parameter change was below tolerance
Initial log joint probability = -23.5879
    Iter      log prob        ||dx||      ||grad||       alpha      alpha0  # evals  Notes 
      99       7030.64   5.75973e-06       2501.79      0.4606      0.4606      124   
    Iter      log prob        ||dx||      ||grad||       alpha      alpha0  # evals  Notes 
      68       9582.57   9.59829e-09       2036.26      0.3897      0.3897       90   
Optimization terminated normally: 
  Convergence detected: absolute parameter change was below tolerance
     191       7031.78   8.14062e-09       2398.98      0.2754      0.2754      232   
Optimization terminated normally: 
  Convergence detected: absolute parameter change was below tolerance
      90         11813   3.48783e-07       2370.83   1.721e-10       0.001      161  LS failed, Hessian reset 
      99         11813   1.69739e-08       2080.52       0.468       0.468      172   
    Iter      log prob        ||dx||      ||grad||       alpha      alpha0  # evals  Notes 
     102         11813   9.47797e-09       2323.59      0.6225      0.6225      175   
Optimization terminated normally: 
  Convergence detected: absolute parameter change was below tolerance
      99       14233.2   1.75924e-07       1799.42       1.516      0.3587      130   
    Iter      log prob        ||dx||      ||grad||       alpha      alpha0  # evals  Notes 
     118       14233.2   2.88565e-07       2073.22   1.214e-10       0.001      193  LS failed, Hessian reset 
     123       14233.2   1.76634e-08       1649.57     0.09784      0.4888      201   
Optimization terminated normally: 
  Convergence detected: relative gradient magnitude is below tolerance
