[I 2020-10-01 02:49:52,226] Trial 146 finished with value: 0.040726305163886624 and parameters: {'changepoint_prior_scale': 0.001483456854874743, 'seasonality_prior_scale': 0.3010958918808215, 'holidays_prior_scale': 0.08110344795709241, 'seasonality_mode': 'additive', 'changepoint_range': 0.5346132294729439}. Best is trial 96 with value: 0.038883738900888705.
Initial log joint probability = -28.8311
    Iter      log prob        ||dx||      ||grad||       alpha      alpha0  # evals  Notes 
      99       18912.9   2.64788e-07       2463.48      0.7022      0.7022      119   
    Iter      log prob        ||dx||      ||grad||       alpha      alpha0  # evals  Notes 
     113       18912.9   3.39885e-08       2068.71      0.3716           1      139   
Optimization terminated normally: 
  Convergence detected: relative gradient magnitude is below tolerance
INFO:fbprophet:Making 5 forecasts with cutoffs between 2013-10-07 00:00:00 and 2015-10-18 00:00:00
INFO:fbprophet:Applying in parallel with <concurrent.futures.process.ProcessPoolExecutor object at 0x7fc88e69ad10>
Initial log joint probability = -8.95172
    Iter      log prob        ||dx||      ||grad||       alpha      alpha0  # evals  Notes 
Initial log joint probability = -12.7302
    Iter      log prob        ||dx||      ||grad||       alpha      alpha0  # evals  Notes 
Initial log joint probability = -15.1549
    Iter      log prob        ||dx||      ||grad||       alpha      alpha0  # evals  Notes 
Initial log joint probability = -18.717
    Iter      log prob        ||dx||      ||grad||       alpha      alpha0  # evals  Notes 
      56       4679.42   7.82896e-09       2522.44      0.2872           1       78   
Optimization terminated normally: 
  Convergence detected: absolute parameter change was below tolerance
Initial log joint probability = -23.5879
    Iter      log prob        ||dx||      ||grad||       alpha      alpha0  # evals  Notes 
      99       7030.24    4.5498e-08       2274.21      0.4549      0.4549      122   
    Iter      log prob        ||dx||      ||grad||       alpha      alpha0  # evals  Notes 
     107       7030.24   8.63178e-09       2261.68      0.2474      0.2474      133   
Optimization terminated normally: 
  Convergence detected: absolute parameter change was below tolerance
      63       9582.55   1.27661e-08       2392.77      0.6584      0.6584       91   
Optimization terminated normally: 
  Convergence detected: relative gradient magnitude is below tolerance
      59       11813.3   8.74705e-09       2526.21      0.2469      0.8279       83   
Optimization terminated normally: 
  Convergence detected: absolute parameter change was below tolerance
      99         14232   2.56418e-08       2412.45      0.1977      0.1977      132   
    Iter      log prob        ||dx||      ||grad||       alpha      alpha0  # evals  Notes 
     129         14232   2.97216e-08       2215.81       0.139       0.359      168   
Optimization terminated normally: 
  Convergence detected: relative gradient magnitude is below tolerance
[I 2020-10-01 02:50:01,155] Trial 147 finished with value: 0.041302090040689965 and parameters: {'changepoint_prior_scale': 0.0019797236250421136, 'seasonality_prior_scale': 0.5114303492949779, 'holidays_prior_scale': 0.08545578504792262, 'seasonality_mode': 'additive', 'changepoint_range': 0.5345733274966014}. Best is trial 96 with value: 0.038883738900888705.
Initial log joint probability = -28.8311
    Iter      log prob        ||dx||      ||grad||       alpha      alpha0  # evals  Notes 
      99       18912.8   1.25893e-07       3051.71      0.3448           1      126   
    Iter      log prob        ||dx||      ||grad||       alpha      alpha0  # evals  Notes 
     127       18912.8   1.70058e-07        2628.7   5.706e-11       0.001      193  LS failed, Hessian reset 
     132       18912.8   2.74481e-08       2326.39      0.2866           1      199   
Optimization terminated normally: 
  Convergence detected: relative gradient magnitude is below tolerance
INFO:fbprophet:Making 5 forecasts with cutoffs between 2013-10-07 00:00:00 and 2015-10-18 00:00:00
INFO:fbprophet:Applying in parallel with <concurrent.futures.process.ProcessPoolExecutor object at 0x7fc88e6aeb90>
Initial log joint probability = -8.95172
    Iter      log prob        ||dx||      ||grad||       alpha      alpha0  # evals  Notes 
Initial log joint probability = -12.7302
    Iter      log prob        ||dx||      ||grad||       alpha      alpha0  # evals  Notes 
Initial log joint probability = -15.1549
    Iter      log prob        ||dx||      ||grad||       alpha      alpha0  # evals  Notes 
Initial log joint probability = -18.717
    Iter      log prob        ||dx||      ||grad||       alpha      alpha0  # evals  Notes 
      66       4677.33   8.26685e-09       3232.87      0.7717      0.7717       85   
Optimization terminated normally: 
  Convergence detected: absolute parameter change was below tolerance
Initial log joint probability = -23.5879
    Iter      log prob        ||dx||      ||grad||       alpha      alpha0  # evals  Notes 
      99       7029.61    2.3175e-08       3000.81      0.2907           1      124   
    Iter      log prob        ||dx||      ||grad||       alpha      alpha0  # evals  Notes 
     106       7029.61   6.79428e-09       3001.01      0.3645      0.3645      132   
Optimization terminated normally: 
  Convergence detected: absolute parameter change was below tolerance
      75       9582.57   6.34898e-09       3478.06      0.3114      0.3114       98   
Optimization terminated normally: 
  Convergence detected: absolute parameter change was below tolerance
      49       11813.3   8.78404e-09       3121.28      0.4885      0.4885       73   
Optimization terminated normally: 
  Convergence detected: absolute parameter change was below tolerance
      85       14232.9   0.000118604       3119.83     3.8e-08       0.001      135  LS failed, Hessian reset 
      99       14233.1   9.08698e-06       2987.97           1           1      151   
    Iter      log prob        ||dx||      ||grad||       alpha      alpha0  # evals  Notes 
     155       14233.3   9.60355e-09       2394.85      0.2873      0.2873      225   
Optimization terminated normally: 
  Convergence detected: absolute parameter change was below tolerance
[I 2020-10-01 02:50:17,525] Trial 148 finished with value: 0.041385145581258186 and parameters: {'changepoint_prior_scale': 0.0015801699382668219, 'seasonality_prior_scale': 0.30956738839631465, 'holidays_prior_scale': 0.10606141082829199, 'seasonality_mode': 'additive', 'changepoint_range': 0.5154326588194832}. Best is trial 96 with value: 0.038883738900888705.
Initial log joint probability = -28.8311
    Iter      log prob        ||dx||      ||grad||       alpha      alpha0  # evals  Notes 
      99       18912.9   9.69335e-07       2119.65       4.983      0.4983      125   
    Iter      log prob        ||dx||      ||grad||       alpha      alpha0  # evals  Notes 
     144       18912.9   1.37614e-07       1887.44   6.664e-11       0.001      218  LS failed, Hessian reset 
     148       18912.9   1.19006e-08       1711.18      0.1799      0.4607      224   
Optimization terminated normally: 
  Convergence detected: relative gradient magnitude is below tolerance
INFO:fbprophet:Making 5 forecasts with cutoffs between 2013-10-07 00:00:00 and 2015-10-18 00:00:00
INFO:fbprophet:Applying in parallel with <concurrent.futures.process.ProcessPoolExecutor object at 0x7fc88e69aa90>
Initial log joint probability = -8.95172
    Iter      log prob        ||dx||      ||grad||       alpha      alpha0  # evals  Notes 
Initial log joint probability = -12.7302
    Iter      log prob        ||dx||      ||grad||       alpha      alpha0  # evals  Notes 
Initial log joint probability = -15.1549
    Iter      log prob        ||dx||      ||grad||       alpha      alpha0  # evals  Notes 
Initial log joint probability = -18.717
    Iter      log prob        ||dx||      ||grad||       alpha      alpha0  # evals  Notes 
Initial log joint probability = -23.5879
    Iter      log prob        ||dx||      ||grad||       alpha      alpha0  # evals  Notes 
      70       4679.46   8.37408e-09        2166.8      0.2615           1      102   
Optimization terminated normally: 
  Convergence detected: absolute parameter change was below tolerance
      99       7031.79   4.55711e-05       1821.77           1           1      124   
    Iter      log prob        ||dx||      ||grad||       alpha      alpha0  # evals  Notes 
      71       9582.64   3.04585e-06       1932.84   1.281e-09       0.001      141  LS failed, Hessian reset 
      73       11813.3    3.2096e-08       1875.08      0.7577      0.7577      102   
Optimization terminated normally: 
  Convergence detected: relative gradient magnitude is below tolerance
      88       9582.65   3.31096e-09       1849.43     0.05537     0.05537      163   
Optimization terminated normally: 
  Convergence detected: absolute parameter change was below tolerance
     164       7032.03   1.84879e-06       2120.73   8.198e-10       0.001      255  LS failed, Hessian reset 
     199       7032.04   1.00388e-07       2080.17           1           1      302   
    Iter      log prob        ||dx||      ||grad||       alpha      alpha0  # evals  Notes 
     206       7032.04   3.98449e-09        2065.4      0.1868      0.1868      310   
Optimization terminated normally: 
  Convergence detected: absolute parameter change was below tolerance
      99       14232.9   5.06916e-05       1909.37           1           1      127   
    Iter      log prob        ||dx||      ||grad||       alpha      alpha0  # evals  Notes 
     129         14233    1.4922e-08       1959.11       0.272           1      169   
Optimization terminated normally: 
  Convergence detected: relative gradient magnitude is below tolerance
[I 2020-10-01 02:50:32,806] Trial 149 finished with value: 0.04210105719910262 and parameters: {'changepoint_prior_scale': 0.002329561201131975, 'seasonality_prior_scale': 0.3912082185626538, 'holidays_prior_scale': 0.054190740634127925, 'seasonality_mode': 'additive', 'changepoint_range': 0.5664422403431792}. Best is trial 96 with value: 0.038883738900888705.
Initial log joint probability = -28.8311
    Iter      log prob        ||dx||      ||grad||       alpha      alpha0  # evals  Notes 
      99       18912.8   7.38154e-05       3638.06          10           1      122   
    Iter      log prob        ||dx||      ||grad||       alpha      alpha0  # evals  Notes 
     150         18913   2.18664e-08       3379.68       0.246      0.7286      183   
Optimization terminated normally: 
  Convergence detected: relative gradient magnitude is below tolerance
INFO:fbprophet:Making 5 forecasts with cutoffs between 2013-10-07 00:00:00 and 2015-10-18 00:00:00
INFO:fbprophet:Applying in parallel with <concurrent.futures.process.ProcessPoolExecutor object at 0x7fc88e65ea50>
Initial log joint probability = -8.95172
    Iter      log prob        ||dx||      ||grad||       alpha      alpha0  # evals  Notes 
Initial log joint probability = -12.7302
    Iter      log prob        ||dx||      ||grad||       alpha      alpha0  # evals  Notes 
Initial log joint probability = -15.1549
    Iter      log prob        ||dx||      ||grad||       alpha      alpha0  # evals  Notes 
Initial log joint probability = -18.717
    Iter      log prob        ||dx||      ||grad||       alpha      alpha0  # evals  Notes 
Initial log joint probability = -23.5879
      48       4679.09   5.02718e-06       3264.74   1.565e-09       0.001       96  LS failed, Hessian reset 
    Iter      log prob        ||dx||      ||grad||       alpha      alpha0  # evals  Notes 
      86       4679.11   5.55119e-09       3317.11      0.3748      0.3748      140   
Optimization terminated normally: 
  Convergence detected: absolute parameter change was below tolerance
      67       7029.06   3.09009e-05       3567.76   1.013e-08       0.001      112  LS failed, Hessian reset 
      99       7029.15   2.02806e-07       2965.03           1           1      153   
    Iter      log prob        ||dx||      ||grad||       alpha      alpha0  # evals  Notes 
      57       11813.3   2.01337e-08       3377.91           1           1       79   
Optimization terminated normally: 
  Convergence detected: relative gradient magnitude is below tolerance
      62       9582.48   5.29772e-06       3439.05   1.392e-09       0.001      125  LS failed, Hessian reset 
      99        9582.5   2.86585e-07       3470.66           1           1      169   
    Iter      log prob        ||dx||      ||grad||       alpha      alpha0  # evals  Notes 
     160       7029.22   8.08764e-07        3737.3   2.142e-10       0.001      274  LS failed, Hessian reset 
     113        9582.5   9.84233e-09       2930.72      0.5052      0.5052      186   
Optimization terminated normally: 
  Convergence detected: absolute parameter change was below tolerance
      90       14233.1   1.04587e-08        3253.3      0.4055           1      123   
Optimization terminated normally: 
  Convergence detected: relative gradient magnitude is below tolerance
     174       7029.22   3.84721e-09       2997.14      0.1968      0.1968      291   
Optimization terminated normally: 
  Convergence detected: absolute parameter change was below tolerance
[I 2020-10-01 02:50:48,274] Trial 150 finished with value: 0.04096026016026702 and parameters: {'changepoint_prior_scale': 0.0014441824201445034, 'seasonality_prior_scale': 0.2803640751420519, 'holidays_prior_scale': 0.13248071186770194, 'seasonality_mode': 'additive', 'changepoint_range': 0.5012687210603831}. Best is trial 96 with value: 0.038883738900888705.
Initial log joint probability = -28.8311
    Iter      log prob        ||dx||      ||grad||       alpha      alpha0  # evals  Notes 
      99       18912.8    9.5155e-05        4349.3           1           1      122   
    Iter      log prob        ||dx||      ||grad||       alpha      alpha0  # evals  Notes 
     143       18912.9   8.02611e-09       3442.41      0.4491      0.4491      179   
Optimization terminated normally: 
  Convergence detected: absolute parameter change was below tolerance
INFO:fbprophet:Making 5 forecasts with cutoffs between 2013-10-07 00:00:00 and 2015-10-18 00:00:00
INFO:fbprophet:Applying in parallel with <concurrent.futures.process.ProcessPoolExecutor object at 0x7fc84dbb3c90>
Initial log joint probability = -8.95172
    Iter      log prob        ||dx||      ||grad||       alpha      alpha0  # evals  Notes 
Initial log joint probability = -12.7302
    Iter      log prob        ||dx||      ||grad||       alpha      alpha0  # evals  Notes 
      96       4679.26   8.19471e-09       4081.34      0.3116      0.3116      128   
Optimization terminated normally: 
  Convergence detected: absolute parameter change was below tolerance
Initial log joint probability = -15.1549
    Iter      log prob        ||dx||      ||grad||       alpha      alpha0  # evals  Notes 
Initial log joint probability = -18.717
    Iter      log prob        ||dx||      ||grad||       alpha      alpha0  # evals  Notes 
Initial log joint probability = -23.5879
    Iter      log prob        ||dx||      ||grad||       alpha      alpha0  # evals  Notes 
      66       7028.52   1.98208e-05       4589.23   4.768e-09       0.001      128  LS failed, Hessian reset 
      99       7028.69   4.45697e-08       3676.82           1           1      170   
    Iter      log prob        ||dx||      ||grad||       alpha      alpha0  # evals  Notes 
     105       7028.69   4.53938e-09       3721.13      0.2702      0.2702      178   
Optimization terminated normally: 
  Convergence detected: absolute parameter change was below tolerance
      65       9582.26   6.57639e-06       4089.75   1.479e-09       0.001      135  LS failed, Hessian reset 
      96       11812.8   8.48301e-09       4222.29      0.5446      0.5446      127   
Optimization terminated normally: 
  Convergence detected: absolute parameter change was below tolerance
      99        9582.3   7.11852e-08       3872.25       2.307      0.2307      180   
    Iter      log prob        ||dx||      ||grad||       alpha      alpha0  # evals  Notes 
     104        9582.3   7.64624e-09       4170.29      0.2776      0.2776      186   
Optimization terminated normally: 
  Convergence detected: absolute parameter change was below tolerance
      97       14231.7   5.61555e-09       3906.17      0.3241      0.3241      133   
Optimization terminated normally: 
  Convergence detected: absolute parameter change was below tolerance
[I 2020-10-01 02:51:03,596] Trial 151 finished with value: 0.04100775734879935 and parameters: {'changepoint_prior_scale': 0.0011924808718883646, 'seasonality_prior_scale': 0.3427578229293169, 'holidays_prior_scale': 0.07574165012551493, 'seasonality_mode': 'additive', 'changepoint_range': 0.5230892037906281}. Best is trial 96 with value: 0.038883738900888705.
Initial log joint probability = -28.8311
    Iter      log prob        ||dx||      ||grad||       alpha      alpha0  # evals  Notes 
      99       18912.9   8.38119e-07       2788.27      0.8758      0.8758      126   
    Iter      log prob        ||dx||      ||grad||       alpha      alpha0  # evals  Notes 
     118       18912.9   1.44523e-08       2800.91      0.1272      0.5125      152   
Optimization terminated normally: 
  Convergence detected: relative gradient magnitude is below tolerance
INFO:fbprophet:Making 5 forecasts with cutoffs between 2013-10-07 00:00:00 and 2015-10-18 00:00:00
INFO:fbprophet:Applying in parallel with <concurrent.futures.process.ProcessPoolExecutor object at 0x7fc88e65e2d0>
Initial log joint probability = -8.95172
    Iter      log prob        ||dx||      ||grad||       alpha      alpha0  # evals  Notes 
Initial log joint probability = -12.7302
    Iter      log prob        ||dx||      ||grad||       alpha      alpha0  # evals  Notes 
Initial log joint probability = -15.1549
    Iter      log prob        ||dx||      ||grad||       alpha      alpha0  # evals  Notes 
Initial log joint probability = -18.717
    Iter      log prob        ||dx||      ||grad||       alpha      alpha0  # evals  Notes 
Initial log joint probability = -23.5879
    Iter      log prob        ||dx||      ||grad||       alpha      alpha0  # evals  Notes 
      83       4679.02    0.00020748       2926.94   6.777e-08       0.001      157  LS failed, Hessian reset 
      99       4679.37   1.23547e-06       2833.78      0.7141      0.7141      178   
    Iter      log prob        ||dx||      ||grad||       alpha      alpha0  # evals  Notes 
      99       7029.65    3.9876e-07       2958.18      0.5591      0.5591      125   
    Iter      log prob        ||dx||      ||grad||       alpha      alpha0  # evals  Notes 
      66       9582.51   4.55076e-09       2850.91      0.3321      0.3321       91   
Optimization terminated normally: 
  Convergence detected: absolute parameter change was below tolerance
     139       4679.39   2.93893e-06       3021.15   9.903e-10       0.001      277  LS failed, Hessian reset 
      48       11813.3   2.74141e-09       3056.77       0.211       0.211       73   
Optimization terminated normally: 
  Convergence detected: absolute parameter change was below tolerance
     112        7029.8   3.00746e-05       2704.65   9.339e-09       0.001      177  LS failed, Hessian reset 
     158        4679.4   7.20367e-07       2916.63   2.633e-10       0.001      339  LS failed, Hessian reset 
     173        4679.4   6.88514e-09       2838.24      0.4924      0.4924      357   
Optimization terminated normally: 
  Convergence detected: absolute parameter change was below tolerance
     191       7029.87   6.85615e-09        2241.1      0.3008           1      283   
Optimization terminated normally: 
  Convergence detected: absolute parameter change was below tolerance
      99       14233.2   1.88877e-07       2263.45      0.8678      0.8678      128   
    Iter      log prob        ||dx||      ||grad||       alpha      alpha0  # evals  Notes 
     115       14233.2   1.91624e-07       2535.75   6.225e-11       0.001      188  LS failed, Hessian reset 
     121       14233.2   2.39095e-09       2466.12     0.08929     0.08929      196   
Optimization terminated normally: 
  Convergence detected: absolute parameter change was below tolerance
