[I 2020-10-01 03:35:45,318] Trial 327 finished with value: 0.0417814136340275 and parameters: {'changepoint_prior_scale': 0.0010019751501895064, 'seasonality_prior_scale': 0.09399774762749481, 'holidays_prior_scale': 0.19008611106826628, 'seasonality_mode': 'additive', 'changepoint_range': 0.5604898605990226}. Best is trial 96 with value: 0.038883738900888705.
Initial log joint probability = -28.8311
    Iter      log prob        ||dx||      ||grad||       alpha      alpha0  # evals  Notes 
      99         18911    1.2998e-06       4151.34      0.1274           1      131   
    Iter      log prob        ||dx||      ||grad||       alpha      alpha0  # evals  Notes 
     199       18912.3    1.7915e-08       4696.28      0.4075      0.4075      255   
    Iter      log prob        ||dx||      ||grad||       alpha      alpha0  # evals  Notes 
     206       18912.3   1.56385e-08       4231.76       1.229      0.3255      266   
Optimization terminated normally: 
  Convergence detected: relative gradient magnitude is below tolerance
INFO:fbprophet:Making 5 forecasts with cutoffs between 2013-10-07 00:00:00 and 2015-10-18 00:00:00
INFO:fbprophet:Applying in parallel with <concurrent.futures.process.ProcessPoolExecutor object at 0x7fc84dc9c790>
Initial log joint probability = -8.95172
    Iter      log prob        ||dx||      ||grad||       alpha      alpha0  # evals  Notes 
Initial log joint probability = -12.7302
    Iter      log prob        ||dx||      ||grad||       alpha      alpha0  # evals  Notes 
Initial log joint probability = -15.1549
    Iter      log prob        ||dx||      ||grad||       alpha      alpha0  # evals  Notes 
Initial log joint probability = -18.717
    Iter      log prob        ||dx||      ||grad||       alpha      alpha0  # evals  Notes 
Initial log joint probability = -23.5879
    Iter      log prob        ||dx||      ||grad||       alpha      alpha0  # evals  Notes 
      94       4679.13   7.48568e-09       4467.58      0.4773      0.4773      120   
Optimization terminated normally: 
  Convergence detected: absolute parameter change was below tolerance
      82       7028.06   8.50126e-09       3939.69      0.3836      0.3836      107   
Optimization terminated normally: 
  Convergence detected: absolute parameter change was below tolerance
      77       9582.37   8.66508e-09       4542.23      0.3405      0.3405      105   
Optimization terminated normally: 
  Convergence detected: absolute parameter change was below tolerance
      82       11813.1   1.04355e-05       4357.21   2.294e-09       0.001      154  LS failed, Hessian reset 
      99       14232.5   5.62818e-05       4368.58      0.3312      0.3312      126   
    Iter      log prob        ||dx||      ||grad||       alpha      alpha0  # evals  Notes 
      99       11813.2   1.22678e-07       4297.28           1           1      176   
    Iter      log prob        ||dx||      ||grad||       alpha      alpha0  # evals  Notes 
     111       11813.2   6.26902e-09       4593.66      0.4878      0.4878      189   
Optimization terminated normally: 
  Convergence detected: absolute parameter change was below tolerance
     146       14232.9   6.56023e-09       4096.69      0.3422      0.3422      185   
Optimization terminated normally: 
  Convergence detected: absolute parameter change was below tolerance
[I 2020-10-01 03:36:01,315] Trial 328 finished with value: 0.04084441236559038 and parameters: {'changepoint_prior_scale': 0.0011150960017482382, 'seasonality_prior_scale': 0.23806384729132476, 'holidays_prior_scale': 0.11234421145189442, 'seasonality_mode': 'additive', 'changepoint_range': 0.5109634328993946}. Best is trial 96 with value: 0.038883738900888705.
Initial log joint probability = -28.8311
    Iter      log prob        ||dx||      ||grad||       alpha      alpha0  # evals  Notes 
      99       18912.6   9.45007e-05        3651.4           1           1      123   
    Iter      log prob        ||dx||      ||grad||       alpha      alpha0  # evals  Notes 
     126       18912.7   7.61151e-09        3807.5      0.2636      0.2636      156   
Optimization terminated normally: 
  Convergence detected: absolute parameter change was below tolerance
INFO:fbprophet:Making 5 forecasts with cutoffs between 2013-10-07 00:00:00 and 2015-10-18 00:00:00
INFO:fbprophet:Applying in parallel with <concurrent.futures.process.ProcessPoolExecutor object at 0x7fc84dc0ae10>
Initial log joint probability = -8.95172
    Iter      log prob        ||dx||      ||grad||       alpha      alpha0  # evals  Notes 
Initial log joint probability = -12.7302
    Iter      log prob        ||dx||      ||grad||       alpha      alpha0  # evals  Notes 
Initial log joint probability = -15.1549
    Iter      log prob        ||dx||      ||grad||       alpha      alpha0  # evals  Notes 
Initial log joint probability = -18.717
    Iter      log prob        ||dx||      ||grad||       alpha      alpha0  # evals  Notes 
Initial log joint probability = -23.5879
    Iter      log prob        ||dx||      ||grad||       alpha      alpha0  # evals  Notes 
      52       4676.26   0.000522927       3687.64   1.404e-07       0.001      116  LS failed, Hessian reset 
      99       4678.94   4.74396e-07       3759.09       0.463       0.463      174   
    Iter      log prob        ||dx||      ||grad||       alpha      alpha0  # evals  Notes 
     116       4678.95   9.97702e-09       3860.15      0.4196      0.4196      193   
Optimization terminated normally: 
  Convergence detected: absolute parameter change was below tolerance
      99       7029.35   3.46939e-07       4006.95      0.9624      0.9624      125   
    Iter      log prob        ||dx||      ||grad||       alpha      alpha0  # evals  Notes 
     142        7029.4   6.82022e-09       3671.16      0.3111           1      185   
Optimization terminated normally: 
  Convergence detected: absolute parameter change was below tolerance
      59       11813.1   9.56029e-09       3873.12      0.3575           1       90   
Optimization terminated normally: 
  Convergence detected: absolute parameter change was below tolerance
      99       9581.62   4.31926e-07        3513.6           1           1      132   
    Iter      log prob        ||dx||      ||grad||       alpha      alpha0  # evals  Notes 
     120       9581.62   6.34529e-09       3341.35       0.322       0.322      157   
Optimization terminated normally: 
  Convergence detected: absolute parameter change was below tolerance
      99       14233.3    2.6321e-06       3930.59           1           1      123   
    Iter      log prob        ||dx||      ||grad||       alpha      alpha0  # evals  Notes 
     119       14233.3   6.84348e-09       3818.61        0.51        0.51      152   
Optimization terminated normally: 
  Convergence detected: absolute parameter change was below tolerance
[I 2020-10-01 03:36:16,756] Trial 329 finished with value: 0.04333142573278143 and parameters: {'changepoint_prior_scale': 0.0012959290625302311, 'seasonality_prior_scale': 0.20657485712571075, 'holidays_prior_scale': 0.1471319630164615, 'seasonality_mode': 'multiplicative', 'changepoint_range': 0.5259302984595551}. Best is trial 96 with value: 0.038883738900888705.
Initial log joint probability = -28.8311
    Iter      log prob        ||dx||      ||grad||       alpha      alpha0  # evals  Notes 
      99       18912.7   4.48883e-06       3464.35           1           1      121   
    Iter      log prob        ||dx||      ||grad||       alpha      alpha0  # evals  Notes 
     125       18912.7   7.03707e-09       3340.35      0.1294      0.5121      156   
Optimization terminated normally: 
  Convergence detected: absolute parameter change was below tolerance
INFO:fbprophet:Making 5 forecasts with cutoffs between 2013-10-07 00:00:00 and 2015-10-18 00:00:00
INFO:fbprophet:Applying in parallel with <concurrent.futures.process.ProcessPoolExecutor object at 0x7fc84dc28c90>
Initial log joint probability = -8.95172
    Iter      log prob        ||dx||      ||grad||       alpha      alpha0  # evals  Notes 
Initial log joint probability = -12.7302
    Iter      log prob        ||dx||      ||grad||       alpha      alpha0  # evals  Notes 
Initial log joint probability = -15.1549
    Iter      log prob        ||dx||      ||grad||       alpha      alpha0  # evals  Notes 
Initial log joint probability = -18.717
    Iter      log prob        ||dx||      ||grad||       alpha      alpha0  # evals  Notes 
Initial log joint probability = -23.5879
    Iter      log prob        ||dx||      ||grad||       alpha      alpha0  # evals  Notes 
      78       4678.62   3.01925e-07       3256.86   8.587e-11       0.001      141  LS failed, Hessian reset 
      90       4678.62   6.50774e-09        2977.1      0.2931      0.2931      155   
Optimization terminated normally: 
  Convergence detected: absolute parameter change was below tolerance
      99       7030.24   8.89707e-05       3411.01      0.4255      0.4255      127   
    Iter      log prob        ||dx||      ||grad||       alpha      alpha0  # evals  Notes 
      50        9582.4   9.90074e-07       3026.92   2.923e-10       0.001      106  LS failed, Hessian reset 
      66       9582.41   7.96781e-09       3316.83      0.1406      0.1406      127   
Optimization terminated normally: 
  Convergence detected: absolute parameter change was below tolerance
     170       7031.73   7.20714e-09       3135.68      0.2326           1      213   
Optimization terminated normally: 
  Convergence detected: absolute parameter change was below tolerance
      81       11813.1   4.78993e-09       3292.83      0.2366      0.6774      111   
Optimization terminated normally: 
  Convergence detected: absolute parameter change was below tolerance
      99       14233.3   3.95494e-06       3116.81      0.6263      0.6263      130   
    Iter      log prob        ||dx||      ||grad||       alpha      alpha0  # evals  Notes 
     108       14233.4    2.0467e-05       3116.12   5.726e-09       0.001      188  LS failed, Hessian reset 
     130       14233.4   3.39397e-06       3350.44   1.025e-09       0.001      255  LS failed, Hessian reset 
     151       14233.4   2.76391e-07       3283.98   7.983e-11       0.001      325  LS failed, Hessian reset 
     168       14233.4   8.85198e-09       3376.68      0.6677      0.6677      343   
Optimization terminated normally: 
  Convergence detected: absolute parameter change was below tolerance
[I 2020-10-01 03:36:32,630] Trial 330 finished with value: 0.04184349943778725 and parameters: {'changepoint_prior_scale': 0.0015178347123723874, 'seasonality_prior_scale': 0.10835994404842947, 'holidays_prior_scale': 0.07858431618764605, 'seasonality_mode': 'additive', 'changepoint_range': 0.580326408403458}. Best is trial 96 with value: 0.038883738900888705.
Initial log joint probability = -28.8311
    Iter      log prob        ||dx||      ||grad||       alpha      alpha0  # evals  Notes 
      99       18912.1   2.47275e-05        4102.8      0.7128      0.7128      128   
    Iter      log prob        ||dx||      ||grad||       alpha      alpha0  # evals  Notes 
     170       18912.9   7.84484e-09       4708.33      0.1655      0.1655      220   
Optimization terminated normally: 
  Convergence detected: absolute parameter change was below tolerance
INFO:fbprophet:Making 5 forecasts with cutoffs between 2013-10-07 00:00:00 and 2015-10-18 00:00:00
INFO:fbprophet:Applying in parallel with <concurrent.futures.process.ProcessPoolExecutor object at 0x7fc84dc201d0>
Initial log joint probability = -8.95172
    Iter      log prob        ||dx||      ||grad||       alpha      alpha0  # evals  Notes 
Initial log joint probability = -12.7302
    Iter      log prob        ||dx||      ||grad||       alpha      alpha0  # evals  Notes 
Initial log joint probability = -15.1549
    Iter      log prob        ||dx||      ||grad||       alpha      alpha0  # evals  Notes 
Initial log joint probability = -18.717
    Iter      log prob        ||dx||      ||grad||       alpha      alpha0  # evals  Notes 
Initial log joint probability = -23.5879
    Iter      log prob        ||dx||      ||grad||       alpha      alpha0  # evals  Notes 
      47       4674.54   0.000614143       4498.01   1.373e-07       0.001      108  LS failed, Hessian reset 
      99        4677.8   5.83173e-05       3950.24   1.305e-08       0.001      214  LS failed, Hessian reset 
    Iter      log prob        ||dx||      ||grad||       alpha      alpha0  # evals  Notes 
      99       7028.47   1.25941e-07       3879.57           1           1      121   
    Iter      log prob        ||dx||      ||grad||       alpha      alpha0  # evals  Notes 
     113       7028.47    3.3811e-09       4721.08     0.01583     0.01583      143   
Optimization terminated normally: 
  Convergence detected: absolute parameter change was below tolerance
      76        9581.9   4.20392e-09       3998.39       0.217       0.217      106   
Optimization terminated normally: 
  Convergence detected: absolute parameter change was below tolerance
      54       11812.8   6.10524e-09       4359.78      0.2511      0.2511       79   
Optimization terminated normally: 
  Convergence detected: absolute parameter change was below tolerance
     180       4678.17   3.43186e-09       3949.86      0.1882      0.1882      320   
Optimization terminated normally: 
  Convergence detected: absolute parameter change was below tolerance
      99       14232.6    3.4318e-08       4357.66           1           1      138   
    Iter      log prob        ||dx||      ||grad||       alpha      alpha0  # evals  Notes 
     102       14232.6   7.01412e-09       4541.73      0.5643      0.5643      141   
Optimization terminated normally: 
  Convergence detected: absolute parameter change was below tolerance
[I 2020-10-01 03:36:49,108] Trial 331 finished with value: 0.04152735251831004 and parameters: {'changepoint_prior_scale': 0.0011165532151000924, 'seasonality_prior_scale': 0.07381414786432262, 'holidays_prior_scale': 0.10214474289496417, 'seasonality_mode': 'additive', 'changepoint_range': 0.5512628621662966}. Best is trial 96 with value: 0.038883738900888705.
Initial log joint probability = -28.8311
    Iter      log prob        ||dx||      ||grad||       alpha      alpha0  # evals  Notes 
      99       18912.8   0.000117447       3508.65      0.1767           1      118   
    Iter      log prob        ||dx||      ||grad||       alpha      alpha0  # evals  Notes 
     143       18912.8   2.58061e-08       3535.09      0.1953           1      180   
Optimization terminated normally: 
  Convergence detected: relative gradient magnitude is below tolerance
INFO:fbprophet:Making 5 forecasts with cutoffs between 2013-10-07 00:00:00 and 2015-10-18 00:00:00
INFO:fbprophet:Applying in parallel with <concurrent.futures.process.ProcessPoolExecutor object at 0x7fc84dcaaa50>
Initial log joint probability = -8.95172
    Iter      log prob        ||dx||      ||grad||       alpha      alpha0  # evals  Notes 
Initial log joint probability = -12.7302
    Iter      log prob        ||dx||      ||grad||       alpha      alpha0  # evals  Notes 
Initial log joint probability = -15.1549
    Iter      log prob        ||dx||      ||grad||       alpha      alpha0  # evals  Notes 
      52       4679.07   3.80827e-05       3719.62   1.033e-08       0.001      108  LS failed, Hessian reset 
Initial log joint probability = -18.717
    Iter      log prob        ||dx||      ||grad||       alpha      alpha0  # evals  Notes 
      99       4679.19   5.82655e-08        3386.2      0.3591      0.3591      169   
    Iter      log prob        ||dx||      ||grad||       alpha      alpha0  # evals  Notes 
     108       4679.19   4.07939e-09       3600.37       0.267       0.267      180   
Optimization terminated normally: 
  Convergence detected: absolute parameter change was below tolerance
Initial log joint probability = -23.5879
    Iter      log prob        ||dx||      ||grad||       alpha      alpha0  # evals  Notes 
      99       7028.37   8.83343e-08       3572.57      0.5745      0.5745      131   
    Iter      log prob        ||dx||      ||grad||       alpha      alpha0  # evals  Notes 
     106       7028.62   4.41445e-05       4080.59   1.129e-08       0.001      184  LS failed, Hessian reset 
      80       9582.54   1.48697e-08        3064.3           1           1      118   
Optimization terminated normally: 
  Convergence detected: relative gradient magnitude is below tolerance
     150       7028.72   8.04261e-09        3009.6      0.3142      0.3142      239   
Optimization terminated normally: 
  Convergence detected: absolute parameter change was below tolerance
      33       11811.8   0.000301804       4028.59   9.063e-08       0.001       91  LS failed, Hessian reset 
      98       11813.2   4.21241e-09        3662.5      0.1867      0.1867      182   
Optimization terminated normally: 
  Convergence detected: absolute parameter change was below tolerance
      99       14232.6   4.46582e-06        3833.6      0.5237      0.5237      132   
    Iter      log prob        ||dx||      ||grad||       alpha      alpha0  # evals  Notes 
     159       14232.9   1.20879e-08       3426.72      0.2615      0.9056      213   
Optimization terminated normally: 
  Convergence detected: relative gradient magnitude is below tolerance
[I 2020-10-01 03:37:04,495] Trial 332 finished with value: 0.04086868424088479 and parameters: {'changepoint_prior_scale': 0.0013555197416351857, 'seasonality_prior_scale': 0.3492985016421467, 'holidays_prior_scale': 0.21347334506030877, 'seasonality_mode': 'additive', 'changepoint_range': 0.5407757789769367}. Best is trial 96 with value: 0.038883738900888705.
Initial log joint probability = -28.8311
    Iter      log prob        ||dx||      ||grad||       alpha      alpha0  # evals  Notes 
      86         18913   6.50964e-09       2379.93      0.2123      0.2123      109   
Optimization terminated normally: 
  Convergence detected: absolute parameter change was below tolerance
INFO:fbprophet:Making 5 forecasts with cutoffs between 2013-10-07 00:00:00 and 2015-10-18 00:00:00
INFO:fbprophet:Applying in parallel with <concurrent.futures.process.ProcessPoolExecutor object at 0x7fc84dc25e50>
Initial log joint probability = -8.95172
    Iter      log prob        ||dx||      ||grad||       alpha      alpha0  # evals  Notes 
Initial log joint probability = -12.7302
    Iter      log prob        ||dx||      ||grad||       alpha      alpha0  # evals  Notes 
Initial log joint probability = -15.1549
    Iter      log prob        ||dx||      ||grad||       alpha      alpha0  # evals  Notes 
Initial log joint probability = -18.717
    Iter      log prob        ||dx||      ||grad||       alpha      alpha0  # evals  Notes 
      70       4679.31   7.64074e-09       2667.52      0.5296      0.5296       93   
Optimization terminated normally: 
  Convergence detected: absolute parameter change was below tolerance
Initial log joint probability = -23.5879
    Iter      log prob        ||dx||      ||grad||       alpha      alpha0  # evals  Notes 
      99       7030.82   0.000105723       2803.89           1           1      121   
    Iter      log prob        ||dx||      ||grad||       alpha      alpha0  # evals  Notes 
      62       9582.57   2.09477e-07       2636.51   7.384e-11       0.001      131  LS failed, Hessian reset 
     136       7031.72   3.62121e-05       2709.59   1.386e-08       0.001      205  LS failed, Hessian reset 
      67       11813.3   1.42115e-08       2603.94      0.3233           1       97   
Optimization terminated normally: 
  Convergence detected: relative gradient magnitude is below tolerance
      74       9582.57   2.31391e-08       2634.78           1           1      144   
Optimization terminated normally: 
  Convergence detected: relative gradient magnitude is below tolerance
     199        7031.8   8.14916e-09       2709.47      0.1989      0.1989      285   
Optimization terminated normally: 
  Convergence detected: absolute parameter change was below tolerance
      99         14232   2.42695e-07       2759.61           1           1      129   
    Iter      log prob        ||dx||      ||grad||       alpha      alpha0  # evals  Notes 
     105       14232.6   9.30256e-05       2050.83   3.573e-08       0.001      173  LS failed, Hessian reset 
     199         14233   2.72626e-07       2752.56      0.1631           1      289   
    Iter      log prob        ||dx||      ||grad||       alpha      alpha0  # evals  Notes 
     211         14233   3.01886e-08       2079.11           1           1      305   
Optimization terminated normally: 
  Convergence detected: relative gradient magnitude is below tolerance
