[I 2020-10-01 03:38:56,802] Trial 339 finished with value: 0.04104135362310161 and parameters: {'changepoint_prior_scale': 0.0012258947661889501, 'seasonality_prior_scale': 0.22358706480665455, 'holidays_prior_scale': 0.06260698803643204, 'seasonality_mode': 'additive', 'changepoint_range': 0.5723793856810779}. Best is trial 96 with value: 0.038883738900888705.
Initial log joint probability = -28.8311
    Iter      log prob        ||dx||      ||grad||       alpha      alpha0  # evals  Notes 
      98       18912.1   7.35494e-09       3390.43      0.1574      0.1574      127   
Optimization terminated normally: 
  Convergence detected: absolute parameter change was below tolerance
INFO:fbprophet:Making 5 forecasts with cutoffs between 2013-10-07 00:00:00 and 2015-10-18 00:00:00
INFO:fbprophet:Applying in parallel with <concurrent.futures.process.ProcessPoolExecutor object at 0x7fc84dbfdd10>
Initial log joint probability = -8.95172
    Iter      log prob        ||dx||      ||grad||       alpha      alpha0  # evals  Notes 
Initial log joint probability = -12.7302
    Iter      log prob        ||dx||      ||grad||       alpha      alpha0  # evals  Notes 
Initial log joint probability = -15.1549
    Iter      log prob        ||dx||      ||grad||       alpha      alpha0  # evals  Notes 
      82       4677.17    0.00072485       3795.24   1.903e-07       0.001      136  LS failed, Hessian reset 
Initial log joint probability = -18.717
    Iter      log prob        ||dx||      ||grad||       alpha      alpha0  # evals  Notes 
      99       4678.78   1.71379e-06        3398.8      0.1996      0.1996      160   
    Iter      log prob        ||dx||      ||grad||       alpha      alpha0  # evals  Notes 
Initial log joint probability = -23.5879
    Iter      log prob        ||dx||      ||grad||       alpha      alpha0  # evals  Notes 
      69       7028.68   1.84588e-05       3863.18   5.022e-09       0.001      130  LS failed, Hessian reset 
     182        4679.2   5.93894e-09       3704.24      0.3253      0.3253      262   
Optimization terminated normally: 
  Convergence detected: absolute parameter change was below tolerance
      99       7028.97   4.16156e-07        3518.6      0.3473           1      167   
    Iter      log prob        ||dx||      ||grad||       alpha      alpha0  # evals  Notes 
     120       7028.97   6.69562e-09       3428.22       0.444       0.444      190   
Optimization terminated normally: 
  Convergence detected: absolute parameter change was below tolerance
      59       9582.38   3.77527e-06       3418.48   9.319e-10       0.001      125  LS failed, Hessian reset 
      53       11813.2   7.12707e-09       3510.38      0.4497      0.4497       77   
Optimization terminated normally: 
  Convergence detected: absolute parameter change was below tolerance
      79       9582.39   9.46284e-09       3736.01      0.2112      0.2112      155   
Optimization terminated normally: 
  Convergence detected: absolute parameter change was below tolerance
      63       14233.3   5.93939e-05       3680.88   1.883e-08       0.001      130  LS failed, Hessian reset 
      99       14233.5    5.3529e-06       3805.41    0.004983           1      173   
    Iter      log prob        ||dx||      ||grad||       alpha      alpha0  # evals  Notes 
     128       14233.6    2.1117e-08       3552.24      0.8086      0.8086      215   
Optimization terminated normally: 
  Convergence detected: relative gradient magnitude is below tolerance
[I 2020-10-01 03:39:12,721] Trial 340 finished with value: 0.041418063267593584 and parameters: {'changepoint_prior_scale': 0.0013614355894467634, 'seasonality_prior_scale': 0.13437997367014562, 'holidays_prior_scale': 0.12790390614381877, 'seasonality_mode': 'additive', 'changepoint_range': 0.5343207096243515}. Best is trial 96 with value: 0.038883738900888705.
Initial log joint probability = -28.8311
    Iter      log prob        ||dx||      ||grad||       alpha      alpha0  # evals  Notes 
      99       18912.6   4.56489e-08       2951.54      0.4486      0.4486      124   
    Iter      log prob        ||dx||      ||grad||       alpha      alpha0  # evals  Notes 
     104       18912.6   1.09179e-07       2786.38      0.6261      0.6261      130   
Optimization terminated normally: 
  Convergence detected: relative gradient magnitude is below tolerance
INFO:fbprophet:Making 5 forecasts with cutoffs between 2013-10-07 00:00:00 and 2015-10-18 00:00:00
INFO:fbprophet:Applying in parallel with <concurrent.futures.process.ProcessPoolExecutor object at 0x7fc84dbe8390>
Initial log joint probability = -8.95172
    Iter      log prob        ||dx||      ||grad||       alpha      alpha0  # evals  Notes 
Initial log joint probability = -12.7302
    Iter      log prob        ||dx||      ||grad||       alpha      alpha0  # evals  Notes 
Initial log joint probability = -15.1549
    Iter      log prob        ||dx||      ||grad||       alpha      alpha0  # evals  Notes 
Initial log joint probability = -18.717
    Iter      log prob        ||dx||      ||grad||       alpha      alpha0  # evals  Notes 
Initial log joint probability = -23.5879
    Iter      log prob        ||dx||      ||grad||       alpha      alpha0  # evals  Notes 
      80       4679.18   2.14066e-07       2827.02   6.856e-11       0.001      139  LS failed, Hessian reset 
      87       4679.18   8.82157e-09       2834.84      0.3455      0.3455      148   
Optimization terminated normally: 
  Convergence detected: absolute parameter change was below tolerance
      82       7029.56   2.70396e-05       2579.78   8.063e-09       0.001      131  LS failed, Hessian reset 
      99        7029.6   9.21403e-08       2796.81       0.432       0.432      153   
    Iter      log prob        ||dx||      ||grad||       alpha      alpha0  # evals  Notes 
     112        7029.6   7.79114e-09       3061.47      0.2369      0.2369      174   
Optimization terminated normally: 
  Convergence detected: absolute parameter change was below tolerance
      92       9582.51   4.78878e-09       2767.24      0.3773      0.3773      120   
Optimization terminated normally: 
  Convergence detected: absolute parameter change was below tolerance
      59         11813    2.8792e-06       3093.41   9.338e-10       0.001      116  LS failed, Hessian reset 
      79         11813   1.00794e-08        2793.4      0.2833           1      142   
Optimization terminated normally: 
  Convergence detected: relative gradient magnitude is below tolerance
      99       14232.1   1.92455e-05       3094.76           1           1      132   
    Iter      log prob        ||dx||      ||grad||       alpha      alpha0  # evals  Notes 
     137       14232.6   5.64415e-06       3163.11   1.701e-09       0.001      221  LS failed, Hessian reset 
     153       14232.6   2.46124e-06       2942.89   8.048e-10       0.001      272  LS failed, Hessian reset 
     174       14232.6   3.08513e-08       2889.98      0.2733           1      299   
Optimization terminated normally: 
  Convergence detected: relative gradient magnitude is below tolerance
[I 2020-10-01 03:39:29,056] Trial 341 finished with value: 0.04120701897351433 and parameters: {'changepoint_prior_scale': 0.0016365460275933794, 'seasonality_prior_scale': 0.09942369063145175, 'holidays_prior_scale': 2.944196087774814, 'seasonality_mode': 'additive', 'changepoint_range': 0.561615719255433}. Best is trial 96 with value: 0.038883738900888705.
Initial log joint probability = -28.8311
    Iter      log prob        ||dx||      ||grad||       alpha      alpha0  # evals  Notes 
      99       18912.3   4.43466e-07       4052.93      0.2214           1      123   
    Iter      log prob        ||dx||      ||grad||       alpha      alpha0  # evals  Notes 
     163       18912.8   9.26366e-09       4130.65      0.1588      0.1588      203   
Optimization terminated normally: 
  Convergence detected: absolute parameter change was below tolerance
INFO:fbprophet:Making 5 forecasts with cutoffs between 2013-10-07 00:00:00 and 2015-10-18 00:00:00
INFO:fbprophet:Applying in parallel with <concurrent.futures.process.ProcessPoolExecutor object at 0x7fc84dbe8590>
Initial log joint probability = -8.95172
    Iter      log prob        ||dx||      ||grad||       alpha      alpha0  # evals  Notes 
Initial log joint probability = -12.7302
    Iter      log prob        ||dx||      ||grad||       alpha      alpha0  # evals  Notes 
Initial log joint probability = -15.1549
    Iter      log prob        ||dx||      ||grad||       alpha      alpha0  # evals  Notes 
Initial log joint probability = -18.717
    Iter      log prob        ||dx||      ||grad||       alpha      alpha0  # evals  Notes 
Initial log joint probability = -23.5879
    Iter      log prob        ||dx||      ||grad||       alpha      alpha0  # evals  Notes 
      64       4678.96   4.32234e-06       4331.44   9.929e-10       0.001      134  LS failed, Hessian reset 
      90       4678.98   7.25449e-09       4245.99      0.5178      0.5178      165   
Optimization terminated normally: 
  Convergence detected: absolute parameter change was below tolerance
      84       7028.56   2.67241e-05       4429.91   6.261e-09       0.001      150  LS failed, Hessian reset 
      99       7028.64   2.24569e-07       3683.16      0.2612           1      170   
    Iter      log prob        ||dx||      ||grad||       alpha      alpha0  # evals  Notes 
      72       9582.26   2.86482e-06       4251.77   6.606e-10       0.001      129  LS failed, Hessian reset 
      31         11812   0.000286769       4866.55   6.587e-08       0.001       92  LS failed, Hessian reset 
     157       7028.65   7.69681e-09       3787.24      0.2755      0.9263      250   
Optimization terminated normally: 
  Convergence detected: absolute parameter change was below tolerance
      99       9582.27   1.93344e-06       4071.04           1           1      162   
    Iter      log prob        ||dx||      ||grad||       alpha      alpha0  # evals  Notes 
     116       9582.27   7.45798e-09       3616.44      0.3327           1      185   
Optimization terminated normally: 
  Convergence detected: absolute parameter change was below tolerance
      99       11813.1   2.92121e-06       4299.36      0.2879           1      179   
    Iter      log prob        ||dx||      ||grad||       alpha      alpha0  # evals  Notes 
      79       14231.2   3.98211e-05       4468.72   1.547e-08       0.001      143  LS failed, Hessian reset 
     120       11813.1    5.7238e-09       4298.64      0.4409      0.4409      205   
Optimization terminated normally: 
  Convergence detected: absolute parameter change was below tolerance
      99       14231.3    1.2815e-06       2902.33       1.461      0.1461      172   
    Iter      log prob        ||dx||      ||grad||       alpha      alpha0  # evals  Notes 
     193       14233.7     1.047e-08       4220.02      0.3118           1      292   
Optimization terminated normally: 
  Convergence detected: relative gradient magnitude is below tolerance
[I 2020-10-01 03:39:45,004] Trial 342 finished with value: 0.04126559238321172 and parameters: {'changepoint_prior_scale': 0.001160346710429575, 'seasonality_prior_scale': 0.3616019115156629, 'holidays_prior_scale': 0.11485387037329907, 'seasonality_mode': 'additive', 'changepoint_range': 0.5222182922993927}. Best is trial 96 with value: 0.038883738900888705.
Initial log joint probability = -28.8311
    Iter      log prob        ||dx||      ||grad||       alpha      alpha0  # evals  Notes 
      99         18912   1.34619e-06       3522.15      0.4494      0.4494      118   
    Iter      log prob        ||dx||      ||grad||       alpha      alpha0  # evals  Notes 
     156       18912.2   1.47269e-08       2985.32       0.278           1      185   
Optimization terminated normally: 
  Convergence detected: relative gradient magnitude is below tolerance
INFO:fbprophet:Making 5 forecasts with cutoffs between 2013-10-07 00:00:00 and 2015-10-18 00:00:00
INFO:fbprophet:Applying in parallel with <concurrent.futures.process.ProcessPoolExecutor object at 0x7fc84dc25e50>
Initial log joint probability = -8.95172
    Iter      log prob        ||dx||      ||grad||       alpha      alpha0  # evals  Notes 
Initial log joint probability = -12.7302
    Iter      log prob        ||dx||      ||grad||       alpha      alpha0  # evals  Notes 
Initial log joint probability = -15.1549
    Iter      log prob        ||dx||      ||grad||       alpha      alpha0  # evals  Notes 
Initial log joint probability = -18.717
    Iter      log prob        ||dx||      ||grad||       alpha      alpha0  # evals  Notes 
Initial log joint probability = -23.5879
    Iter      log prob        ||dx||      ||grad||       alpha      alpha0  # evals  Notes 
      80       4678.81   5.58719e-09       3348.71      0.2591      0.2591      101   
Optimization terminated normally: 
  Convergence detected: absolute parameter change was below tolerance
      99       7029.42   1.68482e-07       3273.34      0.3862      0.3862      125   
    Iter      log prob        ||dx||      ||grad||       alpha      alpha0  # evals  Notes 
      67       9582.43   4.18566e-09       3538.33      0.2042      0.2042       94   
Optimization terminated normally: 
  Convergence detected: absolute parameter change was below tolerance
     140       7029.45   8.74635e-09       3486.36      0.4433      0.4433      177   
Optimization terminated normally: 
  Convergence detected: absolute parameter change was below tolerance
      54       11813.3   6.61477e-09       3506.65      0.1361           1       78   
Optimization terminated normally: 
  Convergence detected: absolute parameter change was below tolerance
      99       14233.3   1.07661e-06        3699.5           1           1      130   
    Iter      log prob        ||dx||      ||grad||       alpha      alpha0  # evals  Notes 
     154       14233.6   1.08825e-06       3305.17    2.85e-10       0.001      232  LS failed, Hessian reset 
     177       14233.6   8.02664e-09        3473.2      0.6009      0.6009      260   
Optimization terminated normally: 
  Convergence detected: absolute parameter change was below tolerance
[I 2020-10-01 03:40:00,681] Trial 343 finished with value: 0.04090619299782817 and parameters: {'changepoint_prior_scale': 0.0013761908983056495, 'seasonality_prior_scale': 0.2511100877761618, 'holidays_prior_scale': 0.25208745204793803, 'seasonality_mode': 'additive', 'changepoint_range': 0.5468498395941055}. Best is trial 96 with value: 0.038883738900888705.
Initial log joint probability = -28.8311
    Iter      log prob        ||dx||      ||grad||       alpha      alpha0  # evals  Notes 
      99       18912.3   0.000107912       3955.73       0.327       0.327      134   
    Iter      log prob        ||dx||      ||grad||       alpha      alpha0  # evals  Notes 
     199       18912.8   7.00257e-09       4741.58      0.2833           1      258   
Optimization terminated normally: 
  Convergence detected: absolute parameter change was below tolerance
INFO:fbprophet:Making 5 forecasts with cutoffs between 2013-10-07 00:00:00 and 2015-10-18 00:00:00
INFO:fbprophet:Applying in parallel with <concurrent.futures.process.ProcessPoolExecutor object at 0x7fc84dc0a190>
Initial log joint probability = -8.95172
    Iter      log prob        ||dx||      ||grad||       alpha      alpha0  # evals  Notes 
Initial log joint probability = -12.7302
    Iter      log prob        ||dx||      ||grad||       alpha      alpha0  # evals  Notes 
Initial log joint probability = -15.1549
    Iter      log prob        ||dx||      ||grad||       alpha      alpha0  # evals  Notes 
Initial log joint probability = -18.717
    Iter      log prob        ||dx||      ||grad||       alpha      alpha0  # evals  Notes 
Initial log joint probability = -23.5879
    Iter      log prob        ||dx||      ||grad||       alpha      alpha0  # evals  Notes 
      68       4674.47    0.00095243       5549.68   1.933e-07       0.001      161  LS failed, Hessian reset 
      99       4678.09   3.19396e-05       4826.85           1           1      197   
    Iter      log prob        ||dx||      ||grad||       alpha      alpha0  # evals  Notes 
      99        7028.2   9.67472e-08        4768.7           1           1      123   
    Iter      log prob        ||dx||      ||grad||       alpha      alpha0  # evals  Notes 
     104        7028.2   9.58208e-09       4737.75      0.4098      0.4098      128   
Optimization terminated normally: 
  Convergence detected: absolute parameter change was below tolerance
      54       9582.13   9.91779e-09       4434.05       0.458       0.458       79   
Optimization terminated normally: 
  Convergence detected: absolute parameter change was below tolerance
     145       4679.23   8.83683e-09        4944.4      0.5277      0.5277      250   
Optimization terminated normally: 
  Convergence detected: absolute parameter change was below tolerance
      71       11812.9   7.54971e-09       4905.64      0.4709      0.4709      103   
Optimization terminated normally: 
  Convergence detected: absolute parameter change was below tolerance
      99       14232.6   5.92314e-08       4647.04      0.4948      0.4948      136   
    Iter      log prob        ||dx||      ||grad||       alpha      alpha0  # evals  Notes 
     113       14232.6   1.04097e-07        4941.8    2.25e-11       0.001      192  LS failed, Hessian reset 
     116       14232.6   8.16632e-09       4912.92      0.2274      0.2274      196   
Optimization terminated normally: 
  Convergence detected: absolute parameter change was below tolerance
