[I 2020-10-01 03:49:10,813] Trial 379 finished with value: 0.040936051656615985 and parameters: {'changepoint_prior_scale': 0.0010048959975324666, 'seasonality_prior_scale': 0.37246211440195326, 'holidays_prior_scale': 0.9715792223307705, 'seasonality_mode': 'additive', 'changepoint_range': 0.5419594289485649}. Best is trial 96 with value: 0.038883738900888705.
Initial log joint probability = -28.8311
    Iter      log prob        ||dx||      ||grad||       alpha      alpha0  # evals  Notes 
      99       18912.3   8.24047e-05        4225.6           1           1      117   
    Iter      log prob        ||dx||      ||grad||       alpha      alpha0  # evals  Notes 
     153       18912.6   2.91975e-07       4449.51   6.099e-11       0.001      231  LS failed, Hessian reset 
     165       18912.6   5.50637e-09       4642.07      0.2671      0.2671      245   
Optimization terminated normally: 
  Convergence detected: absolute parameter change was below tolerance
INFO:fbprophet:Making 5 forecasts with cutoffs between 2013-10-07 00:00:00 and 2015-10-18 00:00:00
INFO:fbprophet:Applying in parallel with <concurrent.futures.process.ProcessPoolExecutor object at 0x7fc84dcaa710>
Initial log joint probability = -8.95172
    Iter      log prob        ||dx||      ||grad||       alpha      alpha0  # evals  Notes 
Initial log joint probability = -12.7302
    Iter      log prob        ||dx||      ||grad||       alpha      alpha0  # evals  Notes 
Initial log joint probability = -15.1549
    Iter      log prob        ||dx||      ||grad||       alpha      alpha0  # evals  Notes 
Initial log joint probability = -18.717
    Iter      log prob        ||dx||      ||grad||       alpha      alpha0  # evals  Notes 
      61       4678.92   7.42885e-09       4441.36      0.2801      0.2801       83   
Optimization terminated normally: 
  Convergence detected: absolute parameter change was below tolerance
Initial log joint probability = -23.5879
    Iter      log prob        ||dx||      ||grad||       alpha      alpha0  # evals  Notes 
      99       7027.79   2.44911e-08        4069.7      0.6723      0.6723      130   
    Iter      log prob        ||dx||      ||grad||       alpha      alpha0  # evals  Notes 
     102       7027.79    4.9595e-09       4507.04      0.3897      0.3897      135   
Optimization terminated normally: 
  Convergence detected: absolute parameter change was below tolerance
      84       9582.22   7.39957e-09        3786.8      0.5397      0.5397      112   
Optimization terminated normally: 
  Convergence detected: absolute parameter change was below tolerance
      69       11812.9   9.48943e-09       4491.32      0.2091      0.2091       99   
Optimization terminated normally: 
  Convergence detected: absolute parameter change was below tolerance
      99       14232.8   3.00183e-05       5165.28           1           1      126   
    Iter      log prob        ||dx||      ||grad||       alpha      alpha0  # evals  Notes 
     144       14233.3   7.71392e-09       4215.19      0.3214      0.3214      187   
Optimization terminated normally: 
  Convergence detected: absolute parameter change was below tolerance
[I 2020-10-01 03:49:25,921] Trial 380 finished with value: 0.04112062194229792 and parameters: {'changepoint_prior_scale': 0.0011234287444103104, 'seasonality_prior_scale': 0.07561830289266706, 'holidays_prior_scale': 4.624873261630406, 'seasonality_mode': 'additive', 'changepoint_range': 0.5287224224590665}. Best is trial 96 with value: 0.038883738900888705.
Initial log joint probability = -28.8311
    Iter      log prob        ||dx||      ||grad||       alpha      alpha0  # evals  Notes 
      99       18912.9   2.59381e-07       2664.76      0.6937      0.6937      128   
    Iter      log prob        ||dx||      ||grad||       alpha      alpha0  # evals  Notes 
     112       18912.9   1.81638e-08       2757.98      0.2776      0.9636      146   
Optimization terminated normally: 
  Convergence detected: relative gradient magnitude is below tolerance
INFO:fbprophet:Making 5 forecasts with cutoffs between 2013-10-07 00:00:00 and 2015-10-18 00:00:00
INFO:fbprophet:Applying in parallel with <concurrent.futures.process.ProcessPoolExecutor object at 0x7fc84dbf9e10>
Initial log joint probability = -8.95172
    Iter      log prob        ||dx||      ||grad||       alpha      alpha0  # evals  Notes 
Initial log joint probability = -12.7302
    Iter      log prob        ||dx||      ||grad||       alpha      alpha0  # evals  Notes 
Initial log joint probability = -15.1549
    Iter      log prob        ||dx||      ||grad||       alpha      alpha0  # evals  Notes 
Initial log joint probability = -18.717
    Iter      log prob        ||dx||      ||grad||       alpha      alpha0  # evals  Notes 
Initial log joint probability = -23.5879
    Iter      log prob        ||dx||      ||grad||       alpha      alpha0  # evals  Notes 
      51       4679.27   9.10222e-06       2880.32   2.864e-09       0.001      105  LS failed, Hessian reset 
      84       4679.32   5.78757e-09       2987.76      0.3671      0.3671      148   
Optimization terminated normally: 
  Convergence detected: absolute parameter change was below tolerance
      99       7029.62   3.81784e-05       3801.52    0.006888           1      126   
    Iter      log prob        ||dx||      ||grad||       alpha      alpha0  # evals  Notes 
      65       9582.44    5.1176e-09       2506.48       0.288       0.288       90   
Optimization terminated normally: 
  Convergence detected: absolute parameter change was below tolerance
      57       11813.2   4.33572e-09        3099.7      0.1882      0.1882       87   
Optimization terminated normally: 
  Convergence detected: absolute parameter change was below tolerance
     176       7031.93   6.23656e-07       2978.47   2.056e-10       0.001      262  LS failed, Hessian reset 
     191       7031.93   5.35065e-09       3027.67      0.2919      0.2919      283   
Optimization terminated normally: 
  Convergence detected: absolute parameter change was below tolerance
      99         14233    2.9655e-06       2472.48       2.965      0.2965      133   
    Iter      log prob        ||dx||      ||grad||       alpha      alpha0  # evals  Notes 
     130         14233   1.95057e-08       1730.41      0.3788      0.3788      175   
Optimization terminated normally: 
  Convergence detected: relative gradient magnitude is below tolerance
[I 2020-10-01 03:49:41,575] Trial 381 finished with value: 0.04148908209951925 and parameters: {'changepoint_prior_scale': 0.0016464946619409123, 'seasonality_prior_scale': 0.10193108599937532, 'holidays_prior_scale': 0.14094302615455317, 'seasonality_mode': 'additive', 'changepoint_range': 0.555066525534102}. Best is trial 96 with value: 0.038883738900888705.
Initial log joint probability = -28.8311
    Iter      log prob        ||dx||      ||grad||       alpha      alpha0  # evals  Notes 
      99       18912.9   1.43426e-06       3283.87           1           1      125   
    Iter      log prob        ||dx||      ||grad||       alpha      alpha0  # evals  Notes 
     133       18912.9   2.03436e-08       3359.42       0.263           1      168   
Optimization terminated normally: 
  Convergence detected: relative gradient magnitude is below tolerance
INFO:fbprophet:Making 5 forecasts with cutoffs between 2013-10-07 00:00:00 and 2015-10-18 00:00:00
INFO:fbprophet:Applying in parallel with <concurrent.futures.process.ProcessPoolExecutor object at 0x7fc84dca4110>
Initial log joint probability = -8.95172
    Iter      log prob        ||dx||      ||grad||       alpha      alpha0  # evals  Notes 
Initial log joint probability = -12.7302
    Iter      log prob        ||dx||      ||grad||       alpha      alpha0  # evals  Notes 
Initial log joint probability = -15.1549
    Iter      log prob        ||dx||      ||grad||       alpha      alpha0  # evals  Notes 
Initial log joint probability = -18.717
    Iter      log prob        ||dx||      ||grad||       alpha      alpha0  # evals  Notes 
Initial log joint probability = -23.5879
    Iter      log prob        ||dx||      ||grad||       alpha      alpha0  # evals  Notes 
      79       4679.13   1.76315e-05       3717.58   4.796e-09       0.001      140  LS failed, Hessian reset 
      99       4679.16   8.01892e-08       3134.73       1.696      0.1696      168   
    Iter      log prob        ||dx||      ||grad||       alpha      alpha0  # evals  Notes 
     106       4679.16   7.94377e-09       3519.89           1           1      177   
Optimization terminated normally: 
  Convergence detected: absolute parameter change was below tolerance
      77       7028.86   6.59291e-05       3581.51   1.862e-08       0.001      132  LS failed, Hessian reset 
      99          7029   3.83447e-07       3285.88      0.9662      0.9662      158   
    Iter      log prob        ||dx||      ||grad||       alpha      alpha0  # evals  Notes 
     118       7029.01   8.98351e-09       2902.65       0.802       0.802      181   
Optimization terminated normally: 
  Convergence detected: absolute parameter change was below tolerance
      94       9582.56   8.21691e-09       3473.81      0.2503      0.2503      121   
Optimization terminated normally: 
  Convergence detected: absolute parameter change was below tolerance
      42       11811.8   0.000229889       3478.62   6.918e-08       0.001      104  LS failed, Hessian reset 
      87       11813.3   1.09392e-08       3574.25      0.3624           1      159   
Optimization terminated normally: 
  Convergence detected: relative gradient magnitude is below tolerance
      99       14233.6   3.39883e-06       3437.15      0.6641      0.6641      124   
    Iter      log prob        ||dx||      ||grad||       alpha      alpha0  # evals  Notes 
     125       14233.6   9.90305e-09       3562.18      0.2575      0.2575      158   
Optimization terminated normally: 
  Convergence detected: absolute parameter change was below tolerance
[I 2020-10-01 03:49:57,198] Trial 382 finished with value: 0.04083255710924958 and parameters: {'changepoint_prior_scale': 0.0013766182713811934, 'seasonality_prior_scale': 0.498067085603195, 'holidays_prior_scale': 0.24305210854519074, 'seasonality_mode': 'additive', 'changepoint_range': 0.533831504940234}. Best is trial 96 with value: 0.038883738900888705.
Initial log joint probability = -28.8311
    Iter      log prob        ||dx||      ||grad||       alpha      alpha0  # evals  Notes 
      99       18912.8   1.44528e-05        3548.7           1           1      118   
    Iter      log prob        ||dx||      ||grad||       alpha      alpha0  # evals  Notes 
     133       18912.8    2.8906e-07       3878.63    7.02e-11       0.001      200  LS failed, Hessian reset 
     144       18912.9   5.80761e-09       3703.05      0.1732      0.1732      215   
Optimization terminated normally: 
  Convergence detected: absolute parameter change was below tolerance
INFO:fbprophet:Making 5 forecasts with cutoffs between 2013-10-07 00:00:00 and 2015-10-18 00:00:00
INFO:fbprophet:Applying in parallel with <concurrent.futures.process.ProcessPoolExecutor object at 0x7fc84dcafb10>
Initial log joint probability = -8.95172
    Iter      log prob        ||dx||      ||grad||       alpha      alpha0  # evals  Notes 
Initial log joint probability = -12.7302
    Iter      log prob        ||dx||      ||grad||       alpha      alpha0  # evals  Notes 
Initial log joint probability = -15.1549
    Iter      log prob        ||dx||      ||grad||       alpha      alpha0  # evals  Notes 
Initial log joint probability = -18.717
      53       4678.36   3.23977e-09       4026.15      0.2513      0.2513       72   
Optimization terminated normally: 
  Convergence detected: absolute parameter change was below tolerance
    Iter      log prob        ||dx||      ||grad||       alpha      alpha0  # evals  Notes 
Initial log joint probability = -23.5879
    Iter      log prob        ||dx||      ||grad||       alpha      alpha0  # evals  Notes 
      84       7028.67   2.79412e-05       3923.71   8.067e-09       0.001      148  LS failed, Hessian reset 
      99       7028.75   1.28836e-06       3167.78      0.2398           1      166   
    Iter      log prob        ||dx||      ||grad||       alpha      alpha0  # evals  Notes 
     129       7028.76   9.39427e-09       3721.68       0.716       0.716      207   
Optimization terminated normally: 
  Convergence detected: absolute parameter change was below tolerance
      62       11813.2   7.46789e-09       4093.31      0.3342      0.3342       92   
Optimization terminated normally: 
  Convergence detected: absolute parameter change was below tolerance
      79       9582.33   1.94824e-06       3812.24   5.115e-10       0.001      152  LS failed, Hessian reset 
      99       9582.34   2.35612e-07        3648.6      0.7984      0.7984      175   
    Iter      log prob        ||dx||      ||grad||       alpha      alpha0  # evals  Notes 
     112       9582.34   8.38915e-09       4095.83      0.5277      0.5277      193   
Optimization terminated normally: 
  Convergence detected: absolute parameter change was below tolerance
      99       14231.6    4.9796e-05       3796.28       0.528       0.528      137   
    Iter      log prob        ||dx||      ||grad||       alpha      alpha0  # evals  Notes 
     143       14231.7   1.25009e-08       3807.97      0.2204           1      189   
Optimization terminated normally: 
  Convergence detected: relative gradient magnitude is below tolerance
[I 2020-10-01 03:50:12,744] Trial 383 finished with value: 0.041482654900297275 and parameters: {'changepoint_prior_scale': 0.0012429534484947383, 'seasonality_prior_scale': 0.13427370678409173, 'holidays_prior_scale': 0.170428895571572, 'seasonality_mode': 'additive', 'changepoint_range': 0.5213037656625775}. Best is trial 96 with value: 0.038883738900888705.
Initial log joint probability = -28.8311
    Iter      log prob        ||dx||      ||grad||       alpha      alpha0  # evals  Notes 
      99       18912.9   1.00014e-07       2342.18      0.5331      0.5331      121   
    Iter      log prob        ||dx||      ||grad||       alpha      alpha0  # evals  Notes 
     111       18912.9   2.21581e-08       2029.79       0.333           1      137   
Optimization terminated normally: 
  Convergence detected: relative gradient magnitude is below tolerance
INFO:fbprophet:Making 5 forecasts with cutoffs between 2013-10-07 00:00:00 and 2015-10-18 00:00:00
INFO:fbprophet:Applying in parallel with <concurrent.futures.process.ProcessPoolExecutor object at 0x7fc84dca4210>
Initial log joint probability = -8.95172
    Iter      log prob        ||dx||      ||grad||       alpha      alpha0  # evals  Notes 
Initial log joint probability = -12.7302
    Iter      log prob        ||dx||      ||grad||       alpha      alpha0  # evals  Notes 
      72       4679.13   5.83289e-09       2364.54      0.5155      0.5155       97   
Optimization terminated normally: 
  Convergence detected: absolute parameter change was below tolerance
Initial log joint probability = -15.1549
    Iter      log prob        ||dx||      ||grad||       alpha      alpha0  # evals  Notes 
Initial log joint probability = -18.717
    Iter      log prob        ||dx||      ||grad||       alpha      alpha0  # evals  Notes 
Initial log joint probability = -23.5879
    Iter      log prob        ||dx||      ||grad||       alpha      alpha0  # evals  Notes 
      99       7030.18   3.12983e-07       2398.33      0.4795      0.4795      117   
    Iter      log prob        ||dx||      ||grad||       alpha      alpha0  # evals  Notes 
     109       7030.34   3.84485e-05        2238.2    1.32e-08       0.001      177  LS failed, Hessian reset 
      42       9582.48   8.13037e-06       2544.61   2.927e-09       0.001      103  LS failed, Hessian reset 
     147       7030.44   7.81446e-09       2508.05      0.2466      0.2466      225   
Optimization terminated normally: 
  Convergence detected: absolute parameter change was below tolerance
      66       9582.49   7.03506e-09       2560.98      0.5982      0.5982      136   
Optimization terminated normally: 
  Convergence detected: absolute parameter change was below tolerance
      46       11812.8   4.24088e-05       2618.82   1.775e-08       0.001      117  LS failed, Hessian reset 
      99       14232.7   5.53818e-06       2138.84      0.2601           1      138   
    Iter      log prob        ||dx||      ||grad||       alpha      alpha0  # evals  Notes 
      99         11813   1.08148e-06       2407.56           1           1      190   
    Iter      log prob        ||dx||      ||grad||       alpha      alpha0  # evals  Notes 
     109       11813.1   3.22672e-05       2752.31   1.337e-08       0.001      248  LS failed, Hessian reset 
     113       14232.7    7.2099e-06       2429.22   2.951e-09       0.001      199  LS failed, Hessian reset 
     141       11813.2   1.89803e-08       2455.96      0.2768           1      292   
Optimization terminated normally: 
  Convergence detected: relative gradient magnitude is below tolerance
     145       14232.7   4.37016e-08       2214.21           1           1      235   
Optimization terminated normally: 
  Convergence detected: relative gradient magnitude is below tolerance
[I 2020-10-01 03:50:28,398] Trial 384 finished with value: 0.040951004227920446 and parameters: {'changepoint_prior_scale': 0.001948758222548522, 'seasonality_prior_scale': 0.08929897590975418, 'holidays_prior_scale': 0.19868395678427567, 'seasonality_mode': 'additive', 'changepoint_range': 0.7992197521061244}. Best is trial 96 with value: 0.038883738900888705.
Initial log joint probability = -28.8311
    Iter      log prob        ||dx||      ||grad||       alpha      alpha0  # evals  Notes 
      99       18912.4   4.13847e-05       4737.14      0.3306           1      128   
    Iter      log prob        ||dx||      ||grad||       alpha      alpha0  # evals  Notes 
     138       18912.6   3.09274e-08       4651.47           1           1      174   
Optimization terminated normally: 
  Convergence detected: relative gradient magnitude is below tolerance
INFO:fbprophet:Making 5 forecasts with cutoffs between 2013-10-07 00:00:00 and 2015-10-18 00:00:00
INFO:fbprophet:Applying in parallel with <concurrent.futures.process.ProcessPoolExecutor object at 0x7fc84dc72550>
Initial log joint probability = -8.95172
    Iter      log prob        ||dx||      ||grad||       alpha      alpha0  # evals  Notes 
Initial log joint probability = -12.7302
    Iter      log prob        ||dx||      ||grad||       alpha      alpha0  # evals  Notes 
Initial log joint probability = -15.1549
    Iter      log prob        ||dx||      ||grad||       alpha      alpha0  # evals  Notes 
Initial log joint probability = -18.717
    Iter      log prob        ||dx||      ||grad||       alpha      alpha0  # evals  Notes 
      60       4678.29   6.96268e-09       4475.76      0.5964      0.5964       81   
Optimization terminated normally: 
  Convergence detected: absolute parameter change was below tolerance
Initial log joint probability = -23.5879
    Iter      log prob        ||dx||      ||grad||       alpha      alpha0  # evals  Notes 
      86       7027.71   1.74659e-06       4078.44   4.302e-10       0.001      152  LS failed, Hessian reset 
      99       7027.73   2.83814e-07       3977.88      0.6521      0.6521      168   
    Iter      log prob        ||dx||      ||grad||       alpha      alpha0  # evals  Notes 
      86       9582.63   1.99481e-09       4514.04     0.05481     0.05481      115   
Optimization terminated normally: 
  Convergence detected: absolute parameter change was below tolerance
     116       7027.73   5.27537e-09       4222.55       0.523       0.523      187   
Optimization terminated normally: 
  Convergence detected: absolute parameter change was below tolerance
      36         11811   0.000239869       4620.62    5.47e-08       0.001       98  LS failed, Hessian reset 
      89       14232.2   5.05641e-09       4163.73      0.4743      0.4743      116   
Optimization terminated normally: 
  Convergence detected: absolute parameter change was below tolerance
      99       11812.2   1.80354e-07        4558.3           1           1      176   
    Iter      log prob        ||dx||      ||grad||       alpha      alpha0  # evals  Notes 
     118       11812.2    1.0447e-08       4503.69        0.38           1      199   
Optimization terminated normally: 
  Convergence detected: relative gradient magnitude is below tolerance
