[I 2020-10-01 02:45:29,342] Trial 129 finished with value: 0.04170362063477811 and parameters: {'changepoint_prior_scale': 0.001805037600424452, 'seasonality_prior_scale': 0.08004521011328194, 'holidays_prior_scale': 0.10573438581138708, 'seasonality_mode': 'additive', 'changepoint_range': 0.5800346534541846}. Best is trial 96 with value: 0.038883738900888705.
Initial log joint probability = -28.8311
    Iter      log prob        ||dx||      ||grad||       alpha      alpha0  # evals  Notes 
      99       18912.8   1.84949e-06       2957.95      0.4682      0.4682      114   
    Iter      log prob        ||dx||      ||grad||       alpha      alpha0  # evals  Notes 
     130       18912.9   5.02958e-08        3391.1      0.2906           1      157   
Optimization terminated normally: 
  Convergence detected: relative gradient magnitude is below tolerance
INFO:fbprophet:Making 5 forecasts with cutoffs between 2013-10-07 00:00:00 and 2015-10-18 00:00:00
INFO:fbprophet:Applying in parallel with <concurrent.futures.process.ProcessPoolExecutor object at 0x7fc88e65e0d0>
Initial log joint probability = -8.95172
    Iter      log prob        ||dx||      ||grad||       alpha      alpha0  # evals  Notes 
Initial log joint probability = -12.7302
    Iter      log prob        ||dx||      ||grad||       alpha      alpha0  # evals  Notes 
Initial log joint probability = -15.1549
    Iter      log prob        ||dx||      ||grad||       alpha      alpha0  # evals  Notes 
Initial log joint probability = -18.717
    Iter      log prob        ||dx||      ||grad||       alpha      alpha0  # evals  Notes 
Initial log joint probability = -23.5879
    Iter      log prob        ||dx||      ||grad||       alpha      alpha0  # evals  Notes 
      79       4679.26   7.29029e-06       3322.72   2.062e-09       0.001      149  LS failed, Hessian reset 
      99       4679.28   7.72438e-09       3374.78      0.2509      0.2509      175   
Optimization terminated normally: 
  Convergence detected: absolute parameter change was below tolerance
      99       7029.08   1.12129e-06       3113.13           1           1      130   
    Iter      log prob        ||dx||      ||grad||       alpha      alpha0  # evals  Notes 
      60       9582.38   9.72547e-09       3501.14      0.4813      0.4813       80   
Optimization terminated normally: 
  Convergence detected: absolute parameter change was below tolerance
     114       7029.08   9.16446e-09       3104.09      0.2626      0.2626      150   
Optimization terminated normally: 
  Convergence detected: absolute parameter change was below tolerance
      59       11813.1   8.85125e-09       3164.13      0.4647      0.4647       91   
Optimization terminated normally: 
  Convergence detected: absolute parameter change was below tolerance
      99       14232.8   4.79525e-05       3273.66      0.4301           1      123   
    Iter      log prob        ||dx||      ||grad||       alpha      alpha0  # evals  Notes 
     133       14232.9   1.90341e-06       3363.32   5.514e-10       0.001      201  LS failed, Hessian reset 
     150       14232.9   5.92704e-09       3115.48       0.262       0.262      228   
Optimization terminated normally: 
  Convergence detected: absolute parameter change was below tolerance
[I 2020-10-01 02:45:43,965] Trial 130 finished with value: 0.041570504163029674 and parameters: {'changepoint_prior_scale': 0.0014511294422062128, 'seasonality_prior_scale': 0.10896594711641507, 'holidays_prior_scale': 0.024484196814527574, 'seasonality_mode': 'additive', 'changepoint_range': 0.6205657984703302}. Best is trial 96 with value: 0.038883738900888705.
Initial log joint probability = -28.8311
    Iter      log prob        ||dx||      ||grad||       alpha      alpha0  # evals  Notes 
      99       18911.5   0.000119276        4703.4           1           1      128   
    Iter      log prob        ||dx||      ||grad||       alpha      alpha0  # evals  Notes 
     139       18911.6   4.46606e-09       5364.24      0.2969      0.2969      175   
Optimization terminated normally: 
  Convergence detected: absolute parameter change was below tolerance
INFO:fbprophet:Making 5 forecasts with cutoffs between 2013-10-07 00:00:00 and 2015-10-18 00:00:00
INFO:fbprophet:Applying in parallel with <concurrent.futures.process.ProcessPoolExecutor object at 0x7fc88e6501d0>
Initial log joint probability = -8.95172
    Iter      log prob        ||dx||      ||grad||       alpha      alpha0  # evals  Notes 
Initial log joint probability = -12.7302
    Iter      log prob        ||dx||      ||grad||       alpha      alpha0  # evals  Notes 
Initial log joint probability = -15.1549
    Iter      log prob        ||dx||      ||grad||       alpha      alpha0  # evals  Notes 
Initial log joint probability = -18.717
    Iter      log prob        ||dx||      ||grad||       alpha      alpha0  # evals  Notes 
      64       4678.57   6.61202e-09       4736.42      0.1879      0.1879       89   
Optimization terminated normally: 
  Convergence detected: absolute parameter change was below tolerance
Initial log joint probability = -23.5879
    Iter      log prob        ||dx||      ||grad||       alpha      alpha0  # evals  Notes 
      99       7028.33   1.71044e-07       4432.68     0.08704      0.4596      143   
    Iter      log prob        ||dx||      ||grad||       alpha      alpha0  # evals  Notes 
      54       11812.7   3.25189e-09       4748.78      0.2061      0.2061       78   
Optimization terminated normally: 
  Convergence detected: absolute parameter change was below tolerance
      84       9582.17    2.9595e-09       4630.96      0.4282      0.4282      114   
Optimization terminated normally: 
  Convergence detected: absolute parameter change was below tolerance
     112       7028.34   4.26975e-07       4851.29   8.732e-11       0.001      199  LS failed, Hessian reset 
     132       7028.34   9.10033e-09       4692.66      0.5935      0.5935      223   
Optimization terminated normally: 
  Convergence detected: absolute parameter change was below tolerance
      99       14233.2   2.98769e-07       4823.64      0.3492           1      130   
    Iter      log prob        ||dx||      ||grad||       alpha      alpha0  # evals  Notes 
     118       14233.2   5.27124e-09       4823.54      0.4799      0.4799      154   
Optimization terminated normally: 
  Convergence detected: absolute parameter change was below tolerance
[I 2020-10-01 02:45:59,253] Trial 131 finished with value: 0.040838910385136144 and parameters: {'changepoint_prior_scale': 0.001002393486489326, 'seasonality_prior_scale': 0.1264188752620799, 'holidays_prior_scale': 0.0843022101655514, 'seasonality_mode': 'additive', 'changepoint_range': 0.5692995628279924}. Best is trial 96 with value: 0.038883738900888705.
Initial log joint probability = -28.8311
    Iter      log prob        ||dx||      ||grad||       alpha      alpha0  # evals  Notes 
      99       18912.6   2.05017e-06          4285      0.3077           1      127   
    Iter      log prob        ||dx||      ||grad||       alpha      alpha0  # evals  Notes 
     122       18912.6   8.74837e-09       4465.46      0.5351      0.5351      157   
Optimization terminated normally: 
  Convergence detected: absolute parameter change was below tolerance
INFO:fbprophet:Making 5 forecasts with cutoffs between 2013-10-07 00:00:00 and 2015-10-18 00:00:00
INFO:fbprophet:Applying in parallel with <concurrent.futures.process.ProcessPoolExecutor object at 0x7fc88e6a6290>
Initial log joint probability = -8.95172
    Iter      log prob        ||dx||      ||grad||       alpha      alpha0  # evals  Notes 
Initial log joint probability = -12.7302
    Iter      log prob        ||dx||      ||grad||       alpha      alpha0  # evals  Notes 
Initial log joint probability = -15.1549
    Iter      log prob        ||dx||      ||grad||       alpha      alpha0  # evals  Notes 
Initial log joint probability = -18.717
    Iter      log prob        ||dx||      ||grad||       alpha      alpha0  # evals  Notes 
Initial log joint probability = -23.5879
    Iter      log prob        ||dx||      ||grad||       alpha      alpha0  # evals  Notes 
      99       4679.09   1.52749e-06       4245.78       0.711       0.711      124   
    Iter      log prob        ||dx||      ||grad||       alpha      alpha0  # evals  Notes 
      55       7027.93    7.5592e-05       4152.06    1.69e-08       0.001      106  LS failed, Hessian reset 
     158       4679.38   5.30802e-09       4394.77      0.4375      0.4375      206   
Optimization terminated normally: 
  Convergence detected: absolute parameter change was below tolerance
      61        9582.1   3.56539e-09       4238.36      0.2113      0.2113       84   
Optimization terminated normally: 
  Convergence detected: absolute parameter change was below tolerance
      99       7028.14   2.18092e-08       3704.94      0.6078      0.6078      160   
    Iter      log prob        ||dx||      ||grad||       alpha      alpha0  # evals  Notes 
      61       11813.1   2.10538e-09        3830.1      0.1966      0.1966       91   
Optimization terminated normally: 
  Convergence detected: absolute parameter change was below tolerance
     122       7028.16   1.17526e-06       4281.47   3.081e-10       0.001      226  LS failed, Hessian reset 
     139       7028.17   1.92103e-09       3916.58     0.06808     0.06808      248   
Optimization terminated normally: 
  Convergence detected: absolute parameter change was below tolerance
      99         14233   2.11569e-05       3815.27      0.6702      0.6702      123   
    Iter      log prob        ||dx||      ||grad||       alpha      alpha0  # evals  Notes 
     136         14233    3.7515e-08        4258.3           1           1      166   
Optimization terminated normally: 
  Convergence detected: relative gradient magnitude is below tolerance
[I 2020-10-01 02:46:14,745] Trial 132 finished with value: 0.0412838231065057 and parameters: {'changepoint_prior_scale': 0.00116205738571048, 'seasonality_prior_scale': 0.12879008446581153, 'holidays_prior_scale': 0.08382879545421738, 'seasonality_mode': 'additive', 'changepoint_range': 0.5943777868825803}. Best is trial 96 with value: 0.038883738900888705.
Initial log joint probability = -28.8311
    Iter      log prob        ||dx||      ||grad||       alpha      alpha0  # evals  Notes 
      99       18912.9   1.62234e-07       3400.61      0.4076           1      123   
    Iter      log prob        ||dx||      ||grad||       alpha      alpha0  # evals  Notes 
     108       18912.9   6.14437e-09       3373.82      0.2072      0.2072      135   
Optimization terminated normally: 
  Convergence detected: absolute parameter change was below tolerance
INFO:fbprophet:Making 5 forecasts with cutoffs between 2013-10-07 00:00:00 and 2015-10-18 00:00:00
INFO:fbprophet:Applying in parallel with <concurrent.futures.process.ProcessPoolExecutor object at 0x7fc88e683b10>
Initial log joint probability = -8.95172
    Iter      log prob        ||dx||      ||grad||       alpha      alpha0  # evals  Notes 
Initial log joint probability = -12.7302
    Iter      log prob        ||dx||      ||grad||       alpha      alpha0  # evals  Notes 
Initial log joint probability = -15.1549
    Iter      log prob        ||dx||      ||grad||       alpha      alpha0  # evals  Notes 
Initial log joint probability = -18.717
    Iter      log prob        ||dx||      ||grad||       alpha      alpha0  # evals  Notes 
Initial log joint probability = -23.5879
    Iter      log prob        ||dx||      ||grad||       alpha      alpha0  # evals  Notes 
      77       4678.98   8.89287e-09        2859.7           1           1      108   
Optimization terminated normally: 
  Convergence detected: absolute parameter change was below tolerance
      75       7028.57   3.04241e-05       2989.04     8.9e-09       0.001      132  LS failed, Hessian reset 
      56       9582.19   4.85911e-09       3474.64      0.3244      0.3244       82   
Optimization terminated normally: 
  Convergence detected: absolute parameter change was below tolerance
      99       7028.73   3.35031e-07       2756.77           1           1      165   
    Iter      log prob        ||dx||      ||grad||       alpha      alpha0  # evals  Notes 
      50       11813.2   3.01852e-09       3177.62      0.1545      0.1545       75   
Optimization terminated normally: 
  Convergence detected: absolute parameter change was below tolerance
     131       7028.73   9.62251e-09       3146.56     0.07038           1      207   
Optimization terminated normally: 
  Convergence detected: absolute parameter change was below tolerance
      99       14233.2   0.000175217       3400.85           1           1      125   
    Iter      log prob        ||dx||      ||grad||       alpha      alpha0  # evals  Notes 
     143       14233.4   8.41498e-09       3370.02      0.5643      0.5643      178   
Optimization terminated normally: 
  Convergence detected: absolute parameter change was below tolerance
[I 2020-10-01 02:46:29,615] Trial 133 finished with value: 0.040981080586045854 and parameters: {'changepoint_prior_scale': 0.0014410699748053264, 'seasonality_prior_scale': 0.09653153920579788, 'holidays_prior_scale': 0.0704444186850888, 'seasonality_mode': 'additive', 'changepoint_range': 0.565237319562337}. Best is trial 96 with value: 0.038883738900888705.
Initial log joint probability = -28.8311
    Iter      log prob        ||dx||      ||grad||       alpha      alpha0  # evals  Notes 
      99       18912.4   2.82458e-05       2549.72           1           1      125   
    Iter      log prob        ||dx||      ||grad||       alpha      alpha0  # evals  Notes 
     182       18912.5    9.1796e-09       2551.64      0.3955      0.3955      227   
Optimization terminated normally: 
  Convergence detected: absolute parameter change was below tolerance
INFO:fbprophet:Making 5 forecasts with cutoffs between 2013-10-07 00:00:00 and 2015-10-18 00:00:00
INFO:fbprophet:Applying in parallel with <concurrent.futures.process.ProcessPoolExecutor object at 0x7fc88e650a50>
Initial log joint probability = -8.95172
    Iter      log prob        ||dx||      ||grad||       alpha      alpha0  # evals  Notes 
Initial log joint probability = -12.7302
    Iter      log prob        ||dx||      ||grad||       alpha      alpha0  # evals  Notes 
Initial log joint probability = -15.1549
    Iter      log prob        ||dx||      ||grad||       alpha      alpha0  # evals  Notes 
Initial log joint probability = -18.717
    Iter      log prob        ||dx||      ||grad||       alpha      alpha0  # evals  Notes 
Initial log joint probability = -23.5879
    Iter      log prob        ||dx||      ||grad||       alpha      alpha0  # evals  Notes 
      99       4679.08   2.62074e-05       3006.58      0.2836           1      124   
    Iter      log prob        ||dx||      ||grad||       alpha      alpha0  # evals  Notes 
     139       4679.14   8.47577e-09       3017.24      0.3774      0.3774      171   
Optimization terminated normally: 
  Convergence detected: absolute parameter change was below tolerance
      99       7029.77   0.000348783       2892.35           1           1      122   
    Iter      log prob        ||dx||      ||grad||       alpha      alpha0  # evals  Notes 
      56       9582.42   8.22944e-09       2847.73      0.7317      0.7317       81   
Optimization terminated normally: 
  Convergence detected: absolute parameter change was below tolerance
     166        7031.9   2.13599e-05       3120.65   6.674e-09       0.001      244  LS failed, Hessian reset 
     191       7031.94   5.19626e-09        3010.5      0.1552      0.7868      280   
Optimization terminated normally: 
  Convergence detected: absolute parameter change was below tolerance
      70       11813.1   2.92936e-09       3017.39      0.1575      0.1575       92   
Optimization terminated normally: 
  Convergence detected: absolute parameter change was below tolerance
      93         14233   4.45844e-08        2865.5           1           1      132   
Optimization terminated normally: 
  Convergence detected: relative gradient magnitude is below tolerance
[I 2020-10-01 02:46:45,374] Trial 134 finished with value: 0.04186627355504807 and parameters: {'changepoint_prior_scale': 0.0016650069314848885, 'seasonality_prior_scale': 0.07557086516337018, 'holidays_prior_scale': 2.308108795173354, 'seasonality_mode': 'additive', 'changepoint_range': 0.582057417380025}. Best is trial 96 with value: 0.038883738900888705.
Initial log joint probability = -28.8311
    Iter      log prob        ||dx||      ||grad||       alpha      alpha0  # evals  Notes 
      99       18912.6   3.81546e-05       3625.82      0.4587      0.4587      122   
    Iter      log prob        ||dx||      ||grad||       alpha      alpha0  # evals  Notes 
     134       18912.7   8.47593e-09       3819.42      0.5805      0.5805      169   
Optimization terminated normally: 
  Convergence detected: absolute parameter change was below tolerance
INFO:fbprophet:Making 5 forecasts with cutoffs between 2013-10-07 00:00:00 and 2015-10-18 00:00:00
INFO:fbprophet:Applying in parallel with <concurrent.futures.process.ProcessPoolExecutor object at 0x7fc88e6a6c90>
Initial log joint probability = -8.95172
    Iter      log prob        ||dx||      ||grad||       alpha      alpha0  # evals  Notes 
Initial log joint probability = -12.7302
    Iter      log prob        ||dx||      ||grad||       alpha      alpha0  # evals  Notes 
Initial log joint probability = -15.1549
    Iter      log prob        ||dx||      ||grad||       alpha      alpha0  # evals  Notes 
Initial log joint probability = -18.717
    Iter      log prob        ||dx||      ||grad||       alpha      alpha0  # evals  Notes 
      57       4678.96   9.80859e-09       3859.25      0.1121      0.1121       75   
Optimization terminated normally: 
  Convergence detected: absolute parameter change was below tolerance
Initial log joint probability = -23.5879
    Iter      log prob        ||dx||      ||grad||       alpha      alpha0  # evals  Notes 
      52       7027.87   9.04172e-05       3962.94   2.186e-08       0.001      101  LS failed, Hessian reset 
      99       7028.44   0.000481558       4386.52           1           1      154   
    Iter      log prob        ||dx||      ||grad||       alpha      alpha0  # evals  Notes 
     101       7028.47   4.51893e-05       4045.71   1.069e-08       0.001      201  LS failed, Hessian reset 
      68       9582.29   2.37499e-07       3991.59    5.87e-11       0.001      141  LS failed, Hessian reset 
      77       9582.29   4.69102e-09       3555.79      0.2181      0.2181      151   
Optimization terminated normally: 
  Convergence detected: absolute parameter change was below tolerance
      78       11813.2   1.61759e-08        3856.6           1           1      114   
Optimization terminated normally: 
  Convergence detected: relative gradient magnitude is below tolerance
     140       7028.61   7.70693e-09       3607.33      0.2841      0.2841      252   
Optimization terminated normally: 
  Convergence detected: absolute parameter change was below tolerance
      99       14233.3    7.9389e-06       3858.08      0.1236           1      127   
    Iter      log prob        ||dx||      ||grad||       alpha      alpha0  # evals  Notes 
     136       14233.3   1.85926e-07       4069.14   4.754e-11       0.001      214  LS failed, Hessian reset 
     144       14233.3   8.00659e-09       3761.75      0.5406      0.5406      225   
Optimization terminated normally: 
  Convergence detected: absolute parameter change was below tolerance
