[I 2020-10-01 02:24:01,367] Trial 45 finished with value: 0.041798052534089185 and parameters: {'changepoint_prior_scale': 0.0025601916096680694, 'seasonality_prior_scale': 0.04920092086024185, 'holidays_prior_scale': 0.7651341616867248, 'seasonality_mode': 'additive', 'changepoint_range': 0.5521424891828939}. Best is trial 3 with value: 0.04098090703811677.
Initial log joint probability = -28.8311
    Iter      log prob        ||dx||      ||grad||       alpha      alpha0  # evals  Notes 
      99       18917.5    0.00159809       332.152      0.2973      0.2973      113   
    Iter      log prob        ||dx||      ||grad||       alpha      alpha0  # evals  Notes 
     199       18918.2   3.48514e-05       74.9222      0.8839      0.8839      238   
    Iter      log prob        ||dx||      ||grad||       alpha      alpha0  # evals  Notes 
     260       18918.3   6.83262e-05       59.7142   1.025e-06       0.001      351  LS failed, Hessian reset 
     299       18918.4   7.08011e-06        56.893       0.661       0.661      404   
    Iter      log prob        ||dx||      ||grad||       alpha      alpha0  # evals  Notes 
     303       18918.4   2.62194e-06       50.5842           1           1      411   
Optimization terminated normally: 
  Convergence detected: relative gradient magnitude is below tolerance
INFO:fbprophet:Making 5 forecasts with cutoffs between 2013-10-07 00:00:00 and 2015-10-18 00:00:00
INFO:fbprophet:Applying in parallel with <concurrent.futures.process.ProcessPoolExecutor object at 0x7fc88e5ecc10>
Initial log joint probability = -8.95172
    Iter      log prob        ||dx||      ||grad||       alpha      alpha0  # evals  Notes 
Initial log joint probability = -12.7302
    Iter      log prob        ||dx||      ||grad||       alpha      alpha0  # evals  Notes 
Initial log joint probability = -15.1549
    Iter      log prob        ||dx||      ||grad||       alpha      alpha0  # evals  Notes 
Initial log joint probability = -18.717
    Iter      log prob        ||dx||      ||grad||       alpha      alpha0  # evals  Notes 
Initial log joint probability = -23.5879
    Iter      log prob        ||dx||      ||grad||       alpha      alpha0  # evals  Notes 
      99       4676.66   3.36426e-05       87.3746      0.5327      0.5327      127   
    Iter      log prob        ||dx||      ||grad||       alpha      alpha0  # evals  Notes 
      99        7035.7     0.0001476       89.2887      0.9103      0.9103      117   
    Iter      log prob        ||dx||      ||grad||       alpha      alpha0  # evals  Notes 
     172       4676.68   8.12308e-06       74.6637   1.207e-07       0.001      253  LS failed, Hessian reset 
     106       7035.75   0.000165734       55.1428   2.569e-06       0.001      160  LS failed, Hessian reset 
     199       4676.68   3.04167e-07       79.1076      0.5057      0.5057      287   
    Iter      log prob        ||dx||      ||grad||       alpha      alpha0  # evals  Notes 
     202       4676.68   4.18654e-07       66.5033      0.3935           1      291   
Optimization terminated normally: 
  Convergence detected: relative gradient magnitude is below tolerance
      99        9581.7    0.00246824        144.09     0.08206           1      123   
    Iter      log prob        ||dx||      ||grad||       alpha      alpha0  # evals  Notes 
      99       11813.5   0.000286055       72.2012      0.9406      0.9406      125   
    Iter      log prob        ||dx||      ||grad||       alpha      alpha0  # evals  Notes 
     168       7035.79   1.92281e-05       65.6353   3.499e-07       0.001      292  LS failed, Hessian reset 
     192       7035.79   4.25422e-07       53.5388      0.8095      0.8095      325   
Optimization terminated normally: 
  Convergence detected: relative gradient magnitude is below tolerance
      99       14235.2     0.0021925       102.903      0.9428      0.9428      118   
    Iter      log prob        ||dx||      ||grad||       alpha      alpha0  # evals  Notes 
     188       9582.04   4.89702e-07        67.419           1           1      234   
Optimization terminated normally: 
  Convergence detected: relative gradient magnitude is below tolerance
     199       11813.9   0.000414188       108.829           1           1      250   
    Iter      log prob        ||dx||      ||grad||       alpha      alpha0  # evals  Notes 
     199       14235.6    0.00143526         65.85      0.4035      0.8182      252   
    Iter      log prob        ||dx||      ||grad||       alpha      alpha0  # evals  Notes 
     299       11814.1   4.50004e-06       49.6209           1           1      381   
    Iter      log prob        ||dx||      ||grad||       alpha      alpha0  # evals  Notes 
     200       14235.6   9.52946e-05       82.5732   1.447e-06       0.001      301  LS failed, Hessian reset 
     323       11814.1   8.68917e-07       68.8866   1.281e-08       0.001      450  LS failed, Hessian reset 
     324       11814.1   7.26781e-07       51.7104           1           1      451   
Optimization terminated normally: 
  Convergence detected: relative gradient magnitude is below tolerance
     259       14235.6   6.99721e-06       45.7153   1.285e-07       0.001      411  LS failed, Hessian reset 
     299       14235.6   5.58491e-05       61.4368       4.227      0.4227      464   
    Iter      log prob        ||dx||      ||grad||       alpha      alpha0  # evals  Notes 
     306       14235.6   1.07797e-05       47.4357   1.876e-07       0.001      509  LS failed, Hessian reset 
     322       14235.6   3.51603e-07       54.7494     0.07085           1      527   
Optimization terminated normally: 
  Convergence detected: relative gradient magnitude is below tolerance
[I 2020-10-01 02:24:19,119] Trial 46 finished with value: 0.05168732600875882 and parameters: {'changepoint_prior_scale': 0.05656715644764895, 'seasonality_prior_scale': 0.014264000398608076, 'holidays_prior_scale': 9.586348974188507, 'seasonality_mode': 'additive', 'changepoint_range': 0.7158200370061725}. Best is trial 3 with value: 0.04098090703811677.
Initial log joint probability = -28.8311
    Iter      log prob        ||dx||      ||grad||       alpha      alpha0  # evals  Notes 
      65       18912.8   9.47909e-06       698.698   1.121e-08       0.001      136  LS failed, Hessian reset 
      88       18912.9   4.19012e-08       665.424      0.4914      0.4914      169   
Optimization terminated normally: 
  Convergence detected: relative gradient magnitude is below tolerance
INFO:fbprophet:Making 5 forecasts with cutoffs between 2013-10-07 00:00:00 and 2015-10-18 00:00:00
INFO:fbprophet:Applying in parallel with <concurrent.futures.process.ProcessPoolExecutor object at 0x7fc88e6858d0>
Initial log joint probability = -8.95172
    Iter      log prob        ||dx||      ||grad||       alpha      alpha0  # evals  Notes 
Initial log joint probability = -12.7302
    Iter      log prob        ||dx||      ||grad||       alpha      alpha0  # evals  Notes 
Initial log joint probability = -15.1549
    Iter      log prob        ||dx||      ||grad||       alpha      alpha0  # evals  Notes 
Initial log joint probability = -18.717
    Iter      log prob        ||dx||      ||grad||       alpha      alpha0  # evals  Notes 
Initial log joint probability = -23.5879
    Iter      log prob        ||dx||      ||grad||       alpha      alpha0  # evals  Notes 
      82        4679.4   3.97533e-05       1040.43   3.835e-08       0.001      149  LS failed, Hessian reset 
      99       4679.47   3.20052e-06       1044.38      0.6844      0.6844      168   
    Iter      log prob        ||dx||      ||grad||       alpha      alpha0  # evals  Notes 
     124       4679.48     9.205e-09       1033.54       0.502       0.502      202   
Optimization terminated normally: 
  Convergence detected: absolute parameter change was below tolerance
      99       7032.17   5.39208e-06       1080.62           1           1      121   
    Iter      log prob        ||dx||      ||grad||       alpha      alpha0  # evals  Notes 
     148       7032.18   1.05403e-06       911.065   1.074e-09       0.001      218  LS failed, Hessian reset 
      99       9582.68   6.00893e-08       507.918     0.04241           1      145   
    Iter      log prob        ||dx||      ||grad||       alpha      alpha0  # evals  Notes 
     163       7032.18   4.22019e-08        846.41      0.4533           1      238   
Optimization terminated normally: 
  Convergence detected: relative gradient magnitude is below tolerance
     111       9582.68   3.76077e-08       769.996      0.3102           1      166   
Optimization terminated normally: 
  Convergence detected: relative gradient magnitude is below tolerance
      99       11813.2   3.02959e-08       971.188      0.2595      0.2595      132   
    Iter      log prob        ||dx||      ||grad||       alpha      alpha0  # evals  Notes 
     102       11813.2   5.01792e-08       844.063      0.6435      0.6435      135   
Optimization terminated normally: 
  Convergence detected: relative gradient magnitude is below tolerance
      89       14233.3   3.86476e-05       737.893   4.702e-08       0.001      158  LS failed, Hessian reset 
      99       14233.3   1.42145e-06       729.723      0.8249      0.8249      172   
    Iter      log prob        ||dx||      ||grad||       alpha      alpha0  # evals  Notes 
     101       14233.3   3.89986e-07       724.183      0.1991           1      176   
Optimization terminated normally: 
  Convergence detected: relative change in objective function was below tolerance
[I 2020-10-01 02:24:34,410] Trial 47 finished with value: 0.04210818823436935 and parameters: {'changepoint_prior_scale': 0.004785442021580788, 'seasonality_prior_scale': 0.1981284687413627, 'holidays_prior_scale': 0.026104225235552413, 'seasonality_mode': 'additive', 'changepoint_range': 0.6698706069790131}. Best is trial 3 with value: 0.04098090703811677.
Initial log joint probability = -28.8311
    Iter      log prob        ||dx||      ||grad||       alpha      alpha0  # evals  Notes 
      99       18912.3   5.34877e-06       4626.96      0.3252           1      128   
    Iter      log prob        ||dx||      ||grad||       alpha      alpha0  # evals  Notes 
     130       18912.3   9.70442e-09       4604.87      0.5081      0.5081      167   
Optimization terminated normally: 
  Convergence detected: absolute parameter change was below tolerance
INFO:fbprophet:Making 5 forecasts with cutoffs between 2013-10-07 00:00:00 and 2015-10-18 00:00:00
INFO:fbprophet:Applying in parallel with <concurrent.futures.process.ProcessPoolExecutor object at 0x7fc88e651410>
Initial log joint probability = -8.95172
    Iter      log prob        ||dx||      ||grad||       alpha      alpha0  # evals  Notes 
Initial log joint probability = -12.7302
    Iter      log prob        ||dx||      ||grad||       alpha      alpha0  # evals  Notes 
Initial log joint probability = -15.1549
    Iter      log prob        ||dx||      ||grad||       alpha      alpha0  # evals  Notes 
Initial log joint probability = -18.717
    Iter      log prob        ||dx||      ||grad||       alpha      alpha0  # evals  Notes 
Initial log joint probability = -23.5879
    Iter      log prob        ||dx||      ||grad||       alpha      alpha0  # evals  Notes 
      91       4679.37   9.13663e-09       4672.32      0.6902      0.6902      118   
Optimization terminated normally: 
  Convergence detected: absolute parameter change was below tolerance
      71       7026.82   1.80322e-05       4620.03   3.978e-09       0.001      123  LS failed, Hessian reset 
      99       7026.97   9.48966e-07       4271.55      0.2926           1      156   
    Iter      log prob        ||dx||      ||grad||       alpha      alpha0  # evals  Notes 
     117       7027.08   1.76593e-05       4453.51    3.63e-09       0.001      219  LS failed, Hessian reset 
      78         11813   7.59013e-09       4732.81      0.3255      0.3255      107   
Optimization terminated normally: 
  Convergence detected: absolute parameter change was below tolerance
      84       9582.32   1.75121e-07       4941.33   3.951e-11       0.001      157  LS failed, Hessian reset 
      90       9582.32   9.37381e-09       4178.07      0.2047      0.2047      164   
Optimization terminated normally: 
  Convergence detected: absolute parameter change was below tolerance
     168        7027.2   7.31261e-09       4331.38      0.1022      0.1022      278   
Optimization terminated normally: 
  Convergence detected: absolute parameter change was below tolerance
      99       14231.9   8.66311e-08       4828.16       0.098       0.098      127   
    Iter      log prob        ||dx||      ||grad||       alpha      alpha0  # evals  Notes 
     108       14231.9   2.24949e-06       5011.89   4.781e-10       0.001      175  LS failed, Hessian reset 
     145         14232   4.60546e-07       5008.32   1.031e-10       0.001      284  LS failed, Hessian reset 
     177         14232   3.89846e-06       4630.75   8.265e-10       0.001      370  LS failed, Hessian reset 
     199         14232   9.62621e-08       4727.07           1           1      400   
    Iter      log prob        ||dx||      ||grad||       alpha      alpha0  # evals  Notes 
     203         14232   5.52244e-07       5058.12   1.202e-10       0.001      438  LS failed, Hessian reset 
     212         14232   9.77872e-09       4582.63      0.2025      0.5223      450   
Optimization terminated normally: 
  Convergence detected: absolute parameter change was below tolerance
[I 2020-10-01 02:24:50,292] Trial 48 finished with value: 0.041469695939552347 and parameters: {'changepoint_prior_scale': 0.0010538056013677005, 'seasonality_prior_scale': 0.9300272930391488, 'holidays_prior_scale': 4.333599620733921, 'seasonality_mode': 'additive', 'changepoint_range': 0.5755576745621791}. Best is trial 3 with value: 0.04098090703811677.
Initial log joint probability = -28.8311
    Iter      log prob        ||dx||      ||grad||       alpha      alpha0  # evals  Notes 
      99       18924.7    0.00311833       140.285           1           1      112   
    Iter      log prob        ||dx||      ||grad||       alpha      alpha0  # evals  Notes 
     199       18925.2    0.00109205       122.613           1           1      234   
    Iter      log prob        ||dx||      ||grad||       alpha      alpha0  # evals  Notes 
     299       18925.7   0.000104245       49.4738      0.2442           1      356   
    Iter      log prob        ||dx||      ||grad||       alpha      alpha0  # evals  Notes 
     399       18925.9   4.59183e-05       26.3638      0.6672           1      484   
    Iter      log prob        ||dx||      ||grad||       alpha      alpha0  # evals  Notes 
     415       18925.9   3.28584e-06       20.8963      0.6409      0.6409      507   
Optimization terminated normally: 
  Convergence detected: relative gradient magnitude is below tolerance
INFO:fbprophet:Making 5 forecasts with cutoffs between 2013-10-07 00:00:00 and 2015-10-18 00:00:00
INFO:fbprophet:Applying in parallel with <concurrent.futures.process.ProcessPoolExecutor object at 0x7fc88e5ecf50>
Initial log joint probability = -8.95172
    Iter      log prob        ||dx||      ||grad||       alpha      alpha0  # evals  Notes 
Initial log joint probability = -12.7302
    Iter      log prob        ||dx||      ||grad||       alpha      alpha0  # evals  Notes 
Initial log joint probability = -15.1549
    Iter      log prob        ||dx||      ||grad||       alpha      alpha0  # evals  Notes 
Initial log joint probability = -18.717
    Iter      log prob        ||dx||      ||grad||       alpha      alpha0  # evals  Notes 
Initial log joint probability = -23.5879
    Iter      log prob        ||dx||      ||grad||       alpha      alpha0  # evals  Notes 
      99       4679.43   5.25862e-07       35.1643      0.1952      0.1952      126   
    Iter      log prob        ||dx||      ||grad||       alpha      alpha0  # evals  Notes 
     113       4679.43    6.7267e-07       33.8242      0.2217      0.5361      144   
Optimization terminated normally: 
  Convergence detected: relative gradient magnitude is below tolerance
      84       7039.36   2.19941e-05         24.78   7.477e-07       0.001      143  LS failed, Hessian reset 
      99        7039.4   5.17815e-05       43.6903      0.5408      0.5408      161   
    Iter      log prob        ||dx||      ||grad||       alpha      alpha0  # evals  Notes 
      99        9586.9    0.00718358       128.321           1           1      114   
    Iter      log prob        ||dx||      ||grad||       alpha      alpha0  # evals  Notes 
      99       11819.2    0.00066547       189.448           1           1      136   
    Iter      log prob        ||dx||      ||grad||       alpha      alpha0  # evals  Notes 
     188       7039.55   1.89518e-05       25.1211    7.59e-07       0.001      322  LS failed, Hessian reset 
      99       14240.9    0.00131945       76.2943           1           1      118   
    Iter      log prob        ||dx||      ||grad||       alpha      alpha0  # evals  Notes 
     199       7039.55   1.10405e-06       18.9096      0.1361      0.8734      339   
Optimization terminated normally: 
  Convergence detected: relative gradient magnitude is below tolerance
     199       9587.57   0.000228069       157.825      0.6051      0.6051      231   
    Iter      log prob        ||dx||      ||grad||       alpha      alpha0  # evals  Notes 
     199       11819.7   0.000230016       38.0908      0.3133           1      260   
    Iter      log prob        ||dx||      ||grad||       alpha      alpha0  # evals  Notes 
     222       11819.8   0.000104988       61.4372   1.193e-06       0.001      337  LS failed, Hessian reset 
     296       9587.73   5.29919e-05       59.2469   1.509e-06       0.001      392  LS failed, Hessian reset 
     299       11819.9    1.5187e-06       25.0467      0.1544           1      434   
    Iter      log prob        ||dx||      ||grad||       alpha      alpha0  # evals  Notes 
     303       11819.9   1.88486e-06        23.272           1           1      439   
Optimization terminated normally: 
  Convergence detected: relative gradient magnitude is below tolerance
     299       9587.73    1.9694e-05       27.7491           1           1      397   
    Iter      log prob        ||dx||      ||grad||       alpha      alpha0  # evals  Notes 
     199       14241.4   0.000214379       41.8017           1           1      237   
    Iter      log prob        ||dx||      ||grad||       alpha      alpha0  # evals  Notes 
     314       9587.73   1.56065e-06       19.1286      0.2836           1      420   
Optimization terminated normally: 
  Convergence detected: relative gradient magnitude is below tolerance
     292       14241.7   2.01922e-05       46.8503   4.615e-07       0.001      402  LS failed, Hessian reset 
     299       14241.7   0.000170249       101.089           1           1      409   
    Iter      log prob        ||dx||      ||grad||       alpha      alpha0  # evals  Notes 
     399       14241.8   3.29467e-06       20.2562      0.7695      0.7695      542   
    Iter      log prob        ||dx||      ||grad||       alpha      alpha0  # evals  Notes 
     443       14241.9   4.78899e-05       78.1499   9.913e-07       0.001      645  LS failed, Hessian reset 
     499       14241.9   4.33617e-05        22.129      0.2842           1      717   
    Iter      log prob        ||dx||      ||grad||       alpha      alpha0  # evals  Notes 
     538       14241.9   1.68468e-06       26.0251      0.3289           1      771   
Optimization terminated normally: 
  Convergence detected: relative gradient magnitude is below tolerance
