[I 2020-10-01 02:34:59,860] Trial 87 finished with value: 0.04466605470794039 and parameters: {'changepoint_prior_scale': 0.03372386358521571, 'seasonality_prior_scale': 0.06436422912520087, 'holidays_prior_scale': 5.278036009958217, 'seasonality_mode': 'additive', 'changepoint_range': 0.5496193831965851}. Best is trial 67 with value: 0.04069570224533105.
Initial log joint probability = -28.8311
    Iter      log prob        ||dx||      ||grad||       alpha      alpha0  # evals  Notes 
      99       18912.6   3.98455e-06       4217.73      0.7451      0.7451      120   
    Iter      log prob        ||dx||      ||grad||       alpha      alpha0  # evals  Notes 
     143       18912.7   2.21977e-08       4067.56      0.2194           1      175   
Optimization terminated normally: 
  Convergence detected: relative gradient magnitude is below tolerance
INFO:fbprophet:Making 5 forecasts with cutoffs between 2013-10-07 00:00:00 and 2015-10-18 00:00:00
INFO:fbprophet:Applying in parallel with <concurrent.futures.process.ProcessPoolExecutor object at 0x7fc84dc6fe90>
Initial log joint probability = -8.95172
    Iter      log prob        ||dx||      ||grad||       alpha      alpha0  # evals  Notes 
Initial log joint probability = -12.7302
    Iter      log prob        ||dx||      ||grad||       alpha      alpha0  # evals  Notes 
Initial log joint probability = -15.1549
    Iter      log prob        ||dx||      ||grad||       alpha      alpha0  # evals  Notes 
      50       4678.89   3.42691e-05        4003.7   8.466e-09       0.001      103  LS failed, Hessian reset 
Initial log joint probability = -18.717
    Iter      log prob        ||dx||      ||grad||       alpha      alpha0  # evals  Notes 
      99       4679.24   2.64042e-08       4122.95      0.2245           1      173   
    Iter      log prob        ||dx||      ||grad||       alpha      alpha0  # evals  Notes 
     100       4679.24   1.69902e-09       4105.39      0.1501      0.1501      174   
Optimization terminated normally: 
  Convergence detected: absolute parameter change was below tolerance
Initial log joint probability = -23.5879
    Iter      log prob        ||dx||      ||grad||       alpha      alpha0  # evals  Notes 
      99       7028.54   2.73269e-06       3662.87      0.5734      0.5734      130   
    Iter      log prob        ||dx||      ||grad||       alpha      alpha0  # evals  Notes 
      70       9582.35   7.69729e-09       4002.09      0.1337      0.1337       97   
Optimization terminated normally: 
  Convergence detected: absolute parameter change was below tolerance
     123        7028.8    1.5077e-05       3788.23   3.646e-09       0.001      198  LS failed, Hessian reset 
     178       7028.84   8.44978e-09       3205.26       0.619       0.619      266   
Optimization terminated normally: 
  Convergence detected: absolute parameter change was below tolerance
      50         11813   4.03349e-05       4185.94   1.039e-08       0.001      114  LS failed, Hessian reset 
      87       11813.1   9.66005e-09       3954.47      0.4223      0.4223      159   
Optimization terminated normally: 
  Convergence detected: absolute parameter change was below tolerance
      81       14232.7    0.00012672       4441.46   3.852e-08       0.001      137  LS failed, Hessian reset 
      99       14233.1   3.31726e-06       3090.43           1           1      160   
    Iter      log prob        ||dx||      ||grad||       alpha      alpha0  # evals  Notes 
     163       14233.3   7.53825e-09       3976.04       0.453       0.453      233   
Optimization terminated normally: 
  Convergence detected: absolute parameter change was below tolerance
[I 2020-10-01 02:35:15,089] Trial 88 finished with value: 0.04134618672357863 and parameters: {'changepoint_prior_scale': 0.0012375046299635162, 'seasonality_prior_scale': 0.08982726326146519, 'holidays_prior_scale': 9.054030190217768, 'seasonality_mode': 'additive', 'changepoint_range': 0.7106570167147204}. Best is trial 67 with value: 0.04069570224533105.
Initial log joint probability = -28.8311
    Iter      log prob        ||dx||      ||grad||       alpha      alpha0  # evals  Notes 
      84       18912.9   4.60484e-08       2601.19      0.3979           1      115   
Optimization terminated normally: 
  Convergence detected: relative gradient magnitude is below tolerance
INFO:fbprophet:Making 5 forecasts with cutoffs between 2013-10-07 00:00:00 and 2015-10-18 00:00:00
INFO:fbprophet:Applying in parallel with <concurrent.futures.process.ProcessPoolExecutor object at 0x7fc88e651c90>
Initial log joint probability = -8.95172
    Iter      log prob        ||dx||      ||grad||       alpha      alpha0  # evals  Notes 
Initial log joint probability = -12.7302
    Iter      log prob        ||dx||      ||grad||       alpha      alpha0  # evals  Notes 
Initial log joint probability = -15.1549
    Iter      log prob        ||dx||      ||grad||       alpha      alpha0  # evals  Notes 
Initial log joint probability = -18.717
    Iter      log prob        ||dx||      ||grad||       alpha      alpha0  # evals  Notes 
Initial log joint probability = -23.5879
    Iter      log prob        ||dx||      ||grad||       alpha      alpha0  # evals  Notes 
      99       4679.37   9.27076e-06       2848.04      0.1897           1      129   
    Iter      log prob        ||dx||      ||grad||       alpha      alpha0  # evals  Notes 
     130        4679.4   8.91564e-09       2892.16      0.3755      0.3755      168   
Optimization terminated normally: 
  Convergence detected: absolute parameter change was below tolerance
      99       7029.98   1.83975e-05       2422.86           1           1      124   
    Iter      log prob        ||dx||      ||grad||       alpha      alpha0  # evals  Notes 
      80       9582.47   3.43768e-07       2537.58   1.077e-10       0.001      137  LS failed, Hessian reset 
      77       11813.2   7.76423e-09        2778.2      0.6247      0.6247      105   
Optimization terminated normally: 
  Convergence detected: absolute parameter change was below tolerance
      99       9582.47    3.5639e-08        2672.6           1           1      160   
    Iter      log prob        ||dx||      ||grad||       alpha      alpha0  # evals  Notes 
     199       7031.69   4.78298e-07       2872.13      0.3241           1      245   
    Iter      log prob        ||dx||      ||grad||       alpha      alpha0  # evals  Notes 
     100       9582.47   8.73445e-09       2017.25      0.5343      0.5343      161   
Optimization terminated normally: 
  Convergence detected: absolute parameter change was below tolerance
     214       7031.69   6.26701e-09          2778       0.363       0.363      266   
Optimization terminated normally: 
  Convergence detected: absolute parameter change was below tolerance
      99       14233.3   2.70888e-07       2671.64      0.2062      0.9502      136   
    Iter      log prob        ||dx||      ||grad||       alpha      alpha0  # evals  Notes 
     142       14233.3   1.71569e-06       2671.91   6.393e-10       0.001      229  LS failed, Hessian reset 
     160       14233.3   4.33723e-08       2376.66           1           1      252   
Optimization terminated normally: 
  Convergence detected: relative gradient magnitude is below tolerance
[I 2020-10-01 02:35:30,143] Trial 89 finished with value: 0.041543992911769835 and parameters: {'changepoint_prior_scale': 0.0017406731536550666, 'seasonality_prior_scale': 0.15563148676094468, 'holidays_prior_scale': 3.0418551546770485, 'seasonality_mode': 'additive', 'changepoint_range': 0.6719040301490017}. Best is trial 67 with value: 0.04069570224533105.
Initial log joint probability = -28.8311
    Iter      log prob        ||dx||      ||grad||       alpha      alpha0  # evals  Notes 
      99       18911.8   2.70998e-06       4812.19      0.7463      0.7463      130   
    Iter      log prob        ||dx||      ||grad||       alpha      alpha0  # evals  Notes 
     158       18912.4   1.12313e-07       4577.92   2.306e-11       0.001      238  LS failed, Hessian reset 
     169       18912.4    2.1981e-08       4348.88      0.6176      0.6176      250   
Optimization terminated normally: 
  Convergence detected: relative gradient magnitude is below tolerance
INFO:fbprophet:Making 5 forecasts with cutoffs between 2013-10-07 00:00:00 and 2015-10-18 00:00:00
INFO:fbprophet:Applying in parallel with <concurrent.futures.process.ProcessPoolExecutor object at 0x7fc88e651c90>
Initial log joint probability = -8.95172
    Iter      log prob        ||dx||      ||grad||       alpha      alpha0  # evals  Notes 
Initial log joint probability = -12.7302
    Iter      log prob        ||dx||      ||grad||       alpha      alpha0  # evals  Notes 
Initial log joint probability = -15.1549
    Iter      log prob        ||dx||      ||grad||       alpha      alpha0  # evals  Notes 
Initial log joint probability = -18.717
    Iter      log prob        ||dx||      ||grad||       alpha      alpha0  # evals  Notes 
Initial log joint probability = -23.5879
    Iter      log prob        ||dx||      ||grad||       alpha      alpha0  # evals  Notes 
      58        4678.8   2.67587e-06       4961.57   5.711e-10       0.001      112  LS failed, Hessian reset 
      84       4678.85   7.73699e-06        4791.4   1.546e-09       0.001      188  LS failed, Hessian reset 
      90       7027.71   5.76929e-09       4753.12       0.454       0.454      108   
Optimization terminated normally: 
  Convergence detected: absolute parameter change was below tolerance
      99       4678.88   9.94559e-08       4827.61      0.3733      0.3733      206   
    Iter      log prob        ||dx||      ||grad||       alpha      alpha0  # evals  Notes 
     106       4678.88   5.25546e-09       4825.96      0.1662      0.1662      216   
Optimization terminated normally: 
  Convergence detected: absolute parameter change was below tolerance
      81       9582.18   7.78693e-09       4723.52      0.9138      0.9138      113   
Optimization terminated normally: 
  Convergence detected: absolute parameter change was below tolerance
      73       11812.7   9.84859e-09       4764.42      0.6298      0.6298      108   
Optimization terminated normally: 
  Convergence detected: absolute parameter change was below tolerance
      99       14230.6   9.19393e-08       4511.43           1           1      126   
    Iter      log prob        ||dx||      ||grad||       alpha      alpha0  # evals  Notes 
     109       14230.6   7.75497e-09       4978.09      0.1508      0.4322      140   
Optimization terminated normally: 
  Convergence detected: absolute parameter change was below tolerance
[I 2020-10-01 02:35:43,916] Trial 90 finished with value: 0.040734638903835295 and parameters: {'changepoint_prior_scale': 0.0010007822920384364, 'seasonality_prior_scale': 0.12099872138487995, 'holidays_prior_scale': 0.09350621329984828, 'seasonality_mode': 'additive', 'changepoint_range': 0.5731272778626294}. Best is trial 67 with value: 0.04069570224533105.
Initial log joint probability = -28.8311
    Iter      log prob        ||dx||      ||grad||       alpha      alpha0  # evals  Notes 
      99       18911.9   3.15092e-06       5121.44      0.5882      0.5882      123   
    Iter      log prob        ||dx||      ||grad||       alpha      alpha0  # evals  Notes 
     139       18912.6    8.9809e-09       4646.11      0.3481      0.3481      173   
Optimization terminated normally: 
  Convergence detected: absolute parameter change was below tolerance
INFO:fbprophet:Making 5 forecasts with cutoffs between 2013-10-07 00:00:00 and 2015-10-18 00:00:00
INFO:fbprophet:Applying in parallel with <concurrent.futures.process.ProcessPoolExecutor object at 0x7fc88e6aee10>
Initial log joint probability = -8.95172
    Iter      log prob        ||dx||      ||grad||       alpha      alpha0  # evals  Notes 
Initial log joint probability = -12.7302
    Iter      log prob        ||dx||      ||grad||       alpha      alpha0  # evals  Notes 
Initial log joint probability = -15.1549
    Iter      log prob        ||dx||      ||grad||       alpha      alpha0  # evals  Notes 
Initial log joint probability = -18.717
    Iter      log prob        ||dx||      ||grad||       alpha      alpha0  # evals  Notes 
      59       4678.63   4.62327e-09       4736.52      0.3185      0.3185       80   
Optimization terminated normally: 
  Convergence detected: absolute parameter change was below tolerance
Initial log joint probability = -23.5879
    Iter      log prob        ||dx||      ||grad||       alpha      alpha0  # evals  Notes 
      99       7028.09    1.5156e-08       4359.11      0.3296           1      123   
    Iter      log prob        ||dx||      ||grad||       alpha      alpha0  # evals  Notes 
     110       7028.09   4.37048e-09       4900.25      0.5349      0.5349      136   
Optimization terminated normally: 
  Convergence detected: absolute parameter change was below tolerance
      64        9582.2   3.37267e-09       4529.84      0.2049      0.2049       94   
Optimization terminated normally: 
  Convergence detected: absolute parameter change was below tolerance
      58       11812.7   8.56991e-09       4739.45      0.3186      0.3186       87   
Optimization terminated normally: 
  Convergence detected: absolute parameter change was below tolerance
      99       14231.8   5.48679e-07       4578.95      0.3565      0.3565      125   
    Iter      log prob        ||dx||      ||grad||       alpha      alpha0  # evals  Notes 
     125       14231.8   9.41455e-09       4307.24      0.4151           1      161   
Optimization terminated normally: 
  Convergence detected: absolute parameter change was below tolerance
[I 2020-10-01 02:35:59,465] Trial 91 finished with value: 0.04067540536866499 and parameters: {'changepoint_prior_scale': 0.0010079560251257593, 'seasonality_prior_scale': 0.10942934710418481, 'holidays_prior_scale': 0.08011568058070724, 'seasonality_mode': 'additive', 'changepoint_range': 0.5732078057553078}. Best is trial 91 with value: 0.04067540536866499.
Initial log joint probability = -28.8311
    Iter      log prob        ||dx||      ||grad||       alpha      alpha0  # evals  Notes 
      99       18912.9   6.16217e-09       3477.25     0.05725     0.05725      122   
Optimization terminated normally: 
  Convergence detected: absolute parameter change was below tolerance
INFO:fbprophet:Making 5 forecasts with cutoffs between 2013-10-07 00:00:00 and 2015-10-18 00:00:00
INFO:fbprophet:Applying in parallel with <concurrent.futures.process.ProcessPoolExecutor object at 0x7fc88e6d4a90>
Initial log joint probability = -8.95172
    Iter      log prob        ||dx||      ||grad||       alpha      alpha0  # evals  Notes 
Initial log joint probability = -12.7302
    Iter      log prob        ||dx||      ||grad||       alpha      alpha0  # evals  Notes 
Initial log joint probability = -15.1549
    Iter      log prob        ||dx||      ||grad||       alpha      alpha0  # evals  Notes 
Initial log joint probability = -18.717
    Iter      log prob        ||dx||      ||grad||       alpha      alpha0  # evals  Notes 
Initial log joint probability = -23.5879
    Iter      log prob        ||dx||      ||grad||       alpha      alpha0  # evals  Notes 
      74       4678.96   7.36875e-09        3390.6     0.05384           1       97   
Optimization terminated normally: 
  Convergence detected: absolute parameter change was below tolerance
      99       7028.42   8.27823e-08       3509.79           1           1      125   
    Iter      log prob        ||dx||      ||grad||       alpha      alpha0  # evals  Notes 
     110       7028.42   6.04454e-09       3344.67      0.5538      0.5538      139   
Optimization terminated normally: 
  Convergence detected: absolute parameter change was below tolerance
      76       9582.51   6.19325e-09       3173.16      0.6655      0.6655       99   
Optimization terminated normally: 
  Convergence detected: absolute parameter change was below tolerance
      87       11813.1   8.51118e-09       3504.54       0.331      0.7267      128   
Optimization terminated normally: 
  Convergence detected: absolute parameter change was below tolerance
      99       14233.2   1.13678e-07       3353.33           1           1      128   
    Iter      log prob        ||dx||      ||grad||       alpha      alpha0  # evals  Notes 
     116       14233.2   5.16633e-09       3866.32     0.06346      0.8653      154   
Optimization terminated normally: 
  Convergence detected: absolute parameter change was below tolerance
[I 2020-10-01 02:36:14,628] Trial 92 finished with value: 0.041020161292194504 and parameters: {'changepoint_prior_scale': 0.001366705026735627, 'seasonality_prior_scale': 0.11583704977491567, 'holidays_prior_scale': 0.0452119390649728, 'seasonality_mode': 'additive', 'changepoint_range': 0.600516337127792}. Best is trial 91 with value: 0.04067540536866499.
Initial log joint probability = -28.8311
    Iter      log prob        ||dx||      ||grad||       alpha      alpha0  # evals  Notes 
      99       18912.2   1.39728e-06       4642.94      0.7216      0.7216      121   
    Iter      log prob        ||dx||      ||grad||       alpha      alpha0  # evals  Notes 
     153       18912.6    9.6091e-09       3912.58       0.517      0.0517      187   
Optimization terminated normally: 
  Convergence detected: absolute parameter change was below tolerance
INFO:fbprophet:Making 5 forecasts with cutoffs between 2013-10-07 00:00:00 and 2015-10-18 00:00:00
INFO:fbprophet:Applying in parallel with <concurrent.futures.process.ProcessPoolExecutor object at 0x7fc88e6aea50>
Initial log joint probability = -8.95172
    Iter      log prob        ||dx||      ||grad||       alpha      alpha0  # evals  Notes 
Initial log joint probability = -12.7302
    Iter      log prob        ||dx||      ||grad||       alpha      alpha0  # evals  Notes 
Initial log joint probability = -15.1549
    Iter      log prob        ||dx||      ||grad||       alpha      alpha0  # evals  Notes 
Initial log joint probability = -18.717
    Iter      log prob        ||dx||      ||grad||       alpha      alpha0  # evals  Notes 
Initial log joint probability = -23.5879
    Iter      log prob        ||dx||      ||grad||       alpha      alpha0  # evals  Notes 
      76       4671.33   6.49596e-09       4359.14      0.4832      0.4832      100   
Optimization terminated normally: 
  Convergence detected: absolute parameter change was below tolerance
      67       9582.34   8.88258e-10       4159.58     0.04692     0.04692       93   
Optimization terminated normally: 
  Convergence detected: absolute parameter change was below tolerance
      97       7028.58   1.45279e-05       4227.49   3.349e-09       0.001      172  LS failed, Hessian reset 
      99       7028.61   2.63005e-05       4024.41           1           1      174   
    Iter      log prob        ||dx||      ||grad||       alpha      alpha0  # evals  Notes 
      56       11813.1   9.91711e-09       4304.73      0.7642      0.7642       85   
Optimization terminated normally: 
  Convergence detected: absolute parameter change was below tolerance
     144       7028.77   3.63246e-09       3855.81      0.3949      0.3949      229   
Optimization terminated normally: 
  Convergence detected: absolute parameter change was below tolerance
      99       14233.5   4.34722e-06       4337.92      0.3716           1      124   
    Iter      log prob        ||dx||      ||grad||       alpha      alpha0  # evals  Notes 
     101       14233.5   4.32486e-06       4681.48   1.025e-09       0.001      164  LS failed, Hessian reset 
     123       14233.5   7.25859e-09       4501.88       0.351           1      195   
Optimization terminated normally: 
  Convergence detected: absolute parameter change was below tolerance
