[I 2020-10-01 04:04:14,663] Trial 439 finished with value: 0.04102829298562936 and parameters: {'changepoint_prior_scale': 0.0011988445758554264, 'seasonality_prior_scale': 0.07800223448490855, 'holidays_prior_scale': 0.09666798466085998, 'seasonality_mode': 'additive', 'changepoint_range': 0.5502784536434542}. Best is trial 96 with value: 0.038883738900888705.
Initial log joint probability = -28.8311
    Iter      log prob        ||dx||      ||grad||       alpha      alpha0  # evals  Notes 
      95       18912.8     3.036e-06       3307.43   9.335e-10       0.001      168  LS failed, Hessian reset 
      99       18912.8   4.79866e-07       3444.02      0.6845      0.6845      172   
    Iter      log prob        ||dx||      ||grad||       alpha      alpha0  # evals  Notes 
     122       18912.8    2.3057e-08       3440.67      0.8191      0.8191      201   
Optimization terminated normally: 
  Convergence detected: relative gradient magnitude is below tolerance
INFO:fbprophet:Making 5 forecasts with cutoffs between 2013-10-07 00:00:00 and 2015-10-18 00:00:00
INFO:fbprophet:Applying in parallel with <concurrent.futures.process.ProcessPoolExecutor object at 0x7fc84dcaa450>
Initial log joint probability = -8.95172
    Iter      log prob        ||dx||      ||grad||       alpha      alpha0  # evals  Notes 
Initial log joint probability = -12.7302
    Iter      log prob        ||dx||      ||grad||       alpha      alpha0  # evals  Notes 
Initial log joint probability = -15.1549
    Iter      log prob        ||dx||      ||grad||       alpha      alpha0  # evals  Notes 
Initial log joint probability = -18.717
    Iter      log prob        ||dx||      ||grad||       alpha      alpha0  # evals  Notes 
Initial log joint probability = -23.5879
    Iter      log prob        ||dx||      ||grad||       alpha      alpha0  # evals  Notes 
      64       4678.98   5.26668e-06       3438.78   1.445e-09       0.001      128  LS failed, Hessian reset 
      99       4679.06   3.23772e-08       3864.49      0.4791      0.4791      168   
    Iter      log prob        ||dx||      ||grad||       alpha      alpha0  # evals  Notes 
     108       4679.06    1.6635e-07       3268.94   4.628e-11       0.001      223  LS failed, Hessian reset 
      57       9582.47   7.01192e-09       3275.79      0.3831      0.3831       74   
Optimization terminated normally: 
  Convergence detected: absolute parameter change was below tolerance
     113       4679.06   8.24515e-09       3381.15       0.146       0.146      230   
Optimization terminated normally: 
  Convergence detected: absolute parameter change was below tolerance
      99       7029.38   3.01189e-05       3161.36           1           1      129   
    Iter      log prob        ||dx||      ||grad||       alpha      alpha0  # evals  Notes 
      31       11812.1    0.00024526       3465.04   7.033e-08       0.001       84  LS failed, Hessian reset 
      95       11812.9   3.95709e-09       3645.75      0.2627      0.2627      162   
Optimization terminated normally: 
  Convergence detected: absolute parameter change was below tolerance
     162       7031.85   1.38775e-05       3552.22   3.745e-09       0.001      244  LS failed, Hessian reset 
      99       14232.4   4.78317e-06        3794.4      0.6763           1      133   
    Iter      log prob        ||dx||      ||grad||       alpha      alpha0  # evals  Notes 
     196       7031.89   1.60176e-07       3552.85   4.559e-11       0.001      324  LS failed, Hessian reset 
     199       7031.89    6.7442e-09       3443.53      0.1483      0.1483      328   
Optimization terminated normally: 
  Convergence detected: absolute parameter change was below tolerance
     100       14232.4   1.77025e-06       2912.87   4.665e-10       0.001      173  LS failed, Hessian reset 
     130       14232.4   8.86577e-09       2353.67      0.6559      0.6559      211   
Optimization terminated normally: 
  Convergence detected: absolute parameter change was below tolerance
[I 2020-10-01 04:04:29,611] Trial 440 finished with value: 0.041178629153308256 and parameters: {'changepoint_prior_scale': 0.0013983653560349714, 'seasonality_prior_scale': 0.16481096579354387, 'holidays_prior_scale': 0.13777451703257992, 'seasonality_mode': 'additive', 'changepoint_range': 0.5715101174118576}. Best is trial 96 with value: 0.038883738900888705.
Initial log joint probability = -28.8311
    Iter      log prob        ||dx||      ||grad||       alpha      alpha0  # evals  Notes 
      99       18912.3   4.61857e-05       4237.65      0.2902           1      130   
    Iter      log prob        ||dx||      ||grad||       alpha      alpha0  # evals  Notes 
     118       18912.4   8.95056e-09       4264.91     0.08739     0.08739      156   
Optimization terminated normally: 
  Convergence detected: absolute parameter change was below tolerance
INFO:fbprophet:Making 5 forecasts with cutoffs between 2013-10-07 00:00:00 and 2015-10-18 00:00:00
INFO:fbprophet:Applying in parallel with <concurrent.futures.process.ProcessPoolExecutor object at 0x7fc84dbf3610>
Initial log joint probability = -8.95172
    Iter      log prob        ||dx||      ||grad||       alpha      alpha0  # evals  Notes 
Initial log joint probability = -12.7302
    Iter      log prob        ||dx||      ||grad||       alpha      alpha0  # evals  Notes 
Initial log joint probability = -15.1549
    Iter      log prob        ||dx||      ||grad||       alpha      alpha0  # evals  Notes 
Initial log joint probability = -18.717
    Iter      log prob        ||dx||      ||grad||       alpha      alpha0  # evals  Notes 
      64       4679.07   8.55388e-09       4145.21      0.3003      0.3003       85   
Optimization terminated normally: 
  Convergence detected: absolute parameter change was below tolerance
Initial log joint probability = -23.5879
    Iter      log prob        ||dx||      ||grad||       alpha      alpha0  # evals  Notes 
      77       7028.26   2.99971e-06       4353.77    6.91e-10       0.001      148  LS failed, Hessian reset 
      99       7028.27   3.58217e-09       4436.37      0.1401      0.1401      174   
Optimization terminated normally: 
  Convergence detected: absolute parameter change was below tolerance
      92       9582.35   6.71144e-09       3784.49      0.2496      0.8678      137   
Optimization terminated normally: 
  Convergence detected: absolute parameter change was below tolerance
      69         11813   3.01139e-09       4325.71      0.2289      0.2289      103   
Optimization terminated normally: 
  Convergence detected: absolute parameter change was below tolerance
      99       14233.4    3.1982e-09       4192.96      0.2831      0.2831      125   
Optimization terminated normally: 
  Convergence detected: absolute parameter change was below tolerance
[I 2020-10-01 04:04:44,955] Trial 441 finished with value: 0.0409410515708229 and parameters: {'changepoint_prior_scale': 0.001124799002808269, 'seasonality_prior_scale': 0.11363490618975682, 'holidays_prior_scale': 0.20074529802155222, 'seasonality_mode': 'additive', 'changepoint_range': 0.557329970440538}. Best is trial 96 with value: 0.038883738900888705.
Initial log joint probability = -28.8311
    Iter      log prob        ||dx||      ||grad||       alpha      alpha0  # evals  Notes 
      99       18911.7   4.92049e-07        3972.5           1           1      133   
    Iter      log prob        ||dx||      ||grad||       alpha      alpha0  # evals  Notes 
     199       18912.1   3.04628e-08       3094.76      0.4862      0.4862      261   
    Iter      log prob        ||dx||      ||grad||       alpha      alpha0  # evals  Notes 
     203       18912.1   3.92638e-09       4237.51      0.1488      0.1488      266   
Optimization terminated normally: 
  Convergence detected: absolute parameter change was below tolerance
INFO:fbprophet:Making 5 forecasts with cutoffs between 2013-10-07 00:00:00 and 2015-10-18 00:00:00
INFO:fbprophet:Applying in parallel with <concurrent.futures.process.ProcessPoolExecutor object at 0x7fc84dcaaa10>
Initial log joint probability = -8.95172
    Iter      log prob        ||dx||      ||grad||       alpha      alpha0  # evals  Notes 
Initial log joint probability = -12.7302
    Iter      log prob        ||dx||      ||grad||       alpha      alpha0  # evals  Notes 
Initial log joint probability = -15.1549
    Iter      log prob        ||dx||      ||grad||       alpha      alpha0  # evals  Notes 
Initial log joint probability = -18.717
    Iter      log prob        ||dx||      ||grad||       alpha      alpha0  # evals  Notes 
Initial log joint probability = -23.5879
    Iter      log prob        ||dx||      ||grad||       alpha      alpha0  # evals  Notes 
      87       4678.72   6.86233e-09       5052.58      0.2252      0.2252      119   
Optimization terminated normally: 
  Convergence detected: absolute parameter change was below tolerance
      48       9582.18   6.20629e-09       4773.73      0.3616           1       70   
Optimization terminated normally: 
  Convergence detected: absolute parameter change was below tolerance
      87       7028.14   2.99385e-06       4804.02   6.494e-10       0.001      141  LS failed, Hessian reset 
      99       7028.14   1.12187e-07        4142.2      0.6636      0.6636      155   
    Iter      log prob        ||dx||      ||grad||       alpha      alpha0  # evals  Notes 
     119       7028.15   3.23737e-09       3907.17      0.2499      0.2499      181   
Optimization terminated normally: 
  Convergence detected: absolute parameter change was below tolerance
      58       11812.9    7.6945e-09       4573.27      0.2217      0.2217       80   
Optimization terminated normally: 
  Convergence detected: absolute parameter change was below tolerance
      99       14232.6   8.31976e-08       4877.17      0.3233      0.7974      128   
    Iter      log prob        ||dx||      ||grad||       alpha      alpha0  # evals  Notes 
     105       14232.6   9.08869e-09       4810.44      0.2963      0.2963      137   
Optimization terminated normally: 
  Convergence detected: absolute parameter change was below tolerance
[I 2020-10-01 04:05:00,831] Trial 442 finished with value: 0.0405547597323617 and parameters: {'changepoint_prior_scale': 0.0010125290365513317, 'seasonality_prior_scale': 0.14029829203538063, 'holidays_prior_scale': 0.10885217916761926, 'seasonality_mode': 'additive', 'changepoint_range': 0.5329115159801343}. Best is trial 96 with value: 0.038883738900888705.
Initial log joint probability = -28.8311
    Iter      log prob        ||dx||      ||grad||       alpha      alpha0  # evals  Notes 
      99       18911.5   0.000357897       5203.03      0.8093      0.8093      129   
    Iter      log prob        ||dx||      ||grad||       alpha      alpha0  # evals  Notes 
     164       18912.9   5.09477e-09        4842.6      0.2706      0.2706      204   
Optimization terminated normally: 
  Convergence detected: absolute parameter change was below tolerance
INFO:fbprophet:Making 5 forecasts with cutoffs between 2013-10-07 00:00:00 and 2015-10-18 00:00:00
INFO:fbprophet:Applying in parallel with <concurrent.futures.process.ProcessPoolExecutor object at 0x7fc84dc8c7d0>
Initial log joint probability = -8.95172
    Iter      log prob        ||dx||      ||grad||       alpha      alpha0  # evals  Notes 
Initial log joint probability = -12.7302
    Iter      log prob        ||dx||      ||grad||       alpha      alpha0  # evals  Notes 
Initial log joint probability = -15.1549
    Iter      log prob        ||dx||      ||grad||       alpha      alpha0  # evals  Notes 
Initial log joint probability = -18.717
    Iter      log prob        ||dx||      ||grad||       alpha      alpha0  # evals  Notes 
Initial log joint probability = -23.5879
    Iter      log prob        ||dx||      ||grad||       alpha      alpha0  # evals  Notes 
      68       4678.86   2.50535e-06       5073.51   5.083e-10       0.001      134  LS failed, Hessian reset 
      89       4678.88   9.00531e-09       4920.92      0.6582      0.2055      162   
Optimization terminated normally: 
  Convergence detected: absolute parameter change was below tolerance
      60       9582.25   9.90993e-09       4953.43      0.2544      0.2544       82   
Optimization terminated normally: 
  Convergence detected: absolute parameter change was below tolerance
      99       7027.84   1.26829e-08       4971.07      0.7294      0.7294      128   
    Iter      log prob        ||dx||      ||grad||       alpha      alpha0  # evals  Notes 
     114       7027.85   8.42702e-09       4301.87      0.4187      0.4187      146   
Optimization terminated normally: 
  Convergence detected: absolute parameter change was below tolerance
      60       11813.2    8.8336e-09        4858.9       0.167           1       90   
Optimization terminated normally: 
  Convergence detected: absolute parameter change was below tolerance
      99       14230.2   1.87776e-07       4908.09           1           1      127   
    Iter      log prob        ||dx||      ||grad||       alpha      alpha0  # evals  Notes 
     103       14230.2   1.80283e-07        4311.9   3.337e-11       0.001      176  LS failed, Hessian reset 
     108       14230.2   4.89327e-09          4090      0.1408      0.1408      182   
Optimization terminated normally: 
  Convergence detected: absolute parameter change was below tolerance
[I 2020-10-01 04:05:14,816] Trial 443 finished with value: 0.04053936179745634 and parameters: {'changepoint_prior_scale': 0.0010010750476182797, 'seasonality_prior_scale': 0.14558888417863491, 'holidays_prior_scale': 0.1150510576864561, 'seasonality_mode': 'additive', 'changepoint_range': 0.6077396431494088}. Best is trial 96 with value: 0.038883738900888705.
Initial log joint probability = -28.8311
    Iter      log prob        ||dx||      ||grad||       alpha      alpha0  # evals  Notes 
      99       18910.8   1.96944e-06       5561.91      0.2705           1      132   
    Iter      log prob        ||dx||      ||grad||       alpha      alpha0  # evals  Notes 
     198       18912.6   2.05906e-08       5307.41           1           1      255   
Optimization terminated normally: 
  Convergence detected: relative gradient magnitude is below tolerance
INFO:fbprophet:Making 5 forecasts with cutoffs between 2013-10-07 00:00:00 and 2015-10-18 00:00:00
INFO:fbprophet:Applying in parallel with <concurrent.futures.process.ProcessPoolExecutor object at 0x7fc84dafd850>
Initial log joint probability = -8.95172
    Iter      log prob        ||dx||      ||grad||       alpha      alpha0  # evals  Notes 
Initial log joint probability = -12.7302
    Iter      log prob        ||dx||      ||grad||       alpha      alpha0  # evals  Notes 
      66       4678.42   7.19256e-09       4626.02      0.3353      0.3353       87   
Optimization terminated normally: 
  Convergence detected: absolute parameter change was below tolerance
Initial log joint probability = -15.1549
    Iter      log prob        ||dx||      ||grad||       alpha      alpha0  # evals  Notes 
Initial log joint probability = -18.717
    Iter      log prob        ||dx||      ||grad||       alpha      alpha0  # evals  Notes 
Initial log joint probability = -23.5879
    Iter      log prob        ||dx||      ||grad||       alpha      alpha0  # evals  Notes 
      99       7027.95   1.54602e-08       4991.71           1           1      127   
    Iter      log prob        ||dx||      ||grad||       alpha      alpha0  # evals  Notes 
     108       7027.95   5.38649e-09       4698.52     0.08125     0.08125      138   
Optimization terminated normally: 
  Convergence detected: absolute parameter change was below tolerance
      59       9582.14    9.6854e-09       4778.93      0.3358      0.3358       86   
Optimization terminated normally: 
  Convergence detected: absolute parameter change was below tolerance
      72         11813   5.63109e-09       5006.84      0.4906      0.4906      104   
Optimization terminated normally: 
  Convergence detected: absolute parameter change was below tolerance
      56       14229.5   0.000392066       5230.94   7.909e-08       0.001      105  LS failed, Hessian reset 
      99       14230.4    2.5899e-07       3801.74           1           1      158   
    Iter      log prob        ||dx||      ||grad||       alpha      alpha0  # evals  Notes 
     114       14230.4   8.29205e-09       4336.29      0.4916      0.4916      177   
Optimization terminated normally: 
  Convergence detected: absolute parameter change was below tolerance
[I 2020-10-01 04:05:29,800] Trial 444 finished with value: 0.040233205046946004 and parameters: {'changepoint_prior_scale': 0.0010011054033218759, 'seasonality_prior_scale': 0.14796958984246145, 'holidays_prior_scale': 0.11610142288374861, 'seasonality_mode': 'additive', 'changepoint_range': 0.5926183569954527}. Best is trial 96 with value: 0.038883738900888705.
Initial log joint probability = -28.8311
    Iter      log prob        ||dx||      ||grad||       alpha      alpha0  # evals  Notes 
      99       18912.1   0.000149338       4897.81      0.4929      0.4929      124   
    Iter      log prob        ||dx||      ||grad||       alpha      alpha0  # evals  Notes 
     140       18912.6   9.05302e-09       5389.07      0.2538      0.2538      176   
Optimization terminated normally: 
  Convergence detected: absolute parameter change was below tolerance
INFO:fbprophet:Making 5 forecasts with cutoffs between 2013-10-07 00:00:00 and 2015-10-18 00:00:00
INFO:fbprophet:Applying in parallel with <concurrent.futures.process.ProcessPoolExecutor object at 0x7fc84dc76310>
Initial log joint probability = -8.95172
    Iter      log prob        ||dx||      ||grad||       alpha      alpha0  # evals  Notes 
Initial log joint probability = -12.7302
    Iter      log prob        ||dx||      ||grad||       alpha      alpha0  # evals  Notes 
Initial log joint probability = -15.1549
    Iter      log prob        ||dx||      ||grad||       alpha      alpha0  # evals  Notes 
Initial log joint probability = -18.717
    Iter      log prob        ||dx||      ||grad||       alpha      alpha0  # evals  Notes 
Initial log joint probability = -23.5879
    Iter      log prob        ||dx||      ||grad||       alpha      alpha0  # evals  Notes 
      66       4678.95   2.03174e-06       4912.82   4.103e-10       0.001      124  LS failed, Hessian reset 
      99       4678.96   9.11537e-09       4868.26      0.3544           1      166   
Optimization terminated normally: 
  Convergence detected: absolute parameter change was below tolerance
      54       9582.28   5.72044e-09       4606.77      0.3048      0.3048       75   
Optimization terminated normally: 
  Convergence detected: absolute parameter change was below tolerance
      93       7027.81   2.07961e-05       4757.57   4.762e-09       0.001      168  LS failed, Hessian reset 
      99       7027.89   6.76606e-06       5158.72      0.2869           1      175   
    Iter      log prob        ||dx||      ||grad||       alpha      alpha0  # evals  Notes 
      59       11813.2   7.30542e-09       4883.28      0.5813      0.5813       83   
Optimization terminated normally: 
  Convergence detected: absolute parameter change was below tolerance
     138       7028.01   8.13191e-09       4267.27      0.5121      0.5121      226   
Optimization terminated normally: 
  Convergence detected: absolute parameter change was below tolerance
      86       14232.1   9.38942e-06       4781.11   1.805e-09       0.001      143  LS failed, Hessian reset 
      99       14232.1   5.21197e-07       5084.73      0.2841      0.6937      158   
    Iter      log prob        ||dx||      ||grad||       alpha      alpha0  # evals  Notes 
     106       14232.1   1.84226e-06       4819.52   3.879e-10       0.001      206  LS failed, Hessian reset 
     133       14232.2   2.32553e-09       4897.32      0.2401      0.2401      239   
Optimization terminated normally: 
  Convergence detected: absolute parameter change was below tolerance
