[I 2020-10-01 03:10:28,482] Trial 228 finished with value: 0.04117974754210462 and parameters: {'changepoint_prior_scale': 0.0018964290950460225, 'seasonality_prior_scale': 0.2567202034075177, 'holidays_prior_scale': 2.4636114194072913, 'seasonality_mode': 'additive', 'changepoint_range': 0.5187464683957654}. Best is trial 96 with value: 0.038883738900888705.
Initial log joint probability = -28.8311
    Iter      log prob        ||dx||      ||grad||       alpha      alpha0  # evals  Notes 
      99       18912.5   7.68772e-08       3972.48      0.2498           1      130   
    Iter      log prob        ||dx||      ||grad||       alpha      alpha0  # evals  Notes 
     153       18912.6    2.7615e-08        3143.9      0.3388           1      198   
Optimization terminated normally: 
  Convergence detected: relative gradient magnitude is below tolerance
INFO:fbprophet:Making 5 forecasts with cutoffs between 2013-10-07 00:00:00 and 2015-10-18 00:00:00
INFO:fbprophet:Applying in parallel with <concurrent.futures.process.ProcessPoolExecutor object at 0x7fc84dc04850>
Initial log joint probability = -8.95172
    Iter      log prob        ||dx||      ||grad||       alpha      alpha0  # evals  Notes 
Initial log joint probability = -12.7302
    Iter      log prob        ||dx||      ||grad||       alpha      alpha0  # evals  Notes 
Initial log joint probability = -15.1549
    Iter      log prob        ||dx||      ||grad||       alpha      alpha0  # evals  Notes 
Initial log joint probability = -18.717
    Iter      log prob        ||dx||      ||grad||       alpha      alpha0  # evals  Notes 
      60       4679.28   6.83955e-09       3548.11      0.1747           1       87   
Optimization terminated normally: 
  Convergence detected: absolute parameter change was below tolerance
Initial log joint probability = -23.5879
    Iter      log prob        ||dx||      ||grad||       alpha      alpha0  # evals  Notes 
      82       7028.88   2.20881e-05       3489.03   6.563e-09       0.001      145  LS failed, Hessian reset 
      99       7028.93   8.83075e-07       3397.89           1           1      165   
    Iter      log prob        ||dx||      ||grad||       alpha      alpha0  # evals  Notes 
      85       9582.51   7.61476e-09       3428.48      0.2459      0.2459      121   
Optimization terminated normally: 
  Convergence detected: absolute parameter change was below tolerance
      60       11813.2    6.2422e-09       3450.38      0.4159      0.4159       88   
Optimization terminated normally: 
  Convergence detected: absolute parameter change was below tolerance
     139       7028.96   9.74787e-09       3335.42      0.2895      0.2895      215   
Optimization terminated normally: 
  Convergence detected: absolute parameter change was below tolerance
      99       14233.2   0.000214465       3495.12      0.6609      0.6609      128   
    Iter      log prob        ||dx||      ||grad||       alpha      alpha0  # evals  Notes 
     149       14233.5   1.44884e-08       3553.25      0.3867      0.8298      197   
Optimization terminated normally: 
  Convergence detected: relative gradient magnitude is below tolerance
[I 2020-10-01 03:10:44,649] Trial 229 finished with value: 0.0410613945230179 and parameters: {'changepoint_prior_scale': 0.0013867663623990446, 'seasonality_prior_scale': 0.19293956625899503, 'holidays_prior_scale': 0.10376388012104655, 'seasonality_mode': 'additive', 'changepoint_range': 0.537702998546083}. Best is trial 96 with value: 0.038883738900888705.
Initial log joint probability = -28.8311
    Iter      log prob        ||dx||      ||grad||       alpha      alpha0  # evals  Notes 
      99       18912.3   9.44909e-06       3402.98           1           1      126   
    Iter      log prob        ||dx||      ||grad||       alpha      alpha0  # evals  Notes 
     126       18912.4   5.72412e-09       3891.34     0.06679     0.06679      166   
Optimization terminated normally: 
  Convergence detected: absolute parameter change was below tolerance
INFO:fbprophet:Making 5 forecasts with cutoffs between 2013-10-07 00:00:00 and 2015-10-18 00:00:00
INFO:fbprophet:Applying in parallel with <concurrent.futures.process.ProcessPoolExecutor object at 0x7fc84dbe8150>
Initial log joint probability = -8.95172
    Iter      log prob        ||dx||      ||grad||       alpha      alpha0  # evals  Notes 
Initial log joint probability = -12.7302
    Iter      log prob        ||dx||      ||grad||       alpha      alpha0  # evals  Notes 
Initial log joint probability = -15.1549
    Iter      log prob        ||dx||      ||grad||       alpha      alpha0  # evals  Notes 
Initial log joint probability = -18.717
    Iter      log prob        ||dx||      ||grad||       alpha      alpha0  # evals  Notes 
      63       4676.97   9.25352e-09       4220.18      0.4529      0.4529       81   
Optimization terminated normally: 
  Convergence detected: absolute parameter change was below tolerance
Initial log joint probability = -23.5879
    Iter      log prob        ||dx||      ||grad||       alpha      alpha0  # evals  Notes 
      93       7028.63   4.20814e-05       4416.15   1.023e-08       0.001      153  LS failed, Hessian reset 
      99       7028.72    7.0493e-06       4037.45           1           1      161   
    Iter      log prob        ||dx||      ||grad||       alpha      alpha0  # evals  Notes 
      28       11812.2   0.000161486       4392.78   3.877e-08       0.001       79  LS failed, Hessian reset 
      62       9582.37    3.3211e-07       3882.09   7.431e-11       0.001      134  LS failed, Hessian reset 
     145       7028.75   9.54911e-09       3579.63       0.458       0.458      215   
Optimization terminated normally: 
  Convergence detected: absolute parameter change was below tolerance
      74       9582.38   4.37749e-09       3350.59      0.3348      0.3348      149   
Optimization terminated normally: 
  Convergence detected: absolute parameter change was below tolerance
      99       14232.3   4.95234e-08       4094.28      0.2979           1      134   
    Iter      log prob        ||dx||      ||grad||       alpha      alpha0  # evals  Notes 
      96       11813.1   8.34528e-09       4137.48      0.2796      0.2796      165   
Optimization terminated normally: 
  Convergence detected: absolute parameter change was below tolerance
     110       14232.4   9.49523e-06       4213.98   2.283e-09       0.001      189  LS failed, Hessian reset 
     167       14232.4   1.60561e-07       4422.93   3.585e-11       0.001      292  LS failed, Hessian reset 
     177       14232.4   9.38354e-09       3893.68      0.7557      0.7557      302   
Optimization terminated normally: 
  Convergence detected: absolute parameter change was below tolerance
[I 2020-10-01 03:10:59,472] Trial 230 finished with value: 0.04121188965320624 and parameters: {'changepoint_prior_scale': 0.0011912430647314975, 'seasonality_prior_scale': 0.14951324346984018, 'holidays_prior_scale': 0.07718697523595741, 'seasonality_mode': 'additive', 'changepoint_range': 0.548209872257267}. Best is trial 96 with value: 0.038883738900888705.
Initial log joint probability = -28.8311
    Iter      log prob        ||dx||      ||grad||       alpha      alpha0  # evals  Notes 
      99       18912.2   1.27172e-05        3056.9           1           1      128   
    Iter      log prob        ||dx||      ||grad||       alpha      alpha0  # evals  Notes 
     152       18912.3   8.15233e-09       2676.81      0.2299      0.2299      193   
Optimization terminated normally: 
  Convergence detected: absolute parameter change was below tolerance
INFO:fbprophet:Making 5 forecasts with cutoffs between 2013-10-07 00:00:00 and 2015-10-18 00:00:00
INFO:fbprophet:Applying in parallel with <concurrent.futures.process.ProcessPoolExecutor object at 0x7fc84dc48590>
Initial log joint probability = -8.95172
    Iter      log prob        ||dx||      ||grad||       alpha      alpha0  # evals  Notes 
Initial log joint probability = -12.7302
    Iter      log prob        ||dx||      ||grad||       alpha      alpha0  # evals  Notes 
Initial log joint probability = -15.1549
    Iter      log prob        ||dx||      ||grad||       alpha      alpha0  # evals  Notes 
Initial log joint probability = -18.717
    Iter      log prob        ||dx||      ||grad||       alpha      alpha0  # evals  Notes 
Initial log joint probability = -23.5879
    Iter      log prob        ||dx||      ||grad||       alpha      alpha0  # evals  Notes 
      49       4675.44   0.000452468       3153.74   1.483e-07       0.001      117  LS failed, Hessian reset 
      97       4678.98   7.67414e-09       3172.44      0.5093      0.5093      172   
Optimization terminated normally: 
  Convergence detected: absolute parameter change was below tolerance
      99        7029.8     0.0028586       3408.87           1           1      127   
    Iter      log prob        ||dx||      ||grad||       alpha      alpha0  # evals  Notes 
      63       9582.39   3.68726e-09       3590.41      0.2759      0.2759       88   
Optimization terminated normally: 
  Convergence detected: absolute parameter change was below tolerance
      31       11811.5   0.000269062       3063.46    9.34e-08       0.001       82  LS failed, Hessian reset 
     182       7031.66   8.35406e-08       3232.03   2.489e-11       0.001      276  LS failed, Hessian reset 
     191       7031.66   8.97513e-09       3259.35      0.8706      0.8706      288   
Optimization terminated normally: 
  Convergence detected: absolute parameter change was below tolerance
      79         11813   8.79365e-09       3295.49     0.02003           1      148   
Optimization terminated normally: 
  Convergence detected: absolute parameter change was below tolerance
      86       14232.8   6.01449e-05       2938.85   1.707e-08       0.001      145  LS failed, Hessian reset 
      99       14232.9   3.77337e-06       2675.45       0.243           1      162   
    Iter      log prob        ||dx||      ||grad||       alpha      alpha0  # evals  Notes 
     132       14232.9   3.42613e-08       3287.03           1           1      203   
Optimization terminated normally: 
  Convergence detected: relative gradient magnitude is below tolerance
[I 2020-10-01 03:11:15,282] Trial 231 finished with value: 0.0420456629708711 and parameters: {'changepoint_prior_scale': 0.0015157708036054706, 'seasonality_prior_scale': 0.2235008895956236, 'holidays_prior_scale': 0.15976595821493766, 'seasonality_mode': 'additive', 'changepoint_range': 0.5668083090272475}. Best is trial 96 with value: 0.038883738900888705.
Initial log joint probability = -28.8311
    Iter      log prob        ||dx||      ||grad||       alpha      alpha0  # evals  Notes 
      99       18912.9   2.99492e-07       2482.52           1           1      130   
    Iter      log prob        ||dx||      ||grad||       alpha      alpha0  # evals  Notes 
     109       18912.9   8.92101e-09       2694.13      0.2783      0.2783      144   
Optimization terminated normally: 
  Convergence detected: absolute parameter change was below tolerance
INFO:fbprophet:Making 5 forecasts with cutoffs between 2013-10-07 00:00:00 and 2015-10-18 00:00:00
INFO:fbprophet:Applying in parallel with <concurrent.futures.process.ProcessPoolExecutor object at 0x7fc84dc487d0>
Initial log joint probability = -8.95172
    Iter      log prob        ||dx||      ||grad||       alpha      alpha0  # evals  Notes 
Initial log joint probability = -12.7302
    Iter      log prob        ||dx||      ||grad||       alpha      alpha0  # evals  Notes 
Initial log joint probability = -15.1549
    Iter      log prob        ||dx||      ||grad||       alpha      alpha0  # evals  Notes 
Initial log joint probability = -18.717
    Iter      log prob        ||dx||      ||grad||       alpha      alpha0  # evals  Notes 
Initial log joint probability = -23.5879
    Iter      log prob        ||dx||      ||grad||       alpha      alpha0  # evals  Notes 
      79       4678.77   2.70355e-09        2948.4      0.1854      0.1854      105   
Optimization terminated normally: 
  Convergence detected: absolute parameter change was below tolerance
      66       7029.59   2.35276e-05       3070.07   8.155e-09       0.001      120  LS failed, Hessian reset 
      58       9582.47   2.21652e-09        2904.6       0.196       0.196       82   
Optimization terminated normally: 
  Convergence detected: absolute parameter change was below tolerance
      99       7029.73   6.33484e-07       2636.68      0.3421           1      159   
    Iter      log prob        ||dx||      ||grad||       alpha      alpha0  # evals  Notes 
      66       11813.3   4.84577e-09       2806.41       0.161       0.161       94   
Optimization terminated normally: 
  Convergence detected: absolute parameter change was below tolerance
     199       7032.08   6.08451e-07       2957.51      0.5921      0.5921      281   
    Iter      log prob        ||dx||      ||grad||       alpha      alpha0  # evals  Notes 
      86       14233.5   8.72599e-09       2764.27      0.2498      0.2498      119   
Optimization terminated normally: 
  Convergence detected: absolute parameter change was below tolerance
     206        7032.1   5.56747e-06       2775.13   1.835e-09       0.001      331  LS failed, Hessian reset 
     234       7032.11   5.15111e-09        3045.8      0.4032      0.4032      364   
Optimization terminated normally: 
  Convergence detected: absolute parameter change was below tolerance
[I 2020-10-01 03:11:31,287] Trial 232 finished with value: 0.04187960671410351 and parameters: {'changepoint_prior_scale': 0.0016753431655143708, 'seasonality_prior_scale': 0.26069257282994474, 'holidays_prior_scale': 0.1524943335933682, 'seasonality_mode': 'additive', 'changepoint_range': 0.559984988564659}. Best is trial 96 with value: 0.038883738900888705.
Initial log joint probability = -28.8311
    Iter      log prob        ||dx||      ||grad||       alpha      alpha0  # evals  Notes 
      99       18912.5    8.7934e-07       3626.14           1           1      126   
    Iter      log prob        ||dx||      ||grad||       alpha      alpha0  # evals  Notes 
     151       18912.6   2.20847e-06       3730.61   6.121e-10       0.001      229  LS failed, Hessian reset 
     173       18912.6   6.86652e-09       3547.35      0.3106      0.3106      258   
Optimization terminated normally: 
  Convergence detected: absolute parameter change was below tolerance
INFO:fbprophet:Making 5 forecasts with cutoffs between 2013-10-07 00:00:00 and 2015-10-18 00:00:00
INFO:fbprophet:Applying in parallel with <concurrent.futures.process.ProcessPoolExecutor object at 0x7fc84dc487d0>
Initial log joint probability = -8.95172
    Iter      log prob        ||dx||      ||grad||       alpha      alpha0  # evals  Notes 
Initial log joint probability = -12.7302
    Iter      log prob        ||dx||      ||grad||       alpha      alpha0  # evals  Notes 
Initial log joint probability = -15.1549
    Iter      log prob        ||dx||      ||grad||       alpha      alpha0  # evals  Notes 
Initial log joint probability = -18.717
    Iter      log prob        ||dx||      ||grad||       alpha      alpha0  # evals  Notes 
      66       4679.15    6.5308e-09       3483.33      0.3121      0.3121       82   
Optimization terminated normally: 
  Convergence detected: absolute parameter change was below tolerance
Initial log joint probability = -23.5879
    Iter      log prob        ||dx||      ||grad||       alpha      alpha0  # evals  Notes 
      99       7028.64   2.13435e-05       3774.63           1           1      126   
    Iter      log prob        ||dx||      ||grad||       alpha      alpha0  # evals  Notes 
      61       9582.43   5.71858e-09       3204.02      0.2236      0.2236       87   
Optimization terminated normally: 
  Convergence detected: absolute parameter change was below tolerance
     104       7028.78   6.35836e-05       3578.48   1.759e-08       0.001      176  LS failed, Hessian reset 
      81       11813.2    8.3339e-09       3608.15      0.5543      0.5543      114   
Optimization terminated normally: 
  Convergence detected: absolute parameter change was below tolerance
     199       7029.75   1.57161e-05       3668.23           1           1      297   
    Iter      log prob        ||dx||      ||grad||       alpha      alpha0  # evals  Notes 
      99       14232.5    6.8209e-06       3624.12      0.6191      0.6191      120   
    Iter      log prob        ||dx||      ||grad||       alpha      alpha0  # evals  Notes 
     148       14232.9   9.57232e-09       3463.81      0.4993      0.4993      177   
Optimization terminated normally: 
  Convergence detected: absolute parameter change was below tolerance
     276       7031.92   2.12523e-07        3897.8   6.038e-11       0.001      436  LS failed, Hessian reset 
     288       7031.92   1.86017e-09        3597.5      0.1698      0.1698      451   
Optimization terminated normally: 
  Convergence detected: absolute parameter change was below tolerance
[I 2020-10-01 03:11:46,474] Trial 233 finished with value: 0.04171920845437042 and parameters: {'changepoint_prior_scale': 0.0013709408521124101, 'seasonality_prior_scale': 0.22464013465994292, 'holidays_prior_scale': 0.119222235434033, 'seasonality_mode': 'additive', 'changepoint_range': 0.5631756772015724}. Best is trial 96 with value: 0.038883738900888705.
Initial log joint probability = -28.8311
    Iter      log prob        ||dx||      ||grad||       alpha      alpha0  # evals  Notes 
      98       18912.9   3.34046e-08       3132.65      0.2399           1      127   
Optimization terminated normally: 
  Convergence detected: relative gradient magnitude is below tolerance
INFO:fbprophet:Making 5 forecasts with cutoffs between 2013-10-07 00:00:00 and 2015-10-18 00:00:00
INFO:fbprophet:Applying in parallel with <concurrent.futures.process.ProcessPoolExecutor object at 0x7fc84dbb3c10>
Initial log joint probability = -8.95172
    Iter      log prob        ||dx||      ||grad||       alpha      alpha0  # evals  Notes 
Initial log joint probability = -12.7302
    Iter      log prob        ||dx||      ||grad||       alpha      alpha0  # evals  Notes 
Initial log joint probability = -15.1549
    Iter      log prob        ||dx||      ||grad||       alpha      alpha0  # evals  Notes 
Initial log joint probability = -18.717
    Iter      log prob        ||dx||      ||grad||       alpha      alpha0  # evals  Notes 
Initial log joint probability = -23.5879
    Iter      log prob        ||dx||      ||grad||       alpha      alpha0  # evals  Notes 
      95       4678.96   3.17694e-09       3053.33        0.27        0.27      122   
Optimization terminated normally: 
  Convergence detected: absolute parameter change was below tolerance
      81       7029.51   1.91132e-05       2896.85   5.886e-09       0.001      139  LS failed, Hessian reset 
      69       9582.49   3.89644e-09       3069.76      0.2006      0.2006       96   
Optimization terminated normally: 
  Convergence detected: absolute parameter change was below tolerance
      99       7029.63   7.54502e-07       2957.66           1           1      164   
    Iter      log prob        ||dx||      ||grad||       alpha      alpha0  # evals  Notes 
      35       11811.6   0.000487524       3384.13   1.871e-07       0.001       91  LS failed, Hessian reset 
     153       7029.63   4.17114e-09       2892.51      0.3216      0.3216      231   
Optimization terminated normally: 
  Convergence detected: absolute parameter change was below tolerance
      86       11813.2   8.87908e-09       3250.19      0.5728      0.5728      154   
Optimization terminated normally: 
  Convergence detected: absolute parameter change was below tolerance
      99       14233.3   0.000319567       2861.06      0.6307      0.6307      132   
    Iter      log prob        ||dx||      ||grad||       alpha      alpha0  # evals  Notes 
     100       14233.4   3.23545e-05       2883.11   1.131e-08       0.001      171  LS failed, Hessian reset 
     159       14233.5   8.50365e-09       3253.47      0.3909      0.3909      241   
Optimization terminated normally: 
  Convergence detected: absolute parameter change was below tolerance
