[I 2020-10-01 04:08:45,888] Trial 457 finished with value: 0.041799643776894234 and parameters: {'changepoint_prior_scale': 0.0021117749377437115, 'seasonality_prior_scale': 0.1261153900470781, 'holidays_prior_scale': 0.07110940660869658, 'seasonality_mode': 'additive', 'changepoint_range': 0.5207736725433947}. Best is trial 96 with value: 0.038883738900888705.
Initial log joint probability = -28.8311
    Iter      log prob        ||dx||      ||grad||       alpha      alpha0  # evals  Notes 
      62       18910.7   2.62096e-05       4494.88   5.665e-09       0.001      115  LS failed, Hessian reset 
      99       18910.8   4.40286e-08       4652.02      0.3248     0.03248      167   
    Iter      log prob        ||dx||      ||grad||       alpha      alpha0  # evals  Notes 
     199       18912.8   9.26851e-08       4612.84      0.5553      0.5553      281   
    Iter      log prob        ||dx||      ||grad||       alpha      alpha0  # evals  Notes 
     209       18912.8   9.79232e-09       4654.35      0.5208      0.5208      292   
Optimization terminated normally: 
  Convergence detected: absolute parameter change was below tolerance
INFO:fbprophet:Making 5 forecasts with cutoffs between 2013-10-07 00:00:00 and 2015-10-18 00:00:00
INFO:fbprophet:Applying in parallel with <concurrent.futures.process.ProcessPoolExecutor object at 0x7fc84dcaa390>
Initial log joint probability = -8.95172
    Iter      log prob        ||dx||      ||grad||       alpha      alpha0  # evals  Notes 
Initial log joint probability = -12.7302
    Iter      log prob        ||dx||      ||grad||       alpha      alpha0  # evals  Notes 
Initial log joint probability = -15.1549
    Iter      log prob        ||dx||      ||grad||       alpha      alpha0  # evals  Notes 
Initial log joint probability = -18.717
    Iter      log prob        ||dx||      ||grad||       alpha      alpha0  # evals  Notes 
      65        4678.7   8.11556e-09       5011.08      0.6459      0.6459       92   
Optimization terminated normally: 
  Convergence detected: absolute parameter change was below tolerance
Initial log joint probability = -23.5879
    Iter      log prob        ||dx||      ||grad||       alpha      alpha0  # evals  Notes 
      99       7028.09   1.03754e-08       4471.46      0.3326      0.3326      128   
    Iter      log prob        ||dx||      ||grad||       alpha      alpha0  # evals  Notes 
     101       7028.09   3.38494e-09       4673.17      0.4423      0.4423      130   
Optimization terminated normally: 
  Convergence detected: absolute parameter change was below tolerance
      91       9582.21   5.43266e-09       4342.94      0.4924      0.4924      115   
Optimization terminated normally: 
  Convergence detected: absolute parameter change was below tolerance
      65       11812.8   1.75392e-07       5490.15   3.668e-11       0.001      138  LS failed, Hessian reset 
      74       11812.8   9.49439e-09       4902.35      0.2349           1      150   
Optimization terminated normally: 
  Convergence detected: absolute parameter change was below tolerance
      99         14233   2.06708e-06       5043.12      0.5678      0.5678      124   
    Iter      log prob        ||dx||      ||grad||       alpha      alpha0  # evals  Notes 
     147       14233.3   8.10294e-09       4744.84      0.5625      0.5625      185   
Optimization terminated normally: 
  Convergence detected: absolute parameter change was below tolerance
[I 2020-10-01 04:09:02,129] Trial 458 finished with value: 0.041022470434767484 and parameters: {'changepoint_prior_scale': 0.001001290411590113, 'seasonality_prior_scale': 0.15513173002802527, 'holidays_prior_scale': 0.0895340514618212, 'seasonality_mode': 'additive', 'changepoint_range': 0.5796463438788797}. Best is trial 96 with value: 0.038883738900888705.
Initial log joint probability = -28.8311
    Iter      log prob        ||dx||      ||grad||       alpha      alpha0  # evals  Notes 
      99       18912.7   4.07983e-06       2422.53      0.5306      0.5306      126   
    Iter      log prob        ||dx||      ||grad||       alpha      alpha0  # evals  Notes 
     128       18912.7   3.60859e-08       2669.07           1           1      161   
Optimization terminated normally: 
  Convergence detected: relative gradient magnitude is below tolerance
INFO:fbprophet:Making 5 forecasts with cutoffs between 2013-10-07 00:00:00 and 2015-10-18 00:00:00
INFO:fbprophet:Applying in parallel with <concurrent.futures.process.ProcessPoolExecutor object at 0x7fc84dc76fd0>
Initial log joint probability = -8.95172
    Iter      log prob        ||dx||      ||grad||       alpha      alpha0  # evals  Notes 
Initial log joint probability = -12.7302
    Iter      log prob        ||dx||      ||grad||       alpha      alpha0  # evals  Notes 
Initial log joint probability = -15.1549
    Iter      log prob        ||dx||      ||grad||       alpha      alpha0  # evals  Notes 
Initial log joint probability = -18.717
    Iter      log prob        ||dx||      ||grad||       alpha      alpha0  # evals  Notes 
Initial log joint probability = -23.5879
    Iter      log prob        ||dx||      ||grad||       alpha      alpha0  # evals  Notes 
      75       4679.26   7.04309e-09       2423.21      0.2979      0.2979       99   
Optimization terminated normally: 
  Convergence detected: absolute parameter change was below tolerance
      99       7029.89   1.29109e-07       2677.56           1           1      123   
    Iter      log prob        ||dx||      ||grad||       alpha      alpha0  # evals  Notes 
      66       9582.61   7.45358e-09       2711.08      0.3929      0.3929       94   
Optimization terminated normally: 
  Convergence detected: absolute parameter change was below tolerance
     126        7029.9   1.41131e-06       2853.54   5.748e-10       0.001      193  LS failed, Hessian reset 
     149        7029.9   7.08311e-09       2705.89      0.5554      0.5554      222   
Optimization terminated normally: 
  Convergence detected: absolute parameter change was below tolerance
      55       11812.5   0.000173874       2730.37   6.709e-08       0.001      133  LS failed, Hessian reset 
      99       11813.3   2.78014e-08       2621.85      0.5577      0.5577      186   
    Iter      log prob        ||dx||      ||grad||       alpha      alpha0  # evals  Notes 
     101       11813.3   6.08418e-09       2787.55      0.3001      0.3001      189   
Optimization terminated normally: 
  Convergence detected: absolute parameter change was below tolerance
      83       14232.6   0.000552121       2674.32   1.865e-07       0.001      166  LS failed, Hessian reset 
      99       14233.5   1.19333e-05        2749.6      0.8595      0.8595      189   
    Iter      log prob        ||dx||      ||grad||       alpha      alpha0  # evals  Notes 
     164       14233.6   4.90685e-08       2791.17           1           1      273   
Optimization terminated normally: 
  Convergence detected: relative gradient magnitude is below tolerance
[I 2020-10-01 04:09:17,634] Trial 459 finished with value: 0.041557279152665945 and parameters: {'changepoint_prior_scale': 0.0017983777335810703, 'seasonality_prior_scale': 0.21147334605322582, 'holidays_prior_scale': 0.12235548144509444, 'seasonality_mode': 'additive', 'changepoint_range': 0.6272133050243912}. Best is trial 96 with value: 0.038883738900888705.
Initial log joint probability = -28.8311
    Iter      log prob        ||dx||      ||grad||       alpha      alpha0  # evals  Notes 
      99       18912.9   1.22993e-05       3383.05       0.249           1      119   
    Iter      log prob        ||dx||      ||grad||       alpha      alpha0  # evals  Notes 
     143       18912.9   1.75235e-06       3904.12   5.245e-10       0.001      218  LS failed, Hessian reset 
     170       18912.9   2.48548e-08       3658.81           1           1      251   
Optimization terminated normally: 
  Convergence detected: relative gradient magnitude is below tolerance
INFO:fbprophet:Making 5 forecasts with cutoffs between 2013-10-07 00:00:00 and 2015-10-18 00:00:00
INFO:fbprophet:Applying in parallel with <concurrent.futures.process.ProcessPoolExecutor object at 0x7fc84dcaadd0>
Initial log joint probability = -8.95172
    Iter      log prob        ||dx||      ||grad||       alpha      alpha0  # evals  Notes 
Initial log joint probability = -12.7302
    Iter      log prob        ||dx||      ||grad||       alpha      alpha0  # evals  Notes 
Initial log joint probability = -15.1549
    Iter      log prob        ||dx||      ||grad||       alpha      alpha0  # evals  Notes 
Initial log joint probability = -18.717
    Iter      log prob        ||dx||      ||grad||       alpha      alpha0  # evals  Notes 
      61       4679.18   7.21162e-09       3926.84      0.3059           1       85   
Optimization terminated normally: 
  Convergence detected: absolute parameter change was below tolerance
Initial log joint probability = -23.5879
    Iter      log prob        ||dx||      ||grad||       alpha      alpha0  # evals  Notes 
      69       7028.61   2.10248e-05       3868.43   5.463e-09       0.001      130  LS failed, Hessian reset 
      99        7028.7   1.40318e-08       4011.32      0.5095      0.5095      169   
    Iter      log prob        ||dx||      ||grad||       alpha      alpha0  # evals  Notes 
      81       9582.48   6.51125e-09       3682.74      0.1929      0.1929      112   
Optimization terminated normally: 
  Convergence detected: absolute parameter change was below tolerance
     120        7028.7   5.48675e-09       3858.81     0.05211    0.005211      196   
Optimization terminated normally: 
  Convergence detected: absolute parameter change was below tolerance
      35       11812.2   0.000212797       3864.36   5.355e-08       0.001       94  LS failed, Hessian reset 
      98       11813.3   2.39044e-09       3901.12       0.221       0.221      169   
Optimization terminated normally: 
  Convergence detected: absolute parameter change was below tolerance
      99       14233.5   1.31937e-05       3904.21   3.363e-09       0.001      177  LS failed, Hessian reset 
    Iter      log prob        ||dx||      ||grad||       alpha      alpha0  # evals  Notes 
     122       14233.5   7.88633e-09       4191.01      0.4156      0.4156      205   
Optimization terminated normally: 
  Convergence detected: absolute parameter change was below tolerance
[I 2020-10-01 04:09:33,243] Trial 460 finished with value: 0.04114010766774853 and parameters: {'changepoint_prior_scale': 0.0012678264030103964, 'seasonality_prior_scale': 0.17327161493820362, 'holidays_prior_scale': 0.14051635247842628, 'seasonality_mode': 'additive', 'changepoint_range': 0.5440945818192702}. Best is trial 96 with value: 0.038883738900888705.
Initial log joint probability = -28.8311
    Iter      log prob        ||dx||      ||grad||       alpha      alpha0  # evals  Notes 
      99       18912.6   4.67612e-06       4767.21      0.9684      0.9684      119   
    Iter      log prob        ||dx||      ||grad||       alpha      alpha0  # evals  Notes 
     139       18912.8   8.15668e-09       4412.56      0.3164      0.3164      171   
Optimization terminated normally: 
  Convergence detected: absolute parameter change was below tolerance
INFO:fbprophet:Making 5 forecasts with cutoffs between 2013-10-07 00:00:00 and 2015-10-18 00:00:00
INFO:fbprophet:Applying in parallel with <concurrent.futures.process.ProcessPoolExecutor object at 0x7fc84dcaa350>
Initial log joint probability = -8.95172
    Iter      log prob        ||dx||      ||grad||       alpha      alpha0  # evals  Notes 
Initial log joint probability = -12.7302
    Iter      log prob        ||dx||      ||grad||       alpha      alpha0  # evals  Notes 
Initial log joint probability = -15.1549
    Iter      log prob        ||dx||      ||grad||       alpha      alpha0  # evals  Notes 
Initial log joint probability = -18.717
    Iter      log prob        ||dx||      ||grad||       alpha      alpha0  # evals  Notes 
      62       4678.81   6.29529e-09       4487.44      0.1743      0.1743       86   
Optimization terminated normally: 
  Convergence detected: absolute parameter change was below tolerance
Initial log joint probability = -23.5879
    Iter      log prob        ||dx||      ||grad||       alpha      alpha0  # evals  Notes 
      64       7028.22   1.89258e-05       4077.81   4.297e-09       0.001      118  LS failed, Hessian reset 
      69       9582.35   9.66573e-09       3785.25      0.2208           1       98   
Optimization terminated normally: 
  Convergence detected: absolute parameter change was below tolerance
      99        7028.3   1.08756e-07       4671.34           1           1      161   
    Iter      log prob        ||dx||      ||grad||       alpha      alpha0  # evals  Notes 
     118       7028.32   1.35669e-06       4874.63   3.373e-10       0.001      226  LS failed, Hessian reset 
     142       7028.33   4.98727e-09       4264.38       0.782       0.782      257   
Optimization terminated normally: 
  Convergence detected: absolute parameter change was below tolerance
      90       11813.1   1.05098e-07       4310.93   2.263e-11       0.001      170  LS failed, Hessian reset 
      94       11813.1   2.36735e-09       4121.57      0.1835      0.1835      175   
Optimization terminated normally: 
  Convergence detected: absolute parameter change was below tolerance
      99       14232.8   7.68139e-06        4283.2       0.654       0.654      139   
    Iter      log prob        ||dx||      ||grad||       alpha      alpha0  # evals  Notes 
     166       14233.2   2.04831e-05       4509.09   4.869e-09       0.001      266  LS failed, Hessian reset 
     199       14233.3   7.08659e-07       4166.34           1           1      308   
    Iter      log prob        ||dx||      ||grad||       alpha      alpha0  # evals  Notes 
     229       14233.3   2.50812e-07       4259.79   5.286e-11       0.001      384  LS failed, Hessian reset 
     235       14233.3    8.7841e-09       3665.88      0.2987      0.2987      392   
Optimization terminated normally: 
  Convergence detected: absolute parameter change was below tolerance
[I 2020-10-01 04:09:48,968] Trial 461 finished with value: 0.04118921404100482 and parameters: {'changepoint_prior_scale': 0.0011194334593134213, 'seasonality_prior_scale': 0.13406767117874185, 'holidays_prior_scale': 0.09712508818617258, 'seasonality_mode': 'additive', 'changepoint_range': 0.5380322738174961}. Best is trial 96 with value: 0.038883738900888705.
Initial log joint probability = -28.8311
    Iter      log prob        ||dx||      ||grad||       alpha      alpha0  # evals  Notes 
      99       18911.9   1.44592e-05        4637.9           1           1      121   
    Iter      log prob        ||dx||      ||grad||       alpha      alpha0  # evals  Notes 
     151       18912.5   9.87349e-09       4346.63      0.2717      0.2717      187   
Optimization terminated normally: 
  Convergence detected: absolute parameter change was below tolerance
INFO:fbprophet:Making 5 forecasts with cutoffs between 2013-10-07 00:00:00 and 2015-10-18 00:00:00
INFO:fbprophet:Applying in parallel with <concurrent.futures.process.ProcessPoolExecutor object at 0x7fc84db08550>
Initial log joint probability = -8.95172
    Iter      log prob        ||dx||      ||grad||       alpha      alpha0  # evals  Notes 
Initial log joint probability = -12.7302
    Iter      log prob        ||dx||      ||grad||       alpha      alpha0  # evals  Notes 
      99       4678.53   7.84582e-08       4971.75        0.73        0.73      126   
    Iter      log prob        ||dx||      ||grad||       alpha      alpha0  # evals  Notes 
Initial log joint probability = -15.1549
    Iter      log prob        ||dx||      ||grad||       alpha      alpha0  # evals  Notes 
Initial log joint probability = -18.717
    Iter      log prob        ||dx||      ||grad||       alpha      alpha0  # evals  Notes 
Initial log joint probability = -23.5879
    Iter      log prob        ||dx||      ||grad||       alpha      alpha0  # evals  Notes 
     145       4679.22   7.13884e-09       5004.67      0.3193      0.3193      187   
Optimization terminated normally: 
  Convergence detected: absolute parameter change was below tolerance
      67       7028.01    9.1329e-06       4737.34   1.809e-09       0.001      127  LS failed, Hessian reset 
      98       7028.05   7.35554e-09       4605.92      0.4441      0.4441      164   
Optimization terminated normally: 
  Convergence detected: absolute parameter change was below tolerance
      62       9582.18   7.96632e-09       4441.46      0.2893      0.2893       90   
Optimization terminated normally: 
  Convergence detected: absolute parameter change was below tolerance
      99       14233.3   8.47277e-07       4687.86      0.6007      0.6007      129   
    Iter      log prob        ||dx||      ||grad||       alpha      alpha0  # evals  Notes 
      93         11813   1.16301e-06       5295.48    2.33e-10       0.001      177  LS failed, Hessian reset 
      99         11813   1.40589e-07       4687.65           1           1      185   
    Iter      log prob        ||dx||      ||grad||       alpha      alpha0  # evals  Notes 
     108         11813   8.22829e-09       4496.78      0.3882      0.3882      198   
Optimization terminated normally: 
  Convergence detected: absolute parameter change was below tolerance
     133       14233.3   6.89262e-09       4728.55      0.4231      0.4231      173   
Optimization terminated normally: 
  Convergence detected: absolute parameter change was below tolerance
[I 2020-10-01 04:10:03,560] Trial 462 finished with value: 0.04138210979073592 and parameters: {'changepoint_prior_scale': 0.001002070431279016, 'seasonality_prior_scale': 0.2494096649776546, 'holidays_prior_scale': 0.16298978825510457, 'seasonality_mode': 'additive', 'changepoint_range': 0.5934715326611033}. Best is trial 96 with value: 0.038883738900888705.
Initial log joint probability = -28.8311
    Iter      log prob        ||dx||      ||grad||       alpha      alpha0  # evals  Notes 
      99       18912.9   2.38288e-07       2552.16      0.7638      0.7638      130   
    Iter      log prob        ||dx||      ||grad||       alpha      alpha0  # evals  Notes 
     112       18912.9   6.23317e-08       2662.83      0.2251      0.9922      147   
Optimization terminated normally: 
  Convergence detected: relative gradient magnitude is below tolerance
INFO:fbprophet:Making 5 forecasts with cutoffs between 2013-10-07 00:00:00 and 2015-10-18 00:00:00
INFO:fbprophet:Applying in parallel with <concurrent.futures.process.ProcessPoolExecutor object at 0x7fc84dcaa910>
Initial log joint probability = -8.95172
    Iter      log prob        ||dx||      ||grad||       alpha      alpha0  # evals  Notes 
Initial log joint probability = -12.7302
    Iter      log prob        ||dx||      ||grad||       alpha      alpha0  # evals  Notes 
Initial log joint probability = -15.1549
    Iter      log prob        ||dx||      ||grad||       alpha      alpha0  # evals  Notes 
Initial log joint probability = -18.717
    Iter      log prob        ||dx||      ||grad||       alpha      alpha0  # evals  Notes 
Initial log joint probability = -23.5879
    Iter      log prob        ||dx||      ||grad||       alpha      alpha0  # evals  Notes 
      99       4679.04   1.08712e-08       3013.22      0.2911      0.7959      132   
    Iter      log prob        ||dx||      ||grad||       alpha      alpha0  # evals  Notes 
     100       4679.04   2.78339e-09        2804.1      0.2412      0.2412      133   
Optimization terminated normally: 
  Convergence detected: absolute parameter change was below tolerance
      99       7029.66    0.00034867       2803.85      0.3897           1      125   
    Iter      log prob        ||dx||      ||grad||       alpha      alpha0  # evals  Notes 
     100       7029.69   2.56703e-05       3290.73   9.155e-09       0.001      162  LS failed, Hessian reset 
      64       9582.44   3.54703e-06       2475.92   9.783e-10       0.001      131  LS failed, Hessian reset 
     140       7029.79   8.77079e-09       3073.56      0.3394      0.3394      218   
Optimization terminated normally: 
  Convergence detected: absolute parameter change was below tolerance
      86       11813.2   2.55958e-08       2894.41           1           1      118   
Optimization terminated normally: 
  Convergence detected: relative gradient magnitude is below tolerance
      99       9582.46   6.72908e-08       2413.25           1           1      173   
    Iter      log prob        ||dx||      ||grad||       alpha      alpha0  # evals  Notes 
     107       9582.46   3.96145e-09       3029.94      0.1779      0.1779      183   
Optimization terminated normally: 
  Convergence detected: absolute parameter change was below tolerance
      99       14232.8    1.8208e-05       2780.84      0.3749           1      120   
    Iter      log prob        ||dx||      ||grad||       alpha      alpha0  # evals  Notes 
     138       14232.8   6.10598e-09       2980.09      0.2591      0.2591      171   
Optimization terminated normally: 
  Convergence detected: absolute parameter change was below tolerance
