[I 2020-10-01 03:34:14,697] Trial 321 finished with value: 0.04128435802470039 and parameters: {'changepoint_prior_scale': 0.0018202958286215494, 'seasonality_prior_scale': 0.2678873636857112, 'holidays_prior_scale': 3.55119098103614, 'seasonality_mode': 'additive', 'changepoint_range': 0.5325617605868012}. Best is trial 96 with value: 0.038883738900888705.
Initial log joint probability = -28.8311
    Iter      log prob        ||dx||      ||grad||       alpha      alpha0  # evals  Notes 
      99       18912.7   3.58096e-06       3748.57      0.8037      0.8037      119   
    Iter      log prob        ||dx||      ||grad||       alpha      alpha0  # evals  Notes 
     128       18912.8   8.24246e-06       3817.58   2.131e-09       0.001      195  LS failed, Hessian reset 
     156       18912.8   9.34883e-09       4327.99      0.5401      0.5401      231   
Optimization terminated normally: 
  Convergence detected: absolute parameter change was below tolerance
INFO:fbprophet:Making 5 forecasts with cutoffs between 2013-10-07 00:00:00 and 2015-10-18 00:00:00
INFO:fbprophet:Applying in parallel with <concurrent.futures.process.ProcessPoolExecutor object at 0x7fc84dca9450>
Initial log joint probability = -8.95172
    Iter      log prob        ||dx||      ||grad||       alpha      alpha0  # evals  Notes 
Initial log joint probability = -12.7302
    Iter      log prob        ||dx||      ||grad||       alpha      alpha0  # evals  Notes 
Initial log joint probability = -15.1549
    Iter      log prob        ||dx||      ||grad||       alpha      alpha0  # evals  Notes 
Initial log joint probability = -18.717
    Iter      log prob        ||dx||      ||grad||       alpha      alpha0  # evals  Notes 
Initial log joint probability = -23.5879
    Iter      log prob        ||dx||      ||grad||       alpha      alpha0  # evals  Notes 
      65       4679.04   1.42375e-05       4017.63   3.784e-09       0.001      117  LS failed, Hessian reset 
      94       4679.09   9.37138e-09       3478.19      0.5301      0.5301      154   
Optimization terminated normally: 
  Convergence detected: absolute parameter change was below tolerance
      57       9582.41   9.12422e-09        3799.2      0.3608      0.3608       79   
Optimization terminated normally: 
  Convergence detected: absolute parameter change was below tolerance
      96       7028.82   2.35574e-05       3612.09   6.248e-09       0.001      162  LS failed, Hessian reset 
      99       7028.85   2.70887e-06       3168.96           1           1      166   
    Iter      log prob        ||dx||      ||grad||       alpha      alpha0  # evals  Notes 
      37       11809.6   0.000896472       3928.77   2.142e-07       0.001       91  LS failed, Hessian reset 
     142       7028.86   7.19064e-09       3982.33      0.4827      0.4827      222   
Optimization terminated normally: 
  Convergence detected: absolute parameter change was below tolerance
      80       11812.9   7.68293e-09       3863.32      0.2286      0.2286      146   
Optimization terminated normally: 
  Convergence detected: absolute parameter change was below tolerance
      99       14233.2   2.16307e-07       3889.08      0.8906      0.8906      121   
    Iter      log prob        ||dx||      ||grad||       alpha      alpha0  # evals  Notes 
     122       14233.2   9.44389e-09       3580.54      0.3682      0.3682      152   
Optimization terminated normally: 
  Convergence detected: absolute parameter change was below tolerance
[I 2020-10-01 03:34:30,310] Trial 322 finished with value: 0.04077581472033599 and parameters: {'changepoint_prior_scale': 0.0012923231339363888, 'seasonality_prior_scale': 0.11147542290543075, 'holidays_prior_scale': 0.06941833593350943, 'seasonality_mode': 'additive', 'changepoint_range': 0.5733010048426571}. Best is trial 96 with value: 0.038883738900888705.
Initial log joint probability = -28.8311
    Iter      log prob        ||dx||      ||grad||       alpha      alpha0  # evals  Notes 
      99       18912.6   1.04462e-05       4249.06      0.4661      0.4661      124   
    Iter      log prob        ||dx||      ||grad||       alpha      alpha0  # evals  Notes 
     170       18912.9   1.70845e-08       3977.39           1           1      216   
Optimization terminated normally: 
  Convergence detected: relative gradient magnitude is below tolerance
INFO:fbprophet:Making 5 forecasts with cutoffs between 2013-10-07 00:00:00 and 2015-10-18 00:00:00
INFO:fbprophet:Applying in parallel with <concurrent.futures.process.ProcessPoolExecutor object at 0x7fc84dcaf710>
Initial log joint probability = -8.95172
    Iter      log prob        ||dx||      ||grad||       alpha      alpha0  # evals  Notes 
Initial log joint probability = -12.7302
    Iter      log prob        ||dx||      ||grad||       alpha      alpha0  # evals  Notes 
Initial log joint probability = -15.1549
    Iter      log prob        ||dx||      ||grad||       alpha      alpha0  # evals  Notes 
Initial log joint probability = -18.717
    Iter      log prob        ||dx||      ||grad||       alpha      alpha0  # evals  Notes 
Initial log joint probability = -23.5879
    Iter      log prob        ||dx||      ||grad||       alpha      alpha0  # evals  Notes 
      47       4679.19   1.50223e-05       4165.43   3.569e-09       0.001      105  LS failed, Hessian reset 
      92       4679.27   6.53397e-09       4093.28      0.1799      0.1799      164   
Optimization terminated normally: 
  Convergence detected: absolute parameter change was below tolerance
      76       7028.52   1.28749e-05       3956.63   3.204e-09       0.001      135  LS failed, Hessian reset 
      47       9582.11    2.0354e-05       4194.23   5.174e-09       0.001      101  LS failed, Hessian reset 
      99       7028.54   3.89149e-07       3995.44      0.2405           1      163   
    Iter      log prob        ||dx||      ||grad||       alpha      alpha0  # evals  Notes 
     116       7028.55   1.38002e-07       3760.72   3.438e-11       0.001      221  LS failed, Hessian reset 
      68       11812.7   6.58824e-09       4244.91      0.3977           1       99   
Optimization terminated normally: 
  Convergence detected: absolute parameter change was below tolerance
     123       7028.55   7.49402e-09       3423.71      0.2163      0.2163      230   
Optimization terminated normally: 
  Convergence detected: absolute parameter change was below tolerance
      85        9582.2   5.30146e-09       3935.62      0.3502      0.3502      149   
Optimization terminated normally: 
  Convergence detected: absolute parameter change was below tolerance
      99       14233.1   2.21181e-06       3901.39      0.6395      0.6395      129   
    Iter      log prob        ||dx||      ||grad||       alpha      alpha0  # evals  Notes 
     174       14233.4    1.1942e-08       4197.33      0.2555      0.8341      223   
Optimization terminated normally: 
  Convergence detected: relative gradient magnitude is below tolerance
[I 2020-10-01 03:34:45,368] Trial 323 finished with value: 0.040966774566982216 and parameters: {'changepoint_prior_scale': 0.0011772730340335105, 'seasonality_prior_scale': 0.15990790178735556, 'holidays_prior_scale': 0.31904223077763216, 'seasonality_mode': 'additive', 'changepoint_range': 0.5215721474371973}. Best is trial 96 with value: 0.038883738900888705.
Initial log joint probability = -28.8311
    Iter      log prob        ||dx||      ||grad||       alpha      alpha0  # evals  Notes 
      99       18912.6   1.32802e-07       2635.95      0.7373      0.7373      128   
    Iter      log prob        ||dx||      ||grad||       alpha      alpha0  # evals  Notes 
     113       18912.6   1.19105e-08       2548.99      0.2705           1      146   
Optimization terminated normally: 
  Convergence detected: relative gradient magnitude is below tolerance
INFO:fbprophet:Making 5 forecasts with cutoffs between 2013-10-07 00:00:00 and 2015-10-18 00:00:00
INFO:fbprophet:Applying in parallel with <concurrent.futures.process.ProcessPoolExecutor object at 0x7fc84dc2f490>
Initial log joint probability = -8.95172
    Iter      log prob        ||dx||      ||grad||       alpha      alpha0  # evals  Notes 
Initial log joint probability = -12.7302
    Iter      log prob        ||dx||      ||grad||       alpha      alpha0  # evals  Notes 
Initial log joint probability = -15.1549
    Iter      log prob        ||dx||      ||grad||       alpha      alpha0  # evals  Notes 
Initial log joint probability = -18.717
    Iter      log prob        ||dx||      ||grad||       alpha      alpha0  # evals  Notes 
Initial log joint probability = -23.5879
    Iter      log prob        ||dx||      ||grad||       alpha      alpha0  # evals  Notes 
      78       4679.11   7.45399e-09       2916.53      0.3612      0.3612      104   
Optimization terminated normally: 
  Convergence detected: absolute parameter change was below tolerance
      69        7029.7   5.90806e-05       2987.21   2.036e-08       0.001      126  LS failed, Hessian reset 
      65       9582.55   9.51922e-09       3275.88      0.3283           1       95   
Optimization terminated normally: 
  Convergence detected: absolute parameter change was below tolerance
      99       7029.81    5.1274e-07       2204.89           1           1      165   
    Iter      log prob        ||dx||      ||grad||       alpha      alpha0  # evals  Notes 
      63       11813.3    8.0385e-09          3148      0.4443      0.4443       88   
Optimization terminated normally: 
  Convergence detected: absolute parameter change was below tolerance
     199       7031.91   1.50792e-07       3197.66           1           1      295   
    Iter      log prob        ||dx||      ||grad||       alpha      alpha0  # evals  Notes 
     212       7031.91   6.97859e-09       2909.85      0.3368      0.3368      312   
Optimization terminated normally: 
  Convergence detected: absolute parameter change was below tolerance
      99       14233.6   5.28411e-08       3180.56      0.5896      0.5896      134   
    Iter      log prob        ||dx||      ||grad||       alpha      alpha0  # evals  Notes 
     111       14233.6   2.76142e-07       3037.91   8.871e-11       0.001      193  LS failed, Hessian reset 
     125       14233.6   4.44451e-09       2849.43       0.256       0.256      210   
Optimization terminated normally: 
  Convergence detected: absolute parameter change was below tolerance
[I 2020-10-01 03:35:01,309] Trial 324 finished with value: 0.04202874940280517 and parameters: {'changepoint_prior_scale': 0.0016366593716022478, 'seasonality_prior_scale': 0.3245937695299877, 'holidays_prior_scale': 0.13504991493986035, 'seasonality_mode': 'additive', 'changepoint_range': 0.5655586025322614}. Best is trial 96 with value: 0.038883738900888705.
Initial log joint probability = -28.8311
    Iter      log prob        ||dx||      ||grad||       alpha      alpha0  # evals  Notes 
      99       18912.9    6.6253e-06       2858.38           1           1      126   
    Iter      log prob        ||dx||      ||grad||       alpha      alpha0  # evals  Notes 
     124       18912.9   3.41455e-08       3339.03       2.159      0.2159      158   
Optimization terminated normally: 
  Convergence detected: relative gradient magnitude is below tolerance
INFO:fbprophet:Making 5 forecasts with cutoffs between 2013-10-07 00:00:00 and 2015-10-18 00:00:00
INFO:fbprophet:Applying in parallel with <concurrent.futures.process.ProcessPoolExecutor object at 0x7fc84dc25ed0>
Initial log joint probability = -8.95172
    Iter      log prob        ||dx||      ||grad||       alpha      alpha0  # evals  Notes 
Initial log joint probability = -12.7302
    Iter      log prob        ||dx||      ||grad||       alpha      alpha0  # evals  Notes 
Initial log joint probability = -15.1549
    Iter      log prob        ||dx||      ||grad||       alpha      alpha0  # evals  Notes 
Initial log joint probability = -18.717
    Iter      log prob        ||dx||      ||grad||       alpha      alpha0  # evals  Notes 
      81       4679.16   9.42056e-09       3535.02      0.6761      0.6761      109   
Optimization terminated normally: 
  Convergence detected: absolute parameter change was below tolerance
Initial log joint probability = -23.5879
    Iter      log prob        ||dx||      ||grad||       alpha      alpha0  # evals  Notes 
      99        7029.5    1.0492e-06       3643.51           1           1      129   
    Iter      log prob        ||dx||      ||grad||       alpha      alpha0  # evals  Notes 
      30       11811.8   0.000106243       3369.16   3.369e-08       0.001       86  LS failed, Hessian reset 
      63       9582.47   5.45711e-07       3246.49    1.57e-10       0.001      123  LS failed, Hessian reset 
     128        7029.5   4.43956e-07       3340.59   1.208e-10       0.001      203  LS failed, Hessian reset 
     143       7029.51   8.54763e-09       3495.62      0.9527      0.9527      221   
Optimization terminated normally: 
  Convergence detected: absolute parameter change was below tolerance
      81       9582.48   5.27126e-09       3437.65      0.2979      0.2979      144   
Optimization terminated normally: 
  Convergence detected: absolute parameter change was below tolerance
      74       11813.3   4.36841e-09        3610.9      0.3201      0.3201      145   
Optimization terminated normally: 
  Convergence detected: absolute parameter change was below tolerance
      99       14233.3   4.55968e-06        3249.9      0.5209      0.5209      122   
    Iter      log prob        ||dx||      ||grad||       alpha      alpha0  # evals  Notes 
     117       14233.3    6.3361e-09       3528.82      0.2484      0.2484      145   
Optimization terminated normally: 
  Convergence detected: absolute parameter change was below tolerance
[I 2020-10-01 03:35:15,144] Trial 325 finished with value: 0.04085763544845905 and parameters: {'changepoint_prior_scale': 0.001408520658267874, 'seasonality_prior_scale': 0.18485729519841615, 'holidays_prior_scale': 0.09134192567538944, 'seasonality_mode': 'additive', 'changepoint_range': 0.5478867389784707}. Best is trial 96 with value: 0.038883738900888705.
Initial log joint probability = -28.8311
    Iter      log prob        ||dx||      ||grad||       alpha      alpha0  # evals  Notes 
      35       18912.6   2.65229e-05       734.501   3.671e-08       0.001       85  LS failed, Hessian reset 
      83       18912.7   1.63723e-05       829.264    1.98e-08       0.001      183  LS failed, Hessian reset 
      99       18912.7   6.56283e-07       708.036      0.4283      0.4283      203   
    Iter      log prob        ||dx||      ||grad||       alpha      alpha0  # evals  Notes 
     119       18912.7   5.29331e-08       813.346      0.2344           1      234   
Optimization terminated normally: 
  Convergence detected: relative gradient magnitude is below tolerance
INFO:fbprophet:Making 5 forecasts with cutoffs between 2013-10-07 00:00:00 and 2015-10-18 00:00:00
INFO:fbprophet:Applying in parallel with <concurrent.futures.process.ProcessPoolExecutor object at 0x7fc84dc0a610>
Initial log joint probability = -8.95172
    Iter      log prob        ||dx||      ||grad||       alpha      alpha0  # evals  Notes 
Initial log joint probability = -12.7302
    Iter      log prob        ||dx||      ||grad||       alpha      alpha0  # evals  Notes 
Initial log joint probability = -15.1549
    Iter      log prob        ||dx||      ||grad||       alpha      alpha0  # evals  Notes 
Initial log joint probability = -18.717
    Iter      log prob        ||dx||      ||grad||       alpha      alpha0  # evals  Notes 
      64       4679.42   5.30763e-09       1011.15      0.2435      0.2435       84   
Optimization terminated normally: 
  Convergence detected: absolute parameter change was below tolerance
Initial log joint probability = -23.5879
    Iter      log prob        ||dx||      ||grad||       alpha      alpha0  # evals  Notes 
      99        7032.1   1.42263e-07       1012.17      0.5258      0.5258      128   
    Iter      log prob        ||dx||      ||grad||       alpha      alpha0  # evals  Notes 
     103        7032.1   5.09789e-09       1006.16      0.1324      0.1324      134   
Optimization terminated normally: 
  Convergence detected: absolute parameter change was below tolerance
      99       9582.65   1.47435e-07       811.773           1           1      142   
    Iter      log prob        ||dx||      ||grad||       alpha      alpha0  # evals  Notes 
     106       9582.65   6.04086e-08       714.844           1           1      150   
Optimization terminated normally: 
  Convergence detected: relative gradient magnitude is below tolerance
      99       11813.2   2.27296e-06       998.148      0.9411      0.9411      131   
    Iter      log prob        ||dx||      ||grad||       alpha      alpha0  # evals  Notes 
      85       14232.9   0.000142094       732.081   1.569e-07       0.001      155  LS failed, Hessian reset 
      99         14233   1.90326e-05       872.003           1           1      175   
    Iter      log prob        ||dx||      ||grad||       alpha      alpha0  # evals  Notes 
     199       11813.3   9.77993e-05       1111.14           1           1      249   
    Iter      log prob        ||dx||      ||grad||       alpha      alpha0  # evals  Notes 
     148         14233   1.32209e-07       971.606           1           1      240   
Optimization terminated normally: 
  Convergence detected: relative gradient magnitude is below tolerance
     278       11813.3   5.91788e-08       950.282      0.3836      0.3836      338   
Optimization terminated normally: 
  Convergence detected: relative gradient magnitude is below tolerance
[I 2020-10-01 03:35:31,450] Trial 326 finished with value: 0.04191170362662711 and parameters: {'changepoint_prior_scale': 0.0044991985992210845, 'seasonality_prior_scale': 0.12911750450878878, 'holidays_prior_scale': 2.6797704719908406, 'seasonality_mode': 'additive', 'changepoint_range': 0.5375063892611562}. Best is trial 96 with value: 0.038883738900888705.
Initial log joint probability = -28.8311
    Iter      log prob        ||dx||      ||grad||       alpha      alpha0  # evals  Notes 
      99       18911.2    0.00236226       4517.29           1           1      126   
    Iter      log prob        ||dx||      ||grad||       alpha      alpha0  # evals  Notes 
     150       18912.2   3.22491e-05       4416.43   6.031e-09       0.001      231  LS failed, Hessian reset 
     188       18912.3   8.50365e-07       4651.64   1.789e-10       0.001      318  LS failed, Hessian reset 
     199       18912.3   6.53617e-08       4345.25       1.521      0.5492      332   
    Iter      log prob        ||dx||      ||grad||       alpha      alpha0  # evals  Notes 
     206       18912.3   1.11248e-08       4867.37      0.4012           1      340   
Optimization terminated normally: 
  Convergence detected: relative gradient magnitude is below tolerance
INFO:fbprophet:Making 5 forecasts with cutoffs between 2013-10-07 00:00:00 and 2015-10-18 00:00:00
INFO:fbprophet:Applying in parallel with <concurrent.futures.process.ProcessPoolExecutor object at 0x7fc84dc253d0>
Initial log joint probability = -8.95172
    Iter      log prob        ||dx||      ||grad||       alpha      alpha0  # evals  Notes 
Initial log joint probability = -12.7302
    Iter      log prob        ||dx||      ||grad||       alpha      alpha0  # evals  Notes 
Initial log joint probability = -15.1549
    Iter      log prob        ||dx||      ||grad||       alpha      alpha0  # evals  Notes 
Initial log joint probability = -18.717
    Iter      log prob        ||dx||      ||grad||       alpha      alpha0  # evals  Notes 
Initial log joint probability = -23.5879
    Iter      log prob        ||dx||      ||grad||       alpha      alpha0  # evals  Notes 
      63       4673.99   0.000290264       4992.96   5.506e-08       0.001      145  LS failed, Hessian reset 
      99       4677.65   4.29865e-05       4881.39           1           1      200   
    Iter      log prob        ||dx||      ||grad||       alpha      alpha0  # evals  Notes 
      88       7028.13   7.74344e-09       5015.22      0.2704      0.2704      110   
Optimization terminated normally: 
  Convergence detected: absolute parameter change was below tolerance
     134       4677.77   5.78127e-09       5022.52       0.362           1      246   
Optimization terminated normally: 
  Convergence detected: absolute parameter change was below tolerance
      56       9582.13   6.77185e-09       5014.74      0.3835      0.3835       85   
Optimization terminated normally: 
  Convergence detected: absolute parameter change was below tolerance
      61       11812.9   1.62155e-06       5181.26   3.225e-10       0.001      140  LS failed, Hessian reset 
      99       14232.9   3.20743e-05       4353.84      0.4389      0.4389      126   
    Iter      log prob        ||dx||      ||grad||       alpha      alpha0  # evals  Notes 
      86       11812.9   7.06723e-09       4721.21      0.4398      0.4398      175   
Optimization terminated normally: 
  Convergence detected: absolute parameter change was below tolerance
     195       14233.5   7.83677e-09       4921.68      0.7501      0.7501      240   
Optimization terminated normally: 
  Convergence detected: absolute parameter change was below tolerance
