[I 2020-10-01 03:16:03,536] Trial 250 finished with value: 0.04127516037636642 and parameters: {'changepoint_prior_scale': 0.0012126640666741651, 'seasonality_prior_scale': 0.11768214302440333, 'holidays_prior_scale': 0.184567949899384, 'seasonality_mode': 'additive', 'changepoint_range': 0.5322523476976969}. Best is trial 96 with value: 0.038883738900888705.
Initial log joint probability = -28.8311
    Iter      log prob        ||dx||      ||grad||       alpha      alpha0  # evals  Notes 
      99       18912.6   3.58325e-06       3570.17           1           1      117   
    Iter      log prob        ||dx||      ||grad||       alpha      alpha0  # evals  Notes 
     156       18912.8   1.48188e-07       3559.81   4.156e-11       0.001      228  LS failed, Hessian reset 
     163       18912.8   8.22309e-09       3203.25      0.3112           1      239   
Optimization terminated normally: 
  Convergence detected: absolute parameter change was below tolerance
INFO:fbprophet:Making 5 forecasts with cutoffs between 2013-10-07 00:00:00 and 2015-10-18 00:00:00
INFO:fbprophet:Applying in parallel with <concurrent.futures.process.ProcessPoolExecutor object at 0x7fc84dbb27d0>
Initial log joint probability = -8.95172
    Iter      log prob        ||dx||      ||grad||       alpha      alpha0  # evals  Notes 
Initial log joint probability = -12.7302
    Iter      log prob        ||dx||      ||grad||       alpha      alpha0  # evals  Notes 
Initial log joint probability = -15.1549
    Iter      log prob        ||dx||      ||grad||       alpha      alpha0  # evals  Notes 
Initial log joint probability = -18.717
    Iter      log prob        ||dx||      ||grad||       alpha      alpha0  # evals  Notes 
Initial log joint probability = -23.5879
    Iter      log prob        ||dx||      ||grad||       alpha      alpha0  # evals  Notes 
      99       4679.23   1.41648e-06       3544.39           1           1      130   
    Iter      log prob        ||dx||      ||grad||       alpha      alpha0  # evals  Notes 
     120       4679.24   6.55173e-09       3571.21      0.5391      0.5391      158   
Optimization terminated normally: 
  Convergence detected: absolute parameter change was below tolerance
      99       7028.83   1.60939e-07       3477.81      0.8387      0.8387      125   
    Iter      log prob        ||dx||      ||grad||       alpha      alpha0  # evals  Notes 
      57       9582.36   8.27812e-09       3464.23           1           1       81   
Optimization terminated normally: 
  Convergence detected: absolute parameter change was below tolerance
     106        7029.1   2.56657e-05       3187.16   8.152e-09       0.001      165  LS failed, Hessian reset 
      34         11812   0.000242169       3623.55   7.626e-08       0.001       89  LS failed, Hessian reset 
     144       7029.18   9.75019e-09       3054.74      0.7758      0.7758      211   
Optimization terminated normally: 
  Convergence detected: absolute parameter change was below tolerance
      82       11813.2   7.04841e-09       3602.38      0.2026           1      148   
Optimization terminated normally: 
  Convergence detected: absolute parameter change was below tolerance
      97       14232.1    1.4069e-06       3899.88   3.897e-10       0.001      172  LS failed, Hessian reset 
      99       14232.1   5.51371e-07       2517.29           1           1      174   
    Iter      log prob        ||dx||      ||grad||       alpha      alpha0  # evals  Notes 
     109       14232.1   6.60631e-09        2905.1      0.1245      0.1245      189   
Optimization terminated normally: 
  Convergence detected: absolute parameter change was below tolerance
[I 2020-10-01 03:16:19,872] Trial 251 finished with value: 0.04090600052676046 and parameters: {'changepoint_prior_scale': 0.0014058791365886723, 'seasonality_prior_scale': 0.07156627224194162, 'holidays_prior_scale': 0.13435620654717922, 'seasonality_mode': 'additive', 'changepoint_range': 0.6013800675561514}. Best is trial 96 with value: 0.038883738900888705.
Initial log joint probability = -28.8311
    Iter      log prob        ||dx||      ||grad||       alpha      alpha0  # evals  Notes 
      99       18912.8    0.00036401       2478.61      0.2726           1      119   
    Iter      log prob        ||dx||      ||grad||       alpha      alpha0  # evals  Notes 
     104       18912.9   1.85387e-05       2700.12   7.098e-09       0.001      183  LS failed, Hessian reset 
     136       18912.9   3.13344e-08        2499.2      0.7237      0.7237      220   
Optimization terminated normally: 
  Convergence detected: relative gradient magnitude is below tolerance
INFO:fbprophet:Making 5 forecasts with cutoffs between 2013-10-07 00:00:00 and 2015-10-18 00:00:00
INFO:fbprophet:Applying in parallel with <concurrent.futures.process.ProcessPoolExecutor object at 0x7fc84dc67950>
Initial log joint probability = -8.95172
    Iter      log prob        ||dx||      ||grad||       alpha      alpha0  # evals  Notes 
Initial log joint probability = -12.7302
    Iter      log prob        ||dx||      ||grad||       alpha      alpha0  # evals  Notes 
Initial log joint probability = -15.1549
    Iter      log prob        ||dx||      ||grad||       alpha      alpha0  # evals  Notes 
Initial log joint probability = -18.717
    Iter      log prob        ||dx||      ||grad||       alpha      alpha0  # evals  Notes 
Initial log joint probability = -23.5879
    Iter      log prob        ||dx||      ||grad||       alpha      alpha0  # evals  Notes 
      39       4679.12    0.00010769       2675.19   3.915e-08       0.001       99  LS failed, Hessian reset 
      83       4679.38   9.56998e-09       2768.67      0.5001      0.5001      157   
Optimization terminated normally: 
  Convergence detected: absolute parameter change was below tolerance
      99       7031.78   1.44387e-05       2267.81           1           1      120   
    Iter      log prob        ||dx||      ||grad||       alpha      alpha0  # evals  Notes 
      56        9582.5   9.50553e-09       2263.14      0.4676      0.4676       81   
Optimization terminated normally: 
  Convergence detected: absolute parameter change was below tolerance
     158       7032.05     4.205e-09       2783.58      0.3307      0.8384      195   
Optimization terminated normally: 
  Convergence detected: absolute parameter change was below tolerance
      57       11813.2   9.59424e-09       2699.01      0.4781      0.4781       79   
Optimization terminated normally: 
  Convergence detected: absolute parameter change was below tolerance
      99       14233.4   5.17803e-07       2393.15           1           1      134   
    Iter      log prob        ||dx||      ||grad||       alpha      alpha0  # evals  Notes 
     116       14233.4   3.56635e-08       2323.87      0.3824           1      157   
Optimization terminated normally: 
  Convergence detected: relative gradient magnitude is below tolerance
[I 2020-10-01 03:16:33,535] Trial 252 finished with value: 0.04182767640925177 and parameters: {'changepoint_prior_scale': 0.0018310225636840919, 'seasonality_prior_scale': 0.10288512606617485, 'holidays_prior_scale': 0.23140200717168757, 'seasonality_mode': 'additive', 'changepoint_range': 0.5409994918050691}. Best is trial 96 with value: 0.038883738900888705.
Initial log joint probability = -28.8311
    Iter      log prob        ||dx||      ||grad||       alpha      alpha0  # evals  Notes 
      72       18911.2   0.000136926       4360.86   3.059e-08       0.001      126  LS failed, Hessian reset 
      99       18912.4   9.09381e-07       2794.26      0.4988      0.4988      158   
    Iter      log prob        ||dx||      ||grad||       alpha      alpha0  # evals  Notes 
     141       18912.4   9.51638e-09       3736.53     0.01449           1      211   
Optimization terminated normally: 
  Convergence detected: absolute parameter change was below tolerance
INFO:fbprophet:Making 5 forecasts with cutoffs between 2013-10-07 00:00:00 and 2015-10-18 00:00:00
INFO:fbprophet:Applying in parallel with <concurrent.futures.process.ProcessPoolExecutor object at 0x7fc84dc0a390>
Initial log joint probability = -8.95172
    Iter      log prob        ||dx||      ||grad||       alpha      alpha0  # evals  Notes 
Initial log joint probability = -12.7302
    Iter      log prob        ||dx||      ||grad||       alpha      alpha0  # evals  Notes 
Initial log joint probability = -15.1549
    Iter      log prob        ||dx||      ||grad||       alpha      alpha0  # evals  Notes 
Initial log joint probability = -18.717
    Iter      log prob        ||dx||      ||grad||       alpha      alpha0  # evals  Notes 
      54       4678.44   6.06964e-09       4086.45      0.3969           1       77   
Optimization terminated normally: 
  Convergence detected: absolute parameter change was below tolerance
Initial log joint probability = -23.5879
    Iter      log prob        ||dx||      ||grad||       alpha      alpha0  # evals  Notes 
      99       7028.73   8.61163e-08       3545.58      0.6905      0.6905      126   
    Iter      log prob        ||dx||      ||grad||       alpha      alpha0  # evals  Notes 
      65       9582.15   3.97277e-09       4075.41      0.3042      0.3042       83   
Optimization terminated normally: 
  Convergence detected: absolute parameter change was below tolerance
      31       11811.6   0.000216325       4388.52   5.866e-08       0.001       85  LS failed, Hessian reset 
     141       7028.74   4.21797e-07       3721.13   9.375e-11       0.001      218  LS failed, Hessian reset 
     150       7028.74   7.80632e-09       3704.02      0.2881      0.2881      229   
Optimization terminated normally: 
  Convergence detected: absolute parameter change was below tolerance
      92       11812.8   6.29377e-09       4376.05      0.5082      0.5082      162   
Optimization terminated normally: 
  Convergence detected: absolute parameter change was below tolerance
      99       14233.2   3.24383e-07       3904.94      0.3591           1      132   
    Iter      log prob        ||dx||      ||grad||       alpha      alpha0  # evals  Notes 
     117       14233.2   1.14304e-06       4070.97   2.745e-10       0.001      218  LS failed, Hessian reset 
     131       14233.2   3.66548e-09       3770.49      0.2233      0.2233      238   
Optimization terminated normally: 
  Convergence detected: absolute parameter change was below tolerance
[I 2020-10-01 03:16:49,539] Trial 253 finished with value: 0.04129547902160307 and parameters: {'changepoint_prior_scale': 0.0012268643731936997, 'seasonality_prior_scale': 0.08187774849913862, 'holidays_prior_scale': 0.16521129212447525, 'seasonality_mode': 'additive', 'changepoint_range': 0.5158029118499773}. Best is trial 96 with value: 0.038883738900888705.
Initial log joint probability = -28.8311
    Iter      log prob        ||dx||      ||grad||       alpha      alpha0  # evals  Notes 
      99       18912.1    1.8323e-06       4592.56       0.596       0.596      125   
    Iter      log prob        ||dx||      ||grad||       alpha      alpha0  # evals  Notes 
     173       18912.8   7.67739e-08       4670.58      0.2257      0.7723      215   
Optimization terminated normally: 
  Convergence detected: relative gradient magnitude is below tolerance
INFO:fbprophet:Making 5 forecasts with cutoffs between 2013-10-07 00:00:00 and 2015-10-18 00:00:00
INFO:fbprophet:Applying in parallel with <concurrent.futures.process.ProcessPoolExecutor object at 0x7fc84dc4d0d0>
Initial log joint probability = -8.95172
    Iter      log prob        ||dx||      ||grad||       alpha      alpha0  # evals  Notes 
Initial log joint probability = -12.7302
    Iter      log prob        ||dx||      ||grad||       alpha      alpha0  # evals  Notes 
Initial log joint probability = -15.1549
    Iter      log prob        ||dx||      ||grad||       alpha      alpha0  # evals  Notes 
Initial log joint probability = -18.717
    Iter      log prob        ||dx||      ||grad||       alpha      alpha0  # evals  Notes 
Initial log joint probability = -23.5879
    Iter      log prob        ||dx||      ||grad||       alpha      alpha0  # evals  Notes 
      54       4674.75   0.000299229        4993.1   6.053e-08       0.001      121  LS failed, Hessian reset 
      99        4676.5   1.14219e-07       4938.24      0.2405           1      181   
    Iter      log prob        ||dx||      ||grad||       alpha      alpha0  # evals  Notes 
     111        4676.5   3.51367e-09       4921.78      0.4036      0.4036      198   
Optimization terminated normally: 
  Convergence detected: absolute parameter change was below tolerance
      56       9581.95   7.68972e-09       4781.28      0.2948           1       75   
Optimization terminated normally: 
  Convergence detected: absolute parameter change was below tolerance
      99       7028.08   4.10894e-06       4029.93           1           1      128   
    Iter      log prob        ||dx||      ||grad||       alpha      alpha0  # evals  Notes 
     107       7028.15   4.47955e-06       4911.85   8.972e-10       0.001      182  LS failed, Hessian reset 
      32       11811.9   0.000199647       5011.19   4.066e-08       0.001       98  LS failed, Hessian reset 
     142       7028.16   7.38395e-10       5117.76      0.1115      0.1115      229   
Optimization terminated normally: 
  Convergence detected: absolute parameter change was below tolerance
      68       11812.9   8.03086e-09       4748.17      0.2305      0.2305      146   
Optimization terminated normally: 
  Convergence detected: absolute parameter change was below tolerance
      99         14232   2.91748e-06       5059.85      0.5775      0.5775      124   
    Iter      log prob        ||dx||      ||grad||       alpha      alpha0  # evals  Notes 
     119         14232   9.42603e-09       5141.86      0.3952      0.3952      152   
Optimization terminated normally: 
  Convergence detected: absolute parameter change was below tolerance
[I 2020-10-01 03:17:03,557] Trial 254 finished with value: 0.04115135495584417 and parameters: {'changepoint_prior_scale': 0.0010159919071402986, 'seasonality_prior_scale': 0.10843767902406796, 'holidays_prior_scale': 0.12082063089832003, 'seasonality_mode': 'additive', 'changepoint_range': 0.5236914485416079}. Best is trial 96 with value: 0.038883738900888705.
Initial log joint probability = -28.8311
    Iter      log prob        ||dx||      ||grad||       alpha      alpha0  # evals  Notes 
      99       18912.9   3.41853e-06       3043.43      0.7093      0.7093      126   
    Iter      log prob        ||dx||      ||grad||       alpha      alpha0  # evals  Notes 
     123       18912.9   1.34236e-08       2680.69      0.3568           1      159   
Optimization terminated normally: 
  Convergence detected: relative gradient magnitude is below tolerance
INFO:fbprophet:Making 5 forecasts with cutoffs between 2013-10-07 00:00:00 and 2015-10-18 00:00:00
INFO:fbprophet:Applying in parallel with <concurrent.futures.process.ProcessPoolExecutor object at 0x7fc84dc1c850>
Initial log joint probability = -8.95172
    Iter      log prob        ||dx||      ||grad||       alpha      alpha0  # evals  Notes 
Initial log joint probability = -12.7302
    Iter      log prob        ||dx||      ||grad||       alpha      alpha0  # evals  Notes 
Initial log joint probability = -15.1549
    Iter      log prob        ||dx||      ||grad||       alpha      alpha0  # evals  Notes 
Initial log joint probability = -18.717
    Iter      log prob        ||dx||      ||grad||       alpha      alpha0  # evals  Notes 
Initial log joint probability = -23.5879
    Iter      log prob        ||dx||      ||grad||       alpha      alpha0  # evals  Notes 
      84       4679.23   1.81924e-07       3058.59   5.908e-11       0.001      155  LS failed, Hessian reset 
      93       4679.23   9.10898e-09       3125.76      0.4202      0.4202      167   
Optimization terminated normally: 
  Convergence detected: absolute parameter change was below tolerance
      99       7029.66   3.49298e-07       3131.54           1           1      117   
    Iter      log prob        ||dx||      ||grad||       alpha      alpha0  # evals  Notes 
     121       7029.66   1.02591e-07        2857.1   3.593e-11       0.001      184  LS failed, Hessian reset 
      37       11811.8   0.000656498       3173.39   2.061e-07       0.001       89  LS failed, Hessian reset 
     129       7029.66   8.80635e-09       2482.49      0.6521      0.6521      193   
Optimization terminated normally: 
  Convergence detected: absolute parameter change was below tolerance
      97        9582.4   1.04737e-08       2679.89      0.8085      0.8085      135   
Optimization terminated normally: 
  Convergence detected: relative gradient magnitude is below tolerance
      99       11813.2   3.90229e-07       3011.87      0.4665      0.4665      165   
    Iter      log prob        ||dx||      ||grad||       alpha      alpha0  # evals  Notes 
      99       14232.4   1.60282e-06       2832.72      0.3812           1      132   
    Iter      log prob        ||dx||      ||grad||       alpha      alpha0  # evals  Notes 
     125       11813.2   2.03599e-08       2922.09      0.3877           1      198   
Optimization terminated normally: 
  Convergence detected: relative gradient magnitude is below tolerance
     155       14233.1   9.09018e-09       3044.62      0.2789           1      202   
Optimization terminated normally: 
  Convergence detected: absolute parameter change was below tolerance
