[I 2020-10-01 03:08:57,484] Trial 222 finished with value: 0.04084499147134531 and parameters: {'changepoint_prior_scale': 0.0016907672957593592, 'seasonality_prior_scale': 0.20947046330469618, 'holidays_prior_scale': 0.17020648969157992, 'seasonality_mode': 'additive', 'changepoint_range': 0.5567912435539829}. Best is trial 96 with value: 0.038883738900888705.
Initial log joint probability = -28.8311
    Iter      log prob        ||dx||      ||grad||       alpha      alpha0  # evals  Notes 
      99       18912.7   2.37286e-06       3612.06           1           1      126   
    Iter      log prob        ||dx||      ||grad||       alpha      alpha0  # evals  Notes 
     128       18912.9   1.44872e-05       3596.23   3.729e-09       0.001      200  LS failed, Hessian reset 
     164       18912.9   1.80774e-08       3756.79      0.4892           1      246   
Optimization terminated normally: 
  Convergence detected: relative gradient magnitude is below tolerance
INFO:fbprophet:Making 5 forecasts with cutoffs between 2013-10-07 00:00:00 and 2015-10-18 00:00:00
INFO:fbprophet:Applying in parallel with <concurrent.futures.process.ProcessPoolExecutor object at 0x7fc84dbe8350>
Initial log joint probability = -8.95172
    Iter      log prob        ||dx||      ||grad||       alpha      alpha0  # evals  Notes 
Initial log joint probability = -12.7302
    Iter      log prob        ||dx||      ||grad||       alpha      alpha0  # evals  Notes 
Initial log joint probability = -15.1549
    Iter      log prob        ||dx||      ||grad||       alpha      alpha0  # evals  Notes 
Initial log joint probability = -18.717
    Iter      log prob        ||dx||      ||grad||       alpha      alpha0  # evals  Notes 
Initial log joint probability = -23.5879
    Iter      log prob        ||dx||      ||grad||       alpha      alpha0  # evals  Notes 
      88       4679.27   4.12299e-09       3778.41      0.3812      0.3812      114   
Optimization terminated normally: 
  Convergence detected: absolute parameter change was below tolerance
      72       7028.76   4.34665e-05       4000.42   1.067e-08       0.001      137  LS failed, Hessian reset 
      99        7028.9   3.46207e-08       3521.84      0.1853      0.1853      172   
    Iter      log prob        ||dx||      ||grad||       alpha      alpha0  # evals  Notes 
      58       11813.3   5.17656e-09       3802.87      0.4418      0.4418       79   
Optimization terminated normally: 
  Convergence detected: absolute parameter change was below tolerance
     110        7028.9   9.70291e-09       3298.39      0.5616      0.5616      186   
Optimization terminated normally: 
  Convergence detected: absolute parameter change was below tolerance
      65       9582.22   2.43271e-05       3358.23   5.871e-09       0.001      132  LS failed, Hessian reset 
      99       9582.27   2.00813e-06       4065.63           1           1      174   
    Iter      log prob        ||dx||      ||grad||       alpha      alpha0  # evals  Notes 
     100       9582.27   4.16149e-07       3476.28   1.024e-10       0.001      219  LS failed, Hessian reset 
      99       14232.4   1.85945e-07       3746.75      0.2073      0.2073      130   
    Iter      log prob        ||dx||      ||grad||       alpha      alpha0  # evals  Notes 
     114       9582.28   9.06058e-09       3473.28       0.523       0.523      235   
Optimization terminated normally: 
  Convergence detected: absolute parameter change was below tolerance
     116       14232.4    6.2003e-09       3799.52      0.2768      0.6576      151   
Optimization terminated normally: 
  Convergence detected: absolute parameter change was below tolerance
[I 2020-10-01 03:09:13,424] Trial 223 finished with value: 0.041248587057953534 and parameters: {'changepoint_prior_scale': 0.0013107639228097537, 'seasonality_prior_scale': 0.26988028832711053, 'holidays_prior_scale': 0.21621781270344162, 'seasonality_mode': 'additive', 'changepoint_range': 0.5302716449692938}. Best is trial 96 with value: 0.038883738900888705.
Initial log joint probability = -28.8311
    Iter      log prob        ||dx||      ||grad||       alpha      alpha0  # evals  Notes 
      99       18912.9   5.05747e-08       3182.97      0.8941      0.8941      128   
    Iter      log prob        ||dx||      ||grad||       alpha      alpha0  # evals  Notes 
     139       18912.9   1.34596e-08       2999.71      0.3262           1      188   
Optimization terminated normally: 
  Convergence detected: relative gradient magnitude is below tolerance
INFO:fbprophet:Making 5 forecasts with cutoffs between 2013-10-07 00:00:00 and 2015-10-18 00:00:00
INFO:fbprophet:Applying in parallel with <concurrent.futures.process.ProcessPoolExecutor object at 0x7fc84dc6f410>
Initial log joint probability = -8.95172
    Iter      log prob        ||dx||      ||grad||       alpha      alpha0  # evals  Notes 
Initial log joint probability = -12.7302
    Iter      log prob        ||dx||      ||grad||       alpha      alpha0  # evals  Notes 
Initial log joint probability = -15.1549
    Iter      log prob        ||dx||      ||grad||       alpha      alpha0  # evals  Notes 
Initial log joint probability = -18.717
    Iter      log prob        ||dx||      ||grad||       alpha      alpha0  # evals  Notes 
Initial log joint probability = -23.5879
    Iter      log prob        ||dx||      ||grad||       alpha      alpha0  # evals  Notes 
      43       4679.24    1.0835e-05       3154.79   3.243e-09       0.001       98  LS failed, Hessian reset 
      67       4679.27   6.94779e-09       3242.78     0.05154     0.05154      129   
Optimization terminated normally: 
  Convergence detected: absolute parameter change was below tolerance
      99       7029.66    1.9724e-05       3181.07       0.538       0.538      125   
    Iter      log prob        ||dx||      ||grad||       alpha      alpha0  # evals  Notes 
      56       9582.49   5.09728e-09       2724.99    0.008465    0.008465       91   
Optimization terminated normally: 
  Convergence detected: absolute parameter change was below tolerance
      63       11812.9   9.89475e-09       3137.87      0.5375      0.5375       87   
Optimization terminated normally: 
  Convergence detected: absolute parameter change was below tolerance
     189        7031.9   2.11855e-06       3400.77   6.531e-10       0.001      275  LS failed, Hessian reset 
     199        7031.9   6.43989e-08       3086.05      0.2376      0.2376      289   
    Iter      log prob        ||dx||      ||grad||       alpha      alpha0  # evals  Notes 
      99       14233.4   8.93899e-08       2935.11           1           1      129   
    Iter      log prob        ||dx||      ||grad||       alpha      alpha0  # evals  Notes 
     101       14233.4   9.99661e-09       3325.99      0.2947      0.2947      132   
Optimization terminated normally: 
  Convergence detected: absolute parameter change was below tolerance
     229       7031.91   1.04973e-06        3142.8   2.942e-10       0.001      368  LS failed, Hessian reset 
     243       7031.91   6.07699e-09       3218.84      0.1617      0.1617      386   
Optimization terminated normally: 
  Convergence detected: absolute parameter change was below tolerance
[I 2020-10-01 03:09:28,781] Trial 224 finished with value: 0.041585197452146644 and parameters: {'changepoint_prior_scale': 0.0015374062716186708, 'seasonality_prior_scale': 0.17506541651737675, 'holidays_prior_scale': 0.14019403570970534, 'seasonality_mode': 'additive', 'changepoint_range': 0.5431464761280205}. Best is trial 96 with value: 0.038883738900888705.
Initial log joint probability = -28.8311
    Iter      log prob        ||dx||      ||grad||       alpha      alpha0  # evals  Notes 
      99       18912.9   9.71029e-07       1659.94      0.4325      0.4325      132   
    Iter      log prob        ||dx||      ||grad||       alpha      alpha0  # evals  Notes 
     157         18913   1.98142e-08       1818.17      0.4634      0.4634      202   
Optimization terminated normally: 
  Convergence detected: relative gradient magnitude is below tolerance
INFO:fbprophet:Making 5 forecasts with cutoffs between 2013-10-07 00:00:00 and 2015-10-18 00:00:00
INFO:fbprophet:Applying in parallel with <concurrent.futures.process.ProcessPoolExecutor object at 0x7fc84dc48550>
Initial log joint probability = -8.95172
    Iter      log prob        ||dx||      ||grad||       alpha      alpha0  # evals  Notes 
Initial log joint probability = -12.7302
    Iter      log prob        ||dx||      ||grad||       alpha      alpha0  # evals  Notes 
Initial log joint probability = -15.1549
    Iter      log prob        ||dx||      ||grad||       alpha      alpha0  # evals  Notes 
Initial log joint probability = -18.717
    Iter      log prob        ||dx||      ||grad||       alpha      alpha0  # evals  Notes 
Initial log joint probability = -23.5879
    Iter      log prob        ||dx||      ||grad||       alpha      alpha0  # evals  Notes 
      99       4679.31   3.79172e-07       2204.54           1           1      129   
    Iter      log prob        ||dx||      ||grad||       alpha      alpha0  # evals  Notes 
     107       4679.31   8.99977e-07       2213.86   4.063e-10       0.001      188  LS failed, Hessian reset 
     124       4679.31   7.93373e-09       2257.83      0.5949      0.5949      209   
Optimization terminated normally: 
  Convergence detected: absolute parameter change was below tolerance
      99          7032   1.26071e-05       2148.31      0.2345      0.2345      119   
    Iter      log prob        ||dx||      ||grad||       alpha      alpha0  # evals  Notes 
      68       9582.62   8.25197e-09       2012.69      0.5361      0.5361       96   
Optimization terminated normally: 
  Convergence detected: absolute parameter change was below tolerance
      57       11813.3   8.21111e-09       2223.85      0.3211      0.3211       78   
Optimization terminated normally: 
  Convergence detected: absolute parameter change was below tolerance
     183        7032.2     1.689e-08       1923.07      0.2944           1      225   
Optimization terminated normally: 
  Convergence detected: relative gradient magnitude is below tolerance
      80       14233.2   3.79708e-09       1531.45     0.07298     0.07298      114   
Optimization terminated normally: 
  Convergence detected: absolute parameter change was below tolerance
[I 2020-10-01 03:09:41,927] Trial 225 finished with value: 0.04199920537155431 and parameters: {'changepoint_prior_scale': 0.0022488883115473575, 'seasonality_prior_scale': 0.2313782550367005, 'holidays_prior_scale': 0.12888554639311844, 'seasonality_mode': 'additive', 'changepoint_range': 0.5684956122362128}. Best is trial 96 with value: 0.038883738900888705.
Initial log joint probability = -28.8311
    Iter      log prob        ||dx||      ||grad||       alpha      alpha0  # evals  Notes 
      99         18911   8.81834e-05       3991.38           1           1      127   
    Iter      log prob        ||dx||      ||grad||       alpha      alpha0  # evals  Notes 
     178       18912.7   9.31245e-09       4657.14      0.5368      0.5368      220   
Optimization terminated normally: 
  Convergence detected: absolute parameter change was below tolerance
INFO:fbprophet:Making 5 forecasts with cutoffs between 2013-10-07 00:00:00 and 2015-10-18 00:00:00
INFO:fbprophet:Applying in parallel with <concurrent.futures.process.ProcessPoolExecutor object at 0x7fc84dc67f90>
Initial log joint probability = -8.95172
    Iter      log prob        ||dx||      ||grad||       alpha      alpha0  # evals  Notes 
Initial log joint probability = -12.7302
    Iter      log prob        ||dx||      ||grad||       alpha      alpha0  # evals  Notes 
Initial log joint probability = -15.1549
    Iter      log prob        ||dx||      ||grad||       alpha      alpha0  # evals  Notes 
Initial log joint probability = -18.717
    Iter      log prob        ||dx||      ||grad||       alpha      alpha0  # evals  Notes 
      56       4678.93   9.03774e-09       4614.39      0.4973      0.4973       78   
Optimization terminated normally: 
  Convergence detected: absolute parameter change was below tolerance
Initial log joint probability = -23.5879
    Iter      log prob        ||dx||      ||grad||       alpha      alpha0  # evals  Notes 
      72       9582.23   6.33769e-09       4387.06      0.4735      0.4735       95   
Optimization terminated normally: 
  Convergence detected: absolute parameter change was below tolerance
      90       7027.69   6.61891e-05       5080.82   1.274e-08       0.001      155  LS failed, Hessian reset 
      99       7027.89    2.4952e-06        4622.2      0.3305      0.8226      165   
    Iter      log prob        ||dx||      ||grad||       alpha      alpha0  # evals  Notes 
      50       11812.7   6.28975e-09       5127.61      0.5502      0.5502       77   
Optimization terminated normally: 
  Convergence detected: absolute parameter change was below tolerance
     136       7027.92   3.47648e-09       3768.83      0.2556      0.2556      210   
Optimization terminated normally: 
  Convergence detected: absolute parameter change was below tolerance
      99       14233.1   1.21492e-05        5391.8      0.6724      0.6724      128   
    Iter      log prob        ||dx||      ||grad||       alpha      alpha0  # evals  Notes 
     153       14233.2   7.60372e-08       4825.21   1.561e-11       0.001      237  LS failed, Hessian reset 
     159       14233.2   9.78207e-09       4380.58      0.2419      0.8253      244   
Optimization terminated normally: 
  Convergence detected: absolute parameter change was below tolerance
[I 2020-10-01 03:09:57,773] Trial 226 finished with value: 0.04093616830385394 and parameters: {'changepoint_prior_scale': 0.001002343583224591, 'seasonality_prior_scale': 0.32622776193998543, 'holidays_prior_scale': 3.076899608555619, 'seasonality_mode': 'additive', 'changepoint_range': 0.5785111273272238}. Best is trial 96 with value: 0.038883738900888705.
Initial log joint probability = -28.8311
    Iter      log prob        ||dx||      ||grad||       alpha      alpha0  # evals  Notes 
      99       18912.8   8.40036e-07       3831.51      0.1731      0.1731      130   
    Iter      log prob        ||dx||      ||grad||       alpha      alpha0  # evals  Notes 
     129       18912.8   4.37472e-09        4212.1      0.2952      0.2952      167   
Optimization terminated normally: 
  Convergence detected: absolute parameter change was below tolerance
INFO:fbprophet:Making 5 forecasts with cutoffs between 2013-10-07 00:00:00 and 2015-10-18 00:00:00
INFO:fbprophet:Applying in parallel with <concurrent.futures.process.ProcessPoolExecutor object at 0x7fc84dc25310>
Initial log joint probability = -8.95172
    Iter      log prob        ||dx||      ||grad||       alpha      alpha0  # evals  Notes 
Initial log joint probability = -12.7302
    Iter      log prob        ||dx||      ||grad||       alpha      alpha0  # evals  Notes 
Initial log joint probability = -15.1549
    Iter      log prob        ||dx||      ||grad||       alpha      alpha0  # evals  Notes 
Initial log joint probability = -18.717
    Iter      log prob        ||dx||      ||grad||       alpha      alpha0  # evals  Notes 
      56       4679.06   3.85792e-09       4215.51      0.1423      0.1423       79   
Optimization terminated normally: 
  Convergence detected: absolute parameter change was below tolerance
Initial log joint probability = -23.5879
    Iter      log prob        ||dx||      ||grad||       alpha      alpha0  # evals  Notes 
      94       7028.64   2.41266e-05       4252.14   5.453e-09       0.001      157  LS failed, Hessian reset 
      99       7028.68   3.91647e-06       3375.36      0.5608      0.5608      162   
    Iter      log prob        ||dx||      ||grad||       alpha      alpha0  # evals  Notes 
      53       9582.41   1.96747e-06       4540.26   5.076e-10       0.001      116  LS failed, Hessian reset 
      28       11811.8   0.000300381       4229.42   6.401e-08       0.001       89  LS failed, Hessian reset 
      70       9582.42   6.89759e-09       4051.24      0.2861      0.2861      138   
Optimization terminated normally: 
  Convergence detected: absolute parameter change was below tolerance
     134        7028.7   2.86699e-09       3947.81      0.1516      0.1516      208   
Optimization terminated normally: 
  Convergence detected: absolute parameter change was below tolerance
      99       14233.6   3.96382e-07       4420.28           1           1      132   
    Iter      log prob        ||dx||      ||grad||       alpha      alpha0  # evals  Notes 
      99       11813.2    1.6773e-08       4385.52      0.5007           1      184   
    Iter      log prob        ||dx||      ||grad||       alpha      alpha0  # evals  Notes 
     106       14233.6   4.96404e-09       4369.86     0.07106     0.07106      142   
Optimization terminated normally: 
  Convergence detected: absolute parameter change was below tolerance
     100       11813.2   5.25684e-09       4368.33      0.2264      0.6802      186   
Optimization terminated normally: 
  Convergence detected: absolute parameter change was below tolerance
[I 2020-10-01 03:10:12,849] Trial 227 finished with value: 0.04096082083705723 and parameters: {'changepoint_prior_scale': 0.0011656811262972324, 'seasonality_prior_scale': 0.41396271408783153, 'holidays_prior_scale': 0.20065983186215686, 'seasonality_mode': 'additive', 'changepoint_range': 0.5561456011913097}. Best is trial 96 with value: 0.038883738900888705.
Initial log joint probability = -28.8311
    Iter      log prob        ||dx||      ||grad||       alpha      alpha0  # evals  Notes 
      86       18912.9   7.06505e-09       2238.64      0.1569      0.1569      112   
Optimization terminated normally: 
  Convergence detected: absolute parameter change was below tolerance
INFO:fbprophet:Making 5 forecasts with cutoffs between 2013-10-07 00:00:00 and 2015-10-18 00:00:00
INFO:fbprophet:Applying in parallel with <concurrent.futures.process.ProcessPoolExecutor object at 0x7fc84dc1c390>
Initial log joint probability = -8.95172
    Iter      log prob        ||dx||      ||grad||       alpha      alpha0  # evals  Notes 
Initial log joint probability = -12.7302
    Iter      log prob        ||dx||      ||grad||       alpha      alpha0  # evals  Notes 
Initial log joint probability = -15.1549
    Iter      log prob        ||dx||      ||grad||       alpha      alpha0  # evals  Notes 
      53       4679.49   9.30814e-09       2628.92      0.3719           1       74   
Optimization terminated normally: 
  Convergence detected: absolute parameter change was below tolerance
Initial log joint probability = -18.717
    Iter      log prob        ||dx||      ||grad||       alpha      alpha0  # evals  Notes 
Initial log joint probability = -23.5879
    Iter      log prob        ||dx||      ||grad||       alpha      alpha0  # evals  Notes 
      99       7030.36   2.15515e-08       2512.28      0.8439      0.8439      124   
    Iter      log prob        ||dx||      ||grad||       alpha      alpha0  # evals  Notes 
     103       7030.36   4.78079e-09       2519.86      0.5135      0.5135      129   
Optimization terminated normally: 
  Convergence detected: absolute parameter change was below tolerance
      99       9582.57   1.64252e-08       2444.16      0.3983           1      127   
    Iter      log prob        ||dx||      ||grad||       alpha      alpha0  # evals  Notes 
     100       9582.57   1.37866e-08       2570.55      0.2615           1      129   
Optimization terminated normally: 
  Convergence detected: relative gradient magnitude is below tolerance
      61       11813.3   1.59694e-08       2619.98      0.8228      0.8228       85   
Optimization terminated normally: 
  Convergence detected: relative gradient magnitude is below tolerance
      99         14232   1.09198e-07       2709.65      0.9734      0.9734      134   
    Iter      log prob        ||dx||      ||grad||       alpha      alpha0  # evals  Notes 
     118       14232.3   0.000123775       2114.25   4.909e-08       0.001      190  LS failed, Hessian reset 
     174       14232.4   5.56686e-08       2365.79           1           1      261   
Optimization terminated normally: 
  Convergence detected: relative gradient magnitude is below tolerance
