[I 2020-10-01 02:48:20,797] Trial 140 finished with value: 0.04059832608807212 and parameters: {'changepoint_prior_scale': 0.001013312444642469, 'seasonality_prior_scale': 0.25507212283036995, 'holidays_prior_scale': 0.14390740145368094, 'seasonality_mode': 'additive', 'changepoint_range': 0.5310722244193565}. Best is trial 96 with value: 0.038883738900888705.
Initial log joint probability = -28.8311
    Iter      log prob        ||dx||      ||grad||       alpha      alpha0  # evals  Notes 
      99       18912.5   3.07909e-05        4987.6      0.6373      0.6373      120   
    Iter      log prob        ||dx||      ||grad||       alpha      alpha0  # evals  Notes 
     197       18912.9   1.91827e-08       4727.67      0.1893      0.7257      239   
Optimization terminated normally: 
  Convergence detected: relative gradient magnitude is below tolerance
INFO:fbprophet:Making 5 forecasts with cutoffs between 2013-10-07 00:00:00 and 2015-10-18 00:00:00
INFO:fbprophet:Applying in parallel with <concurrent.futures.process.ProcessPoolExecutor object at 0x7fc88e685f10>
Initial log joint probability = -8.95172
    Iter      log prob        ||dx||      ||grad||       alpha      alpha0  # evals  Notes 
Initial log joint probability = -12.7302
    Iter      log prob        ||dx||      ||grad||       alpha      alpha0  # evals  Notes 
Initial log joint probability = -15.1549
    Iter      log prob        ||dx||      ||grad||       alpha      alpha0  # evals  Notes 
Initial log joint probability = -18.717
    Iter      log prob        ||dx||      ||grad||       alpha      alpha0  # evals  Notes 
      66       4678.81   7.37395e-09       4650.27       0.391       0.391       85   
Optimization terminated normally: 
  Convergence detected: absolute parameter change was below tolerance
Initial log joint probability = -23.5879
    Iter      log prob        ||dx||      ||grad||       alpha      alpha0  # evals  Notes 
      64       7028.11   4.11912e-05       4864.68   7.638e-09       0.001      121  LS failed, Hessian reset 
      64       9582.26   4.76673e-09       4611.54      0.1722      0.1722       84   
Optimization terminated normally: 
  Convergence detected: absolute parameter change was below tolerance
      99       7028.21   5.39939e-08       4430.17           1           1      163   
    Iter      log prob        ||dx||      ||grad||       alpha      alpha0  # evals  Notes 
      54         11813   5.78588e-09       4784.72      0.2962      0.2962       82   
Optimization terminated normally: 
  Convergence detected: absolute parameter change was below tolerance
     123       7028.21   5.23711e-09       4875.98      0.4285      0.4285      200   
Optimization terminated normally: 
  Convergence detected: absolute parameter change was below tolerance
      99       14232.3   1.15276e-06       4951.84      0.8132      0.8132      130   
    Iter      log prob        ||dx||      ||grad||       alpha      alpha0  # evals  Notes 
     145       14232.9   4.68315e-09        4388.3       0.347       0.347      188   
Optimization terminated normally: 
  Convergence detected: absolute parameter change was below tolerance
[I 2020-10-01 02:48:36,708] Trial 141 finished with value: 0.040661454516640744 and parameters: {'changepoint_prior_scale': 0.001001575197186866, 'seasonality_prior_scale': 0.3250677258604872, 'holidays_prior_scale': 0.1479791242413353, 'seasonality_mode': 'additive', 'changepoint_range': 0.5300995982133236}. Best is trial 96 with value: 0.038883738900888705.
Initial log joint probability = -28.8311
    Iter      log prob        ||dx||      ||grad||       alpha      alpha0  # evals  Notes 
      59       18911.1   8.28074e-05       5412.59   1.736e-08       0.001      117  LS failed, Hessian reset 
      99       18911.9   8.55192e-06       3329.14      0.1414           1      166   
    Iter      log prob        ||dx||      ||grad||       alpha      alpha0  # evals  Notes 
     149       18911.9   2.35621e-08       2648.85      0.3313           1      232   
Optimization terminated normally: 
  Convergence detected: relative gradient magnitude is below tolerance
INFO:fbprophet:Making 5 forecasts with cutoffs between 2013-10-07 00:00:00 and 2015-10-18 00:00:00
INFO:fbprophet:Applying in parallel with <concurrent.futures.process.ProcessPoolExecutor object at 0x7fc88e650b10>
Initial log joint probability = -8.95172
    Iter      log prob        ||dx||      ||grad||       alpha      alpha0  # evals  Notes 
Initial log joint probability = -12.7302
    Iter      log prob        ||dx||      ||grad||       alpha      alpha0  # evals  Notes 
Initial log joint probability = -15.1549
    Iter      log prob        ||dx||      ||grad||       alpha      alpha0  # evals  Notes 
Initial log joint probability = -18.717
    Iter      log prob        ||dx||      ||grad||       alpha      alpha0  # evals  Notes 
Initial log joint probability = -23.5879
    Iter      log prob        ||dx||      ||grad||       alpha      alpha0  # evals  Notes 
      83       4678.58   7.69613e-09       4939.31      0.3803      0.3803      111   
Optimization terminated normally: 
  Convergence detected: absolute parameter change was below tolerance
      63       7028.38   4.04534e-05       4708.83   7.751e-09       0.001      111  LS failed, Hessian reset 
      94        7028.5   6.71838e-09       4374.19      0.2964      0.2964      151   
Optimization terminated normally: 
  Convergence detected: absolute parameter change was below tolerance
      83       9582.23   9.80489e-09       4073.46      0.7864      0.7864      108   
Optimization terminated normally: 
  Convergence detected: absolute parameter change was below tolerance
      25       11811.5   0.000391626       4904.41   8.142e-08       0.001       78  LS failed, Hessian reset 
      97       11813.3   7.63713e-09       4890.16      0.6233      0.6233      169   
Optimization terminated normally: 
  Convergence detected: absolute parameter change was below tolerance
      99       14231.3   6.65712e-07       4947.95      0.9852      0.9852      130   
    Iter      log prob        ||dx||      ||grad||       alpha      alpha0  # evals  Notes 
     121       14231.3   3.67074e-09       4521.94      0.3452      0.3452      157   
Optimization terminated normally: 
  Convergence detected: absolute parameter change was below tolerance
[I 2020-10-01 02:48:51,316] Trial 142 finished with value: 0.04089131444696872 and parameters: {'changepoint_prior_scale': 0.0010290352992460739, 'seasonality_prior_scale': 0.3350719909461355, 'holidays_prior_scale': 0.1475422211537731, 'seasonality_mode': 'additive', 'changepoint_range': 0.5034222952525954}. Best is trial 96 with value: 0.038883738900888705.
Initial log joint probability = -28.8311
    Iter      log prob        ||dx||      ||grad||       alpha      alpha0  # evals  Notes 
      99       18911.8   3.54179e-06        4958.2      0.2568           1      124   
    Iter      log prob        ||dx||      ||grad||       alpha      alpha0  # evals  Notes 
     169       18912.7   3.22751e-06       4661.91   6.057e-10       0.001      249  LS failed, Hessian reset 
     189       18912.7    9.3414e-09       4528.55      0.2019           1      276   
Optimization terminated normally: 
  Convergence detected: absolute parameter change was below tolerance
INFO:fbprophet:Making 5 forecasts with cutoffs between 2013-10-07 00:00:00 and 2015-10-18 00:00:00
INFO:fbprophet:Applying in parallel with <concurrent.futures.process.ProcessPoolExecutor object at 0x7fc88e683d90>
Initial log joint probability = -8.95172
    Iter      log prob        ||dx||      ||grad||       alpha      alpha0  # evals  Notes 
Initial log joint probability = -12.7302
    Iter      log prob        ||dx||      ||grad||       alpha      alpha0  # evals  Notes 
Initial log joint probability = -15.1549
    Iter      log prob        ||dx||      ||grad||       alpha      alpha0  # evals  Notes 
      50       4678.87   9.44043e-09       4854.09      0.1735      0.1735       70   
Optimization terminated normally: 
  Convergence detected: absolute parameter change was below tolerance
Initial log joint probability = -18.717
    Iter      log prob        ||dx||      ||grad||       alpha      alpha0  # evals  Notes 
Initial log joint probability = -23.5879
    Iter      log prob        ||dx||      ||grad||       alpha      alpha0  # evals  Notes 
      55       9582.31   6.24677e-09       4716.67      0.1795      0.1795       72   
Optimization terminated normally: 
  Convergence detected: absolute parameter change was below tolerance
      99       7028.02   2.66988e-08       4122.69       0.372       0.372      127   
    Iter      log prob        ||dx||      ||grad||       alpha      alpha0  # evals  Notes 
     133       7028.03    7.3972e-09          4678      0.4893      0.4893      170   
Optimization terminated normally: 
  Convergence detected: absolute parameter change was below tolerance
      60       11813.1   9.87272e-09       4852.17      0.5521      0.5521       84   
Optimization terminated normally: 
  Convergence detected: absolute parameter change was below tolerance
      99       14233.1   9.73807e-06       5049.95      0.5557      0.5557      128   
    Iter      log prob        ||dx||      ||grad||       alpha      alpha0  # evals  Notes 
     132       14233.1   8.51132e-09        4902.8      0.4341      0.4341      166   
Optimization terminated normally: 
  Convergence detected: absolute parameter change was below tolerance
[I 2020-10-01 02:49:06,459] Trial 143 finished with value: 0.04093001613408876 and parameters: {'changepoint_prior_scale': 0.0010069712739555672, 'seasonality_prior_scale': 0.25300568939381324, 'holidays_prior_scale': 0.11595685659504226, 'seasonality_mode': 'additive', 'changepoint_range': 0.53042724097299}. Best is trial 96 with value: 0.038883738900888705.
Initial log joint probability = -28.8311
    Iter      log prob        ||dx||      ||grad||       alpha      alpha0  # evals  Notes 
      99       18912.3   0.000709094       4637.73           1           1      118   
    Iter      log prob        ||dx||      ||grad||       alpha      alpha0  # evals  Notes 
     185       18912.7   3.82829e-09        3775.4      0.1144      0.1144      231   
Optimization terminated normally: 
  Convergence detected: absolute parameter change was below tolerance
INFO:fbprophet:Making 5 forecasts with cutoffs between 2013-10-07 00:00:00 and 2015-10-18 00:00:00
INFO:fbprophet:Applying in parallel with <concurrent.futures.process.ProcessPoolExecutor object at 0x7fc88e6a6d90>
Initial log joint probability = -8.95172
    Iter      log prob        ||dx||      ||grad||       alpha      alpha0  # evals  Notes 
Initial log joint probability = -12.7302
    Iter      log prob        ||dx||      ||grad||       alpha      alpha0  # evals  Notes 
Initial log joint probability = -15.1549
    Iter      log prob        ||dx||      ||grad||       alpha      alpha0  # evals  Notes 
      56       4678.82   7.15003e-06       4758.04   1.595e-09       0.001      130  LS failed, Hessian reset 
Initial log joint probability = -18.717
    Iter      log prob        ||dx||      ||grad||       alpha      alpha0  # evals  Notes 
      99       4678.87   2.11595e-07       4528.22           1           1      185   
    Iter      log prob        ||dx||      ||grad||       alpha      alpha0  # evals  Notes 
Initial log joint probability = -23.5879
    Iter      log prob        ||dx||      ||grad||       alpha      alpha0  # evals  Notes 
      99       7028.17   1.13105e-08       4525.09      0.4816      0.4816      122   
    Iter      log prob        ||dx||      ||grad||       alpha      alpha0  # evals  Notes 
     101       7028.17   2.73544e-09       4498.88      0.3267      0.3267      125   
Optimization terminated normally: 
  Convergence detected: absolute parameter change was below tolerance
     102       4678.87   1.50859e-07       4542.78   3.221e-11       0.001      236  LS failed, Hessian reset 
     110       4678.87   6.45056e-09       4471.07       0.349           1      246   
Optimization terminated normally: 
  Convergence detected: absolute parameter change was below tolerance
      67       9582.39   1.28572e-06       4835.42   2.849e-10       0.001      135  LS failed, Hessian reset 
      84        9582.4   2.58306e-09        4056.9      0.2295      0.2295      156   
Optimization terminated normally: 
  Convergence detected: absolute parameter change was below tolerance
      78       11813.2   3.39343e-07       4655.55   7.153e-11       0.001      168  LS failed, Hessian reset 
      97       14233.1    1.2558e-08       4797.32       0.344           1      136   
Optimization terminated normally: 
  Convergence detected: relative gradient magnitude is below tolerance
      99       11813.2   1.84114e-08       4469.09           1           1      194   
    Iter      log prob        ||dx||      ||grad||       alpha      alpha0  # evals  Notes 
     105       11813.3    6.2507e-06       4600.08   1.361e-09       0.001      242  LS failed, Hessian reset 
     133       11813.3   9.95624e-09       4653.35      0.2934      0.2934      277   
Optimization terminated normally: 
  Convergence detected: absolute parameter change was below tolerance
[I 2020-10-01 02:49:21,271] Trial 144 finished with value: 0.04107844735588061 and parameters: {'changepoint_prior_scale': 0.0010804877607455978, 'seasonality_prior_scale': 0.4039878671476192, 'holidays_prior_scale': 0.09681455298973543, 'seasonality_mode': 'additive', 'changepoint_range': 0.5200975056374513}. Best is trial 96 with value: 0.038883738900888705.
Initial log joint probability = -28.8311
    Iter      log prob        ||dx||      ||grad||       alpha      alpha0  # evals  Notes 
      99       18912.9   7.98517e-08       3474.98           1           1      126   
    Iter      log prob        ||dx||      ||grad||       alpha      alpha0  # evals  Notes 
     104       18912.9   8.50948e-09       3418.18      0.3943      0.3943      131   
Optimization terminated normally: 
  Convergence detected: absolute parameter change was below tolerance
INFO:fbprophet:Making 5 forecasts with cutoffs between 2013-10-07 00:00:00 and 2015-10-18 00:00:00
INFO:fbprophet:Applying in parallel with <concurrent.futures.process.ProcessPoolExecutor object at 0x7fc88e69a090>
Initial log joint probability = -8.95172
    Iter      log prob        ||dx||      ||grad||       alpha      alpha0  # evals  Notes 
Initial log joint probability = -12.7302
    Iter      log prob        ||dx||      ||grad||       alpha      alpha0  # evals  Notes 
Initial log joint probability = -15.1549
    Iter      log prob        ||dx||      ||grad||       alpha      alpha0  # evals  Notes 
Initial log joint probability = -18.717
    Iter      log prob        ||dx||      ||grad||       alpha      alpha0  # evals  Notes 
Initial log joint probability = -23.5879
    Iter      log prob        ||dx||      ||grad||       alpha      alpha0  # evals  Notes 
      99       4679.24   2.84386e-07       3316.25      0.9566      0.9566      128   
    Iter      log prob        ||dx||      ||grad||       alpha      alpha0  # evals  Notes 
     108       4679.24   9.59145e-09       3513.48    0.009477           1      143   
Optimization terminated normally: 
  Convergence detected: absolute parameter change was below tolerance
      69       7029.36   4.21429e-05       3263.89   1.285e-08       0.001      126  LS failed, Hessian reset 
      63       9582.52   9.28747e-09       3480.69      0.2473           1       91   
Optimization terminated normally: 
  Convergence detected: absolute parameter change was below tolerance
      99       7029.46    5.5926e-08       3046.62           1           1      162   
    Iter      log prob        ||dx||      ||grad||       alpha      alpha0  # evals  Notes 
     117       7029.46   7.98376e-09       3320.91      0.1165      0.3266      185   
Optimization terminated normally: 
  Convergence detected: absolute parameter change was below tolerance
      50       11813.1   1.53982e-05       3408.83   4.499e-09       0.001      111  LS failed, Hessian reset 
      75       11813.2   5.41679e-09       3330.68      0.2262      0.2262      138   
Optimization terminated normally: 
  Convergence detected: absolute parameter change was below tolerance
      99       14232.1   8.84944e-08       3053.08      0.4785      0.4785      136   
    Iter      log prob        ||dx||      ||grad||       alpha      alpha0  # evals  Notes 
     111       14232.1    1.1153e-08       3185.56      0.3265           1      150   
Optimization terminated normally: 
  Convergence detected: relative gradient magnitude is below tolerance
[I 2020-10-01 02:49:36,849] Trial 145 finished with value: 0.04069925028385237 and parameters: {'changepoint_prior_scale': 0.0014800774118330572, 'seasonality_prior_scale': 0.2820466905525834, 'holidays_prior_scale': 0.0867905755983558, 'seasonality_mode': 'additive', 'changepoint_range': 0.5385784419697083}. Best is trial 96 with value: 0.038883738900888705.
Initial log joint probability = -28.8311
    Iter      log prob        ||dx||      ||grad||       alpha      alpha0  # evals  Notes 
      99       18912.9   2.18218e-07       3046.74      0.6311      0.6311      115   
    Iter      log prob        ||dx||      ||grad||       alpha      alpha0  # evals  Notes 
     121       18912.9   1.90553e-08       3279.61      0.2996           1      143   
Optimization terminated normally: 
  Convergence detected: relative gradient magnitude is below tolerance
INFO:fbprophet:Making 5 forecasts with cutoffs between 2013-10-07 00:00:00 and 2015-10-18 00:00:00
INFO:fbprophet:Applying in parallel with <concurrent.futures.process.ProcessPoolExecutor object at 0x7fc88e66c310>
Initial log joint probability = -8.95172
    Iter      log prob        ||dx||      ||grad||       alpha      alpha0  # evals  Notes 
Initial log joint probability = -12.7302
    Iter      log prob        ||dx||      ||grad||       alpha      alpha0  # evals  Notes 
Initial log joint probability = -15.1549
    Iter      log prob        ||dx||      ||grad||       alpha      alpha0  # evals  Notes 
Initial log joint probability = -18.717
    Iter      log prob        ||dx||      ||grad||       alpha      alpha0  # evals  Notes 
Initial log joint probability = -23.5879
    Iter      log prob        ||dx||      ||grad||       alpha      alpha0  # evals  Notes 
      52       4679.12   4.21331e-06       3330.12   1.317e-09       0.001      103  LS failed, Hessian reset 
      81       4679.14   9.06441e-09       3270.53      0.4014      0.4014      137   
Optimization terminated normally: 
  Convergence detected: absolute parameter change was below tolerance
      99       7029.52   3.96007e-08       3336.96       0.582       0.582      129   
    Iter      log prob        ||dx||      ||grad||       alpha      alpha0  # evals  Notes 
      59       9582.54   5.36777e-09       2971.06      0.2607      0.2607       87   
Optimization terminated normally: 
  Convergence detected: absolute parameter change was below tolerance
      30       11811.3   0.000314033        3057.1    9.74e-08       0.001       85  LS failed, Hessian reset 
     130       7029.52   6.62877e-08          3405   1.799e-11       0.001      211  LS failed, Hessian reset 
     134       7029.52   8.13471e-09       3080.92      0.6158      0.6158      215   
Optimization terminated normally: 
  Convergence detected: absolute parameter change was below tolerance
      99       14232.6    7.3842e-07       3400.84       5.376      0.5376      128   
    Iter      log prob        ||dx||      ||grad||       alpha      alpha0  # evals  Notes 
      81         11813   7.67971e-07       3309.25    2.07e-10       0.001      183  LS failed, Hessian reset 
     109       14232.6   7.26011e-09       3597.41    0.001397      0.3439      145   
Optimization terminated normally: 
  Convergence detected: absolute parameter change was below tolerance
      96         11813   1.01878e-08       3245.42      0.4812      0.4812      201   
Optimization terminated normally: 
  Convergence detected: relative gradient magnitude is below tolerance
