[I 2020-10-01 02:59:54,024] Trial 186 finished with value: 0.04083221879449569 and parameters: {'changepoint_prior_scale': 0.0012036234902532761, 'seasonality_prior_scale': 0.1294398425883851, 'holidays_prior_scale': 0.0911883677727492, 'seasonality_mode': 'additive', 'changepoint_range': 0.5381925635271267}. Best is trial 96 with value: 0.038883738900888705.
Initial log joint probability = -28.8311
    Iter      log prob        ||dx||      ||grad||       alpha      alpha0  # evals  Notes 
      99       18912.7   4.88808e-05        4186.1      0.5388      0.5388      120   
    Iter      log prob        ||dx||      ||grad||       alpha      alpha0  # evals  Notes 
     145       18912.8   2.96716e-07       4087.75   7.935e-11       0.001      215  LS failed, Hessian reset 
     151       18912.8   8.80981e-09       3305.24      0.3022      0.3022      222   
Optimization terminated normally: 
  Convergence detected: absolute parameter change was below tolerance
INFO:fbprophet:Making 5 forecasts with cutoffs between 2013-10-07 00:00:00 and 2015-10-18 00:00:00
INFO:fbprophet:Applying in parallel with <concurrent.futures.process.ProcessPoolExecutor object at 0x7fc84dc6ff10>
Initial log joint probability = -8.95172
    Iter      log prob        ||dx||      ||grad||       alpha      alpha0  # evals  Notes 
Initial log joint probability = -12.7302
    Iter      log prob        ||dx||      ||grad||       alpha      alpha0  # evals  Notes 
Initial log joint probability = -15.1549
    Iter      log prob        ||dx||      ||grad||       alpha      alpha0  # evals  Notes 
Initial log joint probability = -18.717
    Iter      log prob        ||dx||      ||grad||       alpha      alpha0  # evals  Notes 
      64       4678.97   8.33965e-09       4452.91      0.7239      0.7239       92   
Optimization terminated normally: 
  Convergence detected: absolute parameter change was below tolerance
Initial log joint probability = -23.5879
    Iter      log prob        ||dx||      ||grad||       alpha      alpha0  # evals  Notes 
      72       7028.29   3.41319e-05       3797.19    6.99e-09       0.001      137  LS failed, Hessian reset 
      99       7028.47   2.69555e-07        3316.3      0.5334      0.5334      172   
    Iter      log prob        ||dx||      ||grad||       alpha      alpha0  # evals  Notes 
     120       7028.47   5.88368e-09       4337.04      0.2288      0.2288      200   
Optimization terminated normally: 
  Convergence detected: absolute parameter change was below tolerance
      99       9582.11   1.87176e-08       3889.99      0.2642     0.02642      133   
    Iter      log prob        ||dx||      ||grad||       alpha      alpha0  # evals  Notes 
     106       9582.11   6.75321e-09       4132.75      0.6828      0.6828      142   
Optimization terminated normally: 
  Convergence detected: absolute parameter change was below tolerance
      31       11811.6   0.000202658       4439.46   4.372e-08       0.001      105  LS failed, Hessian reset 
      99       14233.5   1.35373e-06       3908.34           1           1      133   
    Iter      log prob        ||dx||      ||grad||       alpha      alpha0  # evals  Notes 
      99         11813   4.19755e-07       4300.93      0.2336           1      192   
    Iter      log prob        ||dx||      ||grad||       alpha      alpha0  # evals  Notes 
     111         11813   8.59706e-09        4351.7      0.2201       0.804      209   
Optimization terminated normally: 
  Convergence detected: absolute parameter change was below tolerance
     129       14233.5   3.91796e-07       4338.66   8.336e-11       0.001      220  LS failed, Hessian reset 
     139       14233.5   7.58735e-09       3575.96       0.465       0.465      232   
Optimization terminated normally: 
  Convergence detected: absolute parameter change was below tolerance
[I 2020-10-01 03:00:10,719] Trial 187 finished with value: 0.041064205181271664 and parameters: {'changepoint_prior_scale': 0.0011440089741649392, 'seasonality_prior_scale': 0.10228908312790642, 'holidays_prior_scale': 0.0898049631932109, 'seasonality_mode': 'additive', 'changepoint_range': 0.528041453849383}. Best is trial 96 with value: 0.038883738900888705.
Initial log joint probability = -28.8311
    Iter      log prob        ||dx||      ||grad||       alpha      alpha0  # evals  Notes 
      99       18912.1   8.50369e-07       5066.28           1           1      115   
    Iter      log prob        ||dx||      ||grad||       alpha      alpha0  # evals  Notes 
     121       18912.1   3.08122e-09       5299.06      0.2313      0.2313      145   
Optimization terminated normally: 
  Convergence detected: absolute parameter change was below tolerance
INFO:fbprophet:Making 5 forecasts with cutoffs between 2013-10-07 00:00:00 and 2015-10-18 00:00:00
INFO:fbprophet:Applying in parallel with <concurrent.futures.process.ProcessPoolExecutor object at 0x7fc88e67f850>
Initial log joint probability = -8.95172
    Iter      log prob        ||dx||      ||grad||       alpha      alpha0  # evals  Notes 
Initial log joint probability = -12.7302
    Iter      log prob        ||dx||      ||grad||       alpha      alpha0  # evals  Notes 
Initial log joint probability = -15.1549
    Iter      log prob        ||dx||      ||grad||       alpha      alpha0  # evals  Notes 
Initial log joint probability = -18.717
    Iter      log prob        ||dx||      ||grad||       alpha      alpha0  # evals  Notes 
      67       4678.93   7.60085e-09       4718.05      0.3497      0.3497       87   
Optimization terminated normally: 
  Convergence detected: absolute parameter change was below tolerance
Initial log joint probability = -23.5879
    Iter      log prob        ||dx||      ||grad||       alpha      alpha0  # evals  Notes 
      81       7027.81   3.69566e-05        5268.4    8.12e-09       0.001      133  LS failed, Hessian reset 
      58       9582.12   9.94603e-09       4910.86           1           1       85   
Optimization terminated normally: 
  Convergence detected: absolute parameter change was below tolerance
      99       7027.92   3.56591e-07       4247.58      0.8767      0.8767      154   
    Iter      log prob        ||dx||      ||grad||       alpha      alpha0  # evals  Notes 
     124       7027.92   9.90026e-09       4255.95      0.5909      0.5909      186   
Optimization terminated normally: 
  Convergence detected: absolute parameter change was below tolerance
      35       11812.9   1.70676e-05       4841.51   3.477e-09       0.001      101  LS failed, Hessian reset 
      71         11813   9.47207e-09       4689.04      0.4126      0.4126      145   
Optimization terminated normally: 
  Convergence detected: absolute parameter change was below tolerance
      99         14231     3.248e-07       4912.74           1           1      132   
    Iter      log prob        ||dx||      ||grad||       alpha      alpha0  # evals  Notes 
     120         14231   4.79284e-09       4593.04      0.1699      0.1699      161   
Optimization terminated normally: 
  Convergence detected: absolute parameter change was below tolerance
[I 2020-10-01 03:00:24,827] Trial 188 finished with value: 0.04089607391217313 and parameters: {'changepoint_prior_scale': 0.0010100739133172372, 'seasonality_prior_scale': 0.12726513070852424, 'holidays_prior_scale': 0.04803030715229487, 'seasonality_mode': 'additive', 'changepoint_range': 0.5390415648342356}. Best is trial 96 with value: 0.038883738900888705.
Initial log joint probability = -28.8311
    Iter      log prob        ||dx||      ||grad||       alpha      alpha0  # evals  Notes 
      99       18912.5   0.000119532       4179.88      0.1485           1      122   
    Iter      log prob        ||dx||      ||grad||       alpha      alpha0  # evals  Notes 
     135       18912.5   1.55228e-08       3643.22      0.2397           1      165   
Optimization terminated normally: 
  Convergence detected: relative gradient magnitude is below tolerance
INFO:fbprophet:Making 5 forecasts with cutoffs between 2013-10-07 00:00:00 and 2015-10-18 00:00:00
INFO:fbprophet:Applying in parallel with <concurrent.futures.process.ProcessPoolExecutor object at 0x7fc84dc34850>
Initial log joint probability = -8.95172
    Iter      log prob        ||dx||      ||grad||       alpha      alpha0  # evals  Notes 
Initial log joint probability = -12.7302
    Iter      log prob        ||dx||      ||grad||       alpha      alpha0  # evals  Notes 
Initial log joint probability = -15.1549
    Iter      log prob        ||dx||      ||grad||       alpha      alpha0  # evals  Notes 
Initial log joint probability = -18.717
    Iter      log prob        ||dx||      ||grad||       alpha      alpha0  # evals  Notes 
Initial log joint probability = -23.5879
    Iter      log prob        ||dx||      ||grad||       alpha      alpha0  # evals  Notes 
      99       4679.08    8.6067e-08       4175.73      0.5593      0.5593      143   
    Iter      log prob        ||dx||      ||grad||       alpha      alpha0  # evals  Notes 
     105       4679.17   1.60113e-05        4140.5   3.829e-09       0.001      185  LS failed, Hessian reset 
     136       4679.22   9.76362e-09       4157.57       1.583      0.3257      226   
Optimization terminated normally: 
  Convergence detected: absolute parameter change was below tolerance
      71       9582.38    4.8307e-09       4273.62      0.3457      0.3457      100   
Optimization terminated normally: 
  Convergence detected: absolute parameter change was below tolerance
      96       7028.58   2.63356e-05       3904.26   6.768e-09       0.001      167  LS failed, Hessian reset 
      99       7028.64   1.72488e-06       4310.58       0.183       0.183      171   
    Iter      log prob        ||dx||      ||grad||       alpha      alpha0  # evals  Notes 
      50       11813.2   9.94562e-09       4210.36      0.3559      0.3559       77   
Optimization terminated normally: 
  Convergence detected: absolute parameter change was below tolerance
     147       7028.76   7.60214e-09       3643.04      0.6093      0.6093      230   
Optimization terminated normally: 
  Convergence detected: absolute parameter change was below tolerance
      99       14232.4   6.83901e-07       3860.65      0.6895      0.6895      125   
    Iter      log prob        ||dx||      ||grad||       alpha      alpha0  # evals  Notes 
     116       14232.4   2.52744e-09       4030.31      0.1237      0.1237      148   
Optimization terminated normally: 
  Convergence detected: absolute parameter change was below tolerance
[I 2020-10-01 03:00:40,721] Trial 189 finished with value: 0.041423233157360094 and parameters: {'changepoint_prior_scale': 0.001212582225061541, 'seasonality_prior_scale': 0.1375887918017241, 'holidays_prior_scale': 0.0998055117610296, 'seasonality_mode': 'additive', 'changepoint_range': 0.5451298243626012}. Best is trial 96 with value: 0.038883738900888705.
Initial log joint probability = -28.8311
    Iter      log prob        ||dx||      ||grad||       alpha      alpha0  # evals  Notes 
      99       18910.9   1.17651e-05       4758.55           1           1      119   
    Iter      log prob        ||dx||      ||grad||       alpha      alpha0  # evals  Notes 
     166       18912.7     4.877e-09       4954.63      0.2777      0.2777      204   
Optimization terminated normally: 
  Convergence detected: absolute parameter change was below tolerance
INFO:fbprophet:Making 5 forecasts with cutoffs between 2013-10-07 00:00:00 and 2015-10-18 00:00:00
INFO:fbprophet:Applying in parallel with <concurrent.futures.process.ProcessPoolExecutor object at 0x7fc84dc6f990>
Initial log joint probability = -8.95172
    Iter      log prob        ||dx||      ||grad||       alpha      alpha0  # evals  Notes 
Initial log joint probability = -12.7302
    Iter      log prob        ||dx||      ||grad||       alpha      alpha0  # evals  Notes 
Initial log joint probability = -15.1549
    Iter      log prob        ||dx||      ||grad||       alpha      alpha0  # evals  Notes 
Initial log joint probability = -18.717
    Iter      log prob        ||dx||      ||grad||       alpha      alpha0  # evals  Notes 
      59       4678.58   7.81653e-09       4982.02       0.437       0.437       80   
Optimization terminated normally: 
  Convergence detected: absolute parameter change was below tolerance
Initial log joint probability = -23.5879
    Iter      log prob        ||dx||      ||grad||       alpha      alpha0  # evals  Notes 
      92        7027.6   5.95344e-09       4451.98      0.2349      0.2349      111   
Optimization terminated normally: 
  Convergence detected: absolute parameter change was below tolerance
      65       9582.24   3.18646e-05       5131.64   6.357e-09       0.001      120  LS failed, Hessian reset 
      32       11812.3   0.000178685        4970.5   3.665e-08       0.001       90  LS failed, Hessian reset 
      98        9582.4    3.6719e-09       4620.76       0.221       0.221      160   
Optimization terminated normally: 
  Convergence detected: absolute parameter change was below tolerance
      73         11813    8.1316e-09       4995.73      0.4793      0.4793      143   
Optimization terminated normally: 
  Convergence detected: absolute parameter change was below tolerance
      99       14232.6   1.69951e-08       4953.48      0.5558      0.5558      137   
    Iter      log prob        ||dx||      ||grad||       alpha      alpha0  # evals  Notes 
     100       14232.6   6.58436e-09       4930.54      0.3048      0.3048      138   
Optimization terminated normally: 
  Convergence detected: absolute parameter change was below tolerance
[I 2020-10-01 03:00:55,817] Trial 190 finished with value: 0.041014264671175873 and parameters: {'changepoint_prior_scale': 0.0010036329942852776, 'seasonality_prior_scale': 0.08953658853874807, 'holidays_prior_scale': 0.08271716187925211, 'seasonality_mode': 'additive', 'changepoint_range': 0.5137769182679904}. Best is trial 96 with value: 0.038883738900888705.
Initial log joint probability = -28.8311
    Iter      log prob        ||dx||      ||grad||       alpha      alpha0  # evals  Notes 
      99       18912.4   9.93477e-06       3910.05           1           1      130   
    Iter      log prob        ||dx||      ||grad||       alpha      alpha0  # evals  Notes 
     128       18912.4   9.11948e-09        3349.3      0.2972      0.2972      168   
Optimization terminated normally: 
  Convergence detected: absolute parameter change was below tolerance
INFO:fbprophet:Making 5 forecasts with cutoffs between 2013-10-07 00:00:00 and 2015-10-18 00:00:00
INFO:fbprophet:Applying in parallel with <concurrent.futures.process.ProcessPoolExecutor object at 0x7fc84dc04f10>
Initial log joint probability = -8.95172
    Iter      log prob        ||dx||      ||grad||       alpha      alpha0  # evals  Notes 
Initial log joint probability = -12.7302
    Iter      log prob        ||dx||      ||grad||       alpha      alpha0  # evals  Notes 
Initial log joint probability = -15.1549
    Iter      log prob        ||dx||      ||grad||       alpha      alpha0  # evals  Notes 
Initial log joint probability = -18.717
    Iter      log prob        ||dx||      ||grad||       alpha      alpha0  # evals  Notes 
Initial log joint probability = -23.5879
    Iter      log prob        ||dx||      ||grad||       alpha      alpha0  # evals  Notes 
      81        4679.1   7.60622e-09       3095.86      0.4814      0.4814      104   
Optimization terminated normally: 
  Convergence detected: absolute parameter change was below tolerance
      99       7029.38   7.56698e-07       3620.24      0.7658      0.7658      125   
    Iter      log prob        ||dx||      ||grad||       alpha      alpha0  # evals  Notes 
     124       7029.39   9.44324e-09       3473.37      0.5322      0.5322      155   
Optimization terminated normally: 
  Convergence detected: absolute parameter change was below tolerance
      29       11811.8   0.000330248        3234.8    9.98e-08       0.001       85  LS failed, Hessian reset 
      68       9582.47   1.33776e-07       3566.46   3.422e-11       0.001      135  LS failed, Hessian reset 
      76       9582.47   8.32041e-09       3395.18      0.4065      0.4065      146   
Optimization terminated normally: 
  Convergence detected: absolute parameter change was below tolerance
      75       11813.1   9.19561e-09        3385.7      0.2933      0.2933      144   
Optimization terminated normally: 
  Convergence detected: absolute parameter change was below tolerance
      92       14232.6   8.34045e-06       4113.05   2.866e-09       0.001      170  LS failed, Hessian reset 
      99       14232.6   1.58987e-06       2514.82           1           1      178   
    Iter      log prob        ||dx||      ||grad||       alpha      alpha0  # evals  Notes 
     119       14232.6   2.11757e-08       2531.61      0.4949      0.4949      201   
Optimization terminated normally: 
  Convergence detected: relative gradient magnitude is below tolerance
[I 2020-10-01 03:01:11,392] Trial 191 finished with value: 0.04048991717508151 and parameters: {'changepoint_prior_scale': 0.0013851091683916186, 'seasonality_prior_scale': 0.18191510757740056, 'holidays_prior_scale': 0.12492358959856055, 'seasonality_mode': 'additive', 'changepoint_range': 0.5531118536348206}. Best is trial 96 with value: 0.038883738900888705.
Initial log joint probability = -28.8311
    Iter      log prob        ||dx||      ||grad||       alpha      alpha0  # evals  Notes 
      99       18912.8   3.74362e-05       2911.86       0.489       0.489      125   
    Iter      log prob        ||dx||      ||grad||       alpha      alpha0  # evals  Notes 
     165       18912.9    1.1142e-08       2764.92      0.4464      0.4464      213   
Optimization terminated normally: 
  Convergence detected: relative gradient magnitude is below tolerance
INFO:fbprophet:Making 5 forecasts with cutoffs between 2013-10-07 00:00:00 and 2015-10-18 00:00:00
INFO:fbprophet:Applying in parallel with <concurrent.futures.process.ProcessPoolExecutor object at 0x7fc84dc34d50>
Initial log joint probability = -8.95172
    Iter      log prob        ||dx||      ||grad||       alpha      alpha0  # evals  Notes 
Initial log joint probability = -12.7302
    Iter      log prob        ||dx||      ||grad||       alpha      alpha0  # evals  Notes 
Initial log joint probability = -15.1549
    Iter      log prob        ||dx||      ||grad||       alpha      alpha0  # evals  Notes 
      99       4679.41    2.8046e-06        3420.2           1           1      130   
    Iter      log prob        ||dx||      ||grad||       alpha      alpha0  # evals  Notes 
Initial log joint probability = -18.717
    Iter      log prob        ||dx||      ||grad||       alpha      alpha0  # evals  Notes 
Initial log joint probability = -23.5879
    Iter      log prob        ||dx||      ||grad||       alpha      alpha0  # evals  Notes 
     114       4679.44   1.96148e-06       3383.74   5.847e-10       0.001      186  LS failed, Hessian reset 
     137       4679.45   9.49873e-09       3364.97           1           1      214   
Optimization terminated normally: 
  Convergence detected: absolute parameter change was below tolerance
      99       7029.44   1.48991e-07       3153.45      0.2939      0.2939      126   
    Iter      log prob        ||dx||      ||grad||       alpha      alpha0  # evals  Notes 
      59       9582.51   5.72279e-09       3311.54      0.1887      0.1887       79   
Optimization terminated normally: 
  Convergence detected: absolute parameter change was below tolerance
     131       7029.45   5.87502e-09       3037.21      0.4324      0.4324      168   
Optimization terminated normally: 
  Convergence detected: absolute parameter change was below tolerance
      69       11813.2   1.95046e-06       3351.41   5.731e-10       0.001      132  LS failed, Hessian reset 
      95       14231.9   2.52434e-08       2888.23      0.2196      0.9126      128   
Optimization terminated normally: 
  Convergence detected: relative gradient magnitude is below tolerance
      99       11813.2   2.59083e-07       3340.83      0.1462           1      168   
    Iter      log prob        ||dx||      ||grad||       alpha      alpha0  # evals  Notes 
     100       11813.2   1.98328e-07        3374.5   5.936e-11       0.001      212  LS failed, Hessian reset 
     108       11813.2   5.50009e-09        3399.3      0.2811      0.2811      221   
Optimization terminated normally: 
  Convergence detected: absolute parameter change was below tolerance
