[I 2020-10-01 02:32:34,646] Trial 78 finished with value: 0.04176091316275015 and parameters: {'changepoint_prior_scale': 0.00236281890855105, 'seasonality_prior_scale': 0.09643381792915712, 'holidays_prior_scale': 4.830870662485536, 'seasonality_mode': 'additive', 'changepoint_range': 0.5872483401662489}. Best is trial 67 with value: 0.04069570224533105.
Initial log joint probability = -28.8311
    Iter      log prob        ||dx||      ||grad||       alpha      alpha0  # evals  Notes 
      99       18912.8      0.000106       1729.81      0.2583           1      132   
    Iter      log prob        ||dx||      ||grad||       alpha      alpha0  # evals  Notes 
     178       18912.9   2.95413e-06       1285.23   2.516e-09       0.001      267  LS failed, Hessian reset 
     199       18912.9   1.05358e-07        1327.7           1           1      295   
    Iter      log prob        ||dx||      ||grad||       alpha      alpha0  # evals  Notes 
     235       18912.9   6.60997e-08       1396.46      0.9102      0.9102      337   
Optimization terminated normally: 
  Convergence detected: relative gradient magnitude is below tolerance
INFO:fbprophet:Making 5 forecasts with cutoffs between 2013-10-07 00:00:00 and 2015-10-18 00:00:00
INFO:fbprophet:Applying in parallel with <concurrent.futures.process.ProcessPoolExecutor object at 0x7fc88e65e890>
Initial log joint probability = -8.95172
    Iter      log prob        ||dx||      ||grad||       alpha      alpha0  # evals  Notes 
Initial log joint probability = -12.7302
    Iter      log prob        ||dx||      ||grad||       alpha      alpha0  # evals  Notes 
Initial log joint probability = -15.1549
    Iter      log prob        ||dx||      ||grad||       alpha      alpha0  # evals  Notes 
Initial log joint probability = -18.717
    Iter      log prob        ||dx||      ||grad||       alpha      alpha0  # evals  Notes 
      61       4679.24   3.87514e-09        1690.3      0.3298      0.3298       76   
Optimization terminated normally: 
  Convergence detected: absolute parameter change was below tolerance
Initial log joint probability = -23.5879
    Iter      log prob        ||dx||      ||grad||       alpha      alpha0  # evals  Notes 
      99       7031.38   3.33635e-07       1745.33           1           1      125   
    Iter      log prob        ||dx||      ||grad||       alpha      alpha0  # evals  Notes 
     110       7031.38   7.25851e-09       1606.13       0.274       0.274      139   
Optimization terminated normally: 
  Convergence detected: absolute parameter change was below tolerance
      71       9582.65   9.81534e-09       1521.22      0.5497      0.5497       90   
Optimization terminated normally: 
  Convergence detected: absolute parameter change was below tolerance
      93       11812.5   1.01225e-07       1619.91           1           1      120   
Optimization terminated normally: 
  Convergence detected: relative gradient magnitude is below tolerance
      99       14231.6   2.08241e-07       1539.27      0.5202      0.5202      126   
    Iter      log prob        ||dx||      ||grad||       alpha      alpha0  # evals  Notes 
     113         14232    0.00013058       1392.09   7.755e-08       0.001      187  LS failed, Hessian reset 
     199       14232.4   6.15057e-05       1525.94      0.8838      0.8838      289   
    Iter      log prob        ||dx||      ||grad||       alpha      alpha0  # evals  Notes 
     217       14233.2    0.00013911       1681.89   9.379e-08       0.001      351  LS failed, Hessian reset 
     282       14233.6   1.39354e-08       1477.09      0.3491      0.9179      430   
Optimization terminated normally: 
  Convergence detected: relative gradient magnitude is below tolerance
[I 2020-10-01 02:32:50,641] Trial 79 finished with value: 0.041712557015693125 and parameters: {'changepoint_prior_scale': 0.002954401085024055, 'seasonality_prior_scale': 0.18368245891420726, 'holidays_prior_scale': 8.134224015714638, 'seasonality_mode': 'additive', 'changepoint_range': 0.5655203576278247}. Best is trial 67 with value: 0.04069570224533105.
Initial log joint probability = -28.8311
    Iter      log prob        ||dx||      ||grad||       alpha      alpha0  # evals  Notes 
      99       18912.7   1.69721e-07       3401.03           1           1      133   
    Iter      log prob        ||dx||      ||grad||       alpha      alpha0  # evals  Notes 
     110       18912.8    3.7181e-06        3277.1    1.06e-09       0.001      181  LS failed, Hessian reset 
     140       18912.8   2.79788e-08       3188.82       0.377           1      219   
Optimization terminated normally: 
  Convergence detected: relative gradient magnitude is below tolerance
INFO:fbprophet:Making 5 forecasts with cutoffs between 2013-10-07 00:00:00 and 2015-10-18 00:00:00
INFO:fbprophet:Applying in parallel with <concurrent.futures.process.ProcessPoolExecutor object at 0x7fc88e664f50>
Initial log joint probability = -8.95172
    Iter      log prob        ||dx||      ||grad||       alpha      alpha0  # evals  Notes 
Initial log joint probability = -12.7302
    Iter      log prob        ||dx||      ||grad||       alpha      alpha0  # evals  Notes 
Initial log joint probability = -15.1549
    Iter      log prob        ||dx||      ||grad||       alpha      alpha0  # evals  Notes 
      99       4678.07   2.62562e-08       3442.57           1           1      131   
    Iter      log prob        ||dx||      ||grad||       alpha      alpha0  # evals  Notes 
     102       4678.07   1.97053e-09        3354.3      0.2474      0.2474      135   
Optimization terminated normally: 
  Convergence detected: absolute parameter change was below tolerance
Initial log joint probability = -18.717
    Iter      log prob        ||dx||      ||grad||       alpha      alpha0  # evals  Notes 
Initial log joint probability = -23.5879
    Iter      log prob        ||dx||      ||grad||       alpha      alpha0  # evals  Notes 
      99       7029.14   2.31042e-05       3312.25           1           1      123   
    Iter      log prob        ||dx||      ||grad||       alpha      alpha0  # evals  Notes 
     101       7029.16   4.91632e-06       3798.57    1.44e-09       0.001      166  LS failed, Hessian reset 
      88       9582.18   6.39039e-09       3539.29      0.3972      0.3972      120   
Optimization terminated normally: 
  Convergence detected: absolute parameter change was below tolerance
     126       7029.18   5.60652e-09       3270.99      0.2535      0.2535      198   
Optimization terminated normally: 
  Convergence detected: absolute parameter change was below tolerance
      33       11811.5   0.000232786       2616.94   6.717e-08       0.001       97  LS failed, Hessian reset 
      99       14232.9   1.54197e-06       3457.86           1           1      121   
    Iter      log prob        ||dx||      ||grad||       alpha      alpha0  # evals  Notes 
     114       14232.9   1.89664e-09       3513.14      0.1432      0.1432      139   
Optimization terminated normally: 
  Convergence detected: absolute parameter change was below tolerance
      96         11813   7.00495e-11       2582.08   0.0008242           1      184   
Optimization terminated normally: 
  Convergence detected: absolute parameter change was below tolerance
[I 2020-10-01 02:33:04,571] Trial 80 finished with value: 0.042879456021347274 and parameters: {'changepoint_prior_scale': 0.001457718019842146, 'seasonality_prior_scale': 0.12233903755075264, 'holidays_prior_scale': 2.682663306739984, 'seasonality_mode': 'multiplicative', 'changepoint_range': 0.5081990392639414}. Best is trial 67 with value: 0.04069570224533105.
Initial log joint probability = -28.8311
    Iter      log prob        ||dx||      ||grad||       alpha      alpha0  # evals  Notes 
      99       18912.7   7.25669e-06       3988.02      0.5638      0.5638      133   
    Iter      log prob        ||dx||      ||grad||       alpha      alpha0  # evals  Notes 
     125       18912.7   1.42602e-08       3909.67      0.3885      0.9101      168   
Optimization terminated normally: 
  Convergence detected: relative gradient magnitude is below tolerance
INFO:fbprophet:Making 5 forecasts with cutoffs between 2013-10-07 00:00:00 and 2015-10-18 00:00:00
INFO:fbprophet:Applying in parallel with <concurrent.futures.process.ProcessPoolExecutor object at 0x7fc88e6b7390>
Initial log joint probability = -8.95172
    Iter      log prob        ||dx||      ||grad||       alpha      alpha0  # evals  Notes 
Initial log joint probability = -12.7302
    Iter      log prob        ||dx||      ||grad||       alpha      alpha0  # evals  Notes 
Initial log joint probability = -15.1549
    Iter      log prob        ||dx||      ||grad||       alpha      alpha0  # evals  Notes 
Initial log joint probability = -18.717
    Iter      log prob        ||dx||      ||grad||       alpha      alpha0  # evals  Notes 
      70       4678.88   9.90387e-09       3976.15      0.4394      0.4394       92   
Optimization terminated normally: 
  Convergence detected: absolute parameter change was below tolerance
Initial log joint probability = -23.5879
    Iter      log prob        ||dx||      ||grad||       alpha      alpha0  # evals  Notes 
      60        7028.2   5.06355e-05       3863.72   1.204e-08       0.001      106  LS failed, Hessian reset 
      63       9582.24   9.66738e-09       3748.84       0.728       0.728       86   
Optimization terminated normally: 
  Convergence detected: absolute parameter change was below tolerance
      99       7028.36   2.84628e-07       3837.05           1           1      157   
    Iter      log prob        ||dx||      ||grad||       alpha      alpha0  # evals  Notes 
     117       7028.36   8.06909e-09       3743.06      0.4927      0.4927      179   
Optimization terminated normally: 
  Convergence detected: absolute parameter change was below tolerance
      58       11812.9   3.86088e-05       4035.11    8.99e-09       0.001      119  LS failed, Hessian reset 
      99       14232.6   5.91749e-07       4163.75      0.4156      0.4156      130   
    Iter      log prob        ||dx||      ||grad||       alpha      alpha0  # evals  Notes 
      99         11813   2.73661e-07        4098.7           1           1      175   
    Iter      log prob        ||dx||      ||grad||       alpha      alpha0  # evals  Notes 
     124       14232.6   6.82046e-09       3770.43      0.2724           1      163   
Optimization terminated normally: 
  Convergence detected: absolute parameter change was below tolerance
     114         11813   4.98631e-09       4198.23       0.442       0.442      195   
Optimization terminated normally: 
  Convergence detected: absolute parameter change was below tolerance
[I 2020-10-01 02:33:20,118] Trial 81 finished with value: 0.04105400838136375 and parameters: {'changepoint_prior_scale': 0.0012016767490834375, 'seasonality_prior_scale': 0.06349383660113435, 'holidays_prior_scale': 6.808988551631452, 'seasonality_mode': 'additive', 'changepoint_range': 0.6967603902579943}. Best is trial 67 with value: 0.04069570224533105.
Initial log joint probability = -28.8311
    Iter      log prob        ||dx||      ||grad||       alpha      alpha0  # evals  Notes 
      99       18912.4   5.47602e-07       2747.73      0.7883      0.7883      122   
    Iter      log prob        ||dx||      ||grad||       alpha      alpha0  # evals  Notes 
     124       18912.4   9.37427e-07       2614.82   3.534e-10       0.001      186  LS failed, Hessian reset 
     144       18912.4   2.74166e-08       2468.08           1           1      211   
Optimization terminated normally: 
  Convergence detected: relative gradient magnitude is below tolerance
INFO:fbprophet:Making 5 forecasts with cutoffs between 2013-10-07 00:00:00 and 2015-10-18 00:00:00
INFO:fbprophet:Applying in parallel with <concurrent.futures.process.ProcessPoolExecutor object at 0x7fc88e6d4550>
Initial log joint probability = -8.95172
    Iter      log prob        ||dx||      ||grad||       alpha      alpha0  # evals  Notes 
Initial log joint probability = -12.7302
    Iter      log prob        ||dx||      ||grad||       alpha      alpha0  # evals  Notes 
Initial log joint probability = -15.1549
    Iter      log prob        ||dx||      ||grad||       alpha      alpha0  # evals  Notes 
Initial log joint probability = -18.717
    Iter      log prob        ||dx||      ||grad||       alpha      alpha0  # evals  Notes 
Initial log joint probability = -23.5879
    Iter      log prob        ||dx||      ||grad||       alpha      alpha0  # evals  Notes 
      99       4678.69   2.75737e-07       2841.14           1           1      130   
    Iter      log prob        ||dx||      ||grad||       alpha      alpha0  # evals  Notes 
     114       4678.69    8.0778e-09       2873.44      0.3801      0.3801      147   
Optimization terminated normally: 
  Convergence detected: absolute parameter change was below tolerance
      99       7029.33   6.47176e-06       2690.63      0.7475      0.7475      120   
    Iter      log prob        ||dx||      ||grad||       alpha      alpha0  # evals  Notes 
     188       7031.23   5.11856e-09       2713.46       0.259       0.259      235   
Optimization terminated normally: 
  Convergence detected: absolute parameter change was below tolerance
      84       9581.82   2.69715e-05       2775.62   8.936e-09       0.001      161  LS failed, Hessian reset 
      53       11811.6   0.000194715        3221.8   6.869e-08       0.001      120  LS failed, Hessian reset 
      99       9581.89   2.43357e-07       2688.14      0.2876      0.2876      181   
    Iter      log prob        ||dx||      ||grad||       alpha      alpha0  # evals  Notes 
     117       9581.89   1.43087e-08        2801.4           1           1      207   
Optimization terminated normally: 
  Convergence detected: relative gradient magnitude is below tolerance
      99       11812.4   2.16222e-06        2812.2      0.7235      0.7235      177   
    Iter      log prob        ||dx||      ||grad||       alpha      alpha0  # evals  Notes 
      99       14230.9   4.65425e-08        2785.7      0.7517      0.7517      136   
    Iter      log prob        ||dx||      ||grad||       alpha      alpha0  # evals  Notes 
     104       14230.9   3.11648e-08       2608.65      0.2489      0.6384      144   
Optimization terminated normally: 
  Convergence detected: relative gradient magnitude is below tolerance
     135       11812.4   8.58206e-09       2696.98      0.2452      0.2452      220   
Optimization terminated normally: 
  Convergence detected: absolute parameter change was below tolerance
[I 2020-10-01 02:33:36,023] Trial 82 finished with value: 0.041692864270075826 and parameters: {'changepoint_prior_scale': 0.0017542238341348947, 'seasonality_prior_scale': 0.03331757359812049, 'holidays_prior_scale': 5.491657171478609, 'seasonality_mode': 'additive', 'changepoint_range': 0.6542637621136751}. Best is trial 67 with value: 0.04069570224533105.
Initial log joint probability = -28.8311
    Iter      log prob        ||dx||      ||grad||       alpha      alpha0  # evals  Notes 
      99       18912.6   3.29553e-08       2397.23      0.5498      0.5498      118   
    Iter      log prob        ||dx||      ||grad||       alpha      alpha0  # evals  Notes 
     111       18912.6   4.82088e-08       1772.36           1           1      132   
Optimization terminated normally: 
  Convergence detected: relative gradient magnitude is below tolerance
INFO:fbprophet:Making 5 forecasts with cutoffs between 2013-10-07 00:00:00 and 2015-10-18 00:00:00
INFO:fbprophet:Applying in parallel with <concurrent.futures.process.ProcessPoolExecutor object at 0x7fc88e6d4e50>
Initial log joint probability = -8.95172
    Iter      log prob        ||dx||      ||grad||       alpha      alpha0  # evals  Notes 
Initial log joint probability = -12.7302
    Iter      log prob        ||dx||      ||grad||       alpha      alpha0  # evals  Notes 
Initial log joint probability = -15.1549
    Iter      log prob        ||dx||      ||grad||       alpha      alpha0  # evals  Notes 
Initial log joint probability = -18.717
    Iter      log prob        ||dx||      ||grad||       alpha      alpha0  # evals  Notes 
Initial log joint probability = -23.5879
    Iter      log prob        ||dx||      ||grad||       alpha      alpha0  # evals  Notes 
      52       4678.85   5.96234e-05        2297.3    2.48e-08       0.001      112  LS failed, Hessian reset 
      90          4679   5.57855e-09       2276.96      0.5267      0.5267      162   
Optimization terminated normally: 
  Convergence detected: absolute parameter change was below tolerance
      99       7029.87   4.81919e-06       2604.49           1           1      122   
    Iter      log prob        ||dx||      ||grad||       alpha      alpha0  # evals  Notes 
      90       9582.19   9.04863e-09       2215.07      0.2842      0.2842      118   
Optimization terminated normally: 
  Convergence detected: absolute parameter change was below tolerance
     170       7031.29   4.54304e-09       2485.86      0.2131      0.2131      205   
Optimization terminated normally: 
  Convergence detected: absolute parameter change was below tolerance
      51       11811.8   0.000420684       2679.33   1.841e-07       0.001      139  LS failed, Hessian reset 
      99         14233   2.74029e-08        2375.5      0.6353      0.6353      130   
    Iter      log prob        ||dx||      ||grad||       alpha      alpha0  # evals  Notes 
     104         14233   6.26198e-09       2509.05      0.1707      0.1707      136   
Optimization terminated normally: 
  Convergence detected: absolute parameter change was below tolerance
      99       11812.6   1.28029e-07       2452.83           1           1      198   
    Iter      log prob        ||dx||      ||grad||       alpha      alpha0  # evals  Notes 
     106       11812.6   7.09699e-09       2382.03       0.269       0.269      206   
Optimization terminated normally: 
  Convergence detected: absolute parameter change was below tolerance
