[I 2020-10-01 03:19:56,077] Trial 265 finished with value: 0.04068592636661644 and parameters: {'changepoint_prior_scale': 0.0012447392850526145, 'seasonality_prior_scale': 0.37139349599310423, 'holidays_prior_scale': 0.09429329262977296, 'seasonality_mode': 'additive', 'changepoint_range': 0.5383745016406197}. Best is trial 96 with value: 0.038883738900888705.
Initial log joint probability = -28.8311
    Iter      log prob        ||dx||      ||grad||       alpha      alpha0  # evals  Notes 
      99       18912.8   7.87028e-06       2267.09      0.7817      0.7817      128   
    Iter      log prob        ||dx||      ||grad||       alpha      alpha0  # evals  Notes 
     123       18912.9   5.77178e-08       1696.96      0.2256      0.7113      156   
Optimization terminated normally: 
  Convergence detected: relative gradient magnitude is below tolerance
INFO:fbprophet:Making 5 forecasts with cutoffs between 2013-10-07 00:00:00 and 2015-10-18 00:00:00
INFO:fbprophet:Applying in parallel with <concurrent.futures.process.ProcessPoolExecutor object at 0x7fc84dc1c290>
Initial log joint probability = -8.95172
    Iter      log prob        ||dx||      ||grad||       alpha      alpha0  # evals  Notes 
Initial log joint probability = -12.7302
    Iter      log prob        ||dx||      ||grad||       alpha      alpha0  # evals  Notes 
Initial log joint probability = -15.1549
    Iter      log prob        ||dx||      ||grad||       alpha      alpha0  # evals  Notes 
Initial log joint probability = -18.717
    Iter      log prob        ||dx||      ||grad||       alpha      alpha0  # evals  Notes 
      53       4679.36   4.39681e-09       2361.68      0.5985      0.5985       74   
Optimization terminated normally: 
  Convergence detected: absolute parameter change was below tolerance
Initial log joint probability = -23.5879
    Iter      log prob        ||dx||      ||grad||       alpha      alpha0  # evals  Notes 
      99        7031.5   2.45462e-05       2263.33      0.4872      0.4872      119   
    Iter      log prob        ||dx||      ||grad||       alpha      alpha0  # evals  Notes 
      68       9582.57   1.77812e-07       2020.88   6.692e-11       0.001      130  LS failed, Hessian reset 
      72       9582.57   3.82657e-08       1537.74       0.531       0.531      134   
Optimization terminated normally: 
  Convergence detected: relative gradient magnitude is below tolerance
     180       7032.09   8.28105e-09       2167.98       0.262       0.262      216   
Optimization terminated normally: 
  Convergence detected: absolute parameter change was below tolerance
      84         11813   3.63088e-06       2617.44   1.616e-09       0.001      145  LS failed, Hessian reset 
      99         11813   1.29804e-07       2272.31           1           1      163   
    Iter      log prob        ||dx||      ||grad||       alpha      alpha0  # evals  Notes 
     105         11813   4.59868e-09       2230.71      0.3063      0.3063      171   
Optimization terminated normally: 
  Convergence detected: absolute parameter change was below tolerance
      84       14232.9   2.68189e-06        1681.9   1.215e-09       0.001      147  LS failed, Hessian reset 
      99       14232.9   2.04921e-07       1988.95           1           1      166   
    Iter      log prob        ||dx||      ||grad||       alpha      alpha0  # evals  Notes 
     117       14232.9   2.13582e-08       1986.38      0.1703      0.5675      188   
Optimization terminated normally: 
  Convergence detected: relative gradient magnitude is below tolerance
[I 2020-10-01 03:20:12,006] Trial 266 finished with value: 0.042257270570623146 and parameters: {'changepoint_prior_scale': 0.0021224087071477883, 'seasonality_prior_scale': 0.3793994946066471, 'holidays_prior_scale': 0.0907312467708396, 'seasonality_mode': 'additive', 'changepoint_range': 0.5271866264193709}. Best is trial 96 with value: 0.038883738900888705.
Initial log joint probability = -28.8311
    Iter      log prob        ||dx||      ||grad||       alpha      alpha0  # evals  Notes 
      99       18912.7   2.51729e-06       3364.11           1           1      123   
    Iter      log prob        ||dx||      ||grad||       alpha      alpha0  # evals  Notes 
     151       18912.8    2.0585e-08       3720.58           1           1      188   
Optimization terminated normally: 
  Convergence detected: relative gradient magnitude is below tolerance
INFO:fbprophet:Making 5 forecasts with cutoffs between 2013-10-07 00:00:00 and 2015-10-18 00:00:00
INFO:fbprophet:Applying in parallel with <concurrent.futures.process.ProcessPoolExecutor object at 0x7fc84dc25e90>
Initial log joint probability = -8.95172
    Iter      log prob        ||dx||      ||grad||       alpha      alpha0  # evals  Notes 
Initial log joint probability = -12.7302
    Iter      log prob        ||dx||      ||grad||       alpha      alpha0  # evals  Notes 
Initial log joint probability = -15.1549
    Iter      log prob        ||dx||      ||grad||       alpha      alpha0  # evals  Notes 
Initial log joint probability = -18.717
    Iter      log prob        ||dx||      ||grad||       alpha      alpha0  # evals  Notes 
Initial log joint probability = -23.5879
      67       4676.82   9.23436e-09       3700.52      0.4007           1       93   
Optimization terminated normally: 
  Convergence detected: absolute parameter change was below tolerance
    Iter      log prob        ||dx||      ||grad||       alpha      alpha0  # evals  Notes 
      80       7028.74   5.24829e-05        3436.4   1.274e-08       0.001      138  LS failed, Hessian reset 
      77       9582.42   2.51106e-09       3915.73      0.1768      0.1768       99   
Optimization terminated normally: 
  Convergence detected: absolute parameter change was below tolerance
      99       7028.86   1.43644e-06       3739.64      0.4317      0.4317      164   
    Iter      log prob        ||dx||      ||grad||       alpha      alpha0  # evals  Notes 
      54       11813.3   4.99237e-09       3660.56       0.345       0.345       81   
Optimization terminated normally: 
  Convergence detected: absolute parameter change was below tolerance
     134       7028.87    1.0733e-06        3691.3   2.821e-10       0.001      250  LS failed, Hessian reset 
      99       14232.4   5.67688e-08       4279.52      0.4381      0.4381      125   
    Iter      log prob        ||dx||      ||grad||       alpha      alpha0  # evals  Notes 
     178       7028.89    2.4096e-06       4163.65   6.118e-10       0.001      342  LS failed, Hessian reset 
     107       14232.4   6.54115e-09       3167.61      0.6805      0.6805      135   
Optimization terminated normally: 
  Convergence detected: absolute parameter change was below tolerance
     199        7028.9    3.2531e-08        3561.9           1           1      368   
    Iter      log prob        ||dx||      ||grad||       alpha      alpha0  # evals  Notes 
     204        7028.9   9.18381e-09       3420.49           1           1      377   
Optimization terminated normally: 
  Convergence detected: absolute parameter change was below tolerance
[I 2020-10-01 03:20:27,468] Trial 267 finished with value: 0.04105116015312374 and parameters: {'changepoint_prior_scale': 0.001283667629483183, 'seasonality_prior_scale': 0.32996954329550754, 'holidays_prior_scale': 0.09981156870792832, 'seasonality_mode': 'additive', 'changepoint_range': 0.537855220467412}. Best is trial 96 with value: 0.038883738900888705.
Initial log joint probability = -28.8311
    Iter      log prob        ||dx||      ||grad||       alpha      alpha0  # evals  Notes 
      99         18913   1.13912e-07       2982.13      0.7176      0.7176      132   
    Iter      log prob        ||dx||      ||grad||       alpha      alpha0  # evals  Notes 
     108         18913   1.71326e-08       3143.86      0.2413           1      145   
Optimization terminated normally: 
  Convergence detected: relative gradient magnitude is below tolerance
INFO:fbprophet:Making 5 forecasts with cutoffs between 2013-10-07 00:00:00 and 2015-10-18 00:00:00
INFO:fbprophet:Applying in parallel with <concurrent.futures.process.ProcessPoolExecutor object at 0x7fc84dc4d550>
Initial log joint probability = -8.95172
    Iter      log prob        ||dx||      ||grad||       alpha      alpha0  # evals  Notes 
Initial log joint probability = -12.7302
    Iter      log prob        ||dx||      ||grad||       alpha      alpha0  # evals  Notes 
Initial log joint probability = -15.1549
    Iter      log prob        ||dx||      ||grad||       alpha      alpha0  # evals  Notes 
Initial log joint probability = -18.717
    Iter      log prob        ||dx||      ||grad||       alpha      alpha0  # evals  Notes 
Initial log joint probability = -23.5879
    Iter      log prob        ||dx||      ||grad||       alpha      alpha0  # evals  Notes 
      99       4679.41   1.20231e-07       3320.24      0.7554      0.7554      128   
    Iter      log prob        ||dx||      ||grad||       alpha      alpha0  # evals  Notes 
     108       4679.41   8.88254e-09       3158.14           1           1      139   
Optimization terminated normally: 
  Convergence detected: absolute parameter change was below tolerance
      99        7029.5   2.30054e-06       3281.23      0.3656           1      121   
    Iter      log prob        ||dx||      ||grad||       alpha      alpha0  # evals  Notes 
      53       11813.3   7.23984e-09       3207.07      0.3489      0.3489       74   
Optimization terminated normally: 
  Convergence detected: absolute parameter change was below tolerance
     107       7029.57     1.854e-05       3369.07   6.236e-09       0.001      175  LS failed, Hessian reset 
      96       9582.51   1.29408e-07        2812.8   3.989e-11       0.001      169  LS failed, Hessian reset 
      99       9582.51   4.82897e-08        3148.5           1           1      172   
    Iter      log prob        ||dx||      ||grad||       alpha      alpha0  # evals  Notes 
     169       7029.67   5.70042e-09       2505.85      0.2498      0.2498      256   
Optimization terminated normally: 
  Convergence detected: absolute parameter change was below tolerance
     102       9582.51    1.1736e-08       2768.06      0.3126           1      176   
Optimization terminated normally: 
  Convergence detected: relative gradient magnitude is below tolerance
      99       14231.5    6.4837e-07       2768.54      0.4345      0.9458      132   
    Iter      log prob        ||dx||      ||grad||       alpha      alpha0  # evals  Notes 
     113       14231.5   2.24124e-08       1831.59           1           1      149   
Optimization terminated normally: 
  Convergence detected: relative gradient magnitude is below tolerance
[I 2020-10-01 03:20:41,206] Trial 268 finished with value: 0.041205630255603344 and parameters: {'changepoint_prior_scale': 0.0015503786334055184, 'seasonality_prior_scale': 0.3550636312422733, 'holidays_prior_scale': 0.07479867287250828, 'seasonality_mode': 'additive', 'changepoint_range': 0.5190966805084516}. Best is trial 96 with value: 0.038883738900888705.
Initial log joint probability = -28.8311
    Iter      log prob        ||dx||      ||grad||       alpha      alpha0  # evals  Notes 
      99       18912.3   2.97601e-05          3779      0.3367      0.3367      134   
    Iter      log prob        ||dx||      ||grad||       alpha      alpha0  # evals  Notes 
     150       18912.4   2.22184e-08       3673.81      0.7187      0.7187      202   
Optimization terminated normally: 
  Convergence detected: relative gradient magnitude is below tolerance
INFO:fbprophet:Making 5 forecasts with cutoffs between 2013-10-07 00:00:00 and 2015-10-18 00:00:00
INFO:fbprophet:Applying in parallel with <concurrent.futures.process.ProcessPoolExecutor object at 0x7fc84dc2ff50>
Initial log joint probability = -8.95172
    Iter      log prob        ||dx||      ||grad||       alpha      alpha0  # evals  Notes 
Initial log joint probability = -12.7302
    Iter      log prob        ||dx||      ||grad||       alpha      alpha0  # evals  Notes 
Initial log joint probability = -15.1549
    Iter      log prob        ||dx||      ||grad||       alpha      alpha0  # evals  Notes 
Initial log joint probability = -18.717
    Iter      log prob        ||dx||      ||grad||       alpha      alpha0  # evals  Notes 
      51       4672.96   0.000484944       3695.03    1.36e-07       0.001      114  LS failed, Hessian reset 
      99       4675.95   2.37129e-06        3982.1       0.154       0.154      167   
    Iter      log prob        ||dx||      ||grad||       alpha      alpha0  # evals  Notes 
Initial log joint probability = -23.5879
    Iter      log prob        ||dx||      ||grad||       alpha      alpha0  # evals  Notes 
     121       4675.97   6.90174e-09       4033.39      0.3897      0.3897      194   
Optimization terminated normally: 
  Convergence detected: absolute parameter change was below tolerance
      79        7028.8   2.84551e-05       3418.79   7.196e-09       0.001      137  LS failed, Hessian reset 
      99       7028.92   4.00392e-07       3688.16      0.1849           1      166   
    Iter      log prob        ||dx||      ||grad||       alpha      alpha0  # evals  Notes 
      27       11812.1   0.000186831       3757.01   4.954e-08       0.001       81  LS failed, Hessian reset 
      85       9582.45   1.00812e-06       3800.13   2.794e-10       0.001      181  LS failed, Hessian reset 
     154       7028.93   1.24383e-07       3518.61   2.739e-11       0.001      283  LS failed, Hessian reset 
      99       9582.46   1.26526e-07       3965.24      0.2944           1      198   
    Iter      log prob        ||dx||      ||grad||       alpha      alpha0  # evals  Notes 
     165       7028.93   4.07222e-09          3833      0.2449           1      298   
Optimization terminated normally: 
  Convergence detected: absolute parameter change was below tolerance
      81       11813.2   5.54235e-09        3775.6      0.1324      0.1324      147   
Optimization terminated normally: 
  Convergence detected: absolute parameter change was below tolerance
     114       9582.46   8.02945e-09       3895.41      0.6594      0.6594      215   
Optimization terminated normally: 
  Convergence detected: absolute parameter change was below tolerance
      99       14233.4   1.75904e-07       4161.17      0.4558      0.4558      123   
    Iter      log prob        ||dx||      ||grad||       alpha      alpha0  # evals  Notes 
     108       14233.4   4.35996e-09       3941.05      0.1397      0.1397      134   
Optimization terminated normally: 
  Convergence detected: absolute parameter change was below tolerance
[I 2020-10-01 03:20:58,258] Trial 269 finished with value: 0.04130947935432275 and parameters: {'changepoint_prior_scale': 0.0012608617682963851, 'seasonality_prior_scale': 0.30080007035333844, 'holidays_prior_scale': 0.0837990378768287, 'seasonality_mode': 'additive', 'changepoint_range': 0.5464517893462757}. Best is trial 96 with value: 0.038883738900888705.
Initial log joint probability = -28.8311
    Iter      log prob        ||dx||      ||grad||       alpha      alpha0  # evals  Notes 
      99       18912.8   1.54276e-05       2987.98           1           1      125   
    Iter      log prob        ||dx||      ||grad||       alpha      alpha0  # evals  Notes 
     153       18912.8   2.07527e-08       2950.22      0.1407           1      192   
Optimization terminated normally: 
  Convergence detected: relative gradient magnitude is below tolerance
INFO:fbprophet:Making 5 forecasts with cutoffs between 2013-10-07 00:00:00 and 2015-10-18 00:00:00
INFO:fbprophet:Applying in parallel with <concurrent.futures.process.ProcessPoolExecutor object at 0x7fc84dbf3f50>
Initial log joint probability = -8.95172
    Iter      log prob        ||dx||      ||grad||       alpha      alpha0  # evals  Notes 
Initial log joint probability = -12.7302
    Iter      log prob        ||dx||      ||grad||       alpha      alpha0  # evals  Notes 
Initial log joint probability = -15.1549
    Iter      log prob        ||dx||      ||grad||       alpha      alpha0  # evals  Notes 
Initial log joint probability = -18.717
    Iter      log prob        ||dx||      ||grad||       alpha      alpha0  # evals  Notes 
Initial log joint probability = -23.5879
    Iter      log prob        ||dx||      ||grad||       alpha      alpha0  # evals  Notes 
      96        4679.2   1.19648e-09        3358.9    0.002668      0.2459      126   
Optimization terminated normally: 
  Convergence detected: absolute parameter change was below tolerance
      56       9582.55   2.09932e-09        3483.8       0.188       0.188       76   
Optimization terminated normally: 
  Convergence detected: absolute parameter change was below tolerance
      79       7029.02    3.5925e-05       2931.43   8.912e-09       0.001      138  LS failed, Hessian reset 
      99       7029.13    1.1764e-06       3116.14       0.621       0.621      162   
    Iter      log prob        ||dx||      ||grad||       alpha      alpha0  # evals  Notes 
      46       11813.3   6.98706e-09       3515.69      0.2369      0.2369       72   
Optimization terminated normally: 
  Convergence detected: absolute parameter change was below tolerance
     128       7029.14   9.36507e-07       3619.74   2.907e-10       0.001      234  LS failed, Hessian reset 
     147       7029.15   7.04235e-09       2679.24      0.2129      0.2129      257   
Optimization terminated normally: 
  Convergence detected: absolute parameter change was below tolerance
      99       14232.7   8.50105e-08        4679.8      0.5944      0.5944      132   
    Iter      log prob        ||dx||      ||grad||       alpha      alpha0  # evals  Notes 
     188       14233.1   9.63385e-09       3531.14      0.5722      0.5722      251   
Optimization terminated normally: 
  Convergence detected: absolute parameter change was below tolerance
