[I 2020-10-01 02:58:23,524] Trial 180 finished with value: 0.04132405011947321 and parameters: {'changepoint_prior_scale': 0.0011356277777714483, 'seasonality_prior_scale': 0.3304714053099272, 'holidays_prior_scale': 0.2905378448272972, 'seasonality_mode': 'additive', 'changepoint_range': 0.5393276436461145}. Best is trial 96 with value: 0.038883738900888705.
Initial log joint probability = -28.8311
    Iter      log prob        ||dx||      ||grad||       alpha      alpha0  # evals  Notes 
      99       18912.9   6.96367e-06        3583.6           1           1      122   
    Iter      log prob        ||dx||      ||grad||       alpha      alpha0  # evals  Notes 
     122       18912.9   1.20712e-08        3441.2      0.2433           1      149   
Optimization terminated normally: 
  Convergence detected: relative gradient magnitude is below tolerance
INFO:fbprophet:Making 5 forecasts with cutoffs between 2013-10-07 00:00:00 and 2015-10-18 00:00:00
INFO:fbprophet:Applying in parallel with <concurrent.futures.process.ProcessPoolExecutor object at 0x7fc88e65ee10>
Initial log joint probability = -8.95172
    Iter      log prob        ||dx||      ||grad||       alpha      alpha0  # evals  Notes 
Initial log joint probability = -12.7302
    Iter      log prob        ||dx||      ||grad||       alpha      alpha0  # evals  Notes 
Initial log joint probability = -15.1549
    Iter      log prob        ||dx||      ||grad||       alpha      alpha0  # evals  Notes 
Initial log joint probability = -18.717
    Iter      log prob        ||dx||      ||grad||       alpha      alpha0  # evals  Notes 
Initial log joint probability = -23.5879
    Iter      log prob        ||dx||      ||grad||       alpha      alpha0  # evals  Notes 
      99       4679.16   3.25057e-05       3553.25      0.7668      0.7668      127   
    Iter      log prob        ||dx||      ||grad||       alpha      alpha0  # evals  Notes 
     135       4679.37    8.2463e-09       3575.97      0.6902      0.6902      170   
Optimization terminated normally: 
  Convergence detected: absolute parameter change was below tolerance
      99       7028.99    2.5659e-07       3078.25      0.3064      0.3064      127   
    Iter      log prob        ||dx||      ||grad||       alpha      alpha0  # evals  Notes 
      49       9582.47     7.675e-06        3799.1   2.276e-09       0.001      115  LS failed, Hessian reset 
     129          7029   3.79245e-07        2999.1    1.04e-10       0.001      200  LS failed, Hessian reset 
     147          7029   8.06696e-09       2891.22     0.04118           1      222   
Optimization terminated normally: 
  Convergence detected: absolute parameter change was below tolerance
      69       9582.49   2.19283e-09       3639.63      0.1768      0.1768      146   
Optimization terminated normally: 
  Convergence detected: absolute parameter change was below tolerance
      99       11813.1    7.0074e-05        3541.7           1           1      127   
    Iter      log prob        ||dx||      ||grad||       alpha      alpha0  # evals  Notes 
      99       14233.3   2.31426e-06       3530.71      0.3702           1      126   
    Iter      log prob        ||dx||      ||grad||       alpha      alpha0  # evals  Notes 
     103       11813.2   1.19173e-05       3794.61   3.477e-09       0.001      177  LS failed, Hessian reset 
     124       11813.2   9.04865e-09       3455.03      0.3473      0.3473      206   
Optimization terminated normally: 
  Convergence detected: absolute parameter change was below tolerance
     166       14233.4   9.19222e-09       3460.77      0.2374           1      212   
Optimization terminated normally: 
  Convergence detected: absolute parameter change was below tolerance
[I 2020-10-01 02:58:37,494] Trial 181 finished with value: 0.04120514962663405 and parameters: {'changepoint_prior_scale': 0.0013890810912948115, 'seasonality_prior_scale': 0.2378967764210549, 'holidays_prior_scale': 0.34559063288229047, 'seasonality_mode': 'additive', 'changepoint_range': 0.5575850250044923}. Best is trial 96 with value: 0.038883738900888705.
Initial log joint probability = -28.8311
    Iter      log prob        ||dx||      ||grad||       alpha      alpha0  # evals  Notes 
      99       18912.9   5.13203e-07       3889.02      0.5218      0.5218      119   
    Iter      log prob        ||dx||      ||grad||       alpha      alpha0  # evals  Notes 
     111       18912.9   1.13743e-06       3821.81   3.167e-10       0.001      175  LS failed, Hessian reset 
     136       18912.9   8.54557e-09       3722.09       0.228       0.228      207   
Optimization terminated normally: 
  Convergence detected: absolute parameter change was below tolerance
INFO:fbprophet:Making 5 forecasts with cutoffs between 2013-10-07 00:00:00 and 2015-10-18 00:00:00
INFO:fbprophet:Applying in parallel with <concurrent.futures.process.ProcessPoolExecutor object at 0x7fc88e66c150>
Initial log joint probability = -8.95172
    Iter      log prob        ||dx||      ||grad||       alpha      alpha0  # evals  Notes 
Initial log joint probability = -12.7302
    Iter      log prob        ||dx||      ||grad||       alpha      alpha0  # evals  Notes 
Initial log joint probability = -15.1549
    Iter      log prob        ||dx||      ||grad||       alpha      alpha0  # evals  Notes 
Initial log joint probability = -18.717
    Iter      log prob        ||dx||      ||grad||       alpha      alpha0  # evals  Notes 
Initial log joint probability = -23.5879
    Iter      log prob        ||dx||      ||grad||       alpha      alpha0  # evals  Notes 
      99       4679.43   3.74129e-06       3849.74       1.022       0.361      127   
    Iter      log prob        ||dx||      ||grad||       alpha      alpha0  # evals  Notes 
     119       4679.43   4.28095e-09       3841.23      0.4939      0.4939      155   
Optimization terminated normally: 
  Convergence detected: absolute parameter change was below tolerance
      58       9582.45   6.43985e-09       3788.04      0.6667      0.6667       80   
Optimization terminated normally: 
  Convergence detected: absolute parameter change was below tolerance
      72       7028.86   3.80886e-05       3578.57   9.725e-09       0.001      133  LS failed, Hessian reset 
      99       7029.04   7.21557e-08       3855.17      0.2496           1      168   
    Iter      log prob        ||dx||      ||grad||       alpha      alpha0  # evals  Notes 
     110       7029.04   7.13295e-09       3469.11      0.2302           1      182   
Optimization terminated normally: 
  Convergence detected: absolute parameter change was below tolerance
      81       11813.1   9.68959e-09       3554.05       0.387           1      119   
Optimization terminated normally: 
  Convergence detected: absolute parameter change was below tolerance
      99       14233.4   6.45851e-09       3834.56      0.1652      0.1652      135   
Optimization terminated normally: 
  Convergence detected: absolute parameter change was below tolerance
[I 2020-10-01 02:58:52,720] Trial 182 finished with value: 0.04128419013624981 and parameters: {'changepoint_prior_scale': 0.001297730296240634, 'seasonality_prior_scale': 0.1916075358522451, 'holidays_prior_scale': 0.14555650093976438, 'seasonality_mode': 'additive', 'changepoint_range': 0.5780865439705402}. Best is trial 96 with value: 0.038883738900888705.
Initial log joint probability = -28.8311
    Iter      log prob        ||dx||      ||grad||       alpha      alpha0  # evals  Notes 
      99       18912.2   2.40359e-05       4554.61           1           1      127   
    Iter      log prob        ||dx||      ||grad||       alpha      alpha0  # evals  Notes 
     129       18912.3   5.19726e-09        4621.1      0.2829      0.2829      166   
Optimization terminated normally: 
  Convergence detected: absolute parameter change was below tolerance
INFO:fbprophet:Making 5 forecasts with cutoffs between 2013-10-07 00:00:00 and 2015-10-18 00:00:00
INFO:fbprophet:Applying in parallel with <concurrent.futures.process.ProcessPoolExecutor object at 0x7fc88e69a090>
Initial log joint probability = -8.95172
    Iter      log prob        ||dx||      ||grad||       alpha      alpha0  # evals  Notes 
Initial log joint probability = -12.7302
    Iter      log prob        ||dx||      ||grad||       alpha      alpha0  # evals  Notes 
Initial log joint probability = -15.1549
    Iter      log prob        ||dx||      ||grad||       alpha      alpha0  # evals  Notes 
Initial log joint probability = -18.717
    Iter      log prob        ||dx||      ||grad||       alpha      alpha0  # evals  Notes 
      61       4676.92   6.91179e-09       4899.41      0.5432      0.5432       83   
Optimization terminated normally: 
  Convergence detected: absolute parameter change was below tolerance
Initial log joint probability = -23.5879
    Iter      log prob        ||dx||      ||grad||       alpha      alpha0  # evals  Notes 
      73       7027.71   2.34368e-05       4721.18   4.506e-09       0.001      144  LS failed, Hessian reset 
      99       7028.07   3.21143e-07       4350.08           1           1      179   
    Iter      log prob        ||dx||      ||grad||       alpha      alpha0  # evals  Notes 
      66       9582.19   1.07545e-07       5119.95   2.159e-11       0.001      130  LS failed, Hessian reset 
      74       9582.19   7.53157e-09       4445.17      0.5227      0.5227      141   
Optimization terminated normally: 
  Convergence detected: absolute parameter change was below tolerance
     147       7028.08   5.31373e-09       4276.31      0.3547           1      249   
Optimization terminated normally: 
  Convergence detected: absolute parameter change was below tolerance
      77       11812.9   1.56029e-06       5409.25   3.392e-10       0.001      143  LS failed, Hessian reset 
      95       11812.9   8.15483e-09       4499.48      0.3807      0.3807      163   
Optimization terminated normally: 
  Convergence detected: absolute parameter change was below tolerance
      99       14232.5   1.17142e-06       5139.81           1           1      127   
    Iter      log prob        ||dx||      ||grad||       alpha      alpha0  # evals  Notes 
     150       14233.1   8.34109e-09       4449.32      0.2869      0.2869      202   
Optimization terminated normally: 
  Convergence detected: absolute parameter change was below tolerance
[I 2020-10-01 02:59:07,041] Trial 183 finished with value: 0.04146092177305749 and parameters: {'changepoint_prior_scale': 0.0010120269715910193, 'seasonality_prior_scale': 0.16578289248190906, 'holidays_prior_scale': 0.10912192282815193, 'seasonality_mode': 'additive', 'changepoint_range': 0.5615614550593702}. Best is trial 96 with value: 0.038883738900888705.
Initial log joint probability = -28.8311
    Iter      log prob        ||dx||      ||grad||       alpha      alpha0  # evals  Notes 
      99       18912.8   1.37355e-05       3120.11           1           1      120   
    Iter      log prob        ||dx||      ||grad||       alpha      alpha0  # evals  Notes 
     102       18912.8   5.34453e-06       2957.25   1.761e-09       0.001      161  LS failed, Hessian reset 
     142       18912.8   1.07193e-07       2989.39   3.338e-11       0.001      254  LS failed, Hessian reset 
     149       18912.8   9.89736e-09       3000.81       0.542       0.542      263   
Optimization terminated normally: 
  Convergence detected: absolute parameter change was below tolerance
INFO:fbprophet:Making 5 forecasts with cutoffs between 2013-10-07 00:00:00 and 2015-10-18 00:00:00
INFO:fbprophet:Applying in parallel with <concurrent.futures.process.ProcessPoolExecutor object at 0x7fc84dc48ed0>
Initial log joint probability = -8.95172
    Iter      log prob        ||dx||      ||grad||       alpha      alpha0  # evals  Notes 
Initial log joint probability = -12.7302
    Iter      log prob        ||dx||      ||grad||       alpha      alpha0  # evals  Notes 
Initial log joint probability = -15.1549
    Iter      log prob        ||dx||      ||grad||       alpha      alpha0  # evals  Notes 
Initial log joint probability = -18.717
    Iter      log prob        ||dx||      ||grad||       alpha      alpha0  # evals  Notes 
Initial log joint probability = -23.5879
    Iter      log prob        ||dx||      ||grad||       alpha      alpha0  # evals  Notes 
      92       4679.17    8.0172e-09       3092.87      0.3972      0.3972      123   
Optimization terminated normally: 
  Convergence detected: absolute parameter change was below tolerance
      99       7029.55   3.21169e-07       2637.69      0.7635      0.7635      121   
    Iter      log prob        ||dx||      ||grad||       alpha      alpha0  # evals  Notes 
      49       9582.25   1.00048e-05       3118.13    3.05e-09       0.001      113  LS failed, Hessian reset 
     137       7029.59   4.20296e-06       2999.51   1.481e-09       0.001      202  LS failed, Hessian reset 
     179        7029.6   2.08424e-08       3264.95           1           1      252   
Optimization terminated normally: 
  Convergence detected: relative gradient magnitude is below tolerance
      89       11813.2   1.39909e-08       3229.19      0.2625           1      122   
Optimization terminated normally: 
  Convergence detected: relative gradient magnitude is below tolerance
      99       9582.29   9.95756e-09       3136.96      0.4775      0.4775      176   
Optimization terminated normally: 
  Convergence detected: absolute parameter change was below tolerance
      99       14231.5   9.63866e-05       2264.95      0.8103      0.8103      128   
    Iter      log prob        ||dx||      ||grad||       alpha      alpha0  # evals  Notes 
     199       14232.1   3.12786e-05       3189.24       0.946       0.946      252   
    Iter      log prob        ||dx||      ||grad||       alpha      alpha0  # evals  Notes 
     251       14232.8   4.04544e-09       3408.29      0.2122      0.2122      314   
Optimization terminated normally: 
  Convergence detected: absolute parameter change was below tolerance
[I 2020-10-01 02:59:22,954] Trial 184 finished with value: 0.04122194700029149 and parameters: {'changepoint_prior_scale': 0.0015495137766022883, 'seasonality_prior_scale': 0.07109525528866346, 'holidays_prior_scale': 0.18218939151701763, 'seasonality_mode': 'additive', 'changepoint_range': 0.5532588041527846}. Best is trial 96 with value: 0.038883738900888705.
Initial log joint probability = -28.8311
    Iter      log prob        ||dx||      ||grad||       alpha      alpha0  # evals  Notes 
      99       18912.9    1.1111e-07       2571.11      0.6613      0.6613      130   
    Iter      log prob        ||dx||      ||grad||       alpha      alpha0  # evals  Notes 
     114       18912.9   5.10687e-07       2729.92   2.109e-10       0.001      191  LS failed, Hessian reset 
     133       18912.9   2.56251e-08       2400.78      0.7486      0.7486      219   
Optimization terminated normally: 
  Convergence detected: relative gradient magnitude is below tolerance
INFO:fbprophet:Making 5 forecasts with cutoffs between 2013-10-07 00:00:00 and 2015-10-18 00:00:00
INFO:fbprophet:Applying in parallel with <concurrent.futures.process.ProcessPoolExecutor object at 0x7fc88e66c790>
Initial log joint probability = -8.95172
    Iter      log prob        ||dx||      ||grad||       alpha      alpha0  # evals  Notes 
Initial log joint probability = -12.7302
    Iter      log prob        ||dx||      ||grad||       alpha      alpha0  # evals  Notes 
Initial log joint probability = -15.1549
    Iter      log prob        ||dx||      ||grad||       alpha      alpha0  # evals  Notes 
      24       4677.34   0.000373284       2859.48   1.298e-07       0.001       66  LS failed, Hessian reset 
Initial log joint probability = -18.717
    Iter      log prob        ||dx||      ||grad||       alpha      alpha0  # evals  Notes 
      56        4678.6   9.74418e-06       2909.46   3.451e-09       0.001      145  LS failed, Hessian reset 
Initial log joint probability = -23.5879
    Iter      log prob        ||dx||      ||grad||       alpha      alpha0  # evals  Notes 
      89       4678.61   7.47353e-08       2799.38   2.615e-11       0.001      232  LS failed, Hessian reset 
      92       4678.61    2.5625e-09       2821.06      0.1582      0.1582      236   
Optimization terminated normally: 
  Convergence detected: absolute parameter change was below tolerance
      86       7029.68   3.47648e-05       2549.13    1.07e-08       0.001      146  LS failed, Hessian reset 
      99       7029.75   1.07934e-06       2509.48      0.5486      0.5486      160   
    Iter      log prob        ||dx||      ||grad||       alpha      alpha0  # evals  Notes 
      55       9582.54   1.76272e-06       2720.44   6.054e-10       0.001      118  LS failed, Hessian reset 
      57       11813.1   4.98228e-09       2899.45      0.1508      0.1508       84   
Optimization terminated normally: 
  Convergence detected: absolute parameter change was below tolerance
      70       9582.55   4.47371e-09       2859.18      0.2748      0.2748      140   
Optimization terminated normally: 
  Convergence detected: absolute parameter change was below tolerance
     199       7031.93   6.63451e-06       2965.73      0.5705      0.5705      279   
    Iter      log prob        ||dx||      ||grad||       alpha      alpha0  # evals  Notes 
     272       7032.06   8.56561e-09       2502.35      0.4695      0.4695      363   
Optimization terminated normally: 
  Convergence detected: absolute parameter change was below tolerance
      99       14233.3   8.49827e-06        2765.8           1           1      132   
    Iter      log prob        ||dx||      ||grad||       alpha      alpha0  # evals  Notes 
     141       14233.4   8.98344e-09       2600.98       0.282       0.282      187   
Optimization terminated normally: 
  Convergence detected: absolute parameter change was below tolerance
[I 2020-10-01 02:59:37,900] Trial 185 finished with value: 0.04241523304279393 and parameters: {'changepoint_prior_scale': 0.0017645258554634224, 'seasonality_prior_scale': 0.20397288036647557, 'holidays_prior_scale': 0.07239066777021828, 'seasonality_mode': 'additive', 'changepoint_range': 0.5693681837502645}. Best is trial 96 with value: 0.038883738900888705.
Initial log joint probability = -28.8311
    Iter      log prob        ||dx||      ||grad||       alpha      alpha0  # evals  Notes 
      99       18912.7   4.63225e-05       4084.25      0.5214      0.5214      130   
    Iter      log prob        ||dx||      ||grad||       alpha      alpha0  # evals  Notes 
     142       18912.9   9.46172e-09       3866.46      0.3401      0.3401      186   
Optimization terminated normally: 
  Convergence detected: absolute parameter change was below tolerance
INFO:fbprophet:Making 5 forecasts with cutoffs between 2013-10-07 00:00:00 and 2015-10-18 00:00:00
INFO:fbprophet:Applying in parallel with <concurrent.futures.process.ProcessPoolExecutor object at 0x7fc88e683410>
Initial log joint probability = -8.95172
    Iter      log prob        ||dx||      ||grad||       alpha      alpha0  # evals  Notes 
Initial log joint probability = -12.7302
    Iter      log prob        ||dx||      ||grad||       alpha      alpha0  # evals  Notes 
Initial log joint probability = -15.1549
    Iter      log prob        ||dx||      ||grad||       alpha      alpha0  # evals  Notes 
Initial log joint probability = -18.717
    Iter      log prob        ||dx||      ||grad||       alpha      alpha0  # evals  Notes 
      73       4679.35   8.12059e-09       4203.59      0.2893      0.2893       96   
Optimization terminated normally: 
  Convergence detected: absolute parameter change was below tolerance
Initial log joint probability = -23.5879
    Iter      log prob        ||dx||      ||grad||       alpha      alpha0  # evals  Notes 
      99       7028.28   4.59775e-07       4017.01           1           1      118   
    Iter      log prob        ||dx||      ||grad||       alpha      alpha0  # evals  Notes 
      49       9580.56   0.000240668       4081.28   6.538e-08       0.001      120  LS failed, Hessian reset 
     108       7028.39   1.94941e-05       3755.06    4.89e-09       0.001      205  LS failed, Hessian reset 
      32       11811.9   0.000252392       4002.78   5.209e-08       0.001       94  LS failed, Hessian reset 
     152       7028.62   7.67254e-09        3767.8      0.4278           1      261   
Optimization terminated normally: 
  Convergence detected: absolute parameter change was below tolerance
      99        9582.2   6.24843e-05       4245.04           1           1      176   
    Iter      log prob        ||dx||      ||grad||       alpha      alpha0  # evals  Notes 
     131       9582.33   4.29027e-09       4125.77      0.3265      0.3265      215   
Optimization terminated normally: 
  Convergence detected: absolute parameter change was below tolerance
      92       11813.2   8.90883e-09       4180.49      0.2273      0.2273      168   
Optimization terminated normally: 
  Convergence detected: absolute parameter change was below tolerance
      96       14232.2   8.29859e-09       3660.15      0.3445      0.3445      129   
Optimization terminated normally: 
  Convergence detected: absolute parameter change was below tolerance
