[I 2020-10-01 03:13:17,313] Trial 239 finished with value: 0.04270490127684345 and parameters: {'changepoint_prior_scale': 0.0011010926796221124, 'seasonality_prior_scale': 0.08097125339985342, 'holidays_prior_scale': 0.10267409675134626, 'seasonality_mode': 'multiplicative', 'changepoint_range': 0.5283883856575609}. Best is trial 96 with value: 0.038883738900888705.
Initial log joint probability = -28.8311
    Iter      log prob        ||dx||      ||grad||       alpha      alpha0  # evals  Notes 
      99       18912.6   5.43795e-06       3798.94           1           1      127   
    Iter      log prob        ||dx||      ||grad||       alpha      alpha0  # evals  Notes 
     125       18912.6   1.71162e-08       3905.61      0.9857      0.9857      158   
Optimization terminated normally: 
  Convergence detected: relative gradient magnitude is below tolerance
INFO:fbprophet:Making 5 forecasts with cutoffs between 2013-10-07 00:00:00 and 2015-10-18 00:00:00
INFO:fbprophet:Applying in parallel with <concurrent.futures.process.ProcessPoolExecutor object at 0x7fc84dbb2310>
Initial log joint probability = -8.95172
    Iter      log prob        ||dx||      ||grad||       alpha      alpha0  # evals  Notes 
Initial log joint probability = -12.7302
    Iter      log prob        ||dx||      ||grad||       alpha      alpha0  # evals  Notes 
Initial log joint probability = -15.1549
    Iter      log prob        ||dx||      ||grad||       alpha      alpha0  # evals  Notes 
Initial log joint probability = -18.717
    Iter      log prob        ||dx||      ||grad||       alpha      alpha0  # evals  Notes 
Initial log joint probability = -23.5879
    Iter      log prob        ||dx||      ||grad||       alpha      alpha0  # evals  Notes 
      99       4679.16   4.89229e-08       3881.66      0.2638      0.2638      125   
    Iter      log prob        ||dx||      ||grad||       alpha      alpha0  # evals  Notes 
     129       4679.16   4.58847e-07       3863.59   1.181e-10       0.001      214  LS failed, Hessian reset 
      99       7028.88   8.30151e-06       3619.17           1           1      128   
    Iter      log prob        ||dx||      ||grad||       alpha      alpha0  # evals  Notes 
     146       4679.17   6.30387e-09        3889.1      0.2992      0.2992      238   
Optimization terminated normally: 
  Convergence detected: absolute parameter change was below tolerance
      30       11811.7   0.000298049       3944.72   8.496e-08       0.001       87  LS failed, Hessian reset 
      99       9582.38   4.05957e-06       4055.84      0.2299           1      124   
    Iter      log prob        ||dx||      ||grad||       alpha      alpha0  # evals  Notes 
     123       9582.39    7.5311e-09       3868.91      0.2743      0.2743      150   
Optimization terminated normally: 
  Convergence detected: absolute parameter change was below tolerance
     199       7031.64   1.29691e-06       3905.89      0.4971      0.4971      247   
    Iter      log prob        ||dx||      ||grad||       alpha      alpha0  # evals  Notes 
     211       7031.66   2.06238e-06       3869.97   5.268e-10       0.001      304  LS failed, Hessian reset 
      94       11813.1   8.50002e-09       3676.58      0.1901      0.1901      169   
Optimization terminated normally: 
  Convergence detected: absolute parameter change was below tolerance
      99         14233    2.8417e-07       3729.77           1           1      129   
    Iter      log prob        ||dx||      ||grad||       alpha      alpha0  # evals  Notes 
     241       7031.69   2.59862e-06       3949.44   6.682e-10       0.001      383  LS failed, Hessian reset 
     275       7031.74   4.03554e-06       3847.17   1.033e-09       0.001      481  LS failed, Hessian reset 
     121         14233   2.26338e-07       3889.05   5.889e-11       0.001      195  LS failed, Hessian reset 
     299       7031.78   1.41961e-07       3881.07      0.6801      0.6801      510   
    Iter      log prob        ||dx||      ||grad||       alpha      alpha0  # evals  Notes 
     132         14233   8.65168e-09       3467.92      0.5943      0.5943      209   
Optimization terminated normally: 
  Convergence detected: absolute parameter change was below tolerance
     311       7031.78    4.3261e-09       4015.83      0.2809      0.2809      526   
Optimization terminated normally: 
  Convergence detected: absolute parameter change was below tolerance
[I 2020-10-01 03:13:32,708] Trial 240 finished with value: 0.04170517289549722 and parameters: {'changepoint_prior_scale': 0.0012854142663387379, 'seasonality_prior_scale': 0.096423330535125, 'holidays_prior_scale': 0.3857888496914471, 'seasonality_mode': 'additive', 'changepoint_range': 0.5362964865639643}. Best is trial 96 with value: 0.038883738900888705.
Initial log joint probability = -28.8311
    Iter      log prob        ||dx||      ||grad||       alpha      alpha0  # evals  Notes 
      99       18912.6   7.47554e-07       3241.46      0.4726      0.4726      129   
    Iter      log prob        ||dx||      ||grad||       alpha      alpha0  # evals  Notes 
     195       18912.8   1.96886e-08       2950.04      0.3558           1      261   
Optimization terminated normally: 
  Convergence detected: relative gradient magnitude is below tolerance
INFO:fbprophet:Making 5 forecasts with cutoffs between 2013-10-07 00:00:00 and 2015-10-18 00:00:00
INFO:fbprophet:Applying in parallel with <concurrent.futures.process.ProcessPoolExecutor object at 0x7fc84dc2fe50>
Initial log joint probability = -8.95172
    Iter      log prob        ||dx||      ||grad||       alpha      alpha0  # evals  Notes 
Initial log joint probability = -12.7302
    Iter      log prob        ||dx||      ||grad||       alpha      alpha0  # evals  Notes 
Initial log joint probability = -15.1549
    Iter      log prob        ||dx||      ||grad||       alpha      alpha0  # evals  Notes 
Initial log joint probability = -18.717
    Iter      log prob        ||dx||      ||grad||       alpha      alpha0  # evals  Notes 
      65       4678.77   7.38634e-05       3265.63   2.158e-08       0.001      116  LS failed, Hessian reset 
      99       4679.16   7.09772e-06       3179.64           1           1      157   
    Iter      log prob        ||dx||      ||grad||       alpha      alpha0  # evals  Notes 
Initial log joint probability = -23.5879
    Iter      log prob        ||dx||      ||grad||       alpha      alpha0  # evals  Notes 
     129       4679.17   3.14728e-09       3269.04      0.5486      0.5486      195   
Optimization terminated normally: 
  Convergence detected: absolute parameter change was below tolerance
      99       7029.23   4.03779e-08       3426.89      0.5226      0.5226      123   
    Iter      log prob        ||dx||      ||grad||       alpha      alpha0  # evals  Notes 
      99       9582.51   8.39737e-08       3253.84           1           1      119   
    Iter      log prob        ||dx||      ||grad||       alpha      alpha0  # evals  Notes 
      35       11811.6   0.000285085       3271.63    8.69e-08       0.001       88  LS failed, Hessian reset 
     105       9582.51   3.71333e-09       3148.59      0.2828      0.2828      128   
Optimization terminated normally: 
  Convergence detected: absolute parameter change was below tolerance
     199       7031.92   2.17958e-08       3332.93      0.2044      0.2044      243   
    Iter      log prob        ||dx||      ||grad||       alpha      alpha0  # evals  Notes 
      99         11813   4.88866e-08          3090      0.2351           1      164   
    Iter      log prob        ||dx||      ||grad||       alpha      alpha0  # evals  Notes 
     100         11813   9.97357e-09       3176.24      0.2002      0.2002      165   
Optimization terminated normally: 
  Convergence detected: absolute parameter change was below tolerance
     219       7031.92   4.36402e-08       3336.34   1.325e-11       0.001      309  LS failed, Hessian reset 
     223       7031.92   5.14803e-09       3128.19      0.6193      0.6193      313   
Optimization terminated normally: 
  Convergence detected: absolute parameter change was below tolerance
      95       14233.4   8.01262e-09       3337.98       0.209       0.209      125   
Optimization terminated normally: 
  Convergence detected: absolute parameter change was below tolerance
[I 2020-10-01 03:13:48,469] Trial 241 finished with value: 0.042366900279683636 and parameters: {'changepoint_prior_scale': 0.0014873155711363458, 'seasonality_prior_scale': 0.10583746040704368, 'holidays_prior_scale': 0.14259278046822998, 'seasonality_mode': 'additive', 'changepoint_range': 0.5225806105496453}. Best is trial 96 with value: 0.038883738900888705.
Initial log joint probability = -28.8311
    Iter      log prob        ||dx||      ||grad||       alpha      alpha0  # evals  Notes 
      99       18912.3    4.4837e-08        2583.5      0.3377      0.3377      123   
    Iter      log prob        ||dx||      ||grad||       alpha      alpha0  # evals  Notes 
     100       18912.3   8.84085e-09       2795.31      0.1127      0.4322      125   
Optimization terminated normally: 
  Convergence detected: absolute parameter change was below tolerance
INFO:fbprophet:Making 5 forecasts with cutoffs between 2013-10-07 00:00:00 and 2015-10-18 00:00:00
INFO:fbprophet:Applying in parallel with <concurrent.futures.process.ProcessPoolExecutor object at 0x7fc84dc34dd0>
Initial log joint probability = -8.95172
    Iter      log prob        ||dx||      ||grad||       alpha      alpha0  # evals  Notes 
Initial log joint probability = -12.7302
    Iter      log prob        ||dx||      ||grad||       alpha      alpha0  # evals  Notes 
Initial log joint probability = -15.1549
    Iter      log prob        ||dx||      ||grad||       alpha      alpha0  # evals  Notes 
Initial log joint probability = -18.717
    Iter      log prob        ||dx||      ||grad||       alpha      alpha0  # evals  Notes 
Initial log joint probability = -23.5879
    Iter      log prob        ||dx||      ||grad||       alpha      alpha0  # evals  Notes 
      47       4677.89   0.000204005       2944.06   6.475e-08       0.001      144  LS failed, Hessian reset 
      99       4678.47   8.41639e-07       2911.96           1           1      206   
    Iter      log prob        ||dx||      ||grad||       alpha      alpha0  # evals  Notes 
      99       7029.56   3.61557e-07       2968.78      0.2118           1      126   
    Iter      log prob        ||dx||      ||grad||       alpha      alpha0  # evals  Notes 
     103       4678.97   0.000164481       2943.33   5.412e-08       0.001      253  LS failed, Hessian reset 
      44       9582.38   6.67939e-06       2990.63   2.137e-09       0.001      102  LS failed, Hessian reset 
     135       4679.32   5.71425e-09       2975.57      0.3396      0.3396      297   
Optimization terminated normally: 
  Convergence detected: absolute parameter change was below tolerance
      54       11813.1   6.33993e-09       2977.78      0.2956      0.2956       83   
Optimization terminated normally: 
  Convergence detected: absolute parameter change was below tolerance
     178       7029.84   2.34504e-09       2788.97      0.2512      0.2512      233   
Optimization terminated normally: 
  Convergence detected: absolute parameter change was below tolerance
      86        9582.4   7.81195e-09       2882.66      0.5964      0.5964      156   
Optimization terminated normally: 
  Convergence detected: absolute parameter change was below tolerance
      99       14231.4     1.052e-06       2683.65      0.5943      0.5943      134   
    Iter      log prob        ||dx||      ||grad||       alpha      alpha0  # evals  Notes 
     148         14232   8.02626e-09       2897.61       0.346       0.346      193   
Optimization terminated normally: 
  Convergence detected: absolute parameter change was below tolerance
[I 2020-10-01 03:14:03,666] Trial 242 finished with value: 0.04131308354033604 and parameters: {'changepoint_prior_scale': 0.0016621639698320527, 'seasonality_prior_scale': 0.0709480017473001, 'holidays_prior_scale': 0.16029119227227787, 'seasonality_mode': 'additive', 'changepoint_range': 0.5458250674758925}. Best is trial 96 with value: 0.038883738900888705.
Initial log joint probability = -28.8311
    Iter      log prob        ||dx||      ||grad||       alpha      alpha0  # evals  Notes 
      99       18912.4   1.51105e-06       3391.23           1           1      122   
    Iter      log prob        ||dx||      ||grad||       alpha      alpha0  # evals  Notes 
     142       18912.6   2.92144e-08        3067.4       0.205           1      181   
Optimization terminated normally: 
  Convergence detected: relative gradient magnitude is below tolerance
INFO:fbprophet:Making 5 forecasts with cutoffs between 2013-10-07 00:00:00 and 2015-10-18 00:00:00
INFO:fbprophet:Applying in parallel with <concurrent.futures.process.ProcessPoolExecutor object at 0x7fc84dbb2d90>
Initial log joint probability = -8.95172
    Iter      log prob        ||dx||      ||grad||       alpha      alpha0  # evals  Notes 
Initial log joint probability = -12.7302
    Iter      log prob        ||dx||      ||grad||       alpha      alpha0  # evals  Notes 
Initial log joint probability = -15.1549
    Iter      log prob        ||dx||      ||grad||       alpha      alpha0  # evals  Notes 
Initial log joint probability = -18.717
    Iter      log prob        ||dx||      ||grad||       alpha      alpha0  # evals  Notes 
      65       4679.04   2.01182e-09       3656.24      0.1511      0.1511       87   
Optimization terminated normally: 
  Convergence detected: absolute parameter change was below tolerance
Initial log joint probability = -23.5879
    Iter      log prob        ||dx||      ||grad||       alpha      alpha0  # evals  Notes 
      83       7028.62   7.03893e-05       3878.36    1.93e-08       0.001      141  LS failed, Hessian reset 
      99       7028.76   9.23449e-07       2849.58      0.8356      0.8356      160   
    Iter      log prob        ||dx||      ||grad||       alpha      alpha0  # evals  Notes 
      53       9582.45   2.12169e-06        3252.1   6.008e-10       0.001      105  LS failed, Hessian reset 
      30       11811.9   0.000377876          4154   1.215e-07       0.001       83  LS failed, Hessian reset 
     141       7028.78   1.49612e-06       3384.04   4.044e-10       0.001      245  LS failed, Hessian reset 
     158       7028.78   5.15948e-09       3429.22      0.3036      0.3036      266   
Optimization terminated normally: 
  Convergence detected: absolute parameter change was below tolerance
      83       9582.46   6.63865e-07       3414.19   1.747e-10       0.001      180  LS failed, Hessian reset 
      99       9582.46   6.30743e-09       3287.77       0.245           1      204   
Optimization terminated normally: 
  Convergence detected: absolute parameter change was below tolerance
      99         14233   2.05348e-07        3598.3           1           1      131   
    Iter      log prob        ||dx||      ||grad||       alpha      alpha0  # evals  Notes 
      93       11813.2   2.53469e-07       3681.74   6.962e-11       0.001      202  LS failed, Hessian reset 
      99       11813.2   6.60039e-08       3608.08           1           1      210   
    Iter      log prob        ||dx||      ||grad||       alpha      alpha0  # evals  Notes 
     104       11813.2   8.91151e-09       3595.69      0.5562      0.5562      215   
Optimization terminated normally: 
  Convergence detected: absolute parameter change was below tolerance
     105         14233   3.98114e-07       3284.26   1.066e-10       0.001      177  LS failed, Hessian reset 
     118         14233   1.07979e-08       3783.77      0.6306      0.6306      194   
Optimization terminated normally: 
  Convergence detected: relative gradient magnitude is below tolerance
[I 2020-10-01 03:14:19,104] Trial 243 finished with value: 0.04068291206928987 and parameters: {'changepoint_prior_scale': 0.00138030673452653, 'seasonality_prior_scale': 0.11791260838477861, 'holidays_prior_scale': 0.1946839127918763, 'seasonality_mode': 'additive', 'changepoint_range': 0.5712101033690187}. Best is trial 96 with value: 0.038883738900888705.
Initial log joint probability = -28.8311
    Iter      log prob        ||dx||      ||grad||       alpha      alpha0  # evals  Notes 
      99       18912.8   1.87122e-05       3788.91           1           1      124   
    Iter      log prob        ||dx||      ||grad||       alpha      alpha0  # evals  Notes 
     125       18912.8   1.96829e-08       3663.96      0.4056           1      160   
Optimization terminated normally: 
  Convergence detected: relative gradient magnitude is below tolerance
INFO:fbprophet:Making 5 forecasts with cutoffs between 2013-10-07 00:00:00 and 2015-10-18 00:00:00
INFO:fbprophet:Applying in parallel with <concurrent.futures.process.ProcessPoolExecutor object at 0x7fc84dbe8d10>
Initial log joint probability = -8.95172
    Iter      log prob        ||dx||      ||grad||       alpha      alpha0  # evals  Notes 
Initial log joint probability = -12.7302
    Iter      log prob        ||dx||      ||grad||       alpha      alpha0  # evals  Notes 
Initial log joint probability = -15.1549
    Iter      log prob        ||dx||      ||grad||       alpha      alpha0  # evals  Notes 
Initial log joint probability = -18.717
    Iter      log prob        ||dx||      ||grad||       alpha      alpha0  # evals  Notes 
Initial log joint probability = -23.5879
    Iter      log prob        ||dx||      ||grad||       alpha      alpha0  # evals  Notes 
      56       4678.79   5.59227e-06       4102.84   1.409e-09       0.001      114  LS failed, Hessian reset 
      85       4678.83   9.47248e-09       4112.25      0.2766      0.2766      152   
Optimization terminated normally: 
  Convergence detected: absolute parameter change was below tolerance
      77       7028.52    3.5884e-05        3947.1   9.068e-09       0.001      135  LS failed, Hessian reset 
      99       7028.64   1.28639e-07       3443.81      0.4451      0.4451      162   
    Iter      log prob        ||dx||      ||grad||       alpha      alpha0  # evals  Notes 
      79       9582.35   5.65769e-09       4017.65       0.597       0.597      108   
Optimization terminated normally: 
  Convergence detected: absolute parameter change was below tolerance
      51       11813.1   7.86463e-09       3620.83      0.3198      0.3198       78   
Optimization terminated normally: 
  Convergence detected: absolute parameter change was below tolerance
     122       7028.65   4.18033e-09       3942.26      0.6598      0.6598      195   
Optimization terminated normally: 
  Convergence detected: absolute parameter change was below tolerance
      99       14232.7   1.56703e-06       3898.72           1           1      133   
    Iter      log prob        ||dx||      ||grad||       alpha      alpha0  # evals  Notes 
     116       14232.7   8.94617e-07       3675.23     2.1e-10       0.001      191  LS failed, Hessian reset 
     133       14232.7   5.35914e-09       3551.19      0.3182      0.3182      212   
Optimization terminated normally: 
  Convergence detected: absolute parameter change was below tolerance
