[I 2020-10-01 03:28:37,946] Trial 299 finished with value: 0.04140608741874455 and parameters: {'changepoint_prior_scale': 0.0011145004604792078, 'seasonality_prior_scale': 0.1459663110255821, 'holidays_prior_scale': 0.14781890429054087, 'seasonality_mode': 'additive', 'changepoint_range': 0.545365468132939}. Best is trial 96 with value: 0.038883738900888705.
Initial log joint probability = -28.8311
    Iter      log prob        ||dx||      ||grad||       alpha      alpha0  # evals  Notes 
      99       18912.7   7.61732e-05        3898.6      0.9177      0.9177      130   
    Iter      log prob        ||dx||      ||grad||       alpha      alpha0  # evals  Notes 
     176       18912.9   2.19726e-08       3443.71      0.2024      0.8928      220   
Optimization terminated normally: 
  Convergence detected: relative gradient magnitude is below tolerance
INFO:fbprophet:Making 5 forecasts with cutoffs between 2013-10-07 00:00:00 and 2015-10-18 00:00:00
INFO:fbprophet:Applying in parallel with <concurrent.futures.process.ProcessPoolExecutor object at 0x7fc84dc1e150>
Initial log joint probability = -8.95172
    Iter      log prob        ||dx||      ||grad||       alpha      alpha0  # evals  Notes 
Initial log joint probability = -12.7302
    Iter      log prob        ||dx||      ||grad||       alpha      alpha0  # evals  Notes 
Initial log joint probability = -15.1549
    Iter      log prob        ||dx||      ||grad||       alpha      alpha0  # evals  Notes 
Initial log joint probability = -18.717
    Iter      log prob        ||dx||      ||grad||       alpha      alpha0  # evals  Notes 
Initial log joint probability = -23.5879
      70       4678.02   9.75234e-09       3665.34      0.5787      0.5787       93   
Optimization terminated normally: 
  Convergence detected: absolute parameter change was below tolerance
    Iter      log prob        ||dx||      ||grad||       alpha      alpha0  # evals  Notes 
      91       7029.26   1.18113e-06       3733.17   3.092e-10       0.001      165  LS failed, Hessian reset 
      99       7029.26   1.33555e-06       3684.16           1           1      174   
    Iter      log prob        ||dx||      ||grad||       alpha      alpha0  # evals  Notes 
     122       7029.27   9.50406e-09       3260.37      0.6981      0.6981      202   
Optimization terminated normally: 
  Convergence detected: absolute parameter change was below tolerance
      71       9581.91   3.07465e-05       3737.66   7.962e-09       0.001      142  LS failed, Hessian reset 
      51       11813.1   7.96807e-07       3792.89   2.128e-10       0.001      107  LS failed, Hessian reset 
      64       11813.1   4.33696e-09        3835.1      0.1818      0.1818      125   
Optimization terminated normally: 
  Convergence detected: absolute parameter change was below tolerance
      99       9582.07   3.58048e-07       3473.25      0.2084           1      177   
    Iter      log prob        ||dx||      ||grad||       alpha      alpha0  # evals  Notes 
     109       9582.07   4.44807e-09        3157.1      0.2607      0.2607      192   
Optimization terminated normally: 
  Convergence detected: absolute parameter change was below tolerance
      99       14232.6   5.98054e-07       3297.81      0.4176      0.4176      136   
    Iter      log prob        ||dx||      ||grad||       alpha      alpha0  # evals  Notes 
     116       14232.6   1.91637e-08       3131.86      0.3012        0.82      159   
Optimization terminated normally: 
  Convergence detected: relative gradient magnitude is below tolerance
[I 2020-10-01 03:28:53,914] Trial 300 finished with value: 0.04233616513030338 and parameters: {'changepoint_prior_scale': 0.0013266530722769645, 'seasonality_prior_scale': 2.4764569471747278, 'holidays_prior_scale': 0.0907192527700771, 'seasonality_mode': 'multiplicative', 'changepoint_range': 0.5656724370302856}. Best is trial 96 with value: 0.038883738900888705.
Initial log joint probability = -28.8311
    Iter      log prob        ||dx||      ||grad||       alpha      alpha0  # evals  Notes 
      61         18916   5.78056e-05       214.114   3.551e-07       0.001      113  LS failed, Hessian reset 
      99       18916.1    1.1588e-05        112.54      0.4074      0.4074      163   
    Iter      log prob        ||dx||      ||grad||       alpha      alpha0  # evals  Notes 
     199       18916.2   2.19872e-05       131.458      0.4474           1      289   
    Iter      log prob        ||dx||      ||grad||       alpha      alpha0  # evals  Notes 
     214       18916.2   3.95935e-07       114.888      0.4958      0.4958      305   
Optimization terminated normally: 
  Convergence detected: relative gradient magnitude is below tolerance
INFO:fbprophet:Making 5 forecasts with cutoffs between 2013-10-07 00:00:00 and 2015-10-18 00:00:00
INFO:fbprophet:Applying in parallel with <concurrent.futures.process.ProcessPoolExecutor object at 0x7fc84dc04350>
Initial log joint probability = -8.95172
    Iter      log prob        ||dx||      ||grad||       alpha      alpha0  # evals  Notes 
Initial log joint probability = -12.7302
    Iter      log prob        ||dx||      ||grad||       alpha      alpha0  # evals  Notes 
Initial log joint probability = -15.1549
    Iter      log prob        ||dx||      ||grad||       alpha      alpha0  # evals  Notes 
Initial log joint probability = -18.717
    Iter      log prob        ||dx||      ||grad||       alpha      alpha0  # evals  Notes 
      65       4679.45      9.25e-09       170.846     0.04691     0.04691       89   
Optimization terminated normally: 
  Convergence detected: absolute parameter change was below tolerance
Initial log joint probability = -23.5879
    Iter      log prob        ||dx||      ||grad||       alpha      alpha0  # evals  Notes 
      88       7036.45   0.000194603       227.978   1.251e-06       0.001      141  LS failed, Hessian reset 
      99       7036.48   1.85286e-05        114.44           1           1      154   
    Iter      log prob        ||dx||      ||grad||       alpha      alpha0  # evals  Notes 
      99       9584.54   0.000197497           167           1           1      127   
    Iter      log prob        ||dx||      ||grad||       alpha      alpha0  # evals  Notes 
     114        7036.5   4.83732e-05        118.16   4.096e-07       0.001      220  LS failed, Hessian reset 
     138        7036.5   1.15758e-07       125.242      0.2439      0.5571      250   
Optimization terminated normally: 
  Convergence detected: relative gradient magnitude is below tolerance
      99       11814.7   0.000183618       174.391      0.8724      0.8724      122   
    Iter      log prob        ||dx||      ||grad||       alpha      alpha0  # evals  Notes 
     125       9584.62    4.3255e-05       176.968   2.746e-07       0.001      204  LS failed, Hessian reset 
     146       9584.63   1.84598e-07       133.964        0.49        0.49      233   
Optimization terminated normally: 
  Convergence detected: relative gradient magnitude is below tolerance
     137         11815    0.00020418       122.265   1.432e-06       0.001      205  LS failed, Hessian reset 
      88       14236.7   6.58958e-05        168.19   5.497e-07       0.001      168  LS failed, Hessian reset 
      99       14236.7   0.000200639       124.786      0.3955           1      182   
    Iter      log prob        ||dx||      ||grad||       alpha      alpha0  # evals  Notes 
     199       11815.1    1.6486e-06        93.763      0.2891      0.2891      286   
    Iter      log prob        ||dx||      ||grad||       alpha      alpha0  # evals  Notes 
     150       14236.8    0.00014181       281.209   7.712e-07       0.001      290  LS failed, Hessian reset 
     184       14236.8   2.62641e-06       113.759           1           1      344   
Optimization terminated normally: 
  Convergence detected: relative gradient magnitude is below tolerance
     299       11815.1   5.25421e-06       117.129      0.2303           1      416   
    Iter      log prob        ||dx||      ||grad||       alpha      alpha0  # evals  Notes 
     301       11815.1   2.02935e-06       135.614   1.877e-08       0.001      466  LS failed, Hessian reset 
     319       11815.1   5.26811e-07       153.247           1           1      487   
Optimization terminated normally: 
  Convergence detected: relative gradient magnitude is below tolerance
[I 2020-10-01 03:29:10,492] Trial 301 finished with value: 0.042565166022229976 and parameters: {'changepoint_prior_scale': 0.02721039310125417, 'seasonality_prior_scale': 7.028085178016154, 'holidays_prior_scale': 0.17419290813130056, 'seasonality_mode': 'additive', 'changepoint_range': 0.5544649357178247}. Best is trial 96 with value: 0.038883738900888705.
Initial log joint probability = -28.8311
    Iter      log prob        ||dx||      ||grad||       alpha      alpha0  # evals  Notes 
      99       18912.8   3.50791e-06       2526.14      0.5621      0.5621      120   
    Iter      log prob        ||dx||      ||grad||       alpha      alpha0  # evals  Notes 
     125       18912.9    2.2217e-08       2837.53      0.1167      0.5132      152   
Optimization terminated normally: 
  Convergence detected: relative gradient magnitude is below tolerance
INFO:fbprophet:Making 5 forecasts with cutoffs between 2013-10-07 00:00:00 and 2015-10-18 00:00:00
INFO:fbprophet:Applying in parallel with <concurrent.futures.process.ProcessPoolExecutor object at 0x7fc84dc4d0d0>
Initial log joint probability = -8.95172
    Iter      log prob        ||dx||      ||grad||       alpha      alpha0  # evals  Notes 
Initial log joint probability = -12.7302
    Iter      log prob        ||dx||      ||grad||       alpha      alpha0  # evals  Notes 
Initial log joint probability = -15.1549
    Iter      log prob        ||dx||      ||grad||       alpha      alpha0  # evals  Notes 
Initial log joint probability = -18.717
    Iter      log prob        ||dx||      ||grad||       alpha      alpha0  # evals  Notes 
      64       4672.19   9.93626e-09       3342.98      0.2021      0.4977       88   
Optimization terminated normally: 
  Convergence detected: absolute parameter change was below tolerance
Initial log joint probability = -23.5879
    Iter      log prob        ||dx||      ||grad||       alpha      alpha0  # evals  Notes 
      82       7029.21    2.0788e-05       3375.75   6.092e-09       0.001      144  LS failed, Hessian reset 
      99       7029.29   6.85117e-06       3630.18           1           1      165   
    Iter      log prob        ||dx||      ||grad||       alpha      alpha0  # evals  Notes 
      38       11811.5   0.000190272       3280.45   6.105e-08       0.001       93  LS failed, Hessian reset 
     138        7029.3   6.65386e-09       2885.58      0.2461      0.2461      212   
Optimization terminated normally: 
  Convergence detected: absolute parameter change was below tolerance
      61        9580.7   0.000414102       2375.71   1.493e-07       0.001      134  LS failed, Hessian reset 
      99       9582.14   1.12513e-05       2251.64           1           1      179   
    Iter      log prob        ||dx||      ||grad||       alpha      alpha0  # evals  Notes 
      87         11813    1.1641e-08       3249.45      0.3618           1      156   
Optimization terminated normally: 
  Convergence detected: relative gradient magnitude is below tolerance
      99         14233   3.03711e-07       3250.92      0.5064      0.5064      132   
    Iter      log prob        ||dx||      ||grad||       alpha      alpha0  # evals  Notes 
     118         14233   1.66016e-08       2564.91      0.7009      0.7009      156   
Optimization terminated normally: 
  Convergence detected: relative gradient magnitude is below tolerance
     149       9582.23   9.05568e-08        3169.7   2.831e-11       0.001      279  LS failed, Hessian reset 
     155       9582.23   6.60542e-09        3343.5      0.5313      0.5313      285   
Optimization terminated normally: 
  Convergence detected: absolute parameter change was below tolerance
[I 2020-10-01 03:29:24,594] Trial 302 finished with value: 0.039192254085760235 and parameters: {'changepoint_prior_scale': 0.001508369049230361, 'seasonality_prior_scale': 0.11890034924454425, 'holidays_prior_scale': 0.2663569130356524, 'seasonality_mode': 'additive', 'changepoint_range': 0.5268381816831627}. Best is trial 96 with value: 0.038883738900888705.
Initial log joint probability = -28.8311
    Iter      log prob        ||dx||      ||grad||       alpha      alpha0  # evals  Notes 
      99       18912.3   2.74805e-07       2303.18      0.8717      0.8717      133   
    Iter      log prob        ||dx||      ||grad||       alpha      alpha0  # evals  Notes 
     199       18912.8    2.0767e-05       2387.76   8.011e-09       0.001      311  LS failed, Hessian reset 
    Iter      log prob        ||dx||      ||grad||       alpha      alpha0  # evals  Notes 
     240         18913   2.40026e-06       2543.14   1.165e-09       0.001      401  LS failed, Hessian reset 
     261         18913   2.20428e-08       2014.92       0.398           1      424   
Optimization terminated normally: 
  Convergence detected: relative gradient magnitude is below tolerance
INFO:fbprophet:Making 5 forecasts with cutoffs between 2013-10-07 00:00:00 and 2015-10-18 00:00:00
INFO:fbprophet:Applying in parallel with <concurrent.futures.process.ProcessPoolExecutor object at 0x7fc84dc041d0>
Initial log joint probability = -8.95172
    Iter      log prob        ||dx||      ||grad||       alpha      alpha0  # evals  Notes 
Initial log joint probability = -12.7302
    Iter      log prob        ||dx||      ||grad||       alpha      alpha0  # evals  Notes 
Initial log joint probability = -15.1549
    Iter      log prob        ||dx||      ||grad||       alpha      alpha0  # evals  Notes 
Initial log joint probability = -18.717
    Iter      log prob        ||dx||      ||grad||       alpha      alpha0  # evals  Notes 
Initial log joint probability = -23.5879
    Iter      log prob        ||dx||      ||grad||       alpha      alpha0  # evals  Notes 
      73       4679.43   2.41514e-09       2571.27      0.1971      0.1971      104   
Optimization terminated normally: 
  Convergence detected: absolute parameter change was below tolerance
      99        7030.4   2.96224e-05       2510.16      0.6992      0.6992      121   
    Iter      log prob        ||dx||      ||grad||       alpha      alpha0  # evals  Notes 
      60       9582.55   4.86343e-06       1986.04   1.858e-09       0.001      117  LS failed, Hessian reset 
     159       7031.92   8.31949e-09       2362.01      0.3422           1      197   
Optimization terminated normally: 
  Convergence detected: absolute parameter change was below tolerance
      92       9582.56   2.09765e-08       2072.29      0.2887           1      156   
Optimization terminated normally: 
  Convergence detected: relative gradient magnitude is below tolerance
      99         11813   1.00284e-07       2031.39      0.5877      0.5877      135   
    Iter      log prob        ||dx||      ||grad||       alpha      alpha0  # evals  Notes 
     111         11813   1.83073e-08       2324.32           1           1      149   
Optimization terminated normally: 
  Convergence detected: relative gradient magnitude is below tolerance
      98       14232.7   7.29244e-07       2384.21   2.955e-10       0.001      178  LS failed, Hessian reset 
      99       14232.7   3.77613e-07       1831.42           1           1      179   
    Iter      log prob        ||dx||      ||grad||       alpha      alpha0  # evals  Notes 
     103       14232.7   8.82688e-09       2337.12     0.08598     0.08598      185   
Optimization terminated normally: 
  Convergence detected: absolute parameter change was below tolerance
[I 2020-10-01 03:29:41,545] Trial 303 finished with value: 0.04189423946738473 and parameters: {'changepoint_prior_scale': 0.0019825464428150077, 'seasonality_prior_scale': 0.12119318134326548, 'holidays_prior_scale': 0.32922519481377843, 'seasonality_mode': 'additive', 'changepoint_range': 0.5213961962531413}. Best is trial 96 with value: 0.038883738900888705.
Initial log joint probability = -28.8311
    Iter      log prob        ||dx||      ||grad||       alpha      alpha0  # evals  Notes 
      99       18912.8   2.67093e-06       2953.02      0.4881      0.4881      123   
    Iter      log prob        ||dx||      ||grad||       alpha      alpha0  # evals  Notes 
     114       18912.8    1.3514e-07       2950.71      0.3051           1      144   
Optimization terminated normally: 
  Convergence detected: relative gradient magnitude is below tolerance
INFO:fbprophet:Making 5 forecasts with cutoffs between 2013-10-07 00:00:00 and 2015-10-18 00:00:00
INFO:fbprophet:Applying in parallel with <concurrent.futures.process.ProcessPoolExecutor object at 0x7fc84dc0a1d0>
Initial log joint probability = -8.95172
    Iter      log prob        ||dx||      ||grad||       alpha      alpha0  # evals  Notes 
Initial log joint probability = -12.7302
    Iter      log prob        ||dx||      ||grad||       alpha      alpha0  # evals  Notes 
Initial log joint probability = -15.1549
    Iter      log prob        ||dx||      ||grad||       alpha      alpha0  # evals  Notes 
      40       4676.37    0.00090135       2693.06   2.911e-07       0.001      111  LS failed, Hessian reset 
Initial log joint probability = -18.717
    Iter      log prob        ||dx||      ||grad||       alpha      alpha0  # evals  Notes 
      93       4678.82   7.42206e-09       2942.88        0.46        0.46      175   
Optimization terminated normally: 
  Convergence detected: absolute parameter change was below tolerance
Initial log joint probability = -23.5879
    Iter      log prob        ||dx||      ||grad||       alpha      alpha0  # evals  Notes 
      99       7029.55   4.03509e-06       2925.55           1           1      127   
    Iter      log prob        ||dx||      ||grad||       alpha      alpha0  # evals  Notes 
      75       9582.51   1.18455e-08       2596.02      0.2721           1      108   
Optimization terminated normally: 
  Convergence detected: relative gradient magnitude is below tolerance
     116       7029.75   4.72249e-05       2815.92   1.624e-08       0.001      184  LS failed, Hessian reset 
      61       11813.2   9.79399e-09       2812.89      0.3625      0.3625       85   
Optimization terminated normally: 
  Convergence detected: absolute parameter change was below tolerance
     199       7031.44    0.00052413       2768.34           1           1      279   
    Iter      log prob        ||dx||      ||grad||       alpha      alpha0  # evals  Notes 
     246       7032.06   4.81368e-09       2673.03      0.0314      0.7361      338   
Optimization terminated normally: 
  Convergence detected: absolute parameter change was below tolerance
      99         14233   8.47063e-07       1809.39           1           1      127   
    Iter      log prob        ||dx||      ||grad||       alpha      alpha0  # evals  Notes 
     124         14233   2.77427e-08       2725.72           1           1      161   
Optimization terminated normally: 
  Convergence detected: relative gradient magnitude is below tolerance
