[I 2020-10-01 03:12:01,748] Trial 234 finished with value: 0.04087351141335627 and parameters: {'changepoint_prior_scale': 0.0015867020587397637, 'seasonality_prior_scale': 0.28969872866961655, 'holidays_prior_scale': 0.2886518014927841, 'seasonality_mode': 'additive', 'changepoint_range': 0.5772406099502128}. Best is trial 96 with value: 0.038883738900888705.
Initial log joint probability = -28.8311
    Iter      log prob        ||dx||      ||grad||       alpha      alpha0  # evals  Notes 
      76       18911.1   1.00342e-05       4343.37    2.53e-09       0.001      133  LS failed, Hessian reset 
      99       18911.2   1.03399e-06       4344.33           1           1      164   
    Iter      log prob        ||dx||      ||grad||       alpha      alpha0  # evals  Notes 
     190       18912.8   2.08637e-05       4715.33    4.57e-09       0.001      326  LS failed, Hessian reset 
     199       18912.8    4.1879e-06       4238.97           1           1      337   
    Iter      log prob        ||dx||      ||grad||       alpha      alpha0  # evals  Notes 
     216       18912.9   9.86116e-09       4422.38      0.1348      0.1348      365   
Optimization terminated normally: 
  Convergence detected: absolute parameter change was below tolerance
INFO:fbprophet:Making 5 forecasts with cutoffs between 2013-10-07 00:00:00 and 2015-10-18 00:00:00
INFO:fbprophet:Applying in parallel with <concurrent.futures.process.ProcessPoolExecutor object at 0x7fc84dc1e250>
Initial log joint probability = -8.95172
    Iter      log prob        ||dx||      ||grad||       alpha      alpha0  # evals  Notes 
Initial log joint probability = -12.7302
    Iter      log prob        ||dx||      ||grad||       alpha      alpha0  # evals  Notes 
      68       4678.77   5.16345e-07       4267.14   1.085e-10       0.001      127  LS failed, Hessian reset 
Initial log joint probability = -15.1549
    Iter      log prob        ||dx||      ||grad||       alpha      alpha0  # evals  Notes 
      82       4678.77   8.67913e-09       4628.58      0.6741      0.6741      145   
Optimization terminated normally: 
  Convergence detected: absolute parameter change was below tolerance
Initial log joint probability = -18.717
    Iter      log prob        ||dx||      ||grad||       alpha      alpha0  # evals  Notes 
Initial log joint probability = -23.5879
    Iter      log prob        ||dx||      ||grad||       alpha      alpha0  # evals  Notes 
      95       7028.93   6.11349e-05        4666.6   1.396e-08       0.001      163  LS failed, Hessian reset 
      99       7029.09   1.24382e-05        4088.1      0.8828      0.8828      168   
    Iter      log prob        ||dx||      ||grad||       alpha      alpha0  # evals  Notes 
      52       9582.38   1.85077e-06       4647.91    4.11e-10       0.001      115  LS failed, Hessian reset 
      51         11813   9.45181e-09       4157.15      0.2414      0.2414       78   
Optimization terminated normally: 
  Convergence detected: absolute parameter change was below tolerance
     153       7029.14   9.28714e-09       4091.85           1           1      241   
Optimization terminated normally: 
  Convergence detected: absolute parameter change was below tolerance
      75       9582.39   7.75667e-09       4323.16      0.3324           1      146   
Optimization terminated normally: 
  Convergence detected: absolute parameter change was below tolerance
      99       14233.6    3.9383e-06       4201.49           1           1      125   
    Iter      log prob        ||dx||      ||grad||       alpha      alpha0  # evals  Notes 
     148       14233.6   3.23081e-09       4354.55      0.2108      0.2108      192   
Optimization terminated normally: 
  Convergence detected: absolute parameter change was below tolerance
[I 2020-10-01 03:12:17,253] Trial 235 finished with value: 0.04102067815686282 and parameters: {'changepoint_prior_scale': 0.0011124545614852016, 'seasonality_prior_scale': 0.16674591303157976, 'holidays_prior_scale': 0.17690722654141583, 'seasonality_mode': 'additive', 'changepoint_range': 0.7731653899936944}. Best is trial 96 with value: 0.038883738900888705.
Initial log joint probability = -28.8311
    Iter      log prob        ||dx||      ||grad||       alpha      alpha0  # evals  Notes 
      99       18912.6   1.12435e-06       4114.79       0.924       0.924      123   
    Iter      log prob        ||dx||      ||grad||       alpha      alpha0  # evals  Notes 
     158       18912.8   1.81884e-08       3875.01      0.3088           1      192   
Optimization terminated normally: 
  Convergence detected: relative gradient magnitude is below tolerance
INFO:fbprophet:Making 5 forecasts with cutoffs between 2013-10-07 00:00:00 and 2015-10-18 00:00:00
INFO:fbprophet:Applying in parallel with <concurrent.futures.process.ProcessPoolExecutor object at 0x7fc84dc67590>
Initial log joint probability = -8.95172
    Iter      log prob        ||dx||      ||grad||       alpha      alpha0  # evals  Notes 
Initial log joint probability = -12.7302
    Iter      log prob        ||dx||      ||grad||       alpha      alpha0  # evals  Notes 
Initial log joint probability = -15.1549
    Iter      log prob        ||dx||      ||grad||       alpha      alpha0  # evals  Notes 
Initial log joint probability = -18.717
    Iter      log prob        ||dx||      ||grad||       alpha      alpha0  # evals  Notes 
Initial log joint probability = -23.5879
    Iter      log prob        ||dx||      ||grad||       alpha      alpha0  # evals  Notes 
      71       4679.18   7.66993e-09       3970.82      0.6376      0.6376      100   
Optimization terminated normally: 
  Convergence detected: absolute parameter change was below tolerance
      75       7028.34   3.28924e-05       3866.99   8.538e-09       0.001      141  LS failed, Hessian reset 
      68        9582.4   7.82758e-09       3565.83      0.3338      0.3338       89   
Optimization terminated normally: 
  Convergence detected: absolute parameter change was below tolerance
      99       7028.44    1.0858e-06        3343.6           1           1      175   
    Iter      log prob        ||dx||      ||grad||       alpha      alpha0  # evals  Notes 
      39       11811.3   0.000268355       3455.05   7.446e-08       0.001      115  LS failed, Hessian reset 
     158       7028.48    1.9186e-06       4406.84   5.024e-10       0.001      291  LS failed, Hessian reset 
     185       7028.49   9.50613e-09       3885.86      0.3685      0.3685      328   
Optimization terminated normally: 
  Convergence detected: absolute parameter change was below tolerance
      99       14232.5   2.02504e-07       4127.04           1           1      130   
    Iter      log prob        ||dx||      ||grad||       alpha      alpha0  # evals  Notes 
      91       11812.7   6.84284e-09       3480.51      0.1723      0.7141      180   
Optimization terminated normally: 
  Convergence detected: absolute parameter change was below tolerance
     102       14232.5   2.87685e-07       4036.11   7.869e-11       0.001      172  LS failed, Hessian reset 
     126       14232.5   2.17441e-07       4035.23   5.585e-11       0.001      250  LS failed, Hessian reset 
     135       14232.5   9.66784e-09       4037.81      0.4704      0.4704      262   
Optimization terminated normally: 
  Convergence detected: absolute parameter change was below tolerance
[I 2020-10-01 03:12:32,250] Trial 236 finished with value: 0.041077883105012446 and parameters: {'changepoint_prior_scale': 0.0012750411874480375, 'seasonality_prior_scale': 0.2055226824012522, 'holidays_prior_scale': 0.244217919828027, 'seasonality_mode': 'additive', 'changepoint_range': 0.5525263799799236}. Best is trial 96 with value: 0.038883738900888705.
Initial log joint probability = -28.8311
    Iter      log prob        ||dx||      ||grad||       alpha      alpha0  # evals  Notes 
      99       18912.9   1.70201e-08       2476.92       0.359       0.359      124   
    Iter      log prob        ||dx||      ||grad||       alpha      alpha0  # evals  Notes 
     100       18912.9   2.97708e-08       2296.36      0.3478           1      126   
Optimization terminated normally: 
  Convergence detected: relative gradient magnitude is below tolerance
INFO:fbprophet:Making 5 forecasts with cutoffs between 2013-10-07 00:00:00 and 2015-10-18 00:00:00
INFO:fbprophet:Applying in parallel with <concurrent.futures.process.ProcessPoolExecutor object at 0x7fc84dc482d0>
Initial log joint probability = -8.95172
    Iter      log prob        ||dx||      ||grad||       alpha      alpha0  # evals  Notes 
Initial log joint probability = -12.7302
    Iter      log prob        ||dx||      ||grad||       alpha      alpha0  # evals  Notes 
Initial log joint probability = -15.1549
    Iter      log prob        ||dx||      ||grad||       alpha      alpha0  # evals  Notes 
Initial log joint probability = -18.717
    Iter      log prob        ||dx||      ||grad||       alpha      alpha0  # evals  Notes 
Initial log joint probability = -23.5879
    Iter      log prob        ||dx||      ||grad||       alpha      alpha0  # evals  Notes 
      56       4678.12   0.000268618       2266.61   1.056e-07       0.001      127  LS failed, Hessian reset 
      99       4679.35   6.22478e-06       2588.21      0.3601      0.3601      175   
    Iter      log prob        ||dx||      ||grad||       alpha      alpha0  # evals  Notes 
     121       4679.36   8.35421e-09       2595.75       0.341       0.341      205   
Optimization terminated normally: 
  Convergence detected: absolute parameter change was below tolerance
      56        9582.6   2.85754e-08       2636.21      0.8561      0.8561       77   
Optimization terminated normally: 
  Convergence detected: relative gradient magnitude is below tolerance
      81       7030.12   4.02599e-05          2524   1.509e-08       0.001      135  LS failed, Hessian reset 
      99       7030.19   7.77797e-07       2249.68      0.3443           1      158   
    Iter      log prob        ||dx||      ||grad||       alpha      alpha0  # evals  Notes 
      33       11812.2   0.000331257       2612.01   1.373e-07       0.001      101  LS failed, Hessian reset 
      99       14233.6   1.90656e-08       2599.28      0.4497      0.4497      135   
Optimization terminated normally: 
  Convergence detected: relative gradient magnitude is below tolerance
      94       11813.1   2.22148e-08       2308.52      0.5693     0.05693      181   
Optimization terminated normally: 
  Convergence detected: relative gradient magnitude is below tolerance
     199        7031.8   2.84764e-07        2689.5       0.831       0.831      276   
    Iter      log prob        ||dx||      ||grad||       alpha      alpha0  # evals  Notes 
     220        7031.8   6.15503e-09       2608.35      0.3959           1      303   
Optimization terminated normally: 
  Convergence detected: absolute parameter change was below tolerance
[I 2020-10-01 03:12:46,064] Trial 237 finished with value: 0.0415795539445124 and parameters: {'changepoint_prior_scale': 0.0019329831720096672, 'seasonality_prior_scale': 0.24517424325461862, 'holidays_prior_scale': 0.12608883723643, 'seasonality_mode': 'additive', 'changepoint_range': 0.5891012977793184}. Best is trial 96 with value: 0.038883738900888705.
Initial log joint probability = -28.8311
    Iter      log prob        ||dx||      ||grad||       alpha      alpha0  # evals  Notes 
      99       18912.8   8.43387e-07       3388.96      0.9641      0.9641      126   
    Iter      log prob        ||dx||      ||grad||       alpha      alpha0  # evals  Notes 
     126       18912.9   7.83268e-09        3294.8      0.1284      0.1284      163   
Optimization terminated normally: 
  Convergence detected: absolute parameter change was below tolerance
INFO:fbprophet:Making 5 forecasts with cutoffs between 2013-10-07 00:00:00 and 2015-10-18 00:00:00
INFO:fbprophet:Applying in parallel with <concurrent.futures.process.ProcessPoolExecutor object at 0x7fc84dc2f3d0>
Initial log joint probability = -8.95172
    Iter      log prob        ||dx||      ||grad||       alpha      alpha0  # evals  Notes 
Initial log joint probability = -12.7302
    Iter      log prob        ||dx||      ||grad||       alpha      alpha0  # evals  Notes 
Initial log joint probability = -15.1549
    Iter      log prob        ||dx||      ||grad||       alpha      alpha0  # evals  Notes 
Initial log joint probability = -18.717
    Iter      log prob        ||dx||      ||grad||       alpha      alpha0  # evals  Notes 
Initial log joint probability = -23.5879
    Iter      log prob        ||dx||      ||grad||       alpha      alpha0  # evals  Notes 
      75       4674.82    4.7626e-07       3546.98   1.352e-10       0.001      137  LS failed, Hessian reset 
      81       4674.82   8.67894e-09       3526.76      0.1663      0.1663      146   
Optimization terminated normally: 
  Convergence detected: absolute parameter change was below tolerance
      99       7029.22    5.4055e-06       3437.08       0.464       0.464      125   
    Iter      log prob        ||dx||      ||grad||       alpha      alpha0  # evals  Notes 
     143       7029.29   5.24832e-09       3365.19      0.6297      0.6297      181   
Optimization terminated normally: 
  Convergence detected: absolute parameter change was below tolerance
      64       9580.97   0.000384631       3469.68    1.26e-07       0.001      124  LS failed, Hessian reset 
      61       11813.1   3.27883e-09       3533.15      0.2849      0.2849       85   
Optimization terminated normally: 
  Convergence detected: absolute parameter change was below tolerance
      99       9581.83   4.07514e-06       3053.69      0.3713           1      166   
    Iter      log prob        ||dx||      ||grad||       alpha      alpha0  # evals  Notes 
      99       14231.4   2.74704e-05       3474.74      0.8926      0.8926      131   
    Iter      log prob        ||dx||      ||grad||       alpha      alpha0  # evals  Notes 
     146       9582.15   9.04249e-09       3212.76      0.2619      0.2619      228   
Optimization terminated normally: 
  Convergence detected: absolute parameter change was below tolerance
     133       14231.5   7.26134e-09       3321.53      0.5515      0.5515      175   
Optimization terminated normally: 
  Convergence detected: absolute parameter change was below tolerance
[I 2020-10-01 03:13:01,555] Trial 238 finished with value: 0.04069293987325323 and parameters: {'changepoint_prior_scale': 0.0014200028784559899, 'seasonality_prior_scale': 0.09509160019738497, 'holidays_prior_scale': 0.14103842814383533, 'seasonality_mode': 'additive', 'changepoint_range': 0.5296658373765611}. Best is trial 96 with value: 0.038883738900888705.
Initial log joint probability = -28.8311
    Iter      log prob        ||dx||      ||grad||       alpha      alpha0  # evals  Notes 
      99       18911.2   0.000876999       5000.93          10           1      124   
    Iter      log prob        ||dx||      ||grad||       alpha      alpha0  # evals  Notes 
     176       18912.3   1.69117e-08       4506.54      0.3352           1      220   
Optimization terminated normally: 
  Convergence detected: relative gradient magnitude is below tolerance
INFO:fbprophet:Making 5 forecasts with cutoffs between 2013-10-07 00:00:00 and 2015-10-18 00:00:00
INFO:fbprophet:Applying in parallel with <concurrent.futures.process.ProcessPoolExecutor object at 0x7fc84dc487d0>
Initial log joint probability = -8.95172
    Iter      log prob        ||dx||      ||grad||       alpha      alpha0  # evals  Notes 
Initial log joint probability = -12.7302
    Iter      log prob        ||dx||      ||grad||       alpha      alpha0  # evals  Notes 
Initial log joint probability = -15.1549
    Iter      log prob        ||dx||      ||grad||       alpha      alpha0  # evals  Notes 
Initial log joint probability = -18.717
    Iter      log prob        ||dx||      ||grad||       alpha      alpha0  # evals  Notes 
      36       4675.87   0.000295649       4347.34   6.272e-08       0.001       91  LS failed, Hessian reset 
Initial log joint probability = -23.5879
    Iter      log prob        ||dx||      ||grad||       alpha      alpha0  # evals  Notes 
      86       4677.68   9.20786e-07       4498.75   1.971e-10       0.001      196  LS failed, Hessian reset 
      94       4677.69   6.69198e-09       4472.47       0.104       0.104      206   
Optimization terminated normally: 
  Convergence detected: absolute parameter change was below tolerance
      77       7028.55   7.36817e-07       4343.94   1.619e-10       0.001      140  LS failed, Hessian reset 
      97       7028.55   8.85701e-09       4226.47      0.4549      0.4549      162   
Optimization terminated normally: 
  Convergence detected: absolute parameter change was below tolerance
      70       9581.49   7.98139e-09        4471.5      0.3789           1      103   
Optimization terminated normally: 
  Convergence detected: absolute parameter change was below tolerance
      51       11812.6   6.62984e-09       4637.33      0.3628      0.3628       71   
Optimization terminated normally: 
  Convergence detected: absolute parameter change was below tolerance
      99         14233   4.68319e-07          4202       2.124      0.2124      129   
    Iter      log prob        ||dx||      ||grad||       alpha      alpha0  # evals  Notes 
     106         14233   6.40762e-09       4687.97      0.1764      0.1764      137   
Optimization terminated normally: 
  Convergence detected: absolute parameter change was below tolerance
