[I 2020-10-01 03:59:52,256] Trial 421 finished with value: 0.04147541352129788 and parameters: {'changepoint_prior_scale': 0.0019292640250528667, 'seasonality_prior_scale': 0.11511560101627182, 'holidays_prior_scale': 0.1579927212052712, 'seasonality_mode': 'additive', 'changepoint_range': 0.5791355018215409}. Best is trial 96 with value: 0.038883738900888705.
Initial log joint probability = -28.8311
    Iter      log prob        ||dx||      ||grad||       alpha      alpha0  # evals  Notes 
      95       18912.9   7.01657e-09       2873.96      0.2896      0.2896      128   
Optimization terminated normally: 
  Convergence detected: absolute parameter change was below tolerance
INFO:fbprophet:Making 5 forecasts with cutoffs between 2013-10-07 00:00:00 and 2015-10-18 00:00:00
INFO:fbprophet:Applying in parallel with <concurrent.futures.process.ProcessPoolExecutor object at 0x7fc84dc9ce50>
Initial log joint probability = -8.95172
    Iter      log prob        ||dx||      ||grad||       alpha      alpha0  # evals  Notes 
Initial log joint probability = -12.7302
    Iter      log prob        ||dx||      ||grad||       alpha      alpha0  # evals  Notes 
Initial log joint probability = -15.1549
    Iter      log prob        ||dx||      ||grad||       alpha      alpha0  # evals  Notes 
Initial log joint probability = -18.717
    Iter      log prob        ||dx||      ||grad||       alpha      alpha0  # evals  Notes 
Initial log joint probability = -23.5879
    Iter      log prob        ||dx||      ||grad||       alpha      alpha0  # evals  Notes 
      99       4679.38   1.46982e-07       3138.23      0.2966           1      127   
    Iter      log prob        ||dx||      ||grad||       alpha      alpha0  # evals  Notes 
     108       4679.38   9.20243e-09       3100.71      0.1709           1      141   
Optimization terminated normally: 
  Convergence detected: absolute parameter change was below tolerance
      99       7029.07   2.92796e-06       3179.59      0.4219      0.4219      121   
    Iter      log prob        ||dx||      ||grad||       alpha      alpha0  # evals  Notes 
      61       9582.53    4.5491e-09       3073.86      0.4352      0.4352       86   
Optimization terminated normally: 
  Convergence detected: absolute parameter change was below tolerance
      60       11813.3    1.5834e-08       3068.23      0.9222      0.9222       81   
Optimization terminated normally: 
  Convergence detected: relative gradient magnitude is below tolerance
     147       7029.26   6.61532e-09        2661.5      0.1969      0.1969      180   
Optimization terminated normally: 
  Convergence detected: absolute parameter change was below tolerance
      99       14233.2   4.98024e-06       3090.08      0.3388           1      129   
    Iter      log prob        ||dx||      ||grad||       alpha      alpha0  # evals  Notes 
     161       14233.5   7.66722e-09       3163.88      0.3483      0.3483      210   
Optimization terminated normally: 
  Convergence detected: absolute parameter change was below tolerance
[I 2020-10-01 04:00:05,490] Trial 422 finished with value: 0.04137865610342669 and parameters: {'changepoint_prior_scale': 0.0015985159394170995, 'seasonality_prior_scale': 0.14547597706924775, 'holidays_prior_scale': 0.2027810810625248, 'seasonality_mode': 'additive', 'changepoint_range': 0.5811560602866741}. Best is trial 96 with value: 0.038883738900888705.
Initial log joint probability = -28.8311
    Iter      log prob        ||dx||      ||grad||       alpha      alpha0  # evals  Notes 
      99       18912.8   6.85446e-07       3395.81       0.148       0.148      131   
    Iter      log prob        ||dx||      ||grad||       alpha      alpha0  # evals  Notes 
     128       18912.8   1.28732e-08       3780.54      0.4289      0.4289      171   
Optimization terminated normally: 
  Convergence detected: relative gradient magnitude is below tolerance
INFO:fbprophet:Making 5 forecasts with cutoffs between 2013-10-07 00:00:00 and 2015-10-18 00:00:00
INFO:fbprophet:Applying in parallel with <concurrent.futures.process.ProcessPoolExecutor object at 0x7fc84dca9f90>
Initial log joint probability = -8.95172
    Iter      log prob        ||dx||      ||grad||       alpha      alpha0  # evals  Notes 
Initial log joint probability = -12.7302
    Iter      log prob        ||dx||      ||grad||       alpha      alpha0  # evals  Notes 
Initial log joint probability = -15.1549
    Iter      log prob        ||dx||      ||grad||       alpha      alpha0  # evals  Notes 
Initial log joint probability = -18.717
    Iter      log prob        ||dx||      ||grad||       alpha      alpha0  # evals  Notes 
      67       4679.08   4.46833e-09       3700.46      0.3308      0.3308       92   
Optimization terminated normally: 
  Convergence detected: absolute parameter change was below tolerance
Initial log joint probability = -23.5879
    Iter      log prob        ||dx||      ||grad||       alpha      alpha0  # evals  Notes 
      77       7028.54   7.29961e-05       3715.73   1.943e-08       0.001      138  LS failed, Hessian reset 
      67       9582.43   5.20339e-09       3549.95      0.4264      0.4264       90   
Optimization terminated normally: 
  Convergence detected: absolute parameter change was below tolerance
      99       7028.75   1.55419e-06       3416.25      0.8952      0.8952      165   
    Iter      log prob        ||dx||      ||grad||       alpha      alpha0  # evals  Notes 
      57       11813.2   1.27012e-08       3653.83      0.2785           1       84   
Optimization terminated normally: 
  Convergence detected: relative gradient magnitude is below tolerance
     149       7028.77   5.53437e-07        3066.4   1.284e-10       0.001      270  LS failed, Hessian reset 
     157       7028.77   8.40793e-09       3139.76      0.1625      0.1625      282   
Optimization terminated normally: 
  Convergence detected: absolute parameter change was below tolerance
      99       14232.7   0.000649618       3673.54           1           1      126   
    Iter      log prob        ||dx||      ||grad||       alpha      alpha0  # evals  Notes 
     187       14233.3   9.46554e-09       3166.81      0.3549      0.3549      233   
Optimization terminated normally: 
  Convergence detected: absolute parameter change was below tolerance
[I 2020-10-01 04:00:19,499] Trial 423 finished with value: 0.04080057626543979 and parameters: {'changepoint_prior_scale': 0.001351201280803516, 'seasonality_prior_scale': 0.16861955177272225, 'holidays_prior_scale': 0.11907856894490851, 'seasonality_mode': 'additive', 'changepoint_range': 0.5713303906508524}. Best is trial 96 with value: 0.038883738900888705.
Initial log joint probability = -28.8311
    Iter      log prob        ||dx||      ||grad||       alpha      alpha0  # evals  Notes 
      99       18912.9   4.86014e-05       3796.01       0.829       0.829      123   
    Iter      log prob        ||dx||      ||grad||       alpha      alpha0  # evals  Notes 
     142         18913   6.08513e-09       3937.26      0.1571      0.1571      181   
Optimization terminated normally: 
  Convergence detected: absolute parameter change was below tolerance
INFO:fbprophet:Making 5 forecasts with cutoffs between 2013-10-07 00:00:00 and 2015-10-18 00:00:00
INFO:fbprophet:Applying in parallel with <concurrent.futures.process.ProcessPoolExecutor object at 0x7fc84dc1e610>
Initial log joint probability = -8.95172
    Iter      log prob        ||dx||      ||grad||       alpha      alpha0  # evals  Notes 
Initial log joint probability = -12.7302
    Iter      log prob        ||dx||      ||grad||       alpha      alpha0  # evals  Notes 
Initial log joint probability = -15.1549
    Iter      log prob        ||dx||      ||grad||       alpha      alpha0  # evals  Notes 
Initial log joint probability = -18.717
    Iter      log prob        ||dx||      ||grad||       alpha      alpha0  # evals  Notes 
      63       4679.07   3.60362e-09        4011.3      0.1345      0.1345       82   
Optimization terminated normally: 
  Convergence detected: absolute parameter change was below tolerance
Initial log joint probability = -23.5879
    Iter      log prob        ||dx||      ||grad||       alpha      alpha0  # evals  Notes 
      60       9582.43   8.03397e-09       3749.79      0.4333      0.4333       84   
Optimization terminated normally: 
  Convergence detected: absolute parameter change was below tolerance
      83       7028.63   4.17624e-05       3809.82   9.492e-09       0.001      143  LS failed, Hessian reset 
      99       7028.74   4.08498e-07       3591.84      0.4092      0.4092      165   
    Iter      log prob        ||dx||      ||grad||       alpha      alpha0  # evals  Notes 
      40       11811.6   0.000287249        3367.3   8.637e-08       0.001       90  LS failed, Hessian reset 
     133       7028.74   8.46775e-09       3407.83      0.6114      0.6114      208   
Optimization terminated normally: 
  Convergence detected: absolute parameter change was below tolerance
      99       14233.5   3.72779e-07       3738.72      0.1729           1      128   
    Iter      log prob        ||dx||      ||grad||       alpha      alpha0  # evals  Notes 
     105       14233.5    8.6298e-09       4055.11      0.3431      0.3431      136   
Optimization terminated normally: 
  Convergence detected: absolute parameter change was below tolerance
      95       11813.1   4.84108e-07       4047.55   1.195e-10       0.001      198  LS failed, Hessian reset 
      99       11813.1     1.488e-07       3916.37      0.8572      0.8572      202   
    Iter      log prob        ||dx||      ||grad||       alpha      alpha0  # evals  Notes 
     122       11813.1   4.27511e-09       4003.38      0.1584      0.1584      228   
Optimization terminated normally: 
  Convergence detected: absolute parameter change was below tolerance
[I 2020-10-01 04:00:33,550] Trial 424 finished with value: 0.04113893727620616 and parameters: {'changepoint_prior_scale': 0.0012452742676547933, 'seasonality_prior_scale': 0.12638694266711958, 'holidays_prior_scale': 0.1446207662397802, 'seasonality_mode': 'additive', 'changepoint_range': 0.5597356692372748}. Best is trial 96 with value: 0.038883738900888705.
Initial log joint probability = -28.8311
    Iter      log prob        ||dx||      ||grad||       alpha      alpha0  # evals  Notes 
      96       18912.9   4.15013e-09       3308.35      0.1936      0.1936      123   
Optimization terminated normally: 
  Convergence detected: absolute parameter change was below tolerance
INFO:fbprophet:Making 5 forecasts with cutoffs between 2013-10-07 00:00:00 and 2015-10-18 00:00:00
INFO:fbprophet:Applying in parallel with <concurrent.futures.process.ProcessPoolExecutor object at 0x7fc84dc9ce50>
Initial log joint probability = -8.95172
    Iter      log prob        ||dx||      ||grad||       alpha      alpha0  # evals  Notes 
Initial log joint probability = -12.7302
    Iter      log prob        ||dx||      ||grad||       alpha      alpha0  # evals  Notes 
Initial log joint probability = -15.1549
    Iter      log prob        ||dx||      ||grad||       alpha      alpha0  # evals  Notes 
Initial log joint probability = -18.717
    Iter      log prob        ||dx||      ||grad||       alpha      alpha0  # evals  Notes 
Initial log joint probability = -23.5879
    Iter      log prob        ||dx||      ||grad||       alpha      alpha0  # evals  Notes 
      90       4679.06   9.06703e-07       3289.91   2.713e-10       0.001      154  LS failed, Hessian reset 
      99       4679.06   2.28044e-08        3308.4      0.3867      0.3867      167   
    Iter      log prob        ||dx||      ||grad||       alpha      alpha0  # evals  Notes 
     107       4679.06   8.05977e-09       3254.83      0.3037           1      176   
Optimization terminated normally: 
  Convergence detected: absolute parameter change was below tolerance
      69       7029.36   4.39926e-05       3368.69   1.532e-08       0.001      129  LS failed, Hessian reset 
      67       9582.46   8.66742e-09       3226.95      0.4691           1       93   
Optimization terminated normally: 
  Convergence detected: absolute parameter change was below tolerance
      99       7029.51   1.26058e-07       3229.22      0.3002           1      168   
    Iter      log prob        ||dx||      ||grad||       alpha      alpha0  # evals  Notes 
     127       7029.53   5.89703e-07       3249.58   1.907e-10       0.001      243  LS failed, Hessian reset 
     148       7029.53   3.91842e-09       3325.55      0.2352      0.2352      268   
Optimization terminated normally: 
  Convergence detected: absolute parameter change was below tolerance
      57       11813.2   2.25899e-07       3072.51   6.865e-11       0.001      120  LS failed, Hessian reset 
      83       11813.2   9.03943e-09       3154.22      0.4409      0.4409      153   
Optimization terminated normally: 
  Convergence detected: absolute parameter change was below tolerance
      99       14232.1   6.87923e-08       2988.42           1           1      131   
    Iter      log prob        ||dx||      ||grad||       alpha      alpha0  # evals  Notes 
     104       14232.1     9.206e-09       3258.22      0.4738      0.4738      136   
Optimization terminated normally: 
  Convergence detected: absolute parameter change was below tolerance
[I 2020-10-01 04:00:47,715] Trial 425 finished with value: 0.04112761805844164 and parameters: {'changepoint_prior_scale': 0.0015101306808282611, 'seasonality_prior_scale': 0.15472537693987806, 'holidays_prior_scale': 0.1789919315671723, 'seasonality_mode': 'additive', 'changepoint_range': 0.5732478116642483}. Best is trial 96 with value: 0.038883738900888705.
Initial log joint probability = -28.8311
    Iter      log prob        ||dx||      ||grad||       alpha      alpha0  # evals  Notes 
      99       18912.7   3.58627e-08       1960.19     0.08804      0.3052      126   
    Iter      log prob        ||dx||      ||grad||       alpha      alpha0  # evals  Notes 
     105       18912.7   6.24628e-08        1898.8      0.2402           1      134   
Optimization terminated normally: 
  Convergence detected: relative gradient magnitude is below tolerance
INFO:fbprophet:Making 5 forecasts with cutoffs between 2013-10-07 00:00:00 and 2015-10-18 00:00:00
INFO:fbprophet:Applying in parallel with <concurrent.futures.process.ProcessPoolExecutor object at 0x7fc84dc92150>
Initial log joint probability = -8.95172
    Iter      log prob        ||dx||      ||grad||       alpha      alpha0  # evals  Notes 
Initial log joint probability = -12.7302
    Iter      log prob        ||dx||      ||grad||       alpha      alpha0  # evals  Notes 
      66       4677.09   3.30962e-09       2267.58      0.1532      0.1532       93   
Optimization terminated normally: 
  Convergence detected: absolute parameter change was below tolerance
Initial log joint probability = -15.1549
    Iter      log prob        ||dx||      ||grad||       alpha      alpha0  # evals  Notes 
Initial log joint probability = -18.717
    Iter      log prob        ||dx||      ||grad||       alpha      alpha0  # evals  Notes 
Initial log joint probability = -23.5879
    Iter      log prob        ||dx||      ||grad||       alpha      alpha0  # evals  Notes 
      99       7031.79   1.06814e-05       2216.79      0.5839      0.5839      121   
    Iter      log prob        ||dx||      ||grad||       alpha      alpha0  # evals  Notes 
     128       7031.87   2.76512e-09        2212.4      0.1058      0.1058      160   
Optimization terminated normally: 
  Convergence detected: absolute parameter change was below tolerance
      61       9582.57   3.30932e-09       2164.73      0.2068      0.2068       81   
Optimization terminated normally: 
  Convergence detected: absolute parameter change was below tolerance
      58       11813.3   4.39991e-08       2127.07      0.9002      0.9002       86   
Optimization terminated normally: 
  Convergence detected: relative gradient magnitude is below tolerance
      67       14233.1   3.01215e-05       2036.95   1.149e-08       0.001      135  LS failed, Hessian reset 
      99       14233.1   1.02077e-06       2072.46           1           1      174   
    Iter      log prob        ||dx||      ||grad||       alpha      alpha0  # evals  Notes 
     140       14233.1   4.59386e-08        1797.7      0.5214      0.5214      226   
Optimization terminated normally: 
  Convergence detected: relative gradient magnitude is below tolerance
[I 2020-10-01 04:01:02,318] Trial 426 finished with value: 0.04088676446993847 and parameters: {'changepoint_prior_scale': 0.002233254378443101, 'seasonality_prior_scale': 0.10500796543291915, 'holidays_prior_scale': 0.12781223420058854, 'seasonality_mode': 'additive', 'changepoint_range': 0.6011693133266405}. Best is trial 96 with value: 0.038883738900888705.
Initial log joint probability = -28.8311
    Iter      log prob        ||dx||      ||grad||       alpha      alpha0  # evals  Notes 
      99       18912.9   8.14347e-06       2538.84      0.5349           1      122   
    Iter      log prob        ||dx||      ||grad||       alpha      alpha0  # evals  Notes 
     118       18912.9   2.35754e-08       2151.61      0.3983           1      149   
Optimization terminated normally: 
  Convergence detected: relative gradient magnitude is below tolerance
INFO:fbprophet:Making 5 forecasts with cutoffs between 2013-10-07 00:00:00 and 2015-10-18 00:00:00
INFO:fbprophet:Applying in parallel with <concurrent.futures.process.ProcessPoolExecutor object at 0x7fc84dc9ccd0>
Initial log joint probability = -8.95172
    Iter      log prob        ||dx||      ||grad||       alpha      alpha0  # evals  Notes 
Initial log joint probability = -12.7302
    Iter      log prob        ||dx||      ||grad||       alpha      alpha0  # evals  Notes 
Initial log joint probability = -15.1549
    Iter      log prob        ||dx||      ||grad||       alpha      alpha0  # evals  Notes 
Initial log joint probability = -18.717
    Iter      log prob        ||dx||      ||grad||       alpha      alpha0  # evals  Notes 
Initial log joint probability = -23.5879
    Iter      log prob        ||dx||      ||grad||       alpha      alpha0  # evals  Notes 
      98       4679.22   5.88552e-09       2724.75      0.2477           1      134   
Optimization terminated normally: 
  Convergence detected: absolute parameter change was below tolerance
      99       7031.92   2.48346e-05       2211.24      0.5577      0.5577      113   
    Iter      log prob        ||dx||      ||grad||       alpha      alpha0  # evals  Notes 
      53       11813.3   6.91823e-09       2584.26       0.293           1       76   
Optimization terminated normally: 
  Convergence detected: absolute parameter change was below tolerance
     181       7032.13   7.11031e-09       2663.43      0.2735           1      216   
Optimization terminated normally: 
  Convergence detected: absolute parameter change was below tolerance
      60       9582.55   1.31401e-06       2757.58   4.947e-10       0.001      121  LS failed, Hessian reset 
      75       9582.55   9.35473e-09       2705.87      0.2138      0.2138      143   
Optimization terminated normally: 
  Convergence detected: absolute parameter change was below tolerance
      90       14233.5   2.28081e-08       2671.66      0.0386           1      127   
Optimization terminated normally: 
  Convergence detected: relative gradient magnitude is below tolerance
