[I 2020-10-01 03:44:41,581] Trial 361 finished with value: 0.041002461638931405 and parameters: {'changepoint_prior_scale': 0.0016695167505922737, 'seasonality_prior_scale': 0.7741377705322521, 'holidays_prior_scale': 0.5349862153831881, 'seasonality_mode': 'additive', 'changepoint_range': 0.5162840888107079}. Best is trial 96 with value: 0.038883738900888705.
Initial log joint probability = -28.8311
    Iter      log prob        ||dx||      ||grad||       alpha      alpha0  # evals  Notes 
      99       18912.7   1.90851e-06       1616.78           1           1      128   
    Iter      log prob        ||dx||      ||grad||       alpha      alpha0  # evals  Notes 
     109       18912.8      1.67e-05       1485.77   9.154e-09       0.001      192  LS failed, Hessian reset 
     167       18912.8     8.873e-08       1378.96      0.4554      0.4554      265   
Optimization terminated normally: 
  Convergence detected: relative gradient magnitude is below tolerance
INFO:fbprophet:Making 5 forecasts with cutoffs between 2013-10-07 00:00:00 and 2015-10-18 00:00:00
INFO:fbprophet:Applying in parallel with <concurrent.futures.process.ProcessPoolExecutor object at 0x7fc84dc25b50>
Initial log joint probability = -8.95172
    Iter      log prob        ||dx||      ||grad||       alpha      alpha0  # evals  Notes 
Initial log joint probability = -12.7302
    Iter      log prob        ||dx||      ||grad||       alpha      alpha0  # evals  Notes 
Initial log joint probability = -15.1549
    Iter      log prob        ||dx||      ||grad||       alpha      alpha0  # evals  Notes 
Initial log joint probability = -18.717
    Iter      log prob        ||dx||      ||grad||       alpha      alpha0  # evals  Notes 
Initial log joint probability = -23.5879
    Iter      log prob        ||dx||      ||grad||       alpha      alpha0  # evals  Notes 
      91       4679.45    2.2612e-07       1776.57   1.293e-10       0.001      161  LS failed, Hessian reset 
      95       4679.45   6.12952e-09        1740.7       0.171       0.171      167   
Optimization terminated normally: 
  Convergence detected: absolute parameter change was below tolerance
      99       7031.98   9.03761e-05       1736.47      0.4444      0.4444      122   
    Iter      log prob        ||dx||      ||grad||       alpha      alpha0  # evals  Notes 
      62       9582.58   2.27614e-08       1649.36      0.4098           1       86   
Optimization terminated normally: 
  Convergence detected: relative gradient magnitude is below tolerance
     123       7032.11   2.35989e-05       1708.89   1.248e-08       0.001      202  LS failed, Hessian reset 
      84       11812.3   7.77728e-09       1778.88      0.1984      0.1984      112   
Optimization terminated normally: 
  Convergence detected: absolute parameter change was below tolerance
     158       7032.17   3.89567e-06       1777.76    2.18e-09       0.001      294  LS failed, Hessian reset 
     197       7032.19   1.77496e-09          1751      0.1452      0.1452      347   
Optimization terminated normally: 
  Convergence detected: absolute parameter change was below tolerance
      96       14233.2    2.2851e-05       1699.56   1.523e-08       0.001      166  LS failed, Hessian reset 
      99       14233.2   4.53977e-06       1273.58      0.6378      0.6378      169   
    Iter      log prob        ||dx||      ||grad||       alpha      alpha0  # evals  Notes 
     168       14233.2   2.04874e-06       1365.37   1.293e-09       0.001      299  LS failed, Hessian reset 
     185       14233.2   4.93829e-08        1513.2      0.3937           1      322   
Optimization terminated normally: 
  Convergence detected: relative gradient magnitude is below tolerance
[I 2020-10-01 03:44:55,036] Trial 362 finished with value: 0.04173044714400148 and parameters: {'changepoint_prior_scale': 0.002856453727030429, 'seasonality_prior_scale': 0.9065089716065753, 'holidays_prior_scale': 0.18643522227407733, 'seasonality_mode': 'additive', 'changepoint_range': 0.5381065113818682}. Best is trial 96 with value: 0.038883738900888705.
Initial log joint probability = -28.8311
    Iter      log prob        ||dx||      ||grad||       alpha      alpha0  # evals  Notes 
      99       18912.8   2.15663e-06       4011.32      0.3212      0.8797      124   
    Iter      log prob        ||dx||      ||grad||       alpha      alpha0  # evals  Notes 
     119       18912.8   7.99436e-09       3301.31      0.1856      0.1856      152   
Optimization terminated normally: 
  Convergence detected: absolute parameter change was below tolerance
INFO:fbprophet:Making 5 forecasts with cutoffs between 2013-10-07 00:00:00 and 2015-10-18 00:00:00
INFO:fbprophet:Applying in parallel with <concurrent.futures.process.ProcessPoolExecutor object at 0x7fc84dbfded0>
Initial log joint probability = -8.95172
    Iter      log prob        ||dx||      ||grad||       alpha      alpha0  # evals  Notes 
Initial log joint probability = -12.7302
    Iter      log prob        ||dx||      ||grad||       alpha      alpha0  # evals  Notes 
Initial log joint probability = -15.1549
    Iter      log prob        ||dx||      ||grad||       alpha      alpha0  # evals  Notes 
Initial log joint probability = -18.717
    Iter      log prob        ||dx||      ||grad||       alpha      alpha0  # evals  Notes 
      60       4678.28   2.76188e-09        3731.6      0.2928      0.2928       78   
Optimization terminated normally: 
  Convergence detected: absolute parameter change was below tolerance
Initial log joint probability = -23.5879
    Iter      log prob        ||dx||      ||grad||       alpha      alpha0  # evals  Notes 
      93       7028.88   2.11911e-05       3535.57   5.933e-09       0.001      161  LS failed, Hessian reset 
      99       7028.99   8.51125e-06       3524.86      0.6161      0.6161      168   
    Iter      log prob        ||dx||      ||grad||       alpha      alpha0  # evals  Notes 
      89       9582.45   2.74697e-09       3427.55      0.2585      0.2585      116   
Optimization terminated normally: 
  Convergence detected: absolute parameter change was below tolerance
     150       7029.04    8.1134e-09       2831.66      0.2998      0.2998      230   
Optimization terminated normally: 
  Convergence detected: absolute parameter change was below tolerance
      82       11813.1   8.93564e-09       3623.16      0.4012      0.4012      111   
Optimization terminated normally: 
  Convergence detected: absolute parameter change was below tolerance
      99       14233.5   4.71861e-08       3181.18      0.3291      0.3291      129   
    Iter      log prob        ||dx||      ||grad||       alpha      alpha0  # evals  Notes 
     111       14233.5   5.33615e-09       3502.37       0.352       0.352      145   
Optimization terminated normally: 
  Convergence detected: absolute parameter change was below tolerance
[I 2020-10-01 03:45:09,644] Trial 363 finished with value: 0.041413557876637905 and parameters: {'changepoint_prior_scale': 0.001343212363966406, 'seasonality_prior_scale': 0.637536601409229, 'holidays_prior_scale': 1.8302702876287906, 'seasonality_mode': 'additive', 'changepoint_range': 0.5231946219598669}. Best is trial 96 with value: 0.038883738900888705.
Initial log joint probability = -28.8311
    Iter      log prob        ||dx||      ||grad||       alpha      alpha0  # evals  Notes 
      99       18912.4   1.17279e-07       2665.95      0.4199           1      125   
    Iter      log prob        ||dx||      ||grad||       alpha      alpha0  # evals  Notes 
     114       18912.4   1.48138e-08       2992.68      0.2162           1      142   
Optimization terminated normally: 
  Convergence detected: relative gradient magnitude is below tolerance
INFO:fbprophet:Making 5 forecasts with cutoffs between 2013-10-07 00:00:00 and 2015-10-18 00:00:00
INFO:fbprophet:Applying in parallel with <concurrent.futures.process.ProcessPoolExecutor object at 0x7fc84dc205d0>
Initial log joint probability = -8.95172
    Iter      log prob        ||dx||      ||grad||       alpha      alpha0  # evals  Notes 
Initial log joint probability = -12.7302
    Iter      log prob        ||dx||      ||grad||       alpha      alpha0  # evals  Notes 
Initial log joint probability = -15.1549
    Iter      log prob        ||dx||      ||grad||       alpha      alpha0  # evals  Notes 
Initial log joint probability = -18.717
    Iter      log prob        ||dx||      ||grad||       alpha      alpha0  # evals  Notes 
Initial log joint probability = -23.5879
    Iter      log prob        ||dx||      ||grad||       alpha      alpha0  # evals  Notes 
      67       4679.32   9.00385e-06       3307.03   2.831e-09       0.001      137  LS failed, Hessian reset 
      94       4679.37   5.70268e-09       3252.65      0.3797      0.3797      172   
Optimization terminated normally: 
  Convergence detected: absolute parameter change was below tolerance
      99       7029.66    2.2055e-06       2980.43           1           1      120   
    Iter      log prob        ||dx||      ||grad||       alpha      alpha0  # evals  Notes 
     113       7029.66   9.54106e-09       2812.88      0.1775      0.1775      136   
Optimization terminated normally: 
  Convergence detected: absolute parameter change was below tolerance
      84       9582.52   9.34632e-09       2562.14      0.8795      0.8795      116   
Optimization terminated normally: 
  Convergence detected: absolute parameter change was below tolerance
      30       11811.9    0.00017188       3224.86   4.889e-08       0.001       84  LS failed, Hessian reset 
      98       14233.3   8.96634e-09       3147.88      0.7141      0.7141      135   
Optimization terminated normally: 
  Convergence detected: absolute parameter change was below tolerance
      86       11813.2    1.3944e-07       3429.33   4.162e-11       0.001      190  LS failed, Hessian reset 
      92       11813.2   5.91809e-09       3240.38      0.4332      0.4332      198   
Optimization terminated normally: 
  Convergence detected: absolute parameter change was below tolerance
[I 2020-10-01 03:45:25,590] Trial 364 finished with value: 0.04082631928490919 and parameters: {'changepoint_prior_scale': 0.0015183956672494112, 'seasonality_prior_scale': 0.8904264741835144, 'holidays_prior_scale': 0.3795523578751524, 'seasonality_mode': 'additive', 'changepoint_range': 0.5461949969315534}. Best is trial 96 with value: 0.038883738900888705.
Initial log joint probability = -28.8311
    Iter      log prob        ||dx||      ||grad||       alpha      alpha0  # evals  Notes 
      95       18912.9    4.9885e-06       2429.83   2.323e-09       0.001      178  LS failed, Hessian reset 
      99         18913   5.94416e-07       1753.42      0.7744      0.7744      182   
    Iter      log prob        ||dx||      ||grad||       alpha      alpha0  # evals  Notes 
     122         18913   3.91621e-08       1895.65           1           1      210   
Optimization terminated normally: 
  Convergence detected: relative gradient magnitude is below tolerance
INFO:fbprophet:Making 5 forecasts with cutoffs between 2013-10-07 00:00:00 and 2015-10-18 00:00:00
INFO:fbprophet:Applying in parallel with <concurrent.futures.process.ProcessPoolExecutor object at 0x7fc84dc9c710>
Initial log joint probability = -8.95172
    Iter      log prob        ||dx||      ||grad||       alpha      alpha0  # evals  Notes 
Initial log joint probability = -12.7302
    Iter      log prob        ||dx||      ||grad||       alpha      alpha0  # evals  Notes 
Initial log joint probability = -15.1549
    Iter      log prob        ||dx||      ||grad||       alpha      alpha0  # evals  Notes 
Initial log joint probability = -18.717
    Iter      log prob        ||dx||      ||grad||       alpha      alpha0  # evals  Notes 
Initial log joint probability = -23.5879
    Iter      log prob        ||dx||      ||grad||       alpha      alpha0  # evals  Notes 
      69       4679.41   1.10583e-06       2515.46   4.639e-10       0.001      128  LS failed, Hessian reset 
      85       4679.42   8.79166e-09       2403.51      0.3373      0.3373      150   
Optimization terminated normally: 
  Convergence detected: absolute parameter change was below tolerance
      99       7030.99    0.00463918       2493.43           1           1      126   
    Iter      log prob        ||dx||      ||grad||       alpha      alpha0  # evals  Notes 
      57       9582.51   1.66828e-05       2553.44   7.872e-09       0.001      122  LS failed, Hessian reset 
     128       7031.98   7.10331e-05       2576.78   2.749e-08       0.001      205  LS failed, Hessian reset 
      50       11812.9   4.92775e-05       2221.82   2.126e-08       0.001      100  LS failed, Hessian reset 
     173       7032.13   4.84221e-09       2317.95      0.3297      0.3297      256   
Optimization terminated normally: 
  Convergence detected: absolute parameter change was below tolerance
      98       9582.58   1.82237e-08       2232.56      0.3859           1      172   
Optimization terminated normally: 
  Convergence detected: relative gradient magnitude is below tolerance
      87         11813   2.72551e-09       2321.46      0.2073      0.2073      149   
Optimization terminated normally: 
  Convergence detected: absolute parameter change was below tolerance
      71       14233.1   5.70812e-05       2311.04    2.33e-08       0.001      127  LS failed, Hessian reset 
      99       14233.2   6.88593e-07       1816.22      0.8732      0.8732      161   
    Iter      log prob        ||dx||      ||grad||       alpha      alpha0  # evals  Notes 
     115       14233.2   2.85792e-08        2182.3      0.6713      0.6713      182   
Optimization terminated normally: 
  Convergence detected: relative gradient magnitude is below tolerance
[I 2020-10-01 03:45:39,851] Trial 365 finished with value: 0.04177107028074185 and parameters: {'changepoint_prior_scale': 0.0020195181945223775, 'seasonality_prior_scale': 0.442763020779951, 'holidays_prior_scale': 3.2336620718909774, 'seasonality_mode': 'additive', 'changepoint_range': 0.5098143254394247}. Best is trial 96 with value: 0.038883738900888705.
Initial log joint probability = -28.8311
    Iter      log prob        ||dx||      ||grad||       alpha      alpha0  # evals  Notes 
      99       18912.9    3.4103e-06       3744.52       0.385       0.385      121   
    Iter      log prob        ||dx||      ||grad||       alpha      alpha0  # evals  Notes 
     123       18912.9   1.37247e-08       3883.56       0.626       0.626      154   
Optimization terminated normally: 
  Convergence detected: relative gradient magnitude is below tolerance
INFO:fbprophet:Making 5 forecasts with cutoffs between 2013-10-07 00:00:00 and 2015-10-18 00:00:00
INFO:fbprophet:Applying in parallel with <concurrent.futures.process.ProcessPoolExecutor object at 0x7fc84dc0be50>
Initial log joint probability = -8.95172
    Iter      log prob        ||dx||      ||grad||       alpha      alpha0  # evals  Notes 
Initial log joint probability = -12.7302
    Iter      log prob        ||dx||      ||grad||       alpha      alpha0  # evals  Notes 
      87       4679.26     6.232e-09        3816.8      0.4184      0.4184      117   
Optimization terminated normally: 
  Convergence detected: absolute parameter change was below tolerance
Initial log joint probability = -15.1549
    Iter      log prob        ||dx||      ||grad||       alpha      alpha0  # evals  Notes 
Initial log joint probability = -18.717
    Iter      log prob        ||dx||      ||grad||       alpha      alpha0  # evals  Notes 
Initial log joint probability = -23.5879
    Iter      log prob        ||dx||      ||grad||       alpha      alpha0  # evals  Notes 
      91       7028.74   4.52124e-05       3741.31   1.039e-08       0.001      161  LS failed, Hessian reset 
      99       7028.88    5.1024e-06       3286.11      0.1649           1      170   
    Iter      log prob        ||dx||      ||grad||       alpha      alpha0  # evals  Notes 
     140       7028.91   7.55538e-09       3506.82       0.522       0.522      224   
Optimization terminated normally: 
  Convergence detected: absolute parameter change was below tolerance
      89       9582.28   7.89024e-09       3624.13      0.8264      0.8264      111   
Optimization terminated normally: 
  Convergence detected: absolute parameter change was below tolerance
      77       11813.2   4.44392e-09       3463.65      0.1933      0.1933      108   
Optimization terminated normally: 
  Convergence detected: absolute parameter change was below tolerance
      99       14232.6   2.94997e-06       3614.16      0.5979      0.5979      131   
    Iter      log prob        ||dx||      ||grad||       alpha      alpha0  # evals  Notes 
     155       14233.2   1.38053e-08        3536.4      0.3129           1      201   
Optimization terminated normally: 
  Convergence detected: relative gradient magnitude is below tolerance
[I 2020-10-01 03:45:55,681] Trial 366 finished with value: 0.041059878516180724 and parameters: {'changepoint_prior_scale': 0.0012991061405159764, 'seasonality_prior_scale': 0.5063774712759788, 'holidays_prior_scale': 0.894009688488102, 'seasonality_mode': 'additive', 'changepoint_range': 0.5327944381031933}. Best is trial 96 with value: 0.038883738900888705.
Initial log joint probability = -28.8311
    Iter      log prob        ||dx||      ||grad||       alpha      alpha0  # evals  Notes 
      99         18913   2.51977e-07       2471.56           1           1      129   
    Iter      log prob        ||dx||      ||grad||       alpha      alpha0  # evals  Notes 
     115         18913   3.37805e-07       2715.98   1.209e-10       0.001      185  LS failed, Hessian reset 
     126         18913   1.27697e-08       2788.36      0.2378      0.2378      200   
Optimization terminated normally: 
  Convergence detected: relative gradient magnitude is below tolerance
INFO:fbprophet:Making 5 forecasts with cutoffs between 2013-10-07 00:00:00 and 2015-10-18 00:00:00
INFO:fbprophet:Applying in parallel with <concurrent.futures.process.ProcessPoolExecutor object at 0x7fc84dc0b910>
Initial log joint probability = -8.95172
    Iter      log prob        ||dx||      ||grad||       alpha      alpha0  # evals  Notes 
Initial log joint probability = -12.7302
    Iter      log prob        ||dx||      ||grad||       alpha      alpha0  # evals  Notes 
Initial log joint probability = -15.1549
    Iter      log prob        ||dx||      ||grad||       alpha      alpha0  # evals  Notes 
Initial log joint probability = -18.717
    Iter      log prob        ||dx||      ||grad||       alpha      alpha0  # evals  Notes 
      64       4677.78   4.24319e-09       2795.75       0.555       0.555       90   
Optimization terminated normally: 
  Convergence detected: absolute parameter change was below tolerance
Initial log joint probability = -23.5879
    Iter      log prob        ||dx||      ||grad||       alpha      alpha0  # evals  Notes 
      99       7031.45   8.37202e-05       3054.93      0.8201      0.8201      118   
    Iter      log prob        ||dx||      ||grad||       alpha      alpha0  # evals  Notes 
      47       11813.3   6.68887e-09       2878.65      0.1075      0.1075       67   
Optimization terminated normally: 
  Convergence detected: absolute parameter change was below tolerance
      79       9582.58   1.32867e-08       2516.43      0.4382           1      107   
Optimization terminated normally: 
  Convergence detected: relative gradient magnitude is below tolerance
     146       7031.93   4.91581e-09       2614.67       0.572       0.572      174   
Optimization terminated normally: 
  Convergence detected: absolute parameter change was below tolerance
      56       14232.8   0.000144746       2738.95   4.888e-08       0.001      111  LS failed, Hessian reset 
      99       14233.3    2.3386e-08       2872.52      0.1718      0.5279      165   
    Iter      log prob        ||dx||      ||grad||       alpha      alpha0  # evals  Notes 
     106       14233.3   1.89172e-08       2754.92           1           1      174   
Optimization terminated normally: 
  Convergence detected: relative gradient magnitude is below tolerance
