[I 2020-10-01 04:10:17,149] Trial 463 finished with value: 0.04122858320042467 and parameters: {'changepoint_prior_scale': 0.0016195958591286332, 'seasonality_prior_scale': 0.11974201381082848, 'holidays_prior_scale': 4.130811823340779, 'seasonality_mode': 'additive', 'changepoint_range': 0.7173652773806033}. Best is trial 96 with value: 0.038883738900888705.
Initial log joint probability = -28.8311
    Iter      log prob        ||dx||      ||grad||       alpha      alpha0  # evals  Notes 
      58       18911.2   0.000195435       3573.65   4.691e-08       0.001      124  LS failed, Hessian reset 
      99       18912.5   3.11376e-07       3454.33      0.2995           1      173   
    Iter      log prob        ||dx||      ||grad||       alpha      alpha0  # evals  Notes 
     131       18912.5   6.02536e-08       3653.01           1           1      217   
Optimization terminated normally: 
  Convergence detected: relative gradient magnitude is below tolerance
INFO:fbprophet:Making 5 forecasts with cutoffs between 2013-10-07 00:00:00 and 2015-10-18 00:00:00
INFO:fbprophet:Applying in parallel with <concurrent.futures.process.ProcessPoolExecutor object at 0x7fc84dca46d0>
Initial log joint probability = -8.95172
    Iter      log prob        ||dx||      ||grad||       alpha      alpha0  # evals  Notes 
Initial log joint probability = -12.7302
    Iter      log prob        ||dx||      ||grad||       alpha      alpha0  # evals  Notes 
Initial log joint probability = -15.1549
    Iter      log prob        ||dx||      ||grad||       alpha      alpha0  # evals  Notes 
Initial log joint probability = -18.717
    Iter      log prob        ||dx||      ||grad||       alpha      alpha0  # evals  Notes 
Initial log joint probability = -23.5879
    Iter      log prob        ||dx||      ||grad||       alpha      alpha0  # evals  Notes 
      51       4678.72   0.000150959       3736.27   3.999e-08       0.001      112  LS failed, Hessian reset 
      93       4679.18   8.03591e-09       3649.95      0.3894           1      169   
Optimization terminated normally: 
  Convergence detected: absolute parameter change was below tolerance
      81       7028.83   2.39352e-05       3395.27   7.714e-09       0.001      145  LS failed, Hessian reset 
      99       7028.95   5.03316e-07       3789.11           1           1      167   
    Iter      log prob        ||dx||      ||grad||       alpha      alpha0  # evals  Notes 
     119       7028.95   4.92757e-09       3922.92     0.01671           1      193   
Optimization terminated normally: 
  Convergence detected: absolute parameter change was below tolerance
      71       9582.38   2.12143e-06       3217.69   5.445e-10       0.001      135  LS failed, Hessian reset 
      35       11811.5   0.000199269       3750.43   5.485e-08       0.001      116  LS failed, Hessian reset 
      99        9582.4   6.04319e-08       3509.16      0.5561      0.5561      172   
    Iter      log prob        ||dx||      ||grad||       alpha      alpha0  # evals  Notes 
     104        9582.4   9.55933e-09       3096.01      0.2475      0.2475      180   
Optimization terminated normally: 
  Convergence detected: absolute parameter change was below tolerance
      78       11813.2   9.00769e-09       3705.17      0.1667      0.1667      172   
Optimization terminated normally: 
  Convergence detected: absolute parameter change was below tolerance
      99       14232.6   3.01131e-07       3433.36      0.2814      0.9169      133   
    Iter      log prob        ||dx||      ||grad||       alpha      alpha0  # evals  Notes 
     127       14232.6   3.97811e-08       2636.17      0.2167           1      164   
Optimization terminated normally: 
  Convergence detected: relative gradient magnitude is below tolerance
[I 2020-10-01 04:10:32,612] Trial 464 finished with value: 0.040740735886626085 and parameters: {'changepoint_prior_scale': 0.0013249714609559077, 'seasonality_prior_scale': 0.14511978194753689, 'holidays_prior_scale': 0.11692149851117288, 'seasonality_mode': 'additive', 'changepoint_range': 0.5119024286194835}. Best is trial 96 with value: 0.038883738900888705.
Initial log joint probability = -28.8311
    Iter      log prob        ||dx||      ||grad||       alpha      alpha0  # evals  Notes 
      99       18912.8   1.49404e-07       3736.04           1           1      125   
    Iter      log prob        ||dx||      ||grad||       alpha      alpha0  # evals  Notes 
     108       18912.8   9.08123e-09       3315.81      0.3643      0.3643      136   
Optimization terminated normally: 
  Convergence detected: absolute parameter change was below tolerance
INFO:fbprophet:Making 5 forecasts with cutoffs between 2013-10-07 00:00:00 and 2015-10-18 00:00:00
INFO:fbprophet:Applying in parallel with <concurrent.futures.process.ProcessPoolExecutor object at 0x7fc84dcaa350>
Initial log joint probability = -8.95172
    Iter      log prob        ||dx||      ||grad||       alpha      alpha0  # evals  Notes 
Initial log joint probability = -12.7302
    Iter      log prob        ||dx||      ||grad||       alpha      alpha0  # evals  Notes 
Initial log joint probability = -15.1549
    Iter      log prob        ||dx||      ||grad||       alpha      alpha0  # evals  Notes 
Initial log joint probability = -18.717
    Iter      log prob        ||dx||      ||grad||       alpha      alpha0  # evals  Notes 
      73       4669.11   7.50543e-09       3540.68      0.3182      0.3182       94   
Optimization terminated normally: 
  Convergence detected: absolute parameter change was below tolerance
Initial log joint probability = -23.5879
    Iter      log prob        ||dx||      ||grad||       alpha      alpha0  # evals  Notes 
      92       7029.18   1.62623e-05       3831.83     4.4e-09       0.001      162  LS failed, Hessian reset 
      99       7029.21   2.73134e-06        3674.5           1           1      171   
    Iter      log prob        ||dx||      ||grad||       alpha      alpha0  # evals  Notes 
      59       9582.48   1.90062e-06        3126.4    5.61e-10       0.001      120  LS failed, Hessian reset 
     131       7029.22   4.98255e-09       3303.16       0.297           1      210   
Optimization terminated normally: 
  Convergence detected: absolute parameter change was below tolerance
      81       9582.49   6.62729e-09       3409.17      0.1545      0.1545      147   
Optimization terminated normally: 
  Convergence detected: absolute parameter change was below tolerance
      82       11813.3   8.18313e-09       3581.88       0.351           1      112   
Optimization terminated normally: 
  Convergence detected: absolute parameter change was below tolerance
      99       14233.1    6.2183e-07       3455.81       4.226      0.4226      128   
    Iter      log prob        ||dx||      ||grad||       alpha      alpha0  # evals  Notes 
     102       14233.1    5.0503e-07       3396.53    1.31e-10       0.001      173  LS failed, Hessian reset 
     114       14233.1   9.57264e-09       3197.87      0.4556      0.4556      187   
Optimization terminated normally: 
  Convergence detected: absolute parameter change was below tolerance
[I 2020-10-01 04:10:48,247] Trial 465 finished with value: 0.038970806812989575 and parameters: {'changepoint_prior_scale': 0.0014178044417045605, 'seasonality_prior_scale': 0.18535803867335893, 'holidays_prior_scale': 0.14481782066819843, 'seasonality_mode': 'additive', 'changepoint_range': 0.5531899275694425}. Best is trial 96 with value: 0.038883738900888705.
Initial log joint probability = -28.8311
    Iter      log prob        ||dx||      ||grad||       alpha      alpha0  # evals  Notes 
      99       18912.5   2.51314e-07       2699.92      0.2038           1      125   
    Iter      log prob        ||dx||      ||grad||       alpha      alpha0  # evals  Notes 
     130       18912.5   1.68888e-08        2977.7      0.2932           1      163   
Optimization terminated normally: 
  Convergence detected: relative gradient magnitude is below tolerance
INFO:fbprophet:Making 5 forecasts with cutoffs between 2013-10-07 00:00:00 and 2015-10-18 00:00:00
INFO:fbprophet:Applying in parallel with <concurrent.futures.process.ProcessPoolExecutor object at 0x7fc84db0cb50>
Initial log joint probability = -8.95172
    Iter      log prob        ||dx||      ||grad||       alpha      alpha0  # evals  Notes 
Initial log joint probability = -12.7302
    Iter      log prob        ||dx||      ||grad||       alpha      alpha0  # evals  Notes 
Initial log joint probability = -15.1549
    Iter      log prob        ||dx||      ||grad||       alpha      alpha0  # evals  Notes 
Initial log joint probability = -18.717
    Iter      log prob        ||dx||      ||grad||       alpha      alpha0  # evals  Notes 
Initial log joint probability = -23.5879
    Iter      log prob        ||dx||      ||grad||       alpha      alpha0  # evals  Notes 
      78       4679.39    5.2345e-09       3236.76       0.266       0.266      106   
Optimization terminated normally: 
  Convergence detected: absolute parameter change was below tolerance
      99       7029.39    2.8767e-06       2899.65      0.7058      0.7058      135   
    Iter      log prob        ||dx||      ||grad||       alpha      alpha0  # evals  Notes 
      29       11811.3   0.000323371       3048.21   1.117e-07       0.001       83  LS failed, Hessian reset 
      61        9582.4   5.04792e-06       3011.64   1.544e-09       0.001      121  LS failed, Hessian reset 
      79       9582.41   8.12792e-09       3283.24      0.1424      0.1424      144   
Optimization terminated normally: 
  Convergence detected: absolute parameter change was below tolerance
     199       7032.07   1.87545e-06       3234.94       2.456      0.2456      259   
    Iter      log prob        ||dx||      ||grad||       alpha      alpha0  # evals  Notes 
     216       7032.07   8.73431e-09       3340.05      0.2086      0.2086      280   
Optimization terminated normally: 
  Convergence detected: absolute parameter change was below tolerance
      72       11813.2   8.35349e-09       3295.04      0.4352      0.9969      136   
Optimization terminated normally: 
  Convergence detected: absolute parameter change was below tolerance
      99       14231.7   6.01484e-07       2509.73           1           1      128   
    Iter      log prob        ||dx||      ||grad||       alpha      alpha0  # evals  Notes 
     118       14231.7    3.0083e-08       2307.23           1           1      152   
Optimization terminated normally: 
  Convergence detected: relative gradient magnitude is below tolerance
[I 2020-10-01 04:11:01,404] Trial 466 finished with value: 0.04154447228288305 and parameters: {'changepoint_prior_scale': 0.001520502174082952, 'seasonality_prior_scale': 0.20042433952188435, 'holidays_prior_scale': 0.15840514672508546, 'seasonality_mode': 'additive', 'changepoint_range': 0.5506809597609631}. Best is trial 96 with value: 0.038883738900888705.
Initial log joint probability = -28.8311
    Iter      log prob        ||dx||      ||grad||       alpha      alpha0  # evals  Notes 
      99       18912.8   3.61853e-08       2814.23      0.6651      0.6651      125   
Optimization terminated normally: 
  Convergence detected: relative gradient magnitude is below tolerance
INFO:fbprophet:Making 5 forecasts with cutoffs between 2013-10-07 00:00:00 and 2015-10-18 00:00:00
INFO:fbprophet:Applying in parallel with <concurrent.futures.process.ProcessPoolExecutor object at 0x7fc84db2fe10>
Initial log joint probability = -8.95172
    Iter      log prob        ||dx||      ||grad||       alpha      alpha0  # evals  Notes 
Initial log joint probability = -12.7302
    Iter      log prob        ||dx||      ||grad||       alpha      alpha0  # evals  Notes 
Initial log joint probability = -15.1549
    Iter      log prob        ||dx||      ||grad||       alpha      alpha0  # evals  Notes 
Initial log joint probability = -18.717
    Iter      log prob        ||dx||      ||grad||       alpha      alpha0  # evals  Notes 
Initial log joint probability = -23.5879
    Iter      log prob        ||dx||      ||grad||       alpha      alpha0  # evals  Notes 
      64       4678.63   0.000207858        2830.7   8.073e-08       0.001      132  LS failed, Hessian reset 
      99       4679.41   4.80225e-07       2646.72      0.6713      0.6713      176   
    Iter      log prob        ||dx||      ||grad||       alpha      alpha0  # evals  Notes 
     116       4679.41   4.27601e-09       2862.53      0.3819      0.3819      197   
Optimization terminated normally: 
  Convergence detected: absolute parameter change was below tolerance
      99       7031.67    0.00047865       3053.72           1           1      121   
    Iter      log prob        ||dx||      ||grad||       alpha      alpha0  # evals  Notes 
      56       9582.52   3.59722e-09       2968.38      0.2364      0.2364       84   
Optimization terminated normally: 
  Convergence detected: absolute parameter change was below tolerance
      56       11813.3   1.91261e-08       2885.41      0.1931           1       82   
Optimization terminated normally: 
  Convergence detected: relative gradient magnitude is below tolerance
     179        7032.1   8.03347e-09       2488.81      0.3529           1      227   
Optimization terminated normally: 
  Convergence detected: absolute parameter change was below tolerance
      99       14232.9    3.3511e-07       2689.22      0.5259      0.5259      146   
    Iter      log prob        ||dx||      ||grad||       alpha      alpha0  # evals  Notes 
     128       14232.9   2.78778e-08        2153.4      0.3677           1      180   
Optimization terminated normally: 
  Convergence detected: relative gradient magnitude is below tolerance
[I 2020-10-01 04:11:15,477] Trial 467 finished with value: 0.041783113149851704 and parameters: {'changepoint_prior_scale': 0.0017895342901505602, 'seasonality_prior_scale': 0.23464948329874838, 'holidays_prior_scale': 0.13193522114179987, 'seasonality_mode': 'additive', 'changepoint_range': 0.5356729481941597}. Best is trial 96 with value: 0.038883738900888705.
Initial log joint probability = -28.8311
    Iter      log prob        ||dx||      ||grad||       alpha      alpha0  # evals  Notes 
      86       18912.7   1.74506e-05       1758.42   8.671e-09       0.001      154  LS failed, Hessian reset 
      99       18912.7   9.46809e-07       1586.01       0.728       0.728      172   
    Iter      log prob        ||dx||      ||grad||       alpha      alpha0  # evals  Notes 
     116       18912.7   5.81242e-08        1505.6      0.6988      0.6988      192   
Optimization terminated normally: 
  Convergence detected: relative gradient magnitude is below tolerance
INFO:fbprophet:Making 5 forecasts with cutoffs between 2013-10-07 00:00:00 and 2015-10-18 00:00:00
INFO:fbprophet:Applying in parallel with <concurrent.futures.process.ProcessPoolExecutor object at 0x7fc84dca9e90>
Initial log joint probability = -8.95172
    Iter      log prob        ||dx||      ||grad||       alpha      alpha0  # evals  Notes 
Initial log joint probability = -12.7302
    Iter      log prob        ||dx||      ||grad||       alpha      alpha0  # evals  Notes 
      46       4678.75   0.000410137       2075.16   2.062e-07       0.001       97  LS failed, Hessian reset 
Initial log joint probability = -15.1549
    Iter      log prob        ||dx||      ||grad||       alpha      alpha0  # evals  Notes 
      84       4679.29    9.1121e-09       1964.27      0.3382      0.3382      146   
Optimization terminated normally: 
  Convergence detected: absolute parameter change was below tolerance
Initial log joint probability = -18.717
    Iter      log prob        ||dx||      ||grad||       alpha      alpha0  # evals  Notes 
Initial log joint probability = -23.5879
    Iter      log prob        ||dx||      ||grad||       alpha      alpha0  # evals  Notes 
      99       7031.87    0.00010594       2047.33      0.5496      0.5496      115   
    Iter      log prob        ||dx||      ||grad||       alpha      alpha0  # evals  Notes 
     145       7032.07   8.56459e-09       1881.31      0.5652      0.5652      170   
Optimization terminated normally: 
  Convergence detected: absolute parameter change was below tolerance
      59       9582.57    6.9305e-06        2115.4   3.594e-09       0.001      122  LS failed, Hessian reset 
      36       11812.7   0.000217715        1726.7   1.344e-07       0.001       93  LS failed, Hessian reset 
      90       9582.59   6.25534e-09       1811.58      0.4729      0.4729      158   
Optimization terminated normally: 
  Convergence detected: absolute parameter change was below tolerance
      99       11813.1   3.23142e-06       1826.83      0.9483      0.9483      167   
    Iter      log prob        ||dx||      ||grad||       alpha      alpha0  # evals  Notes 
      99       14233.4   1.24824e-05       1719.75      0.8056      0.8056      127   
    Iter      log prob        ||dx||      ||grad||       alpha      alpha0  # evals  Notes 
     139       11813.1   2.17241e-08       1698.49      0.3929           1      215   
Optimization terminated normally: 
  Convergence detected: relative gradient magnitude is below tolerance
     170       14233.4   2.91159e-08       1658.47      0.8502      0.8502      212   
Optimization terminated normally: 
  Convergence detected: relative gradient magnitude is below tolerance
[I 2020-10-01 04:11:31,191] Trial 468 finished with value: 0.04188496248660051 and parameters: {'changepoint_prior_scale': 0.002504664985217443, 'seasonality_prior_scale': 0.1784693887541299, 'holidays_prior_scale': 0.1484171069011615, 'seasonality_mode': 'additive', 'changepoint_range': 0.5528447273501639}. Best is trial 96 with value: 0.038883738900888705.
Initial log joint probability = -28.8311
    Iter      log prob        ||dx||      ||grad||       alpha      alpha0  # evals  Notes 
      96       18912.3   5.95184e-06       2959.58   1.733e-09       0.001      168  LS failed, Hessian reset 
      99       18912.3   1.77026e-06       2806.34      0.1011           1      172   
    Iter      log prob        ||dx||      ||grad||       alpha      alpha0  # evals  Notes 
     143       18912.3   4.16103e-09       3353.06     0.05043      0.9238      230   
Optimization terminated normally: 
  Convergence detected: absolute parameter change was below tolerance
INFO:fbprophet:Making 5 forecasts with cutoffs between 2013-10-07 00:00:00 and 2015-10-18 00:00:00
INFO:fbprophet:Applying in parallel with <concurrent.futures.process.ProcessPoolExecutor object at 0x7fc84db0c110>
Initial log joint probability = -8.95172
    Iter      log prob        ||dx||      ||grad||       alpha      alpha0  # evals  Notes 
Initial log joint probability = -12.7302
    Iter      log prob        ||dx||      ||grad||       alpha      alpha0  # evals  Notes 
Initial log joint probability = -15.1549
    Iter      log prob        ||dx||      ||grad||       alpha      alpha0  # evals  Notes 
Initial log joint probability = -18.717
    Iter      log prob        ||dx||      ||grad||       alpha      alpha0  # evals  Notes 
Initial log joint probability = -23.5879
    Iter      log prob        ||dx||      ||grad||       alpha      alpha0  # evals  Notes 
      99       4679.11   5.61598e-08       3320.49           1           1      126   
    Iter      log prob        ||dx||      ||grad||       alpha      alpha0  # evals  Notes 
     105       4679.11    5.9848e-09       3282.63      0.4656      0.4656      133   
Optimization terminated normally: 
  Convergence detected: absolute parameter change was below tolerance
      50       7028.26   0.000173554       3353.23   5.704e-08       0.001       96  LS failed, Hessian reset 
      99       7028.82   1.82304e-05       3784.36           1           1      155   
    Iter      log prob        ||dx||      ||grad||       alpha      alpha0  # evals  Notes 
     102       7029.01   1.65586e-05       2928.95   4.703e-09       0.001      199  LS failed, Hessian reset 
      99       9582.53    8.6994e-06       3565.06      0.1276      0.9183      123   
    Iter      log prob        ||dx||      ||grad||       alpha      alpha0  # evals  Notes 
      33       11811.6   0.000303245       3828.17   9.895e-08       0.001      103  LS failed, Hessian reset 
     123       9582.55   3.52356e-09        3257.4      0.2554      0.2554      153   
Optimization terminated normally: 
  Convergence detected: absolute parameter change was below tolerance
     145       7029.09   7.65497e-09       3481.59      0.5376      0.5376      250   
Optimization terminated normally: 
  Convergence detected: absolute parameter change was below tolerance
      99       14233.2   1.56274e-06        3871.6      0.7026      0.7026      127   
    Iter      log prob        ||dx||      ||grad||       alpha      alpha0  # evals  Notes 
      98         11813   4.11495e-09       3325.85      0.2521      0.2521      182   
Optimization terminated normally: 
  Convergence detected: absolute parameter change was below tolerance
     130       14233.2   9.49192e-09       2811.43      0.3228      0.3228      170   
Optimization terminated normally: 
  Convergence detected: absolute parameter change was below tolerance
