[I 2020-10-01 03:25:41,079] Trial 287 finished with value: 0.04073773836931738 and parameters: {'changepoint_prior_scale': 0.0013455553958843475, 'seasonality_prior_scale': 2.704223517802699, 'holidays_prior_scale': 0.17156848097535207, 'seasonality_mode': 'additive', 'changepoint_range': 0.5427353580112037}. Best is trial 96 with value: 0.038883738900888705.
Initial log joint probability = -28.8311
    Iter      log prob        ||dx||      ||grad||       alpha      alpha0  # evals  Notes 
      99       18911.5   5.11914e-06       5112.12      0.6965      0.6965      124   
    Iter      log prob        ||dx||      ||grad||       alpha      alpha0  # evals  Notes 
     174       18912.1   6.78837e-09       5220.94      0.2622      0.2622      217   
Optimization terminated normally: 
  Convergence detected: absolute parameter change was below tolerance
INFO:fbprophet:Making 5 forecasts with cutoffs between 2013-10-07 00:00:00 and 2015-10-18 00:00:00
INFO:fbprophet:Applying in parallel with <concurrent.futures.process.ProcessPoolExecutor object at 0x7fc84dc4d0d0>
Initial log joint probability = -8.95172
    Iter      log prob        ||dx||      ||grad||       alpha      alpha0  # evals  Notes 
Initial log joint probability = -12.7302
    Iter      log prob        ||dx||      ||grad||       alpha      alpha0  # evals  Notes 
Initial log joint probability = -15.1549
    Iter      log prob        ||dx||      ||grad||       alpha      alpha0  # evals  Notes 
Initial log joint probability = -18.717
    Iter      log prob        ||dx||      ||grad||       alpha      alpha0  # evals  Notes 
      57       4678.91    8.6595e-09       4736.87      0.1504      0.1504       80   
Optimization terminated normally: 
  Convergence detected: absolute parameter change was below tolerance
Initial log joint probability = -23.5879
    Iter      log prob        ||dx||      ||grad||       alpha      alpha0  # evals  Notes 
      99       7028.11   3.07035e-07        5008.7           1           1      130   
    Iter      log prob        ||dx||      ||grad||       alpha      alpha0  # evals  Notes 
      53       9582.46   5.16179e-09       5048.65        0.36        0.36       82   
Optimization terminated normally: 
  Convergence detected: absolute parameter change was below tolerance
     124       7028.12   5.09653e-09       4486.22      0.2448      0.2448      160   
Optimization terminated normally: 
  Convergence detected: absolute parameter change was below tolerance
      75         11813    7.2707e-09       4534.83           1           1      105   
Optimization terminated normally: 
  Convergence detected: absolute parameter change was below tolerance
      99       14232.6   1.94107e-06       4727.01           1           1      127   
    Iter      log prob        ||dx||      ||grad||       alpha      alpha0  # evals  Notes 
     118       14232.6   4.61537e-08       4890.81      0.5946      0.5946      149   
Optimization terminated normally: 
  Convergence detected: relative gradient magnitude is below tolerance
[I 2020-10-01 03:25:57,213] Trial 288 finished with value: 0.041115280817661616 and parameters: {'changepoint_prior_scale': 0.0010019442256493083, 'seasonality_prior_scale': 0.1309549038774759, 'holidays_prior_scale': 0.16325904610499764, 'seasonality_mode': 'additive', 'changepoint_range': 0.5406051810909753}. Best is trial 96 with value: 0.038883738900888705.
Initial log joint probability = -28.8311
    Iter      log prob        ||dx||      ||grad||       alpha      alpha0  # evals  Notes 
      99       18912.8   6.17385e-08       3757.14      0.2857      0.6779      129   
    Iter      log prob        ||dx||      ||grad||       alpha      alpha0  # evals  Notes 
     107       18912.8   3.79871e-09       3818.84      0.2556      0.2556      140   
Optimization terminated normally: 
  Convergence detected: absolute parameter change was below tolerance
INFO:fbprophet:Making 5 forecasts with cutoffs between 2013-10-07 00:00:00 and 2015-10-18 00:00:00
INFO:fbprophet:Applying in parallel with <concurrent.futures.process.ProcessPoolExecutor object at 0x7fc84dbfd610>
Initial log joint probability = -8.95172
    Iter      log prob        ||dx||      ||grad||       alpha      alpha0  # evals  Notes 
Initial log joint probability = -12.7302
    Iter      log prob        ||dx||      ||grad||       alpha      alpha0  # evals  Notes 
Initial log joint probability = -15.1549
    Iter      log prob        ||dx||      ||grad||       alpha      alpha0  # evals  Notes 
Initial log joint probability = -18.717
    Iter      log prob        ||dx||      ||grad||       alpha      alpha0  # evals  Notes 
Initial log joint probability = -23.5879
    Iter      log prob        ||dx||      ||grad||       alpha      alpha0  # evals  Notes 
      46       4679.28   1.81982e-05       4014.91   4.517e-09       0.001      105  LS failed, Hessian reset 
      99       4679.38   2.67494e-08       3911.39      0.7029      0.7029      178   
    Iter      log prob        ||dx||      ||grad||       alpha      alpha0  # evals  Notes 
     100       4679.38   6.85848e-09       3944.52      0.5119      0.5119      179   
Optimization terminated normally: 
  Convergence detected: absolute parameter change was below tolerance
      91       7029.03   1.42537e-05       3204.34   3.365e-09       0.001      164  LS failed, Hessian reset 
      99       7029.07    2.1857e-06       3464.96           1           1      175   
    Iter      log prob        ||dx||      ||grad||       alpha      alpha0  # evals  Notes 
      99       9582.57   2.25816e-06       3754.94      0.5245      0.5245      130   
    Iter      log prob        ||dx||      ||grad||       alpha      alpha0  # evals  Notes 
     125       7029.08   8.64785e-09       3315.69      0.5875      0.5875      210   
Optimization terminated normally: 
  Convergence detected: absolute parameter change was below tolerance
     119       9582.58   1.44776e-08       3749.61       0.215      0.8211      154   
Optimization terminated normally: 
  Convergence detected: relative gradient magnitude is below tolerance
      95       11813.3   8.33589e-09       4028.69      0.5263      0.5263      126   
Optimization terminated normally: 
  Convergence detected: absolute parameter change was below tolerance
      99       14233.5   4.45742e-07       3881.29      0.5145      0.5145      125   
    Iter      log prob        ||dx||      ||grad||       alpha      alpha0  # evals  Notes 
     128       14233.6    6.6306e-09       4035.84       0.285           1      162   
Optimization terminated normally: 
  Convergence detected: absolute parameter change was below tolerance
[I 2020-10-01 03:26:12,085] Trial 289 finished with value: 0.04113119565613351 and parameters: {'changepoint_prior_scale': 0.001242070450717717, 'seasonality_prior_scale': 1.6133134838404852, 'holidays_prior_scale': 0.09285390274873212, 'seasonality_mode': 'additive', 'changepoint_range': 0.5287637949129167}. Best is trial 96 with value: 0.038883738900888705.
Initial log joint probability = -28.8311
    Iter      log prob        ||dx||      ||grad||       alpha      alpha0  # evals  Notes 
      99         18912   3.65783e-07       4531.96      0.6913      0.6913      121   
    Iter      log prob        ||dx||      ||grad||       alpha      alpha0  # evals  Notes 
     191       18912.4   9.22001e-09       3559.31      0.3612      0.3612      238   
Optimization terminated normally: 
  Convergence detected: absolute parameter change was below tolerance
INFO:fbprophet:Making 5 forecasts with cutoffs between 2013-10-07 00:00:00 and 2015-10-18 00:00:00
INFO:fbprophet:Applying in parallel with <concurrent.futures.process.ProcessPoolExecutor object at 0x7fc84dbe86d0>
Initial log joint probability = -8.95172
    Iter      log prob        ||dx||      ||grad||       alpha      alpha0  # evals  Notes 
Initial log joint probability = -12.7302
    Iter      log prob        ||dx||      ||grad||       alpha      alpha0  # evals  Notes 
Initial log joint probability = -15.1549
    Iter      log prob        ||dx||      ||grad||       alpha      alpha0  # evals  Notes 
Initial log joint probability = -18.717
    Iter      log prob        ||dx||      ||grad||       alpha      alpha0  # evals  Notes 
      59       4679.01   4.33602e-09       4834.22      0.2715      0.2715       82   
Optimization terminated normally: 
  Convergence detected: absolute parameter change was below tolerance
Initial log joint probability = -23.5879
    Iter      log prob        ||dx||      ||grad||       alpha      alpha0  # evals  Notes 
      59       9582.27   8.88559e-09       4970.58      0.7492      0.7492       81   
Optimization terminated normally: 
  Convergence detected: absolute parameter change was below tolerance
      92       7028.12   7.57847e-06       5172.06   1.659e-09       0.001      147  LS failed, Hessian reset 
      99       7028.14    7.8441e-07       4678.02           1           1      156   
    Iter      log prob        ||dx||      ||grad||       alpha      alpha0  # evals  Notes 
     115       7028.15   7.73892e-09       4527.41      0.6249      0.6249      177   
Optimization terminated normally: 
  Convergence detected: absolute parameter change was below tolerance
      67       11812.9   9.19477e-09       5093.26      0.5293      0.5293       90   
Optimization terminated normally: 
  Convergence detected: absolute parameter change was below tolerance
      99       14232.5   4.64936e-07       4802.65      0.5665      0.5665      128   
    Iter      log prob        ||dx||      ||grad||       alpha      alpha0  # evals  Notes 
     118       14232.5   1.53941e-08       4849.17      0.3489      0.8669      154   
Optimization terminated normally: 
  Convergence detected: relative gradient magnitude is below tolerance
[I 2020-10-01 03:26:27,749] Trial 290 finished with value: 0.040964181556961396 and parameters: {'changepoint_prior_scale': 0.0010029621289087821, 'seasonality_prior_scale': 1.5282170853146384, 'holidays_prior_scale': 0.1684259433483654, 'seasonality_mode': 'additive', 'changepoint_range': 0.547363957984002}. Best is trial 96 with value: 0.038883738900888705.
Initial log joint probability = -28.8311
    Iter      log prob        ||dx||      ||grad||       alpha      alpha0  # evals  Notes 
      99       18912.6   1.50086e-05       3273.46           1           1      120   
    Iter      log prob        ||dx||      ||grad||       alpha      alpha0  # evals  Notes 
     166       18912.8   9.98245e-09       3555.81      0.3775      0.3775      199   
Optimization terminated normally: 
  Convergence detected: absolute parameter change was below tolerance
INFO:fbprophet:Making 5 forecasts with cutoffs between 2013-10-07 00:00:00 and 2015-10-18 00:00:00
INFO:fbprophet:Applying in parallel with <concurrent.futures.process.ProcessPoolExecutor object at 0x7fc84dbe8d10>
Initial log joint probability = -8.95172
    Iter      log prob        ||dx||      ||grad||       alpha      alpha0  # evals  Notes 
Initial log joint probability = -12.7302
    Iter      log prob        ||dx||      ||grad||       alpha      alpha0  # evals  Notes 
      68       4678.71   3.46884e-09       3691.88      0.2867      0.2867       92   
Optimization terminated normally: 
  Convergence detected: absolute parameter change was below tolerance
Initial log joint probability = -15.1549
    Iter      log prob        ||dx||      ||grad||       alpha      alpha0  # evals  Notes 
Initial log joint probability = -18.717
    Iter      log prob        ||dx||      ||grad||       alpha      alpha0  # evals  Notes 
Initial log joint probability = -23.5879
    Iter      log prob        ||dx||      ||grad||       alpha      alpha0  # evals  Notes 
      99       7029.46   3.40233e-07       3783.66           1           1      127   
    Iter      log prob        ||dx||      ||grad||       alpha      alpha0  # evals  Notes 
     109       7029.46   4.69291e-09       3460.82     0.09736     0.09736      142   
Optimization terminated normally: 
  Convergence detected: absolute parameter change was below tolerance
      76       9582.47   6.06037e-09       3633.79      0.3983      0.3983       97   
Optimization terminated normally: 
  Convergence detected: absolute parameter change was below tolerance
      48       11813.2   2.63119e-05       3429.56   7.562e-09       0.001      107  LS failed, Hessian reset 
      85       11813.2    9.1938e-09       3611.45      0.3417      0.3417      154   
Optimization terminated normally: 
  Convergence detected: absolute parameter change was below tolerance
      99       14232.9   8.12219e-05       4174.07      0.8379      0.8379      128   
    Iter      log prob        ||dx||      ||grad||       alpha      alpha0  # evals  Notes 
     149       14233.2   9.53288e-09       3593.59      0.4748      0.4748      195   
Optimization terminated normally: 
  Convergence detected: absolute parameter change was below tolerance
[I 2020-10-01 03:26:42,960] Trial 291 finished with value: 0.04122692723808144 and parameters: {'changepoint_prior_scale': 0.0013579162284879046, 'seasonality_prior_scale': 4.284103400590802, 'holidays_prior_scale': 0.10299947094900037, 'seasonality_mode': 'additive', 'changepoint_range': 0.7346535034400984}. Best is trial 96 with value: 0.038883738900888705.
Initial log joint probability = -28.8311
    Iter      log prob        ||dx||      ||grad||       alpha      alpha0  # evals  Notes 
      99       18912.7   1.07872e-07       3759.18           1           1      124   
    Iter      log prob        ||dx||      ||grad||       alpha      alpha0  # evals  Notes 
     105       18912.7   8.36484e-09       3993.91      0.2757      0.2757      132   
Optimization terminated normally: 
  Convergence detected: absolute parameter change was below tolerance
INFO:fbprophet:Making 5 forecasts with cutoffs between 2013-10-07 00:00:00 and 2015-10-18 00:00:00
INFO:fbprophet:Applying in parallel with <concurrent.futures.process.ProcessPoolExecutor object at 0x7fc84dc2fe90>
Initial log joint probability = -8.95172
    Iter      log prob        ||dx||      ||grad||       alpha      alpha0  # evals  Notes 
Initial log joint probability = -12.7302
    Iter      log prob        ||dx||      ||grad||       alpha      alpha0  # evals  Notes 
Initial log joint probability = -15.1549
    Iter      log prob        ||dx||      ||grad||       alpha      alpha0  # evals  Notes 
Initial log joint probability = -18.717
    Iter      log prob        ||dx||      ||grad||       alpha      alpha0  # evals  Notes 
Initial log joint probability = -23.5879
    Iter      log prob        ||dx||      ||grad||       alpha      alpha0  # evals  Notes 
      83       4679.37   5.28272e-06       4224.06   1.274e-09       0.001      149  LS failed, Hessian reset 
      99       4679.39   1.13889e-08       4149.32      0.3455      0.3455      171   
    Iter      log prob        ||dx||      ||grad||       alpha      alpha0  # evals  Notes 
     102       4679.39   2.32259e-09       4105.87      0.1707      0.1707      176   
Optimization terminated normally: 
  Convergence detected: absolute parameter change was below tolerance
      88       7028.67   2.21272e-05       3552.21   5.166e-09       0.001      150  LS failed, Hessian reset 
      99       7028.76   1.56154e-06       3849.25      0.8141      0.8141      162   
    Iter      log prob        ||dx||      ||grad||       alpha      alpha0  # evals  Notes 
      76       9582.52   9.57914e-09       4247.84      0.2424           1      108   
Optimization terminated normally: 
  Convergence detected: absolute parameter change was below tolerance
      84       11813.1   4.61143e-09       4311.13      0.4905      0.4905      106   
Optimization terminated normally: 
  Convergence detected: absolute parameter change was below tolerance
     148       7028.79   1.15331e-06       3692.17   2.611e-10       0.001      270  LS failed, Hessian reset 
     167       7028.79   5.65501e-09        3860.8      0.4256      0.4256      294   
Optimization terminated normally: 
  Convergence detected: absolute parameter change was below tolerance
      96       14232.6   8.84762e-09       4198.29      0.4387      0.4387      129   
Optimization terminated normally: 
  Convergence detected: absolute parameter change was below tolerance
[I 2020-10-01 03:26:56,673] Trial 292 finished with value: 0.040929493155937205 and parameters: {'changepoint_prior_scale': 0.001199160211393492, 'seasonality_prior_scale': 6.487299270586626, 'holidays_prior_scale': 2.862651410507094, 'seasonality_mode': 'additive', 'changepoint_range': 0.5354079634294298}. Best is trial 96 with value: 0.038883738900888705.
Initial log joint probability = -28.8311
    Iter      log prob        ||dx||      ||grad||       alpha      alpha0  # evals  Notes 
      99       18912.7   2.00896e-06       3659.35           1           1      126   
    Iter      log prob        ||dx||      ||grad||       alpha      alpha0  # evals  Notes 
     118       18912.8   8.01237e-09       3540.96       0.521       0.521      149   
Optimization terminated normally: 
  Convergence detected: absolute parameter change was below tolerance
INFO:fbprophet:Making 5 forecasts with cutoffs between 2013-10-07 00:00:00 and 2015-10-18 00:00:00
INFO:fbprophet:Applying in parallel with <concurrent.futures.process.ProcessPoolExecutor object at 0x7fc84dc041d0>
Initial log joint probability = -8.95172
    Iter      log prob        ||dx||      ||grad||       alpha      alpha0  # evals  Notes 
Initial log joint probability = -12.7302
    Iter      log prob        ||dx||      ||grad||       alpha      alpha0  # evals  Notes 
Initial log joint probability = -15.1549
    Iter      log prob        ||dx||      ||grad||       alpha      alpha0  # evals  Notes 
Initial log joint probability = -18.717
    Iter      log prob        ||dx||      ||grad||       alpha      alpha0  # evals  Notes 
Initial log joint probability = -23.5879
    Iter      log prob        ||dx||      ||grad||       alpha      alpha0  # evals  Notes 
      52       4679.01   2.01449e-05       3900.01   5.502e-09       0.001      103  LS failed, Hessian reset 
      86       4679.11   5.61324e-07       3978.19   1.571e-10       0.001      179  LS failed, Hessian reset 
      92       4679.12   8.95038e-09       3490.45      0.3931      0.3931      188   
Optimization terminated normally: 
  Convergence detected: absolute parameter change was below tolerance
      73       7028.87   3.86617e-05        3979.4   1.022e-08       0.001      132  LS failed, Hessian reset 
      57       9582.42   9.92566e-09       3078.86      0.2448           1       80   
Optimization terminated normally: 
  Convergence detected: absolute parameter change was below tolerance
      99       7029.11   6.21454e-07       3335.66           1           1      161   
    Iter      log prob        ||dx||      ||grad||       alpha      alpha0  # evals  Notes 
     115       7029.11   3.77454e-09       3853.77      0.1782      0.1782      184   
Optimization terminated normally: 
  Convergence detected: absolute parameter change was below tolerance
      95       11813.1   5.78698e-09        3566.4      0.2329      0.2329      143   
Optimization terminated normally: 
  Convergence detected: absolute parameter change was below tolerance
      99       14233.4   4.58865e-08       3590.94           1           1      130   
    Iter      log prob        ||dx||      ||grad||       alpha      alpha0  # evals  Notes 
     103       14233.4   2.03034e-08       3757.63      0.9241      0.9241      135   
Optimization terminated normally: 
  Convergence detected: relative gradient magnitude is below tolerance
