[I 2020-10-01 02:51:19,894] Trial 152 finished with value: 0.040947698217874605 and parameters: {'changepoint_prior_scale': 0.0016958856754123453, 'seasonality_prior_scale': 0.22026090429219508, 'holidays_prior_scale': 0.06332581310820094, 'seasonality_mode': 'additive', 'changepoint_range': 0.5329493987525262}. Best is trial 96 with value: 0.038883738900888705.
Initial log joint probability = -28.8311
    Iter      log prob        ||dx||      ||grad||       alpha      alpha0  # evals  Notes 
      99       18912.6   5.06719e-05       3804.27           1           1      123   
    Iter      log prob        ||dx||      ||grad||       alpha      alpha0  # evals  Notes 
     149       18912.9   7.24101e-09       3557.91      0.2023           1      187   
Optimization terminated normally: 
  Convergence detected: absolute parameter change was below tolerance
INFO:fbprophet:Making 5 forecasts with cutoffs between 2013-10-07 00:00:00 and 2015-10-18 00:00:00
INFO:fbprophet:Applying in parallel with <concurrent.futures.process.ProcessPoolExecutor object at 0x7fc88e69ad10>
Initial log joint probability = -8.95172
    Iter      log prob        ||dx||      ||grad||       alpha      alpha0  # evals  Notes 
Initial log joint probability = -12.7302
    Iter      log prob        ||dx||      ||grad||       alpha      alpha0  # evals  Notes 
Initial log joint probability = -15.1549
    Iter      log prob        ||dx||      ||grad||       alpha      alpha0  # evals  Notes 
Initial log joint probability = -18.717
    Iter      log prob        ||dx||      ||grad||       alpha      alpha0  # evals  Notes 
      65       4678.94   9.01496e-09       3445.42      0.2824      0.2824       82   
Optimization terminated normally: 
  Convergence detected: absolute parameter change was below tolerance
Initial log joint probability = -23.5879
    Iter      log prob        ||dx||      ||grad||       alpha      alpha0  # evals  Notes 
      99       7029.19   2.04277e-07       3526.97      0.8623      0.8623      122   
    Iter      log prob        ||dx||      ||grad||       alpha      alpha0  # evals  Notes 
     109       7029.19    8.1307e-09       3312.98       0.445       0.445      133   
Optimization terminated normally: 
  Convergence detected: absolute parameter change was below tolerance
      57       11813.2   8.07756e-09       3619.54      0.4548      0.4548       80   
Optimization terminated normally: 
  Convergence detected: absolute parameter change was below tolerance
      97       9582.48   8.80219e-09       3077.27      0.1905      0.7196      130   
Optimization terminated normally: 
  Convergence detected: absolute parameter change was below tolerance
      99       14232.2   0.000134612       3438.65      0.5552      0.5552      130   
    Iter      log prob        ||dx||      ||grad||       alpha      alpha0  # evals  Notes 
     121       14232.4   1.76384e-05       3820.23   4.583e-09       0.001      193  LS failed, Hessian reset 
     153       14232.5   6.35391e-09       3676.98      0.4236      0.4236      232   
Optimization terminated normally: 
  Convergence detected: absolute parameter change was below tolerance
[I 2020-10-01 02:51:33,228] Trial 153 finished with value: 0.04085594898383715 and parameters: {'changepoint_prior_scale': 0.0013622264260725052, 'seasonality_prior_scale': 0.19327738369550176, 'holidays_prior_scale': 0.15657839121471734, 'seasonality_mode': 'additive', 'changepoint_range': 0.5571115795473511}. Best is trial 96 with value: 0.038883738900888705.
Initial log joint probability = -28.8311
    Iter      log prob        ||dx||      ||grad||       alpha      alpha0  # evals  Notes 
      99       18912.5   1.77847e-06       3487.26           1           1      126   
    Iter      log prob        ||dx||      ||grad||       alpha      alpha0  # evals  Notes 
     116       18912.5   7.56327e-09       3247.32       0.166       0.166      145   
Optimization terminated normally: 
  Convergence detected: absolute parameter change was below tolerance
INFO:fbprophet:Making 5 forecasts with cutoffs between 2013-10-07 00:00:00 and 2015-10-18 00:00:00
INFO:fbprophet:Applying in parallel with <concurrent.futures.process.ProcessPoolExecutor object at 0x7fc88e683b50>
Initial log joint probability = -8.95172
    Iter      log prob        ||dx||      ||grad||       alpha      alpha0  # evals  Notes 
Initial log joint probability = -12.7302
    Iter      log prob        ||dx||      ||grad||       alpha      alpha0  # evals  Notes 
Initial log joint probability = -15.1549
    Iter      log prob        ||dx||      ||grad||       alpha      alpha0  # evals  Notes 
Initial log joint probability = -18.717
    Iter      log prob        ||dx||      ||grad||       alpha      alpha0  # evals  Notes 
Initial log joint probability = -23.5879
    Iter      log prob        ||dx||      ||grad||       alpha      alpha0  # evals  Notes 
      99       4679.13   1.56178e-05       3504.41           1           1      121   
    Iter      log prob        ||dx||      ||grad||       alpha      alpha0  # evals  Notes 
     127       4679.23   1.03184e-05       3655.52   2.896e-09       0.001      203  LS failed, Hessian reset 
      99        7029.3    4.2603e-08       3754.46      0.6127      0.6127      121   
    Iter      log prob        ||dx||      ||grad||       alpha      alpha0  # evals  Notes 
     155       4679.25   9.98245e-09       3653.13      0.4537      0.4537      235   
Optimization terminated normally: 
  Convergence detected: absolute parameter change was below tolerance
      73       9582.46   8.33591e-09        3268.5      0.2517           1       99   
Optimization terminated normally: 
  Convergence detected: absolute parameter change was below tolerance
     180       7031.98    8.1947e-09       3588.33       0.205       0.205      223   
Optimization terminated normally: 
  Convergence detected: absolute parameter change was below tolerance
      99       11813.2   1.70049e-08       3278.01      0.4147      0.4147      125   
    Iter      log prob        ||dx||      ||grad||       alpha      alpha0  # evals  Notes 
     106       11813.2   5.64022e-09       3576.83      0.3913      0.3913      133   
Optimization terminated normally: 
  Convergence detected: absolute parameter change was below tolerance
      85       14232.4   0.000119884        3483.5   3.329e-08       0.001      160  LS failed, Hessian reset 
      99       14232.7   6.74354e-06       3410.62           1           1      178   
    Iter      log prob        ||dx||      ||grad||       alpha      alpha0  # evals  Notes 
     138       14232.8   8.43182e-09       3027.25      0.3469      0.9232      224   
Optimization terminated normally: 
  Convergence detected: absolute parameter change was below tolerance
[I 2020-10-01 02:51:48,321] Trial 154 finished with value: 0.041673797439572044 and parameters: {'changepoint_prior_scale': 0.0013956715367308993, 'seasonality_prior_scale': 0.1631224649908142, 'holidays_prior_scale': 0.16792066602719968, 'seasonality_mode': 'additive', 'changepoint_range': 0.5535957053517759}. Best is trial 96 with value: 0.038883738900888705.
Initial log joint probability = -28.8311
    Iter      log prob        ||dx||      ||grad||       alpha      alpha0  # evals  Notes 
      99       18912.4   1.03195e-05       4673.59           1           1      116   
    Iter      log prob        ||dx||      ||grad||       alpha      alpha0  # evals  Notes 
     161       18912.7   1.22498e-08       3551.43      0.3465           1      200   
Optimization terminated normally: 
  Convergence detected: relative gradient magnitude is below tolerance
INFO:fbprophet:Making 5 forecasts with cutoffs between 2013-10-07 00:00:00 and 2015-10-18 00:00:00
INFO:fbprophet:Applying in parallel with <concurrent.futures.process.ProcessPoolExecutor object at 0x7fc84dc6fe10>
Initial log joint probability = -8.95172
    Iter      log prob        ||dx||      ||grad||       alpha      alpha0  # evals  Notes 
Initial log joint probability = -12.7302
    Iter      log prob        ||dx||      ||grad||       alpha      alpha0  # evals  Notes 
Initial log joint probability = -15.1549
    Iter      log prob        ||dx||      ||grad||       alpha      alpha0  # evals  Notes 
Initial log joint probability = -18.717
    Iter      log prob        ||dx||      ||grad||       alpha      alpha0  # evals  Notes 
      55       4679.05   9.32855e-09       4469.21      0.3918      0.3918       74   
Optimization terminated normally: 
  Convergence detected: absolute parameter change was below tolerance
Initial log joint probability = -23.5879
    Iter      log prob        ||dx||      ||grad||       alpha      alpha0  # evals  Notes 
      85       7028.33   1.09675e-06        3991.2   2.441e-10       0.001      152  LS failed, Hessian reset 
      99       7028.34   5.72265e-08       4034.87      0.2046      0.8912      170   
    Iter      log prob        ||dx||      ||grad||       alpha      alpha0  # evals  Notes 
     107       7028.34   6.38003e-09       4418.74      0.5115      0.5115      179   
Optimization terminated normally: 
  Convergence detected: absolute parameter change was below tolerance
      57       9579.82   0.000317975       3777.45   1.032e-07       0.001      136  LS failed, Hessian reset 
      33       11811.9    0.00021952       4505.54   4.615e-08       0.001       96  LS failed, Hessian reset 
      99       9582.13   1.59407e-07       3987.38      0.3278      0.9358      187   
    Iter      log prob        ||dx||      ||grad||       alpha      alpha0  # evals  Notes 
     106       9582.13   7.46057e-09       3964.93      0.2588      0.2588      197   
Optimization terminated normally: 
  Convergence detected: absolute parameter change was below tolerance
      99       14233.1   1.90415e-05       4477.96      0.2637           1      125   
    Iter      log prob        ||dx||      ||grad||       alpha      alpha0  # evals  Notes 
      94       11812.7   5.22991e-09       4446.58      0.3134      0.3134      174   
Optimization terminated normally: 
  Convergence detected: absolute parameter change was below tolerance
     125       14233.1   8.18767e-09        4451.4      0.2861      0.2861      157   
Optimization terminated normally: 
  Convergence detected: absolute parameter change was below tolerance
[I 2020-10-01 02:52:04,052] Trial 155 finished with value: 0.04106311877281974 and parameters: {'changepoint_prior_scale': 0.0011329676299642185, 'seasonality_prior_scale': 0.1957460949604055, 'holidays_prior_scale': 0.11830788584293718, 'seasonality_mode': 'additive', 'changepoint_range': 0.5422817743684016}. Best is trial 96 with value: 0.038883738900888705.
Initial log joint probability = -28.8311
    Iter      log prob        ||dx||      ||grad||       alpha      alpha0  # evals  Notes 
      99       18918.1   0.000385408       101.684           1           1      119   
    Iter      log prob        ||dx||      ||grad||       alpha      alpha0  # evals  Notes 
     148       18918.3   2.78129e-05       99.9342   2.245e-07       0.001      225  LS failed, Hessian reset 
     163       18918.3   7.84754e-07       58.3736      0.6989      0.6989      249   
Optimization terminated normally: 
  Convergence detected: relative gradient magnitude is below tolerance
INFO:fbprophet:Making 5 forecasts with cutoffs between 2013-10-07 00:00:00 and 2015-10-18 00:00:00
INFO:fbprophet:Applying in parallel with <concurrent.futures.process.ProcessPoolExecutor object at 0x7fc88e683590>
Initial log joint probability = -8.95172
    Iter      log prob        ||dx||      ||grad||       alpha      alpha0  # evals  Notes 
Initial log joint probability = -12.7302
    Iter      log prob        ||dx||      ||grad||       alpha      alpha0  # evals  Notes 
Initial log joint probability = -15.1549
    Iter      log prob        ||dx||      ||grad||       alpha      alpha0  # evals  Notes 
Initial log joint probability = -18.717
    Iter      log prob        ||dx||      ||grad||       alpha      alpha0  # evals  Notes 
Initial log joint probability = -23.5879
    Iter      log prob        ||dx||      ||grad||       alpha      alpha0  # evals  Notes 
      99       4679.51    1.4187e-06       96.9596      0.5417      0.5417      122   
    Iter      log prob        ||dx||      ||grad||       alpha      alpha0  # evals  Notes 
     110       4679.51   6.79633e-08       91.6148     0.09524      0.3912      136   
Optimization terminated normally: 
  Convergence detected: relative gradient magnitude is below tolerance
      99       7037.95   0.000763036       81.8797           1           1      124   
    Iter      log prob        ||dx||      ||grad||       alpha      alpha0  # evals  Notes 
     137       7038.08   1.80898e-07       61.2485     0.07396     0.07396      188   
Optimization terminated normally: 
  Convergence detected: relative gradient magnitude is below tolerance
      99        9585.2   5.12701e-05       76.2867      0.2954           1      124   
    Iter      log prob        ||dx||      ||grad||       alpha      alpha0  # evals  Notes 
     106       9585.24   0.000202628       142.345   1.932e-06       0.001      165  LS failed, Hessian reset 
      99       11816.8   0.000406555        143.84      0.6612      0.6612      128   
    Iter      log prob        ||dx||      ||grad||       alpha      alpha0  # evals  Notes 
      99       14238.3    0.00205757       98.4599           1           1      117   
    Iter      log prob        ||dx||      ||grad||       alpha      alpha0  # evals  Notes 
     199       9585.58   3.54572e-05       92.8848           1           1      278   
    Iter      log prob        ||dx||      ||grad||       alpha      alpha0  # evals  Notes 
     209       9585.61   0.000246342       106.321   2.542e-06       0.001      338  LS failed, Hessian reset 
     181       11817.2   0.000118306       215.694   9.055e-07       0.001      277  LS failed, Hessian reset 
     261       9585.64   2.45622e-07        77.881      0.4149      0.4149      400   
Optimization terminated normally: 
  Convergence detected: relative gradient magnitude is below tolerance
     199       11817.3   1.72575e-06       53.4082       1.354      0.1354      306   
    Iter      log prob        ||dx||      ||grad||       alpha      alpha0  # evals  Notes 
     184       14238.9    4.4212e-05       130.152   4.257e-07       0.001      255  LS failed, Hessian reset 
     208       11817.3   2.32053e-05       77.1142   2.971e-07       0.001      351  LS failed, Hessian reset 
     199       14238.9   7.74092e-06       76.5611      0.2689           1      278   
    Iter      log prob        ||dx||      ||grad||       alpha      alpha0  # evals  Notes 
     206       14238.9   8.90869e-07        50.489      0.6817      0.1881      290   
Optimization terminated normally: 
  Convergence detected: relative gradient magnitude is below tolerance
     299       11817.3   3.40925e-05       91.0368           1           1      463   
    Iter      log prob        ||dx||      ||grad||       alpha      alpha0  # evals  Notes 
     348       11817.4   6.91067e-05        167.03    6.15e-07       0.001      568  LS failed, Hessian reset 
     399       11817.4   6.08484e-06       72.2394     0.05754      0.4223      637   
    Iter      log prob        ||dx||      ||grad||       alpha      alpha0  # evals  Notes 
     435       11817.4   4.35204e-07       87.6226      0.1782           1      685   
Optimization terminated normally: 
  Convergence detected: relative gradient magnitude is below tolerance
[I 2020-10-01 02:52:20,138] Trial 156 finished with value: 0.04588455593477717 and parameters: {'changepoint_prior_scale': 0.04765235212314398, 'seasonality_prior_scale': 0.266762491204623, 'holidays_prior_scale': 0.0927409194963706, 'seasonality_mode': 'additive', 'changepoint_range': 0.573680698569608}. Best is trial 96 with value: 0.038883738900888705.
Initial log joint probability = -28.8311
    Iter      log prob        ||dx||      ||grad||       alpha      alpha0  # evals  Notes 
      99         18913   5.55726e-06       2777.81      0.3695      0.3695      125   
    Iter      log prob        ||dx||      ||grad||       alpha      alpha0  # evals  Notes 
     121         18913   4.24265e-08          2356      0.8516      0.2232      157   
Optimization terminated normally: 
  Convergence detected: relative gradient magnitude is below tolerance
INFO:fbprophet:Making 5 forecasts with cutoffs between 2013-10-07 00:00:00 and 2015-10-18 00:00:00
INFO:fbprophet:Applying in parallel with <concurrent.futures.process.ProcessPoolExecutor object at 0x7fc88e66ce50>
Initial log joint probability = -8.95172
    Iter      log prob        ||dx||      ||grad||       alpha      alpha0  # evals  Notes 
Initial log joint probability = -12.7302
    Iter      log prob        ||dx||      ||grad||       alpha      alpha0  # evals  Notes 
Initial log joint probability = -15.1549
    Iter      log prob        ||dx||      ||grad||       alpha      alpha0  # evals  Notes 
Initial log joint probability = -18.717
    Iter      log prob        ||dx||      ||grad||       alpha      alpha0  # evals  Notes 
      79       4679.36    2.6363e-09       2724.96      0.3003      0.3003      116   
Optimization terminated normally: 
  Convergence detected: absolute parameter change was below tolerance
Initial log joint probability = -23.5879
    Iter      log prob        ||dx||      ||grad||       alpha      alpha0  # evals  Notes 
      99       7030.47    1.9974e-06        2538.4      0.6627      0.6627      122   
    Iter      log prob        ||dx||      ||grad||       alpha      alpha0  # evals  Notes 
     171       7030.49   5.71539e-09       2627.97      0.5807      0.5807      213   
Optimization terminated normally: 
  Convergence detected: absolute parameter change was below tolerance
      71       9581.18   0.000612492       2698.49   2.012e-07       0.001      174  LS failed, Hessian reset 
      55       11813.2   1.76689e-05       2665.52    6.37e-09       0.001      131  LS failed, Hessian reset 
      99       9582.53    7.0313e-07       2659.49      0.5305      0.5305      212   
    Iter      log prob        ||dx||      ||grad||       alpha      alpha0  # evals  Notes 
     118       9582.53    5.9095e-09       2602.61      0.4869      0.4869      233   
Optimization terminated normally: 
  Convergence detected: absolute parameter change was below tolerance
      86       11813.2   8.19997e-09       2611.15      0.2583      0.2583      172   
Optimization terminated normally: 
  Convergence detected: absolute parameter change was below tolerance
      99       14233.5   1.76986e-08       2755.35      0.4894      0.4894      133   
    Iter      log prob        ||dx||      ||grad||       alpha      alpha0  # evals  Notes 
     103       14233.5   2.04969e-08       2755.74      0.7608      0.7608      137   
Optimization terminated normally: 
  Convergence detected: relative gradient magnitude is below tolerance
