[I 2020-10-01 03:40:16,135] Trial 344 finished with value: 0.04142243983397349 and parameters: {'changepoint_prior_scale': 0.001015686177830876, 'seasonality_prior_scale': 0.08036942034601383, 'holidays_prior_scale': 0.16177485555612414, 'seasonality_mode': 'additive', 'changepoint_range': 0.5819091046411642}. Best is trial 96 with value: 0.038883738900888705.
Initial log joint probability = -28.8311
    Iter      log prob        ||dx||      ||grad||       alpha      alpha0  # evals  Notes 
      99       18921.8    0.00687357       141.197           1           1      121   
    Iter      log prob        ||dx||      ||grad||       alpha      alpha0  # evals  Notes 
     199       18922.4     0.0120427       126.782           1           1      243   
    Iter      log prob        ||dx||      ||grad||       alpha      alpha0  # evals  Notes 
     276       18922.7   1.58464e-05       55.6082   2.304e-07       0.001      375  LS failed, Hessian reset 
     299       18922.7   0.000297363       53.9194      0.9087      0.9087      404   
    Iter      log prob        ||dx||      ||grad||       alpha      alpha0  # evals  Notes 
     373       18922.8   7.39637e-06       27.0858   2.137e-07       0.001      547  LS failed, Hessian reset 
     399       18922.9   9.13734e-05       20.7517      0.4827      0.4827      578   
    Iter      log prob        ||dx||      ||grad||       alpha      alpha0  # evals  Notes 
     499         18923   0.000581478       69.1764           1           1      700   
    Iter      log prob        ||dx||      ||grad||       alpha      alpha0  # evals  Notes 
     599       18923.1   1.03616e-05       28.6048      0.3855      0.3855      816   
    Iter      log prob        ||dx||      ||grad||       alpha      alpha0  # evals  Notes 
     613       18923.1   1.88553e-05       51.1628   5.579e-07       0.001      875  LS failed, Hessian reset 
     646       18923.1   3.31707e-06       15.5774      0.3534       0.953      918   
Optimization terminated normally: 
  Convergence detected: relative gradient magnitude is below tolerance
INFO:fbprophet:Making 5 forecasts with cutoffs between 2013-10-07 00:00:00 and 2015-10-18 00:00:00
INFO:fbprophet:Applying in parallel with <concurrent.futures.process.ProcessPoolExecutor object at 0x7fc84dbf9c10>
Initial log joint probability = -8.95172
    Iter      log prob        ||dx||      ||grad||       alpha      alpha0  # evals  Notes 
Initial log joint probability = -12.7302
    Iter      log prob        ||dx||      ||grad||       alpha      alpha0  # evals  Notes 
Initial log joint probability = -15.1549
    Iter      log prob        ||dx||      ||grad||       alpha      alpha0  # evals  Notes 
Initial log joint probability = -18.717
    Iter      log prob        ||dx||      ||grad||       alpha      alpha0  # evals  Notes 
Initial log joint probability = -23.5879
    Iter      log prob        ||dx||      ||grad||       alpha      alpha0  # evals  Notes 
      99        4679.5   2.98343e-05       23.3001           1           1      122   
    Iter      log prob        ||dx||      ||grad||       alpha      alpha0  # evals  Notes 
     129        4679.5   1.99474e-05         20.28    8.32e-07       0.001      206  LS failed, Hessian reset 
      99       7039.72   0.000493044        31.164       2.596      0.2596      122   
    Iter      log prob        ||dx||      ||grad||       alpha      alpha0  # evals  Notes 
     154        4679.5   6.94679e-07       23.4026      0.2267           1      241   
Optimization terminated normally: 
  Convergence detected: relative gradient magnitude is below tolerance
      99       9587.99    0.00028699       46.7554           1           1      121   
    Iter      log prob        ||dx||      ||grad||       alpha      alpha0  # evals  Notes 
      99       11819.5   0.000965944       136.565      0.2995           1      115   
    Iter      log prob        ||dx||      ||grad||       alpha      alpha0  # evals  Notes 
     179       7039.91   2.48231e-05       22.3237   4.004e-07       0.001      267  LS failed, Hessian reset 
     199       7039.93   0.000248554       24.7735           1           1      290   
    Iter      log prob        ||dx||      ||grad||       alpha      alpha0  # evals  Notes 
     227       7039.94   1.36754e-06       11.1762      0.8288      0.8288      331   
Optimization terminated normally: 
  Convergence detected: relative gradient magnitude is below tolerance
      99       14241.9    0.00170914       96.5002           1           1      120   
    Iter      log prob        ||dx||      ||grad||       alpha      alpha0  # evals  Notes 
     199       9588.78    0.00167546       58.8232      0.5854           1      231   
    Iter      log prob        ||dx||      ||grad||       alpha      alpha0  # evals  Notes 
     199         11820   0.000105417       32.1196           1           1      236   
    Iter      log prob        ||dx||      ||grad||       alpha      alpha0  # evals  Notes 
     299       9588.95    0.00211391       36.8861           1           1      352   
    Iter      log prob        ||dx||      ||grad||       alpha      alpha0  # evals  Notes 
     301       9588.95   2.90936e-05       44.7363   8.032e-07       0.001      408  LS failed, Hessian reset 
     199       14242.3   0.000116077       37.9781           1           1      241   
    Iter      log prob        ||dx||      ||grad||       alpha      alpha0  # evals  Notes 
     299       11820.3   9.42909e-05       86.7141      0.6103      0.6103      359   
    Iter      log prob        ||dx||      ||grad||       alpha      alpha0  # evals  Notes 
     393          9589   2.55852e-06       14.0626      0.4194      0.8305      526   
Optimization terminated normally: 
  Convergence detected: relative gradient magnitude is below tolerance
     213       14242.4   1.53394e-05       43.4066   3.092e-07       0.001      313  LS failed, Hessian reset 
     362       11820.3   1.15973e-05       25.9574   4.451e-07       0.001      474  LS failed, Hessian reset 
     399       11820.4   0.000268097       30.5974           1           1      524   
    Iter      log prob        ||dx||      ||grad||       alpha      alpha0  # evals  Notes 
     299       14242.7   0.000257998       21.7385           1           1      415   
    Iter      log prob        ||dx||      ||grad||       alpha      alpha0  # evals  Notes 
     424       11820.4    1.0174e-05       23.8704   5.036e-07       0.001      599  LS failed, Hessian reset 
     499       11820.4    0.00097665       24.0021           1           1      686   
    Iter      log prob        ||dx||      ||grad||       alpha      alpha0  # evals  Notes 
     399       14242.9   0.000238296       68.0001           1           1      538   
    Iter      log prob        ||dx||      ||grad||       alpha      alpha0  # evals  Notes 
     599       11820.5   2.66551e-05       23.1228      0.1391      0.6996      807   
    Iter      log prob        ||dx||      ||grad||       alpha      alpha0  # evals  Notes 
     610       11820.5   1.38425e-06       13.0488       0.115           1      823   
Optimization terminated normally: 
  Convergence detected: relative gradient magnitude is below tolerance
     461         14243   7.26628e-05       35.4929   1.629e-06       0.001      657  LS failed, Hessian reset 
     499         14243   2.30839e-05        23.542      0.7113      0.7113      703   
    Iter      log prob        ||dx||      ||grad||       alpha      alpha0  # evals  Notes 
     523       14243.1    2.2267e-05       53.6739   5.161e-07       0.001      775  LS failed, Hessian reset 
     599       14243.1   0.000511527       22.6784           1           1      865   
    Iter      log prob        ||dx||      ||grad||       alpha      alpha0  # evals  Notes 
     699       14243.2   4.35949e-05        19.176           1           1      989   
    Iter      log prob        ||dx||      ||grad||       alpha      alpha0  # evals  Notes 
     799       14243.2   0.000253314       56.0222           1           1     1120   
    Iter      log prob        ||dx||      ||grad||       alpha      alpha0  # evals  Notes 
     899       14243.2   0.000118445        16.164           1           1     1243   
    Iter      log prob        ||dx||      ||grad||       alpha      alpha0  # evals  Notes 
     937       14243.2   6.88871e-05       46.5471   3.009e-06       0.001     1331  LS failed, Hessian reset 
     999       14243.2   0.000345194       35.0689           1           1     1402   
    Iter      log prob        ||dx||      ||grad||       alpha      alpha0  # evals  Notes 
    1017       14243.2   2.99272e-06       14.9345           1           1     1422   
Optimization terminated normally: 
  Convergence detected: relative gradient magnitude is below tolerance
[I 2020-10-01 03:40:36,509] Trial 345 finished with value: 0.046652612382421355 and parameters: {'changepoint_prior_scale': 0.22230611336599487, 'seasonality_prior_scale': 0.19907469410386802, 'holidays_prior_scale': 2.2717019992203293, 'seasonality_mode': 'additive', 'changepoint_range': 0.5302183906920265}. Best is trial 96 with value: 0.038883738900888705.
Initial log joint probability = -28.8311
    Iter      log prob        ||dx||      ||grad||       alpha      alpha0  # evals  Notes 
      99       18912.9   8.97002e-06       2805.32           1           1      119   
    Iter      log prob        ||dx||      ||grad||       alpha      alpha0  # evals  Notes 
     100       18912.9   1.42184e-06       2403.87   5.068e-10       0.001      157  LS failed, Hessian reset 
     129       18912.9   6.09355e-09       2513.94      0.2268           1      191   
Optimization terminated normally: 
  Convergence detected: absolute parameter change was below tolerance
INFO:fbprophet:Making 5 forecasts with cutoffs between 2013-10-07 00:00:00 and 2015-10-18 00:00:00
INFO:fbprophet:Applying in parallel with <concurrent.futures.process.ProcessPoolExecutor object at 0x7fc84dc72c50>
Initial log joint probability = -8.95172
    Iter      log prob        ||dx||      ||grad||       alpha      alpha0  # evals  Notes 
Initial log joint probability = -12.7302
    Iter      log prob        ||dx||      ||grad||       alpha      alpha0  # evals  Notes 
Initial log joint probability = -15.1549
    Iter      log prob        ||dx||      ||grad||       alpha      alpha0  # evals  Notes 
Initial log joint probability = -18.717
    Iter      log prob        ||dx||      ||grad||       alpha      alpha0  # evals  Notes 
      67       4677.92   4.42721e-09       2557.91      0.2629      0.2629       88   
Optimization terminated normally: 
  Convergence detected: absolute parameter change was below tolerance
Initial log joint probability = -23.5879
    Iter      log prob        ||dx||      ||grad||       alpha      alpha0  # evals  Notes 
      99       7031.54   0.000601959       2404.14           1           1      125   
    Iter      log prob        ||dx||      ||grad||       alpha      alpha0  # evals  Notes 
      57       9582.48   6.17103e-09       2249.21      0.2929      0.2929       78   
Optimization terminated normally: 
  Convergence detected: absolute parameter change was below tolerance
      55       11813.3   7.31948e-09       2623.04      0.4825      0.4825       81   
Optimization terminated normally: 
  Convergence detected: absolute parameter change was below tolerance
     172       7032.13    3.1462e-09       2485.88      0.3608      0.3608      220   
Optimization terminated normally: 
  Convergence detected: absolute parameter change was below tolerance
      99       14233.3    1.4331e-07       2193.97      0.5023      0.5023      127   
    Iter      log prob        ||dx||      ||grad||       alpha      alpha0  # evals  Notes 
     110       14233.3   1.04161e-08       2465.93       0.387           1      145   
Optimization terminated normally: 
  Convergence detected: relative gradient magnitude is below tolerance
[I 2020-10-01 03:40:52,661] Trial 346 finished with value: 0.04248401737144018 and parameters: {'changepoint_prior_scale': 0.0018771812832781665, 'seasonality_prior_scale': 0.12214297156153783, 'holidays_prior_scale': 0.0789676007908244, 'seasonality_mode': 'additive', 'changepoint_range': 0.5506296728320023}. Best is trial 96 with value: 0.038883738900888705.
Initial log joint probability = -28.8311
    Iter      log prob        ||dx||      ||grad||       alpha      alpha0  # evals  Notes 
      99       18912.8   2.31188e-06       2604.19      0.2956      0.7799      132   
    Iter      log prob        ||dx||      ||grad||       alpha      alpha0  # evals  Notes 
     129       18912.8    8.3235e-09       2622.14      0.3519      0.3519      172   
Optimization terminated normally: 
  Convergence detected: absolute parameter change was below tolerance
INFO:fbprophet:Making 5 forecasts with cutoffs between 2013-10-07 00:00:00 and 2015-10-18 00:00:00
INFO:fbprophet:Applying in parallel with <concurrent.futures.process.ProcessPoolExecutor object at 0x7fc84dc9cc10>
Initial log joint probability = -8.95172
    Iter      log prob        ||dx||      ||grad||       alpha      alpha0  # evals  Notes 
Initial log joint probability = -12.7302
    Iter      log prob        ||dx||      ||grad||       alpha      alpha0  # evals  Notes 
      59       4679.22     3.528e-09       3120.52      0.2579      0.2579       79   
Optimization terminated normally: 
  Convergence detected: absolute parameter change was below tolerance
Initial log joint probability = -15.1549
    Iter      log prob        ||dx||      ||grad||       alpha      alpha0  # evals  Notes 
Initial log joint probability = -18.717
    Iter      log prob        ||dx||      ||grad||       alpha      alpha0  # evals  Notes 
Initial log joint probability = -23.5879
    Iter      log prob        ||dx||      ||grad||       alpha      alpha0  # evals  Notes 
      99       7029.56   1.39409e-06       3490.62      0.6153      0.6153      124   
    Iter      log prob        ||dx||      ||grad||       alpha      alpha0  # evals  Notes 
      70       9582.46    8.6856e-09       3003.01      0.1869      0.1869       95   
Optimization terminated normally: 
  Convergence detected: absolute parameter change was below tolerance
     168       7032.05   3.13491e-09       3225.81     0.05538     0.05538      217   
Optimization terminated normally: 
  Convergence detected: absolute parameter change was below tolerance
      71       11813.3   1.05422e-08       3185.86      0.6825      0.6825       96   
Optimization terminated normally: 
  Convergence detected: relative gradient magnitude is below tolerance
      99       14231.4   9.14861e-07       2428.14      0.5107      0.5107      134   
    Iter      log prob        ||dx||      ||grad||       alpha      alpha0  # evals  Notes 
     199       14232.4   2.69879e-08       3127.37      0.1206      0.1206      261   
    Iter      log prob        ||dx||      ||grad||       alpha      alpha0  # evals  Notes 
     215       14232.4   2.70832e-08       2954.96           1           1      280   
Optimization terminated normally: 
  Convergence detected: relative gradient magnitude is below tolerance
[I 2020-10-01 03:41:07,852] Trial 347 finished with value: 0.04193392329283037 and parameters: {'changepoint_prior_scale': 0.0015420768541659236, 'seasonality_prior_scale': 0.16788700656265115, 'holidays_prior_scale': 0.13623532767234373, 'seasonality_mode': 'additive', 'changepoint_range': 0.5424677358415027}. Best is trial 96 with value: 0.038883738900888705.
Initial log joint probability = -28.8311
    Iter      log prob        ||dx||      ||grad||       alpha      alpha0  # evals  Notes 
      99       18912.3   1.83196e-05       4007.25      0.8361      0.8361      122   
    Iter      log prob        ||dx||      ||grad||       alpha      alpha0  # evals  Notes 
     134       18912.4   1.00016e-08       3889.03      0.3348           1      169   
Optimization terminated normally: 
  Convergence detected: relative gradient magnitude is below tolerance
INFO:fbprophet:Making 5 forecasts with cutoffs between 2013-10-07 00:00:00 and 2015-10-18 00:00:00
INFO:fbprophet:Applying in parallel with <concurrent.futures.process.ProcessPoolExecutor object at 0x7fc84dc25b50>
Initial log joint probability = -8.95172
    Iter      log prob        ||dx||      ||grad||       alpha      alpha0  # evals  Notes 
Initial log joint probability = -12.7302
    Iter      log prob        ||dx||      ||grad||       alpha      alpha0  # evals  Notes 
Initial log joint probability = -15.1549
    Iter      log prob        ||dx||      ||grad||       alpha      alpha0  # evals  Notes 
Initial log joint probability = -18.717
    Iter      log prob        ||dx||      ||grad||       alpha      alpha0  # evals  Notes 
      68       4678.99   5.33303e-09       4011.49      0.5069      0.5069       92   
Optimization terminated normally: 
  Convergence detected: absolute parameter change was below tolerance
Initial log joint probability = -23.5879
    Iter      log prob        ||dx||      ||grad||       alpha      alpha0  # evals  Notes 
      85       7028.62   2.61539e-05       3778.86   6.556e-09       0.001      146  LS failed, Hessian reset 
      68       9582.41   3.92453e-10       4126.59    0.001288           1      100   
Optimization terminated normally: 
  Convergence detected: absolute parameter change was below tolerance
      99       7028.79   1.10316e-06        3734.5      0.3544           1      163   
    Iter      log prob        ||dx||      ||grad||       alpha      alpha0  # evals  Notes 
     140       7028.81   4.42119e-09       4233.98      0.3536      0.3536      221   
Optimization terminated normally: 
  Convergence detected: absolute parameter change was below tolerance
      82       11813.1   4.25475e-09        4037.8      0.2112      0.2112      108   
Optimization terminated normally: 
  Convergence detected: absolute parameter change was below tolerance
      99       14233.4   5.99407e-07          3832           1           1      133   
    Iter      log prob        ||dx||      ||grad||       alpha      alpha0  # evals  Notes 
     117       14233.4   1.85498e-08       4056.98      0.2167           1      156   
Optimization terminated normally: 
  Convergence detected: relative gradient magnitude is below tolerance
[I 2020-10-01 03:41:23,801] Trial 348 finished with value: 0.040868622850153205 and parameters: {'changepoint_prior_scale': 0.0012402252525731076, 'seasonality_prior_scale': 0.144265465128616, 'holidays_prior_scale': 0.09770251900519322, 'seasonality_mode': 'additive', 'changepoint_range': 0.5654460988836073}. Best is trial 96 with value: 0.038883738900888705.
Initial log joint probability = -28.8311
    Iter      log prob        ||dx||      ||grad||       alpha      alpha0  # evals  Notes 
      99       18912.7    2.8005e-05       4567.49      0.3567      0.3567      125   
    Iter      log prob        ||dx||      ||grad||       alpha      alpha0  # evals  Notes 
     158       18912.8   2.67547e-06       4797.24   6.119e-10       0.001      255  LS failed, Hessian reset 
     184       18912.8   4.54573e-09       4439.72      0.1741      0.1741      294   
Optimization terminated normally: 
  Convergence detected: absolute parameter change was below tolerance
INFO:fbprophet:Making 5 forecasts with cutoffs between 2013-10-07 00:00:00 and 2015-10-18 00:00:00
INFO:fbprophet:Applying in parallel with <concurrent.futures.process.ProcessPoolExecutor object at 0x7fc84dbe8590>
Initial log joint probability = -8.95172
    Iter      log prob        ||dx||      ||grad||       alpha      alpha0  # evals  Notes 
Initial log joint probability = -12.7302
    Iter      log prob        ||dx||      ||grad||       alpha      alpha0  # evals  Notes 
Initial log joint probability = -15.1549
    Iter      log prob        ||dx||      ||grad||       alpha      alpha0  # evals  Notes 
Initial log joint probability = -18.717
    Iter      log prob        ||dx||      ||grad||       alpha      alpha0  # evals  Notes 
      59       4679.16   8.28524e-09       3991.58      0.1654      0.1654       79   
Optimization terminated normally: 
  Convergence detected: absolute parameter change was below tolerance
Initial log joint probability = -23.5879
    Iter      log prob        ||dx||      ||grad||       alpha      alpha0  # evals  Notes 
      99       7028.85   4.12643e-08       4536.33      0.4589      0.4589      127   
    Iter      log prob        ||dx||      ||grad||       alpha      alpha0  # evals  Notes 
      59       9582.39   4.21989e-09       3947.06      0.1692      0.1692       86   
Optimization terminated normally: 
  Convergence detected: absolute parameter change was below tolerance
     117       7028.85   9.79658e-09       4308.72      0.2732      0.2732      150   
Optimization terminated normally: 
  Convergence detected: absolute parameter change was below tolerance
      53       11813.1   9.02209e-09       4408.54      0.5798      0.5798       77   
Optimization terminated normally: 
  Convergence detected: absolute parameter change was below tolerance
      99       14233.3   1.93285e-06       4485.18      0.8523      0.8523      123   
    Iter      log prob        ||dx||      ||grad||       alpha      alpha0  # evals  Notes 
     115       14233.3   1.17432e-08       4197.21      0.3672           1      147   
Optimization terminated normally: 
  Convergence detected: relative gradient magnitude is below tolerance
