[I 2020-10-01 03:03:01,319] Trial 198 finished with value: 0.042108228466318766 and parameters: {'changepoint_prior_scale': 0.0014699269162413507, 'seasonality_prior_scale': 0.21313417983049626, 'holidays_prior_scale': 0.07613209576178134, 'seasonality_mode': 'additive', 'changepoint_range': 0.5958271110964911}. Best is trial 96 with value: 0.038883738900888705.
Initial log joint probability = -28.8311
    Iter      log prob        ||dx||      ||grad||       alpha      alpha0  # evals  Notes 
      99         18913   6.71061e-07       3916.36      0.2769      0.2769      120   
    Iter      log prob        ||dx||      ||grad||       alpha      alpha0  # evals  Notes 
     125         18913   4.96246e-09        3925.9      0.1885      0.1885      155   
Optimization terminated normally: 
  Convergence detected: absolute parameter change was below tolerance
INFO:fbprophet:Making 5 forecasts with cutoffs between 2013-10-07 00:00:00 and 2015-10-18 00:00:00
INFO:fbprophet:Applying in parallel with <concurrent.futures.process.ProcessPoolExecutor object at 0x7fc84dc6ff90>
Initial log joint probability = -8.95172
    Iter      log prob        ||dx||      ||grad||       alpha      alpha0  # evals  Notes 
Initial log joint probability = -12.7302
    Iter      log prob        ||dx||      ||grad||       alpha      alpha0  # evals  Notes 
Initial log joint probability = -15.1549
    Iter      log prob        ||dx||      ||grad||       alpha      alpha0  # evals  Notes 
Initial log joint probability = -18.717
    Iter      log prob        ||dx||      ||grad||       alpha      alpha0  # evals  Notes 
Initial log joint probability = -23.5879
    Iter      log prob        ||dx||      ||grad||       alpha      alpha0  # evals  Notes 
      74          4679   9.70623e-07       4021.89    2.39e-10       0.001      139  LS failed, Hessian reset 
      90       4679.01    5.1984e-09       3942.61      0.3944      0.3944      161   
Optimization terminated normally: 
  Convergence detected: absolute parameter change was below tolerance
      59        9582.5   9.97167e-09        3769.8           1           1       79   
Optimization terminated normally: 
  Convergence detected: absolute parameter change was below tolerance
      99       7028.53   3.85548e-06       3941.06           1           1      133   
    Iter      log prob        ||dx||      ||grad||       alpha      alpha0  # evals  Notes 
     119       7028.55   1.35741e-06       4246.61   3.653e-10       0.001      194  LS failed, Hessian reset 
     161       7028.55   8.94229e-09       3785.11      0.4298      0.4298      248   
Optimization terminated normally: 
  Convergence detected: absolute parameter change was below tolerance
      62       11813.2   1.55466e-05       3735.37   3.809e-09       0.001      139  LS failed, Hessian reset 
      99       14232.7   7.00865e-08       4093.51           1           1      130   
    Iter      log prob        ||dx||      ||grad||       alpha      alpha0  # evals  Notes 
     104       14232.7    1.7821e-08       4197.24           1           1      138   
Optimization terminated normally: 
  Convergence detected: relative gradient magnitude is below tolerance
      95       11813.2   6.91249e-09       3827.27      0.3683      0.3683      183   
Optimization terminated normally: 
  Convergence detected: absolute parameter change was below tolerance
[I 2020-10-01 03:03:11,767] Trial 199 finished with value: 0.04093071778775013 and parameters: {'changepoint_prior_scale': 0.0012542646985723768, 'seasonality_prior_scale': 0.3600729526574252, 'holidays_prior_scale': 0.12245871948492708, 'seasonality_mode': 'additive', 'changepoint_range': 0.8300074939888714}. Best is trial 96 with value: 0.038883738900888705.
Initial log joint probability = -28.8311
    Iter      log prob        ||dx||      ||grad||       alpha      alpha0  # evals  Notes 
      99       18911.5     3.608e-06       4001.87      0.9689      0.2525      127   
    Iter      log prob        ||dx||      ||grad||       alpha      alpha0  # evals  Notes 
     199       18911.9   1.52846e-07       2923.38           1           1      260   
    Iter      log prob        ||dx||      ||grad||       alpha      alpha0  # evals  Notes 
     205       18911.9   2.16951e-08       2893.54      0.6189      0.6189      268   
Optimization terminated normally: 
  Convergence detected: relative gradient magnitude is below tolerance
INFO:fbprophet:Making 5 forecasts with cutoffs between 2013-10-07 00:00:00 and 2015-10-18 00:00:00
INFO:fbprophet:Applying in parallel with <concurrent.futures.process.ProcessPoolExecutor object at 0x7fc84dbe8fd0>
Initial log joint probability = -8.95172
    Iter      log prob        ||dx||      ||grad||       alpha      alpha0  # evals  Notes 
Initial log joint probability = -12.7302
    Iter      log prob        ||dx||      ||grad||       alpha      alpha0  # evals  Notes 
Initial log joint probability = -15.1549
    Iter      log prob        ||dx||      ||grad||       alpha      alpha0  # evals  Notes 
Initial log joint probability = -18.717
    Iter      log prob        ||dx||      ||grad||       alpha      alpha0  # evals  Notes 
      81       4678.91   1.48067e-05       4333.82   3.238e-09       0.001      160  LS failed, Hessian reset 
Initial log joint probability = -23.5879
    Iter      log prob        ||dx||      ||grad||       alpha      alpha0  # evals  Notes 
      99       4678.98   6.86485e-06       4351.21      0.8884      0.8884      181   
    Iter      log prob        ||dx||      ||grad||       alpha      alpha0  # evals  Notes 
     130       4679.17   5.69493e-09       4527.55      0.1939      0.1939      230   
Optimization terminated normally: 
  Convergence detected: absolute parameter change was below tolerance
      60        9582.4   6.17307e-09       4659.44      0.4622      0.4622       84   
Optimization terminated normally: 
  Convergence detected: absolute parameter change was below tolerance
      92       7028.03   3.45382e-05       4462.94    8.53e-09       0.001      155  LS failed, Hessian reset 
      99        7028.1    1.8221e-06       3206.54      0.5098      0.5098      163   
    Iter      log prob        ||dx||      ||grad||       alpha      alpha0  # evals  Notes 
      56       11812.9    8.2129e-09       4306.16      0.4092      0.4092       76   
Optimization terminated normally: 
  Convergence detected: absolute parameter change was below tolerance
     167       7028.44   6.44925e-05       4305.01   1.381e-08       0.001      288  LS failed, Hessian reset 
     199       7028.63   4.52107e-08       4092.95      0.3162           1      331   
    Iter      log prob        ||dx||      ||grad||       alpha      alpha0  # evals  Notes 
     205       7028.63   5.96014e-09       3609.22      0.2902      0.2902      338   
Optimization terminated normally: 
  Convergence detected: absolute parameter change was below tolerance
      99       14230.9   6.35522e-07       4505.94      0.2977      0.2977      123   
    Iter      log prob        ||dx||      ||grad||       alpha      alpha0  # evals  Notes 
     117       14230.9   7.89489e-09       4320.72      0.4799      0.4799      142   
Optimization terminated normally: 
  Convergence detected: absolute parameter change was below tolerance
[I 2020-10-01 03:03:26,294] Trial 200 finished with value: 0.04110158664909559 and parameters: {'changepoint_prior_scale': 0.0011252455605479542, 'seasonality_prior_scale': 0.232010216158709, 'holidays_prior_scale': 0.0838174651858653, 'seasonality_mode': 'additive', 'changepoint_range': 0.5655097498683407}. Best is trial 96 with value: 0.038883738900888705.
Initial log joint probability = -28.8311
    Iter      log prob        ||dx||      ||grad||       alpha      alpha0  # evals  Notes 
      99       18911.8   1.91971e-06        5165.9      0.4044      0.4044      114   
    Iter      log prob        ||dx||      ||grad||       alpha      alpha0  # evals  Notes 
     155       18912.4   9.65874e-09       3827.43      0.2594      0.2594      182   
Optimization terminated normally: 
  Convergence detected: absolute parameter change was below tolerance
INFO:fbprophet:Making 5 forecasts with cutoffs between 2013-10-07 00:00:00 and 2015-10-18 00:00:00
INFO:fbprophet:Applying in parallel with <concurrent.futures.process.ProcessPoolExecutor object at 0x7fc88e67f610>
Initial log joint probability = -8.95172
    Iter      log prob        ||dx||      ||grad||       alpha      alpha0  # evals  Notes 
Initial log joint probability = -12.7302
    Iter      log prob        ||dx||      ||grad||       alpha      alpha0  # evals  Notes 
Initial log joint probability = -15.1549
    Iter      log prob        ||dx||      ||grad||       alpha      alpha0  # evals  Notes 
Initial log joint probability = -18.717
    Iter      log prob        ||dx||      ||grad||       alpha      alpha0  # evals  Notes 
Initial log joint probability = -23.5879
    Iter      log prob        ||dx||      ||grad||       alpha      alpha0  # evals  Notes 
      72       4672.38   6.49173e-09       4914.43      0.9318      0.9318       96   
Optimization terminated normally: 
  Convergence detected: absolute parameter change was below tolerance
      99       7028.28   2.46695e-07       3829.49      0.5877      0.5877      125   
    Iter      log prob        ||dx||      ||grad||       alpha      alpha0  # evals  Notes 
      60       9582.17    3.3295e-09       5066.31      0.4605      0.4605       79   
Optimization terminated normally: 
  Convergence detected: absolute parameter change was below tolerance
     110       7028.28    2.4462e-09       4627.47      0.1347      0.1347      139   
Optimization terminated normally: 
  Convergence detected: absolute parameter change was below tolerance
      42       11811.5   0.000186425        5300.9   3.526e-08       0.001      123  LS failed, Hessian reset 
      99       14233.3   3.82756e-07       5007.82      0.4604           1      131   
    Iter      log prob        ||dx||      ||grad||       alpha      alpha0  # evals  Notes 
      90       11812.8   7.64268e-09       4872.58       0.473       0.473      183   
Optimization terminated normally: 
  Convergence detected: absolute parameter change was below tolerance
     116       14233.3   3.83291e-09        4662.1      0.5078      0.5078      150   
Optimization terminated normally: 
  Convergence detected: absolute parameter change was below tolerance
[I 2020-10-01 03:03:42,014] Trial 201 finished with value: 0.03978485890642193 and parameters: {'changepoint_prior_scale': 0.0010185013918100872, 'seasonality_prior_scale': 0.11033868710592472, 'holidays_prior_scale': 2.927428788425536, 'seasonality_mode': 'additive', 'changepoint_range': 0.5244597906975007}. Best is trial 96 with value: 0.038883738900888705.
Initial log joint probability = -28.8311
    Iter      log prob        ||dx||      ||grad||       alpha      alpha0  # evals  Notes 
      99       18911.5   2.70704e-07       4544.35           1           1      128   
    Iter      log prob        ||dx||      ||grad||       alpha      alpha0  # evals  Notes 
     113       18911.5   1.76276e-08       4489.61      0.2853           1      145   
Optimization terminated normally: 
  Convergence detected: relative gradient magnitude is below tolerance
INFO:fbprophet:Making 5 forecasts with cutoffs between 2013-10-07 00:00:00 and 2015-10-18 00:00:00
INFO:fbprophet:Applying in parallel with <concurrent.futures.process.ProcessPoolExecutor object at 0x7fc84dc67350>
Initial log joint probability = -8.95172
    Iter      log prob        ||dx||      ||grad||       alpha      alpha0  # evals  Notes 
Initial log joint probability = -12.7302
    Iter      log prob        ||dx||      ||grad||       alpha      alpha0  # evals  Notes 
Initial log joint probability = -15.1549
    Iter      log prob        ||dx||      ||grad||       alpha      alpha0  # evals  Notes 
Initial log joint probability = -18.717
    Iter      log prob        ||dx||      ||grad||       alpha      alpha0  # evals  Notes 
Initial log joint probability = -23.5879
      71       4673.42   7.48439e-09       4919.18      0.6273      0.6273       94   
Optimization terminated normally: 
  Convergence detected: absolute parameter change was below tolerance
    Iter      log prob        ||dx||      ||grad||       alpha      alpha0  # evals  Notes 
      51        9581.8   9.87847e-09       4668.71      0.1863      0.1863       69   
Optimization terminated normally: 
  Convergence detected: absolute parameter change was below tolerance
      93       7028.36   2.21894e-05       4614.14   4.835e-09       0.001      161  LS failed, Hessian reset 
      99       7028.47   7.80936e-06       4727.73      0.7879      0.7879      168   
    Iter      log prob        ||dx||      ||grad||       alpha      alpha0  # evals  Notes 
      27       11811.9   0.000400594       4922.67   8.085e-08       0.001       87  LS failed, Hessian reset 
     133        7028.5    5.4402e-09       4626.74      0.5618      0.5618      213   
Optimization terminated normally: 
  Convergence detected: absolute parameter change was below tolerance
      65       11813.2   5.30171e-09        4788.9      0.2772      0.2772      140   
Optimization terminated normally: 
  Convergence detected: absolute parameter change was below tolerance
      99         14233   8.13293e-07       4790.98      0.1311      0.1311      125   
    Iter      log prob        ||dx||      ||grad||       alpha      alpha0  # evals  Notes 
     133       14233.1   6.84348e-06       4787.18   1.375e-09       0.001      222  LS failed, Hessian reset 
     168       14233.2   5.68682e-09        4201.9      0.2584      0.2584      266   
Optimization terminated normally: 
  Convergence detected: absolute parameter change was below tolerance
[I 2020-10-01 03:03:57,698] Trial 202 finished with value: 0.04006252556704219 and parameters: {'changepoint_prior_scale': 0.0010123049796308694, 'seasonality_prior_scale': 0.11531253107621996, 'holidays_prior_scale': 2.5521398629849665, 'seasonality_mode': 'additive', 'changepoint_range': 0.5236023308376306}. Best is trial 96 with value: 0.038883738900888705.
Initial log joint probability = -28.8311
    Iter      log prob        ||dx||      ||grad||       alpha      alpha0  # evals  Notes 
      99       18912.5   5.71117e-07       3309.18           1           1      120   
    Iter      log prob        ||dx||      ||grad||       alpha      alpha0  # evals  Notes 
     114       18912.5   2.01217e-08       3668.28       0.654       0.654      141   
Optimization terminated normally: 
  Convergence detected: relative gradient magnitude is below tolerance
INFO:fbprophet:Making 5 forecasts with cutoffs between 2013-10-07 00:00:00 and 2015-10-18 00:00:00
INFO:fbprophet:Applying in parallel with <concurrent.futures.process.ProcessPoolExecutor object at 0x7fc84dbe8750>
Initial log joint probability = -8.95172
    Iter      log prob        ||dx||      ||grad||       alpha      alpha0  # evals  Notes 
Initial log joint probability = -12.7302
    Iter      log prob        ||dx||      ||grad||       alpha      alpha0  # evals  Notes 
Initial log joint probability = -15.1549
    Iter      log prob        ||dx||      ||grad||       alpha      alpha0  # evals  Notes 
Initial log joint probability = -18.717
    Iter      log prob        ||dx||      ||grad||       alpha      alpha0  # evals  Notes 
Initial log joint probability = -23.5879
    Iter      log prob        ||dx||      ||grad||       alpha      alpha0  # evals  Notes 
      73       4672.31   5.25533e-09       3734.02      0.2464      0.2464       96   
Optimization terminated normally: 
  Convergence detected: absolute parameter change was below tolerance
      65       7028.86   3.78148e-05       3744.45   1.027e-08       0.001      127  LS failed, Hessian reset 
      99       7028.95   9.88887e-09        3781.3      0.2622      0.2622      169   
Optimization terminated normally: 
  Convergence detected: absolute parameter change was below tolerance
      99       9582.45   1.53624e-06       3472.37           1           1      129   
    Iter      log prob        ||dx||      ||grad||       alpha      alpha0  # evals  Notes 
     120       9582.45     7.555e-09       3602.81      0.2653      0.2653      157   
Optimization terminated normally: 
  Convergence detected: absolute parameter change was below tolerance
      97       11813.3   5.87741e-09       3772.69      0.2508      0.2508      130   
Optimization terminated normally: 
  Convergence detected: absolute parameter change was below tolerance
      99         14233   1.10685e-08       3447.06      0.2909           1      129   
    Iter      log prob        ||dx||      ||grad||       alpha      alpha0  # evals  Notes 
     105         14233   1.23268e-07       3780.47   3.355e-11       0.001      177  LS failed, Hessian reset 
     112         14233   1.11601e-08       3389.93      0.2518           1      186   
Optimization terminated normally: 
  Convergence detected: relative gradient magnitude is below tolerance
[I 2020-10-01 03:04:12,059] Trial 203 finished with value: 0.03992723960756084 and parameters: {'changepoint_prior_scale': 0.0013501069345784017, 'seasonality_prior_scale': 0.11146724849236103, 'holidays_prior_scale': 2.541173320742529, 'seasonality_mode': 'additive', 'changepoint_range': 0.5300091295123577}. Best is trial 96 with value: 0.038883738900888705.
Initial log joint probability = -28.8311
    Iter      log prob        ||dx||      ||grad||       alpha      alpha0  # evals  Notes 
      99       18912.7   4.58579e-07       3789.58      0.5527      0.5527      122   
    Iter      log prob        ||dx||      ||grad||       alpha      alpha0  # evals  Notes 
     169         18913   5.69037e-08       3536.05    1.59e-11       0.001      252  LS failed, Hessian reset 
     172         18913   3.39568e-08       3249.58           1           1      255   
Optimization terminated normally: 
  Convergence detected: relative gradient magnitude is below tolerance
INFO:fbprophet:Making 5 forecasts with cutoffs between 2013-10-07 00:00:00 and 2015-10-18 00:00:00
INFO:fbprophet:Applying in parallel with <concurrent.futures.process.ProcessPoolExecutor object at 0x7fc84dc4d950>
Initial log joint probability = -8.95172
    Iter      log prob        ||dx||      ||grad||       alpha      alpha0  # evals  Notes 
Initial log joint probability = -12.7302
    Iter      log prob        ||dx||      ||grad||       alpha      alpha0  # evals  Notes 
Initial log joint probability = -15.1549
    Iter      log prob        ||dx||      ||grad||       alpha      alpha0  # evals  Notes 
Initial log joint probability = -18.717
    Iter      log prob        ||dx||      ||grad||       alpha      alpha0  # evals  Notes 
Initial log joint probability = -23.5879
    Iter      log prob        ||dx||      ||grad||       alpha      alpha0  # evals  Notes 
      87       4678.76   5.90478e-09       3538.38      0.4047      0.4047      112   
Optimization terminated normally: 
  Convergence detected: absolute parameter change was below tolerance
      99       7029.16   2.54475e-07       3589.51      0.2968      0.6935      122   
    Iter      log prob        ||dx||      ||grad||       alpha      alpha0  # evals  Notes 
     116       7029.16   9.95715e-09       3037.79      0.6549      0.6549      143   
Optimization terminated normally: 
  Convergence detected: absolute parameter change was below tolerance
      59       9582.35   5.85702e-06       3540.19   1.706e-09       0.001      116  LS failed, Hessian reset 
      83       9582.37   5.76692e-09       3060.51       0.162       0.162      155   
Optimization terminated normally: 
  Convergence detected: absolute parameter change was below tolerance
      43       11811.6   0.000192455       3353.49   5.006e-08       0.001      131  LS failed, Hessian reset 
      99         14233    6.9866e-06       3699.79      0.7211      0.7211      120   
    Iter      log prob        ||dx||      ||grad||       alpha      alpha0  # evals  Notes 
      99       11812.8   1.21332e-07       3640.67           1           1      200   
    Iter      log prob        ||dx||      ||grad||       alpha      alpha0  # evals  Notes 
     162       14233.1   2.51528e-08       3536.77           1           1      195   
Optimization terminated normally: 
  Convergence detected: relative gradient magnitude is below tolerance
     127       11812.8   1.65557e-08       3644.56           1           1      234   
Optimization terminated normally: 
  Convergence detected: relative gradient magnitude is below tolerance
