[I 2020-10-01 03:43:09,842] Trial 355 finished with value: 0.04153713304402941 and parameters: {'changepoint_prior_scale': 0.001349264969885023, 'seasonality_prior_scale': 0.5427220605179915, 'holidays_prior_scale': 0.16830486261669575, 'seasonality_mode': 'additive', 'changepoint_range': 0.5194143111834949}. Best is trial 96 with value: 0.038883738900888705.
Initial log joint probability = -28.8311
    Iter      log prob        ||dx||      ||grad||       alpha      alpha0  # evals  Notes 
      99       18912.7   1.55678e-07       2827.95      0.3143           1      133   
    Iter      log prob        ||dx||      ||grad||       alpha      alpha0  # evals  Notes 
     123       18912.7   1.86327e-08       2877.66      0.3208           1      165   
Optimization terminated normally: 
  Convergence detected: relative gradient magnitude is below tolerance
INFO:fbprophet:Making 5 forecasts with cutoffs between 2013-10-07 00:00:00 and 2015-10-18 00:00:00
INFO:fbprophet:Applying in parallel with <concurrent.futures.process.ProcessPoolExecutor object at 0x7fc84dc78750>
Initial log joint probability = -8.95172
    Iter      log prob        ||dx||      ||grad||       alpha      alpha0  # evals  Notes 
Initial log joint probability = -12.7302
    Iter      log prob        ||dx||      ||grad||       alpha      alpha0  # evals  Notes 
Initial log joint probability = -15.1549
    Iter      log prob        ||dx||      ||grad||       alpha      alpha0  # evals  Notes 
Initial log joint probability = -18.717
    Iter      log prob        ||dx||      ||grad||       alpha      alpha0  # evals  Notes 
Initial log joint probability = -23.5879
    Iter      log prob        ||dx||      ||grad||       alpha      alpha0  # evals  Notes 
      51       4678.28   0.000235938       2864.95   8.278e-08       0.001      135  LS failed, Hessian reset 
      99       7031.66   0.000399567       2841.91      0.6405      0.6405      118   
    Iter      log prob        ||dx||      ||grad||       alpha      alpha0  # evals  Notes 
      98       4679.14   5.98777e-05       2878.55   2.094e-08       0.001      247  LS failed, Hessian reset 
      99        4679.2   2.74133e-05       2909.73           1           1      248   
    Iter      log prob        ||dx||      ||grad||       alpha      alpha0  # evals  Notes 
      69       9582.56   9.04547e-09       3053.04      0.4857      0.4857       94   
Optimization terminated normally: 
  Convergence detected: absolute parameter change was below tolerance
     138       7031.92   8.80817e-09       2795.36           1           1      168   
Optimization terminated normally: 
  Convergence detected: absolute parameter change was below tolerance
     133        4679.4   7.61543e-06       2916.04   2.732e-09       0.001      332  LS failed, Hessian reset 
     161       4679.43   7.22641e-07       2911.87   2.578e-10       0.001      406  LS failed, Hessian reset 
     182       4679.43   7.81974e-09       2834.75      0.6983      0.6983      433   
Optimization terminated normally: 
  Convergence detected: absolute parameter change was below tolerance
      59       11813.3   1.14575e-06       2832.34   3.787e-10       0.001      126  LS failed, Hessian reset 
      78       11813.3    1.2418e-08       2687.54      0.2883      0.2883      150   
Optimization terminated normally: 
  Convergence detected: relative gradient magnitude is below tolerance
      99       14233.4   2.04377e-07       2596.32           1           1      134   
    Iter      log prob        ||dx||      ||grad||       alpha      alpha0  # evals  Notes 
     132       14233.4   2.85449e-07       2673.95   1.273e-10       0.001      223  LS failed, Hessian reset 
     145       14233.4   3.69599e-08        1908.3           1           1      240   
Optimization terminated normally: 
  Convergence detected: relative gradient magnitude is below tolerance
[I 2020-10-01 03:43:24,424] Trial 356 finished with value: 0.04176002284483118 and parameters: {'changepoint_prior_scale': 0.001755121848450406, 'seasonality_prior_scale': 0.45978467455530103, 'holidays_prior_scale': 0.15055501287912224, 'seasonality_mode': 'additive', 'changepoint_range': 0.5397950191564238}. Best is trial 96 with value: 0.038883738900888705.
Initial log joint probability = -28.8311
    Iter      log prob        ||dx||      ||grad||       alpha      alpha0  # evals  Notes 
      99       18912.9   9.67542e-08       3160.91      0.3531           1      127   
    Iter      log prob        ||dx||      ||grad||       alpha      alpha0  # evals  Notes 
     108       18912.9   1.50721e-08       3736.43      0.3647      0.9894      139   
Optimization terminated normally: 
  Convergence detected: relative gradient magnitude is below tolerance
INFO:fbprophet:Making 5 forecasts with cutoffs between 2013-10-07 00:00:00 and 2015-10-18 00:00:00
INFO:fbprophet:Applying in parallel with <concurrent.futures.process.ProcessPoolExecutor object at 0x7fc84dbf38d0>
Initial log joint probability = -8.95172
    Iter      log prob        ||dx||      ||grad||       alpha      alpha0  # evals  Notes 
Initial log joint probability = -12.7302
    Iter      log prob        ||dx||      ||grad||       alpha      alpha0  # evals  Notes 
Initial log joint probability = -15.1549
    Iter      log prob        ||dx||      ||grad||       alpha      alpha0  # evals  Notes 
Initial log joint probability = -18.717
    Iter      log prob        ||dx||      ||grad||       alpha      alpha0  # evals  Notes 
      58       4679.18   9.92386e-09       3161.29     0.01467           1       78   
Optimization terminated normally: 
  Convergence detected: absolute parameter change was below tolerance
Initial log joint probability = -23.5879
    Iter      log prob        ||dx||      ||grad||       alpha      alpha0  # evals  Notes 
      99       7029.26   4.79552e-07       3418.91      0.8081      0.8081      128   
    Iter      log prob        ||dx||      ||grad||       alpha      alpha0  # evals  Notes 
     116       7029.26   3.93163e-07       3163.88   1.112e-10       0.001      185  LS failed, Hessian reset 
      87       9582.46   8.71965e-09       2704.74      0.3817      0.3817      117   
Optimization terminated normally: 
  Convergence detected: absolute parameter change was below tolerance
      30       11811.7   0.000324363       3269.84   9.825e-08       0.001       89  LS failed, Hessian reset 
     130       7029.26   9.19642e-09       3275.65      0.6905      0.6905      201   
Optimization terminated normally: 
  Convergence detected: absolute parameter change was below tolerance
      75       11813.3   5.01685e-09       3432.16      0.1175      0.1175      146   
Optimization terminated normally: 
  Convergence detected: absolute parameter change was below tolerance
      89         14232   1.21565e-05       2632.38   3.642e-09       0.001      158  LS failed, Hessian reset 
      99       14232.1   3.63537e-06       3880.61           1           1      170   
    Iter      log prob        ||dx||      ||grad||       alpha      alpha0  # evals  Notes 
     140       14232.1   9.34234e-09       3159.49      0.2461      0.2461      218   
Optimization terminated normally: 
  Convergence detected: absolute parameter change was below tolerance
[I 2020-10-01 03:43:39,787] Trial 357 finished with value: 0.040537614094850793 and parameters: {'changepoint_prior_scale': 0.0014597080743376238, 'seasonality_prior_scale': 0.7031497014881194, 'holidays_prior_scale': 0.9919448845380558, 'seasonality_mode': 'additive', 'changepoint_range': 0.5306620040936898}. Best is trial 96 with value: 0.038883738900888705.
Initial log joint probability = -28.8311
    Iter      log prob        ||dx||      ||grad||       alpha      alpha0  # evals  Notes 
      99       18912.7   3.89969e-07       2954.48       0.755       0.755      123   
    Iter      log prob        ||dx||      ||grad||       alpha      alpha0  # evals  Notes 
     114       18912.7   8.26358e-09       2846.23      0.4356      0.4356      140   
Optimization terminated normally: 
  Convergence detected: absolute parameter change was below tolerance
INFO:fbprophet:Making 5 forecasts with cutoffs between 2013-10-07 00:00:00 and 2015-10-18 00:00:00
INFO:fbprophet:Applying in parallel with <concurrent.futures.process.ProcessPoolExecutor object at 0x7fc84dc0bdd0>
Initial log joint probability = -8.95172
    Iter      log prob        ||dx||      ||grad||       alpha      alpha0  # evals  Notes 
Initial log joint probability = -12.7302
    Iter      log prob        ||dx||      ||grad||       alpha      alpha0  # evals  Notes 
Initial log joint probability = -15.1549
    Iter      log prob        ||dx||      ||grad||       alpha      alpha0  # evals  Notes 
Initial log joint probability = -18.717
    Iter      log prob        ||dx||      ||grad||       alpha      alpha0  # evals  Notes 
Initial log joint probability = -23.5879
    Iter      log prob        ||dx||      ||grad||       alpha      alpha0  # evals  Notes 
      45       4678.94   9.76494e-05       3140.28   3.099e-08       0.001      105  LS failed, Hessian reset 
      80       4679.21   9.09334e-09       3150.27           1           1      149   
Optimization terminated normally: 
  Convergence detected: absolute parameter change was below tolerance
      66       7028.98   0.000103596       2879.55   3.597e-08       0.001      116  LS failed, Hessian reset 
      99       7029.15   3.90428e-07       2737.44           1           1      152   
    Iter      log prob        ||dx||      ||grad||       alpha      alpha0  # evals  Notes 
      47       11813.3   1.43691e-08       3225.84      0.7043      0.7043       69   
Optimization terminated normally: 
  Convergence detected: relative gradient magnitude is below tolerance
      82       9582.58   7.61098e-09       2823.54      0.6574      0.6574      128   
Optimization terminated normally: 
  Convergence detected: absolute parameter change was below tolerance
     119       7029.23   2.58458e-05       2769.55   6.987e-09       0.001      215  LS failed, Hessian reset 
     175       7029.29   8.41857e-09       2721.46      0.8007      0.8007      284   
Optimization terminated normally: 
  Convergence detected: absolute parameter change was below tolerance
      98         14233   8.51919e-09       2860.96      0.1473      0.1473      138   
Optimization terminated normally: 
  Convergence detected: absolute parameter change was below tolerance
[I 2020-10-01 03:43:55,313] Trial 358 finished with value: 0.04092043653238686 and parameters: {'changepoint_prior_scale': 0.001582463161190024, 'seasonality_prior_scale': 0.8154273447967884, 'holidays_prior_scale': 1.5484703531038606, 'seasonality_mode': 'additive', 'changepoint_range': 0.5282604309871818}. Best is trial 96 with value: 0.038883738900888705.
Initial log joint probability = -28.8311
    Iter      log prob        ||dx||      ||grad||       alpha      alpha0  # evals  Notes 
      99       18912.8   9.97799e-08       3002.74      0.7531      0.7531      122   
    Iter      log prob        ||dx||      ||grad||       alpha      alpha0  # evals  Notes 
     140       18912.9   5.75658e-10       3335.07    0.005513           1      174   
Optimization terminated normally: 
  Convergence detected: absolute parameter change was below tolerance
INFO:fbprophet:Making 5 forecasts with cutoffs between 2013-10-07 00:00:00 and 2015-10-18 00:00:00
INFO:fbprophet:Applying in parallel with <concurrent.futures.process.ProcessPoolExecutor object at 0x7fc84dc727d0>
Initial log joint probability = -8.95172
    Iter      log prob        ||dx||      ||grad||       alpha      alpha0  # evals  Notes 
Initial log joint probability = -12.7302
    Iter      log prob        ||dx||      ||grad||       alpha      alpha0  # evals  Notes 
Initial log joint probability = -15.1549
    Iter      log prob        ||dx||      ||grad||       alpha      alpha0  # evals  Notes 
Initial log joint probability = -18.717
    Iter      log prob        ||dx||      ||grad||       alpha      alpha0  # evals  Notes 
Initial log joint probability = -23.5879
    Iter      log prob        ||dx||      ||grad||       alpha      alpha0  # evals  Notes 
      71       4679.09   1.00405e-06       3465.56   2.878e-10       0.001      135  LS failed, Hessian reset 
      89       4679.09    6.0694e-09       3568.19      0.6871      0.6871      157   
Optimization terminated normally: 
  Convergence detected: absolute parameter change was below tolerance
      99       7029.23   1.03864e-07       3300.74      0.3157      0.3157      118   
    Iter      log prob        ||dx||      ||grad||       alpha      alpha0  # evals  Notes 
      55       11813.2   8.25101e-09       3434.26      0.3677      0.3677       84   
Optimization terminated normally: 
  Convergence detected: absolute parameter change was below tolerance
     186        7031.9   5.33981e-09       3439.97      0.3043      0.3043      219   
Optimization terminated normally: 
  Convergence detected: absolute parameter change was below tolerance
      89       9582.53   3.46894e-07       3702.29   1.238e-10       0.001      158  LS failed, Hessian reset 
      99       9582.53    5.7335e-08       3362.92      0.7175      0.7175      169   
    Iter      log prob        ||dx||      ||grad||       alpha      alpha0  # evals  Notes 
     110       9582.53   1.40746e-08       3381.41           1           1      180   
Optimization terminated normally: 
  Convergence detected: relative gradient magnitude is below tolerance
      99       14233.5   2.30234e-07       3570.24      0.3142           1      128   
    Iter      log prob        ||dx||      ||grad||       alpha      alpha0  # evals  Notes 
     139       14233.6    8.5652e-09       3244.31      0.2026      0.2026      184   
Optimization terminated normally: 
  Convergence detected: absolute parameter change was below tolerance
[I 2020-10-01 03:44:10,845] Trial 359 finished with value: 0.042270800089353716 and parameters: {'changepoint_prior_scale': 0.0014474004384634658, 'seasonality_prior_scale': 0.6258844255135617, 'holidays_prior_scale': 0.260074726865213, 'seasonality_mode': 'additive', 'changepoint_range': 0.5013049240670163}. Best is trial 96 with value: 0.038883738900888705.
Initial log joint probability = -28.8311
    Iter      log prob        ||dx||      ||grad||       alpha      alpha0  # evals  Notes 
      99       18912.8   6.38421e-07       2273.02      0.2831           1      124   
    Iter      log prob        ||dx||      ||grad||       alpha      alpha0  # evals  Notes 
     125       18912.8   1.18104e-07       1899.45      0.5514      0.5514      155   
Optimization terminated normally: 
  Convergence detected: relative gradient magnitude is below tolerance
INFO:fbprophet:Making 5 forecasts with cutoffs between 2013-10-07 00:00:00 and 2015-10-18 00:00:00
INFO:fbprophet:Applying in parallel with <concurrent.futures.process.ProcessPoolExecutor object at 0x7fc84dc20150>
Initial log joint probability = -8.95172
    Iter      log prob        ||dx||      ||grad||       alpha      alpha0  # evals  Notes 
Initial log joint probability = -12.7302
    Iter      log prob        ||dx||      ||grad||       alpha      alpha0  # evals  Notes 
Initial log joint probability = -15.1549
    Iter      log prob        ||dx||      ||grad||       alpha      alpha0  # evals  Notes 
Initial log joint probability = -18.717
    Iter      log prob        ||dx||      ||grad||       alpha      alpha0  # evals  Notes 
      60       4679.32     9.058e-09       2544.36      0.3783      0.3783       80   
Optimization terminated normally: 
  Convergence detected: absolute parameter change was below tolerance
Initial log joint probability = -23.5879
    Iter      log prob        ||dx||      ||grad||       alpha      alpha0  # evals  Notes 
      99       7030.35   3.30987e-05        2118.6        0.65        0.65      123   
    Iter      log prob        ||dx||      ||grad||       alpha      alpha0  # evals  Notes 
      75       9582.08   2.24964e-08       2478.94      0.3125       0.977      103   
Optimization terminated normally: 
  Convergence detected: relative gradient magnitude is below tolerance
     172       7030.76   7.71992e-09       2599.17    0.004109           1      214   
Optimization terminated normally: 
  Convergence detected: absolute parameter change was below tolerance
      96         11813   1.52175e-08       1785.31      0.3281      0.9436      130   
Optimization terminated normally: 
  Convergence detected: relative gradient magnitude is below tolerance
      99       14232.4   7.84411e-07       2242.31           1           1      133   
    Iter      log prob        ||dx||      ||grad||       alpha      alpha0  # evals  Notes 
     116       14232.4   2.72209e-08       1990.52      0.3477      0.3477      155   
Optimization terminated normally: 
  Convergence detected: relative gradient magnitude is below tolerance
[I 2020-10-01 03:44:26,001] Trial 360 finished with value: 0.04277760673808231 and parameters: {'changepoint_prior_scale': 0.0019593258545560015, 'seasonality_prior_scale': 0.5669818913911295, 'holidays_prior_scale': 1.1379892411739168, 'seasonality_mode': 'multiplicative', 'changepoint_range': 0.5300807303300953}. Best is trial 96 with value: 0.038883738900888705.
Initial log joint probability = -28.8311
    Iter      log prob        ||dx||      ||grad||       alpha      alpha0  # evals  Notes 
      99       18912.7   7.09055e-06       2723.29     0.02188           1      143   
    Iter      log prob        ||dx||      ||grad||       alpha      alpha0  # evals  Notes 
     126       18912.7   3.23881e-08       2823.76      0.7545      0.7545      177   
Optimization terminated normally: 
  Convergence detected: relative gradient magnitude is below tolerance
INFO:fbprophet:Making 5 forecasts with cutoffs between 2013-10-07 00:00:00 and 2015-10-18 00:00:00
INFO:fbprophet:Applying in parallel with <concurrent.futures.process.ProcessPoolExecutor object at 0x7fc84dc76850>
Initial log joint probability = -8.95172
    Iter      log prob        ||dx||      ||grad||       alpha      alpha0  # evals  Notes 
Initial log joint probability = -12.7302
    Iter      log prob        ||dx||      ||grad||       alpha      alpha0  # evals  Notes 
Initial log joint probability = -15.1549
    Iter      log prob        ||dx||      ||grad||       alpha      alpha0  # evals  Notes 
Initial log joint probability = -18.717
    Iter      log prob        ||dx||      ||grad||       alpha      alpha0  # evals  Notes 
      66       4679.38   3.69282e-09       2996.42       0.239       0.239       84   
Optimization terminated normally: 
  Convergence detected: absolute parameter change was below tolerance
Initial log joint probability = -23.5879
    Iter      log prob        ||dx||      ||grad||       alpha      alpha0  # evals  Notes 
      99       7029.73   5.62711e-08       2694.54      0.3428      0.3428      133   
    Iter      log prob        ||dx||      ||grad||       alpha      alpha0  # evals  Notes 
     103       7029.73   7.87008e-09       3006.51      0.3639      0.3639      137   
Optimization terminated normally: 
  Convergence detected: absolute parameter change was below tolerance
      65       9582.42   1.70172e-05       2836.17   7.253e-09       0.001      122  LS failed, Hessian reset 
      57       11813.3   3.51709e-07       2947.21   1.164e-10       0.001      120  LS failed, Hessian reset 
      99       9582.48   5.06446e-08       2726.23           1           1      168   
    Iter      log prob        ||dx||      ||grad||       alpha      alpha0  # evals  Notes 
     102       9582.48   9.33301e-09       2601.48      0.4758      0.4758      171   
Optimization terminated normally: 
  Convergence detected: absolute parameter change was below tolerance
      66       11813.3   8.56842e-09       3032.83      0.2741      0.2741      131   
Optimization terminated normally: 
  Convergence detected: absolute parameter change was below tolerance
      99       14232.9   1.49553e-07       2645.07           1           1      131   
    Iter      log prob        ||dx||      ||grad||       alpha      alpha0  # evals  Notes 
     113       14232.9    3.5733e-07       2562.51   1.184e-10       0.001      186  LS failed, Hessian reset 
     117       14232.9   8.56499e-09       2459.75      0.1562      0.1562      191   
Optimization terminated normally: 
  Convergence detected: absolute parameter change was below tolerance
