[I 2020-10-01 03:29:56,214] Trial 304 finished with value: 0.042270838697346144 and parameters: {'changepoint_prior_scale': 0.001756482743981593, 'seasonality_prior_scale': 0.0919509954746376, 'holidays_prior_scale': 0.2701326748731004, 'seasonality_mode': 'additive', 'changepoint_range': 0.5312301786927337}. Best is trial 96 with value: 0.038883738900888705.
Initial log joint probability = -28.8311
    Iter      log prob        ||dx||      ||grad||       alpha      alpha0  # evals  Notes 
      99       18912.3   5.56683e-07       3209.01      0.2678           1      130   
    Iter      log prob        ||dx||      ||grad||       alpha      alpha0  # evals  Notes 
     114       18912.3   1.76768e-08       2754.84      0.3663           1      155   
Optimization terminated normally: 
  Convergence detected: relative gradient magnitude is below tolerance
INFO:fbprophet:Making 5 forecasts with cutoffs between 2013-10-07 00:00:00 and 2015-10-18 00:00:00
INFO:fbprophet:Applying in parallel with <concurrent.futures.process.ProcessPoolExecutor object at 0x7fc84dc041d0>
Initial log joint probability = -8.95172
    Iter      log prob        ||dx||      ||grad||       alpha      alpha0  # evals  Notes 
Initial log joint probability = -12.7302
    Iter      log prob        ||dx||      ||grad||       alpha      alpha0  # evals  Notes 
Initial log joint probability = -15.1549
    Iter      log prob        ||dx||      ||grad||       alpha      alpha0  # evals  Notes 
Initial log joint probability = -18.717
    Iter      log prob        ||dx||      ||grad||       alpha      alpha0  # evals  Notes 
Initial log joint probability = -23.5879
    Iter      log prob        ||dx||      ||grad||       alpha      alpha0  # evals  Notes 
      70       4677.08   1.62094e-07        3201.4   5.084e-11       0.001      142  LS failed, Hessian reset 
      85       4677.08   9.02285e-09       3112.32      0.1814      0.1814      162   
Optimization terminated normally: 
  Convergence detected: absolute parameter change was below tolerance
      78       7029.32    3.1475e-05       2889.62   8.444e-09       0.001      135  LS failed, Hessian reset 
      99       7029.41   1.86355e-06       2711.11           1           1      159   
    Iter      log prob        ||dx||      ||grad||       alpha      alpha0  # evals  Notes 
      94        9582.5   8.07179e-09          2845      0.8552      0.8552      118   
Optimization terminated normally: 
  Convergence detected: absolute parameter change was below tolerance
      64       11813.2   2.17838e-08       3202.43      0.3167           1       91   
Optimization terminated normally: 
  Convergence detected: relative gradient magnitude is below tolerance
     142       7029.43   2.42583e-07        2942.2    7.82e-11       0.001      252  LS failed, Hessian reset 
     159       7029.43   4.46761e-09       3064.23      0.5045      0.5045      274   
Optimization terminated normally: 
  Convergence detected: absolute parameter change was below tolerance
      99       14232.6   6.46448e-05       3243.35      0.2093           1      137   
    Iter      log prob        ||dx||      ||grad||       alpha      alpha0  # evals  Notes 
     164       14232.8   6.60397e-09       3236.32       0.405       0.405      217   
Optimization terminated normally: 
  Convergence detected: absolute parameter change was below tolerance
[I 2020-10-01 03:30:10,125] Trial 305 finished with value: 0.04167477771052358 and parameters: {'changepoint_prior_scale': 0.0015268689996083926, 'seasonality_prior_scale': 0.16399236164139305, 'holidays_prior_scale': 0.2376456746411569, 'seasonality_mode': 'additive', 'changepoint_range': 0.5160993458061971}. Best is trial 96 with value: 0.038883738900888705.
Initial log joint probability = -28.8311
    Iter      log prob        ||dx||      ||grad||       alpha      alpha0  # evals  Notes 
      99       18912.1   2.50104e-06       5173.26      0.9105      0.9105      123   
    Iter      log prob        ||dx||      ||grad||       alpha      alpha0  # evals  Notes 
     162       18912.7   7.44912e-09       5072.87      0.5197      0.5197      201   
Optimization terminated normally: 
  Convergence detected: absolute parameter change was below tolerance
INFO:fbprophet:Making 5 forecasts with cutoffs between 2013-10-07 00:00:00 and 2015-10-18 00:00:00
INFO:fbprophet:Applying in parallel with <concurrent.futures.process.ProcessPoolExecutor object at 0x7fc84dbe8550>
Initial log joint probability = -8.95172
    Iter      log prob        ||dx||      ||grad||       alpha      alpha0  # evals  Notes 
Initial log joint probability = -12.7302
    Iter      log prob        ||dx||      ||grad||       alpha      alpha0  # evals  Notes 
Initial log joint probability = -15.1549
    Iter      log prob        ||dx||      ||grad||       alpha      alpha0  # evals  Notes 
Initial log joint probability = -18.717
    Iter      log prob        ||dx||      ||grad||       alpha      alpha0  # evals  Notes 
Initial log joint probability = -23.5879
    Iter      log prob        ||dx||      ||grad||       alpha      alpha0  # evals  Notes 
      48       4678.66   1.09732e-05       4780.71   2.212e-09       0.001      105  LS failed, Hessian reset 
      88       4678.86   3.63759e-06       4702.37   7.106e-10       0.001      190  LS failed, Hessian reset 
      99       4678.87   2.73718e-07       4904.25           1           1      204   
    Iter      log prob        ||dx||      ||grad||       alpha      alpha0  # evals  Notes 
     110       4678.87   2.91199e-09       4939.56      0.1729      0.1729      217   
Optimization terminated normally: 
  Convergence detected: absolute parameter change was below tolerance
      99       7028.21   5.79538e-09       4370.98      0.2828      0.2828      132   
Optimization terminated normally: 
  Convergence detected: absolute parameter change was below tolerance
      63       9582.39   8.84675e-09       4339.69      0.3631           1       87   
Optimization terminated normally: 
  Convergence detected: absolute parameter change was below tolerance
      49       11812.7   1.50811e-05       5235.04   3.218e-09       0.001      112  LS failed, Hessian reset 
      99       14228.9   1.74866e-05       5478.09           1           1      133   
    Iter      log prob        ||dx||      ||grad||       alpha      alpha0  # evals  Notes 
      74       11812.8   1.47244e-06       5075.57   2.931e-10       0.001      182  LS failed, Hessian reset 
      84       11812.8   2.20512e-09       4945.68     0.05021     0.05021      199   
Optimization terminated normally: 
  Convergence detected: absolute parameter change was below tolerance
     148       14231.3   6.63788e-09       4923.81      0.2829      0.9725      197   
Optimization terminated normally: 
  Convergence detected: absolute parameter change was below tolerance
[I 2020-10-01 03:30:22,870] Trial 306 finished with value: 0.04088702184379286 and parameters: {'changepoint_prior_scale': 0.0010028857973785408, 'seasonality_prior_scale': 0.1329722100024085, 'holidays_prior_scale': 0.11449522555574629, 'seasonality_mode': 'additive', 'changepoint_range': 0.5270639362955338}. Best is trial 96 with value: 0.038883738900888705.
Initial log joint probability = -28.8311
    Iter      log prob        ||dx||      ||grad||       alpha      alpha0  # evals  Notes 
      99       18912.4   1.23871e-07       3130.96           1           1      129   
    Iter      log prob        ||dx||      ||grad||       alpha      alpha0  # evals  Notes 
     101       18912.4   6.86485e-09       2718.98      0.2165      0.2165      132   
Optimization terminated normally: 
  Convergence detected: absolute parameter change was below tolerance
INFO:fbprophet:Making 5 forecasts with cutoffs between 2013-10-07 00:00:00 and 2015-10-18 00:00:00
INFO:fbprophet:Applying in parallel with <concurrent.futures.process.ProcessPoolExecutor object at 0x7fc84dc20a50>
Initial log joint probability = -8.95172
    Iter      log prob        ||dx||      ||grad||       alpha      alpha0  # evals  Notes 
Initial log joint probability = -12.7302
    Iter      log prob        ||dx||      ||grad||       alpha      alpha0  # evals  Notes 
Initial log joint probability = -15.1549
    Iter      log prob        ||dx||      ||grad||       alpha      alpha0  # evals  Notes 
Initial log joint probability = -18.717
    Iter      log prob        ||dx||      ||grad||       alpha      alpha0  # evals  Notes 
Initial log joint probability = -23.5879
    Iter      log prob        ||dx||      ||grad||       alpha      alpha0  # evals  Notes 
      57       4676.69    0.00110525       3313.47   3.148e-07       0.001      113  LS failed, Hessian reset 
      99          4679    1.2266e-06       3578.72      0.4206      0.4206      167   
    Iter      log prob        ||dx||      ||grad||       alpha      alpha0  # evals  Notes 
     119          4679   9.60047e-09       3373.82      0.2233      0.2233      192   
Optimization terminated normally: 
  Convergence detected: absolute parameter change was below tolerance
      99       7029.46   1.13825e-06       3089.81           1           1      124   
    Iter      log prob        ||dx||      ||grad||       alpha      alpha0  # evals  Notes 
     124       7029.47   5.98707e-09       3221.07      0.2967      0.2967      154   
Optimization terminated normally: 
  Convergence detected: absolute parameter change was below tolerance
      69       9582.37   1.09765e-08       3177.59      0.6293      0.6293       99   
Optimization terminated normally: 
  Convergence detected: relative gradient magnitude is below tolerance
      34       11811.6   0.000228097       2898.51   6.964e-08       0.001       95  LS failed, Hessian reset 
      93         11813   7.87057e-09       3263.38      0.4808      0.4808      166   
Optimization terminated normally: 
  Convergence detected: absolute parameter change was below tolerance
      99       14232.5   3.16847e-06       3529.74      0.2758      0.2758      131   
    Iter      log prob        ||dx||      ||grad||       alpha      alpha0  # evals  Notes 
     144       14232.8   9.38844e-09       3222.07      0.2708      0.2708      186   
Optimization terminated normally: 
  Convergence detected: absolute parameter change was below tolerance
[I 2020-10-01 03:30:38,221] Trial 307 finished with value: 0.0416006363973215 and parameters: {'changepoint_prior_scale': 0.0015182905544175852, 'seasonality_prior_scale': 0.10202825341535775, 'holidays_prior_scale': 0.29107041992589544, 'seasonality_mode': 'additive', 'changepoint_range': 0.5652188329357676}. Best is trial 96 with value: 0.038883738900888705.
Initial log joint probability = -28.8311
    Iter      log prob        ||dx||      ||grad||       alpha      alpha0  # evals  Notes 
      65         18915   3.43486e-07       195.834      0.2498      0.6011       93   
Optimization terminated normally: 
  Convergence detected: relative gradient magnitude is below tolerance
INFO:fbprophet:Making 5 forecasts with cutoffs between 2013-10-07 00:00:00 and 2015-10-18 00:00:00
INFO:fbprophet:Applying in parallel with <concurrent.futures.process.ProcessPoolExecutor object at 0x7fc84dc2f890>
Initial log joint probability = -8.95172
    Iter      log prob        ||dx||      ||grad||       alpha      alpha0  # evals  Notes 
Initial log joint probability = -12.7302
    Iter      log prob        ||dx||      ||grad||       alpha      alpha0  # evals  Notes 
Initial log joint probability = -15.1549
    Iter      log prob        ||dx||      ||grad||       alpha      alpha0  # evals  Notes 
Initial log joint probability = -18.717
    Iter      log prob        ||dx||      ||grad||       alpha      alpha0  # evals  Notes 
      68       4679.41   7.86546e-08       289.748      0.9064      0.9064       88   
Optimization terminated normally: 
  Convergence detected: relative gradient magnitude is below tolerance
Initial log joint probability = -23.5879
    Iter      log prob        ||dx||      ||grad||       alpha      alpha0  # evals  Notes 
      57       7034.19   0.000270033       246.038   1.167e-06       0.001      101  LS failed, Hessian reset 
      89       7034.25   9.27993e-08       183.198     0.05183           1      144   
Optimization terminated normally: 
  Convergence detected: relative gradient magnitude is below tolerance
      51       11813.3   4.65737e-06       258.032    1.81e-08       0.001      103  LS failed, Hessian reset 
      84       9583.09   1.48442e-06       145.072   9.464e-09       0.001      151  LS failed, Hessian reset 
      63       11813.3   1.53723e-07       206.129           1           1      119   
Optimization terminated normally: 
  Convergence detected: relative gradient magnitude is below tolerance
      99       9583.09   4.40281e-07       134.509           1           1      176   
    Iter      log prob        ||dx||      ||grad||       alpha      alpha0  # evals  Notes 
     107       9583.09    2.9187e-06       172.744   1.796e-08       0.001      239  LS failed, Hessian reset 
      99       14235.3   7.19374e-06        266.98           1           1      125   
    Iter      log prob        ||dx||      ||grad||       alpha      alpha0  # evals  Notes 
     119       9583.09   5.57809e-08       189.316     0.07159      0.3229      259   
Optimization terminated normally: 
  Convergence detected: relative gradient magnitude is below tolerance
     151       14235.4   6.13998e-08        283.26      0.2549      0.2549      186   
Optimization terminated normally: 
  Convergence detected: relative gradient magnitude is below tolerance
[I 2020-10-01 03:30:53,547] Trial 308 finished with value: 0.040883039725154474 and parameters: {'changepoint_prior_scale': 0.015074379525081559, 'seasonality_prior_scale': 0.1153299302435009, 'holidays_prior_scale': 0.07393771954951721, 'seasonality_mode': 'additive', 'changepoint_range': 0.5059740581675019}. Best is trial 96 with value: 0.038883738900888705.
Initial log joint probability = -28.8311
    Iter      log prob        ||dx||      ||grad||       alpha      alpha0  # evals  Notes 
      99       18912.7   4.42566e-05       3667.04      0.8765      0.8765      117   
    Iter      log prob        ||dx||      ||grad||       alpha      alpha0  # evals  Notes 
     151       18912.8   8.20573e-08       3860.09      0.9688      0.9688      183   
Optimization terminated normally: 
  Convergence detected: relative gradient magnitude is below tolerance
INFO:fbprophet:Making 5 forecasts with cutoffs between 2013-10-07 00:00:00 and 2015-10-18 00:00:00
INFO:fbprophet:Applying in parallel with <concurrent.futures.process.ProcessPoolExecutor object at 0x7fc84dc28810>
Initial log joint probability = -8.95172
    Iter      log prob        ||dx||      ||grad||       alpha      alpha0  # evals  Notes 
Initial log joint probability = -12.7302
    Iter      log prob        ||dx||      ||grad||       alpha      alpha0  # evals  Notes 
Initial log joint probability = -15.1549
    Iter      log prob        ||dx||      ||grad||       alpha      alpha0  # evals  Notes 
Initial log joint probability = -18.717
    Iter      log prob        ||dx||      ||grad||       alpha      alpha0  # evals  Notes 
Initial log joint probability = -23.5879
    Iter      log prob        ||dx||      ||grad||       alpha      alpha0  # evals  Notes 
      88       4679.22   8.94488e-09       4103.62      0.3758      0.3758      122   
Optimization terminated normally: 
  Convergence detected: absolute parameter change was below tolerance
      80       7028.45   1.49004e-05       4085.16   4.077e-09       0.001      139  LS failed, Hessian reset 
      99       7028.49   3.16994e-08       3990.62      0.2466      0.2466      163   
    Iter      log prob        ||dx||      ||grad||       alpha      alpha0  # evals  Notes 
     114       7028.49   5.72641e-09       3643.94      0.4475      0.4475      183   
Optimization terminated normally: 
  Convergence detected: absolute parameter change was below tolerance
      92       9582.37    9.7025e-09       3717.29      0.4348      0.4348      117   
Optimization terminated normally: 
  Convergence detected: absolute parameter change was below tolerance
      99         11813   1.23628e-08       4102.72      0.2385      0.2385      127   
    Iter      log prob        ||dx||      ||grad||       alpha      alpha0  # evals  Notes 
     105         11813   9.42849e-09       4133.57      0.6337      0.6337      133   
Optimization terminated normally: 
  Convergence detected: absolute parameter change was below tolerance
      99       14232.5   4.83569e-08       4136.36      0.8484      0.8484      134   
    Iter      log prob        ||dx||      ||grad||       alpha      alpha0  # evals  Notes 
     107       14232.5   7.32993e-09       4212.39    0.009444      0.4473      146   
Optimization terminated normally: 
  Convergence detected: absolute parameter change was below tolerance
[I 2020-10-01 03:31:09,365] Trial 309 finished with value: 0.04078561940135357 and parameters: {'changepoint_prior_scale': 0.0012193888931782322, 'seasonality_prior_scale': 0.08477520594915403, 'holidays_prior_scale': 0.2152051830164852, 'seasonality_mode': 'additive', 'changepoint_range': 0.5369076753122535}. Best is trial 96 with value: 0.038883738900888705.
Initial log joint probability = -28.8311
    Iter      log prob        ||dx||      ||grad||       alpha      alpha0  # evals  Notes 
      99       18912.4   0.000122015       4304.33           1           1      124   
    Iter      log prob        ||dx||      ||grad||       alpha      alpha0  # evals  Notes 
     170       18912.8    1.5029e-07       4116.61   3.514e-11       0.001      252  LS failed, Hessian reset 
     182       18912.8   4.66722e-09        4304.7      0.2491           1      267   
Optimization terminated normally: 
  Convergence detected: absolute parameter change was below tolerance
INFO:fbprophet:Making 5 forecasts with cutoffs between 2013-10-07 00:00:00 and 2015-10-18 00:00:00
INFO:fbprophet:Applying in parallel with <concurrent.futures.process.ProcessPoolExecutor object at 0x7fc84dc2f1d0>
Initial log joint probability = -8.95172
    Iter      log prob        ||dx||      ||grad||       alpha      alpha0  # evals  Notes 
Initial log joint probability = -12.7302
    Iter      log prob        ||dx||      ||grad||       alpha      alpha0  # evals  Notes 
Initial log joint probability = -15.1549
    Iter      log prob        ||dx||      ||grad||       alpha      alpha0  # evals  Notes 
Initial log joint probability = -18.717
    Iter      log prob        ||dx||      ||grad||       alpha      alpha0  # evals  Notes 
      76       4678.17   8.24755e-09       4446.42      0.7578      0.7578       95   
Initial log joint probability = -23.5879
Optimization terminated normally: 
  Convergence detected: absolute parameter change was below tolerance
    Iter      log prob        ||dx||      ||grad||       alpha      alpha0  # evals  Notes 
      84       7028.33   1.22142e-05        4371.9   2.909e-09       0.001      143  LS failed, Hessian reset 
      99       7028.39   8.40577e-07       3785.44       0.772       0.772      161   
    Iter      log prob        ||dx||      ||grad||       alpha      alpha0  # evals  Notes 
      47       9581.89   4.95914e-06       4263.08   1.126e-09       0.001      103  LS failed, Hessian reset 
     132       7028.39   8.06693e-09       4212.82      0.2544           1      203   
Optimization terminated normally: 
  Convergence detected: absolute parameter change was below tolerance
      87       9582.04   1.47035e-05       4631.38   3.467e-09       0.001      192  LS failed, Hessian reset 
      99       9582.08   1.54604e-07       4360.47      0.2123      0.2123      206   
    Iter      log prob        ||dx||      ||grad||       alpha      alpha0  # evals  Notes 
      94       11813.1   1.27665e-05       4227.65   2.851e-09       0.001      173  LS failed, Hessian reset 
      99       14232.5   2.26014e-06       4609.77      0.3853     0.03853      132   
    Iter      log prob        ||dx||      ||grad||       alpha      alpha0  # evals  Notes 
      99       11813.1   1.04217e-06        4443.6      0.5012      0.5012      179   
    Iter      log prob        ||dx||      ||grad||       alpha      alpha0  # evals  Notes 
     119       9582.08   1.17774e-07        4445.1   2.653e-11       0.001      273  LS failed, Hessian reset 
     118       11813.1   9.67488e-09       4559.22      0.3718      0.3718      205   
Optimization terminated normally: 
  Convergence detected: absolute parameter change was below tolerance
     131       9582.08   8.41575e-09       4344.52      0.2121      0.2121      287   
Optimization terminated normally: 
  Convergence detected: absolute parameter change was below tolerance
     127       14232.5   3.72052e-09       4333.79      0.2923      0.2923      167   
Optimization terminated normally: 
  Convergence detected: absolute parameter change was below tolerance
