[I 2020-10-01 02:43:58,455] Trial 123 finished with value: 0.04108812789340116 and parameters: {'changepoint_prior_scale': 0.0015864962933209595, 'seasonality_prior_scale': 0.29026893986060553, 'holidays_prior_scale': 0.10731762700759091, 'seasonality_mode': 'additive', 'changepoint_range': 0.5275050127426371}. Best is trial 96 with value: 0.038883738900888705.
Initial log joint probability = -28.8311
    Iter      log prob        ||dx||      ||grad||       alpha      alpha0  # evals  Notes 
      99       18912.4   1.98847e-05       4302.84      0.7118      0.7118      121   
    Iter      log prob        ||dx||      ||grad||       alpha      alpha0  # evals  Notes 
     150         18913   1.96771e-08       4457.76      0.3527           1      185   
Optimization terminated normally: 
  Convergence detected: relative gradient magnitude is below tolerance
INFO:fbprophet:Making 5 forecasts with cutoffs between 2013-10-07 00:00:00 and 2015-10-18 00:00:00
INFO:fbprophet:Applying in parallel with <concurrent.futures.process.ProcessPoolExecutor object at 0x7fc88e6851d0>
Initial log joint probability = -8.95172
    Iter      log prob        ||dx||      ||grad||       alpha      alpha0  # evals  Notes 
Initial log joint probability = -12.7302
    Iter      log prob        ||dx||      ||grad||       alpha      alpha0  # evals  Notes 
Initial log joint probability = -15.1549
    Iter      log prob        ||dx||      ||grad||       alpha      alpha0  # evals  Notes 
Initial log joint probability = -18.717
    Iter      log prob        ||dx||      ||grad||       alpha      alpha0  # evals  Notes 
Initial log joint probability = -23.5879
    Iter      log prob        ||dx||      ||grad||       alpha      alpha0  # evals  Notes 
      47        4673.7   0.000364694       4075.74   1.044e-07       0.001      120  LS failed, Hessian reset 
      47       7027.95   6.91767e-05       4384.82   1.536e-08       0.001       96  LS failed, Hessian reset 
      99          4679   4.21992e-08       4811.76      0.5365      0.5365      187   
    Iter      log prob        ||dx||      ||grad||       alpha      alpha0  # evals  Notes 
     111          4679   3.81885e-08       4068.56   8.499e-12       0.001      254  LS failed, Hessian reset 
     114          4679   4.74327e-09       4516.11      0.5703      0.5703      257   
Optimization terminated normally: 
  Convergence detected: absolute parameter change was below tolerance
      91       7028.21   3.44367e-09       4128.58      0.1818      0.1818      152   
Optimization terminated normally: 
  Convergence detected: absolute parameter change was below tolerance
      76       9582.38   4.93586e-09       3505.02      0.4847      0.4847      104   
Optimization terminated normally: 
  Convergence detected: absolute parameter change was below tolerance
      70       11813.2   5.17744e-09       4466.33      0.1505      0.1505      103   
Optimization terminated normally: 
  Convergence detected: absolute parameter change was below tolerance
      99       14233.7   1.23022e-07       4174.44           1           1      132   
    Iter      log prob        ||dx||      ||grad||       alpha      alpha0  # evals  Notes 
     104       14233.7   5.47889e-09        4331.8     0.06071      0.7205      141   
Optimization terminated normally: 
  Convergence detected: absolute parameter change was below tolerance
[I 2020-10-01 02:44:13,306] Trial 124 finished with value: 0.04181352051953255 and parameters: {'changepoint_prior_scale': 0.0011322052465565606, 'seasonality_prior_scale': 3.1925156676353557, 'holidays_prior_scale': 0.04065095960091416, 'seasonality_mode': 'additive', 'changepoint_range': 0.5697925052047991}. Best is trial 96 with value: 0.038883738900888705.
Initial log joint probability = -28.8311
    Iter      log prob        ||dx||      ||grad||       alpha      alpha0  # evals  Notes 
      99       18912.1   4.56625e-07       3633.51           1           1      124   
    Iter      log prob        ||dx||      ||grad||       alpha      alpha0  # evals  Notes 
     192       18912.6   4.12263e-07        4052.9   1.237e-10       0.001      278  LS failed, Hessian reset 
     199       18912.6   1.62563e-08       3584.46      0.2761      0.2761      287   
    Iter      log prob        ||dx||      ||grad||       alpha      alpha0  # evals  Notes 
     207       18912.6   3.18721e-08       3587.59      0.4288           1      299   
Optimization terminated normally: 
  Convergence detected: relative gradient magnitude is below tolerance
INFO:fbprophet:Making 5 forecasts with cutoffs between 2013-10-07 00:00:00 and 2015-10-18 00:00:00
INFO:fbprophet:Applying in parallel with <concurrent.futures.process.ProcessPoolExecutor object at 0x7fc88e683f10>
Initial log joint probability = -8.95172
    Iter      log prob        ||dx||      ||grad||       alpha      alpha0  # evals  Notes 
Initial log joint probability = -12.7302
    Iter      log prob        ||dx||      ||grad||       alpha      alpha0  # evals  Notes 
Initial log joint probability = -15.1549
    Iter      log prob        ||dx||      ||grad||       alpha      alpha0  # evals  Notes 
Initial log joint probability = -18.717
    Iter      log prob        ||dx||      ||grad||       alpha      alpha0  # evals  Notes 
      55       4678.47   4.96995e-09       3916.79      0.3558           1       85   
Optimization terminated normally: 
  Convergence detected: absolute parameter change was below tolerance
Initial log joint probability = -23.5879
    Iter      log prob        ||dx||      ||grad||       alpha      alpha0  # evals  Notes 
      82       7028.68   1.24749e-05       3874.12   3.347e-09       0.001      134  LS failed, Hessian reset 
      99       7028.74   5.36091e-07        3585.8           1           1      154   
    Iter      log prob        ||dx||      ||grad||       alpha      alpha0  # evals  Notes 
      84        9582.4   8.79261e-09       3111.01      0.5935      0.5935      121   
Optimization terminated normally: 
  Convergence detected: absolute parameter change was below tolerance
     127       7028.74   7.58668e-09       3809.13      0.1309      0.1309      189   
Optimization terminated normally: 
  Convergence detected: absolute parameter change was below tolerance
      83       11813.1   8.58475e-09          3792      0.3095      0.3095      115   
Optimization terminated normally: 
  Convergence detected: absolute parameter change was below tolerance
      99       14231.7   7.28861e-06       3715.93           1           1      127   
    Iter      log prob        ||dx||      ||grad||       alpha      alpha0  # evals  Notes 
     105       14231.7   7.22715e-07          3616   1.859e-10       0.001      175  LS failed, Hessian reset 
     120       14231.7   9.74213e-09       4033.92      0.2295           1      193   
Optimization terminated normally: 
  Convergence detected: absolute parameter change was below tolerance
[I 2020-10-01 02:44:29,157] Trial 125 finished with value: 0.041236367794914255 and parameters: {'changepoint_prior_scale': 0.0012765503086493918, 'seasonality_prior_scale': 0.22279615193508834, 'holidays_prior_scale': 0.08877080174591645, 'seasonality_mode': 'additive', 'changepoint_range': 0.5149433446487924}. Best is trial 96 with value: 0.038883738900888705.
Initial log joint probability = -28.8311
    Iter      log prob        ||dx||      ||grad||       alpha      alpha0  # evals  Notes 
      78       18911.1   3.24755e-05       5277.33   6.992e-09       0.001      134  LS failed, Hessian reset 
      99       18911.2   7.07271e-07       3337.19      0.3456      0.3456      159   
    Iter      log prob        ||dx||      ||grad||       alpha      alpha0  # evals  Notes 
     136       18911.2   2.57044e-06       5627.49   4.842e-10       0.001      245  LS failed, Hessian reset 
     154       18911.2    9.7767e-09       3423.98      0.3023      0.3023      274   
Optimization terminated normally: 
  Convergence detected: absolute parameter change was below tolerance
INFO:fbprophet:Making 5 forecasts with cutoffs between 2013-10-07 00:00:00 and 2015-10-18 00:00:00
INFO:fbprophet:Applying in parallel with <concurrent.futures.process.ProcessPoolExecutor object at 0x7fc88e6ae1d0>
Initial log joint probability = -8.95172
    Iter      log prob        ||dx||      ||grad||       alpha      alpha0  # evals  Notes 
Initial log joint probability = -12.7302
    Iter      log prob        ||dx||      ||grad||       alpha      alpha0  # evals  Notes 
Initial log joint probability = -15.1549
    Iter      log prob        ||dx||      ||grad||       alpha      alpha0  # evals  Notes 
Initial log joint probability = -18.717
    Iter      log prob        ||dx||      ||grad||       alpha      alpha0  # evals  Notes 
Initial log joint probability = -23.5879
    Iter      log prob        ||dx||      ||grad||       alpha      alpha0  # evals  Notes 
      60       4678.84   2.20724e-06       4935.54   4.283e-10       0.001      124  LS failed, Hessian reset 
      89       4678.85   9.12147e-09       4914.27      0.5436      0.5436      162   
Optimization terminated normally: 
  Convergence detected: absolute parameter change was below tolerance
      48       9582.06   9.66976e-09       4932.63      0.3587      0.3587       66   
Optimization terminated normally: 
  Convergence detected: absolute parameter change was below tolerance
      91       7027.72    3.1567e-05       4876.12   6.172e-09       0.001      166  LS failed, Hessian reset 
      99       7027.86   3.59622e-06       4287.32      0.2998           1      177   
    Iter      log prob        ||dx||      ||grad||       alpha      alpha0  # evals  Notes 
     130       7027.92   5.16655e-09       4613.38       0.357       0.357      218   
Optimization terminated normally: 
  Convergence detected: absolute parameter change was below tolerance
      99         14233   1.02159e-08       4881.98      0.6857      0.6857      140   
Optimization terminated normally: 
  Convergence detected: relative gradient magnitude is below tolerance
      86       11813.1   4.19298e-06        4919.3    8.47e-10       0.001      157  LS failed, Hessian reset 
      99       11813.1   1.07105e-07       4553.44      0.5188      0.5188      173   
    Iter      log prob        ||dx||      ||grad||       alpha      alpha0  # evals  Notes 
     107       11813.1    1.9053e-09       5030.87       0.158       0.158      185   
Optimization terminated normally: 
  Convergence detected: absolute parameter change was below tolerance
[I 2020-10-01 02:44:45,824] Trial 126 finished with value: 0.04110742921633088 and parameters: {'changepoint_prior_scale': 0.0010010075450347313, 'seasonality_prior_scale': 0.1447146157990331, 'holidays_prior_scale': 0.06731175056070023, 'seasonality_mode': 'additive', 'changepoint_range': 0.5373270714309816}. Best is trial 96 with value: 0.038883738900888705.
Initial log joint probability = -28.8311
    Iter      log prob        ||dx||      ||grad||       alpha      alpha0  # evals  Notes 
      40       18913.9    1.2808e-05       411.668   3.024e-08       0.001       98  LS failed, Hessian reset 
      58       18913.9   7.98149e-08       352.431      0.2609           1      124   
Optimization terminated normally: 
  Convergence detected: relative gradient magnitude is below tolerance
INFO:fbprophet:Making 5 forecasts with cutoffs between 2013-10-07 00:00:00 and 2015-10-18 00:00:00
INFO:fbprophet:Applying in parallel with <concurrent.futures.process.ProcessPoolExecutor object at 0x7fc88e685ed0>
Initial log joint probability = -8.95172
    Iter      log prob        ||dx||      ||grad||       alpha      alpha0  # evals  Notes 
Initial log joint probability = -12.7302
    Iter      log prob        ||dx||      ||grad||       alpha      alpha0  # evals  Notes 
Initial log joint probability = -15.1549
    Iter      log prob        ||dx||      ||grad||       alpha      alpha0  # evals  Notes 
Initial log joint probability = -18.717
    Iter      log prob        ||dx||      ||grad||       alpha      alpha0  # evals  Notes 
      66       4679.47   2.59476e-08       611.847      0.2221           1       92   
Optimization terminated normally: 
  Convergence detected: relative gradient magnitude is below tolerance
Initial log joint probability = -23.5879
    Iter      log prob        ||dx||      ||grad||       alpha      alpha0  # evals  Notes 
      46       9582.68   2.91777e-08       342.774     0.05613           1       79   
Optimization terminated normally: 
  Convergence detected: relative gradient magnitude is below tolerance
      83       7032.21   3.25486e-05        368.24   1.034e-07       0.001      141  LS failed, Hessian reset 
      99       7032.21   8.68542e-08        399.05      0.1925      0.1925      165   
    Iter      log prob        ||dx||      ||grad||       alpha      alpha0  # evals  Notes 
     102       7032.21   4.38796e-08       283.884      0.2268           1      170   
Optimization terminated normally: 
  Convergence detected: relative gradient magnitude is below tolerance
      99       11813.2   2.37443e-06       421.297      0.2594      0.2594      127   
    Iter      log prob        ||dx||      ||grad||       alpha      alpha0  # evals  Notes 
     123       11813.2   2.48204e-07       403.172      0.1854           1      160   
Optimization terminated normally: 
  Convergence detected: relative gradient magnitude is below tolerance
      78       14234.3   3.79209e-08        484.95      0.3036      0.3036      111   
Optimization terminated normally: 
  Convergence detected: relative gradient magnitude is below tolerance
[I 2020-10-01 02:44:59,588] Trial 127 finished with value: 0.04218668251981816 and parameters: {'changepoint_prior_scale': 0.008323139164450368, 'seasonality_prior_scale': 0.18933910569719187, 'holidays_prior_scale': 0.03480459970650901, 'seasonality_mode': 'additive', 'changepoint_range': 0.5577792258658851}. Best is trial 96 with value: 0.038883738900888705.
Initial log joint probability = -28.8311
    Iter      log prob        ||dx||      ||grad||       alpha      alpha0  # evals  Notes 
      97       18912.8   2.58571e-08       3471.44      0.3482           1      124   
Optimization terminated normally: 
  Convergence detected: relative gradient magnitude is below tolerance
INFO:fbprophet:Making 5 forecasts with cutoffs between 2013-10-07 00:00:00 and 2015-10-18 00:00:00
INFO:fbprophet:Applying in parallel with <concurrent.futures.process.ProcessPoolExecutor object at 0x7fc88e650f50>
Initial log joint probability = -8.95172
    Iter      log prob        ||dx||      ||grad||       alpha      alpha0  # evals  Notes 
Initial log joint probability = -12.7302
    Iter      log prob        ||dx||      ||grad||       alpha      alpha0  # evals  Notes 
Initial log joint probability = -15.1549
    Iter      log prob        ||dx||      ||grad||       alpha      alpha0  # evals  Notes 
Initial log joint probability = -18.717
    Iter      log prob        ||dx||      ||grad||       alpha      alpha0  # evals  Notes 
Initial log joint probability = -23.5879
    Iter      log prob        ||dx||      ||grad||       alpha      alpha0  # evals  Notes 
      86       4679.07   7.28265e-09       3428.64      0.6821      0.6821      113   
Optimization terminated normally: 
  Convergence detected: absolute parameter change was below tolerance
      54       9582.35   7.86574e-09       3272.17      0.4168      0.4168       76   
Optimization terminated normally: 
  Convergence detected: absolute parameter change was below tolerance
      99       7029.15   6.11503e-07       3880.57           1           1      128   
    Iter      log prob        ||dx||      ||grad||       alpha      alpha0  # evals  Notes 
     118       7029.15   6.05423e-09       3737.14      0.4863      0.4863      153   
Optimization terminated normally: 
  Convergence detected: absolute parameter change was below tolerance
      60       11813.1   9.18407e-09       3292.18        0.48        0.48       82   
Optimization terminated normally: 
  Convergence detected: absolute parameter change was below tolerance
      67       14232.3   0.000184977       3691.86   5.492e-08       0.001      131  LS failed, Hessian reset 
      99       14232.7   1.73068e-06       3756.75           1           1      171   
    Iter      log prob        ||dx||      ||grad||       alpha      alpha0  # evals  Notes 
     143       14232.7   8.90957e-07       3560.96   2.638e-10       0.001      274  LS failed, Hessian reset 
     159       14232.7   4.49068e-09       3513.22      0.2331      0.2331      293   
Optimization terminated normally: 
  Convergence detected: absolute parameter change was below tolerance
[I 2020-10-01 02:45:14,292] Trial 128 finished with value: 0.04078645002404179 and parameters: {'changepoint_prior_scale': 0.0014183939583362576, 'seasonality_prior_scale': 0.07571866390523598, 'holidays_prior_scale': 0.0717308733986649, 'seasonality_mode': 'additive', 'changepoint_range': 0.5812310300087247}. Best is trial 96 with value: 0.038883738900888705.
Initial log joint probability = -28.8311
    Iter      log prob        ||dx||      ||grad||       alpha      alpha0  # evals  Notes 
      99       18912.8   3.00284e-08       2446.93      0.4122           1      127   
Optimization terminated normally: 
  Convergence detected: relative gradient magnitude is below tolerance
INFO:fbprophet:Making 5 forecasts with cutoffs between 2013-10-07 00:00:00 and 2015-10-18 00:00:00
INFO:fbprophet:Applying in parallel with <concurrent.futures.process.ProcessPoolExecutor object at 0x7fc88e69ad50>
Initial log joint probability = -8.95172
    Iter      log prob        ||dx||      ||grad||       alpha      alpha0  # evals  Notes 
Initial log joint probability = -12.7302
    Iter      log prob        ||dx||      ||grad||       alpha      alpha0  # evals  Notes 
Initial log joint probability = -15.1549
    Iter      log prob        ||dx||      ||grad||       alpha      alpha0  # evals  Notes 
Initial log joint probability = -18.717
    Iter      log prob        ||dx||      ||grad||       alpha      alpha0  # evals  Notes 
      78       4677.22    0.00042448       2671.73   1.699e-07       0.001      183  LS failed, Hessian reset 
Initial log joint probability = -23.5879
    Iter      log prob        ||dx||      ||grad||       alpha      alpha0  # evals  Notes 
      99       4678.74   1.30358e-05       2610.93      0.3807      0.3807      212   
    Iter      log prob        ||dx||      ||grad||       alpha      alpha0  # evals  Notes 
      99       7029.85   4.62904e-07       2430.22      0.4491           1      125   
    Iter      log prob        ||dx||      ||grad||       alpha      alpha0  # evals  Notes 
      60        9582.4    7.3108e-09       2838.61      0.2624      0.2624       82   
Optimization terminated normally: 
  Convergence detected: absolute parameter change was below tolerance
     183       4679.18   6.89547e-09       2772.79      0.2594      0.2594      310   
Optimization terminated normally: 
  Convergence detected: absolute parameter change was below tolerance
      82       11813.1   8.49278e-09       2687.08      0.2055     0.02055      121   
Optimization terminated normally: 
  Convergence detected: absolute parameter change was below tolerance
     174       7031.85    6.5547e-06       2647.57   2.361e-09       0.001      264  LS failed, Hessian reset 
     198       7031.88   7.58463e-07       2822.06   2.658e-10       0.001      334  LS failed, Hessian reset 
     199       7031.88   2.22801e-07       2678.02       0.889       0.889      335   
    Iter      log prob        ||dx||      ||grad||       alpha      alpha0  # evals  Notes 
     227       7031.89    1.9846e-09       2808.29     0.04279      0.5932      374   
Optimization terminated normally: 
  Convergence detected: absolute parameter change was below tolerance
      99       14233.1   7.26514e-08       2478.27      0.9893      0.9893      139   
    Iter      log prob        ||dx||      ||grad||       alpha      alpha0  # evals  Notes 
     104       14233.1   3.57157e-09       2395.69      0.1244      0.1244      145   
Optimization terminated normally: 
  Convergence detected: absolute parameter change was below tolerance
