[I 2020-10-01 03:01:28,543] Trial 192 finished with value: 0.04102074276955297 and parameters: {'changepoint_prior_scale': 0.0014772212447116, 'seasonality_prior_scale': 0.155746928591804, 'holidays_prior_scale': 0.13299402130015478, 'seasonality_mode': 'additive', 'changepoint_range': 0.5371756327131021}. Best is trial 96 with value: 0.038883738900888705.
Initial log joint probability = -28.8311
    Iter      log prob        ||dx||      ||grad||       alpha      alpha0  # evals  Notes 
      99       18912.7   8.87604e-06        4393.4      0.3864      0.3864      120   
    Iter      log prob        ||dx||      ||grad||       alpha      alpha0  # evals  Notes 
     179       18912.9   2.95066e-08       3776.16      0.2371           1      210   
Optimization terminated normally: 
  Convergence detected: relative gradient magnitude is below tolerance
INFO:fbprophet:Making 5 forecasts with cutoffs between 2013-10-07 00:00:00 and 2015-10-18 00:00:00
INFO:fbprophet:Applying in parallel with <concurrent.futures.process.ProcessPoolExecutor object at 0x7fc84dc48590>
Initial log joint probability = -8.95172
    Iter      log prob        ||dx||      ||grad||       alpha      alpha0  # evals  Notes 
Initial log joint probability = -12.7302
    Iter      log prob        ||dx||      ||grad||       alpha      alpha0  # evals  Notes 
Initial log joint probability = -15.1549
    Iter      log prob        ||dx||      ||grad||       alpha      alpha0  # evals  Notes 
Initial log joint probability = -18.717
    Iter      log prob        ||dx||      ||grad||       alpha      alpha0  # evals  Notes 
      64       4679.16   5.16632e-09       4133.11      0.5627      0.5627       84   
Optimization terminated normally: 
  Convergence detected: absolute parameter change was below tolerance
Initial log joint probability = -23.5879
    Iter      log prob        ||dx||      ||grad||       alpha      alpha0  # evals  Notes 
      99       7028.24   4.23877e-07        4120.7      0.3309      0.3309      122   
    Iter      log prob        ||dx||      ||grad||       alpha      alpha0  # evals  Notes 
     143       7028.26   9.28973e-09       3391.83      0.4668      0.4668      178   
Optimization terminated normally: 
  Convergence detected: absolute parameter change was below tolerance
      62       9582.43   3.17588e-07       4184.31   8.333e-11       0.001      122  LS failed, Hessian reset 
      69       9582.43    3.4354e-09       3698.64      0.1158      0.1158      131   
Optimization terminated normally: 
  Convergence detected: absolute parameter change was below tolerance
      37       11811.5   0.000243803       4236.98     6.2e-08       0.001      120  LS failed, Hessian reset 
      93       14232.8   7.26003e-09        3587.7      0.4435      0.4435      119   
Optimization terminated normally: 
  Convergence detected: absolute parameter change was below tolerance
      99         11813   7.35572e-05       4044.25      0.6325      0.6325      196   
    Iter      log prob        ||dx||      ||grad||       alpha      alpha0  # evals  Notes 
     128       11813.1   2.34735e-08        4015.3      0.3795           1      234   
Optimization terminated normally: 
  Convergence detected: relative gradient magnitude is below tolerance
[I 2020-10-01 03:01:45,170] Trial 193 finished with value: 0.040713743027335776 and parameters: {'changepoint_prior_scale': 0.0012327994186415517, 'seasonality_prior_scale': 0.23882477976545588, 'holidays_prior_scale': 0.11113642888081647, 'seasonality_mode': 'additive', 'changepoint_range': 0.5672864621988516}. Best is trial 96 with value: 0.038883738900888705.
Initial log joint probability = -28.8311
    Iter      log prob        ||dx||      ||grad||       alpha      alpha0  # evals  Notes 
      99       18912.9   6.08193e-07       3897.06           1           1      121   
    Iter      log prob        ||dx||      ||grad||       alpha      alpha0  # evals  Notes 
     119       18912.9   1.32752e-08       3787.54      0.3299           1      149   
Optimization terminated normally: 
  Convergence detected: relative gradient magnitude is below tolerance
INFO:fbprophet:Making 5 forecasts with cutoffs between 2013-10-07 00:00:00 and 2015-10-18 00:00:00
INFO:fbprophet:Applying in parallel with <concurrent.futures.process.ProcessPoolExecutor object at 0x7fc88e67f6d0>
Initial log joint probability = -8.95172
    Iter      log prob        ||dx||      ||grad||       alpha      alpha0  # evals  Notes 
Initial log joint probability = -12.7302
    Iter      log prob        ||dx||      ||grad||       alpha      alpha0  # evals  Notes 
Initial log joint probability = -15.1549
    Iter      log prob        ||dx||      ||grad||       alpha      alpha0  # evals  Notes 
Initial log joint probability = -18.717
    Iter      log prob        ||dx||      ||grad||       alpha      alpha0  # evals  Notes 
Initial log joint probability = -23.5879
    Iter      log prob        ||dx||      ||grad||       alpha      alpha0  # evals  Notes 
      67       4679.23   8.03487e-09       3571.06      0.2493      0.2493       97   
Optimization terminated normally: 
  Convergence detected: absolute parameter change was below tolerance
      99       7028.91   6.91088e-08       3597.62      0.2925      0.2925      129   
    Iter      log prob        ||dx||      ||grad||       alpha      alpha0  # evals  Notes 
      54       9582.41   3.17352e-09       3876.15      0.2027      0.2027       84   
Optimization terminated normally: 
  Convergence detected: absolute parameter change was below tolerance
     143       7028.91   4.70428e-09       4008.91      0.4473      0.4473      180   
Optimization terminated normally: 
  Convergence detected: absolute parameter change was below tolerance
      70       11813.2   9.01838e-09       3881.31     0.08215     0.08215      101   
Optimization terminated normally: 
  Convergence detected: absolute parameter change was below tolerance
      99       14232.7   9.40471e-07       4111.41           1           1      127   
    Iter      log prob        ||dx||      ||grad||       alpha      alpha0  # evals  Notes 
     132       14232.8   6.78233e-09       3787.73      0.5387      0.5387      172   
Optimization terminated normally: 
  Convergence detected: absolute parameter change was below tolerance
[I 2020-10-01 03:01:59,967] Trial 194 finished with value: 0.040956448199206526 and parameters: {'changepoint_prior_scale': 0.00128234097973961, 'seasonality_prior_scale': 0.24558378357950392, 'holidays_prior_scale': 0.1189850319590153, 'seasonality_mode': 'additive', 'changepoint_range': 0.5863661760970096}. Best is trial 96 with value: 0.038883738900888705.
Initial log joint probability = -28.8311
    Iter      log prob        ||dx||      ||grad||       alpha      alpha0  # evals  Notes 
      99       18912.9   1.05207e-07       2811.47      0.9166      0.9166      129   
    Iter      log prob        ||dx||      ||grad||       alpha      alpha0  # evals  Notes 
     125       18912.9   2.04595e-08       2518.47       0.193      0.8719      160   
Optimization terminated normally: 
  Convergence detected: relative gradient magnitude is below tolerance
INFO:fbprophet:Making 5 forecasts with cutoffs between 2013-10-07 00:00:00 and 2015-10-18 00:00:00
INFO:fbprophet:Applying in parallel with <concurrent.futures.process.ProcessPoolExecutor object at 0x7fc84dc484d0>
Initial log joint probability = -8.95172
    Iter      log prob        ||dx||      ||grad||       alpha      alpha0  # evals  Notes 
Initial log joint probability = -12.7302
    Iter      log prob        ||dx||      ||grad||       alpha      alpha0  # evals  Notes 
Initial log joint probability = -15.1549
    Iter      log prob        ||dx||      ||grad||       alpha      alpha0  # evals  Notes 
Initial log joint probability = -18.717
    Iter      log prob        ||dx||      ||grad||       alpha      alpha0  # evals  Notes 
Initial log joint probability = -23.5879
    Iter      log prob        ||dx||      ||grad||       alpha      alpha0  # evals  Notes 
      74       4679.15   6.84041e-09       2756.78       0.292       0.292       98   
Optimization terminated normally: 
  Convergence detected: absolute parameter change was below tolerance
      99       7031.14   6.19104e-05       2563.18      0.7119      0.7119      121   
    Iter      log prob        ||dx||      ||grad||       alpha      alpha0  # evals  Notes 
      69       9582.58   2.41393e-07       2914.39   8.736e-11       0.001      129  LS failed, Hessian reset 
      62       11813.1   6.18489e-09       2904.28      0.3421      0.3421       91   
Optimization terminated normally: 
  Convergence detected: absolute parameter change was below tolerance
      81       9582.58   3.65494e-09       2651.37      0.3225      0.3225      146   
Optimization terminated normally: 
  Convergence detected: absolute parameter change was below tolerance
     199       7032.18   2.31233e-08       2595.89      0.3991      0.3991      242   
Optimization terminated normally: 
  Convergence detected: relative gradient magnitude is below tolerance
      99       14232.4   6.87378e-08       2476.09      0.5244      0.5244      126   
    Iter      log prob        ||dx||      ||grad||       alpha      alpha0  # evals  Notes 
     145       14232.4   8.70229e-09       2369.54      0.3809      0.3809      185   
Optimization terminated normally: 
  Convergence detected: absolute parameter change was below tolerance
[I 2020-10-01 03:02:14,963] Trial 195 finished with value: 0.041756983859600735 and parameters: {'changepoint_prior_scale': 0.0017104187158381561, 'seasonality_prior_scale': 0.2926861415393814, 'holidays_prior_scale': 0.10731164446893725, 'seasonality_mode': 'additive', 'changepoint_range': 0.5650597304960815}. Best is trial 96 with value: 0.038883738900888705.
Initial log joint probability = -28.8311
    Iter      log prob        ||dx||      ||grad||       alpha      alpha0  # evals  Notes 
      99       18912.6   0.000127665       4180.05           1           1      126   
    Iter      log prob        ||dx||      ||grad||       alpha      alpha0  # evals  Notes 
     146       18912.7   9.14029e-09       3979.38      0.2985      0.2985      186   
Optimization terminated normally: 
  Convergence detected: absolute parameter change was below tolerance
INFO:fbprophet:Making 5 forecasts with cutoffs between 2013-10-07 00:00:00 and 2015-10-18 00:00:00
INFO:fbprophet:Applying in parallel with <concurrent.futures.process.ProcessPoolExecutor object at 0x7fc88e66c150>
Initial log joint probability = -8.95172
    Iter      log prob        ||dx||      ||grad||       alpha      alpha0  # evals  Notes 
Initial log joint probability = -12.7302
    Iter      log prob        ||dx||      ||grad||       alpha      alpha0  # evals  Notes 
Initial log joint probability = -15.1549
    Iter      log prob        ||dx||      ||grad||       alpha      alpha0  # evals  Notes 
Initial log joint probability = -18.717
    Iter      log prob        ||dx||      ||grad||       alpha      alpha0  # evals  Notes 
      64        4678.9   7.07196e-09       4197.48      0.7723      0.7723       78   
Optimization terminated normally: 
  Convergence detected: absolute parameter change was below tolerance
Initial log joint probability = -23.5879
    Iter      log prob        ||dx||      ||grad||       alpha      alpha0  # evals  Notes 
      60       9582.39   5.19706e-09       4039.46      0.2251      0.2251       83   
Optimization terminated normally: 
  Convergence detected: absolute parameter change was below tolerance
      81       7028.48   1.69494e-05       4390.43   3.587e-09       0.001      146  LS failed, Hessian reset 
      52       11813.1   4.63775e-09       4390.44       0.104       0.104       73   
Optimization terminated normally: 
  Convergence detected: absolute parameter change was below tolerance
      99       7028.53   2.43096e-07       4246.01      0.4028      0.4028      169   
    Iter      log prob        ||dx||      ||grad||       alpha      alpha0  # evals  Notes 
     123       7028.55   4.66288e-07       3983.75   1.073e-10       0.001      235  LS failed, Hessian reset 
     138       7028.55    7.5343e-09       3922.22      0.2942           1      255   
Optimization terminated normally: 
  Convergence detected: absolute parameter change was below tolerance
      99       14232.4   3.00194e-07       4692.79      0.4423      0.4423      129   
    Iter      log prob        ||dx||      ||grad||       alpha      alpha0  # evals  Notes 
     126       14232.5   6.30112e-09       4091.67      0.3114      0.3114      168   
Optimization terminated normally: 
  Convergence detected: absolute parameter change was below tolerance
[I 2020-10-01 03:02:29,715] Trial 196 finished with value: 0.04088774122709266 and parameters: {'changepoint_prior_scale': 0.0011309890680256244, 'seasonality_prior_scale': 0.17602919912386497, 'holidays_prior_scale': 0.06831020556681808, 'seasonality_mode': 'additive', 'changepoint_range': 0.574804504620382}. Best is trial 96 with value: 0.038883738900888705.
Initial log joint probability = -28.8311
    Iter      log prob        ||dx||      ||grad||       alpha      alpha0  # evals  Notes 
      89       18912.9   2.81675e-06       2244.96   1.144e-09       0.001      148  LS failed, Hessian reset 
      99       18912.9   5.32729e-07       1832.36      0.4687       0.705      159   
    Iter      log prob        ||dx||      ||grad||       alpha      alpha0  # evals  Notes 
     117       18912.9   2.62702e-08        2006.4      0.3351      0.8806      180   
Optimization terminated normally: 
  Convergence detected: relative gradient magnitude is below tolerance
INFO:fbprophet:Making 5 forecasts with cutoffs between 2013-10-07 00:00:00 and 2015-10-18 00:00:00
INFO:fbprophet:Applying in parallel with <concurrent.futures.process.ProcessPoolExecutor object at 0x7fc84dc48a50>
Initial log joint probability = -8.95172
    Iter      log prob        ||dx||      ||grad||       alpha      alpha0  # evals  Notes 
Initial log joint probability = -12.7302
    Iter      log prob        ||dx||      ||grad||       alpha      alpha0  # evals  Notes 
Initial log joint probability = -15.1549
    Iter      log prob        ||dx||      ||grad||       alpha      alpha0  # evals  Notes 
Initial log joint probability = -18.717
    Iter      log prob        ||dx||      ||grad||       alpha      alpha0  # evals  Notes 
Initial log joint probability = -23.5879
    Iter      log prob        ||dx||      ||grad||       alpha      alpha0  # evals  Notes 
      50       4678.87   0.000272616       2521.05   1.102e-07       0.001      112  LS failed, Hessian reset 
      89       4679.41   9.79688e-09       2402.35      0.2849           1      161   
Optimization terminated normally: 
  Convergence detected: absolute parameter change was below tolerance
      99       7030.37   1.62857e-07       2452.85      0.3123           1      125   
    Iter      log prob        ||dx||      ||grad||       alpha      alpha0  # evals  Notes 
      56       9582.57   2.75623e-06       2431.76   1.218e-09       0.001      118  LS failed, Hessian reset 
      70       11813.3   1.92115e-08       2490.32           1           1      109   
Optimization terminated normally: 
  Convergence detected: relative gradient magnitude is below tolerance
     199       7031.93   6.91276e-06       2266.28       0.313       0.313      243   
    Iter      log prob        ||dx||      ||grad||       alpha      alpha0  # evals  Notes 
     224       7031.93   4.61196e-09       2468.39      0.2514      0.2514      273   
Optimization terminated normally: 
  Convergence detected: absolute parameter change was below tolerance
      84       9582.58   1.44746e-06       2356.99   5.347e-10       0.001      203  LS failed, Hessian reset 
      99       9582.58   1.17625e-06       2562.39           1           1      223   
    Iter      log prob        ||dx||      ||grad||       alpha      alpha0  # evals  Notes 
     121       9582.59   6.63794e-09       2305.16      0.2582      0.2582      252   
Optimization terminated normally: 
  Convergence detected: absolute parameter change was below tolerance
      96       14233.3   2.48651e-05       2331.08   1.225e-08       0.001      175  LS failed, Hessian reset 
      99       14233.3   2.22266e-05       2508.84           1           1      178   
    Iter      log prob        ||dx||      ||grad||       alpha      alpha0  # evals  Notes 
     190       14233.4   8.95299e-07        2322.7   3.392e-10       0.001      344  LS failed, Hessian reset 
     199       14233.4   8.50408e-08        1539.1           1           1      355   
    Iter      log prob        ||dx||      ||grad||       alpha      alpha0  # evals  Notes 
     205       14233.4   7.80654e-09       2059.28      0.3869      0.3869      364   
Optimization terminated normally: 
  Convergence detected: absolute parameter change was below tolerance
[I 2020-10-01 03:02:44,864] Trial 197 finished with value: 0.04196055077780043 and parameters: {'changepoint_prior_scale': 0.0020167216324452164, 'seasonality_prior_scale': 0.2600801442184413, 'holidays_prior_scale': 0.09423409927033058, 'seasonality_mode': 'additive', 'changepoint_range': 0.5511106257755368}. Best is trial 96 with value: 0.038883738900888705.
Initial log joint probability = -28.8311
    Iter      log prob        ||dx||      ||grad||       alpha      alpha0  # evals  Notes 
      99       18912.9   8.60808e-08       3142.37      0.6869      0.6869      126   
    Iter      log prob        ||dx||      ||grad||       alpha      alpha0  # evals  Notes 
     113       18912.9   7.41009e-09        3448.5      0.3048           1      144   
Optimization terminated normally: 
  Convergence detected: absolute parameter change was below tolerance
INFO:fbprophet:Making 5 forecasts with cutoffs between 2013-10-07 00:00:00 and 2015-10-18 00:00:00
INFO:fbprophet:Applying in parallel with <concurrent.futures.process.ProcessPoolExecutor object at 0x7fc84dbe8b10>
Initial log joint probability = -8.95172
    Iter      log prob        ||dx||      ||grad||       alpha      alpha0  # evals  Notes 
Initial log joint probability = -12.7302
    Iter      log prob        ||dx||      ||grad||       alpha      alpha0  # evals  Notes 
Initial log joint probability = -15.1549
    Iter      log prob        ||dx||      ||grad||       alpha      alpha0  # evals  Notes 
Initial log joint probability = -18.717
    Iter      log prob        ||dx||      ||grad||       alpha      alpha0  # evals  Notes 
Initial log joint probability = -23.5879
    Iter      log prob        ||dx||      ||grad||       alpha      alpha0  # evals  Notes 
      99       4679.24   4.84914e-07       3427.22           1           1      129   
    Iter      log prob        ||dx||      ||grad||       alpha      alpha0  # evals  Notes 
     114       4679.24   5.89099e-09       3409.78      0.2494      0.2494      149   
Optimization terminated normally: 
  Convergence detected: absolute parameter change was below tolerance
      75       7028.95   4.37322e-05       3425.76    1.46e-08       0.001      128  LS failed, Hessian reset 
      60       9582.57   2.18631e-09       3072.14      0.1921      0.1921       90   
Optimization terminated normally: 
  Convergence detected: absolute parameter change was below tolerance
      99        7029.1    2.4223e-06       3307.86      0.3585           1      161   
    Iter      log prob        ||dx||      ||grad||       alpha      alpha0  # evals  Notes 
      77       11813.2   7.68103e-09       3347.04      0.2497      0.2497      113   
Optimization terminated normally: 
  Convergence detected: absolute parameter change was below tolerance
     199       7032.04   1.07289e-05       3050.83      0.2971      0.2971      281   
    Iter      log prob        ||dx||      ||grad||       alpha      alpha0  # evals  Notes 
     235       7032.08   6.20258e-09       3072.74      0.6313      0.6313      325   
Optimization terminated normally: 
  Convergence detected: absolute parameter change was below tolerance
      99       14232.8   1.80815e-07       2996.64       0.412       0.412      130   
    Iter      log prob        ||dx||      ||grad||       alpha      alpha0  # evals  Notes 
     118       14232.8   4.17037e-09       2618.93      0.2111      0.2111      156   
Optimization terminated normally: 
  Convergence detected: absolute parameter change was below tolerance
